img_path,summary,question_resolution,question,answer_resolution,abstractive_answer,extractive_answer,decontextualizated_text_added,decontextualizated_text_removed,abstractive_text_added,abstractive_text_removed,extra_added_text,title,original_answer
mturk_charts/no_data_remaining/multi_col/2186.png,"The January 2014 survey , conducted just after the 2013 holiday gift - giving season , produced evidence that e - book reading devices are spreading through the population . Some 42 % of adults now own tablet computers , up from 34 % in September . And the number of adults who own an e - book reading device like a Kindle or Nook reader jumped from 24 % in September to 32 % after the holidays . Overall , 50 % of Americans now have a dedicated handheld device – either a tablet computer like an iPad , or an e - reader such as a Kindle or Nook – for reading e - content . That figure has grown from 43 % of adults who had either of those devices in September .",same,Describe the main reading devices used by American adults.,answer1,"Some 42 % of adults now own tablet computers . And the number of adults who own an e - book reading device jumped to 32 % . Overall , 50 % of Americans now have a dedicated handheld device – either a tablet computer , or an e - reader .","Some 42 % of adults now own tablet computers . And the number of adults who own an e - book reading device jumped to 32 % . Overall , 50 % of Americans now have a dedicated handheld device – either a tablet computer , or an e - reader .",,like Kindle Nook after holidays like iPad such as Kindle Nook for content,,, ,Half of American adults now own either a tablet or an e-reader % of American adults ages 18+ who own each device,"Some 42 % of adults now own tablet computers And the number of adults who own an e - book reading device like a Kindle or Nook reader jumped to 32 % after the holidays . Overall , 50 % of Americans now have a dedicated handheld device – either a tablet computer like an iPad , or an e - reader such as a Kindle or Nook – for reading e - content ."
mturk_charts/no_data_remaining/multi_col/2185.png,"The proportion of Americans who read e - books is growing , but few have completely replaced print books for electronic versions . The percentage of adults who read an e - book in the past year has risen to 28 % , up from 23 % at the end of 2012 . At the same time , about seven in ten Americans reported reading a book in print , up four percentage points after a slight dip in 2012 , and 14 % of adults listened to an audiobook . Overall , 76 % of adults read a book in some format over the previous 12 months . The typical American adult read or listened to 5 books in the past year , and the average for all adults was 12 books.1 Neither the mean nor median number of books read has changed significantly over the past few years .",same,Describe the reading habits of the public in relation to the type of book used.,same,"The percentage of adults who read an e - book in the past year has risen to 28 % . At the same time , about seven in ten Americans reported reading a book in print . Overall , 76 % of adults read a book in some format over the previous 12 months .","The percentage of adults who read an e - book in the past year has risen to 28 % . At the same time , about seven in ten Americans reported reading a book in print . Overall , 76 % of adults read a book in some format over the previous 12 months .",Overall 76 some format over previous 12 months,up from 23 at end 2012 up four points after slight dip 2012 and 14 listened audiobook,,, ,"Most adults read a book in the past year; print remains most popular, but e-reading is on the rise Among American adults 18 and older, the % who read at least one book (in total, in print, or as an e. book) in the past year Total (any format) Read print book Read an e-book","The percentage of adults who read an e - book in the past year has risen to 28 % , up from 23 % at the end of 2012 . At the same time , about seven in ten Americans reported reading a book in print , up four percentage points after a slight dip in 2012 , and 14 % of adults listened to an audiobook ."
mturk_charts/no_data_remaining/multi_col/2184.png,"Barack Obama ’s job approval rating has shown little change from last month . In the current survey , 49 % disapprove of how he is handling his job and 43 % approve . Obama ’s ratings had steadily declined from May to November of last year , before he regained some ground in December .",same,What is the public's opinion about Obama?,same,49 % disapprove of how he is handling his job and 43 % approve .,49 % disapprove of how he is handling his job and 43 % approve .,,"In the current survey ,",,, ,Obama Job Rating Mostly Steady handling Approve or disapprove president? of the way Barack Obama is handling his disapprove job as president?,"In the current survey , 49 % disapprove of how he is handling his job and 43 % approve ."
mturk_charts/no_data_remaining/multi_col/2183.png,"Today , 40 % approve of the government ’s collection of telephone and internet data as part of anti - terrorism efforts , while 53 % disapprove . In July , more Americans approved ( 50 % ) than disapproved ( 44 % ) of the program .",same,What does the public think about data collection as a form of anti-terrorism?,same,"Today , 40 % approve of the government ’s collection of telephone and internet data as part of anti - terrorism efforts , while 53 % disapprove .","Today , 40 % approve of the government ’s collection of telephone and internet data as part of anti - terrorism efforts , while 53 % disapprove .",,,,, ,More Disapprove of NSA Surveillance Program The government's collection of telephone and internet data as part,"Today , 40 % approve of the government ’s collection of telephone and internet data as part of anti - terrorism efforts , while 53 % disapprove ."
mturk_charts/no_data_remaining/multi_col/2181.png,"Young adults are significantly more supportive than their elders of Edward Snowden and his leaks of classified details of the National Security Agency ’s telephone and internet surveillance programs , a new Pew Research Center / USA TODAY survey finds . 57 % of 18- to 29 - year olds said the leaks have served rather than harmed the public interest — almost exact mirrors of the 65 - and - over age group . These youngest adults were the only age group without majority support for prosecuting Snowden — they split 42%-42 % on whether the former NSA contractor should be tried . ( Snowden was charged in June 2013 with three criminal counts related to the leaks , though he ’s apparently not yet been formally indicted . )",same,Describe what young adults think about Edward Snowden.,answer1,57 % of 18- to 29 - year olds said the leaks have served rather than harmed the public interest . These youngest adults were the only age group without majority support for prosecuting Snowden — they split 42%-42 % on whether the former NSA contractor should be tried .,57 % of 18- to 29 - year olds said the leaks have served rather than harmed the public interest . These youngest adults were the only age group without majority support for prosecuting Snowden — they split 42%-42 % on whether the former NSA contractor should be tried .,,almost exact mirrors 65 and over,,, ,"Hero, Criminal or Both? Snowden's leak of classified information about programs 57% 35 Should gov't pursue a criminal case",57 % of 18- to 29 - year olds said the leaks have served rather than harmed the public interest — almost exact mirrors of the 65 - and - over age group . These youngest adults were the only age group without majority support for prosecuting Snowden — they split 42%-42 % on whether the former NSA contractor should be tried .
mturk_charts/no_data_remaining/multi_col/2180.png,"There is a broad consensus that the government should do “ a lot ” or “ some ” to reduce poverty – 82 % of Americans express this view , with 53 % saying the government should to a lot in this area . Most also believe the government should be addressing the gap between the rich and everyone else , but there is substantially less agreement in this area . While 69 % say the government should do something , fewer than half ( 43 % ) say it should be doing a lot and roughly a quarter ( 26 % ) say the government should take some action . Majorities of Americans believe the government can do at least something to reduce poverty and the gap between the rich and everyone else . But fewer believe the government can do a lot to lessen poverty ( 40 % ) than say it should take a lot of action to achieve this goal ( 53 % ) .",same,What are the opinions about the government's ability to reduce poverty?,same,Majorities of Americans believe the government can do at least something to reduce poverty and the gap between the rich and everyone else .,Majorities of Americans believe the government can do at least something to reduce poverty and the gap between the rich and everyone else .,,"There is a broad consensus that should “ a lot ” or “ some ” – 82 % express this view , with 53 % saying should a lot in this area Most also should be addressing , but there is substantially less agreement in this area While 69 % say should , fewer than half ( 43 % ) say it should be doing a lot roughly a quarter ( 26 % ) say should take some action But fewer a lot lessen ( 40 % ) than say it should take a lot action achieve this goal ( 53 % )",,, ,How Much Should the Government Do to Reduce Poverty and Inequality? How Much Can It Do? To reduce the gap between the,"There is a broad consensus that the government should do “ a lot ” or “ some ” to reduce poverty – 82 % of Americans express this view , with 53 % saying the government should to a lot in this area . Most also believe the government should be addressing the gap between the rich and everyone else , but there is substantially less agreement in this area . While 69 % say the government should do something , fewer than half ( 43 % ) say it should be doing a lot and roughly a quarter ( 26 % ) say the government should take some action . Majorities of Americans believe the government can do at least something to reduce poverty and the gap between the rich and everyone else . But fewer believe the government can do a lot to lessen poverty ( 40 % ) than say it should take a lot of action to achieve this goal ( 53 % ) ."
mturk_charts/no_data_remaining/multi_col/2179.png,"Yet amidst these skeptical views , most Americans continue to believe that opportunity exists for those who make the effort . Six - in - ten ( 60 % ) say most people who want to get ahead can make it if they are willing to work hard . Some 38 % take the more pessimistic view that hard work and determination are no guarantee of success for most people . While opinions about the nexus between success and hard work have changed little since 2011 , a decade ago just 28 % were of the view that hard work and determination were no guarantee of success .",same,What is the public view about the relation between hard work and success?,answer1,Six - in - ten ( 60 % ) say most people who want to get ahead can make it if they are willing to work hard . Some 38 % take the more pessimistic view that hard work and determination are no guarantee of success for most people .,Six - in - ten ( 60 % ) say most people who want to get ahead can make it if they are willing to work hard . Some 38 % take the more pessimistic view that hard work and determination are no guarantee of success for most people .,,,,, ,Does Hard Work Lead to Success? Most people who want willing to get work ahead can make it if they're willing to work hard,Six - in - ten ( 60 % ) say most people who want to get ahead can make it if they are willing to work hard . Some 38 % take the more pessimistic view that hard work and determination are no guarantee of success for most people
mturk_charts/no_data_remaining/multi_col/2178.png,"The U.S. general public is also supportive of allowing unauthorized immigrants to remain in the country legally . A Pew Research Center / USA TODAY survey from last June found that 71 % of U.S. adults said there should be a way for undocumented immigrants to stay in the country legally , if they meet certain requirements ( a different survey question than that asked of Hispanics and Asian Americans ) . Support for legalization crosses party lines — majorities of Democrats ( 80 % ) and Republicans ( 61 % ) said they support this measure . The same survey found that most Americans believe legalization should be tied to improved border security — fully 77 % said this . But the public was divided when it came to the timing of this link . Some 43 % of U.S. adults said legalization should occur only after the effective control of U.S. borders is achieved , but half ( 49 % ) said unauthorized immigrants should be allowed to apply for legal status while border improvements are being made .",same,How supportive are Americans for the legalization of undocumented immigrants?,answer1,"The U.S. general public is supportive of allowing unauthorized immigrants to remain in the country legally . 71 % of U.S. adults said there should be a way for undocumented immigrants to stay in the country legally , if they meet certain requirements .","The U.S. general public is supportive of allowing unauthorized immigrants to remain in the country legally . 71 % of U.S. adults said there should be a way for undocumented immigrants to stay in the country legally , if they meet certain requirements .",,also A Pew Research Center / USA TODAY survey from last June found that ( different survey question than that asked Hispanics and Asian Americans ) Support legalization crosses party lines — majorities Democrats ( 80 ) and Republicans ( 61 ) support this measure same survey found that most Americans believe legalization tied improved border security — fully 77 this But was divided when it came timing this link Some 43 legalization occur only after effective control borders achieved but half ( 49 ) allowed apply legal status while border improvements are being made,,, ,"Among U.S. Adults, Most Support Legali lization, Increased Border Security Undocumented requirements immigrants currently in the U.S. who meet certain requirements should Legislation allowing undocumented immigrants to","The U.S. general public is also supportive of allowing unauthorized immigrants to remain in the country legally . A Pew Research Center / USA TODAY survey from last June found that 71 % of U.S. adults said there should be a way for undocumented immigrants to stay in the country legally , if they meet certain requirements ( a different survey question than that asked of Hispanics and Asian Americans ) . Support for legalization crosses party lines — majorities of Democrats ( 80 % ) and Republicans ( 61 % ) said they support this measure . The same survey found that most Americans believe legalization should be tied to improved border security — fully 77 % said this . But the public was divided when it came to the timing of this link . Some 43 % of U.S. adults said legalization should occur only after the effective control of U.S. borders is achieved , but half ( 49 % ) said unauthorized immigrants should be allowed to apply for legal status while border improvements are being made ."
mturk_charts/no_data_remaining/multi_col/2177.png,The rise of e - book reading is tied to the steady increase in ownership of tablet computers and e - readers . 50 % of adults now own either a tablet computer or an e- reader .,same,Describe the share of adults that own reading devices.,answer1,50 % of adults now own either a tablet computer or an e- reader .,50 % of adults now own either a tablet computer or an e- reader .,,The rise e - book reading is tied to the steady increase in ownership computers and e - readers,,, ,Half of American adults now own either a tablet or an e-reader % of American adults ages 18+ who own each device,The rise of e - book reading is tied to the steady increase in ownership of tablet computers and e - readers . 50 % of adults now own either a tablet computer or an e- reader .
mturk_charts/no_data_remaining/multi_col/2176.png,"E - book reading is growing , but printed books still dominate the reading world . 28 % of American adults ages 18 and older read an e - book in the past year , up from 17 % in 2011 . Still , 69 % read a printed book , about the same as last year . Only 4 % of readers are “ e - book only ” readers . The vast majority of e - book readers also read a printed book .",same,What are adults' reading preferences when it comes to print and e-reading options?,answer1,"E - book reading is growing , but printed books still dominate the reading world . 28 % of American adults ages 18 and older read an e - book in the past year . Still , 69 % read a printed book , about the same as last year .","E - book reading is growing , but printed books still dominate the reading world . 28 % of American adults ages 18 and older read an e - book in the past year . Still , 69 % read a printed book , about the same as last year .",,up from 17 2011 Only 4 readers are “ only ” readers The vast majority readers also,,, ,"Most adults read a book in the past year; print remains most popular, but e-reading is on the rise Among American adults 18 and older, the % who read at least one book (in total, in print, or as an e. book) in the past year Total (any format) Read print book Read an e-book","E - book reading is growing , but printed books still dominate the reading world . 28 % of American adults ages 18 and older read an e - book in the past year , up from 17 % in 2011 . Still , 69 % read a printed book , about the same as last year . Only 4 % of readers are “ e - book only ” readers . The vast majority of e - book readers also read a printed book"
mturk_charts/no_data_remaining/multi_col/2174.png,"Despite a slowly recovering economy , the proportion of Americans who identify themselves as middle class has dropped sharply in recent years . Today , about as many Americans identify themselves as lower or lower - middle class ( 40 % ) as say they are in the middle class ( 44 % ) , according to a recent Pew Research Center / USA TODAY survey . The nationally representative survey of 1,504 adults conducted Jan. 15 - 19 found that the share of Americans who identify with the middle class has never been lower , dropping to 44 % in the latest survey from 53 % in 2008 during the first months of the Great Recession . At the same time , the share of the public who says they are in the lower or lower - middle classes rose by 15 percentage points , from 25 % in 2008 to 40 % today . As a consequence of these shifts , the difference in the proportion of Americans who say they are middle class and those who say they are in the lower classes has fallen from 28 percentage points in 2008 ( 53 % vs. 25 % ) to a statistically insignificant 4 points today ( 44 % vs. 40 % ) .",same,Describe the distribution of American economic classes today compared to 2008.,answer1,"The proportion of Americans who identify themselves as middle class has dropped sharply in recent years . Today , about as many Americans identify themselves as lower or lower - middle class ( 40 % ) as say they are in the middle class ( 44 % ) . The share of Americans who identify with the middle class has never been lower , dropping to 44 % in the latest survey from 53 % in 2008 . At the same time , the share of the public who says they are in the lower or lower - middle classes rose by 15 percentage points , from 25 % in 2008 to 40 % today . As a consequence of these shifts , the difference in the proportion of Americans who say they are middle class and those who say they are in the lower classes has fallen from 28 percentage points in 2008 ( 53 % vs. 25 % ) to a statistically insignificant 4 points today ( 44 % vs. 40 % ) .","the proportion of Americans who identify themselves as middle class has dropped sharply in recent years . Today , about as many Americans identify themselves as lower or lower - middle class ( 40 % ) as say they are in the middle class ( 44 % ) . the share of Americans who identify with the middle class has never been lower , dropping to 44 % in the latest survey from 53 % in 2008 . At the same time , the share of the public who says they are in the lower or lower - middle classes rose by 15 percentage points , from 25 % in 2008 to 40 % today . As a consequence of these shifts , the difference in the proportion of Americans who say they are middle class and those who say they are in the lower classes has fallen from 28 percentage points in 2008 ( 53 % vs. 25 % ) to a statistically insignificant 4 points today ( 44 % vs. 40 % ) .",dropped sharply years,"according Pew Research Center / USA TODAY The nationally representative 1,504 adults conducted Jan. 19 found that during first months Great Recession",The The,, ,America's Shrinking Middle Class Percent of adults selfidentifing as each social class,"Today , about as many Americans identify themselves as lower or lower - middle class ( 40 % ) as say they are in the middle class ( 44 % ) , according to a recent Pew Research Center / USA TODAY survey . The nationally representative survey of 1,504 adults conducted Jan. 15 - 19 found that the share of Americans who identify with the middle class has never been lower , dropping to 44 % in the latest survey from 53 % in 2008 during the first months of the Great Recession . At the same time , the share of the public who says they are in the lower or lower - middle classes rose by 15 percentage points , from 25 % in 2008 to 40 % today . As a consequence of these shifts , the difference in the proportion of Americans who say they are middle class and those who say they are in the lower classes has fallen from 28 percentage points in 2008 ( 53 % vs. 25 % ) to a statistically insignificant 4 points today ( 44 % vs. 40 % ) ."
mturk_charts/no_data_remaining/multi_col/2172.png,"When Obama takes the rostrum Tuesday night for his fifth State of the Union , he will be speaking at a time when his current approval rating stands at 43 % . Last year was the only time just before a State of the Union that more than half the public gave Obama positive marks for the job he was doing , when 52 % approved . Obama was riding the wave of his successful re - election campaign , which put him in a stronger position with the public than he was during much of his first term . He was also helped by the relative poor standing of the Republicans , whose favorable ratings had dropped significantly over the previous months .",same,Compare the approval ratings of Obama's State of the Union job for the current year and last year?,answer1,"his current approval rating stands at 43 % . Last year was the only time just before a State of the Union that more than half the public gave Obama positive marks for the job he was doing , when 52 % approved .","his current approval rating stands at 43 % . Last year was the only time just before a State of the Union that more than half the public gave Obama positive marks for the job he was doing , when 52 % approved .",,When takes rostrum Tuesday night fifth will be speaking,,, ,Obama 's Approval Rating at State of the Union job Percent Obama saying doing they approve or ofeach disapprove ofthe job Obama is doing in January ofeach year,"When Obama takes the rostrum Tuesday night for his fifth State of the Union , he will be speaking at a time when his current approval rating stands at 43 % . Last year was the only time just before a State of the Union that more than half the public gave Obama positive marks for the job he was doing , when 52 % approved ."
