img_path,summary,question_resolution,question,answer_resolution,abstractive_answer,extractive_answer,decontextualizated_text_added,decontextualizated_text_removed,abstractive_text_added,abstractive_text_removed,extra_added_text,title,original_answer
mturk_charts/no_data_remaining/multi_col/2414.png,"Only about a quarter of Americans ( 23 % ) rate current economic conditions as excellent or good , while 76 % say they are only fair or poor . Yet this is the most positive assessment of the nation ’s economy since January 2008 .",same,What are Americans' views about the economy?,answer1,"Only about a quarter of Americans ( 23 % ) rate current economic conditions as excellent or good , while 76 % say they are only fair or poor .","Only about a quarter of Americans ( 23 % ) rate current economic conditions as excellent or good , while 76 % say they are only fair or poor .",,,,, ,Views of the National Economy Excellent/Good Only fair,"Only about a quarter of Americans ( 23 % ) rate current economic conditions as excellent or good , while 76 % say they are only fair or poor ."
mturk_charts/no_data_remaining/multi_col/2413.png,"Obama ’s current job rating of 49 % is higher than George W. Bush ’s rating in June 2005 ( 42 % ) , but lower than Bill Clinton ’s job measure in June 1997 ( 54 % ) .",same,"Compare Obama's, Bush's and Clinton's job ratings.",same,"Obama ’s current job rating of 49 % is higher than George W. Bush ’s rating ( 42 % ) , but lower than Bill Clinton ’s job measure ( 54 % ) .","Obama ’s current job rating of 49 % is higher than George W. Bush ’s rating ( 42 % ) , but lower than Bill Clinton ’s job measure ( 54 % ) .",,in June 2005 in June 1997,,, ,"Obama's with Bush's, Job Clinton Rating Compared with Bush's, Clinton Rating Compared s","Obama ’s current job rating of 49 % is higher than George W. Bush ’s rating in June 2005 ( 42 % ) , but lower than Bill Clinton ’s job measure in June 1997 ( 54 % ) ."
mturk_charts/no_data_remaining/multi_col/2412.png,"The latest national survey by the Pew Research Center , conducted June 12 - 16 among 1,512 adults , finds that Obama is likely benefitting from more positive perceptions of the national economy . Yet the public ’s economic views look good only when compared with the dismal attitudes of the past five years . Take evaluations of local job availability : 29 % now say that there are plenty of jobs available in their community , the most positive measure since July 2008 . Roughly twice as many ( 64 % ) say that jobs are difficult to find .",same,How does the public perceive local job availability?,answer1,29 % now say that there are plenty of jobs available in their community . Roughly twice as many ( 64 % ) say that jobs are difficult to find .,29 % now say that there are plenty of jobs available in their community . Roughly twice as many ( 64 % ) say that jobs are difficult to find .,,"Take evaluations local job availability : , the most positive measure since July 2008",,, ,"Public's Better, View of Job Situation: Public's Better, Still View Not of Good Job Situation: Availability ofjobs in your community","Take evaluations of local job availability : 29 % now say that there are plenty of jobs available in their community , the most positive measure since July 2008 . Roughly twice as many ( 64 % ) say that jobs are difficult to find ."
mturk_charts/no_data_remaining/multi_col/2411.png,"In a second term marked by a series of controversies and little legislative success , President Obama ’s job approval rating has nonetheless remained fairly steady . Currently , 49 % approve of the way Obama is handling his job as president while 43 % disapprove .",same,Describe the approval rate of President Obama's job.,answer1,"Currently , 49 % approve of the way Obama is handling his job as president while 43 % disapprove .","Currently , 49 % approve of the way Obama is handling his job as president while 43 % disapprove .",,In a second term marked by a series controversies and little legislative success President ’s approval rating has nonetheless remained fairly steady,,, ,"Through Job Rating Eventful Little Year, Changed Obama Through Job Rating Is Little Year, Changed Obama","In a second term marked by a series of controversies and little legislative success , President Obama ’s job approval rating has nonetheless remained fairly steady . Currently , 49 % approve of the way Obama is handling his job as president while 43 % disapprove ."
mturk_charts/no_data_remaining/multi_col/2410.png,"According to Pew Research Center ’s most recent estimate based on the 2011 American Community Survey , there were 1.89 million Cubans and 1.95 million Salvadorans living in the U.S. Statistically speaking , those two estimates are indistinguishable from each other , and it ’s been that way since 2008 .",same,Compare the number of Cubans and Salvadorans living in the U.S.,answer1,There were 1.89 million Cubans and 1.95 million Salvadorans living in the U.S. Statistically speaking .,there were 1.89 million Cubans and 1.95 million Salvadorans living in the U.S. Statistically speaking .,,"According to Pew Research Center ’s most recent estimate based on 2011 American Community Survey , , those two estimates are indistinguishable from each other , it ’s been that way since 2008",There,there, ,"Cuban-Origin Population Trends, and Salvadoran-Origin Population Trends, 2006-2011 Number ofCubans and Salvadorans the in the U.S.","According to Pew Research Center ’s most recent estimate based on the 2011 American Community Survey , there were 1.89 million Cubans and 1.95 million Salvadorans living in the U.S. Statistically speaking , those two estimates are indistinguishable from each other , and it ’s been that way since 2008 ."
mturk_charts/no_data_remaining/multi_col/2408.png,"In 2011 , nearly two - thirds ( 64.6 % ) of U.S. Hispanics , or 33.5 million , traced their family origins to Mexico , according to Pew Research Center tabulations of the 2011 American Community Survey ( ACS ) . By comparison , Puerto Ricans , the nation ’s second largest Hispanic - origin group , number about 5 million and make up 9.5 % of the total Hispanic population in the 50 states and the District of Columbia . Mexican - origin Hispanics have always been the largest Hispanic - origin group in the U.S. In 1860 , for example , among the 155,000 Hispanics living in the U.S. , 81 % were of Mexican origin — a historic high . Since then the origins of the nation ’s Hispanic population have diversified as growing numbers of immigrants from other Latin American nations and Puerto Rico settled in the U.S. For example , between 1930 and 1980 , Hispanics from places other than Mexico nearly doubled their representation among U.S. Hispanics , from 22 % to 41 % . But with the arrival of large numbers of Mexican immigrants in the 1980s and 1990s , the Mexican share among Hispanics grew , rising to a recent peak of 66 % in 2008 . Since then it has declined slightly — to 65%—as Mexican migration to the U.S. has slowed ( Passel , Cohn and Gonzalez - Barrera , 2012 ) .",same,Describe the trend in the proportion of Mexican Hispanics in the U.S.,answer1,"In 2011 , nearly two - thirds of U.S. Hispanics traced their family origins to Mexico . Mexican - origin Hispanics have always been the largest Hispanic - origin group in the U.S. In 1860 , 81 % were of Mexican origin — a historic high . In the 1980s and 1990s , the Mexican share among Hispanics grew , rising to a recent peak of 66 % in 2008 . Since then it has declined slightly — to 65%—as Mexican migration to the U.S. has slowed .","In 2011 , nearly two - thirds of U.S. Hispanics traced their family origins to Mexico . Mexican - origin Hispanics have always been the largest Hispanic - origin group in the U.S. In 1860 , 81 % were of Mexican origin — a historic high . in the 1980s and 1990s , the Mexican share among Hispanics grew , rising to a recent peak of 66 % in 2008 . Since then it has declined slightly — to 65%—as Mexican migration to the U.S. has slowed .",Mexican have always been 1860 81 were Mexican — a historic high 1980s 1990s Mexican share among grew rising a recent peak 66 2008 Since then it has declined slightly — 65%—as Mexican migration has slowed,( 64.6 ) or 33.5 million according Pew Research Center tabulations American Community Survey ( ACS ) By comparison Puerto Ricans nation ’s second number about 5 million make up 9.5 total population 50 states District Columbia,,, ,"Figure 2 Share Mexican- Origin among the U.S. Hispanic Population, 1850-2011 90","In 2011 , nearly two - thirds ( 64.6 % ) of U.S. Hispanics , or 33.5 million , traced their family origins to Mexico , according to Pew Research Center tabulations of the 2011 American Community Survey ( ACS ) . By comparison , Puerto Ricans , the nation ’s second largest Hispanic - origin group , number about 5 million and make up 9.5 % of the total Hispanic population in the 50 states and the District of Columbia"
mturk_charts/no_data_remaining/multi_col/2407.png,"Though ratings have improved in recent months , CNN ’s morning programming ranked third in viewership in 2012 , averaging just 239,000 viewers per day , compared with 452,000 for MSNBC ’s Morning Joe and 1.13 million for Fox ’s Fox and Friends , according to Nielsen Media Research . Other parts of the day look no better . Continued declines in prime - time viewership , considered the most critical time for cable news , placed the channel third behind Fox and MSNBC for three years straight . In 2012 , it fell to third place in daytime viewership for the first time . There ’s more to the story , of course . CNN remains a highly profitable organization , with a wide digital reach and a sizable international presence ; it operates more bureaus around the world than Fox and MSNBC combined . And in May , the channel ’s previous morning show , Starting Point , averaged 380,000 viewers , according to Nielsen — not enough to come close to Fox and Friends ’ 1.26 million , but enough to approach MSNBC ’s Morning Joe , which drew an average of 387,000 .",same,Describe the drop in the viewership of CNN.,answer1,"In 2012 , it fell to third place in daytime viewership for the first time .","In 2012 , it fell to third place in daytime viewership for the first time .",In it fell place daytime first,"Though ratings have improved recent months CNN ’s morning programming ranked averaging just 239,000 viewers per day compared with 452,000 MSNBC ’s Morning Joe and 1.13 million Fox ’s Fox and Friends according Nielsen Media Research Other parts of day look no better Continued declines prime - considered most critical cable news placed channel behind Fox and MSNBC three years straight",,, ,"New Morning Show Could be Critical for CNN Cable News Median Daytime Viewership 6am- 6pm, in Thousands","Though ratings have improved in recent months , CNN ’s morning programming ranked third in viewership in 2012 , averaging just 239,000 viewers per day , compared with 452,000 for MSNBC ’s Morning Joe and 1.13 million for Fox ’s Fox and Friends , according to Nielsen Media Research . Other parts of the day look no better . Continued declines in prime - time viewership , considered the most critical time for cable news , placed the channel third behind Fox and MSNBC for three years straight"
mturk_charts/no_data_remaining/multi_col/2404.png,56 % — Percentage of unmarried gay men in America who say they ’d like to get married someday . 58 % — Percentage of unmarried U.S. lesbians who say they would . 45 % — Percentage of unmarried bisexuals who say they would .,same,"Describe the proportions of gay, lesbian and bisexual Americans that would like to marry.",same,56 % — Percentage of unmarried gay men in America who say they ’d like to get married someday . 58 % — Percentage of unmarried U.S. lesbians who say they would . 45 % — Percentage of unmarried bisexuals who say they would .,56 % — Percentage of unmarried gay men in America who say they ’d like to get married someday . 58 % — Percentage of unmarried U.S. lesbians who say they would . 45 % — Percentage of unmarried bisexuals who say they would .,,,,, ,"If Someday? You Could, Would You Like to Get Married Someday? Could, %of funmarried saying",56 % — Percentage of unmarried gay men in America who say they ’d like to get married someday . 58 % — Percentage of unmarried U.S. lesbians who say they would . 45 % — Percentage of unmarried bisexuals who say they would .
mturk_charts/no_data_remaining/multi_col/2403.png,10 — Median age at which gay men in America said they first thought they might be gay . 15 — Median age at which they knew for sure . 13 — Median age at which American lesbians said they first thought they might be lesbian .,same,Explain at what ages gay men first thought and told someone they were gay.,same,10 — Median age at which gay men in America said they first thought they might be gay . 15 — Median age at which they knew for sure .,10 — Median age at which gay men in America said they first thought they might be gay . 15 — Median age at which they knew for sure .,,13 American lesbians lesbian,,, ,"The Coming Out Experience: When You Thought, Knew, Told Median age atwhich gay mightbe men, /lesbians bisexuals say they they were or mightbe LGB First thought Knew for sure milow someone",10 — Median age at which gay men in America said they first thought they might be gay . 15 — Median age at which they knew for sure . 13 — Median age at which American lesbians said they first thought they might be lesbian .
mturk_charts/no_data_remaining/multi_col/2402.png,"Most Americans believe undocumented immigrants should meet certain requirements before they are allowed to stay in the U.S. legally : 56 % say undocumented immigrants should have to pay fines before gaining legal status . A similar percentage ( 55 % ) backs a 10 - year waiting period for most immigrants before permanent residency . There is much broader support for another requirement – fully 76 % of the public , including majorities of nearly every demographic group , say that undocumented immigrants should have to show they can speak and understand English before being allowed to stay in the U.S. legally .",same,Describe Americans' views on the possible requirements for allowing undocumented immigrants to stay legally in the U.S.,answer1,56 % say undocumented immigrants should have to pay fines before gaining legal status . A similar percentage ( 55 % ) backs a 10 - year waiting period for most immigrants before permanent residency . There is much broader support for another requirement – fully 76 % of the public say that undocumented immigrants should have to show they can speak and understand English before being allowed to stay in the U.S. legally .,56 % say undocumented immigrants should have to pay fines before gaining legal status . A similar percentage ( 55 % ) backs a 10 - year waiting period for most immigrants before permanent residency . There is much broader support for another requirement – fully 76 % of the public say that undocumented immigrants should have to show they can speak and understand English before being allowed to stay in the U.S. legally .,,", including majorities nearly every demographic group ,",,, ,6-21-2013. 4,"56 % say undocumented immigrants should have to pay fines before gaining legal status . A similar percentage ( 55 % ) backs a 10 - year waiting period for most immigrants before permanent residency . There is much broader support for another requirement – fully 76 % of the public , including majorities of nearly every demographic group , say that undocumented immigrants should have to show they can speak and understand English before being allowed to stay in the U.S. legally ."
mturk_charts/no_data_remaining/multi_col/2401.png,"In many cases , the political divides over these issues are wider than the racial or ethnic differences . And as with many other issues , the debate over affirmative action is becoming more polarized along partisan lines , largely due to increased support for such programs by Democrats . When Pew Research first began asking the”preferential treatment ” question back in 1987 , only 33 % of Democrats supported the principle ; by 2012 that figure had risen to 52 % . Meanwhile , Republicans have remained solid in their disapproval : Just 12 % agree that we should make every possible effort , including preferential treatment , to improve the position of blacks and other minorities – virtually unchanged from 15 % a quarter - century ago .",same,"Describe the change in the position of Democrats on efforts to improve the position of minorities, even if it means preferential treatment.",answer1,"In 1987 , only 33 % of Democrats supported the principle ; by 2012 that figure had risen to 52 % .","in 1987 , only 33 % of Democrats supported the principle ; by 2012 that figure had risen to 52 % .",,When asking the”preferential treatment ” question back Meanwhile Republicans have remained solid their disapproval : Just 12 agree we should make every possible effort including preferential treatment improve position blacks and other minorities,In,in, ,"More Democrats Minorities Favor Preferences to More Improve Democrats Minorities Favor Position Preferences We of minorities, should make even every if means effort to preferentia improve the trea position tment Republican Democrat","When asking the”preferential treatment ” question back in 1987 , only 33 % of Democrats supported the principle ; by 2012 that figure had risen to 52 % . Meanwhile , Republicans have remained solid in their disapproval : Just 12 % agree that we should make every possible effort , including preferential treatment , to improve the position of blacks and other minorities"
mturk_charts/no_data_remaining/multi_col/2400.png,"Pew Research surveys going back to 1987 show only a quarter to a third of Americans agreeing with the statement that “ We should make every possible effort to improve the position of blacks and other minorities , even if it means giving them preferential treatment . ” But support is sharply split by race : When we asked the question last year , 62 % of blacks and 59 % of Hispanics agreed with the statement but only 22 % of whites did . And while 44 % of 18- to 29 - year - olds agreed , about a third of all other age groups did .",same,Discuss what Americans think about improving the position of blacks and other minorities in 1987.,answer1,"Only a quarter to a third of Americans agreeing with the statement that “ We should make every possible effort to improve the position of blacks and other minorities , even if it means giving them preferential treatment . ”","only a quarter to a third of Americans agreeing with the statement that “ We should make every possible effort to improve the position of blacks and other minorities , even if it means giving them preferential treatment . ”",,,Only,only, ,Most Improve Oppose Position Use of Preferences of Minorities to Improve Oppose Position Preferences of Minorities We position should giving of make blacks them every preferential other possible minorities effort to e ven improve ifit the means giving them every preferential treatment,"only a quarter to a third of Americans agreeing with the statement that “ We should make every possible effort to improve the position of blacks and other minorities , even if it means giving them preferential treatment . ”"
mturk_charts/no_data_remaining/multi_col/2399.png,"A new poll finds that the public is as interested in the Supreme Court ’s upcoming ruling on the Voting Rights Act as in its long - awaited decisions on same - sex marriage . Roughly a third of Americans ( 35 % each ) say they are very interested in both how the court will rule on whether parts of the Voting Rights Act are still necessary and on federal and state laws on gay marriage . A third ( 33 % ) express little or no interest in how the court rules on the Voting Rights Act , while 40 % say they are not too or not at all interested in the court ’s rulings on gay marriage . The Pew Research Center survey was conducted June 20 - 23 among 1,005 adults , before the Supreme Court ’s ruling Monday on affirmative action in college admissions . About three - in - ten ( 31 % ) had said they were very interested in that decision .",same,How interested is the public in the results of the Voting Rights Act?,answer1,Roughly a third of Americans ( 35 % each ) say they are very interested in both how the court will rule on whether parts of the Voting Rights Act are still necessary . A third ( 33 % ) express little or no interest in how the court rules on the Voting Rights Act .,Roughly a third of Americans ( 35 % each ) say they are very interested in both how the court will rule on whether parts of the Voting Rights Act are still necessary . A third ( 33 % ) express little or no interest in how the court rules on the Voting Rights Act .,,"and federal and state laws gay marriage , while 40 not too not at all ’s rulings gay marriage About three - - ten 31 had said were that decision",,, ,Public Interest in Rulings End -of-Term Supreme Interest Court Rulings Whether parts of Voting Rights Act are still necessary Federal and state flaws about gay marriage,"Roughly a third of Americans ( 35 % each ) say they are very interested in both how the court will rule on whether parts of the Voting Rights Act are still necessary and on federal and state laws on gay marriage . A third ( 33 % ) express little or no interest in how the court rules on the Voting Rights Act , while 40 % say they are not too or not at all interested in the court ’s rulings on gay marriage About three - in - ten ( 31 % ) had said they were very interested in that decision ."
mturk_charts/no_data_remaining/multi_col/2397.png,"A Pew Research Center survey in May found that for the first time , more than half ( 51 % ) of Americans favored allowing gay men and lesbians to marry . The same survey found that 72 % percent of Americans believe that legal recognition of same - sex marriage is inevitable , regardless of whether they themselves favor or oppose it : While 85 % of same - sex marriage supporters say legal recognition is inevitable , so do 59 % of opponents .",same,How much do Americans favor same-sex marriage?,same,More than half ( 51 % ) of Americans favored allowing gay men and lesbians to marry .,more than half ( 51 % ) of Americans favored allowing gay men and lesbians to marry .,,"A Pew Research Center survey in May found that for the first time , The same survey found that 72 percent believe that legal recognition same - sex marriage is inevitable , regardless whether they themselves favor or oppose it : While 85 same - sex marriage supporters say legal recognition is inevitable , so do 59 opponents",More,more, ,"Growing Marriage, Support Gay Legal for Agreements Same Sex Growing Marriage, Support Gay Legal Agreements Favor allowing legal agreements","A Pew Research Center survey in May found that for the first time , more than half ( 51 % ) of Americans favored allowing gay men and lesbians to marry . The same survey found that 72 % percent of Americans believe that legal recognition of same - sex marriage is inevitable , regardless of whether they themselves favor or oppose it : While 85 % of same - sex marriage supporters say legal recognition is inevitable , so do 59 % of opponents ."
mturk_charts/no_data_remaining/multi_col/2396.png,"Favorable opinions of both business corporations and labor unions have rebounded from record lows reached in the summer of 2011 . Overall , more Americans now hold a favorable ( 55 % ) than an unfavorable ( 39 % ) view of business corporations ; two years ago , opinion was reversed ( 52 % unfavorable , 38 % favorable ) . Similarly , views of labor unions have returned to positive territory , with 51 % holding a favorable view and 42 % holding an unfavorable view – far better ratings than the 46 % unfavorable/41 % favorable balance of opinion registered in 2011 . Public views of business corporations and labor unions , which had mostly been in positive territory from the 1980s through the early 2000s , turned less favorable during the economic recession . And in August 2011 , amid fears of a new economic downturn and widespread dissatisfaction with national conditions , favorable ratings for business and labor hit all - time lows . Since then , favorable opinions of business corporations have increased 17 points and positive views of labor unions have risen 10 points .",same,Explain how the Americans' opinions about business corporations changed in the last two years.,answer1,"Overall , more Americans now hold a favorable ( 55 % ) view of business corporations ; two years ago , opinion was reversed ( 38 % favorable ) .","Overall , more Americans now hold a favorable ( 55 % ) view of business corporations ; two years ago , opinion was reversed ( 38 % favorable ) .",.,than an unfavorable 39 52 unfavorable,,, ,Favorable Views of Business and Labor Favorable Up Sharply Views Since 2011 and % with favorable view of,"Overall , more Americans now hold a favorable ( 55 % ) than an unfavorable ( 39 % ) view of business corporations ; two years ago , opinion was reversed ( 52 % unfavorable , 38 % favorable )"
