img_path,summary,question_resolution,question,answer_resolution,abstractive_answer,extractive_answer,decontextualizated_text_added,decontextualizated_text_removed,abstractive_text_added,abstractive_text_removed,extra_added_text,title,original_answer
mturk_charts/no_data_remaining/multi_col/2317.png,"Historically , women have been especially avid users . Between December 2009 and December 2012 , women were significantly more likely than men to use social networking sites in nine out of ten surveys we conducted . During this period , the proportion of women who used social media sites was 10 percentage points higher than men on average . When we include earlier surveys and our latest reading ( spanning May 2008 through May 2013 ) , the average difference falls slightly to 8 % . Currently , three - quarters ( 74 % ) of online women use social networking sites .",same,Compare the usage of social networks between women and men over the years.,answer1,"Historically , women have been especially avid users . Between December 2009 and December 2012 , women were significantly more likely than men to use social networking sites in nine out of ten surveys we conducted . During this period , the proportion of women who used social media sites was 10 percentage points higher than men on average . When we include earlier surveys and our latest reading ( spanning May 2008 through May 2013 ) , the average difference falls slightly to 8 % . Currently , three - quarters ( 74 % ) of online women use social networking sites .","Historically , women have been especially avid users . Between December 2009 and December 2012 , women were significantly more likely than men to use social networking sites in nine out of ten surveys we conducted . During this period , the proportion of women who used social media sites was 10 percentage points higher than men on average . When we include earlier surveys and our latest reading ( spanning May 2008 through May 2013 ) , the average difference falls slightly to 8 % . Currently , three - quarters ( 74 % ) of online women use social networking sites .",,,,, ,"Women, men, and social networking over time Among internet users, the % of men vs. women who use social networking sites","Historically , women have been especially avid users . Between December 2009 and December 2012 , women were significantly more likely than men to use social networking sites in nine out of ten surveys we conducted . During this period , the proportion of women who used social media sites was 10 percentage points higher than men on average . When we include earlier surveys and our latest reading ( spanning May 2008 through May 2013 ) , the average difference falls slightly to 8 % . Currently , three - quarters ( 74 % ) of online women use social networking sites ."
mturk_charts/no_data_remaining/multi_col/2316.png,"Currently , 43 % approve of the way that Barack Obama is handling the economy , while 52 % disapprove . Obama ’s job rating on the economy has shown little change this year . Views of Obama ’s handling of the economy have been consistently more negative than positive since shortly after he took office in early 2009 .",same,Describe Obama's approval rating regarding the economy over the years.,answer1,"Currently , 43 % approve of the way that Barack Obama is handling the economy , while 52 % disapprove . Obama ’s job rating on the economy has shown little change this year . Views of Obama ’s handling of the economy have been consistently more negative than positive since shortly early 2009 .","Currently , 43 % approve of the way that Barack Obama is handling the economy , while 52 % disapprove . Obama ’s job rating on the economy has shown little change this year . Views of Obama ’s handling of the economy have been consistently more negative than positive since shortly early 2009 .",job rating on has shown little change this year,after he took office in,,, ,Continued Handling Disapproval of Obama S Handling of Disapproval the Economy of Obama 's handling of the economy,"Currently , 43 % approve of the way that Barack Obama is handling the economy , while 52 % disapprove . Views of Obama ’s handling of the economy have been consistently more negative than positive since shortly after he took office in early 2009 ."
mturk_charts/no_data_remaining/multi_col/2315.png,"Overall , 40 % say that the job situation is the national economic issue that worries them most , while somewhat fewer cite the budget deficit ( 24 % ) or rising prices ( 22 % ) ; just 10 % say the condition of the financial and housing markets is their top economic worry . The percentage citing the job situation as their top economic worry has increased eight points since March , when concern over rising prices rivaled the job situation as the public ’s top economic worry . For most of the past three years , the job situation has been the public ’s top economic worry .",same,Discuss what economic issues concern the public.,answer1,"Overall , 40 % say that the job situation is the national economic issue that worries them most , while somewhat fewer cite the budget deficit ( 24 % ) or rising prices ( 22 % ) ; just 10 % say the condition of the financial and housing markets is their top economic worry .","Overall , 40 % say that the job situation is the national economic issue that worries them most , while somewhat fewer cite the budget deficit ( 24 % ) or rising prices ( 22 % ) ; just 10 % say the condition of the financial and housing markets is their top economic worry .",,,,, ,Job Situation Remains Public's Top Economic Concern Economic issue that,"Overall , 40 % say that the job situation is the national economic issue that worries them most , while somewhat fewer cite the budget deficit ( 24 % ) or rising prices ( 22 % ) ; just 10 % say the condition of the financial and housing markets is their top economic worry ."
mturk_charts/no_data_remaining/multi_col/2311.png,"Nearly two - thirds ( 63 % ) of cell phone owners now use their phone to go online , according to a new survey by the Pew Research Center ’s Internet & amp ; American Life Project . We call them “ cell internet users ” and define them as anyone who uses their cell phone to access the internet or use email . Because 91 % of all Americans now own a cell phone , this means that 57 % of all American adults are cell internet users . The proportion of cell owners who use their phone to go online has doubled since 2009 .",same,Describe how often cell phone users go online.,answer1,Nearly two - thirds ( 63 % ) of cell phone owners now use their phone to go online .,Nearly two - thirds ( 63 % ) of cell phone owners now use their phone to go online .,.,,,, ,"Almost two-thirds of cell owners go online using their phones Among cell phone owners, the % who use the internet or email on their phone",Nearly two - thirds ( 63 % ) of cell phone owners now use their phone to go online
mturk_charts/no_data_remaining/multi_col/2310.png,"Currently , 53 % disapprove of the health care law , while 42 % approve . This is among the most negative assessments of the law since it was enacted in March 2010 . In July 2012 , shortly after the Supreme Court upheld most of the provisions of the Affordable Care Act , 47 % approved of the legislation and 43 % disapproved . Overall opinion about the health care law has fluctuated in recent years , yet the patterns of opposition and support across demographic and partisan groups have remained fairly steady since the legislation was first being debated in Congress .",same,What does the public have to say about the health care law?,answer1,"Currently , 53 % disapprove of the health care law , while 42 % approve .","Currently , 53 % disapprove of the health care law , while 42 % approve .",,,,, ,Views of Health Care Law Views Since Passage of Health,"Currently , 53 % disapprove of the health care law , while 42 % approve ."
mturk_charts/no_data_remaining/multi_col/2309.png,"While 58 % of Americans have a positive opinion of the UN , support varies considerably by political party . A strong majority of Democrats ( 72 % ) in the U.S. have a favorable view of the international body , while a smaller 60%-majority of independents agree . Meanwhile , support among Republicans trails at 41 % and has dropped ten percentage points since 2011 .",same,What do different party-aligned Americans think about the UN?,answer1,"A strong majority of Democrats ( 72 % ) in the U.S. have a favorable view of the international body , while a smaller 60%-majority of independents agree . Meanwhile , support among Republicans trails at 41 % .","A strong majority of Democrats ( 72 % ) in the U.S. have a favorable view of the international body , while a smaller 60%-majority of independents agree . Meanwhile , support among Republicans trails at 41 % .",,and has dropped ten percentage points since 2011,,, ,Partisan Divide in U.S. Views of UN % Favorable of UN,"A strong majority of Democrats ( 72 % ) in the U.S. have a favorable view of the international body , while a smaller 60%-majority of independents agree . Meanwhile , support among Republicans trails at 41 % and has dropped ten percentage points since 2011 ."
mturk_charts/no_data_remaining/multi_col/2308.png,"Hard times can act to bring families together , and the Great Recession of 2007 - 09 was no different : The number of children living with a grandparent surged after the onset of the recession , as did the number of children whose primary caregiver was that grandparent . A Pew Research Center analysis of Census data found that 7.7 million U.S. children — about 10 % of all children in the country — were living in the same household as at least one of their grandparents in 2011 , and for 3 million that grandparent also was their primary caregiver . Both trends stabilized at higher level after the recession ’s official end in mid-2009 .",same,,answer1,"A Pew Research Center analysis of Census data found that 7.7 million U.S. children — about 10 % of all children in the country — were living in the same household as at least one of their grandparents in 2011 , and for 3 million that grandparent also was their primary caregiver . Both trends stabilized at higher level after the recession ’s official end in mid-2009 .","A Pew Research Center analysis of Census data found that 7.7 million U.S. children — about 10 % of all children in the country — were living in the same household as at least one of their grandparents in 2011 , and for 3 million that grandparent also was their primary caregiver . Both trends stabilized at higher level after the recession ’s official end in mid-2009 .",,,,, ,"Children Grand Living with or Being During Cared Recession, for Primarily bya Grand parent Rose During Recession, Stabilized Thereafter Annual% change in number of children","A Pew Research Center analysis of Census data found that 7.7 million U.S. children — about 10 % of all children in the country — were living in the same household as at least one of their grandparents in 2011 , and for 3 million that grandparent also was their primary caregiver . Both trends stabilized at higher level after the recession ’s official end in mid-2009 ."
mturk_charts/no_data_remaining/multi_col/2307.png,"Sudan is one of an increasing number of countries whose governments regulate the wearing of religious symbols or attire , such as head coverings for women or facial hair for men . The Pew Research Center ’s latest report on global restrictions on religion finds that , as of 2011 , 53 of the 198 countries included in the study ( 27 % ) have such restrictions , up from 21 countries ( 11 % ) in 2007 . In addition to government regulations , private individuals and groups also try to enforce norms of religious attire in many countries . Our study finds that the number of countries in which women have been harassed by individuals or groups for violating religious dress codes has increased in recent years . In the latest year studied , such social hostilities over religious attire were found in 50 countries ( 25 % ) , including Sudan . Five years earlier , such incidents were reported in 14 countries ( 7 % ) . While there may not be a direct causal connection between government regulations and social hostilities involving religious attire , our data show that harassment of women over religious dress occurs more often in countries where the wearing of religious symbols and attire are regulated by any level of government .",same,Explain the increase in the proportion of countries where women are harassed for violating religious dress codes.,new_answer,"The number of countries in which women have been harassed by individuals or groups for violating religious dress codes has increased in recent years . such social hostilities over religious attire were found in 25 % . Five years earlier , such incidents were reported in 7 % .","the number of countries in which women have been harassed by individuals or groups for violating religious dress codes has increased in recent years . such social hostilities over religious attire were found in 25 % . Five years earlier , such incidents were reported in 7 % .",number which women been harassed by individuals or groups for violating religious dress codes has increased recent years . social hostilities over religious attire were found 25 . Five years earlier incidents were reported 7 .,The Pew Research Center ’s latest report on global restrictions on religion finds that as 2011 53 198 included study ( 27 ) restrictions up from 21 ( 11 ) 2007,The,the, ,Government Restrictions on Religious Dress % of countries where the government wearing of religious regulates symbols the wearing of religious symbols,"The Pew Research Center ’s latest report on global restrictions on religion finds that , as of 2011 , 53 of the 198 countries included in the study ( 27 % ) have such restrictions , up from 21 countries ( 11 % ) in 2007"
mturk_charts/no_data_remaining/multi_col/2305.png,"New data show that median household income has stagnated for the longest period since the government began collecting such data in 1967 . In 2012 the median household income was $ 51,017 , still below the pre - recession 2007 level ( $ 55,627 ) and also below the all - time peak level reached in 1999 ( $ 56,080 ) . So the typical American household had 9 % less income in 2012 than it did 13 years earlier ( all figures adjusted for inflation ) . The 2012 level is just above where it had stood as of 1995 ( $ 50,978 ) . Households headed by those 65 and older are faring relatively better since the recession . The income patterns of younger and older households have moved in opposite directions in recent years . The median incomes of households headed by those 65 and older have risen during the recession and recovery , continuing their steady rise over more than four decades . By contrast , the median incomes of younger and middle - aged households have declined since the onset of the recession . In 2012 , the median household income among those led by someone aged 65 and older was $ 33,848 , statistically unchanged from $ 33,810 in 2011 . Thus , in 2012 the median household income of seniors was 66 % of the national median household income . Back in 1967 , the median income of these older households was only 39 % of the national median .",same,Describe the changes in the median household income since 1999.,same,"The median household income has stagnated for the longest period since 1967 . In 2012 the median household income was $ 51,017 , still below the pre - recession 2007 level ( $ 55,627 ) and also below the all - time peak level reached in 1999 ( $ 56,080 ) . So the typical American household had 9 % less income in 2012 than it did 13 years earlier ( all figures adjusted for inflation ) .","median household income has stagnated for the longest period since 1967 . In 2012 the median household income was $ 51,017 , still below the pre - recession 2007 level ( $ 55,627 ) and also below the all - time peak level reached in 1999 ( $ 56,080 ) . So the typical American household had 9 % less income in 2012 than it did 13 years earlier ( all figures adjusted for inflation ) .",has stagnated longest period since 1967,,,,The  ,"1967-2012 Median Household Income by Age of Householder, 1967-2012 In 2012 dollars $60, .000","In 2012 the median household income was $ 51,017 , still below the pre - recession 2007 level ( $ 55,627 ) and also below the all - time peak level reached in 1999 ( $ 56,080 ) . So the typical American household had 9 % less income in 2012 than it did 13 years earlier ( all figures adjusted for inflation ) ."
mturk_charts/no_data_remaining/multi_col/2304.png,"The media ’s newfound focus on the economy as a central campaign issue also coincided with increasingly unflattering coverage of McCain . The week before the Lehman Brothers collapse , McCain was benefiting from a post - convention bounce that was reflected in the tone of his media coverage . From Sept. 8 - 14 , 37 % of campaign narrative focused on the senator was positive in tone , while 32 % was negative ( another 31 % was neutral ) .",same,Describe the tone in the coverage of the senator John McCain during Sept. 8 - 14.,same,"37 % of campaign narrative focused on the senator was positive in tone , while 32 % was negative ( another 31 % was neutral ) .","37 % of campaign narrative focused on the senator was positive in tone , while 32 % was negative ( another 31 % was neutral ) .",,From Sept. 8 - 14,,, ,"Tone of John McCain Coverage Over Time Percent of candidate coverage by tone, Sept. 8 Oct. 16, 2008","From Sept. 8 - 14 , 37 % of campaign narrative focused on the senator was positive in tone , while 32 % was negative ( another 31 % was neutral ) ."
mturk_charts/no_data_remaining/multi_col/2301.png,"For the first time on record , households headed by someone with at least a bachelor ’s degree received nearly a majority ( 49.7 % ) of aggregate U.S. household income ; nearly one out of every two dollars went to the college educated . In 2012 one - in - three households was college educated , so , put another way , half of the aggregate U.S. income goes to one third of the households .",same,Describe the U.S. household income distribution by education.,answer1,Households headed by someone with at least a bachelor ’s degree received nearly a majority ( 49.7 % ) of aggregate U.S. household income ; nearly one out of every two dollars went to the college educated .,households headed by someone with at least a bachelor ’s degree received nearly a majority ( 49.7 % ) of aggregate U.S. household income ; nearly one out of every two dollars went to the college educated .,,"For first time on record , In 2012 - in - three was , so , put another way , half goes third",Households,households, ,"Income, by Education of Householder, Aggregate 1991-2012 Bachelor's or more","For the first time on record , households headed by someone with at least a bachelor ’s degree received nearly a majority ( 49.7 % ) of aggregate U.S. household income ; nearly one out of every two dollars went to the college educated . In 2012 one - in - three households was college educated , so , put another way , half of the aggregate U.S. income goes to one third of the households ."
mturk_charts/no_data_remaining/multi_col/2300.png,"The number of people killed in religion - related terrorist attacks in Kenya has dramatically increased in recent years . According to reports analyzed by the Pew Research Center as part of our ongoing global study of religious restrictions and hostilities , more than 300 people were killed , injured or displaced as a result of religion - related terrorist attacks in Kenya in 2012 , more than twice as many as in 2011 and more than a five - fold increase from 2010 . In general , social hostilities involving religion , defined by Pew Research as concrete acts of religious violence ranging from hate crimes to religion - related terrorism and war , are much higher in Kenya than in sub - Saharan Africa as a whole . In 2012 , Kenya had nearly four times the level of social hostilities ( 8.3 on a scale of 10 ) as the median level among the 48 countries in the region ( 2.1 ) . The Pew Research Social Hostilities Index takes into account the level and intensity of hostilities , including sectarian violence , religion - related mob violence and so - called honor killings , where the perpetrators are motivated by religion .",same,"Describe the level of social hostilities in Kenya, compared to sub-Saharan Africa.",new_answer,"In 2012 , Kenya had nearly four times the level of social hostilities ( 8.3 on a scale of 10 ) as the median level among the 48 countries in the region ( 2.1 ) .","In 2012 , Kenya had nearly four times the level of social hostilities ( 8.3 on a scale of 10 ) as the median level among the 48 countries in the region ( 2.1 ) .",In had nearly four times level social ( 8.3 on scale 10 ) median level among 48 countries region ( 2.1 ) .,According to reports analyzed by Pew Research Center part our ongoing global study religious restrictions and more than 300 people were killed injured or displaced result religion - related terrorist attacks more than twice many 2011 and more than five - fold increase from 2010,,, ,Social Hostilities Involving Religion Scores on the 10-point Social Hostilities Index,"According to reports analyzed by the Pew Research Center as part of our ongoing global study of religious restrictions and hostilities , more than 300 people were killed , injured or displaced as a result of religion - related terrorist attacks in Kenya in 2012 , more than twice as many as in 2011 and more than a five - fold increase from 2010"
mturk_charts/no_data_remaining/multi_col/2298.png,"At first glance , new data released Wednesday from the Federal Reserve appears to show an increase in the nation ’s net worth compared with six years ago , when the stock market plunged and the financial sector was on the brink of collapse . The Fed reported that the nation ’s net worth is $ 74.8 trillion as of June 30 , compared with $ 67.8 trillion in 2007 . Does that mean the wealth of a typical U.S. household has fully recovered from the Great Recession ? Hardly . Keep in mind 3 considerations :",same,Describe the increase in the U.S. net worth since 2007.,answer1,"The nation ’s net worth is $ 75 trillion , compared with $ 68 trillion in 2007 .","the nation ’s net worth is $ 74.8 trillion , compared with $ 67.8 trillion in 2007 .",.,The Fed reported that as of June 30,The 75 68,the 74.8 67.8, ,Aggregate U.S. Net Worth Wealth adjusted for inflation,"The Fed reported that the nation ’s net worth is $ 74.8 trillion as of June 30 , compared with $ 67.8 trillion in 2007"
mturk_charts/no_data_remaining/multi_col/2296.png,"Nuclear power has lost support over the past year . Currently , 38 % favor the increased use of nuclear power while 58 % are opposed . In March 2012 , opinion was more closely divided ( 44 % favor , 49 % oppose ) . As recently as February 2010 , significantly more favored ( 52 % ) than opposed ( 41 % ) the increased use of nuclear power .",same,Describe information about public opinion regarding the increased use of nuclear energy.,answer1,"Currently , 38 % favor the increased use of nuclear power while 58 % are opposed .","Currently , 38 % favor the increased use of nuclear power while 58 % are opposed .",,,,, ,Promoting the Increased Use of Nuclear Power,"Currently , 38 % favor the increased use of nuclear power while 58 % are opposed ."
mturk_charts/no_data_remaining/multi_col/2295.png,"Public views of Republican leaders ’ policies , which were nearly two - to - one positive in the month after the election ( 52 % approve , 28 % disapprove ) , turned negative just eight months later . In August 1995 , 38 % approved GOP leaders ’ proposals while 45 % disapproved . Notably , these opinions did not change much over the following year – including through the period of the two government shutdowns .",same,Describe the public view of GOP proposals in December 1994.,answer1,"Public views of Republican leaders ’ policies were nearly two - to - one positive ( 52 % approve , 28 % disapprove ) .","Public views of Republican leaders ’ policies were nearly two - to - one positive ( 52 % approve , 28 % disapprove ) .",,which in the month after the election turned negative just eight months later Notably these opinions did not change much over the following year – including through the period the government shutdowns,,, ,Views of GOP Proposals '95 Turned Negative Before Proposals '95 Shutdown Dec 1994-June leaders 1996: Policies and proposals of Republican 1994-June leaders 1996: in Congress and,"Public views of Republican leaders ’ policies , which were nearly two - to - one positive in the month after the election ( 52 % approve , 28 % disapprove ) , turned negative just eight months later . Notably , these opinions did not change much over the following year – including through the period of the two government shutdowns ."
