img_path,"summary",question_resolution,"question",answer_resolution,"abstractive_answer","extractive_answer","decontextualizated_text_added","decontextualizated_text_removed","extra_added_text"
mturk_charts/no_data/multi_col/524.png,"The terms Hispanics in the United States use to describe themselves can provide a direct look at how they view their identity and how the strength of immigrant ties influences the ways they see themselves . About half of Hispanic adults say they most often describe themselves by their family ’s country of origin or heritage , using terms such as Mexican , Cuban , Puerto Rican or Salvadoran , while another 39 % most often describe themselves as “ Hispanic ” or “ Latino , ” the pan - ethnic terms used most often to describe this group in the U.S. The use of these terms varies across immigrant generations and reflects their diverse experiences . More than half ( 56 % ) of foreign - born Latinos most often use the name of their origin country to describe themselves , a share that falls to 39 % among the U.S.-born adult children of immigrant parents ( i.e. , the second generation ) and 33 % among third- or higher - generation Latinos .",same,"Describe the trend of how Hispanics identity themselves?",answer1,"About half of Hispanic adults say they most often describe themselves by their family ’s country of origin or heritage , while another 39 % most often describe themselves as “ Hispanic ” or “ Latino","About half of Hispanic adults say they most often describe themselves by their family ’s country of origin or heritage , using terms such as Mexican , Cuban , Puerto Rican or Salvadoran , while another 39 % most often describe themselves as “ Hispanic ” or “ Latino","","","About half of Hispanic adults say they most often describe themselves by their family ’s country of origin or heritage , while another 39 % most often describe themselves as “ Hispanic ” or “ Latino"
mturk_charts/no_data/multi_col/525.png,"The December 2019 survey also finds U.S. Hispanics are divided on how much of a common identity they share with other Americans , though views vary widely by immigrant generation . About half ( 53 % ) consider themselves to be a typical American , while 44 % say they are very different from a typical American . By contrast , only 37 % of immigrant Hispanics consider themselves a typical American . This share rises to 67 % among second - generation Hispanics and to 79 % among third - or - higher - generation Hispanics – views that partially reflect their birth in the U.S. and their experiences as lifelong residents of this country .",same,"Does Hispanics think of themselves as a American?",answer1,"About half ( 53 % ) consider themselves to be a typical American , while 44 % say they are very different from a typical American","About half ( 53 % ) consider themselves to be a typical American , while 44 % say they are very different from a typical American","About half ( 53 ) consider themselves to be , while","",""
mturk_charts/no_data/multi_col/526.png,"The importance of most of these elements to Hispanic identity decreases across generations . For example , 54 % of foreign - born Hispanics say speaking Spanish is an essential part of what being Hispanic means to them , compared with 44 % of second - generation Hispanics and 20 % of third- or higher - generation Hispanics .",same,"Describe the proportion of foreign-born Hispanics who say that speaking Spanish is an essential part of what being Hispanic means to them?",same,"54 % of foreign - born Hispanics say speaking Spanish is an essential part of what being Hispanic means to them","54 % of foreign - born Hispanics say speaking Spanish is an essential part of what being Hispanic means to them","","",""
mturk_charts/no_data/multi_col/539.png,"President Donald Trump is generally seen more negatively than other major world leaders , with a median of 83 % expressing no confidence in him on world affairs .",question2,"What is opinion of people around the world about President Donald Trump as a world leader ?",answer1,"President Donald Trump is generally seen more negatively than other major world leaders , with a median of 83 % expressing no confidence in him on world affairs .","President Donald Trump is generally seen more negatively than other major world leaders , with a median of 83 % expressing no confidence in him on world affairs .","","",""
mturk_charts/no_data/multi_col/541.png,"Gen Z eligible voters , who range in age from 18 to 23 , are a more racially and ethnically diverse group than older generations . While a majority ( 55 % ) are non - Hispanic White , a notable 22 % are Hispanic , according to a Pew Research Center analysis based on Census Bureau data . Some 14 % of Gen Z eligible voters are Black , 5 % are Asian and 5 % are some other race or multiracial .",same,"What is the proportion of ethnic voters in Gen Z eligible voters ?",answer1,"While a majority ( 55 % ) are non - Hispanic White , a notable 22 % are Hispanic Some 14 % of Gen Z eligible voters are Black , 5 % are Asian and 5 % are some other race or multiracial .","While a majority ( 55 % ) are non - Hispanic White , a notable 22 % are Hispanic Some 14 % of Gen Z eligible voters are Black , 5 % are Asian and 5 % are some other race or multiracial .","","",""
mturk_charts/no_data/multi_col/549.png,"On a question about morality , Hispanic teens hold different opinions from their White , non - Hispanic peers . Hispanic teens are about evenly split on the question of whether it is necessary to believe in God in order to be moral and have good values : 50 % say it is not necessary , while 48 % say it is . By comparison , 71 % of White teens say that a belief in God is unnecessary to be moral and 28 % say it is necessary .",same,"What is the ratio of teens who say that it is necessary to believe in god to be moral ?",answer1,"50 % say it is not necessary , while 48 % say it is . By comparison , 71 % of White teens say that a belief in God is unnecessary to be moral and 28 % say it is necessary","50 % say it is not necessary , while 48 % say it is . By comparison , 71 % of White teens say that a belief in God is unnecessary to be moral and 28 % say it is necessary","","",""
mturk_charts/no_data/multi_col/551.png,"Most Americans say the U.S. response to the coronavirus outbreak has been less effective than that of other wealthy nations . Around six - in - ten adults ( 62 % ) hold that view , while a quarter say America ’s response has been about as effective and 13 % say it has been more effective , according to a survey conducted July 27 to Aug. 2 . Attitudes on this question are deeply divided along partisan lines , as they are on many questions related to the coronavirus . Almost nine - in - ten Democrats and Democratic - leaning independents ( 87 % ) say the U.S. response has been less effective than that of other wealthy countries , while Republicans and GOP leaners are much more divided : Around a third ( 34 % ) say it has been less effective , 42 % say it has been about as effective and 22 % say it has been more effective .",question2,"What do Americans think about the effectiveness of U.S. response towards COVID-19 ?",answer1,"Around six - in - ten adults ( 62 % ) hold that view , while a quarter say America ’s response has been about as effective and 13 % say it has been more effective","Around six - in - ten adults ( 62 % ) hold that view , while a quarter say America ’s response has been about as effective and 13 % say it has been more effective","","",""
mturk_charts/no_data/multi_col/568.png,"Supporters of Donald Trump and Joe Biden are divided not just in their views of the two presidential candidates and in their broader political beliefs and values . They are also largely divided in their personal relationships : Roughly four - in - ten registered voters in both camps say that they do not have a single close friend who supports the other major party candidate , and fewer than a quarter say they have more than a few friends who do , according to a Pew Research Center survey conducted in July and August . Most voters instead report having a lot of friends who share their political preferences . Around six - in - ten Trump supporters ( 59 % ) say they have a lot of friends who share their support for the president ’s reelection bid , while a slightly smaller share of Biden supporters ( 48 % ) say a lot of their close friends also back the former vice president in the election this fall . Nearly nine - in - ten backers of both Trump ( 89 % ) and Biden ( 87 % ) say they have at least some close friends who support their candidate for president .",same,"What is the opinion among supporters of Biden and Trump towards candidate support ?",answer1,"Around six - in - ten Trump supporters ( 59 % ) say they have a lot of friends who share their support for the president ’s reelection bid , while a slightly smaller share of Biden supporters ( 48 % ) say a lot of their close friends also back the former vice president in the election this fall","Around six - in - ten Trump supporters ( 59 % ) say they have a lot of friends who share their support for the president ’s reelection bid , while a slightly smaller share of Biden supporters ( 48 % ) say a lot of their close friends also back the former vice president in the election this fall","","",""
mturk_charts/no_data/multi_col/577.png,"Consistent with the view that a vaccine may be approved before its safety and effectiveness are fully understood , Americans overwhelmingly say their greater concern is that the approval process will move too fast , rather than too slowly . Nearly eight - in - ten ( 78 % ) say their greater concern is that the vaccine approval process will move too fast , without fully establishing that it is safe and effective . Just 20 % say they are more concerned the approval process will move too slowly , causing unnecessary delays in access to a vaccine . While Republicans and Democrats have differed over many aspects of the coronavirus outbreak – including the threat it presents to public health and how quickly to lift restrictions on public activity – majorities of both groups say their greater concern about the vaccine approval process is that it will move too fast , rather than too slowly . About seven - in - ten Republicans ( 69 % ) are more concerned about the approval process moving too fast , and an even larger majority of Democrats ( 86 % ) share this view .",same,"What does U.S. adults think about COVID-19 vaccine approval process pace ?",answer1,"Nearly eight - in - ten ( 78 % ) say their greater concern is that the vaccine approval process will move too fast , without fully establishing that it is safe and effective . Just 20 % say they are more concerned the approval process will move too slowly , causing unnecessary delays in access to a vaccine","Nearly eight - in - ten ( 78 % ) say their greater concern is that the vaccine approval process will move too fast , without fully establishing that it is safe and effective . Just 20 % say they are more concerned the approval process will move too slowly , causing unnecessary delays in access to a vaccine","","",""
mturk_charts/no_data/multi_col/578.png,"Overall , 19 % of the public has a great deal of confidence that the research and development process in the U.S. will produce a safe and effective vaccine for COVID-19 , while another 45 % say they have a fair amount of confidence . About a third ( 35 % ) say they have not too much or no confidence in this process . Among those who say they would definitely or probably get a vaccine , more than eight - in - ten express either a great deal ( 30 % ) or a fair amount ( 54 % ) of confidence in the research and development process . By contrast , 55 % of those not planning to get a coronavirus vaccine say they have not too much or no confidence at all in this process .",same,"Describe the proportion of the public who had great confidence that the US research and development process will produce a safe and effective vaccine for COVID-19?",answer2,"Overall , 19 % of the public has a great deal of confidence that the research and development process in the U.S. will produce a safe and effective vaccine for COVID-19 Among those who say they would definitely or probably get a vaccine , more than eight - in - ten express either a great deal ( 30 % ) or a fair amount ( 54 % )","Overall , 19 % of the public has a great deal of confidence that the research and development process in the U.S. will produce a safe and effective vaccine for COVID-19 Among those who say they would definitely or probably get a vaccine , more than eight - in - ten express either a great deal ( 30 % ) or a fair amount ( 54 % )","54","",""
mturk_charts/no_data/multi_col/583.png,"Overall , 41 % of adults say recent protests related to racial inequality have received too much attention from news organizations , while 36 % say they have received the right amount and 23 % say they have received too little . By comparison , larger shares of Americans say news organizations have paid the right amount of attention to two other major stories this year : the coronavirus outbreak ( 46 % ) and the presidential election ( 58 % ) .",same,"How U.S. adults say about attention of new organizations have given to protests related to racial inequality?",answer1,"41 % of adults say recent protests related to racial inequality have received too much attention from news organizations , while 36 % say they have received the right amount and 23 % say they have received too little comparison","41 % of adults say recent protests related to racial inequality have received too much attention from news organizations , while 36 % say they have received the right amount and 23 % say they have received too little comparison",", while 36 they the right amount and 23 they little comparison","",""
mturk_charts/no_data/multi_col/587.png,"The partisan gap is similar among White adults . About nine - in - ten White Democrats ( 88 % ) express at least some support for the Black Lives Matter movement , compared with 16 % of White Republicans . And while about half of White Democrats ( 51 % ) say they strongly support the movement , just 2 % of White Republicans say the same .",same,"Describe response between white Democrats and Republicans on Black Libves Matter?",answer2,"About nine - in - ten White Democrats ( 88 % ) express at least some support for the Black Lives Matter movement , compared with 16 % of White Republicans And while about half of White Democrats ( 51 % ) say they strongly support the movement , just 2 % of White Republicans say the same","About nine - in - ten White Democrats ( 88 % ) express at least some support for the Black Lives Matter movement , compared with 16 % of White Republicans And while about half of White Democrats ( 51 % ) say they strongly support the movement , just 2 % of White Republicans say the same","","",""
mturk_charts/no_data/multi_col/595.png,"Hispanic self - identification varies across immigrant generations . Among the foreign born from Latin America , nearly all self - identify as Hispanic . But by the fourth generation , only half of people with Hispanic heritage in the U.S. self - identify as Hispanic .",same,"What is the trend among Americans in identifying as Hispanics ?",same,"Hispanic self - identification varies across immigrant generations . Among the foreign born from Latin America , nearly all self - identify as Hispanic . But by the fourth generation , only half of people with Hispanic heritage in the U.S. self - identify as Hispanic","Hispanic self - identification varies across immigrant generations . Among the foreign born from Latin America , nearly all self - identify as Hispanic . But by the fourth generation , only half of people with Hispanic heritage in the U.S. self - identify as Hispanic","","",""
mturk_charts/no_data/multi_col/601.png,"White and Hispanic Catholics are very different politically . Nearly six - in - ten White Catholic registered voters ( 57 % ) identify with or lean toward the Republican Party , marking a big shift since 2008 , when four - in - ten ( 41 % ) supported the GOP . Most Hispanic Catholic voters ( 68 % ) , meanwhile , identify as Democrats or lean Democratic , a share that has remained fairly stable in the past decade . ( Two - thirds of Catholic registered voters are White , while a quarter are Hispanic , according to data collected in 2018 and 2019 . ) Catholics ’ views of Trump are clearly divided by race and ethnicity . In a poll conducted in late July and early August – amid a surge in U.S. coronavirus cases – 54 % of White Catholics overall said they approve of Trump ’s performance as president , but 69 % of Hispanic Catholics said they disapprove of the way he is handling his job . And 59 % of White Catholic registered voters said they would vote for Trump , or lean that way , if the election were held today ; among Hispanic Catholic registered voters , 65 % said they would vote for Biden today . There was a similar divide in the last presidential election : 64 % of White Catholics voted for Trump in 2016 , according to a Pew Research Center survey of validated voters conducted at the time , while 78 % of Hispanic Catholics voted for Clinton .",same,"Describe how Whites and Hispanics says about voting Trump and Biden ?",answer1,"54 % of White Catholics overall said they approve of Trump ’s performance as president , but 69 % of Hispanic Catholics said they disapprove of the way he is handling his job And 59 % of White Catholic registered voters said they would vote for Trump , or lean that way , if the election were held today ; among Hispanic Catholic registered voters , 65 % said they would vote for Biden today","54 % of White Catholics overall said they approve of Trump ’s performance as president , but 69 % of Hispanic Catholics said they disapprove of the way he is handling his job And 59 % of White Catholic registered voters said they would vote for Trump , or lean that way , if the election were held today ; among Hispanic Catholic registered voters , 65 % said they would vote for Biden today","","",""
mturk_charts/no_data/multi_col/602.png,"When it comes to specific policy issues , Catholics are often more aligned with their political party than with the teachings of their church . On abortion , for example , 77 % of Democratic and Democratic - leaning Catholic adults say they think abortion should be legal in all or most cases , while 63 % of Republican and Republican - leaning Catholics say abortion should be illegal in all or most cases , according to a 2019 survey . This divide exists despite the Catholic Church ’s formal opposition to abortion . On immigration , 91 % of Catholic Democrats oppose expanding the wall along the border between the U.S. and Mexico , while 81 % of Catholic Republicans favor expanding the wall , according to a separate 2019 survey . The U.S. Conference of Catholic Bishops has condemned Trump ’s plan to build such a wall , and Pope Francis described the desire to build a border wall as “ not Christian . ”",same,"What is the opinion of Catholic Democrats and Republicans about U.S Mexico border wall expansion ?",answer1,"91 % of Catholic Democrats oppose expanding the wall along the border between the U.S. and Mexico , while 81 % of Catholic Republicans favor expanding the wall , according to a separate 2019 survey","91 % of Catholic Democrats oppose expanding the wall along the border between the U.S. and Mexico , while 81 % of Catholic Republicans favor expanding the wall , according to a separate 2019 survey","","",""
mturk_charts/no_data/multi_col/607.png,"For instance , just 41 % in the United Kingdom express a favorable opinion of the U.S. , the lowest percentage registered in any Pew Research Center survey there . In France , only 31 % see the U.S. positively , matching the grim ratings from March 2003 , at the height of U.S.-France tensions over the Iraq War . Germans give the U.S. particularly low marks on the survey : 26 % rate the U.S. favorably , similar to the 25 % in the same March 2003 poll . Ratings for U.S. President Donald Trump have been low in these nations throughout his presidency , and that trend continues this year . Trump ’s most negative assessment is in Belgium , where only 9 % say they have confidence in the U.S. president to do the right thing in world affairs . His highest rating is in Japan ; still , just one - quarter of Japanese express confidence in Trump .",same,"Describe the rates of people of UK, France and German who express a favorable opinion of the U.S.?",same,"just 41 % in the United Kingdom express a favorable opinion of the U.S. In France , only 31 % see the U.S. positively Germans give the U.S. particularly low marks on the survey : 26 %","just 41 % in the United Kingdom express a favorable opinion of the U.S. In France , only 31 % see the U.S. positively Germans give the U.S. particularly low marks on the survey : 26 %","In France , only 31 see positively Germans give particularly low marks on survey : 26","",""
mturk_charts/no_data/multi_col/609.png,"The publics surveyed also see Trump more negatively than other world leaders . Among the six leaders included on the survey , Angela Merkel receives the highest marks : A median of 76 % across the nations polled have confidence in the German chancellor . French President Emmanuel Macron also gets largely favorable reviews . Ratings for British Prime Minister Boris Johnson are roughly split . Ratings for Russian President Vladimir Putin and Chinese President Xi Jinping are overwhelmingly negative , although not as negative as those for Trump .",same,"How Trump is seen in relation to other world leaders?",answer1,"The publics surveyed also see Trump more negatively than other world leaders .","The publics surveyed also see Trump more negatively than other world leaders .","","",""
mturk_charts/no_data/multi_col/632.png,"Majority continues to say that Americans can solve problems . Despite the pandemic and the grim national mood , a majority of adults ( 57 % ) continue to say that , as Americans , we can always find ways to solve our problems and get what we want . This is essentially unchanged since September 2019 , when 55 % expressed optimism in the country ’s ability to solve its problems . Republicans are somewhat more likely than Democrats to say that Americans can always find ways to solve our problems . Nearly two - thirds of Republicans say this ( 65 % ) , compared with half of Democrats .",same,"What is the opinion of most Americans about the country being able to find ways to solve its problems?",answer1,"Majority continues to say that Americans can solve problems a majority of adults ( 57 % ) continue to say that as Americans we can always find ways to solve our problems and get what we want","Majority continues to say that Americans can solve problems a majority of adults ( 57 % ) continue to say that as Americans we can always find ways to solve our problems and get what we want","","",""
mturk_charts/no_data/multi_col/644.png,"One - in - seven U.S. adults ( 14 % ) say they have tested positive for COVID-19 or are “ pretty sure ” they have had it despite not receiving an official diagnosis , according to a Pew Research Center survey conducted Aug. 3 to 16 . The survey also finds a sharp increase since the spring in the share of Americans who say they know someone else who has been hospitalized or died due to COVID-19 .",same,"Is it possible to COVID-19 official statistics might be fragile due to the non-diagnosticated cases?",answer1,"One - in - seven U.S. adults ( 14 % ) say they have tested positive for COVID-19 or are “ pretty sure ” they have had it despite not receiving an official diagnosis , according to a Pew Research Center survey conducted Aug. 3 to 16 . The survey also finds a sharp increase since the spring in the share of Americans who say they know someone else who has been hospitalized or died due to COVID-19","One - in - seven U.S. adults ( 14 % ) say they have tested positive for COVID-19 or are “ pretty sure ” they have had it despite not receiving an official diagnosis , according to a Pew Research Center survey conducted Aug. 3 to 16 . The survey also finds a sharp increase since the spring in the share of Americans who say they know someone else who has been hospitalized or died due to COVID-19","","",""
mturk_charts/no_data/multi_col/646.png,"A majority of Black Americans ( 57 % ) say they personally know someone who has been hospitalized or died as a result of having COVID-19 . Some 46 % of Hispanic adults say the same , compared with about a third of White ( 34 % ) and Asian adults ( 32 % ) . The share of Hispanic Americans who know someone who has been hospitalized or died due to COVID-19 has more than doubled since the spring survey , when 19 % said this .",same,"Describe ethnic groups data towards COVID-19 pandemic?",answer2,"A majority of Black Americans ( 57 % ) say they personally know someone who has been hospitalized or died as a result of having COVID-19 . Some 46 % of Hispanic adults say the same , compared with about a third of White ( 34 % ) and Asian adults ( 32 % )","A majority of Black Americans ( 57 % ) say they personally know someone who has been hospitalized or died as a result of having COVID-19 . Some 46 % of Hispanic adults say the same , compared with about a third of White ( 34 % ) and Asian adults ( 32 % )","","",""
