img_path,"summary",question_resolution,"question",answer_resolution,"abstractive_answer","extractive_answer","decontextualizated_text_added","decontextualizated_text_removed","extra_added_text"
mturk_charts/no_data/multi_col/650.png,"In the wake of the 2016 presidential campaign , Facebook users were more likely to press the “ anger ” button than the “ love ” button in response to lawmakers ’ posts on the platform . But a new Pew Research Center analysis finds that this trend has shifted in recent years , and that lawmakers received more love than anger reactions to their posts in 2019 and 2020 . In both 2017 and 2018 , Facebook posts by members of Congress received around 5 million more “ angry ” reactions than “ love ” reactions . But love reactions overtook anger in 2019 , and lawmakers have received roughly 2 million more love than anger reactions in the first seven months of 2020 .",same,"What is the trend of reactions to Facebook posts by lawmakers?",answer2,"lawmakers received more love than anger reactions to their posts in 2019 and 2020 . In both 2017 and 2018 Facebook posts by members of Congress received around 5 million more “ angry ” reactions than “ love ” reactions . But love reactions overtook anger in 2019 , and lawmakers have received roughly 2 million more love than anger reactions in the first seven months of 2020","lawmakers received more love than anger reactions to their posts in 2019 and 2020 . In both 2017 and 2018 Facebook posts by members of Congress received around 5 million more “ angry ” reactions than “ love ” reactions . But love reactions overtook anger in 2019 , and lawmakers have received roughly 2 million more love than anger reactions in the first seven months of 2020","","Pew Research Center analysis finds that this trend has shifted recent years that",""
mturk_charts/no_data/multi_col/657.png,"Florida and Texas are home to the highest shares of Latinos among immigrant eligible voters . About 54 % of naturalized citizens who are eligible voters in Florida are Latino , the highest in the nation . Texas ( 52 % ) is the only other state where Latinos make up at least half of immigrant eligible voters .",same,"What is the ratio of eligible voter Latinos in Florida and Texas ?",answer1,"About 54 % of naturalized citizens who are eligible voters in Florida are Latino , the highest in the nation . Texas ( 52 % ) is the only other state where Latinos make up at least half of immigrant eligible voters","About 54 % of naturalized citizens who are eligible voters in Florida are Latino , the highest in the nation . Texas ( 52 % ) is the only other state where Latinos make up at least half of immigrant eligible voters","","",""
mturk_charts/no_data/multi_col/662.png,"Overall , 44 % of Americans now say that it is a lot more difficult to be a Black person in the U.S. than it is to be a White person , while 32 % say it is a little more difficult and 23 % say it is no more difficult . The share saying it is a lot more difficult to be Black than White is now 9 percentage points higher than it was in the summer of 2016 . But while overall views have shifted , the shift has come exclusively from within the Democratic coalition . The attitudes of Trump supporters today look very similar to attitudes of Trump supporters four years ago : 45 % of Trump voters now say that it is no more difficult to be a Black person in the U.S. than to be a White person , while 44 % say Black people have it a little more difficult . Only about one - in - ten Trump supporters say that Black people have it a lot more difficult than White people . But while overall views have shifted , the shift has come exclusively from within the Democratic coalition . The attitudes of Trump supporters today look very similar to attitudes of Trump supporters four years ago : 45 % of Trump voters now say that it is no more difficult to be a Black person in the U.S. than to be a White person , while 44 % say Black people have it a little more difficult . Only about one - in - ten Trump supporters say that Black people have it a lot more difficult than White people .",same,"What is the opinion of American voters about being a black or white person in U.S. ?",answer1,"Overall , 44 % of Americans now say that it is a lot more difficult to be a Black person in the U.S. than it is to be a White person , while 32 % say it is a little more difficult and 23 % say it is no more difficult","Overall , 44 % of Americans now say that it is a lot more difficult to be a Black person in the U.S. than it is to be a White person , while 32 % say it is a little more difficult and 23 % say it is no more difficult","","",""
mturk_charts/no_data/multi_col/664.png,"The pattern of opinion on the question of whether White people benefit from societal advantages Black people do not have is largely parallel , with a larger share of voters now saying that White people benefit a great deal from advantages in society that Black people do n’t have . While Biden ’s supporters are substantially more likely to say that White people have advantages than Clinton supporters were in 2016 ( 59 % today , 40 % then ) , just 5 % of Trump supporters say this today – little different than the 4 % who said this in 2016 .",same,"What is the trend in Biden's supporters in saying white people have advantages over black people ?",answer1,"While Biden ’s supporters are substantially more likely to say that White people have advantages than Clinton supporters were in 2016 ( 59 % today , 40 % then","While Biden ’s supporters are substantially more likely to say that White people have advantages than Clinton supporters were in 2016 ( 59 % today , 40 % then","","",""
mturk_charts/no_data/multi_col/665.png,"Today , 72 % of Trump voters say that obstacles that once made it harder for women are now largely gone , up from 67 % in 2016 . By contrast , just 20 % of Biden voters currently say this – a modest decline from the 26 % among Clinton voters in 2016 .",same,"Describe the trend among Trump voters towards eliminating the problems that make things harder for women since 2016?",same,"Today , 72 % of Trump voters say that obstacles that once made it harder for women are now largely gone , up from 67 % in 2016","Today , 72 % of Trump voters say that obstacles that once made it harder for women are now largely gone , up from 67 % in 2016","","",""
mturk_charts/no_data/multi_col/666.png,"When asked about societal priorities around family , voters are somewhat less likely to say that society is better off if people make marriage and having children a priority than they were four years ago ( 36 % today , 42 % in 2016 ) . As was the case in 2016 , a slim majority of Trump ’s voters this year say this ( 55 % today , 57 % in 2016 ) . But Biden voters are slightly more likely today to say that society is just as well off if people have priorities other than marriage and children than Clinton voters were in 2016 ( 77 % today , 69 % in 2016 ) .",same,"What is the opinion of voters about the fact that society is better off if people make marriage and having children a priority than it was four years ago?",answer1,"voters are somewhat less likely to say that society is better off if people make marriage and having children a priority than they were four years ago ( 36 % today , 42 % in 2016 )","voters are somewhat less likely to say that society is better off if people make marriage and having children a priority than they were four years ago ( 36 % today , 42 % in 2016 )","","",""
mturk_charts/no_data/multi_col/667.png,"In 2016 voters were about evenly divided in the share saying that the growing number of newcomers strengthens American society ( 46 % ) and the share who said they threaten traditional American customs and values ( 50 % ) . Today , six - in - ten American voters ( 60 % ) say that newcomers strengthen American society and 37 % say they threaten traditional customs and values . Supporters of both major party candidates this year are more likely than 2016 supporters to have positive views of immigrants to the United States , but the gap between supporters of the Republican and Democratic candidates is little different than it was four years ago . Today , more than eight - in - ten Biden supporters ( 84 % ) say the growing share of newcomers in the U.S. strengthens American society , up from 71 % among Clinton supporters in 2016 . By comparison , a much smaller share of Trump supporters ( 32 % ) view immigration as strengthening society . Still , that is up from just 19 % among Trump supporters in 2016 .",same,"What are the trend of American voters say that newcomers strengthen American society from 2016 to 2020?",answer2,"In 2016 voters were about evenly divided in the share saying that the growing number of newcomers strengthens American society ( 46 % ) . Today , six - in - ten American voters ( 60 % ) say that newcomers strengthen American society","In 2016 voters were about evenly divided in the share saying that the growing number of newcomers strengthens American society ( 46 % ) . Today , six - in - ten American voters ( 60 % ) say that newcomers strengthen American society",".","",""
mturk_charts/no_data/multi_col/668.png,"Four years ago , a narrow majority ( 54 % ) of voters said that Islam was more likely than other religions to encourage violence among its followers . Today , the balance of opinion has shifted in the other direction , with 45 % of voters saying that Islam is more likely to encourage violence and 51 % saying it does not encourage violence more than other religions .",same,"What is the trend in voters opinion on Islam and violence since 2016 ?",same,"Four years ago , a narrow majority ( 54 % ) of voters said that Islam was more likely than other religions to encourage violence among its followers . Today , the balance of opinion has shifted in the other direction , with 45 % of voters saying that Islam is more likely to encourage violence and 51 % saying it does not encourage violence more than other religions","Four years ago , a narrow majority ( 54 % ) of voters said that Islam was more likely than other religions to encourage violence among its followers . Today , the balance of opinion has shifted in the other direction , with 45 % of voters saying that Islam is more likely to encourage violence and 51 % saying it does not encourage violence more than other religions","","",""
mturk_charts/no_data/multi_col/671.png,"At the same time , the public ’s views varied by the level of importance they placed on the internet during this time . While 44 % of Americans who said the internet has been essential to them personally during this outbreak believed the government has a responsibility during the pandemic to ensure that all Americans have high - speed internet access , these shares were smaller among those who deemed the internet as important but not essential ( 31 % ) and those who described the internet during this time as not too or not at all important ( 25 % ) .",same,"What is the opinion of U.S. adults about governments responsibility in providing internet access during covid-19 outbreak ?",answer1,"While 44 % of Americans who said the internet has been essential to them personally during this outbreak believed the government has a responsibility during the pandemic to ensure that all Americans have high - speed internet access , these shares were smaller among those who deemed the internet as important but not essential ( 31 % ) and those who described the internet during this time as not too or not at all important ( 25 % ) .","While 44 % of Americans who said the internet has been essential to them personally during this outbreak believed the government has a responsibility during the pandemic to ensure that all Americans have high - speed internet access , these shares were smaller among those who deemed the internet as important but not essential ( 31 % ) and those who described the internet during this time as not too or not at all important ( 25 % ) .","","",""
mturk_charts/no_data/multi_col/676.png,"Most teens report attending religious services with either both ( 40 % ) or one ( 25 % ) of their parents . Another 7 % say they generally attend with other people , such as grandparents , other family members or friends . Just 1 % say they attend worship services alone . Roughly one - quarter say they never attend religious services or declined to answer the question .",same,"What is the trend among teenagers in attending religious services with family members ?",answer1,"Most teens report attending religious services with either both ( 40 % ) or one ( 25 % ) of their parents . Another 7 % say they generally attend with other people , such as grandparents , other family members or friends . Just 1 % say they attend worship services alone . Roughly one - quarter say they never attend religious services or declined to answer the question .","Most teens report attending religious services with either both ( 40 % ) or one ( 25 % ) of their parents . Another 7 % say they generally attend with other people , such as grandparents , other family members or friends . Just 1 % say they attend worship services alone . Roughly one - quarter say they never attend religious services or declined to answer the question .","","",""
mturk_charts/no_data/multi_col/679.png,"Many U.S. teens report having religious or spiritual experiences at least once or twice a month . Half feel a deep sense of spiritual peace and well - being at least monthly , while 46 % say they think about the meaning and purpose of life and 40 % report feeling a deep sense of wonder about the universe . The most common experience is a strong feeling of gratitude or thankfulness , reported by 77 % of teens in the survey .",same,"What is the opinion of U.S. teens about feeling religious or spiritual experiences ?",answer1,"while 46 % say they think about the meaning and purpose of life and 40 % report feeling a deep sense of wonder about the universe . The most common experience is a strong feeling of gratitude or thankfulness , reported by 77 % of teens in the survey","while 46 % say they think about the meaning and purpose of life and 40 % report feeling a deep sense of wonder about the universe . The most common experience is a strong feeling of gratitude or thankfulness , reported by 77 % of teens in the survey","","",""
mturk_charts/no_data/multi_col/692.png,"Broadly speaking , older people across the 14 countries are more concerned by security threats . In the case of terrorism , for instance , a median of 72 % among those ages 50 and older say it is a major threat , compared with 53 % among those who are 18 to 29 . Similar age gaps appear in concerns about cyberattacks and the spread of nuclear weapons .",same,"What percentage of old people and teens concerned about terrorism ?",answer1,"a median of 72 % among those ages 50 and older say it is a major threat , compared with 53 % among those who are 18 to 29","a median of 72 % among those ages 50 and older say it is a major threat , compared with 53 % among those who are 18 to 29","","",""
mturk_charts/no_data/multi_col/693.png,"And when it comes to the global economy , those who say the economy in their country is doing poorly or are concerned about the future of their economy are more likely to see the condition of the global economy as a major threat .",same,"What is the relation between economy of a country and global economy as per people's opinion ?",answer1,"those who say the economy in their country is doing poorly or are concerned about the future of their economy are more likely to see the condition of the global economy as a major threat .","those who say the economy in their country is doing poorly or are concerned about the future of their economy are more likely to see the condition of the global economy as a major threat .","","",""
mturk_charts/no_data/multi_col/712.png,"Protestants made up a majority of those voting Republican in 2018 , just as they did in 2016 . Overall , 57 % of GOP House voters were Protestant , compared with just a third ( 32 % ) of Democratic voters . Catholics made up a slightly higher share of Republican voters as well ( 22 % vs. 16 % of Democratic voters ) . Voters who were unaffiliated with any religious tradition ( atheists , agnostics and those who describe themselves as “ nothing in particular ” ) make up 42 % of Democratic voters but just 15 % of Republican voters .",same,"Describe the partisan trend between Protestants and Catholics in the US?",same,"Protestants made up a majority of those voting Republican in 2018 , just as they did in 2016 . Overall , 57 % of GOP House voters were Protestant , compared with just a third ( 32 % ) of Democratic voters . Catholics made up a slightly higher share of Republican voters as well ( 22 % vs. 16 % of Democratic voters )","Protestants made up a majority of those voting Republican in 2018 , just as they did in 2016 . Overall , 57 % of GOP House voters were Protestant , compared with just a third ( 32 % ) of Democratic voters . Catholics made up a slightly higher share of Republican voters as well ( 22 % vs. 16 % of Democratic voters )","","",""
mturk_charts/no_data/multi_col/717.png,"In an April survey , two - thirds of U.S. adults said the coronavirus outbreak is likely to significantly disrupt Americans ’ ability to vote in November . Around a quarter of adults ( 23 % ) said a significant disruption is very likely , while another 44 % said it is somewhat likely . Democrats and Democratic - leaning independents were 30 percentage points more likely than Republicans and GOP leaners ( 80 % vs. 50 % ) to say it is at least somewhat likely that COVID-19 will significantly disrupt the election . ( The survey was conducted relatively early into the U.S. coronavirus outbreak , before cases and deaths spiked across much of the country . It ’s possible attitudes may have changed since then . )",same,"Describe the proportion of American adults who say the coronavirus outbreak is likely to significantly affect Americans' ability to vote in November 2020?",answer1,"two - thirds of U.S. adults said the coronavirus outbreak is likely to significantly disrupt Americans ’ ability to vote in November . Around a quarter of adults ( 23 % ) said a significant disruption is very likely , while another 44 % said it is somewhat likely .","two - thirds of U.S. adults said the coronavirus outbreak is likely to significantly disrupt Americans ’ ability to vote in November . Around a quarter of adults ( 23 % ) said a significant disruption is very likely , while another 44 % said it is somewhat likely .",". Around a quarter ( 23 % ) a significant disruption very , while another 44 % it somewhat .","",""
mturk_charts/no_data/multi_col/718.png,"In the same survey , Republicans were far more likely than Democrats to express confidence that the election will be conducted fairly and that all citizens who want to vote will be able to do so . Overall , majorities of Americans said they are at least somewhat confident that the election will be conducted fairly and accurately ( 59 % ) and that all citizens who want to vote will be able to do so ( 63 % ) . But Republicans were far more likely than Democrats to express confidence on both fronts . Three - quarters of Republicans expressed confidence that the election will be fair and accurate , compared with 46 % of Democrats . An even larger majority of Republicans ( 87 % ) said they are confident that all citizens who want to vote will be able to , compared with just 43 % of Democrats .",same,"What is the partisan bias of those who are confident that the election will be conducted fairly and that all citizens will be able to vote if they want to vote?",answer1,"Republicans were far more likely than Democrats to express confidence that the election will be conducted fairly and that all citizens who want to vote will be able to do so Three - quarters of Republicans expressed confidence that the election will be fair and accurate , compared with 46 % of Democrats . An even larger majority of Republicans ( 87 % ) said they are confident that all citizens who want to vote will be able to , compared with just 43 % of Democrats .","Republicans were far more likely than Democrats to express confidence that the election will be conducted fairly and that all citizens who want to vote will be able to do so Three - quarters of Republicans expressed confidence that the election will be fair and accurate , compared with 46 % of Democrats . An even larger majority of Republicans ( 87 % ) said they are confident that all citizens who want to vote will be able to , compared with just 43 % of Democrats .","","",""
mturk_charts/no_data/multi_col/719.png,"Far more voters expect voting to be difficult this year than in 2018 , according to a survey of registered voters conducted July 27 to Aug. 2 . Around half of registered voters ( 49 % ) said they expect voting to be very or somewhat difficult this year , while the other half ( 50 % ) expect it to be very or somewhat easy . That represents a major change from October 2018 , when just 15 % of voters said they expected voting in that year ’s midterms to be difficult and 85 % said they expected it to be easy .",same,"What is the opinion of registered voters about the difficulty of voting they expects this year ?",same,"according to a survey of registered voters conducted July 27 to Aug. 2 . Around half of registered voters ( 49 % ) said they expect voting to be very or somewhat difficult this year , while the other half ( 50 % ) expect it to be very or somewhat easy","according to a survey of registered voters conducted July 27 to Aug. 2 . Around half of registered voters ( 49 % ) said they expect voting to be very or somewhat difficult this year , while the other half ( 50 % ) expect it to be very or somewhat easy","","",""
mturk_charts/no_data/multi_col/721.png,"Democrats and Republicans also differ over so - called “ no excuse ” absentee or early voting , according to a separate survey conducted in June . Overall , 65 % of U.S. adults said voters should be allowed to vote early or absentee without a documented reason , but Democrats were nearly twice as likely as Republicans to hold this view ( 83 % vs. 44 % ) . Among the one - third of Americans who said early or absentee voting should be allowed only with a documented reason , Republicans were much more likely than Democrats to say COVID-19 should not be considered a valid reason .",same,"What is the opinion of U.S. adults about early or absentee voting ?",same,"Overall , 65 % of U.S. adults said voters should be allowed to vote early or absentee without a documented reason","Overall , 65 % of U.S. adults said voters should be allowed to vote early or absentee without a documented reason","","",""
mturk_charts/no_data/multi_col/722.png,"There are fundamental partisan differences over whether elections would be less secure if the rules were changed to make it easier for people to register and vote , according to the June survey . Overall , six - in - ten U.S. adults said elections would not be less secure , while 37 % said they would be . But while around eight - in - ten Democrats ( 79 % ) said that making it easier to vote would not make elections any less secure , a majority of Republicans ( 59 % ) said the opposite .",same,"What is the opinion of Democrats and Republicans about making voting easier and election security ?",answer1,"eight - in - ten Democrats ( 79 % ) said that making it easier to vote would not make elections any less secure , a majority of Republicans ( 59 % ) said the opposite .","eight - in - ten Democrats ( 79 % ) said that making it easier to vote would not make elections any less secure , a majority of Republicans ( 59 % ) said the opposite .","","",""
mturk_charts/no_data/multi_col/735.png,"Majority says significant changes are needed in structure of government . A 62 % majority of the public says that significant changes are needed in the fundamental design and structure of American government to make it work for current times ; 37 % say the design and structure of government serves the country well , and significant changes are not needed . While views among the public overall have changed little since 2018 , Democrats and Republicans have moved further apart in their opinions . Currently , 79 % of Democrats say significant changes in the structure of government are needed , compared with 41 % of Republicans .",same,"What is the opinion of the public about changing fundamental design and structure of American government ?",answer2,"Majority says significant changes are needed in structure of government A 62 % majority of the public says that significant changes are needed in the fundamental design and structure of American government to make it work for current times 37 % say the design and structure of government serves the country well , and significant changes are not needed 79 % of Democrats say significant changes in the structure of government are needed , compared with 41 % of Republicans .","Majority says significant changes are needed in structure of government A 62 % majority of the public says that significant changes are needed in the fundamental design and structure of American government to make it work for current times 37 % say the design and structure of government serves the country well , and significant changes are not needed 79 % of Democrats say significant changes in the structure of government are needed , compared with 41 % of Republicans .","","",""
