img_path,summary,category
mturk_charts/no_data_remaining/multi_col/882.png,"Views about environmental regulations are more partisan today than they were a decade ago. Roughly six-in-ten Republicans and Republican leaners (58%) said in another 2016 Pew Research Center survey that environmental laws and regulations cost too many jobs and hurt the economy, up from 34% in 2007. By comparison, a declining share of Democrats and Democratic leaners hold this view. This partisan gap now stands at 41 percentage points; in 2007, it was 10 points.",good
mturk_charts/no_data_remaining/multi_col/883.png,"Millennial workers, those ages 18 to 35, are just as likely to stick with their employers as their older counterparts in Generation X were when they were young adults, according to recently released government data. And among the college-educated, Millennials have longer track records with their employers than Generation X workers did in 2000 when they were the same age as today’s Millennials. In January 2016, 63.4% of employed Millennials, the generation born between 1981 and 1998, reported that they had worked for their current employer at least 13 months. In February 2000, somewhat fewer 18- to 35-year-olds (59.9%) – most of whom are today’s Gen Xers – reported similar job tenure. Looking at young workers with longer tenures, 22% of Millennial workers had been with their employer for at least five years as of 2016, similar to the share of Gen X workers (21.8%) in 2000.",good
mturk_charts/no_data_remaining/multi_col/884.png,"These college-educated Millennials are sticking with their jobs longer than their Gen X counterparts. About 75% of college-educated 25- to 35-year-olds (75% for men and 74% for women) had worked for their employer at least 13 months in 2016. Back in 2000, somewhat fewer college-educated Gen X women (70%) had been on the job that long. Among college-educated Gen X men, 72% had similar tenure. The increasing job tenure of college-educated Millennials is consistent with a decline in employer switching among all working-age adults since the 1980s. The reasons for the decline are not well understood. Recent research indicates that the rise of dual-career households, the decline in middle-skill jobs, occupational licensing and the need for employees to retain health insurance cannot account for much of the decline in job-switching. The trend is different among less-educated young adults. For example, among Millennials with a high school education, 70% of men and 69% of women had been with their employer at least 13 months. These proportions are similar to their high-school-educated counterparts among today’s Gen Xers in 2000 (72% for men and 71% for women).",good
mturk_charts/no_data_remaining/multi_col/885.png,"Americans who have heard of the House Freedom Caucus are more likely to have negative than positive views of it. Overall, 36% of these adults view the group favorably and 48% view it unfavorably, and opinions vary sharply by political affiliation. Among Republicans and Republican-leaning independents who have heard of the caucus, 59% view it favorably and 25% view it unfavorably. The reverse is true among Democrats and Democratic leaners: About two-thirds (66%) of those who have heard of the group view it unfavorably, while one-in-five (19%) view it favorably. Among conservative Republicans who have heard of the caucus, 67% view it favorably; among liberal Democrats who have heard of the group, 74% view it unfavorably.",good
mturk_charts/no_data_remaining/multi_col/886.png,"But the Democratic Party has made sharp gains compared with a year ago on several issues – notably, foreign policy and immigration. Currently, 49% of Americans say the Democratic Party is better able to make wise decisions about foreign policy, while 36% favor the GOP. A year ago, Republicans were favored on foreign policy, 46% to 38%. Democrats also lead on dealing with immigration, 50% to 39%; in recent years, the parties have run about even on this issue. And, with budget debates looming this month in Congress, 48% say the Democratic Party better represents their views on government spending, while 40% say the Republican Party does.",good
mturk_charts/no_data_remaining/multi_col/887.png,"Among the public overall, 62% say they are bothered “a lot” by the feeling that some corporations don’t pay their fair share of taxes, and 60% say the same about some wealthy people not paying their fair share. About four-in-ten (43%) say they are bothered a great deal by the complexity of the system. But with the April 18 tax filing deadline approaching, only about a quarter (27%) say they are bothered a lot by the amount they pay in taxes. And just 20% say that about the feeling that the poor do not pay their fair share of taxes. The latest national survey by Pew Research Center, conducted April 5-11, 2017 among 1,501 adults, finds an increase in the share saying that the tax system is unfair, largely because of a shift in opinion among Democrats.",good
mturk_charts/no_data_remaining/multi_col/888.png,"Two years ago, a 55% majority of Republicans said they were bothered a lot by the feeling that some corporations did not pay their fair share of taxes. Today, 44% of Republicans express this concern. Among Democrats, there has been virtually no change in the share saying they are bothered a lot by corporations not paying their fair share (73% then, 75% today). Similarly, today, a smaller share of Republicans is bothered a lot by the feeling that some wealthy people do not pay their fair share of taxes (49% in 2015, 40% today). Again, there has been little change among Democrats in this view (71% then, 76% today).",good
mturk_charts/no_data_remaining/multi_col/889.png,"In the same year, blacks made up 17% of the DOD active-duty military – somewhat higher than their share of the U.S. population ages 18 to 44 (13%). Blacks have consistently been represented in greater shares among enlisted personnel (19% in 2015) than among the commissioned officers (9%). The share of the active-duty force that is Hispanic has risen rapidly in recent decades. In 2015, 12% of all active-duty personnel were Hispanic, three times the share in 1980.",good
mturk_charts/no_data_remaining/multi_col/890.png,"In 1970, 69% of adults were married, and they paid 80% of all federal income taxes. As of 2014, the share of married adults had dropped to half of the adult population (50%) but the share of income taxes paid by them fell much less, to 74%.",good
mturk_charts/no_data_remaining/multi_col/891.png,"This marriage and education gap has widened as the share of high school graduates who are married has fallen more sharply than the share of college graduates who are married. In 2015, 45% of adults ages 18 and older with a high school degree but no college experience were married. This compares with 62% among those with a bachelor’s degree or higher.",good
mturk_charts/no_data_remaining/multi_col/892.png,"Europe in 2015 saw a rise in social hostilities involving religion, particularly against the continent’s Muslims, according to a new Pew Research Center study on global religious restrictions. Muslims faced social hostilities in seven-in-ten (71%) countries in Europe, an increase from 58% the year before.",good
mturk_charts/no_data_remaining/multi_col/893.png,"After a period of steady growth, the number of inmates held in private prisons in the United States has declined modestly in recent years and continues to represent a small share of the nation’s total prison population. In 2015, the most recent year for which data are available, about 126,000 prisoners were held in privately operated facilities under the jurisdiction of 29 states and the federal Bureau of Prisons. That’s an 83% increase since 1999, the first year with comparable data, according to the Bureau of Justice Statistics (BJS). By comparison, the total U.S. prison population increased 12% during that span. In more recent years, however, both the private and overall U.S. prison populations have declined at modest rates. The private prison population has shrunk by 8% since its peak in 2012, while the overall prison population has fallen by 5% since its peak in 2009. (The state private prison population peaked in 2012 with 96,774 prisoners, while the federal private prison population reached its peak a year later in 2013, with 41,159 prisoners.) Since 1999 – the first year BJS began collecting data on private prisons – inmates in privately run facilities have made up a small share of all U.S. prisoners. In 2015, just 8% of the nearly 1.53 million state and federal prisoners in the U.S. were in private facilities, up slightly from 5% in 1999.",complex
mturk_charts/no_data_remaining/multi_col/894.png,"Government harassment and use of force against members of religious groups surged around the world in 2015, according to a new Pew Research Center study on global religious restrictions. But nowhere was this trend more pronounced than in Europe, where over half of countries (53%) saw an increase from the previous year. More specifically, governments of 38 European countries (84%) harassed religious groups in limited or widespread ways in 2015, while the governments of 24 countries in Europe (53%) used some type of force against religious groups. In addition to recording the biggest increase in government harassment and use of force against religious groups, Europe also had the second-largest overall share of countries (89%) that exhibited these types of actions. Only the Middle East-North Africa region (95%) had more governments that harassed or used force against religious groups. Sub-Saharan Africa, the Americas and the Asia-Pacific region had lower shares of government harassment or use of force against religious groups, although over seven-in-ten countries in each region had these types of government restrictions.",complex
mturk_charts/no_data_remaining/multi_col/895.png,"In addition to recording the biggest increase in government harassment and use of force against religious groups, Europe also had the second-largest overall share of countries (89%) that exhibited these types of actions. Only the Middle East-North Africa region (95%) had more governments that harassed or used force against religious groups. Sub-Saharan Africa, the Americas and the Asia-Pacific region had lower shares of government harassment or use of force against religious groups, although over seven-in-ten countries in each region had these types of government restrictions. In total, 32 European governments (71%) specifically harassed Muslims during 2015, up from 27 governments (60%) the year before. The Middle East-North Africa region was the only region to have a larger share of countries that harassed Muslims (75%).",good
mturk_charts/no_data_remaining/multi_col/896.png,"On the other hand, fewer current broadband users know what their own internet access speed is. When asked what download speed they have for their own home internet service, 47% were not able to provide an answer. The remaining users offered a range of estimates, from 10 megabits per second or less (which is how 5% of current subscribers describe their connection speed) to 100 Mbps or more (12%).",good
mturk_charts/no_data_remaining/multi_col/897.png,"Federal law enforcement agencies are making more arrests for immigration-related offenses and fewer arrests for other types of offenses – including drug, property and gun crimes – than they were a decade ago, according to a Pew Research Center analysis of new data from the Bureau of Justice Statistics. Half (50%) of the 165,265 total arrests made by the federal government in fiscal 2014 – the most recent year for which statistics are available – were for immigration-related offenses, such as crossing the border illegally or smuggling others into the United States. A decade earlier, immigration-related offenses accounted for 28% of all federal arrests. At the same time, arrests for drug crimes fell from 23% of the total in 2004 to 14% in 2014. Those for supervision violations, such as probation or parole infractions, fell from 17% to 14%. Arrests for property crimes, including fraud and embezzlement, declined from 11% to 8%. And arrests for weapon offenses, such as possession of an unregistered firearm, fell from 7% to 4%.",good
mturk_charts/no_data_remaining/multi_col/898.png,"The figures, released by the bureau in March, count all arrests made by the federal government, ranging from traditional law enforcement entities, such as the Department of Justice (DOJ) and the Department of Homeland Security (DHS), to less traditional ones, such as the Interior and Treasury departments. They do not include arrests made by state and local authorities, which make the vast majority of U.S. arrests each year (nearly 99% in 2014). In 2014, DHS made 59% of all federal arrests, up from 37% in 2004 (the earliest year for which data are available following the department’s establishment in 2002). By comparison, DOJ made 35% of all federal arrests in 2014, down from 48% a decade earlier. In fact, just one agency within DHS – Customs and Border Protection – made more arrests in 2014 (64,954) than all of the agencies within DOJ combined (58,265). DOJ agencies include the FBI, the Drug Enforcement Agency, the Bureau of Alcohol, Tobacco, Firearms and Explosives and the U.S. Marshals Service.",good
mturk_charts/no_data_remaining/multi_col/899.png,"In 2014, 61% of all federal arrests involved non-U.S. citizens, up from 43% in 2004. U.S. citizens, by contrast, accounted for 39% of all arrests in 2014, down from 57% a decade earlier. (Totals omit cases in which records are missing or unknown.)",good
mturk_charts/no_data_remaining/multi_col/900.png,"This relative decline is largely attributable to the fact that religious “nones” are, on average, older and have fewer children than people who are affiliated with a religion. In 2015, for instance, the median age of people who belong to any of the world’s religions was 29, compared with 36 among the unaffiliated. And between 2010 and 2015, adherents of religions are estimated to have given birth to an average of 2.45 children per woman, compared with an average of 1.65 children among the unaffiliated. Between 2010 and 2015, there were a larger estimated number of births than deaths among religious “nones” in all regions, led by the Asia-Pacific region, which is home to a majority of the global religiously unaffiliated population. But this will change in the coming years. For people with no religion in Asia, for instance, the number of deaths will begin to exceed the number of births to unaffiliated mothers by 2030, a change driven by low fertility and a relatively old unaffiliated population in China, where over 60% of the world’s unaffiliated population currently resides. By 2035, unaffiliated deaths in Europe are expected to outnumber births there as well.",complex
mturk_charts/no_data_remaining/multi_col/901.png,"In the next half century or so, Christianity’s long reign as the world’s largest religion may come to an end, according to a just-released report that builds on Pew Research Center’s original population growth projections for religious groups. Indeed, Muslims will grow more than twice as fast as the overall world population between 2015 and 2060 and, in the second half of this century, will likely surpass Christians as the world’s largest religious group. While the world’s population is projected to grow 32% in the coming decades, the number of Muslims is expected to increase by 70% – from 1.8 billion in 2015 to nearly 3 billion in 2060. In 2015, Muslims made up 24.1% of the global population. Forty-five years later, they are expected to make up more than three-in-ten of the world’s people (31.1%).",good
mturk_charts/no_data_remaining/multi_col/902.png,"As marriage rates have fallen, the number of U.S. adults in cohabiting relationships has continued to climb, reaching about 18 million in 2016. This is up 29% since 2007, when 14 million adults were cohabiting, according to U.S. Census Bureau data. Roughly half of cohabiters – those living with an unmarried partner – are younger than 35. But an increasing number of Americans ages 50 and older are in cohabiting relationships, according to a new Pew Research Center analysis of the Current Population Survey. In fact, cohabiters ages 50 and older represented about a quarter (23%) of all cohabiting adults in 2016. Since 2007, the number of cohabiting adults ages 50 and older grew by 75%. This increase is faster than that of other age groups during this time period and is driven in part by the aging of Baby Boomers. In 2016, 4 million adults ages 50 and older were cohabiting – up from 2.3 million in 2007. By comparison, 8.9 million adults ages 18 to 34 were cohabiting last year, up from 7.2 million. While cohabitation is rising, cohabiters still make up relatively small portions of each age group – particularly among adults ages 50 and older. In total, 7% of U.S. adults were cohabiting in 2016. Just 4% of adults 50 and older were cohabiting. By comparison, 14% of Americans ages 25 to 34 were cohabiting – the highest share among the age groups analyzed here. Roughly one-in-ten adults ages 18 to 24 and 35 to 49 were cohabiting.",complex
mturk_charts/no_data_remaining/multi_col/903.png,"Americans have uniformly negative views of North Korea and its nuclear ambitions – a subject likely to be high on the agenda when President Donald Trump meets in Florida this week with Chinese President Xi Jinping. Overall, 78% of Americans have an unfavorable view of the communist nation ruled by Kim Jong Un, with 61% holding a very unfavorable opinion. Negative attitudes toward North Korea are shared across demographic groups, though more college-educated Americans hold negative views (91%) than do Americans with a high school education or less (69%). Unlike public opinion on other aspects of U.S. foreign policy, there are no significant partisan divides on attitudes toward North Korea.",good
mturk_charts/no_data_remaining/multi_col/904.png,"Roughly two-thirds of Americans (65%) are very concerned about North Korea having nuclear weapons. And 64% say that in the event of a serious conflict, the United States should use military force to defend its Asian allies, such as Japan, South Korea or the Philippines, against the Pyongyang regime, according to a new Pew Research Center survey. A further 61% think sanctions, rather than attempts at closer ties, are the best way to deal with the nuclear threat posed by the Democratic People’s Republic of Korea. When given an option between increasing economic sanctions against Kim Jong Un’s authoritarian regime to deal with its nuclear program or deepening ties with North Korea, 61% of Americans prefer increasing the already-severe sanctions that are in place. Only 28% say they want to deal with the nuclear issue by engaging more and deepening ties with the country. Republicans (70%) are keener on sanctions than Democrats (61%), as are older Americans (69%) compared with young people (49%).",good
mturk_charts/no_data_remaining/multi_col/906.png,"A new Pew Research Center survey finds 44% of Americans have a favorable opinion of China, up from 37% a year ago. The growth in positive ratings for China may be due in part to declining concerns about economic threats from China. The share of the public that sees the amount of U.S. debt held by Beijing, the loss of jobs to China and the trade deficit with China as very serious problems has dropped significantly in recent years. For example, 61% said the trade deficit was a very serious problem in 2012, compared with 44% today. Concerns about Chinese cyberattacks have, on the other hand, risen to 55% from 50% five years ago. Still, debt, trade and jobs have not disappeared as sources of concern for Americans, and overall about half the public (52%) continues to see China as more of an economic threat than a military one.",good
mturk_charts/no_data_remaining/multi_col/905.png,"A new Pew Research Center survey finds 44% of Americans have a favorable opinion of China, up from 37% a year ago. The growth in positive ratings for China may be due in part to declining concerns about economic threats from China. The share of the public that sees the amount of U.S. debt held by Beijing, the loss of jobs to China and the trade deficit with China as very serious problems has dropped significantly in recent years. For example, 61% said the trade deficit was a very serious problem in 2012, compared with 44% today. Concerns about Chinese cyberattacks have, on the other hand, risen to 55% from 50% five years ago.",good
mturk_charts/no_data_remaining/multi_col/907.png,"Although economic concerns about China have become less prevalent in recent years, many Americans are still worried about China’s economic strength. The amount of American debt held by China, for instance, is the top concern among the eight sources of tension between the two countries included in the survey. Large majorities of Americans consider all eight of these issues at least a somewhat serious problem for the U.S., and more than half say the amount of U.S. debt held by China, cyberattacks, China’s environmental impact and job losses are very serious problems.",good
mturk_charts/no_data_remaining/multi_col/908.png,"What a difference a year, and possibly an election, makes. Nearly six-in-ten people in the United States (58%) say the economic situation is very or somewhat good, according to a new Pew Research Center survey conducted Feb. 16-March 15. Last spring, 44% of the American public described the economy as good. This is the most positive assessment of U.S. economic conditions since 2007, and only the second time that half or more of those surveyed have given the economy a thumbs-up. Driving the latest increase is a jump among Republicans over the past year. The 14-percentage-point rise in overall public opinion about the economy since last year is the largest one-year improvement in public sentiment about economic conditions in the history of this survey. The current rosy assessment stands in stark contrast to where opinion stood immediately after the beginning of the financial crisis in spring 2008, when just 20% said economic conditions were good.",good
mturk_charts/no_data_remaining/multi_col/909.png,"Strikingly, there is currently no major partisan difference in public views of the economy. But the more positive public assessment of the economy these days has been driven by changing Republican attitudes. Roughly six-in-ten Republicans (61%) and Democrats (60%) say conditions are very or somewhat good, with sentiment among GOP supporters roughly doubling in the past year. More than half (54%) of independents agree. Just a year ago there was a 26-percentage-point partisan difference on economic conditions, with Democrats being far more bullish on the economy than Republicans. This was the case throughout the Obama administration.",good
mturk_charts/no_data_remaining/multi_col/910.png,"A majority (62%) of Republicans and Republican leaners in counties that went very strongly for Donald Trump in the general election (those where his share of the two-party vote was at least 40 percentage points greater than Hillary Clinton’s) said that when these disagreements happened, it was better to try to find common ground. In counties that Trump won less resoundingly, or those where Clinton prevailed, Republicans were less likely to seek common ground on politics and more likely to prefer to avoid talking about differences, according to the national survey conducted Nov. 29-Dec. 12 among 4,138 adults on Pew Research Center’s American Trends Panel. A similar pattern was evident among Democrats and Democratic leaners: 59% of those living in counties where Clinton defeated Trump by 40 points or more said it was better to address political differences, while 40% it was better to avoid talking about these differences. Among Democrats in strong Trump counties, opinion was almost the reverse: 61% said it was better to avoid raising political differences while just 39% said it was better to talk about them. The post-election survey found only modest partisan differences in how often people talked about Trump’s plans and policies in conversations in the weeks after the election. But the geographic pattern was different for Republicans than for Democrats in counties where one side or the other dominated. In counties that went strongly for Trump, 30% of Republicans and just 14% of Democrats said the president-elect’s plans came up “a lot” in conversation. Partisan differences were more modest in other counties. And in those counties where Clinton won decisively, 31% of Democrats and a similar share of Republicans (28%) said this topic came up a lot.",complex
mturk_charts/no_data_remaining/multi_col/911.png,"A decadelong economic recession has contributed to a historic number of people leaving Puerto Rico for the U.S. mainland. Between 2005 and 2015, Puerto Rico had a net loss of about 446,000 people to the mainland, with job-related (40%) and family or household reasons (39%) cited as primary causes among a plurality of those leaving. Puerto Rico’s population losses have affected nearly every county, or municipio, on the island. The population of San Juan, Puerto Rico’s capital and largest metro area, declined by 40,000 people (-10%) between 2005 and 2015, to 355,000, by far the largest numeric drop of any municipio.",good
