img_path,summary,category
mturk_charts/no_data_remaining/multi_col/638.png,"Not all issues divided the country along partisan lines. Americans across the political spectrum expressed rising worry about North Korea’s nuclear program following a series of increasingly advanced missile tests by the secretive Asian nation and an escalating war of words between Trump and the country’s leader, Kim Jong Un. Three-quarters of Americans said in October that they view North Korea’s nuclear program as a “major threat” to the U.S., up from 64% in January and as high a share as at any point since 2005. Majorities in both parties said the U.S. should take the North’s threats very seriously; that the North is really willing to follow through on its threats to use nuclear weapons against the U.S.; and that the North is capable of launching a missile that could reach the U.S. An overwhelming majority of Americans also said they believed Trump is “really willing” to use military force against North Korea.",good
mturk_charts/no_data_remaining/multi_col/639.png,"The national survey by Pew Research Center, conducted Nov. 29-Dec. 4 among 1,503 adults, finds that the public has negative assessments of the overall state of race relations in the U.S. A majority (56%) says race relations are generally bad, while 38% say they are generally good. Since May 2016, there has been an increase in the share of Americans who say race relations are getting worse – from 38% then to 44% today. Opinions about the overall state of race relations have grown more negative in recent years. Positive views reached a high shortly after Obama’s inauguration in 2009, when 66% said race relations were generally good. However, public views of race relations declined significantly in 2014 and 2015, following a number of high-profile shootings of unarmed black men. In August 2014, about as many said race relations were generally good (47%) as generally bad (44%). And by May 2015, views had grown even more negative: 61% called race relations generally bad, compared with just 34% who said they were generally good. A year later, in a major survey of the public’s attitudes about race and racial inequality, opinions about the state of race relations were divided (48% generally bad, 44% generally good). Today, a 56% majority expresses a negative view of race relations, while 38% say relations are generally good.",good
mturk_charts/no_data_remaining/multi_col/640.png,"As in the past, whites have a more positive view of race relations than do blacks or Hispanics. Currently, 40% of whites say race relations are generally good, compared with 28% of blacks and 33% of Hispanics who say this.",good
mturk_charts/no_data_remaining/multi_col/641.png,"The graph below shows how liberals and conservatives in Congress shared stories from different outlets, focusing only on the news outlets that were linked to most often (200 times or more) over the study period. A narrow boxed range in the graphic indicates the extent to which the outlet was linked to by liberals or conservatives in Congress. For example, Breitbart news was linked to nearly 700 times among Republican lawmakers (particularly more conservative Republicans) during the study period, and zero times by Democrats in Congress. On the opposite side of the spectrum, there were more than 1,100 links to the Huffington Post by congressional Democrats, but only 89 from Republican lawmakers. In contrast, outlets with a very wide boxed range – such as The Washington Post, The Hill and CNN – were linked to often by both liberals and conservatives in Congress. For example, news links to CNN were shared 1,011 times by Democrats in Congress during the study period, and 1,062 by congressional Republicans. After Trump won the 2016 presidential election, Democrats in Congress became increasingly likely to share national news on Facebook. Between Jan. 2, 2015, and Nov. 8, 2016 – the day of the presidential election – just 8% of congressional Democrats’ Facebook posts included links to national news stories. From Jan. 20 through July 20, 2017, however, that number doubled to 16%.",good
mturk_charts/no_data_remaining/multi_col/642.png,"After Trump won the 2016 presidential election, Democrats in Congress became increasingly likely to share national news on Facebook. Between Jan. 2, 2015, and Nov. 8, 2016 – the day of the presidential election – just 8% of congressional Democrats’ Facebook posts included links to national news stories. From Jan. 20 through July 20, 2017, however, that number doubled to 16%. The Center analyzed these reactions and found that, in response to posts from congressional Democrats, the proportion of reactions from the Facebook audience that used the “angry” button more than tripled after the election. From May 1 to Nov. 8, 2016, roughly 5% of reactions to national news links posted by congressional Democrats were “angry” reactions – yet between the election and July 20, 2017, fully 18% of all reactions to Democratic lawmakers’ news links were “angry.” Reactions to Republican-shared news links remained relatively stable. Between May 1 and Nov. 8, 2016, 9% of reactions to Republican posts were “angry,” compared with 10% between Nov. 9, 2016 and July 20, 2017.",good
mturk_charts/no_data_remaining/multi_col/643.png,"When they go to the store, which greeting do Americans prefer: “merry Christmas” or “happy holidays”? For some, this can be a sensitive question, but an increasing number of Americans do not seem to have strong feelings either way. About half of Americans (52%) now say it doesn’t matter how stores greet their customers over the holidays, up from 46% in 2012. About a third (32%) choose “merry Christmas” – down considerably from the 42% who said this five years ago. Republicans are much more likely than Democrats to say they prefer “merry Christmas.”",good
mturk_charts/no_data_remaining/multi_col/644.png,"As with many other attitudes, partisans’ trust in government tracks party control of the presidency. The share of Republicans and Republican-leaning independents who say they trust the government at least most of the time is higher today (22%) than during the Obama administration. Yet the current level of Republican trust in government is relatively low compared with past Republican administrations. The share of Republicans saying they trusted the government always or most of the time was much higher during most of George W. Bush’s presidency, and throughout the entire administrations of George H.W. Bush and Ronald Reagan. Just 15% of Democrats and Democratic leaners say they trust the federal government always or most of the time, which is lower than during the Obama administration and among the lowest levels of Democratic trust in government in the past 60 years. Democrats’ trust in government was about this low toward the end of Bush’s presidency in 2008.",good
mturk_charts/no_data_remaining/multi_col/645.png,"As with trust in the federal government, there has been little change in people’s feelings toward the government. As in the past, most say they are frustrated with the government (55%), while smaller shares are angry (24%) or basically content (17%).",good
mturk_charts/no_data_remaining/multi_col/646.png,"Nearly a year into Trump’s presidency, there has been a substantial increase in the share of Democrats expressing anger at the federal government. Currently, 29% of Democrats say they are angry at the government, which equals the share saying this in October 2006, before the midterm elections that year. About one-in-five Republicans (19%) say they are angry at the government, which is much lower than the share saying this through most of Obama’s administration. However, the share of Republicans expressing anger at the federal government is higher today than at points during the first six years of Bush’s presidency (question was not asked later in his administration).",good
mturk_charts/no_data_remaining/multi_col/647.png,"Israeli Prime Minister Benjamin Netanyahu receives extremely negative ratings from nations in the Middle East and North Africa. Only 7% in both Tunisia and Turkey, 1% in Jordan and 0% in Lebanon have a favorable view of Netanyahu. And the negative opinion in Jordan and Lebanon is particularly intense; 95% of Jordanians and 97% of Lebanese say they have a very unfavorable view.",good
mturk_charts/no_data_remaining/multi_col/648.png,"While the future of the Affordable Care Act is in question, the public increasingly thinks the law has had a positive impact on the country. Today, more Americans say the 2010 health care overhaul has had a mostly positive than mostly negative effect on the country (44% versus 35%), while 14% say it has not had much effect. As recently as April 2016, more Americans thought the law had had a negative impact on the country (44%) than said it had a positive effect (39%). Since 2013, the share of Americans saying the law has had a positive effect on the country has increased 20 percentage points, from 24% to 44%. In addition, the share saying the law has had a positive personal effect has ticked up over the past year. Today, about as many say its effect on them and their families has been mostly positive (28%) as say mostly negative (24%); nearly half (48%) say it has not had much personal effect. In April 2016, somewhat more said the law had impacted them negatively (31%) than positively (23%); 45% said it had not much of an effect.",good
mturk_charts/no_data_remaining/multi_col/649.png,Much of the increase in positive views of the impact of the Affordable Care Act – and support for the law – has come among Democrats. Two-thirds (67%) of Democrats and Democratic-leaning independents now say the law has had a positive effect on the country.,good
mturk_charts/no_data_remaining/multi_col/650.png,"Throughout the seven-year history of the health care law, opinions about it have tended to be more negative than positive – or, less frequently, divided. But in February, for the first time, a majority of the public approved of the law. That remains the case today, with 56% approving of the law. While that is little changed since February, support has jumped 12 percentage points since April 2016 (44%).",good
mturk_charts/no_data_remaining/multi_col/651.png,"Since then, there has been a sharp rise in the share of Democrats and Democratic-leaning independents who approve of the health care law (from 71% then to 85% today). By contrast, there has been very little change in views among Republicans (13% approved of the law then, 14% today).",good
mturk_charts/no_data_remaining/multi_col/652.png,"The U.S. has admitted more than 70,000 Iraqi and Afghan citizens over the past decade through special immigrant visa programs available to those who worked for the U.S. government during conflicts in their home countries, and Afghans account for a big majority of them, according to a Pew Research Center analysis of U.S. Department of State data. Recipients of these special visas served as interpreters or translators or performed other key jobs in Afghanistan or Iraq for the U.S. government and in doing so put themselves and their families in danger. More than two-thirds of special immigrant visas have gone to Afghans (48,601) since fiscal 2007 – the first year visas were awarded under the programs – while Iraqis have received 21,961 such visas. Totals include visas issued to the principal applicants who worked for the U.S. government, as well as their spouses and unmarried children younger than 21. (These special visas make up a small slice – about 1% – of the overall number of U.S. immigrant visas awarded from fiscal years 2007 to 2017.)",good
mturk_charts/no_data_remaining/multi_col/653.png,"Since Trump became president, his job approval ratings have been more polarized than past presidents during their first year in office. That remains the case today, but his job ratings are lower today among Republicans than they were in February. His ratings are virtually unchanged among Democrats. Currently, 76% of Republicans and Republican leaners approve of Trump’s job performance, compared with 84% who did so in February. Trump’s job approval among Democrats and Democratic leaners is 7%, about the same as in February (8%).",good
mturk_charts/no_data_remaining/multi_col/654.png,"Overall, views of the productivity of Congress are little changed over the past few years. When asked to compare the current Congress to recent sessions, about half of Americans (52%) say that it has accomplished less than usual, 8% say that it has accomplished more, and a third (33%) say that it has accomplished about the same amount as recent sessions of Congress.",good
mturk_charts/no_data_remaining/multi_col/655.png,"One metric – the number of new immigrants arriving in the U.S. each year – illustrates dramatically how immigration trends from Mexico and the three Central American nations, known collectively as the “Northern Triangle,” have diverged in recent years. According to U.S. Census Bureau data analyzed by Pew Research Center, about 115,000 new immigrants arrived from the Northern Triangle in 2014, double the 60,000 who entered the U.S. three years earlier. Meanwhile, the number of new arrivals from Mexico declined slightly from 175,000 in 2011 to 165,000 in 2014.",good
mturk_charts/no_data_remaining/multi_col/656.png,"The Colorado case has reached the high court amid a backdrop of rising societal acceptance of homosexuality and same-sex marriage. Seven-in-ten Americans now say homosexuality should be accepted by society, up from 51% who held this view in 2006. Even among Republicans and those who lean toward the GOP, a slim majority (54%) now say society should accept homosexuality.",complex
mturk_charts/no_data_remaining/multi_col/657.png,"While Muslims are still a relatively small share of Europe’s population (roughly 5%), they are set to continue rising as a percentage of Europe’s population, according to a new Pew Research Center analysis of demographic data. This is true even if immigration stops entirely in the coming decades, which is a highly unlikely scenario. And if migration to the continent continues at medium or high levels, the share of Europe’s population that is Muslim could more than double between now and 2050, according to the analysis, which defines Europe as the 28 European Union member states plus Norway and Switzerland.",good
mturk_charts/no_data_remaining/multi_col/658.png,"There’s more gray in the workforce. Americans ages 55 and older make up more than a fifth of the total labor force today (22.8%, seasonally adjusted), compared with 17.6% at the start of the Great Recession. Over the past decade, in fact, labor force participation has risen only among the 55-and-older contingent – from a seasonally adjusted 38.9% in December 2007 to 39.8% last month. (That continued a trend that began in the mid-1990s, though for the past eight years the 55-and-older participation rate has been fairly level.) As the population has aged and participation rates have fallen for people in their prime working years, 35- to 54-year-olds now account for just 41.4% of the labor force (seasonally adjusted), down from 46.4% in December 2007.",complex
mturk_charts/no_data_remaining/multi_col/659.png,"The Muslim share of Europe’s total population has been increasing steadily and will continue to grow in the coming decades. From mid-2010 to mid-2016 alone, the share of Muslims in Europe rose more than 1 percentage point, from 3.8% to 4.9% (from 19.5 million to 25.8 million). By 2050, the share of the continent’s population that is Muslim could more than double, rising to 11.2% or more, depending on how much migration is allowed into Europe. Even in the unlikely event that future migration is permanently halted, the Muslim population still would rise to an estimated 7.4%, due to the relative youth and high fertility rates of Europe’s current Muslim residents.",good
mturk_charts/no_data_remaining/multi_col/660.png,"Indians’ approval of Prime Minister Narendra Modi and their satisfaction with both their country’s direction and the state of its economy have grown in recent years. Three years into Modi’s five-year tenure, the honeymoon period for his administration may be over but the public’s love affair with current conditions in India is even more intense. Nearly nine-in-ten Indians hold a favorable opinion of Modi, comparable to their view of him in 2015, after a year in office. Roughly seven-in-ten say they have a very favorable view of the prime minister, again similar to public views in 2015.",complex
mturk_charts/no_data_remaining/multi_col/661.png,"Modi remains by far the most popular national figure in Indian politics tested in the survey. His favorable rating is 31 percentage points higher than that of Sonia Gandhi, the leader of the Congress party, and is 30 points more than that for Rahul Gandhi, who led the Congress ticket in the last Lok Sabha election.",good
mturk_charts/no_data_remaining/multi_col/662.png,"The Indian public, happy with its prime minister, believes the national government is doing the right thing for the country. More than eight-in-ten (85%) voice trust in the national government, including 39% who express a lot of trust. BJP supporters (90%) are more trusting of the government than Congress backers (76%). The public is also quite satisfied (79%) with the way their democracy is currently working. This includes 33% who are very satisfied. Again, this is a partisan issue. BJP supporters (84%) are significantly more satisfied with Indian democracy than are Congress backers (65%).",good
mturk_charts/no_data_remaining/multi_col/663.png,"Yet there are virtually no partisan differences today in concerns over obesity: 71% of Democrats and 69% of Republicans say it is an extremely or very serious public health problem. Four years ago, 77% of Democrats said it was at least very serious problem, compared with 60% of Republicans.",good
mturk_charts/no_data_remaining/multi_col/664.png,"Fewer members of Congress have prior military experience than in the past. As the share of Americans who are veterans has declined, so has the share of Congress members who have previously served in the military. In the current Congress, 20% of senators and 19% of representatives had prior military service, down drastically from just a few decades ago. The share of senators who are veterans reached a post-Korean War peak of 81% in 1975, while the share among House members peaked in 1967 at 75%. However, there are signs more veterans could run for office in the future.",good
mturk_charts/no_data_remaining/multi_col/665.png,"Even at various points when Obama was in office, majorities of Democrats viewed the U.S. as less respected internationally; 58% said this last year. But now, 87% of Democrats and Democratic leaners say the U.S. is less respected than in the past, with 70% saying this is a major problem.",good
mturk_charts/no_data_remaining/multi_col/666.png,"There also is a 25-point partisan gap in views of whether Russia’s power and influence constitute a major threat (63% of Democrats, 38% of Republicans), and an 18-point gap on Iran’s nuclear program (63% of Republicans, 45% of Democrats). For many years, Republicans and Democrats generally shared the same views about whether Russia represented a major threat to the U.S. In 2014, 58% of Republicans and 50% of Democrats said “growing authoritarianism in Russia” was a major threat and as recently as last year, 37% of Democrats and 46% of Republicans described “tensions with Russia” as a major threat. But partisan differences increased sharply after the presidential election, amid reports that Russia interfered in the campaign. In January, 67% of Democrats and 41% of Republicans said Russia’s power and influence were a major threat. These views have changed little since January; currently, 63% of Democrats and 38% of Republicans say Russia is a major threat to the U.S.",good
mturk_charts/no_data_remaining/multi_col/667.png,"About seven-in-ten Americans (69%) now say they approve of the U.S. military campaign against Islamic militants in Iraq and Syria, and 55% say it is going very (13%) or fairly (42%) well. While clear majorities of the public have approved of the efforts to defeat ISIS since the campaign began, this is the first time in Pew Research Center surveys that a majority of the public views the military campaign in positive terms. As recently as last October, just 31% of Americans said the campaign was going very or fairly well. The overall change in public assessments of the military’s approach to the Islamic State is largely attributable to a sharp shift in GOP views over the past year. Today, two-thirds (67%) of Republicans and Republican-leaning independents say the campaign is going well. In surveys conducted throughout the first years of the military campaign against ISIS (and during Barack Obama’s administration), no more than three-in-ten Republicans said this.",good
mturk_charts/no_data_remaining/multi_col/668.png,"The public’s views of local job availability continue to improve. Currently, 50% of Americans say there are plenty of jobs available in their communities – the highest number saying that jobs are plentiful in Pew Research Center surveys dating to 2001. Since June 2016, the share saying plenty of jobs are available has increased seven percentage points, from 43% to 50%, with virtually all of the change coming among Republicans. Yet in both parties, perceptions of the local job situation are much more positive today than they were three or four years ago.",good
mturk_charts/no_data_remaining/multi_col/669.png,"Nearly six-in-ten Republicans (58%) now say there are plenty of jobs available in their local communities, compared with 47% of Democrats. Since the question was last asked in June 2016, GOP views have become considerably more positive (from 41% who said plenty of jobs were available then to 58% who say this today). Democratic views are little changed over this period (45% then, 47% today). The partisan gap is even more pronounced on the question of whether “good jobs” are available (half of respondents are asked about “job” availability, half are asked about “good jobs” availability). While 57% of Republicans say there are plenty of “good jobs” (little different than the share who say there are plenty of jobs), just 32% of Democrats say this.",good
mturk_charts/no_data_remaining/multi_col/670.png,"Today, a 57% majority of Republicans and Republican leaners characterize national economic conditions as excellent (10%) or good (47%). Among Democrats, just 30% say the same. At the same time, Democrats are roughly twice as likely as Republicans to describe current conditions as poor (27% vs. 12%).",good
mturk_charts/no_data_remaining/multi_col/671.png,"Catalonia’s recent secession attempts come at a difficult time for Spain. Across the country, people distrust the national government and feel dissatisfied with the way democracy is working in their nation. And Catalans are even more negative on these issues than those living in other regions of Spain, according to a new analysis of data from a Pew Research Center survey conducted in March and April. An overwhelming majority of the Spanish public (81%) does not trust the national government to do the right thing for their country. In Catalonia, this figure reaches 91%, including 53% who say they do not trust Madrid at all. In other regions of Spain, 79% lack trust in their government and only about four-in-ten express absolutely no trust. Spanish people are also unhappy about their democracy. Overall, 74% say they are dissatisfied with the way democracy is working in their nation. Among Catalans, this figure is 81%, with 41% saying they are not at all satisfied. While 73% of people living in other regions of Spain are dissatisfied with democracy, only 28% feel this way strongly.",good
mturk_charts/no_data_remaining/multi_col/672.png,"The new national survey by Pew Research Center, conducted Oct. 25-30 among 1,504 adults, finds that Trump’s job rating is lower than it was in June and February (39% on each occasion). Most Americans continue to have strong feelings about the president, with about twice as many strongly disapproving of his job performance as strongly approving (51% to 25%). Since earlier this year, approval ratings for the congressional leaders of both parties have fallen – largely because fewer Republicans and Democrats are expressing positive views of their own parties’ leaders.",good
mturk_charts/no_data_remaining/multi_col/673.png,"The new survey finds that public concerns about the nation’s budget deficit are lower today than during Barack Obama’s presidency. About half of Americans (54%) view the deficit as a “very serious” problem for the country, while 35% regard it as a “somewhat serious” problem. Very few, just 10%, think it is not much of a problem.",good
mturk_charts/no_data_remaining/multi_col/674.png,"Public assessments of Donald Trump’s ability to handle several aspects of his job are more negative today than they were earlier in his term. Overall, 39% of the public is very or somewhat confident that Donald Trump can work effectively with Congress, while 59% are not too or not at all confident Trump can do this. In April, 46% expressed confidence in Trump’s ability to work with Congress. Trump receives similar ratings on his ability to manage the executive branch: 42% say they are at least somewhat confident that he can do this effectively. Last spring, half (50%) had confidence in Trump’s ability in this area.",good
