img_path,summary,category
mturk_charts/no_data_remaining/multi_col/1220.png,"About a third of Americans familiar with Black Lives Matter say they don’t understand the goals of the movement. Roughly two-thirds (64%) of those who have heard at least a little about Black Lives Matter say they understand the movement’s goals very or fairly well. Still, about a third (36%) of those who have heard about Black Lives Matter say they don’t understand its goals too well – or at all. Blacks who have heard at least a little about Black Lives Matter are far more likely than whites who have some general awareness of the movement to say they understand its goals very well (42% vs. 16%). About four-in-ten whites who have heard of Black Lives Matter (38%) say they don’t understand the movement’s goals particularly well. Blacks are more likely than whites to say the Black Lives Matter movement will be effective in the long run. About six-in-ten blacks (59%) believe that Black Lives Matter will ultimately be effective in bringing about racial equality. Whites are about evenly divided: 34% say the Black Lives Matter movement will be effective in helping blacks achieve equality, while 39% say the movement won’t be effective; another 26% either weren’t familiar with the movement or didn’t provide an opinion. Among blacks, skepticism about the effectiveness of Black Lives Matter may reflect broader skepticism about the future of racial equality in the U.S. Our survey found that fully 43% of blacks doubt that the U.S. will ever make the changes needed for blacks to have equal rights with whites. Some 11% of whites feel this way.",good
mturk_charts/no_data_remaining/multi_col/1221.png,"At this point in the campaign, Clinton receives slightly greater support from Democrats and Democratic leaners (91%) than Trump receives from Republicans and Republican leaners (85%) in a general election matchup. In part, this reflects the fact that Clinton does somewhat better among Democrats who did not support her in the primary than Trump does among Republicans who did not support him in the primary. Among Republicans, 77% of those who preferred another candidate in the GOP primary say they would vote for Trump over Clinton. A somewhat larger percentage of Democrats who preferred Sanders in the Democratic primary (85%) say they would vote for Clinton over Trump.",good
mturk_charts/no_data_remaining/multi_col/1222.png,"The Zika virus has become a concern to many Americans, and its emergence fits into a broader pattern of public concern that the number of infectious disease threats to people’s health has grown in the past generation. Some 51% of adults say there are more infectious disease threats today than there were 20 years ago.",good
mturk_charts/no_data_remaining/multi_col/1223.png,"Fully 85% of Americans have heard or read about the virus – 38% say they have heard or read “a lot” and 48% say they have read “a little” about it. Those who have paid the most attention are also more likely than others to believe the virus is a threat to the population as a whole, to pregnant women and to themselves. The level of attention and concern about Zika could evolve if new outbreaks occur and news coverage of the virus potentially increases heading into the Summer Olympics Games in Brazil. By the height of the most-recent major Ebola outbreak in Africa in the fall of 2014, Pew Research Center surveys found that 98% of Americans had heard at least a little about the Ebola problem. Some 79% had heard a lot about the Ebola situation at that time, compared with the 38% who say they have heard a lot about the Zika problem now.",good
mturk_charts/no_data_remaining/multi_col/1224.png,"Overall satisfaction with the choice of candidates is at its lowest point in two decades. Currently, fewer than half of registered voters in both parties – 43% of Democrats and 40% of Republicans – say they are satisfied with their choices for president.",good
mturk_charts/no_data_remaining/multi_col/1225.png,"Yet dissatisfaction with the campaign and the candidates has done nothing to dampen voter interest in the 2016 election. Fully 80% of registered voters say they have given “quite a lot” of thought to the election, the highest share at this point in any campaign since 1992. Four years ago, 67% of voters said they had given a lot of thought to the election, and at this point in 2008 – the previous election in which both parties had contested nominations – 72% did so. In part, this is a reflection of the widespread belief that a great deal is at stake in the upcoming election. In every campaign since 2004, majorities of voters have said “it really matters” who wins presidential contests, but currently 74% express this view, up 11 percentage points from the same point in the campaigns four and eight years ago.",good
mturk_charts/no_data_remaining/multi_col/1226.png,"Other issues are seen as more important by backers of one of the candidates: Trump supporters are more likely than Clinton supporters to say immigration is very important to their vote (79% vs. 65%), though the importance of this issue across-the-board is substantially higher today than it was in 2008 or 2012. Conversely, though nearly eight-in-ten (79%) Clinton supporters view the treatment of racial and ethnic minorities as a very important issue to their vote, only 42% of Trump backers say the same. And while more than half of Clinton supporters (54%) say the treatment of gay, lesbian and transgender people is very important, just a quarter of Trump supporters agree. Clinton is viewed as better able than Trump to handle several issues, including dealing with race relations (66% to 26% over Trump), better reflecting people’s views on abortion, making wise decisions on foreign policy, dealing with health care and selecting Supreme Court justices. Yet voters are divided over which candidate can better handle the economy and terrorism – the two issues that rank at the top of voters’ agenda. Trump has a wide edge over Clinton as being better able to reduce the influence of lobbyists and special interests in Washington (50% to 30%).",good
mturk_charts/no_data_remaining/multi_col/1227.png,"Many see daylight between Trump’s positions and those of average Republicans. About half of all voters (51%) say average Republicans generally disagree with Trump on most issues, while fewer (42%) say they generally agree with Trump’s positions. By contrast, 72% of voters say average Democrats agree with Clinton on most issues. Republicans remain skeptical that their party will unite behind their presumptive nominee. Just 38% of Republican and Republican-leaning registered voters say the party will “solidly unite” behind Trump; 54% say disagreements in the party will keep many Republicans from supporting him. These views are virtually unchanged since March, amid the GOP primary contest. By contrast, 72% of Democratic voters say their party will solid unite behind Clinton; in March, 64% expected their party to unite behind Clinton if she became the nominee.",good
mturk_charts/no_data_remaining/multi_col/1228.png,"But when asked whether the U.S. owed its success more to its “ability to change” or its “reliance on long-standing principles,” 51% of Americans attributed its success to the ability to change, while 43% pointed to reliance on long-standing principles. The question was one of many measures about the country and its future we examined for our 2015 survey on government performance. For most Millennials and Gen Xers, the country’s success was associated with its ability to change. About six-in-ten Millennials (62%), ages 18 to 34 in 2015, and 51% of Gen Xers (then ages 35 to 50) said the U.S. had been successful because of its ability to change. Boomers (ages 51-69 at the time) were more divided: 45% said it was due to America’s ability to change while nearly the same share (49%) said it was due to its reliance on principles. Members of the Silent generation (ages 70-87) were also split: 43% said America has been successful because of its ability to change while 46% say it is due to its reliance on long-standing principles.",good
mturk_charts/no_data_remaining/multi_col/1229.png,"Large racial and gender wage gaps in the U.S. remain, even as they have narrowed in some cases over the years. Among full- and part-time workers in the U.S., blacks in 2015 earned just 75% as much as whites in median hourly earnings and women earned 83% as much as men. Looking at gender, race and ethnicity combined, all groups, with the exception of Asian men, lag behind white men in terms of median hourly earnings, according to a new Pew Research Center analysis of Bureau of Labor Statistics data. White men are often used in comparisons such as this because they are the largest demographic group in the workforce – 33% in 2015.",good
mturk_charts/no_data_remaining/multi_col/1230.png,"Although he has not been universally praised by global publics throughout his two terms in office, previous Pew Research Center surveys have found higher international ratings for Obama than for his predecessor, George W. Bush. During the Bush era, opposition to U.S. foreign policy and rising anti-Americanism were widespread in many regions of the world, but Obama’s election in November 2008 led to a significant improvement in America’s global image. The shift was especially dramatic in Western Europe, where assessments of Bush were grim, but subsequent views of Obama have been remarkably positive.",good
mturk_charts/no_data_remaining/multi_col/1231.png,"Overall, there is no strong consensus about the trajectory of American power over the past decade. When asked whether the U.S. plays a less, more or equally important and powerful role as a world leader today compared with 10 years ago, respondents in most countries are fairly divided. Japan is the only country in which a majority thinks the U.S. is less important and powerful than it was a decade ago, while India is the only nation with a majority saying the U.S. is more important and powerful. For their part, Americans are more likely than most of the other publics surveyed to believe their country’s power is waning: 46% say the U.S. is playing a less important role in the world. (For more on U.S. views about foreign policy, see “Public Uncertain, Divided Over America’s Place in the World.”) In the European Union, public opinion has moved substantially on this question since it was first asked in 2008. Looking across five EU nations polled each year since 2008 – France, Germany, Poland, Spain and the UK – the median percentage naming the U.S. as the world’s top economic power declined rapidly after 2009, but has rebounded steadily since 2012. American public opinion has also shifted on this question. As recently as 2014, 41% said China was the leading economy, while 40% chose the U.S. Now, just 34% think it’s China, while 54% say the U.S.",good
mturk_charts/no_data_remaining/multi_col/1232.png,"Looking at the five EU nations we have surveyed consistently since 2008, the share of the public saying that Washington respects personal freedoms rose between 2008 and 2013, but has fallen in the years since. In France and Germany, for example, the share of the public that says the U.S. respects personal rights is lower today than it was during the final year of the Bush presidency.",good
mturk_charts/no_data_remaining/multi_col/1233.png,"Moreover, many around the world also associate negative characteristics with the American people. Half or more in 10 countries think Americans are arrogant and many say they are greedy. Interestingly, most in the U.S. say Americans are arrogant (55%) and greedy (57%). Fewer describe Americans as violent, although half or more express this opinion in Australia (68%), Greece (63%), the UK (57%), Spain (55%), Canada (53%) and China (52%). A sizable share in the U.S. – 42% – also says Americans are violent. Public opinion in the U.S. divides sharply along partisan lines: 50% of Democrats and 44% of independents characterize Americans as violent, compared with just 29% of Republicans.",good
mturk_charts/no_data_remaining/multi_col/1234.png,"Views of the U.S. remain positive, especially when compared with China. Half or more in almost every nation surveyed have a favorable opinion of the U.S. The highest marks for the U.S. are found in Poland, Italy and Japan. About half or more of Indians and Chinese also have a positive view of America. The only country surveyed in which views are negative is Greece, where only 38% have a positive opinion of the U.S. China receives lower ratings than the U.S. in virtually every country surveyed. This includes positive ratings of just 11% from neighboring Japan, and 31% from India. European countries also see China negatively, with no country expressing majority support except Greece, where 57% have a positive view of China. In 2016, many people across the nations polled say the U.S. is the world’s leading economic power. Australia stands out as the one nation polled where at least half (52%) say China is the top economy in the world, compared with 32% who say it is the U.S. Relatively few respondents in these 16 nations think Japan or the countries of the European Union are the globe’s leading economic power, although 25% of Germans say it is the EU countries.",good
mturk_charts/no_data_remaining/multi_col/1235.png,"In 2016, many people across the nations polled say the U.S. is the world’s leading economic power. Australia stands out as the one nation polled where at least half (52%) say China is the top economy in the world, compared with 32% who say it is the U.S. Relatively few respondents in these 16 nations think Japan or the countries of the European Union are the globe’s leading economic power, although 25% of Germans say it is the EU countries.",good
mturk_charts/no_data_remaining/multi_col/1236.png,"Across most nations surveyed, confidence ratings for Barack Obama are high. This includes over 80% confidence in his ability to handle international affairs from people in Sweden, the Netherlands, Germany, France, Australia and Canada. Confidence in Obama’s international abilities is lower in China (52%) than in most of the other countries surveyed, but it is still positive. Meanwhile, Greeks are the most negative toward Obama, with 58% expressing no confidence in his ability to handle world affairs.",good
mturk_charts/no_data_remaining/multi_col/1237.png,"Across several measures, black-white gaps in social and economic well-being persist. Blacks lag behind whites in homeownership, household wealth and median income, among other indicators. And these differences remain even when controlling for levels of education.",good
mturk_charts/no_data_remaining/multi_col/1238.png,"The EU has never been as popular in the UK as it has been among other EU members. Just 44% of the public in the UK has a favorable view of the EU, compared with a median of 50% who hold a favorable opinion in five other EU nations surveyed by Pew Research Center. Support for the EU is down in the UK from a high of 52% in 2014. British views of the EU have consistently been lower than those on the continent for nearly a decade.",good
mturk_charts/no_data_remaining/multi_col/1239.png,"Scotland also disagrees with the rest of the UK on two issues central to the Brexit debate: the economy and immigration. The Scottish feel more threatened by the prospect of global economic instability than their counterparts in the rest of the UK. Roughly six-in-ten say it is a major threat to their country, while only 48% say the same in England, Northern Ireland and Wales. Meanwhile, the rest of the UK feels more threatened by the large number of refugees leaving countries such as Iraq and Syria (54% major threat). Just 41% of Scottish people agree.",good
mturk_charts/no_data_remaining/multi_col/1240.png,"Religion-related terrorism spiked in 2014, with 82 countries experiencing this kind of danger, up from 73 countries in 2013 and 2012. These activities resulted in injury or death in 60 countries (up from 51 in 2013), reaching an eight-year high in lethality. The Middle East-North Africa region continued to have the highest share of countries with religion-related terrorism (90%) among the report’s five regions, although the Asia-Pacific region saw the biggest increase in the share of countries that experienced religion-related terrorism, rising from 36% in 2013 to 44% in 2014.",good
mturk_charts/no_data_remaining/multi_col/1241.png,"Greeks also differ from other Europeans in their evaluation of international institutions. Of the countries surveyed, Greeks have the least favorable views of the United Nations, the EU and the North Atlantic Treaty Organization (NATO). Roughly two-thirds of Europeans have a favorable view of the UN, compared with roughly four-in-ten Greeks (41%). Nearly six-in-ten Europeans (59%) view NATO favorably, compared with just a quarter of Greeks. And on the EU, 51% of Europeans view the institution favorably while only 27% of Greeks agree.",good
mturk_charts/no_data_remaining/multi_col/1242.png,"In addition to holding the EU in low regard, Greeks are the most critical of EU policy on a range of issues. More than nine-in-ten Greeks disapprove of the EU’s handling of the refugee crisis and European economic issues. A median of more than seven-in-ten Europeans disapprove of the EU’s handling of refugees and a majority disapprove of its handling of economic issues, a far cry from the near universal disapproval in Greece.",good
mturk_charts/no_data_remaining/multi_col/1243.png,"A Pew Research Center survey of 2,003 American adults (including 795 who are currently employed on a full- or part-time basis) conducted Sept. 11-14 and 18-21, 2014, finds that social media plays some role in the lives of many American workers – but that role is not always clear-cut or entirely positive. As noted above, 17% of workers say they use social media to build or strengthen personal relationships at work – but the transparency that social media facilitates comes with costs as well as benefits. Some 14% of workers have found information on social media that has improved their professional opinion of a colleague; at the same time, a similar share (16%) have found information on social media that has lowered their professional opinion of a colleague. Younger workers are more likely than their older counterparts to say they have discovered information about a colleague on social media that lowered their professional opinion of them – but also are more likely than older workers to have found information that improved their professional opinion of a colleague. Some 23% of workers ages 18 to 29 report that they have discovered information on social media that improved their professional opinion of a colleague. By comparison, just 12% of workers ages 30 to 49 and 9% of workers ages 50 to 64 have experienced this. Similarly, 29% of these younger workers have discovered information that lowered their professional opinion of a colleague: 16% of those ages 30 to 49 and 6% of those ages 50 to 64 indicate that this has happened to them.",good
mturk_charts/no_data_remaining/multi_col/1244.png,"Many workers report that their employers have policies about social media use on the job, or about how employees may present themselves in various online spaces. Half of all full-time and part-time workers (51%) say their workplace has rules about using social media while at work (45% say their employer does not have these policies), while 32% report that their employer has policies about how employees may present themselves on the internet in general (63% say their employer does not have these policies). Policies that regulate how employers present themselves online outside of work may be expected to influence whether these workers use social media at all. However, this does not seem to be the case: Fully 77% of workers report using social media regardless of whether their employer has such a policy in place.",good
mturk_charts/no_data_remaining/multi_col/1245.png,"In 2015, about 4.9 million people born in the UK lived in other countries, the 10th-largest emigrant population in the world. Overall, about 8% of those born in the UK live outside its borders. By contrast, only about 1% of those born in the U.S. live outside of the United States. Among the 10 countries with the highest number of emigrants, the UK is the only Western European country to appear on the list. Other top origin countries of emigrants include India (15.6 million), Mexico (12.3 million) and Russia (10.6 million).",good
mturk_charts/no_data_remaining/multi_col/1246.png,"In May, 18.8% of Americans ages 65 and older, or nearly 9 million people, reported being employed full- or part-time, continuing a steady increase that dates to at least 2000 (which is as far back as we took our analysis). In May of that year, just 12.8% of 65-and-older Americans, or about 4 million people, said they were working.",good
mturk_charts/no_data_remaining/multi_col/1247.png,"Driven in part by a highly competitive presidential primary season, cable news saw its viewership jump 8%, to an average of 3.1 million viewers in prime time (according to Pew Research Center analysis of Nielsen Media Research data, used under license). This was especially pronounced at CNN, whose prime-time audience grew 38%. Cable channels gained economically as well, with annual revenue for the three major channels (Fox News Channel, CNN and MSNBC) projected to rise 10%, to $4 billion. Podcasting continues to experience audience growth – though this includes both those podcasts focused on news and those looking at other subjects. About one-in-five U.S. adults ages 12 or older (21%) listened to some kind of podcast in the past month, up from 12% six years ago, and 36% have ever listened to a podcast, up from 23% in 2010. Though the audience (and revenue) for podcasts is only a small portion of that for radio, streaming radio has been growing as well, with the share who listened to online radio (whether news or non-news) in the past month more than doubling since 2010, from 27% to 57%. This growth hasn’t necessarily cannibalized the audience for traditional radio, however; 91% of those ages 12 and older listened to terrestrial radio in the past month. When it comes to news radio in particular, NPR’s flagship news programs each have around 12 million listeners. (This is roughly half of the average viewership of the three nightly TV network newscasts, which together attracted about 24 million viewers in 2015.)",good
mturk_charts/no_data_remaining/multi_col/1248.png,"Americans and Europeans may agree ISIS is a top threat, but they differ in how they rank other concerns. For example, while climate change is the second biggest concern in Europe, it is lower on the list in the U.S. Instead, Americans name cyberattacks as the second greatest threat. China’s emergence as a world power rates relatively low in both the U.S. and Europe, although Americans are more concerned than Europeans about Beijing’s growing power. Many Americans and Europeans believe their national influence is waning, although Germans believe their country’s influence is on the rise. A 46% plurality of Americans believe the U.S. is less important and powerful than it was 10 years ago – a share that has been at historic highs in recent years. Majorities or pluralities also say their country is less important in Greece, Italy, Spain and France. However, just 11% hold this view in Germany, which in many ways has taken a more prominent role in European political and economic affairs over the past decade. A 62% majority there says Germany is more important than a decade ago.",complex
mturk_charts/no_data_remaining/multi_col/1249.png,"For a while it looked like this year’s primaries, driven by high turnout on the Republican side, might eclipse the turnout record set in 2008, when 30.4% of voting-age citizens cast ballots. The GOP did indeed have the highest primary turnout since at least 1980, according to our analysis – 14.8%, compared with 11% in 2008 and 9.8% in 2012. But turnout fell off markedly after Donald Trump won the May 3 Indiana primary and his two main rivals dropped out of the race. By contrast, the heated battle between Hillary Clinton and Bernie Sanders engaged Democratic voters for longer. Less than a day before the final five states held their primaries, the Associated Press reported that Clinton already had clinched the nomination. But turnout in the five primaries held June 7 didn’t appear to be affected, averaging 14.1% compared with an average of 14.5% for the preceding 31 contests. (The District of Columbia will hold its Democratic primary June 14, but there likely won’t be enough voters there to significantly change the nationwide numbers.)",good
