img_path,summary,category
mturk_charts/no_data_remaining/multi_col/2871.png,"In a week dominated by news about the Tucson shootings, Americans continued to track news about the economy. Nearly four-in-ten (37%) say they followed economic news very closely, a level that has changed only slightly in recent weeks. Still, just 12% say this was the news they followed most closely. About a third (35%) say they followed news about winter storms in the eastern United States very closely; 16% say this was the news they followed most closely. Not surprisingly, interest was highest in the north east and the south. More than one-in-ten (13%) say they followed news about floods in Australia very closely; 3% say this was the news they followed most closely. Two other breaking foreign stories barely registered with the public. Just 4% say they followed news about the collapse of the Lebanese government very closely; 1% says this was the news they followed most closely. And 3% say they followed news about the independence vote in southern Sudan very closely. Less than 1% say this was the story they followed most closely.",good
mturk_charts/no_data_remaining/multi_col/2872.png,"About a third (35%) say they followed news about winter storms in the eastern United States very closely; 16% say this was the news they followed most closely. Not surprisingly, interest was highest in the north east and the south. More than one-in-ten (13%) say they followed news about floods in Australia very closely; 3% say this was the news they followed most closely. Two other breaking foreign stories barely registered with the public. Just 4% say they followed news about the collapse of the Lebanese government very closely; 1% says this was the news they followed most closely. And 3% say they followed news about the independence vote in southern Sudan very closely. Less than 1% say this was the story they followed most closely.",good
mturk_charts/no_data_remaining/multi_col/2873.png,The survey asked group members whether they had done several core activities with their group in the past 30 days and internet users were significantly more likely to have done all of these activities.,good
mturk_charts/no_data_remaining/multi_col/2874.png,"The percentage of all American adults who use Wikipedia to look for information has increased from 25% in February 2007 to 42% in May 2010, a 17 percentage point increase. The proportion of adults who use the internet over that same time period grew at a more modest rate, from 71% to 79% of all adults.",good
mturk_charts/no_data_remaining/multi_col/2875.png,"The Pew Research Center has tracked attitudes about this issue since 1993. In September, public opinion was divided: 50% said it was more important to control gun ownership while 46% said it was more important to protect the rights of Americans to own guns.",good
mturk_charts/no_data_remaining/multi_col/2876.png,"American views of China are not extreme in a global perspective. A 2010 Pew Global Attitudes Project survey found roughly half of Americans expressing a favorable opinion of China, while 36% said they felt unfavorably. In that survey, attitudes toward China were far more negative in France, Germany and Turkey, as well as among the publics of some of China’s neighbors, such as Japan, South Korea and India. By contrast, China is viewed in an overwhelmingly favorable light in places like Kenya and Nigeria (where the U.S. is also viewed very favorably) as well as in Pakistan (where opinions of the U.S. are mostly negative).",good
mturk_charts/no_data_remaining/multi_col/2877.png,"Public perceptions of the tone of economic news have become much less negative over the past month. In fact, the percentage saying they are hearing mostly bad news about the economy has dropped to its lowest point since the question was first asked in December 2008. Currently, 24% say they are hearing mostly bad news, down 15 points from 39% in early December. The proportion saying they are hearing a mix of good and bad news has jumped from 55% last month to 68% in the new survey. However, as has been the case for the past two years, very few say they are hearing mostly good economic news; just 7% say this, which is little changed from 4% in December.",good
mturk_charts/no_data_remaining/multi_col/2878.png,"Public perceptions of the tone of economic news have become much less negative over the past month. In fact, the percentage saying they are hearing mostly bad news about the economy has dropped to its lowest point since the question was first asked in December 2008. The latest News Interest Index survey, conducted Jan. 6-9 among 1,018 adults, finds that Republicans, in particular, are much less likely to say they are hearing mostly bad news about the economy than they were just a month ago. Currently, 24% say they have been hearing mostly bad news, half of the number that said this in early December (50%). Seven-in-ten (71%) Republicans say they are hearing a mix of good and bad news about the economy, up from 47% in December. Through most of the Obama administration, Republicans have been far more likely than Democrats to say the economic news they are hearing is mostly bad. In early November, for example, Republicans were twice as likely to say this (53% vs. 26%). Now, as the number of Republicans taking the most negative viewpoint has dropped, the partisan gap has narrowed to just seven points (24% of Republicans vs. 17% of Democrats).",complex
mturk_charts/no_data_remaining/multi_col/2879.png,"One story where the public and the media were often in sync was the economy. Coverage of economic news was consistently high from week to week and cumulatively represented the single largest story over the course of 2010. Public interest was also notably consistent. In every week public interest in economic news was measured, at least 30% of Americans said they were following reports about the condition of the economy very closely, and, aside from periods of peak interest in Haiti, the health care debate and the Gulf oil spill, at least 10% said the economy was the story they were following more closely than any other. Economic news received the most or second most public attention in 32 of the 45 weeks in which public attention to the topic was tracked.",complex
mturk_charts/no_data_remaining/multi_col/2880.png,"At their peak, each of these stories dominated press coverage – accounting for more than 40% of the newshole in a single week. And at these moments, public interest was commensurately high. Fully 66% of Americans said they were following the debate over health care more closely than any other news the week of March 22-28, and 63% were focused on the oil spill in the Gulf of Mexico the week of June 14-20. Immediately following the earthquake in Haiti, 57% of Americans followed news about the aftermath more closely than any other story, and in the week following the 2010 midterms, 43% of Americans said that was their top news interest.",good
mturk_charts/no_data_remaining/multi_col/2881.png,"Similarly, over the entire course of 2010 1% of news coverage was devoted to Iraq events and policy debates, and in no week did Iraq consume more than 10% of the newshole. Public interest in Iraq news was also modest – in the ten weeks in which public interest in Iraq-related news was tested, roughly a quarter of Americans said they were following “very closely”, but about one-in-ten rated it as the top story they followed most closely. The exception to this came in early September, when 17% said they were following news about the withdrawal of U.S. troops from Iraq more closely than any other story.",good
mturk_charts/no_data_remaining/multi_col/2882.png,"The graphic below plots out the interest and coverage levels for many top weekly stories of the year. For long-running stories, such as the economy or the Gulf oil spill, the numbers have been averaged and are represented by larger square dots. The bold diagonal line represents the typical relationship between coverage and interest across the entire year’s worth of weekly measurements (as defined by a simple regression analysis). Data points above the diagonal line represent stories in which public interest was high relative to the amount of press coverage. Those points below the line show stories in which press coverage was high relative to the amount of public interest. In both directions, the farther a story is from the line, the greater the gap between interest and coverage.",complex
mturk_charts/no_data_remaining/multi_col/2883.png,"The internet is slowly closing in on television as Americans’ main source of national and international news. Currently, 41% say they get most of their news about national and international news from the internet, which is little changed over the past two years but up 17 points since 2007. Television remains the most widely used source for national and international news – 66% of Americans say it is their main source of news – but that is down from 74% three years ago and 82% as recently as 2002. The national survey by the Pew Research Center for the People &amp; the Press, conducted Dec. 1-5, 2010 among 1,500 adults reached on cell phones and landlines, finds that more people continue to cite the internet than newspapers as their main source of news, reflecting both the growth of the internet, and the gradual decline in newspaper readership (from 34% in 2007 to 31% now). The proportion citing radio as their main source of national and international news has remained relatively stable in recent years; currently, 16% say it is their main source.",good
mturk_charts/no_data_remaining/multi_col/2884.png,"The decline in the share of Americans who cite television as their main source of national and international news crosses all age groups. Over the past three years, the number saying TV is their main source has fallen 16 points among 18-29 year-olds, eight points among those 30 to 49, and six points among those age 50 and older.",complex
mturk_charts/no_data_remaining/multi_col/2885.png,"Reflecting the slow decline in the proportion of people getting most of their national and international news from television, the numbers specifically citing cable news outlets or broadcast networks as their main news source has fallen. When asked where on television they get most of their news, 36% name a cable network such as CNN, the Fox News Channel or MSNBC; 22% name ABC News, CBS News or NBC News; and 16% say they get most of their national and international news from local news programming. Compared with five years ago, the share citing a cable network as their main source is down seven points (from 43% to 36%), and the share citing a broadcast network is down eight points (from 30% to 22%). The local news figure has remained relatively constant over this period.",good
mturk_charts/no_data_remaining/multi_col/2886.png,"In the News Interest Index survey conducted Dec. 16-19, Americans say the two stories they followed most closely last week were the final approval of major tax legislation in Washington and the cold winter weather that struck many parts of the country. Late last week, Congress passed and President Obama signed legislation that includes a temporary extension of Bush-era tax cuts, aid to the unemployed and several other tax measures intended to boost the U.S. economy. About two-in-ten (22%) say they followed this news more closely than any other top story; 37% say they followed news about the tax deal very closely. Two-in-ten (20%) say they followed news about cold winter weather most closely, while 43% say they followed this news very closely. About four-in-ten (39%) say they paid very close attention to news about the economy; 14% say they followed economic news more closely than any other topic. The media also focused on the economy and the tax legislation last week. The finale of the debate over tax cuts made up 17% of the newshole, according to the Pew Research Center’s Project for Excellence in Journalism. More general economic news accounted for an additional 9% of coverage. News about harsh winter weather conditions made up 3% of the newshole. Nearly three-in-ten (28%) say they very closely followed reports about a federal judge in Virginia ruling that parts of the new health care law are unconstitutional, including a provision mandating all Americans carry health insurance. About one-in-ten (9%) say this was the news they followed most closely. Far more Republicans (42%) than Democrats or independents (24% each) followed this story very closely. The situation in Iraq was followed very closely by 19% of the public and a similar number (17%) say they very closely followed news about the administration’s review of its Afghan war strategy. The situation in Afghanistan and the review of the war’s progress accounted for 5% of the newshole, while Iraq made up 1% of coverage.",good
mturk_charts/no_data_remaining/multi_col/2887.png,"While social networking has spread globally, it is particularly widespread in the country where it began. Among the 22 publics surveyed, Americans most often say they use websites like Facebook and MySpace: 46% use such sites; 36% use the internet, but do not access these sites; and 18% say they never go online. The survey finds three countries close behind the United States in social network usage: in Poland (43%), Britain (43%) and South Korea (40%), at least four-in-ten adults say they use such sites. And at least a third engage in social networking in France (36%), Spain (34%), Russia (33%) and Brazil (33%). Germans and the Japanese stand out among highly connected publics for their comparatively low levels of participation in social networking. While 31% of Germans use these types of sites, 49% go online at least occasionally but choose not to use them. In Japan, 24% are engaged in social networking, while 44% have internet access but are not engaged.",complex
mturk_charts/no_data_remaining/multi_col/2888.png,"While social networking has spread globally, it is particularly widespread in the country where it began. Among the 22 publics surveyed, Americans most often say they use websites like Facebook and MySpace: 46% use such sites, 36% use the internet, but do not access these sites, and 18% say they never go online. The survey finds three countries close behind the United States in social network usage: in Poland (43%), Britain (43%) and South Korea (40%), at least four-in-ten adults say they use such sites. And at least a third engage in social networking in France (36%), Spain (34%), Russia (33%) and Brazil (33%). Germans and the Japanese stand out among highly connected publics for their comparatively low levels of participation in social networking. While 31% of Germans use these types of sites, 49% go online at least occasionally but choose not to use them. In Japan, 24% are engaged in social networking, while 44% have internet access but are not engaged.",complex
mturk_charts/no_data_remaining/multi_col/2889.png,"More people around the world are using computers and cell phones than was the case just three years ago, and the increase is especially dramatic compared with 2002. Internet usage has also become more widespread in recent years, and more now say they send or receive email at least occasionally. Looking across the 16 countries for which trends are available, the median percentage of people who own a cell phone has increased by 36 percentage points since 2002. The current median is 81%, compared with 45% earlier in the decade. In 2007, the median percentage owning cell phones across these 16 countries was 70%. Computer usage has also increased considerably, although at a slower pace than cell phone ownership. Currently, across the 16 countries where trends are available the median percentage of computer users is 50%; in 2007, the median was 39% and, in 2002, a median of 32% said they used a computer at least occasionally.",good
mturk_charts/no_data_remaining/multi_col/2890.png,"About three-in-ten (29%) say they followed news about the deal more closely than any other major story. Another 17% say they most closely followed news about the economy in general, according to the latest News Interest Index survey conducted Dec. 9-12 among 1,011 adults. News about the economy – and efforts to spark greater growth – dominated news coverage as well. A third (33%) of news coverage last week focused specifically on the agreement reached between the White House and GOP leaders, according to a separate analysis by the Pew Research Center’s Project for Excellence in Journalism (PEJ). More general reporting on the economy accounted for another 7% of the newshole. People paid attention to both storylines: 69% say they followed news about the economy either very (39%) or fairly closely (30%), while 66% say they followed news about the tax deal either very (37%) or fairly closely (29%).",good
mturk_charts/no_data_remaining/multi_col/2891.png,"In 1995 only about 1 in 10 American adults had access to the internet. In 2000, it was up to nearly half of adults. Now, about 75% of adults and 95% teenagers in the U.S. have internet access.",complex
mturk_charts/no_data_remaining/multi_col/2892.png,"In the year 2000 only 5% of households had broadband access. Now, two-thirds of Americans have broadband at home. One Pew Internet study found that dial-up users take part in an average of 3 activities per day while broadband users take part in 7.",complex
mturk_charts/no_data_remaining/multi_col/2893.png,"Most of the major deficit reduction proposals under discussion meet with public disapproval. Particularly unpopular are provisions that would tax the health insurance people receive from their employers (72% disapprove), raise the national gasoline tax (74% disapprove), and reduce federal funding to states for things like education and roads (71% disapprove). Of 12 ideas tested, just two meet with majority approval: increasing the amount of earned income that is subject to Social Security withholding (64% approve) and freezing the salaries of government workers (59% approve); the latter proposal is supported by President Obama and many Republicans.",good
mturk_charts/no_data_remaining/multi_col/2894.png,"Most of the major deficit reduction proposals under discussion meet with public disapproval. Particularly unpopular are provisions that would tax the health insurance people receive from their employers (72% disapprove), raise the national gasoline tax (74% disapprove), and reduce federal funding to states for things like education and roads (71% disapprove). Of 12 ideas tested, just two meet with majority approval: increasing the amount of earned income that is subject to Social Security withholding (64% approve) and freezing the salaries of government workers (59% approve); the latter proposal is supported by President Obama and many Republicans.",good
mturk_charts/no_data_remaining/multi_col/2895.png,"Most Americans following news about the WikiLeaks website’s release of a huge trove of classified documents about U.S. diplomatic relations see the revelations – which have received extensive media coverage – doing more harm than good. Six-in-ten (60%) of those paying attention to the story say they believe the release of thousands of secret State Department communications harms the public interest. About half that number (31%) say the release serves the public interest, according to the latest News Interest Index survey conducted Dec. 2-5 among 1,003 adults. In August, the public was more divided about the impact of the release by WikiLeaks of thousands of classified documents about the war in Afghanistan. At that point, 47% of those who had heard at least a little about the story said the release harmed the public interest, while 42% said it served the public interest.",good
mturk_charts/no_data_remaining/multi_col/2896.png,"The public’s perceptions of economic news remain mixed and far less positive than earlier in 2010. More than half (55%) say they are hearing a mix of good and bad news about the economy; 39% say they are hearing mostly bad news while just 4% say they are hearing mostly good news. Those numbers have changed little since July, when perceptions of economic news took a turn for the worse.",good
mturk_charts/no_data_remaining/multi_col/2897.png,"About four-in-ten (39%) say they very closely followed news about the debate over whether to extend the Bush era income tax cuts; 17% say this was the story they followed most closely. Though the tensions between North and South Korea amounted to just 2% of the week’s newshole, Americans took an interest in the story: 35% say they followed this news very closely, while 16% say this was the news they followed most closely. Continued debate in Washington about whether to end the Pentagon’s “Don’t Ask, Don’t Tell” policy concerning gays and lesbians in the military – including Congressional hearings and the release of a survey of military personnel – accounted for 5% of coverage, according to PEJ. Nearly three-in-ten (29%) say they followed this news very closely; this was the top story for 9%. Three-in-ten (30%) say they followed news about the WikiLeaks release very closely, while 7% say they followed this story most closely. The story accounted for 16% of coverage. About a third (35%) very closely followed news about recommendations for reducing the federal deficit, while 6% say this was the news they followed most closely. Those stories accounted for 7% of coverage.",good
mturk_charts/no_data_remaining/multi_col/2898.png,"But Muslim views of Hezbollah reflect a deep sectarian divide in Lebanon, where the group’s leader, Hassan Nasrallah, is threatening violence if a United Nations tribunal indicts Hezbollah members for the 2005 assassination of former Prime Minister Rafik Hariri. More than nine-in-ten (94%) Lebanese Shia support the organization, while an overwhelming majority (84%) of Sunnis in that country express unfavorable views.",good
mturk_charts/no_data_remaining/multi_col/2899.png,"In Indonesia, about nine-in-ten Muslims (91%) either say that their religion plays a large role in politics and that this is a good thing or that Islam plays a small role and that this is a bad thing. Similarly, at least three-quarters of Muslims in Egypt (85%), Nigeria (82%) and Jordan (76%) consider Islamic influence over political life to be a positive thing for their country, as do 69% of Muslims in Pakistan and 58% in Lebanon. Only in Turkey are opinions about the role of Islam in political life more mixed. About four-in-ten (38%) Turkish Muslims say Islam plays a large role and embrace its influence in their country’s politics or say it is bad that Islam plays only a small role; about three-in-ten (31%) say Islam’s influence is negative.",good
mturk_charts/no_data_remaining/multi_col/2900.png,"Islamic extremism continues to be a serious concern in nations with substantial Muslim populations. Large majorities in five of the six predominantly Muslim nations surveyed as well as in Nigeria, where roughly half of the population is Muslim, say they are very or somewhat concerned about the rise of Islamic extremism around the world. The only outlier is Turkey, where 39% are concerned. Many are also worried about the rise of Islamic extremism within their own countries. That is especially the case in Lebanon, where eight-in-ten – including 90% of Christians, 82% of Shia and 67% of Sunnis – express at least some concern. In Nigeria, roughly three-quarters (76%) are concerned about Islamic extremism in their country, including 83% of Muslims and 68% of Christians. Nearly two-thirds of Pakistanis (65%) express concern about Islamic extremism in their country, but fears have declined since last year, when 79% shared that view. About six-in-ten in Egypt (61%) and Indonesia (59%) and more than four-in-ten in Jordan (44%) and Turkey (43%) are also concerned about extremism in their countries.",good
mturk_charts/no_data_remaining/multi_col/2901.png,"News about the economy topped the public’s news interest last week, though many Americans also closely tracked the fallout from the midterm elections and the debate over enhanced security measures at the nation’s airports. About three-in-ten (29%) say they followed news about the economy more closely than other major stories, while 20% say they followed news about the election outcome most closely. At the start of a busy holiday travel period, 14% say they most closely followed news about tougher passenger screening procedures at airports, according to the latest News Interest Index survey conducted Nov. 18-21 among 1,004 adults. The media divided coverage among top stories, including the economy (11% of coverage) and the election outcome (9%), according to a separate analysis by the Pew Research Center’s Project for Excellence in Journalism. News about airport security screening procedures made up 6% of the newshole measured by PEJ, while coverage of the situation in Afghanistan accounted for 7%.",good
