img_path,summary,category
mturk_charts/no_data_remaining/multi_col/705.png,"Although they comprise a relatively small share of the population, these workers who have been impacted by automation express strongly negative views about the current – and future – impact of technology on their own careers. Fully 46% of these workers feel that technology has decreased their own opportunities for career advancement, while 34% feel that technology has generally made their work less interesting (each of these views is shared by just 11% of other workers). And nearly six-in-ten (57%) anticipate that their own jobs or professions will be mostly done by machines within their lifetimes – roughly twice the share among workers who have not been impacted by automation in this way (28%). More broadly, the survey also finds that the current generation of workforce technologies has had widely disparate impacts on today’s workers. For some – especially those with high levels of educational attainment – technology represents a largely positive force that makes their work more interesting and provides opportunities for career advancement. But those who have not attended college are much less likely to view today’s workforce technologies in such a positive light. When it comes to the overall impact of technology on them in a professional context, just 38% of workers with high school diplomas or less indicate that technology in general has made their jobs more interesting. And a similarly modest share (32%) feels that technology has increased their opportunities for career advancement. In each instance, these figures are substantially lower than those reported by workers who have continued their formal education beyond high school.",good
mturk_charts/no_data_remaining/multi_col/706.png,"In Mexico, most of these issues were more important among people who earn an income above the median. Higher-income Mexicans were particularly likely to say guaranteeing gender equality, protesting police misconduct, promoting a clean environment, ensuring free and fair elections, guaranteeing fair trials and holding the government accountable on human rights issues should be top priorities. Few see human rights organizations as tools of foreign powers. In recent years, several governments around the world have placed restrictions on foreign support for human rights groups and other nongovernmental organizations, with critics often charging that these groups serve the interests of foreign organizations. However, this is not a view shared by the four publics surveyed. When asked whether human rights organizations are primarily dedicated to promoting the interests of foreign groups or protecting the rights of people in their country, strong majorities of Kenyans, Indonesians and Mexicans said such groups are dedicated to helping people in their country. In India, a 43% plurality said the same, though roughly three-in-ten did not offer an opinion.",good
mturk_charts/no_data_remaining/multi_col/707.png,"The high school dropout rate among U.S. Hispanics has fallen to a new low, extending a decades-long decline, according to recently released data from the Census Bureau. The reduction has come alongside a long-term increase in Hispanic college enrollment, which is at a record high. The Hispanic dropout rate was 10% in 2016, with about 648,000 Hispanics ages 18 to 24 – out of more than 6.5 million nationally in that age group – not completing high school and not enrolled in school. Just five years earlier, the rate had been 16%. The overall high school dropout rate in the U.S. has also fallen substantially in recent decades, matching a record low of 6% in 2016. Hispanics have accounted for much of that decline. Since 1999, the earliest year for which data on all major races and ethnicities are available, the dropout rate among Hispanics has fallen by 24 percentage points, compared with 9 points among blacks, 3 points among whites and 2 points among Asians. (Hispanics, however, still have the highest dropout rate of these four groups.)",good
mturk_charts/no_data_remaining/multi_col/708.png,"As the Hispanic dropout rate has declined, the share of Hispanic high school graduates who enroll in college has risen. In 2016, 47% of Hispanic high school graduates ages 18 to 24 were enrolled in college, up from 32% in 1999. By comparison, the share of college enrollees among 18- to 24-year-old white, black and Asian high school graduates increased more modestly.",good
mturk_charts/no_data_remaining/multi_col/709.png,"But, the majority of Americans don’t believe entertainment media undermine their understanding of science, technology and medicine. About half of frequent viewers of crime-focused shows (51%) say these programs have no effect on their own understanding of science-related topics. More say these shows help than hurt their understanding by a margin of 40% to 9%.",good
mturk_charts/no_data_remaining/multi_col/711.png,"Domestically, despite international concerns leveled by various governments regarding Duterte’s controversial clashes with drug cartels and potential human rights violations, the Filipino leader and his policies are widely popular. Fully 86% have a favorable view of Duterte himself, 78% support his handling of the illegal-drugs issue and 62% say that the Philippine government is making progress in its anti-drug campaign.1 Meanwhile, 78% believe the current economic situation is good and 57% are satisfied with the direction of the country, a 21-percentage-point increase from 2014, the last time this question was asked in the Philippines. Since being elected in 2016, Philippines President Rodrigo Duterte has waged a war on drugs that has garnered international condemnation, including accusations of crimes against humanity by the International Criminal Court. Yet Pew Research Center’s 2017 survey finds that Duterte is well-liked domestically and his policies, including his approach to the war on drugs, are generally popular among Filipinos. A 57% majority say they are satisfied with the way things are going in their country, up from 36% three years ago. Moreover, 78% believe that the economic situation in the Philippines is good, while only 20% say the economy is in bad shape.",good
mturk_charts/no_data_remaining/multi_col/710.png,"In addition to continuing support of U.S. military backing for their nation, Filipinos in recent years have softened their stance on their sometimes fraught relationship with China. Today, two-thirds say having a strong economic relationship with China is more important for ties between the two nations, while 28% say being tough with China on territorial disputes is more vital. This represents a dramatic shift since this question was last asked in 2015; at that time, Filipinos were almost evenly divided between forging a strong economic relationship with China (43%) and being tough on territorial disputes (41%).",good
mturk_charts/no_data_remaining/multi_col/712.png,"The Philippines is one of 16 official major non-NATO allies of the U.S. The two countries have maintained a strong military relationship for decades, but Duterte has made it a point to court the favor of China, sometimes at the cost of distancing his country from the U.S. Duterte’s balancing act between the two powers has received mostly positive reviews: 63% of Filipinos approve of his handling of relations with the U.S. and 53% approve of how he’s handled relations with China.",good
mturk_charts/no_data_remaining/multi_col/714.png,"Opinions about which country is the world’s leading economic power are also shifting in the Philippines. While 49% still consider the U.S. the world’s top economic power, this is down from 66% two years ago. Meanwhile, the share of the public naming China has risen from 14% to 25% in that same time period.",good
mturk_charts/no_data_remaining/multi_col/713.png,"The Philippines is one of 16 official major non-NATO allies of the U.S. The two countries have maintained a strong military relationship for decades, but Duterte has made it a point to court the favor of China, sometimes at the cost of distancing his country from the U.S. Duterte’s balancing act between the two powers has received mostly positive reviews: 63% of Filipinos approve of his handling of relations with the U.S. and 53% approve of how he’s handled relations with China. In the Philippines, the public is still more favorable toward the U.S. than China. Roughly eight-in-ten (78%) have a positive view of the U.S., compared with 55% for China. But positive feelings toward the U.S. are down 14 percentage points since 2015 (when Barack Obama was the U.S. president), which coincides with a global decline in U.S. favorability at the beginning of the Donald Trump era. On the other hand, favorable opinion of China has changed little since 2015 and is up 17 points since 2014, when most Filipinos were concerned that territorial disputes with China could lead to a military conflict.",good
mturk_charts/no_data_remaining/multi_col/715.png,"Filipinos’ levels of trust in American and Chinese leadership have also started to converge since 2015; trust in China’s Xi Jinping has remained stable, but Filipinos have much less trust in Trump than they did in Obama. In 2015, there was a 43-point gap between confidence in Obama (94%) and confidence in Xi (51%) to do the right thing in world affairs. Now, there is just a 16-point gap between Trump (69%) and Xi (53%).",good
mturk_charts/no_data_remaining/multi_col/716.png,"As far as educational attainment, men and women overall tend to agree on the importance of a man or a woman being well educated in order to make a good spouse or partner. But college graduates are more likely than those with lower levels of education to say this is very important. Among adults ages 25 and older with a bachelor’s degree or higher, 40% say being well educated is very important for a woman to be a good wife or partner, compared with 30% of those with less education. When it comes to the importance of a man being well educated, 44% of those with a bachelor’s degree or higher say this is very important, compared with 32% of those with less education.",good
mturk_charts/no_data_remaining/multi_col/717.png,"An overwhelming 86% of Germans believe their economy is doing well, up from 75% last year, according to a Pew Research Center survey conducted in spring. Views of the economy have been consistently positive since 2011, reflecting Germany’s quick recovery from the global financial crisis. By comparison, just 2% of Greeks, 15% of Italians, 21% of French and 28% of Spanish say their economies are doing well.",good
mturk_charts/no_data_remaining/multi_col/718.png,"Two-thirds of Muslims in the United States (67%) say the country needs to continue making changes to give blacks equal rights with whites, a higher percentage than the share of Americans in general who say this (57%). Muslim Americans are also more likely than the general public to say there is a lot of discrimination against black people in the U.S. About seven-in-ten U.S. Muslims (71%) say this, compared with 59% of the overall population, according to a 2017 Pew Research Center survey. Still, even when those who identify solely as black are excluded, U.S. Muslims are more likely than Americans overall to say more changes are needed for black people to have equal rights with whites (66% vs. 53%) and are more likely to say there is a lot of discrimination against blacks (66% vs 56%).",good
mturk_charts/no_data_remaining/multi_col/719.png,"Muslim Americans are also more likely than the general public to say there is a lot of discrimination against black people in the U.S. About seven-in-ten U.S. Muslims (71%) say this, compared with 59% of the overall population, according to a 2017 Pew Research Center survey.",good
mturk_charts/no_data_remaining/multi_col/721.png,"Marriage rates are also more closely linked to socio-economic status than ever before, according to a Pew Research Center analysis of Census Bureau data that shows that the education gap in marital status has continued to widen. In 2015, among adults ages 25 and older, 65% with a four-year college degree were married, compared with 55% of those with some college education and 50% among those with no education beyond high school. Twenty-five years earlier, the marriage rate was above 60% for each of these groups.",good
mturk_charts/no_data_remaining/multi_col/720.png,"Police officers are also viewed more positively by Republicans than Democrats. Among Republicans, 86% give officers a warm rating, including 74% who rate officers very warmly. Among Democrats, 57% give officers a warm rating on the scale (including just 33% who rate officers very warmly), while 21% offer a neutral rating and 19% offer a cold rating. Conservative and moderate Democrats (58%) and liberal Democrats (56%) are about equally likely to rate officers warmly, but liberal Democrats are less likely to offer a very warm rating.",good
mturk_charts/no_data_remaining/multi_col/722.png,"This analysis is based on a nationwide survey conducted online among 3,763 adults March 25-April 19, 2016. Of the total sample, it was possible to match the voting records of 3,309 registered voters from voter file records compiled by TargetSmart. This analysis is further restricted to the 2,758 registered voters 22 and older in 2016 (those old enough to have been eligible to vote in 2012). For further details about the survey and the match to the voter file, see the methodology. Despite being less interested in politics, drop-off voters were about as likely as consistent voters to say that people like them are able to improve their local communities, and most drop-off voters said an individual’s vote matters. In this sense, they stand out clearly from nonvoters. About eight-in-ten consistent voters (81%) said individual votes can make a difference and influence an election. A somewhat smaller majority (69%) of those who missed the 2014 midterm but turned out in 2012 and 2016 said the same. By contrast, fewer than half nonvoters (42%) – who did not cast ballots in 2012, 2014 or 2016 – said a person’s vote can make a difference.",good
mturk_charts/no_data_remaining/multi_col/723.png,"On every measure, registered nonvoters were less likely to report engaging in any form of political activity than both consistent and drop-off voters. At their most engaged, about 4-in-10 said they had volunteered for community service (42%). Just 9% said they had contributed money and 7% reported they had worked on a political campaign. Among 2016 voters, those who missed the 2014 midterm election reported having fewer conversations with their friends about current events compared with consistent voters. More than half (54%) of consistent voters said they talk about current events or things they have heard about in the news with their friends often or very often; 41% of drop-off voters said the same. Similar shares of consistent voters (24%) and drop-off voters (19%) say they heard politics discussed around their houses very often or often while growing up. A much larger share of nonvoters said they heard politics discussed rarely or never (59%) than either consistent (38%) or drop-off (45%) voters.",good
mturk_charts/no_data_remaining/multi_col/724.png,"More Mexicans view the United States unfavorably than at any time in the past decade and a half. Nearly two-thirds of Mexicans (65%) express a negative opinion of the U.S., more than double the share two years ago (29%). Mexicans’ opinions about the economic relationship with their country’s northern neighbor are also deteriorating, though less dramatically: 55% now say economic ties between Mexico and the U.S. are good for their country, down from 70% in 2013.",good
mturk_charts/no_data_remaining/multi_col/725.png,"More Mexicans view the United States unfavorably than at any time in the past decade and a half. Nearly two-thirds of Mexicans (65%) express a negative opinion of the U.S., more than double the share two years ago (29%). Mexicans’ opinions about the economic relationship with their country’s northern neighbor are also deteriorating, though less dramatically: 55% now say economic ties between Mexico and the U.S. are good for their country, down from 70% in 2013. This erosion of Mexico’s goodwill toward the U.S. coincides with low approval of American President Donald Trump and one of his signature policies. An overwhelming 94% of Mexicans oppose Trump’s proposed border wall and only 5% have confidence in him to do the right thing regarding world affairs, Trump’s lowest rating among 37 nations polled in 2017. President Barack Obama’s lowest rating in Mexico was 38%, in 2011. (For more on America’s image around the world, see “U.S. Image Suffers as Publics Around World Question Trump’s Leadership.”)",good
mturk_charts/no_data_remaining/multi_col/726.png,"Overall, the national mood in Mexico is grim: 85% are dissatisfied with the way things are going in Mexico generally, and perceptions of the national economy are not much better, with seven-in-ten believing the economic situation is bad.",good
mturk_charts/no_data_remaining/multi_col/727.png,"The rise of online streaming services such as Netflix and HBO Go has dramatically altered the media habits of Americans, especially young adults. About six-in-ten of those ages 18 to 29 (61%) say the primary way they watch television now is with streaming services on the internet, compared with 31% who say they mostly watch via a cable or satellite subscription and 5% who mainly watch with a digital antenna, according to a Pew Research Center survey conducted in August. Other age groups are less likely to use internet streaming services and are much more likely to cite cable TV as the primary way they watch television. Overall, 59% of U.S. adults say cable connections are their primary means of watching TV, while 28% cite streaming services and 9% say they use digital antennas. Among the other findings of the survey: The survey marks the latest in a number of Pew Research Center findings that show how much the internet and apps have shifted people’s access pathways to media and some types of content in recent years. The internet, for example, is now closing in on television as a source of news in the U.S. A generation ago, television was far and away the dominant news source for Americans, but now, the internet substantially outpaces TV as a regular news source for adults younger than 50.",good
mturk_charts/no_data_remaining/multi_col/728.png,"Republicans have recently turned negative in their assessments of the impact of colleges and universities, and a new survey finds that they also have a skeptical view of college professors. More Republicans offer a cold than warm view of professors on a “feeling thermometer” scale ranging from 0 to 100, with an average rating of 46. The Pew Research Center survey, conducted on the American Trends Panel in August, asks the public to rate a number of groups on a “feeling thermometer” from 0 to 100, where 0 is the coldest, most negative rating and 100 is the warmest, most positive. Overall, about half of the public (49%) gives college professors at least a somewhat warm rating, including a third (33%) who rate professors very warmly. Fewer (24%) give professors a cold rating, while 26% have a neutral view of professors. Democrats have a broadly positive view of college professors. About two-thirds (66%) give professors a warm rating, while just 7% offer a cold rating and 24% express a neutral view. Liberal Democrats are more likely than conservative and moderate Democrats to rate professors warmly, though majorities of both groups do so (76% and 56%, respectively). Views among Republicans are much chillier: 43% give cold ratings to college professors, including about a quarter (27%) who give a very cold rating. A significantly smaller share of Republicans (30%) give professors a warm rating, while 25% take a neutral view. Conservative Republicans are especially likely to give very (31%) or somewhat (20%) cold ratings to professors. By contrast, moderate and liberal Republicans hold quite different views: More offer warm (49%) than cold (20%) assessments of professors.",good
mturk_charts/no_data_remaining/multi_col/729.png,"In thinking about the issue positions of the two parties, majorities of Republicans and Democrats say they agree with their own party “almost always” or “more than half the time” – and very few agree with the opposing party’s positions. These views are little changed since last year. About seven-in-ten Republicans (72%) say they agree with the Republican Party almost always (22%) or more than half of the time (51%) on issues; another 21% agree with the party “about half of the time,” while just 7% agree “less than half of the time” or “almost never.” Among Democrats, there is a similar level of agreement with the party’s positions: 73% say they agree with the party almost always or more than half the time.",good
mturk_charts/no_data_remaining/multi_col/730.png,"About seven-in-ten Republicans (72%) say they agree with the Republican Party almost always (22%) or more than half of the time (51%) on issues; another 21% agree with the party “about half of the time,” while just 7% agree “less than half of the time” or “almost never.” Both Republicans and Democrats have largely positive views of members of the military and police officers, though in both cases Republicans’ ratings of the groups are warmer than Democratic ratings. Fully 93% of Republicans have a warm rating of people in the military, including 86% who give a very warm rating (76 or higher on the 0-100 scale). Though Democrats are less intensely positive than Republicans about members the military, 82% give a warm rating – including 69% who view service members very warmly. The partisan divide is more pronounced in views of police officers. Overall, 64% of the public views police officers warmly, 16% give them a neutral rating, while 18% view them coldly. While 86% of Republicans give officers warm ratings – and about three-quarters (74%) view them very warmly – a smaller majority of Democrats (57%) view officers warmly, and just 33% give them very warm ratings. Independents’ ratings are similar to Democrats (65% warm, 43% very warm). Still, only about two-in-ten Democrats (19%) or independents (16%) view officers coldly.",good
mturk_charts/no_data_remaining/multi_col/731.png,"Overall, college professors are viewed warmly: 49% give professors either a very warm (33%) or somewhat warm (16%) rating, 26% give professors a neutral rating, while 24% give them either a very cold (16%) or somewhat cold (8%) rating). But while Democratic ratings of professors are largely positive (66% warm, including 50% very warm), Republican views are more negative than positive. Just 30% of Republicans give college professors a warm rating, while 43% give them a cold rating. (For more on views of college professors, see “Republicans much ‘colder’ than Democrats in views of professors.”)",good
mturk_charts/no_data_remaining/multi_col/732.png,"As of August, 43% of Americans report often getting news online, just 7 percentage points lower than the 50% who often get news on television, according to a Pew Research Center survey conducted in August. This gap between the two news platforms was 19 points in early 2016, more than twice as large.",good
mturk_charts/no_data_remaining/multi_col/733.png,"The rise in online news consumption plays out across demographic groups, especially when looked at by age. The two oldest age groups saw considerable increases in online news use – 10 percentage points for those 65 and older (30% vs. 20% in early 2016) and 6 points among those ages 50 to 64 (35% vs. 29%). The pattern is in line with previous findings that show that recent growth in mobile news was driven by the oldest age groups. The decline in television as a source of news occurs both among 50- to 64-year-olds and 30- to 49-year-olds. The portion of those ages 50 to 64 who often get news on TV fell from 72% in 2016 to 64% today; for 30- to 49-year-olds, this declined from 45% to 35%. And while 18- to 29-year-olds did not show any significant change in their use of television news from early 2016, it was already substantially lower for this age group than for those 50 and older. Indeed, even in early 2016 this youngest age group was about twice as likely to often get news online as on TV (50% vs. 27%), about as large as the gap seen today (52% vs. 23%).",good
mturk_charts/no_data_remaining/multi_col/734.png,"About a quarter of U.S. adults (27%) now say they think of themselves as spiritual but not religious, up 8 percentage points in five years, according to a Pew Research Center survey conducted between April 25 and June 4 of this year. This growth has been broad-based: It has occurred among men and women; whites, blacks and Hispanics; people of many different ages and education levels; and among Republicans and Democrats. For instance, the share of whites who identify as spiritual but not religious has grown by 8 percentage points in the past five years.",good
mturk_charts/no_data_remaining/multi_col/735.png,"Millennials are the largest living generation by population size (79.8 million in 2016), but they trail Baby Boomers and Generation Xers when it comes to the number of households they head. Many Millennials still live under their parents’ roof or are in a college dorm or some other shared living situation. As of 2016, Millennials (ages 18 to 35 in 2016) headed only 28 million households, many fewer than were headed by Generation X (ages 36 to 51 in 2016) or Baby Boomers (ages 52 to 70).",good
