img_path,summary,category
mturk_charts/no_data_remaining/multi_col/961.png,"In addition, many Americans lack faith in various public and private institutions to protect their personal information from bad actors. They express some level of concern about a variety of entities, ranging from telecommunications firms to credit card companies. But their fears are especially pronounced for two institutions in particular: the federal government and social media platforms. Some 28% of Americans are not confident at all that the federal government can keep their personal information safe and secure from unauthorized users, while 24% of social media users lack any confidence in these sites to protect their data. By contrast, just 12% of Americans (and 9% of social media users) have a very high level of confidence that these entities can keep their personal information safe and secure.",good
mturk_charts/no_data_remaining/multi_col/962.png,"This lack of adherence to best practices begins with the ways that Americans keep track of the passwords to their online accounts. Cybersecurity experts generally recommend password management software as the safest and most secure way to track and maintain online passwords. Still, just 12% of internet users say that they ever use password management software themselves – and only 3% say that this is the password technique they rely on most. Instead, roughly two-thirds (65%) of internet users say that memorization is the main or only way they keep track of their online passwords – and another 18% rely primarily on writing their passwords down on a piece of paper. In other words, fully 84% of online adults rely primarily on memorization or pen and paper as their main (or only) approach to password management.",good
mturk_charts/no_data_remaining/multi_col/963.png,"Americans remain divided on the issue of encryption: 46% believe that the government should be able to access encrypted communications when investigating crimes, while 44% believe that technology companies should be able to use encryption tools that are unbreakable even to law enforcement. Democrats and younger adults tend to express greater support for strong encryption, while Republicans tend to express greater support for encryption protocols that can be accessed by law enforcement in the context of criminal investigations.",good
mturk_charts/no_data_remaining/multi_col/964.png,"Most U.S. police officers see significant challenges on the job in the wake of high-profile incidents involving law enforcement and black citizens. Among those challenges is a widespread feeling among officers that police are mistreated by the media, according to a recent Pew Research Center survey conducted by the National Police Research Platform. About eight-in-ten officers (81%) who work in departments of 100 or more sworn officers say the media generally treat the police unfairly, according to the survey. Just 18% of officers disagree. About four-in-ten officers (42%) strongly agree that the media are unfair to police.",good
mturk_charts/no_data_remaining/multi_col/965.png,"Within these countries, those who hold favorable views of right-wing populist parties – like the Alternative for Germany (AfD) or Italy’s Northern League – are more likely to express confidence in Putin than those who hold unfavorable views of those parties. Just about half of those who give positive ratings to the AfD and 46% who favor the Northern League say they are confident Putin will do the right thing regarding world affairs. People in the UK and Sweden with positive views of right-wing populist parties are also significantly more likely than those who are unfavorable toward right-wing populist parties to share confidence in Russia’s president. Support for a strong economic relationship with Russia is more widespread than confidence in Putin. In Germany, Italy, France, the Netherlands and the UK, majorities of those who favor right-wing populist parties say that having a strong economic relationship with Russia is more important than being tough with Moscow on foreign policy disputes. Nearly three-quarters (72%) of those favorable to the AfD and six-in-ten of those favorable to the National Front want a stronger economic relationship with Russia over an adversarial geopolitical one. In the Netherlands, those who view the right-wing Party for Freedom favorably are 17 percentage points more likely to say they prefer having strong economic ties with Moscow to being tough with Russia on foreign policy disputes; in the UK, the difference between the competing views is an even wider 21 points.",good
mturk_charts/no_data_remaining/multi_col/966.png,"As in previous policy priority surveys, the widest partisan gap is on the importance of dealing with global climate change. About six-in-ten Democrats (62%) say this should be a top priority for the president and Congress. Just 15% of Republicans say the same – making climate change by far the lowest-ranked of 21 policy priorities among Republicans. Republicans have ranked global climate change – or global warming in surveys prior to 2015 – at or close to the bottom of the list of policy priorities for more than a decade. At the same time, the share of Democrats who rate climate change as a top priority has steadily increased in recent years – from 46% in 2015 to 62% currently. There also is a sizable partisan gap over the importance of environmental protection as a policy priority. While 72% of Democrats say protecting the environment should be a top priority for Congress and the president, just 35% of Republicans say this.",good
mturk_charts/no_data_remaining/multi_col/967.png,"Almost one-in-five voting members of the House and Senate are a racial or ethnic minority, making the 115th U.S. Congress the most diverse in history. And while Congress as a whole remains disproportionately white when compared with the U.S. population, the racial and ethnic profile of newly elected members more closely resembles the increasingly diverse populace, according to a Pew Research Center analysis. Among minority groups in Congress, the biggest growth over time has been among Hispanics and Asians, both of whom have doubled their representation in the national legislature since 2001. Today, there are 39 Hispanics and 15 Asians in office, up from 19 Hispanics and seven Asians in the 107th Congress.",good
mturk_charts/no_data_remaining/multi_col/968.png,"The increasing number of minorities in Congress is due largely to changes in the House, where today 95 of 435 members (22%) are nonwhite, according to CQ Roll Call. By comparison, there were 60 minorities in the House in 2001. In the Senate, 10 of 100 members now belong to a racial or ethnic minority group, up from three in 2001.",good
mturk_charts/no_data_remaining/multi_col/969.png,"President Donald Trump is promising major changes on climate and energy policy, including efforts to increase production from fossil fuel energy sources such as coal. But a new Pew Research Center survey finds that 65% of Americans give priority to developing alternative energy sources, compared with 27% who would emphasize expanded production of fossil fuel sources.",good
mturk_charts/no_data_remaining/multi_col/970.png,"There continue to be wide political differences on energy priorities. While a 2016 Pew Research Center survey found large majorities of Democrats and Republicans supported expanding both wind and solar energy, the new survey shows that Democrats remain far more likely than Republicans to stress that developing alternative energy should take priority over developing fossil fuel sources. About eight-in-ten (81%) Democrats and independents who lean to the Democratic Party favor developing alternative sources instead of expanding production from fossil fuel sources. Republicans and Republican-leaning independents are closely divided: 45% say the more important priority should be developing alternative sources, while 44% say expanding production of oil, coal and natural gas should be given more priority.",good
mturk_charts/no_data_remaining/multi_col/971.png,"The GOP’s image has improved. In the aftermath of the election, the Republican Party’s image is more positive than it has been in years. Currently, about equal shares view the GOP favorably (47%) and unfavorably (49%). The share that views the Republican Party favorably is up 7 percentage points since October and is 14 points higher than it was in April of 2016.",good
mturk_charts/no_data_remaining/multi_col/973.png,"Democrats glumly approach a new era. For the first time in a decade, Democrats are shut out of power in Washington. Today, they are about as pessimistic about the new year as Republicans were four years ago, after Obama’s reelection. Just 24% of Democrats say 2017 will be better than 2016. By contrast, victorious Republicans are optimistic: 83% expect 2017 to be better than 2016. The Democrats’ gloom also has affected their view of the economy: In December, just 15% said they expect the nation’s economy to improve over the next year, down from 35% last June. Republican economic optimism, by contrast, has soared: 75% predicted the economy would get better, more than double the share who said this in June (29%).",good
mturk_charts/no_data_remaining/multi_col/974.png,"Obama leaves office on a high note. The soon-to-be-former president leaves office with an approval rating of 55%, among his highest ratings since 2012. Obama’s job ratings, which had been mixed for the early portion of his second term, moved into positive territory in June and have stayed there ever since.",good
mturk_charts/no_data_remaining/multi_col/972.png,"Currently, 67% of Democrats and Democratic leaners view Russia’s “power and influence” as a major threat to the U.S. Last April, just 37% of Democrats said “tensions with Russia” posed a major threat. Republicans’ views are little changed over this period, and today just 41% regard Russia’s power as a major threat to the U.S.",good
mturk_charts/no_data_remaining/multi_col/975.png,"Should all of President-elect Donald Trump’s Cabinet nominees eventually be confirmed, he will start his administration with one of the most heavily business-oriented Cabinets in U.S. history. Five of the 15 people Trump has nominated to be Cabinet secretaries have spent all or nearly all their careers in the business world, with no significant public office or senior military service on their résumés. That would be more businesspeople with no public-sector experience than have ever served in the Cabinet at any one time, according to a review and analysis by the Pew Research Center. Even accounting for the growth of the Cabinet over time, Trump would be in the top tier in terms of the percentage of career businesspeople as Cabinet secretaries. A third of the department heads in the Trump administration (33%) will be people whose prior experience has been entirely in the public sector. Only three other presidents are in the same range: William McKinley (three out eight Cabinet positions, or 37.5%), Ronald Reagan (four out of 13 positions, or 31%), and Dwight Eisenhower (three out of 10 positions, or 30%).",good
mturk_charts/no_data_remaining/multi_col/976.png,"Ahead of Donald Trump’s inauguration as the nation’s 45th president, the public sees a country deeply fractured along partisan lines. Fully 86% describe the country as more politically divided today than in the past, while just 12% say the country is no more divided.",complex
mturk_charts/no_data_remaining/multi_col/977.png,"The latest national survey by Pew Research Center, conducted Jan. 4-9 among 1,502 adults, finds little optimism that the country’s political divisions will subside any time soon: 40% expect the country to be about as politically divided in five years as it is today, while 31% think it will be even more divided; just 24% expect divisions to lessen. When asked a more general question about the year ahead, public views are mixed: 49% think 2017 will be a better year than 2016, while 42% think it will be worse. Expectations for 2017 are about as negative as for any year over the last decade. Compared with a year ago, optimism among Republicans has surged, while views among Democrats have plummeted. Fully 83% of Republicans and Republican leaners expect 2017 to be better than 2016; a year ago, 44% expected a better year in 2016 than 2015. By contrast, just 24% of Democrats and Democratic leaners expect a better year in 2017 (65% thought 2016 would be better than 2015).",complex
mturk_charts/no_data_remaining/multi_col/978.png,"On a follow-up question on why 2017 will be better or worse than 2016, mentions of Donald Trump dominate among both those optimistic and pessimistic about the year ahead. Overall, 56% of those who think 2017 will be better say Trump is the reason they feel this way. No other response comes close (15% offer general mentions of optimism, while 11% express some form of economic optimism). Among those who think 2017 will be worse than 2016, Trump is even more widely cited as the reason for their view. About seven-in-ten (72%) say Trump is the reason why they expect the year ahead to be worse. Far fewer cite other reasons, such as the political divisions in the country (6%) or pessimism about the Republican-controlled Congress (6%).",good
mturk_charts/no_data_remaining/multi_col/979.png,"While the 2016 elections have done little to brighten the public’s overall outlook or raise expectations for partisan cooperation, the Republican Party has seen its standing improve in the wake of Trump’s presidential win and the GOP maintaining control of Congress. Today, about as many hold a favorable (47%) as unfavorable (49%) view of the Republican Party. This is the first time views of the GOP have been about as favorable as unfavorable since 2011. The Democratic Party is rated slightly more positively (51% favorable, 45% unfavorable) than the GOP, but the gap in assessments of the two parties is much narrower than it was just a few weeks before the election, in October 2016. Furthermore, the GOP has drawn even with the Democrats as the party seen as “more concerned with the needs of people like me:” 45% say this phrase better describes the Democratic Party, while 44% now say it better describes the Republican Party. In July 2015, far more said the Democratic Party (53%) than the Republican Party (31%) was better described by this phrase.",good
mturk_charts/no_data_remaining/multi_col/980.png,"Roughly equal shares of the public expect the “overall level of ethics and honesty in the federal government” to rise (29%), fall (34%) or stay the same (33%) with Trump as president. As with expectations for Trump’s success in office, predictions about federal ethics and honesty during his tenure as president are split along partisan and ideological lines. About half of Republicans and Republican-leaning independents (53%) expect ethics and honesty in government will rise; 39% say they will stay the same while just 6% expect them to fall. By contrast, 59% of Democrats and Democratic leaners say they will fall, 27% expect they will stay the same and just 10% say they will rise. There are ideological divides within the two parties – 72% of liberal Democrats, compared with 49% of conservative and moderate Democrats, expect the level of ethics and honesty to fall with Trump as president. And while 35% of conservative and moderate Democrats expect little change in the overall level of ethics in the federal government, just 19% of liberals say this (only 8% of liberals and 13% of conservative and moderate Democrats expect ethical levels to rise).",good
mturk_charts/no_data_remaining/multi_col/982.png,"The improvement in the Republican Party’s favorability rating is most pronounced among independents who lean toward the GOP. In the wake of Trump’s victory, about seven-in-ten Republican leaners (72%) have a favorable opinion of the GOP, which is up 15 points since October and 29 points since April. Republicans are about as favorable toward their party today (83%) as they were in October (82%), though ratings have improved 15 points since the spring. Democratic views of the GOP have also ticked more positive than in recent months, though just 20% of Democrats and 27% of Democratic leaners view the Republican Party favorably. While overall ratings of the Democratic Party are unchanged since the fall, there have been shifts in views among subgroups over this period. Favorable views of the Democratic Party are down slightly among Democrats (88% today, from 94% in October), but they are unchanged among Democratic leaners. Both Republicans (up 8 points) and Republican leaners (up 9 points) are somewhat more likely to rate the Democratic Party favorably today than they were in October.",good
mturk_charts/no_data_remaining/multi_col/981.png,"For the first time since 2011, about as many have a positive as negative impression of the Republican Party: 47% now hold a favorable view of the GOP, compared with 49% who have an unfavorable view. The share who views the Republican Party favorably is up 7 percentage points since October and is 14 points higher than it was in April of 2016. Ratings of the Democratic Party remain somewhat more positive than those of the Republican Party, though the gap in assessments of the two parties has narrowed. Overall, slightly more hold a favorable (51%) than unfavorable (45%) view of the Democratic Party. These ratings are about the same as they were last October.",good
mturk_charts/no_data_remaining/multi_col/984.png,"About six-in-ten Americans (61%) expect that Republicans and Democrats in Washington will bicker and oppose one another more than usual, while just 29% say they expect the parties to work together more. Majorities have expected the parties to bicker and oppose rather than work together in recent years, though public predictions for partisan cooperation were substantially higher on the eve of Barack Obama’s inauguration eight years ago. In January 2009, 50% expected the two parties to work together more, while fewer (39%) expected greater hostility.",good
mturk_charts/no_data_remaining/multi_col/985.png,"With just a few days remaining in Barack Obama’s presidency, 55% say they approve of his handling of the job; 40% disapprove. His current rating is little different than in recent months, though he leaves office with approval ratings that are as high as they have been since shortly after his re-election in 2012.",good
mturk_charts/no_data_remaining/multi_col/986.png,"When Francis began his papacy in March of 2013, 57% of Americans held a favorable view of him, while 14% held an unfavorable view and 29% couldn’t give him a rating. Now, seven-in-ten Americans express a favorable view of Francis, while 19% express an unfavorable opinion and just 11% say they don’t know enough to be able to rate the pontiff.",good
mturk_charts/no_data_remaining/multi_col/987.png,"Some world leaders begin their tenures with high favorability ratings – only to see their popularity fall over time. But, in the U.S., Pope Francis remains as popular as ever, with seven-in-ten Americans saying their opinion of the pontiff is “very” or “mostly” favorable, according to a new Pew Research Center survey. When Francis began his papacy in March of 2013, 57% of Americans held a favorable view of him, while 14% held an unfavorable view and 29% couldn’t give him a rating. Now, seven-in-ten Americans express a favorable view of Francis, while 19% express an unfavorable opinion and just 11% say they don’t know enough to be able to rate the pontiff. Not surprisingly, Pope Francis is even more popular among U.S. Catholics than he is among the public as a whole, with eight-in-ten or more American Catholics routinely giving the pope favorable ratings. Currently, 87% of Catholics express a favorable view of the pope.",complex
mturk_charts/no_data_remaining/multi_col/988.png,"About half of Americans (46%) say they plan to watch as Donald Trump takes the presidential oath of office on Friday, while 51% say they do not intend to watch the inauguration. Interest in Trump’s inaugural is lower than for Barack Obama’s first inauguration in 2009, when two-thirds of Americans (67%) said they were planning to watch. It is also lower than for Bill Clinton’s first inaugural in 1993, when 57% said they intended to watch. (The question was not asked when George W. Bush took office in 2001.) There is a wide partisan gap over plans to watch the inauguration, according to a new Pew Research Center survey, conducted Jan. 4-9 among 1,502 adults. About seven-in-ten Republicans and Republican-leaning independents (69%) say they will watch the event, compared with just 30% of Democrats and Democratic leaners. Despite their overall support for the president-elect and his plans, Republicans are less enthusiastic about watching Trump’s inauguration than Democrats were about watching Obama’s eight years ago (69% of Republicans today, compared with 84% of Democrats in 2009).",good
mturk_charts/no_data_remaining/multi_col/983.png,The public is equally likely to say the Republican (43%) as Democratic Party (43%) can better manage the federal government. Views on this question are little changed in recent years.,complex
mturk_charts/no_data_remaining/multi_col/989.png,"Just prior to Obama taking office in 2009, more than twice as many said people like them would gain rather than lose influence (47% vs. 18%) and the margin was nearly as wide before Clinton took office in January 1993 (43% vs. 22%). In early 2001, 35% said people like them would gain influence with Bush in the White House, while 26% thought they would lose influence.",good
mturk_charts/no_data_remaining/multi_col/990.png,"Based on the conventional statistics used to gauge educational attainment, the nation has made some progress toward this 2020 goal during the Obama years. In March 2009, 41% of 25- to 34-year-olds had completed at least an associate degree. By March 2016, 48% of young adults had done so. Women continue to outpace men in terms of educational attainment, though both groups are making gains at a fairly similar rate. A larger share of female 25- to 34-year-olds (52%) had finished college in 2016 than their male counterparts (43%).",good
mturk_charts/no_data_remaining/multi_col/991.png,"While young Hispanics are furthest from the 2020 goal, there are large gaps between U.S.-born and foreign-born Hispanics. U.S.-born Hispanics are twice as likely as their foreign-born counterparts to have completed at least an associate degree (34% vs. 17%). In fact, the attainment rate of young U.S.-born Hispanics is on par with that of young blacks (35%). It’s important to note that many young foreign-born Hispanics have recently arrived in the U.S. from countries with lower average levels of education than the U.S. Conversely, young foreign-born Asians are more likely than their U.S.-born counterparts to have completed at least an associate degree. This is largely due to the fact that many of these young Asian immigrants hail from nations that have higher educational attainment levels than the U.S. overall.",good
mturk_charts/no_data_remaining/multi_col/992.png,"The nationwide survey of 7,917 police officers in departments with at least 100 officers finds that many female officers think men in their department are treated better than women when it comes to assignments and promotions. About four-in-ten female officers (43%) say this is the case, compared with just 6% of male officers. By contrast, a third of male officers say women are treated better than men when it comes to assignments and promotions in their department – but just 6% of women say this is the case. Six-in-ten male officers and half of female officers say men and women are treated about the same.",good
mturk_charts/no_data_remaining/multi_col/993.png,"Currently, 60% of Americans say the government should be responsible for ensuring health care coverage for all Americans, compared with 38% who say this should not be the government’s responsibility. The share saying it is the government’s responsibility has increased from 51% last year and now stands at its highest point in nearly a decade.",good
mturk_charts/no_data_remaining/multi_col/994.png,"The new national survey by Pew Research Center, conducted Jan. 4-9 among 1,502 adults, finds only modest changes since last year in perceptions of these threats, but there are a few notable exceptions. Last April, just 42% viewed “tensions with Russia” as a major threat; today, 54% say the same about “Russia’s power and influence.” The largest change in partisan views of global threats is seen in assessments of Russia. Currently, Democrats are 26 percentage points more likely than Republicans to say Russia’s power and influence is a major threat to the well-being of the United States (67% vs. 41%). As recently as last April, before the allegations that Russia hacked Hillary Clinton’s campaign and the Democratic National Committee, Republicans were somewhat more likely than Democrats to view tensions with Russia as a major threat (46% of Republicans vs. 37% of Democrats). (For more on views of Russia and the alleged hacking, including ratings of Vladimir Putin, see: “U.S. public sees Russian role in campaign hacking, but is divided over new sanctions,” released Jan. 10, 2017)",good
