img_path,summary,category
mturk_charts/no_data_remaining/multi_col/2282.png,"Support for same-sex marriage has been growing in recent years, with half (50%) of Americans now in favor and 43% opposed. While support is considerably lower among those who identify as white evangelical Protestant, Republican or politically conservative, support for same-sex marriage has risen even among these groups over the past decade, according to aggregated Pew Research data. For example, data from Pew Research surveys from March and May 2013 show that adults under age 30 who say they are Republican or lean Republican are much more supportive of same-sex marriage (54%) than Republicans 65 and older (18%). At the same time, younger Republicans are much less supportive of same-sex marriage than those in the 18-29 age bracket who are Democrats or lean Democratic (54% vs. 76%).",good
mturk_charts/no_data_remaining/multi_col/2283.png,"In an increasingly technologized, interlinked global economy, where more and more jobs involve analyzing and communicating information, the correlation between productivity (defined as output per hour worked) and use of reading skills at work may come as no surprise. But it has major developmental implications, the OECD noted, especially for countries that aren’t effectively deploying what skills their residents have.",unquestionable
mturk_charts/no_data_remaining/multi_col/2284.png,"In Pew Research Center’s latest survey, three-quarters of Republicans (77%) say President Obama should agree to a budget deal that includes changes to the Affordable Care Act. More than half (54%) say it would be unacceptable for Republicans to drop this requirement even if it were the only way to end the shutdown. A similar share of Democrats want a deal with no changes to health care (75%) and say it would be unacceptable for Obama to give ground if it were necessary to end the shutdown (58%). However, when compromise is presented as a general concept with no specific tradeoffs mentioned, the public’s attitude is different. A CBS News poll last week asked if Obama and Democrats should compromise in order to get a budget agreement and also asked if Republicans should compromise. The survey found that three-quarters of the public want the Democrats to compromise and three-quarters say the Republicans should compromise. That includes 61% of Democrats saying their own party should compromise and 59% of Republicans saying the GOP should compromise. And, in our recent survey, six-in-ten (61%) said lawmakers who share their views should be more willing to compromise instead of standing by their principles if it means the shutdown continues (29%).",good
mturk_charts/no_data_remaining/multi_col/2285.png,"Pew Research surveys dating back 25 years, consistently show that the public, as a general proposition, likes political leaders who are willing to make compromises. In our April 2012 survey, fully 80% said they wanted leaders who were willing to compromise to get things done and just 16% disagreed. Democrats have always been more supportive of this idea than Republicans (90% of Democrats last year wanted leaders who compromised), but about two-thirds of Republicans consistently express this desire as well (68%).",good
mturk_charts/no_data_remaining/multi_col/2286.png,"But now, as the White House and Congress find themselves in yet another showdown over the budget and debt ceiling, Gallup reports that 33% of Americans now cite dissatisfaction with government and lawmakers as the nation’s top issue. That figure not only surpasses the economy (19%) and unemployment (12%), but is the highest such percentage dating back to 1939 for what Gallup describes as “dysfunctional government.” Gallup said that the economy and jobs as the nation’s top problem had already been declining this year. But, in its survey conducted Oct. 3-6, Americans who mentioned some dissatisfaction with government leadership as the top problem doubled to the 33% mark, compared to 16% last month.",good
mturk_charts/no_data_remaining/multi_col/2287.png,"“We find substantial under-reporting of LGBT [lesbian, gay, bisexual and transgender] identity and behaviors as well as underreporting of anti-gay sentiment …even under anonymous and very private conditions,” the researchers wrote in a working paper just published by the National Bureau of Economic Research. In the results using the experimental technique, self-reports of non-heterosexual identity amounted to 19% of those surveyed using the Veiled Report methods – 65% higher than the 11% in the control group. The share reporting same-sex sexual experiences also grew from 17% in the control group to 27% in the Veiled Report group, they reported. (Because their experiment did not use a random sample of the adult population, the researchers do not attempt to estimate the actual size of the country’s gay and lesbian population.) The experimental method also increased the rates of anti-gay sentiment. For example, the share who disapproved of having an openly gay manager at work increased from 16% in the control group to 27% in the Veiled Report group. The proportion who thought it should be legal to discriminate when hiring on the basis of sexual orientation also rose from 14% to 25%. However, those in the Veiled Report treatment were less likely than those in the Direct Report treatment to say that a homosexual person “can change their sexual orientation if they choose to do so” (22% vs. 15%). As the authors suggest, “This indicates that participants saw it more socially desirable to report that sexual orientation is changeable, which goes in the opposite direction of a general ‘pro-LGBT’ norm.”",good
mturk_charts/no_data_remaining/multi_col/2288.png,"While location-tagging has grown more popular over the past two years, another location-based practice — “checking in” via a geosocial service such as Foursquare — seems to have become less so. The May survey found that 12% of adult smartphone owners (equivalent to 7% of all adults) had used a check-in service , down from 18% (10% of all adults) in February 2012.",good
mturk_charts/no_data_remaining/multi_col/2289.png,"In our most recent survey in July, 48% of Americans expressed a favorable view of the court while 38% regarded it unfavorably, the first time the positive number had edged below the 50% mark. Prior to the decisions handed down in June, a March survey found 52% viewed the court favorably while 31 % had an unfavorable opinion. As recently as 2007, nearly three-quarters (72%) of Americans had viewed the court positively.",good
mturk_charts/no_data_remaining/multi_col/2290.png,"While the court’s favorability declined this year, partisan differences in opinions about it narrowed. Overall, 54% of Democrats in the July survey had a favorable view of the court as did 48% of Republicans, with 47% of independents sharing that view. In a July 2012 survey, after the court upheld the new health care law, the number of Republicans holding a favorable view of the court dropped to 38% compared to 56% who had a positive view in April. After the health care decision, the number of Democrats expressing a favorable view increased 12 points, from 52% to 64%.",good
mturk_charts/no_data_remaining/multi_col/2291.png,"Because of the federal government shutdown, there was no official word from the Bureau of Labor Statistics Friday on September’s unemployment rate or how many payroll jobs businesses added last month (the more significant indicator, according to most economists). But we do have a fairly reliable substitute: the monthly report on private-sector jobs produced by Automatic Data Processing, or ADP. According to ADP, businesses added 166,000 jobs last month.",complex
mturk_charts/no_data_remaining/multi_col/2292.png,"Hispanics’ views of the impact of unauthorized immigration on the U.S. Hispanic community have grown more positive since 2010, according to a new nationwide survey of 5,103 Hispanic adults by the Pew Research Center. Today, 45% of Hispanic adults say the impact of unauthorized immigration on Hispanics already living in the U.S. is positive, up 16 percentage points from 2010 when 29% said the same.",good
mturk_charts/no_data_remaining/multi_col/2293.png,"With a possible government shutdown just hours away, public anger at the federal government is as high as at any point since the Pew Research Center began asking the question in 1997. Anger is most palpable among conservative Republicans – 41% say they are angry at the federal government, the highest among any partisan group. The new national survey by the Pew Research Center, conducted Sept. 25-29 among 1,005 adults, finds that 26% overall say they are angry at the federal government, while 51% feel frustrated. Just 17% say they are basically content with the government. As in the past, substantial majorities across the political spectrum are either angry or frustrated with the federal government. But anger at the government is far more widespread among conservative Republicans than other partisan groups. This marks a change from 2011, when political independents (30% angry) were about as likely as conservative Republicans (32%) to express anger at the federal government. In the new survey, 41% of conservative Republicans say they feel angry at the government, compared with 27% of independents. Conservative Republicans are roughly twice as likely as liberal Democrats to say they are angry with government (41% vs. 18%).",good
mturk_charts/no_data_remaining/multi_col/2294.png,"We took the opportunity to look back at Americans’ habits to “Google themselves” during the first decade of the search engine’s life and found that, after an initial increase, the activity appears to have leveled off. In a survey conducted in April and May of 2013, we found that 56% of internet users have used a search engine to look up their own name to see what information is available about them online, up from 22% who had done that in 2001 (the first time we asked the question).",good
mturk_charts/no_data_remaining/multi_col/2295.png,"Public views of Republican leaders’ policies, which were nearly two-to-one positive in the month after the election (52% approve, 28% disapprove), turned negative just eight months later. In August 1995, 38% approved GOP leaders’ proposals while 45% disapproved. Notably, these opinions did not change much over the following year – including through the period of the two government shutdowns.",good
mturk_charts/no_data_remaining/multi_col/2296.png,"Nuclear power has lost support over the past year. Currently, 38% favor the increased use of nuclear power while 58% are opposed. In March 2012, opinion was more closely divided (44% favor, 49% oppose). As recently as February 2010, significantly more favored (52%) than opposed (41%) the increased use of nuclear power.",good
mturk_charts/no_data_remaining/multi_col/2297.png,"Just a few years ago, there was broad agreement on some – though not all – energy policy objectives. In 2006, during George W. Bush’s presidency, comparable majorities of independents (85%), Republicans (82%) and Democrats (77%) favored increasing federal funding for research on wind, solar and hydrogen technology. Since then, support for funding alternative technology research has fallen by 24 points among Republicans (to 58%) and 10 points among independents (75%), while increasing slightly among Democrats (84%). Much of the change in opinions among Republicans came after Barack Obama took office in 2009. In September 2008, 85% of Republicans and 77% of independents favor increased funding for alternative energy research; in May of 2010, 61% of Republicans and 73% of independents favored more funding for alternative energy research. There has been a similar trend in opinions about requiring better fuel efficiency for cars, trucks and SUVs. Seven years ago, large majorities across all partisan groups (87% of independents, 86% of Democrats and 85% of Republicans) favored higher fuel efficiency standards. The percentage of Democrats favoring this has changed little over this period (currently 84% favor), while falling 25 points among Republicans and 13 points among independents.",complex
mturk_charts/no_data_remaining/multi_col/2298.png,"At first glance, new data released Wednesday from the Federal Reserve appears to show an increase in the nation’s net worth compared with six years ago, when the stock market plunged and the financial sector was on the brink of collapse. The Fed reported that the nation’s net worth is $74.8 trillion as of June 30, compared with $67.8 trillion in 2007. Does that mean the wealth of a typical U.S. household has fully recovered from the Great Recession? Hardly. Keep in mind 3 considerations:",good
mturk_charts/no_data_remaining/multi_col/2299.png,"In fact, not only were more jobs wiped out in the Great Recession than any other post-World War II downturn — 8.7 million, or 6.3% of the pre-recession peak payroll — but it’s taking longer to regain them than it did in the previous two post-recession recoveries combined. We pulled monthly figures on seasonally adjusted non-farm payroll jobs, which economists generally consider a more reliable measure than the unemployment rate, from the Bureau of Labor Statistics. Then we identified the employment peaks and troughs associated with each of the 11 postwar recessions, and counted how many months it took for payrolls to regain all the lost jobs. (The job peaks and troughs don’t exactly coincide with the official starting and ending dates of recessions, as determined by the National Bureau of Economic Research, because the NBER looks at more economic indicators besides jobs when dating business cycles.) The result: From the late 1940s until the early 1990s, the U.S. ec0nomy never took more than a year to regain all the jobs lost during downturns. The 1990-91 recession was fairly mild — only 1.6 million jobs lost, or 1.5% of peak payroll employment — but it took 21 months to recover them all. That was the first, though not the last, “jobless recovery“: In the aftermath of the dot-com bubble, 2.7 million jobs evaporated; it took 18 months after payrolls bottomed out for them all to come back.",complex
mturk_charts/no_data_remaining/multi_col/2300.png,"The number of people killed in religion-related terrorist attacks in Kenya has dramatically increased in recent years. According to reports analyzed by the Pew Research Center as part of our ongoing global study of religious restrictions and hostilities, more than 300 people were killed, injured or displaced as a result of religion-related terrorist attacks in Kenya in 2012, more than twice as many as in 2011 and more than a five-fold increase from 2010. In general, social hostilities involving religion, defined by Pew Research as concrete acts of religious violence ranging from hate crimes to religion-related terrorism and war, are much higher in Kenya than in sub-Saharan Africa as a whole. In 2012, Kenya had nearly four times the level of social hostilities (8.3 on a scale of 10) as the median level among the 48 countries in the region (2.1). The Pew Research Social Hostilities Index takes into account the level and intensity of hostilities, including sectarian violence, religion-related mob violence and so-called honor killings, where the perpetrators are motivated by religion.",good
mturk_charts/no_data_remaining/multi_col/2301.png,"For the first time on record, households headed by someone with at least a bachelor’s degree received nearly a majority (49.7%) of aggregate U.S. household income; nearly one out of every two dollars went to the college educated. In 2012 one-in-three households was college educated, so, put another way, half of the aggregate U.S. income goes to one third of the households.",good
mturk_charts/no_data_remaining/multi_col/2302.png,"A stellar analysis of the city’s troubled financial history by the Detroit Free Press concluded that Detroit’s bankruptcy was the result of decades of poor decisions by city leaders — failure to trim payroll in the 1960s and 1970s as the city’s population and property-tax base began to fall, heavy borrowing to cover operating expenses in recent years, mismanagement of urban redevelopment projects, paying $1 billion in pension bonuses from 1985 to 2008, and much more. The paper distilled five decades’ worth of data into a series of graphics (of which this is just one) and accompanying text that clearly lay out a series of lost opportunities to avoid tumbling into a fiscal black hole.",complex
mturk_charts/no_data_remaining/multi_col/2303.png,The Chinese public is increasingly concerned about the quality of the country’s air and water after a year in which China experienced numerous high-profile environmental problems.,unquestionable
mturk_charts/no_data_remaining/multi_col/2304.png,"The media’s newfound focus on the economy as a central campaign issue also coincided with increasingly unflattering coverage of McCain. The week before the Lehman Brothers collapse, McCain was benefiting from a post-convention bounce that was reflected in the tone of his media coverage. From Sept. 8-14, 37% of campaign narrative focused on the senator was positive in tone, while 32% was negative (another 31% was neutral).",good
mturk_charts/no_data_remaining/multi_col/2305.png,"New data show that median household income has stagnated for the longest period since the government began collecting such data in 1967. In 2012 the median household income was $51,017, still below the pre-recession 2007 level ($55,627) and also below the all-time peak level reached in 1999 ($56,080). So the typical American household had 9% less income in 2012 than it did 13 years earlier (all figures adjusted for inflation). The 2012 level is just above where it had stood as of 1995 ($50,978). Households headed by those 65 and older are faring relatively better since the recession. The income patterns of younger and older households have moved in opposite directions in recent years. The median incomes of households headed by those 65 and older have risen during the recession and recovery, continuing their steady rise over more than four decades. By contrast, the median incomes of younger and middle-aged households have declined since the onset of the recession. In 2012, the median household income among those led by someone aged 65 and older was $33,848, statistically unchanged from $33,810 in 2011. Thus, in 2012 the median household income of seniors was 66% of the national median household income. Back in 1967, the median income of these older households was only 39% of the national median.",good
mturk_charts/no_data_remaining/multi_col/2306.png,"The median household incomes of white, black, Hispanic and Asian households did not statistically change from 2011 to 2012. As the recent Pew Research report on Martin Luther King Jr.’s elusive dream noted, the gap in median income between white and black households has not changed much over the decades. In 1972, white incomes were 1.7 times black incomes. White and black incomes have both risen since then and in 2012 white incomes were 1.7 times black incomes. The white-to-Hispanic income gap has risen since 1972, from 1.3 in 1972 to 1.5 in 2012. The Census Bureau has tracked Asian household incomes since 1987. In 1987 white incomes were about 88% of the typical Asian household. By 2012, whites incomes were 83% of Asian incomes. These household income figures from the Census are not adjusted for variance in household size. Asian-Americans tend to have more people living in their households than do other race groups, which may account for some of the gap in median income.",unquestionable
mturk_charts/no_data_remaining/multi_col/2307.png,"Sudan is one of an increasing number of countries whose governments regulate the wearing of religious symbols or attire, such as head coverings for women or facial hair for men. The Pew Research Center’s latest report on global restrictions on religion finds that, as of 2011, 53 of the 198 countries included in the study (27%) have such restrictions, up from 21 countries (11%) in 2007. In addition to government regulations, private individuals and groups also try to enforce norms of religious attire in many countries. Our study finds that the number of countries in which women have been harassed by individuals or groups for violating religious dress codes has increased in recent years. In the latest year studied, such social hostilities over religious attire were found in 50 countries (25%), including Sudan. Five years earlier, such incidents were reported in 14 countries (7%). While there may not be a direct causal connection between government regulations and social hostilities involving religious attire, our data show that harassment of women over religious dress occurs more often in countries where the wearing of religious symbols and attire are regulated by any level of government.",good
mturk_charts/no_data_remaining/multi_col/2308.png,"Hard times can act to bring families together, and the Great Recession of 2007-09 was no different: The number of children living with a grandparent surged after the onset of the recession, as did the number of children whose primary caregiver was that grandparent. A Pew Research Center analysis of Census data found that 7.7 million U.S. children — about 10% of all children in the country — were living in the same household as at least one of their grandparents in 2011, and for 3 million that grandparent also was their primary caregiver. Both trends stabilized at higher level after the recession’s official end in mid-2009.",good
mturk_charts/no_data_remaining/multi_col/2309.png,"While 58% of Americans have a positive opinion of the UN, support varies considerably by political party. A strong majority of Democrats (72%) in the U.S. have a favorable view of the international body, while a smaller 60%-majority of independents agree. Meanwhile, support among Republicans trails at 41% and has dropped ten percentage points since 2011.",good
mturk_charts/no_data_remaining/multi_col/2310.png,"Currently, 53% disapprove of the health care law, while 42% approve. This is among the most negative assessments of the law since it was enacted in March 2010. In July 2012, shortly after the Supreme Court upheld most of the provisions of the Affordable Care Act, 47% approved of the legislation and 43% disapproved. Overall opinion about the health care law has fluctuated in recent years, yet the patterns of opposition and support across demographic and partisan groups have remained fairly steady since the legislation was first being debated in Congress.",good
mturk_charts/no_data_remaining/multi_col/2311.png,"Nearly two-thirds (63%) of cell phone owners now use their phone to go online, according to a new survey by the Pew Research Center’s Internet &amp; American Life Project. We call them “cell internet users” and define them as anyone who uses their cell phone to access the internet or use email. Because 91% of all Americans now own a cell phone, this means that 57% of all American adults are cell internet users. The proportion of cell owners who use their phone to go online has doubled since 2009.",good
mturk_charts/no_data_remaining/multi_col/2312.png,"It was five years ago this month when the financial crisis, which had been steadily worsening for months, reached critical mass and exploded with a force that, for a while, threatened to take down the entire global economy. But a lot has happened since then, and who can remember all the details? Was it Bear Stearns or Lehman Brothers that collapsed first? Wasn’t TARP enacted under President Obama? And what did TARP stand for anyway?",complex
mturk_charts/no_data_remaining/multi_col/2313.png,"Beyond the raw dollar figures, an arguably more useful way to look at the national debt is as a percentage of gross domestic product. Based on the latest GDP estimate the debt currently stands at just over 100% of gross domestic product, its highest level since just after World War II. (It was 55.6% of GDP at the end of fiscal 2001, according to a useful primer prepared by the Congressional Research Service.) That gives the United States one of the higher debt-to-GDP ratios among the 30 developed economies tracked by the Organization for Economic Cooperation and Development, though not the highest: That title goes to Japan, whose public debt is more than twice its GDP.",complex
mturk_charts/no_data_remaining/multi_col/2314.png,"Five years after the financial crisis, views of the national economy still remain negative. Only 19% rate the economy as excellent or good. By contrast, about a third (32%) rate the economy as poor and roughly half (48%) say economic conditions are only fair.",complex
mturk_charts/no_data_remaining/multi_col/2315.png,"Overall, 40% say that the job situation is the national economic issue that worries them most, while somewhat fewer cite the budget deficit (24%) or rising prices (22%); just 10% say the condition of the financial and housing markets is their top economic worry. The percentage citing the job situation as their top economic worry has increased eight points since March, when concern over rising prices rivaled the job situation as the public’s top economic worry. For most of the past three years, the job situation has been the public’s top economic worry.",good
mturk_charts/no_data_remaining/multi_col/2316.png,"Currently, 43% approve of the way that Barack Obama is handling the economy, while 52% disapprove. Obama’s job rating on the economy has shown little change this year. Views of Obama’s handling of the economy have been consistently more negative than positive since shortly after he took office in early 2009.",good
