img_path,summary,category
mturk_charts/no_data_remaining/multi_col/2058.png,"Egyptians are about as unhappy with the direction of their country as they were back in spring 2010, less than a year before the revolution that toppled then President Hosni Mubarak, following 18 days of protest in Cairo’s Tahrir Square. Today, 72% of Egyptians are dissatisfied with the country’s direction, while just 24% are satisfied.",good
mturk_charts/no_data_remaining/multi_col/2059.png,"The Muslim Brotherhood’s ratings are down – but a substantial minority still like them. Three-in-four Egyptians had a favorable opinion of the Muslim Brotherhood back in 2011, in the months after Mubarak’s ouster, but in the current poll just 38% hold this view. Once again, this is a higher number than some might anticipate, given that over the last year the new government has banned the group and labeled it a terrorist organization.",good
mturk_charts/no_data_remaining/multi_col/2060.png,"When asked about the tradeoff between democracy and stability, 54% of Egyptians say that having a stable government is more important, even if there is a risk it won’t be fully democratic. Only 44% think having a democratic government is more important. This is a shift from previous surveys, when Egyptians placed a greater priority on democracy than stability.",good
mturk_charts/no_data_remaining/multi_col/2061.png,"By a 3-to-1 margin, Egyptians are more dissatisfied (72%) than satisfied (24%) with their country’s direction. Dissatisfaction is up significantly from last year’s already high 62%, and in fact, is roughly the same today as it was before the revolution that removed Mubarak from office.",good
mturk_charts/no_data_remaining/multi_col/2062.png,"The round of Republican primaries held Tuesday has been headlined as a tide-turning victory of the GOP establishment over Tea Party insurgents, with the most notable one being the win scored in Kentucky by Senate Minority Leader Mitch McConnell over a well-funded opponent. But whatever yesterday’s votes portend, polls have been showing a decline in Tea Party support among Republicans since their peak of influence in 2010. In asking Republicans whether they agree or disagree with the Tea Party, Pew Research surveys found that agreement has fallen from 48% in March 2010 to 33% in our most recent poll conducted in late April this year. At one point agreement with the Tea Party dipped to 28% in May 2013, during the long budget standoff between congressional Republican leaders and the White House.",good
mturk_charts/no_data_remaining/multi_col/2063.png,"As the 2016 presidential campaign ramps up, Republicans and Democrats have different wish lists when it comes to what traits they want in a candidate. Military service far and away tops the list for Republicans, while a significant share of Democrats would like to see a woman at the top of the ticket, a choice that has much less appeal for the GOP, according to a Pew Research Center survey conducted last month. Republican and Republican leaners respond strongly to military experience: 58% say they would be more likely to support a candidate with military experience, the top positive trait for Republicans of the 16 tested in the survey. Military experience also tops the list for Democrats and Democratic leaners, but they are not as enthusiastic as Republicans: 31% say they would be more likely to support a candidate who has served in the military, while 62% say this wouldn’t matter to them. While a positive for both Democrats and Republicans, military experience is not easy to find among the list of much-talked-about potential 2016 candidates. With Hillary Clinton looming large over the potential Democratic presidential field, 27% of Democrats say they would be more likely to vote for a woman presidential candidate, the third most positive attribute for Democrats. A candidate being a woman ranks highly as a positive trait among just 11% of Republicans.",complex
mturk_charts/no_data_remaining/multi_col/2064.png,"Between 1900 and 2010, the total number of Christians in the region – including Egypt, Iraq, Israel, Jordan, Lebanon, Syria and the Palestinian territories – grew from 1.6 million to 7.5 million. But while the Christian population in the Middle East more than quadrupled in that period, the non-Christian population increased ten-fold. As a result, the Christian share of the overall population in the region decreased from 10% in 1900 to 5% in 2010. In recent decades, Christians in the region have tended to be older, have fewer children and be more likely to leave the area compared with Muslims.",good
mturk_charts/no_data_remaining/multi_col/2065.png,"A separate measure dating back to the late 1980s shows an even larger decline in the perceived value of Washington experience. The question asks which better prepares someone to be president – serving as a senator or member of Congress or as a state’s governor – and mentions possible advantages of each position. In the case of a member of Congress, it would be acquiring experience in Washington and foreign policy; a governor is described as able to��gain experience as head of an administration. In 1987, 66% said experience as a member of Congress provided better preparation for the White House while just 22% said serving as governor was better preparation. In 2007, two decades later, congressional experience was still preferred by more than two-to-one (55% to 24%). But today, the public is divided: 44% say serving in Congress better prepares someone to be president while as many say experience as governor is better preparation.",good
mturk_charts/no_data_remaining/multi_col/2066.png,"Fueled by these demographic trends, the share of white students enrolled in majority-minority schools has nearly doubled over the past two decades, from 8.4% in 1990 to 15.9% in 2010. The share of black, Hispanic and Asian students enrolled in majority-minority schools also increased during this time—for Hispanics, from 73% to 79%, for example.",good
mturk_charts/no_data_remaining/multi_col/2067.png,"In the past 15 years, the percentage of women who work in newspaper newsrooms has barely budged. Women made up 36% of all newspaper staff in 2012 (the last year for which data are available), nearly unchanged from 37% in 1998, according to The American Society of News Editors’ annual census. Virtually the same proportion of women (35%) worked in supervisory positions in newspapers in 2012, a number that has also barely changed since 1998, when it was at 34%. (At the Times itself, four of the top nine editors currently are women, even after Abramson’s departure.) It’s worth noting that these shares have remained the same during a period when newspaper newsrooms have been shrinking. Since 1998, nearly 17,000 of those jobs have been lost, according to ASNE.",complex
mturk_charts/no_data_remaining/multi_col/2068.png,"The New York Fed’s economists base these estimates on their analysis of a unique dataset of millions of consumer-credit reports, updated quarterly, but their analysis stops at the end of 2012. More recent data from the same source, though only publicly available in the aggregate, shows that the total balance of student-loan debt reached $1.08 trillion at the end of 2013, up 11.8% (in nominal dollars) from a year earlier.",complex
mturk_charts/no_data_remaining/multi_col/2069.png,"Negative attitudes toward Muslims are also more common on the ideological right. In Germany and France, for instance, respondents who place themselves on the right side of the political spectrum are more than twice as likely as those on the left to say they have an unfavorable opinion of Muslims.",unquestionable
mturk_charts/no_data_remaining/multi_col/2070.png,"Debt-to-income ratios have increased for young student debtors, even as they have declined for other young households since 2008. The typical young, college-educated student debtor household has debts equivalent to two years of income. Young, college-educated households with no student debt and less-educated households with student debt carry half this debt load, or the equivalent of one year of income.",complex
mturk_charts/no_data_remaining/multi_col/2071.png,"Debt-to-income ratios have increased for young student debtors, even as they have declined for other young households since 2008. The typical young, college-educated student debtor household has debts equivalent to two years of income. Young, college-educated households with no student debt and less-educated households with student debt carry half this debt load, or the equivalent of one year of income. Young households that borrowed for college are less satisfied with their personal financial situation than those who didn’t and are less likely to say their education has paid off.",unquestionable
mturk_charts/no_data_remaining/multi_col/2072.png,"Here are some of the key takeaways from the survey conducted in seven European Union member countries – France, Germany, Greece, Italy, Poland, Spain and the United Kingdom: Disillusion with the EU seems to be ending. Support for the European Union is rebounding just in time for the May 22-25 European Parliament elections. After a dramatic decline in the wake of the euro crisis, EU favorability is now on the rise in France, the United Kingdom and Germany. And faith in one of the EU’s founding principles – that European economic integration is good for their own country – is up in the UK, Poland and Germany. Median belief that European economic integration strengthens a person’s national economy is up as well, driven by a 15-point increase in the UK and a 12-point rise in Poland. However, EU support has yet to return to pre-crisis levels. Italians are increasingly critical of the institution.",unquestionable
mturk_charts/no_data_remaining/multi_col/2073.png,"Right after their re-elections, President Obama and George W. Bush both suffered through the first year of their second terms. Heading into this year’s midterm elections, Obama’s job approval rate may be nothing to brag about, but it is better than Bush’s was at this point in 2006 and Obama appears to be less of a drag on his party’s midterm prospects than Bush was. Obama’s job approval rating stands at 44% while Bush’s was 35% at the same point in the 2006 midterm year, according to a Pew Research Center survey conducted April 23-27. But Obama can look with some envy at where his Democratic predecessor — Bill Clinton — stood in his sixth year. Clinton’s approval rating was a solid 62%.",good
mturk_charts/no_data_remaining/multi_col/2074.png,"Today’s moms work more hours outside the home and spend far less time on housework than they did 50 years ago. They also spend more time with their children than mothers did in the 1960s, and about twice as much time as today’s fathers do. For their part, dads now spend more time on housework and child care than they used to, but they haven’t caught up to moms.",unquestionable
mturk_charts/no_data_remaining/multi_col/2075.png,"About seven-in-ten mothers (71%) with children younger than 18 were in the labor force in 2012, compared with less than half (47%) in 1975. Meanwhile, after decades of decline, the share of stay-at-home moms has ticked up since 1999.",good
mturk_charts/no_data_remaining/multi_col/2076.png,"These are the principal findings from the latest survey in Ukraine by the Pew Research Center. Based on face-to-face interviews between April 5-23, with 1,659 randomly selected adults from across the country, the poll finds that along with questions about the country’s leadership, Ukrainians are far from satisfied with the involvement of foreign powers to date. The European Union fairs best in the eyes of Ukrainians, with a 45%-plurality describing its influence in Ukraine as good. Meanwhile, assessments of the U.S. impact on Ukraine are split: 38% positive, 38% negative. Russia is viewed with the greatest suspicion. Three times as many Ukrainians say Russia is having a bad influence on their country as say it is having a good impact (67% vs. 22%). At the same time, overall confidence in Putin’s handling of world affairs has plummeted from 56% in 2007 to 23% today.",good
mturk_charts/no_data_remaining/multi_col/2077.png,"These so-called “opt-out moms” (roughly 10% of all highly educated mothers) make up just 1% of the nation’s 35 million mothers ages 18 to 69 who are living with their children younger than 18. For our purposes, “opt-out moms” are mothers who have at least a Master’s degree, an annual family income of $75,000 or more; a working husband; and who state that they are out of the workforce in order to care for their family. In families with these highly educated, affluent non-working moms, it may be the husbands who are bringing home the bacon, but in 37% of the cases, it is the stay-at-home wives who actually have a higher level of education. In 45% of these families, the spouses have equal educational attainment, and in about 18% of the cases, the husbands have more education than their wives. An estimate using a slightly different methodology suggests that the share of all U.S. married couples where the wife has more education than the husband is about 21%.",good
mturk_charts/no_data_remaining/multi_col/2078.png,"Favorable views of the Supreme Court are back above 50%, having rebounded from historic lows reached in the summer of 2013. However, the court still has several major decisions pending that could impact the public’s views, including rulings on challenges to the Affordable Care Act’s requirement that employers include contraceptive coverage in their employees’ health plans. The latest survey by the Pew Research Center, conducted April 23-27 among 1,501 adults, finds that 56% have a favorable view of the court, while 35% have an unfavorable view. (The survey was conducted before the court’s ruling that a town council in New York and, by extension, other legislatures, can begin meetings with a Christian prayer.) Last July, following high-profile rulings on the Voting Rights Act and same-sex marriage, about half held a favorable view of the court (48%), among the lowest measures recorded in Pew Research surveys.",good
mturk_charts/no_data_remaining/multi_col/2079.png,"Currently, more Democrats (63%) than Republicans (54%) have a favorable impression of the Roberts court, though the gap has narrowed considerably since July 2012. At that time, shortly after the court upheld most of the provisions of the Affordable Care Act, 64% of Democrats viewed the court favorably compared with just 38% of Republicans.",good
mturk_charts/no_data_remaining/multi_col/2080.png,"The quits rate — the number people who voluntarily leave their jobs as a percentage of total employment — has improved somewhat from its 2009-10 lows, but at 1.7% is still well below pre-recession levels (typically 2% or higher). The quits rate is a good indicator of labor-market confidence, since people are more willing to leave their jobs when they’re confident they can find a better one.",complex
mturk_charts/no_data_remaining/multi_col/2081.png,"Substantially more women than men are in jobs that pay the minimum wage or less, according to U.S. Bureau of Labor Statistics data analyzed by the Pew Research Center. Men make up a larger share of the U.S. labor force than women (53%-47%). But among those who earn the minimum wage or less, 62% are women and 38% are men. Among those paid by the hour, some 5.4% of women (2.1 million workers) made the federal minimum wage or less in 2013. For men, that share is 3.3%, or 1.2 million workers. (Some people may be paid below the federal minimum wage, including those who make tips.) The difference has narrowed since 1979, when the share of hourly workers who earned federal minimum wage or less was 20.2% for women and 7.7% for men. The biggest gap is between young women and young men. Among hourly workers ages 20 to 24, some 10.0% of women made the federal minimum wage or less in 2013, compared with 5.8% of men. By comparison, the gender gap narrows for older workers. Among hourly workers ages 30 to 34, some 4.0% of women made the federal minimum wage or less, compared with 2.7% of men. Among workers ages 60 to 64, women and men are about equally likely to work at the federal minimum wage—1.5% of women did in 2013, compared with 1.2% of men.",complex
mturk_charts/no_data_remaining/multi_col/2082.png,"Economic Pessimism Persists. The survey was conducted before Friday’s jobs report, which showed that the unemployment rate had fallen to 6.3%, its lowest level since 2008, and that the economy had added 288,000 jobs. However, more than 800,000 people left the labor force. From the public’s point of view, jobs remain scarce: 65% say jobs in their community are difficult to find while 27% say there are plenty of jobs available. Since the recession, perceptions of the job market have become less negative as the unemployment rate has declined. However, there has been virtually no change in these views since last June (64% jobs hard to find), although the jobless rate has fallen by more than a percentage point (from 7.5% to 6.3%) since then.",good
mturk_charts/no_data_remaining/multi_col/2083.png,"Tuesday night’s botched execution of Oklahoma inmate Clayton Lockett is renewing debate about how, and whether, the U.S. should continue to impose the death penalty. Though a majority (55%) of Americans in a 2013 Pew Research Center survey said they favored the death penalty for convicted murderers, that was the lowest support level in four decades; support has been falling for the past two decades. (Gallup’s most recent poll on the subject, from this past October, found 60% support, also the lowest in more than 40 years.)",complex
mturk_charts/no_data_remaining/multi_col/2084.png,"Families today are more blended and differently constructed. Nearly half (44%) of young people ages 18 to 29 have a step sibling. About half as many (23%) of those ages 50 to 64—and just 16% of those 65 or older—have a step sibling. More babies are born to unmarried mothers than ever before. Unmarried women accounted for 41% of births in 2011, up from just 5% in 1960. In 2011, 72% of births to black women were to unmarried mothers, compared with 53% of births to Hispanic women and 29% of births to white women. (The sample size was too small to analyze results among Asians.) But just 9% of new mothers with a bachelor’s degree, regardless of race, were unmarried when they gave birth.",good
mturk_charts/no_data_remaining/multi_col/2085.png,"In the ongoing dispute between Israel and the Palestinians, a 53% majority sympathizes more with Israel, while far fewer (11%) sympathize more with the Palestinians; 16% volunteer that they sympathize with neither side. In polling by Pew Research and the Chicago Council on Foreign Relations dating back to 1978, sympathy toward Israel has never been higher. A decade ago, four-in-ten (40%) sympathized more with Israel and 13% sympathized more with the Palestinians. By the summer of 2006, sympathy with Israel had risen to 48% and has remained at or around 50% since that . Republicans continue to register very high measures of sympathy for Israel (68%), while 7% sympathize more with the Palestinians and 9% volunteer “neither.” Among Democrats, 46% sympathize more with Israel, 15% say they sympathize more with the Palestinians, and 15% say neither. The opinion gap is especially large between the two party’s ideological wings: 75% of conservative Republicans sympathize more with Israel, compared with 41% of liberal Democrats.",complex
mturk_charts/no_data_remaining/multi_col/2086.png,"Between 1980 and 2000, immigration was the main driver of Latino population growth as the Latino immigrant population boomed from 4.2 million to 14.1 million. However since 2000, the primary source of Hispanic population growth has swung from immigration to native births. Between 2000 and 2010, there were 9.6 million Hispanic births in the U.S., while the number of newly arrived immigrants was 6.5 million. Overall, U.S. births alone accounted for 60% of Hispanic population growth (births and immigration only3 during the period.4) These opposing trends—the rise of U.S.-born and the slowdown in immigrant population growth—have begun to reshape the adult Hispanic population. Just as the slowdown in immigration has occurred, the number of U.S.-born Hispanics entering adulthood is beginning to accelerate. Today, some 800,000 young U.S.-born Hispanics enter adulthood each year, but in the coming decades, that number will rise to more than a million annually (Taylor, Gonzalez-Barrera, Passel and Lopez, 2012).",good
mturk_charts/no_data_remaining/multi_col/2087.png,"Digital advertising in the U.S. accounted for $42.6 billion in revenue in 2013, an increase of 16% over 2012, according to the financial analysis firm eMarketer. But while that digital ad pie is growing, the numbers show that news organizations are competing for an increasingly smaller share of those dollars.",good
mturk_charts/no_data_remaining/multi_col/2088.png,"The biggest story is among Hispanics, who have made big gains in college enrollment, a measure that includes both two- and four-year schools. From 1996 to 2012, college enrollment among Hispanics ages 18 to 24 more than tripled (240% increase), outpacing increases among blacks (72%) and whites (12%). (The Census Bureau did not publish Asian college enrollment figures before 1999.) In fact, for the first time in 2012, Hispanics’college enrollment rate among 18- to 24 year-old high school graduates surpassed that of whites, by 49% to 47%.",complex
mturk_charts/no_data_remaining/multi_col/2089.png,"In 2012, Hispanics made up about an equal proportion of all public high school graduates (18%) and all college students (ages 18 to 24) (19%). Whites, blacks and Asians also had about the same share of public high school graduates as college enrollees.",complex
mturk_charts/no_data_remaining/multi_col/2090.png,"In the Philippines, South Korea and Japan, Obama’s efforts to deepen security and economic ties with the U.S. are likely to find a receptive audience. When asked which is more important, having strong ties with China or the U.S., most of those surveyed in these three countries said the latter. In contrast, half of Malaysians volunteered that it’s equally important to maintain strong ties with both major powers. America’s overall ratings are significantly higher than China’s in Japan, South Korea and the Philippines. This is especially true in Japan, where 69% had a favorable view of the U.S., while only 5% said the same about China. Ratings for the U.S. were overwhelmingly positive in the Philippines and South Korea, while China received mixed reviews in both countries. Malaysia is again the exception: A narrow majority of Malaysians had a favorable opinion of the U.S., but roughly eight-in-ten (81%) gave China a positive rating.",complex
mturk_charts/no_data_remaining/multi_col/2091.png,"The use of affirmative action programs in college admissions has roiled campuses and the public for years, leading to state-passed laws banning the practice and to today’s Supreme Court ruling upholding a Michigan voter initiative banning the use of racial preferences. But while the debate and the battles continue, a new Pew Research Center poll finds that Americans overwhelmingly support these programs. Americans say by roughly two-to-one (63% to 30%) that affirmative action programs designed to increase the number of black and minority students on college campuses are a “good thing,” according to the survey conducted Feb. 27-Mar. 16. This was almost the same result Pew Research found in 2003. While a majority (55%) of whites support affirmative action programs on campus, that compares with 84% of blacks who believe they are a good thing and 80% of Hispanics. Nearly eight-in-ten (78%) Democrats back the programs as a good thing, as do 62% of independents; Republicans are mixed, with 50% seeing the racial preferences as a bad thing and 43% viewing them as a good thing.",good
mturk_charts/no_data_remaining/multi_col/2092.png,"More Americans search for “church” around Easter than at any other time, with the Christmas season usually ranking second, according to Google Trends data between 2004 and 2013. Google’s Trends tool measures the popularity of a search term relative to all searches in the United States. Data are reported on a scale from 0 to 100.",complex
mturk_charts/no_data_remaining/multi_col/2093.png,"Overall, on the weekends, mothers scale back their time spent on child care by 29%, compared with the amount of time spent during a week day (1.5 hours per day vs. 2.1 hours). This is consistent with earlier research by Sayer, Bianchi, and Robinson. A recent Pew Research Center report found that stay-at-home mothers spend more time on child care and housework than working mothers. But the gap in child care is much narrower on the weekends than during the week, and working moms spend almost the same amount of time on housework as stay-at-home moms do on the weekends. Working moms tend to use the weekend to clean up the house: They increase their time spent on this activity by about one hour during the weekends. At the same time, stay-at-home moms take a little break from household chores on weekends. And all mothers, whether working outside the home or not, have more time for leisure activities during weekends.",complex
