img_path,summary,category
mturk_charts/no_data_remaining/multi_col/3157.png,"From January through May, a growing proportion of Americans said they were hearing a mix of good and bad news about the economy. More recently, however, there has been a steady increase in the share saying that the economic news is mostly bad. Currently, 41% say they are hearing mostly bad news about the economy, edging up from 37% in June but 10 points higher than in May (31%). Over the past two months, the proportion reporting they are hearing a mix of good and bad news has fallen from 64% to 56%. Very few Americans (3% currently) continue to say they are hearing mostly good news about the economy.",good
mturk_charts/no_data_remaining/multi_col/3158.png,"More than one-in-five (22%) say they very closely followed developments in Iran in the aftermath of a disputed presidential election. But that was down from one week earlier, when three-in-ten (31%) said they were following developments very closely as the government cracked down on protesters. This was the story followed most closely by 9%. Coverage of developments in Iran dropped to 4% in the most recent week from 19% the week before. Close to one-in-five (19%) say they very closely followed the U.S. Supreme Court decision that found a group of New Haven firefighters had been illegally denied promotion because of their race. The case has taken on additional national prominence because President Obama’s Supreme Court nominee, Sonia Sotomayor, was part of the appeals court panel whose judgment was overturned. For 5%, this was the story they followed more closely than any other. The court ruling accounted for 4% of the newshole. A similar share (18%) says they very closely followed the sentencing of Bernard Madoff to 150 years in prison for his role in a multi-billion dollar investment fraud; 4% say this was the story they followed most closely. The share following Madoff’s sentencing very closely reflects a drop in interest from earlier stories dealing with revelations about the extent of his fraud in December (30% very closely) and his guilty plea in March (27% very closely). The media devoted 5% of coverage to Madoff’s sentencing.",complex
mturk_charts/no_data_remaining/multi_col/3159.png,"The public closely tracked the sudden death of pop superstar Michael Jackson last week, though nearly two-in-three Americans say news organizations gave too much coverage to the story. At the same time, half say the media struck the right balance between reporting on Jackson’s musical legacy and the problems in his personal life. With reports about Jackson’s June 25th death in Los Angeles dominating media coverage at week’s end, 30% say they followed these stories very closely. A similar share (31%) say this was the story they followed more closely than any other, according to the latest weekly News Interest Index survey, conducted June 26-29 by the Pew Research Center for the People &amp; the Press.",complex
mturk_charts/no_data_remaining/multi_col/3160.png,"But the difference, while statistically significant, was small in absolute terms – smaller than the margin of sampling error in most polls. Obama’s average lead across the six surveys was 9.9 points among registered voters when cell phone and landline interviews were combined and weighted. If estimates had been based only on the weighted landline samples, Obama’s average lead would have been 7.6 points, an average bias of 2.3 percentage points on the margin, or about 1.2 points expressed as candidate error. Limiting the analysis to likely voters rather than all voters produced similar results. Obama’s average lead among likely voters was 8.2 points across all six dual frame surveys versus 5.8 points (or 1.2 points as candidate error) when the landline samples are analyzed alone. (See the appendix for a detailed description of the sampling and weighting employed in this analysis.)",complex
mturk_charts/no_data_remaining/multi_col/3161.png,"The latest survey by the Pew Research Center for the People &amp; the Press finds the public evenly divided over whether deficit reduction or stimulus spending is the higher priority for the government right now. Among 1,005 adults interviewed over landline and cell phones June 18-21, 48% place a higher priority on “spending more to help the economy recover” while 46% prioritize “reducing the budget deficit.” Two other recent national polls, which gave arguments on both sides of the issue, found the public giving greater priority to deficit reduction than to stimulating the economy. Both the CBS/New York Times and NBC/Wall Street Journal surveys, released last week, made efforts to explain the pros and cons of stimulus spending and deficit reduction, and both found majorities supporting the latter option. The NBC/WSJ survey asked if the president and Congress should worry more about “boosting the economy even though it may mean larger budget deficits now and in the future” or “keeping the budget deficit down even though it may mean it will take longer for the economy to recover.” When these countervailing arguments are provided, they find more siding with deficit reduction by a 23-point margin (58% vs. 35%). The CBS/NYT survey asked if the government “should spend money to stimulate the national economy, even if it means increasing the budget deficit” or “should NOT spend money to stimulate the national economy and should instead focus on reducing the budget deficit.” This formulation also found more favoring deficit reduction, but by a narrower 11-point margin (52% vs. 41%).",complex
mturk_charts/no_data_remaining/multi_col/3162.png,"The dramatic events in Iran last week captured the attention of both the public and the media as Americans tracked news about post-election protests in Tehran nearly as closely as they followed news about the troubled U.S. economy. Two-in-ten say they followed news about the street protests over disputed election results – and the government bid to contain them – more closely than any other major story last week. That’s about the same as the 22% that say they most closely followed news about the economy, the week’s other top story.",good
mturk_charts/no_data_remaining/multi_col/3163.png,"Public concern about the job situation, which surged earlier this year, has leveled off. Currently, 42% cite the job situation as the economic issue they worry about most, which is largely unchanged from March (42%) and February (45%). Last December, only 26% viewed jobs as their top economic concern. Meanwhile, worries about rising prices – which dominated the public’s economic concerns last year during the rapid run-up in gas prices – are once again increasing. Currently, 29% say rising prices are the issue that most worries them, up from 22% in March. A year earlier, fully 49% named rising prices as their biggest economic worry. As the stock market has become less volatile, concern over problems in financial markets has declined. Currently, 15% cite problems in the markets as their top economic worry, down from 21% in March and 31% last October. In March, comparable shares cited rising prices (22%) and problems in the financial markets (21%) as their biggest economic worry; now, nearly twice as many say they are most worried by rising prices (29% vs. 15%). Fewer than one-in-ten (8%) cite declining real estate values as the economic issue that they find most worrisome, a figure that has stayed fairly constant for more than a year.",good
mturk_charts/no_data_remaining/multi_col/3164.png,"The share of the public that says they are hearing a mix of good and bad economic news fell from 64% in May to 59%, while the share that says they are hearing mostly bad news increased from 31% to 37%. The percentage that says they are hearing mostly good news remains small and did not change (4%).",good
mturk_charts/no_data_remaining/multi_col/3165.png,"Americans divided their attention among several major stories last week as President Obama reached out to the Muslim world in a major speech, a jetliner crashed into the Atlantic Ocean and General Motors filed for bankruptcy protection. At the same time, they continued to keep a close watch on news about the troubles facing the U.S. economy. Meanwhile, the latest weekly News Interest Index survey, conducted June 5-8 by the Pew Research Center for the People &amp; the Press, shows that interest in news about the U.S. economy remained strong across most groups. About two-in ten (22%) say they followed economic news more closely than other major stories. A comparable share (21%) say they followed news about the deadly plane crash most closely, while 17% say the same about Obama’s speech to the Muslim world on June 4. A slightly smaller share (13%) say they followed news about the GM bankruptcy filing more closely than other major stories, while 7% say they followed news about the NBA final series most closely, and 5% say they followed news about the killing of a Kansas doctor who performed abortions that closely.",good
mturk_charts/no_data_remaining/multi_col/3166.png,"The public divided its attention among the top stories last week, though Americans say they followed news about the economy – and the fate of General Motors – most closely. Two-in-ten say they followed news about the condition of the U.S. economy most closely among the leading stories. More than four-in-ten (43%) say they followed economic news very closely, comparable to the share following the economy very closely in recent weeks. According to PEJ, coverage of the economic crisis took up 9% of the newshole. Close to two-in-ten (18%) say they followed reports about General Motors’ plans to file bankruptcy most closely. A third say they followed those stories very closely, while another 40% followed them fairly closely. Those numbers are similar to the share following American carmakers’ troubles in recent surveys. Stories about GM’s plans – the company filed for Chapter 11 on June 1 – and developments at Chrysler accounted for 7% of the newshole.",good
mturk_charts/no_data_remaining/multi_col/3167.png,"Projects by the U.S. Census Bureau indicate that by 2025, nearly three-in-ten children in this country will be of Latino ancestry. Pew Hispanic Center population projects indicate that the generational composition of Hispanic children will change yet again between now and then. Today’s large cohort of second-generation Hispanic children will eventually form families and produce third-generation offspring. The Center’s projections show that the share of Hispanic children who are second generation will likely peak not much above the current level of 52% and then begin falling roughly a decade from now. The share of Hispanic children who are third generation or higher will likely hit bottom at 35% around 2015 and then begin rising. Given past trends, this change in the generational composition of Hispanic children could well have an impact on their employment, education and social outcomes in future years.",good
mturk_charts/no_data_remaining/multi_col/3168.png,"More than four-in-ten Americans (44%) say they followed reports about the U.S. economy very closely last week, which is little changed from recent weeks. News organizations, meanwhile, devoted 12% of the newshole to the economic crisis, as measured by PEJ. That figure does not include 5% of coverage devoted to new credit card regulations enacted into law last week in Washington. Interest in that story was measured separately in this survey. Public attention to economic news peaked as the financial crisis deepened last fall. In the last week of September, 70% said they were following economic news very closely – the highest ever in a Pew Research survey. Since then, interest has fluctuated depending on events; this year, interest peaked at 57% in late January.",good
mturk_charts/no_data_remaining/multi_col/3169.png,"The number of online adults who have used online classified ads has more than doubled in the past four years. Almost half (49%) of internet users say they have ever used online classified sites, compared with 22% of online adults who had done so in 2005.",good
mturk_charts/no_data_remaining/multi_col/3170.png,"While the Democrats gained a sizable advantage in partisan affiliation during George Bush’s presidency, their numbers slipped between December 2008 and April 2009, from 39% to 33%. Republican losses have been a little more modest, from 26% to 22%, but this represents the lowest level of professed affiliation with the GOP in at least a quarter century. Moreover, on nearly every dimension the Republican Party is at a low ebb – from image, to morale, to demographic vitality. By contrast, the percentage of self-described political independents has steadily climbed, on a monthly basis, from 30% last December to 39% in April. Taking an average of surveys conducted this year, 36% say they are independents, 35% are Democrats, while 23% are Republicans. On an annual basis, the only previous year when independent identification has been this high was in 1992 when Ross Perot ran a popular independent candidacy.",complex
mturk_charts/no_data_remaining/multi_col/3171.png,"The public continued to follow reports about the condition of the U.S. economy closely last week. Still, about a third (34%) say they followed reports about the swine flu in the U.S. and elsewhere most closely, slightly more than the 30% that say they followed economic stories most closely. But with the swine flu outbreak apparently not as dangerous as first feared, the share saying they followed news about the virus very closely was down 9 points from the previous week to 34%. Meanwhile, the economy received the most coverage, filling 16% of the newshole as measured by the Pew Research Center’s Project for Excellence in Journalism. That number separates out coverage of the April unemployment report and the Obama budget, which together bring total economic coverage to 21%, according to PEJ. The swine flu, which dominated news coverage the week before with 31% of coverage, dropped to the second spot – taking up 9% of the newshole – as fears eased about the immediate spread and potential lethality of the H1N1 virus.",good
mturk_charts/no_data_remaining/multi_col/3172.png,"Goggle Trends show no surge in searches for popular privately run health information websites such as WebMd. But frequent users of such sites are likely to access them directly. And a Hitwise analysis shows that while most of these health-information websites show no clear uptick in visits as concern about the swine flu peaked, WebMd, the most popular of the group, showed a sharp increase in the frequency of visits. Moreover, Tancer’s review of the top search terms sending traffic to WebMd for the week ending May 2, 2009, shows that queries relating to swine flu symptoms are the most common on the list.",complex
mturk_charts/no_data_remaining/multi_col/3173.png,"The internet tops the list (25%) when people are asked which source has been most useful. Close to four-in-ten (38%) of those younger than 40 cite the internet as that most useful source. Among those 40-64, the web is tied with the cable news networks (22%) and among those 65 and older, the most frequent choices are local television news (21%) and cable news (22%). Still, 15% of that group name the internet. The internet is the top choice – or tied for top choice – across income and education groups. Broken down a different way, of the 49% who say they learned something about the swine flu from the internet, about half (51%) say the internet was their most useful source. Among the 69% who say they learned about the flu from local TV news, just 23% cite local TV news as the most useful source. For cable news viewers, the pattern is similar. Of the two thirds (65%) that say they learned about the flu from cable TV news, just 22% cite cable TV news as the most useful source.",good
mturk_charts/no_data_remaining/multi_col/3174.png,"The latest national survey by the Pew Research Center for the People &amp; the Press, conducted March 31-April 21 among 1,521 adults reached on landlines and cell phones, also finds public opinion about abortion more closely divided than it has been in several years. Currently, 46% say abortion should be legal in most cases (28%) or all cases (18%); 44% believe that abortion should be illegal in most (28%) or all cases (16%). Since the mid-1990s, majorities have consistently favored legal abortion, with the exception of an August 2001 survey by ABC News/Washington Post.",good
mturk_charts/no_data_remaining/multi_col/3175.png,"The increased diversity of the electorate was also driven by population growth, especially among Latinos. Between 2004 and 2008, the number of Latino eligible voters rose from 16.1 million in 2004 to 19.5 million in 2008, or 21.4%. In comparison, among the general population, the total number of eligible voters increased by just 4.6%. In 2008, Latino eligible voters accounted for 9.5% of all eligible voters, up from 8.2% in 2004. Similarly, the share of eligible voters who were black increased from 11.6% in 2004 to 11.8% in 2008. The share of eligible voters who were Asian also increased, from 3.3% in 2004 to 3.4% in 2008. In contrast, the share of eligible voters who were white fell from 75.2% in 2004 to 73.4% in 2008. With population growth and increased voter participation among blacks, Latinos and Asians, members of all three groups cast more votes in 2008 than in 2004. Two million more blacks and 2 million more Latinos reported voting in 2008 than said the same in 2004. Among Asians, 338,000 more votes were reported cast in 2008 than in 2004. The number of white voters in 2008 was also up, but only slightly—increasing from 99.6 million in 2004 to 100 million in 2008.",complex
mturk_charts/no_data_remaining/multi_col/3176.png,"With population growth and increased voter participation among blacks, Latinos and Asians, members of all three groups cast more votes in 2008 than in 2004. Two million more blacks and 2 million more Latinos reported voting in 2008 than said the same in 2004. Among Asians, 338,000 more votes were reported cast in 2008 than in 2004. The number of white voters in 2008 was also up, but only slightly—increasing from 99.6 million in 2004 to 100 million in 2008.",good
mturk_charts/no_data_remaining/multi_col/3177.png,"The Census Bureau’s biannual Current Population Survey November Voting and Registration Supplement is the most comprehensive data source available for examining the demographic composition of the electorate in federal elections. However, because it relies on post-election self-reporting by survey respondents in some 55,000 households, these weighted CPS estimates of turnout never match up precisely with the actual number of votes tallied in the 50 states. According to the CPS, an estimated 131.1 million U.S. citizens voted in the 2008 presidential election – slightly less than the 131.3 million votes cast for president, as reported by the Center for the Study of the American Electorate (Gans, 2008) and other sources (McDonald, 2009).",good
mturk_charts/no_data_remaining/multi_col/3178.png,"Over the first four months of 2009, the Republican Party has continued to lose adherents. Interviews with over 7,000 respondents nationwide so far this year found fewer than a quarter (23%) of the combined total identifying themselves as Republicans. This is down from 25% in 2008, and from 30% in 2004. In total, the GOP has lost roughly a quarter of its base over the past five years. But these Republican losses have not translated into substantial Democratic gains. So far in 2009, 35% of adults nationwide identify as Democrats, about the same as in 2008 (36%). While GOP identification has fallen seven points since 2004, the Democrats have gained only two points over that period. Instead, a growing number of Americans describe themselves as independents, 36% in 2009 compared with just 32% in 2008 and 30% in 2004. Looking at the individual monthly surveys since December suggests that both political parties are facing declining membership in the wake of an engaging election cycle. In the Pew Research Center’s April 2009 survey, 33% identified as Democrats, down from 39% in December 2008. Over the same period, the share calling themselves Republicans has fallen from 26% to 22%. By contrast, the number of independents has risen from 30% in December to 39% now. While it is not unusual for Republican and Democratic identification to grow over the course of an election and subside afterward, the magnitude of these changes is noteworthy.",complex
mturk_charts/no_data_remaining/multi_col/3179.png,"Looking at the individual monthly surveys since December suggests that both political parties are facing declining membership in the wake of an engaging election cycle. In the Pew Research Center’s April 2009 survey, 33% identified as Democrats, down from 39% in December 2008. Over the same period, the share calling themselves Republicans has fallen from 26% to 22%. By contrast, the number of independents has risen from 30% in December to 39% now. While it is not unusual for Republican and Democratic identification to grow over the course of an election and subside afterward, the magnitude of these changes is noteworthy. In announcing his change in party affiliation from Republican to Democrat yesterday, Pennsylvania Sen. Arlen Specter mentioned the changing composition of his state as a consideration. Across a typical year the Pew Research Center conducts well over 1,000 interviews in Pennsylvania, including 384 in the first four months of 2009. The data, so far, support Sen. Specter’s contention. When he last ran for his seat in 2004, 38% of Pennsylvanians said they were Democrats, while 34% identified as Republican. This year, the share identifying as Democrats is the same 38%, but only 27% call themselves Republicans. What had been a slim four-point Democratic identification advantage is now an eleven-point advantage.",good
mturk_charts/no_data_remaining/multi_col/3180.png,"As an outbreak of swine flu spreads beyond Mexico into the United States and elsewhere, Americans have started to track the fast developing story closely. The story grew in prominence after the survey went into the field, but 25% of the public say they followed reports about the deadly flu very closely and 21% say this was the story – among six choices – that they followed most closely last week. At this point, the amount of interest is similar to several recent health scares, including the spread of a drug-resistant staph infection in the U.S. in late 2007. The public also continues to closely track the financial problems facing the U.S. auto industry, particularly Chrysler and General Motors. Three-in-ten say they followed these stories very closely. For almost two-in-ten (18%), this was the story they followed more closely than any other. Slightly more than one-in-ten (11%) say they were following developments in the debate over whether to set up a bi-partisan commission to investigate the harsh interrogation techniques used by the CIA following the Sept. 11, 2001, terror attacks more closely than any other story. Two-in-ten (21%) say they followed this story very closely. The same share (21%) say they were following events in Iraq very closely last week, while 10% say this was the news they followed most closely.",complex
mturk_charts/no_data_remaining/multi_col/3181.png,"As an outbreak of swine flu spreads beyond Mexico into the United States and elsewhere, Americans have started to track the fast developing story closely. The story grew in prominence after the survey went into the field, but 25% of the public say they followed reports about the deadly flu very closely and 21% say this was the story — among six choices — that they followed most closely last week. At this point, the amount of interest is similar to several recent health scares, including the spread of a drug-resistant staph infection in the U.S. in late 2007. The public also continues to closely track the financial problems facing the U.S. auto industry, particularly Chrysler and General Motors. Three-in-ten say they followed these stories very closely. For almost two-in-ten (18%), this was the story they followed more closely than any other. Slightly more than one-in-ten (11%) say they were following developments in the debate over whether to set up a bi-partisan commission to investigate the harsh interrogation techniques used by the CIA following the Sept. 11, 2001, terror attacks more closely than any other story. Two-in-ten (21%) say they followed this story very closely. The same share (21%) say they were following events in Iraq very closely last week, while 10% say this was the news they followed most closely.",complex
mturk_charts/no_data_remaining/multi_col/3182.png,"The latest national survey by the Pew Research Center for the People &amp; the Press, conducted April 14-21 among 1,507 adults interviewed in English and Spanish on landlines and cell phones, finds that Obama’s job ratings on several specific domestic issues are on balance positive, but also reflect the division of opinion about many of his policies. For example, 60% approve of his handling of the economy generally, while 33% disapprove. Fewer (50%) approve of his handling of the budget deficit, compared with 39% who disapprove. Obama gets better ratings on foreign policy and terrorism – issues on which he trailed John McCain during last year’s presidential campaign – than on health care, tax policy or the budget deficit. The balance of opinion regarding Obama’s performance on foreign policy and terrorism is largely unchanged since February.",good
