img_path,summary,category
mturk_charts/no_data_remaining/multi_col/1062.png,"By contrast, Clinton voters express little or no confidence in Trump to deal with major issues. And while a majority of Clinton voters (58%) say they are “willing to give Trump a chance and see how he governs as president,” nearly four-in-ten (39%) say they can’t see themselves giving Trump a chance “because of the kind of person he has shown himself to be.” Equally important, most Democrats would like to see their party’s leaders stand up to Trump rather than work with him. In fact, Democratic support for cooperation with the president-elect today is substantially less than GOP support for working with Obama eight years ago. Nearly two-thirds of Democratic and Democratic-leaning voters (65%) say “Democratic leaders should stand up to Donald Trump on issues that are important to Democratic supporters, even if means less gets done in Washington.” Just 32% want the party’s leaders to work with Trump if it means disappointing Democrats. In November 2008 – a time when voters generally felt much better about the election and its outcome – Republicans and Republican leaners were more favorably disposed to their party’s leaders working with Obama. Nearly six-in-ten (59%) said GOP leaders should work with Obama, while 36% wanted them to “stand up” to the new president.",good
mturk_charts/no_data_remaining/multi_col/1063.png,"As our surveys found throughout the campaign, voters view the 2016 contest as extraordinarily negative. Fully 92% say there was more “mudslinging” or negative campaigning than in past elections – which is 20 percentage points higher than the previous high (72% after the 2004 election).",good
mturk_charts/no_data_remaining/multi_col/1064.png,"A key question that news organizations face, particularly during intense periods like election years, is to what degree journalists should present the facts with some interpretation, giving their audience guidance in navigating all the information that comes at them. A majority of U.S. adults (59%) reject the idea of adding interpretation, saying that the news media should present the facts alone, a recent Pew Research Center survey found. Four-in-ten favor adding some interpretation to the facts. The survey of 4,132 adults on the Center’s nationally representative American Trends Panel was conducted Sept. 27-Oct. 10, before Election Day. There are substantial partisan differences over whether journalists should include interpretation in their stories. Registered voters who supported Trump for president favored a “just the facts” approach by more than two-to-one, with only 29% saying the news media should add interpretation. Clinton supporters, on the other hand, are evenly split on the issue, with half against interpretation and half favoring it. This may be linked to a perception among Republicans that coverage of their candidate had been too tough. Among Republicans, 46% thought coverage of Trump had been too tough, while only three-in-ten Democrats thought the same of coverage of Clinton, according to Pew Research Center’s mid-September survey.",good
mturk_charts/no_data_remaining/multi_col/1065.png,"Another Justice Department agency, the Bureau of Justice Statistics, produces its own annual crime report, based on a survey of more than 90,000 households that counts crimes that aren’t reported to police in addition to those that are. BJS data show that violent crime and property crime rates fell 26% and 22%, respectively, between 2008 and 2015 (again, the most recent year available).",good
mturk_charts/no_data_remaining/multi_col/1066.png,"When asked which country besides their own is the best example of a developed economy, people in Kenya, South Africa and Nigeria overwhelmingly point to the United States and China, the world’s two largest economies. But among people in these three African nations, there are differences in the share of respondents who choose each power. In Kenya, 36% say the U.S. is the best example of a developed country, while only 15% choose China. An additional 4% say Japan, South Africa or Tanzania are the best examples. Among South Africans, around a quarter each say the U.S. (27%) and China (22%) are the best examples of an advanced economy. An additional 5% name Germany as a top example, with 4% naming the United Kingdom, Australia, Botswana or “Europe.” In Nigeria, 28% name China as the best example of a developed economy and a quarter cite the U.S. Another 4% say Saudi Arabia.",good
mturk_charts/no_data_remaining/multi_col/1067.png,"Moreover, roughly three-in-four Nigerians, Kenyans and South Africans believe that young people today who want to live a good life should stay in their countries rather than move abroad.",good
mturk_charts/no_data_remaining/multi_col/1068.png,"On a number of questions in this survey, South African blacks are more optimistic than others about the future of the country. Roughly seven-in-ten blacks (69%) think the national economy will improve in the next 12 months, compared with 46% of white and 30% of mixed-race respondents, and they are also more likely to believe their own personal finances will improve in the coming year. South African blacks are more optimistic that the next generation will see improvements to such challenges as education, poverty, health care and corruption. And they are more likely than white or mixed-race South Africans to believe that young people should stay in South Africa to pursue a good life, rather than leave for another country. And while majorities of all three groups say the government is run for the benefit of only a few groups in society, whites and mixed-race respondents are more inclined than blacks to think so. Nigerian public opinion frequently divides along religious lines, with notable differences between Muslims and Christians. In our current poll, Muslims are much more upbeat about the economy, and more likely to believe that the national economy will improve in the next 12 months. Although majorities of both groups see inequality as a very big problem, Christians are especially likely to hold this view. And opinions about the fairness of government have shifted over the past year, perhaps reflecting a transition of power from former President Goodluck Jonathan, a Christian, to current President Muhammadu Buhari, a Muslim. Among Nigeria’s Christians, 65% now say government is run for the benefit of a few groups, up slightly from 58% in 2015. Meanwhile, the share of Muslims expressing this view has dropped from 64% to 45%. Ethnic divisions are prominent on many issues in Kenya, with the Kikuyu and Kalenjin people expressing a much more positive outlook about the nation than the Luhya and Luo. Kikuyu and Kalenjin respondents are more satisfied with current economic conditions, and much less likely to say that the government is run for the benefit of only a few groups (current President Uhuru Kenyatta is Kikuyu, and all presidents since the country’s independence have been either Kikuyu or Kalenjin).",good
mturk_charts/no_data_remaining/multi_col/1069.png,"In addition to measuring the broad impact and meaning of social media, since 2012 the Center has also tracked the specific sites and platforms that users turn to in the course of living their social lives online. In that context, a national survey of 1,520 adults conducted March 7-April 4, 2016, finds that Facebook continues to be America’s most popular social networking platform by a substantial margin: Nearly eight-in-ten online Americans1 (79%) now use Facebook, more than double the share that uses Twitter (24%), Pinterest (31%), Instagram (32%) or LinkedIn (29%). On a total population basis (accounting for Americans who do not use the internet at all), that means that 68% of all U.S. adults are Facebook users, while 28% use Instagram, 26% use Pinterest, 25% use LinkedIn and 21% use Twitter. Thanks in part to the growing number of older adults who are joining the site, Facebook use appears to be on the rise: The share of online adults who report using Facebook has increased by 7 percentage points compared with a Pew Research Center survey conducted at a similar point in 2015. In addition, the share of Facebook users who check in daily has increased slightly in the past year: 76% of Americans who use Facebook now report that they visit the site on a daily basis, up from 70% in 2015. Roughly eight-in-ten online Americans (79%) now use Facebook, a 7-percentage-point increase from a survey conducted at a similar point in 2015.",good
mturk_charts/no_data_remaining/multi_col/1070.png,"Facebook remains the most popular social media platform, with its users visiting the site more regularly than users of other social media sites. Roughly three-quarters (76%) of Facebook users report that they visit the site daily (55% visit several times a day, and 22% visit about once per day). This represents a modest but statistically significant increase from the 70% of Facebook users who indicated that they visited the site daily in 2015. Other than this slight uptick among Facebook users, daily engagement for each of the other major social media platforms is generally similar to Pew Research Center findings from 2015. Instagram and Twitter occupy the middle tier of social media sites in terms of the share of users who log in daily. Roughly half (51%) of Instagram users access the platform on a daily basis, with 35% saying they do so several times a day. And 42% of Twitter users indicate that they are daily visitors, with 23% saying they visit more than once a day. A slightly larger share of Americans use Pinterest and LinkedIn than use Twitter, but users of these sites are less likely than Twitter users to check in every day: 25% of Pinterest users and 18% of LinkedIn users are daily visitors.",good
mturk_charts/no_data_remaining/multi_col/1071.png,"Whites, as well as college graduates and those with higher incomes, are more likely than nonwhites to have spoken with or been interviewed by a local journalist, according to a survey by Pew Research Center. About three-in-ten whites (29%) say they have ever spoken with or been interviewed by a local journalist or reporter, compared with 19% of nonwhites. (Nonwhite includes all racial and ethnic groups except non-Hispanic white.) This difference is particularly striking given that nonwhites generally are more engaged consumers of local news than whites. For instance, while 43% of nonwhites follow local news very closely, only a third of whites say the same – a similar pattern to what we found in our 2015 study of local news habits in three cities. Experiences in talking to local journalists also differ starkly by respondents’ level of education. Those with a college degree are twice as likely to have spoken with a local journalist as those who have never been to college. Just over a third (36%) of those with at least a college degree say they have spoken with a local reporter, compared with 23% of those with some college education and 18% of those with a high school diploma or less. A similar pattern is evident when considering Americans’ income levels, with those earning $75,000 or more per year being most likely to have been interviewed by a local journalist.",good
mturk_charts/no_data_remaining/multi_col/1072.png,"About three-in-ten whites (29%) say they have ever spoken with or been interviewed by a local journalist or reporter, compared with 19% of nonwhites. (Nonwhite includes all racial and ethnic groups except non-Hispanic white.) This difference is particularly striking given that nonwhites generally are more engaged consumers of local news than whites. For instance, while 43% of nonwhites follow local news very closely, only a third of whites say the same – a similar pattern to what we found in our 2015 study of local news habits in three cities. Among adults of all races, women are about as likely as men to have spoken with or been interviewed by a local reporter (28% of men versus 24% of women). However, a gender gap emerges among white U.S. adults. Roughly a third of white men have spoken with a local reporter (32%), compared with only about a quarter of white women (26%). Among nonwhites, women are just as likely as men to be interviewed by a local journalist, with 19% of both genders saying they have had the experience.",good
mturk_charts/no_data_remaining/multi_col/1073.png,"The share of the population with military experience – counting those who are on active duty or were in the past – has fallen by more than half since 1980. Then, 18% of adults were serving or had served in the military. By 2014, the share had declined to 8%, according to Census Bureau data, with an additional 1% serving in the reserves. Among U.S. men, the decline was even more dramatic, dropping from 45% in 1960 to 37% in 1980 and 16% in 2014. The number of people currently on active duty has also dropped significantly in the past half-century, falling from 3.1 million in 1966 – during the military draft era – to 1.3 million in today’s all-voluntary force, less than 1% of all U.S. adults. However, the decline in the share of the population with military experience has been driven primarily by the shrinking number of U.S. veterans as many pass away. In 1980, 18% of U.S. adults were veterans, compared with 8% in 2014, according to census data.",good
mturk_charts/no_data_remaining/multi_col/1074.png,"Trump won white voters by a margin almost identical to that of Mitt Romney, who lost the popular vote to Barack Obama in 2012. (Trump appears likely to lose the popular vote, which would make him only the fifth elected president to do so and still win office.) White non-Hispanic voters preferred Trump over Clinton by 21 percentage points (58% to 37%), according to the exit poll conducted by Edison Research for the National Election Pool. Romney won whites by 20 percentage points in 2012 (59% to 39%). However, although Trump fared little better among blacks and Hispanics than Romney did four years ago, Hillary Clinton did not run as strongly among these core Democratic groups as Obama did in 2012. Clinton held an 80-point advantage among blacks (88% to 8%) compared with Obama’s 87-point edge four years ago (93% to 6%). In 2008, Obama had a 91-point advantage among blacks.",good
mturk_charts/no_data_remaining/multi_col/1075.png,"Among whites, Trump won an overwhelming share of those without a college degree; and among white college graduates – a group that many identified as key for a potential Clinton victory – Trump outperformed Clinton by a narrow 4-point margin.",good
mturk_charts/no_data_remaining/multi_col/1076.png,"Clinton received a lower share of the vote among young voters (ages 18-29) than Obama received in 2012 or 2008. Young adults preferred Clinton over Trump by a wide 55%-37% margin; by comparison, Obama had a 60%-36% advantage over Romney in 2012 and a 66%-32% advantage over McCain in 2008.",good
mturk_charts/no_data_remaining/multi_col/1077.png,"While more than 46 million Americans already have cast their votes this year, 80 million or so more will be voting on Election Day itself. If you’re one of them, there’s a good chance you’ll use one of two basic forms of voting technology to record your choices: optical-scan ballots, in which voters fill in bubbles, complete arrows or make other machine-readable marks on paper ballots; or direct-recording electronic (DRE) devices, such as touch screens, that record votes in computer memory. While those are the two dominant forms of in-person voting, they aren’t the only ones in use. Around 5% of registered voters live in places that conduct elections entirely by mail – the states of Colorado, Oregon and Washington, more than half of the counties in North Dakota, 10 counties in Utah and two in California. And in more than 1,800 small counties, cities and towns – mostly in New England, the Midwest and the intermountain West – more than a million voters still use paper ballots that are counted by hand. Beyond the rise of early, absentee and mail voting, the means by which Americans vote on Election Day have changed dramatically over the past generation. In 1980, when Ronald Reagan defeated Jimmy Carter, the two most common voting systems nationwide were punch-card devices and “lever machines” – self-contained voting booths in which voters flipped levers to indicate their preferences, with the totals automatically recorded on a built-in mechanical register when the voter opened the privacy curtain to exit the booth. But the lever machines, which were first invented in the 1890s, were bulky and expensive to maintain and repair, and they were phased out over the next two decades. (New York State was the last to use them regularly, officially retiring them in 2010, though they’ve made a handful of guest appearances since.) Punch cards hung on throughout the 1990s but gradually lost ground to optical-scan and electronic systems – a decline that accelerated sharply after the 2000 Florida election recount debacle that brought the term “hanging chad” to brief prominence.",complex
mturk_charts/no_data_remaining/multi_col/1078.png,"Republicans and Democrats have grown increasingly negative in their evaluations of presidents representing the other party. Partisan divisions over presidential performance are wider now than at any point going back more than six decades, and this growing gap is largely the result of increasing disapproval of the chief executive from the opposition party. An average of just 14% of Republicans have approved of Barack Obama over the course of his presidency, compared with an average of 81% of Democrats.",complex
mturk_charts/no_data_remaining/multi_col/1079.png,"Hillary Clinton is hoping to make history on Tuesday by being elected the nation’s first woman president. While the impact of Clinton’s gender on her candidacy is viewed very differently by her supporters and voters who back Donald Trump, there also is a gender gap among Clinton’s supporters. Half of Clinton supporters think she is being held to a higher standard than past presidential candidates because she is a woman; just 11% of Trump supporters say the same, according to a Pew Research Center survey conducted Oct. 20-25. But women who back Clinton are far more likely than her male supporters to say she is being held to a higher standard. A majority of women who back Clinton (57%) express this view, compared with 34% who say her gender is not a factor. Among men who back Clinton, opinion is nearly the reverse: 52% say Clinton’s gender is not a factor, while 40% say she is held to a higher standard than prior presidential candidates. Very few of Clinton’s male (6%) or female (8%) supporters think she is treated less critically because of her gender.",good
mturk_charts/no_data_remaining/multi_col/1080.png,"Still, when it comes to the prospect of Clinton making history on Nov. 8, men and women Clinton supporters are on the same page. In an August survey, comparable shares of women (65%) and men (61%) Clinton supporters said the election of a woman president would be very important historically. By contrast, most Trump supporters – women (67%) and men (62%) alike – said this would be not too important or not at all important.",good
mturk_charts/no_data_remaining/multi_col/1081.png,"A majority of the public says abortion should be legal in all or most cases (59%), while 37% say abortion should be illegal in at least most cases, according to a Pew Research Center survey released last week. Support for legal abortion has fluctuated in recent years, but is at its highest level since 1995.",complex
mturk_charts/no_data_remaining/multi_col/1082.png,"This shift in Democratic support is especially pronounced among women. Currently, 85% of Democratic women think abortion should be legal in all or most cases, up 18 points from March. This is the highest level of support for legal abortion among Democratic women in the past two decades. By comparison, 71% of Democratic men say abortion should legal in at least most cases, little changed from March (75%). There are no similar divisions by gender among Republicans. Currently, 36% of Republican men and 32% of Republican women think abortion should be legal in at least most cases. For the most part, there have been only slight gender differences in Republican opinion about abortion over the past decade.",good
mturk_charts/no_data_remaining/multi_col/1083.png,"With nearly 160,000 arrivals so far in 2016, Italy has received almost the same number of refugees as Greece this year, and by year’s end it may surpass Greece as Europe’s new focal point for refugee flows, according to recent statistics from the United Nations High Commissioner on Refugees. Italy only needs to receive about 10,000 more refugees by Dec. 31 to overtake Greece in number of refugee arrivals in 2016. Already, Italy has received more refugees than it did in all of 2015 (153,842) and is quickly approaching its 2014 refugee total (170,100).",good
mturk_charts/no_data_remaining/multi_col/1084.png,"Italy only needs to receive about 10,000 more refugees by Dec. 31 to overtake Greece in number of refugee arrivals in 2016. Already, Italy has received more refugees than it did in all of 2015 (153,842) and is quickly approaching its 2014 refugee total (170,100). One of the reasons the overall number of refugees to Europe is down is a March 2016 agreement between Turkey and the European Union that requires the return of any new asylum-seekers traveling from Turkey. Since the agreement, the number of Syrian refugees in neighboring Turkey has remained stable, and relatively few asylum-seekers from Syria have made the journey to Greece.",good
mturk_charts/no_data_remaining/multi_col/1085.png,"As Election Day nears, more Republicans feel favorably toward their party. As in past cycles, Republicans’ ratings of their own party have grown more favorable as the campaign nears its end. About eight-in-ten Republicans (82%) now say they have a favorable view of the GOP. This positive outlook is up from earlier this year, when the share who rated the party favorably dipped. In June, 69% of Republicans had a favorable opinion, while 28% rated the GOP unfavorably.",complex
mturk_charts/no_data_remaining/multi_col/1086.png,"Nearly six-in-ten registered voters who back Clinton (58%) say they have a “hard time” respecting someone who supports Trump for president; 40% say they have “no trouble” with it. Nearly the opposite is true among Trump supporters, with 56% saying they have no trouble respecting someone who backs Clinton and 40% saying they do have trouble with it.",good
mturk_charts/no_data_remaining/multi_col/1087.png,"About 57,800 minors in the U.S. ages 15 to 17 were married as of 2014. That might sound like a lot of people (and it is), but it’s also just five of every 1,000 in that age group, a Pew Research Center analysis of 2014 data from the Census Bureau’s American Community Survey finds. By contrast, 18 of every 1,000 of those ages 18 to 19 were married, and among those ages 20 to 24, the number rose to 107 out of every 1,000.",good
mturk_charts/no_data_remaining/multi_col/1088.png,"And while a majority of the Japanese public maintains a favorable view of their longtime ally the United States, roughly half see U.S. power and influence as a major threat to Japan. An even larger share of the population (61%) sees America in decline, a harsher judgment of the U.S. than is found in China.",good
mturk_charts/no_data_remaining/multi_col/1089.png,"The Japanese public sees cybersecurity, ISIS and climate change as the biggest threats to their country. About seven-in-ten Japanese (71%) say cyberattacks from other countries are a major threat to Japan. Roughly the same share of the public (69%) believes the Islamic militant group in Iraq and Syria known as ISIS represents a major threat. And a similar number (68%) cite global climate change as a major problem. Notably, it is older Japanese (75% of those ages 50 and older), not younger ones (59% ages 18 to 34), who are the most worried about global warming. Despite widespread antipathy toward Beijing, a smaller share of the public (63%) names China’s emergence as a world power as a major threat to Japan. And despite a largely favorable view of the United States, roughly half the Japanese public (52%) also names U.S. power and influence as a major international challenge for Japan. Young Japanese (63%), those ages 18 to 34, are more likely than those ages 50 and older (47%) to see the U.S. as a threat.",good
mturk_charts/no_data_remaining/multi_col/1090.png,"Japan is a relatively closed society demographically. The foreign population in Japan accounts for just 1.6% of the country’s population. This is the third-smallest share in any OECD country. And the Japanese feel strongly about their national identity. Roughly nine-in-ten Japanese believe that to be considered truly Japanese, it is very important (70%) or somewhat important (22%) to be able to speak Japanese. A similar portion says it is very (43%) or somewhat important (47%) to share national customs and traditions to identify as Japanese. And roughly three-quarters voice the view that it is very (50%) or somewhat important (27%) to have been born in Japan to be truly Japanese. The intensity of such sentiment is felt most strongly by older Japanese – those ages 50 and older – who are far more likely than those ages 18 to 34 to believe it is very important that a person be born in Japan, speak Japanese and adhere to Japanese customs and traditions to be considered truly Japanese.",good
