img_path,summary,category
mturk_charts/no_data_remaining/multi_col/2394.png,"South Africans appear to recognize the competing economic influence of the two world powers – and to welcome ties with both countries. According to a new Pew Research Center poll, about seven-in-ten (72%) say the U.S. has a great deal or fair amount of influence on economic conditions in South Africa; 71% say the same about China. Among those who believe the U.S. and China have a significant economic impact on their country, majorities say both nations’ influence is a good thing for South Africa: 67% for the U.S. and 58% for China. Regardless, Obama is likely to receive a warm welcome on the visit. Roughly seven-in-ten (72%) hold a favorable view of the U.S., a higher percentage than in either 2002 or 2008. And a broad majority (74%) express confidence in Obama to do the right thing in world affairs, much higher than the 32% in 2008 who trusted his predecessor, President George W. Bush.",good
mturk_charts/no_data_remaining/multi_col/2395.png,"Last year, the Obama administration created the Deferred Action for Childhood Arrivals program, which provides temporary relief from deportation to qualifying young adults ages 15 to 30 who were brought to the U.S. illegally as children. The program also provides a work permit to those who are awarded relief from deportation. The program does not provide a pathway to citizenship, but does offer temporary legal status – a feature likely to be a part of any comprehensive immigration bill.",unquestionable
mturk_charts/no_data_remaining/multi_col/2396.png,"Favorable opinions of both business corporations and labor unions have rebounded from record lows reached in the summer of 2011. Overall, more Americans now hold a favorable (55%) than an unfavorable (39%) view of business corporations; two years ago, opinion was reversed (52% unfavorable, 38% favorable). Similarly, views of labor unions have returned to positive territory, with 51% holding a favorable view and 42% holding an unfavorable view – far better ratings than the 46% unfavorable/41% favorable balance of opinion registered in 2011. Public views of business corporations and labor unions, which had mostly been in positive territory from the 1980s through the early 2000s, turned less favorable during the economic recession. And in August 2011, amid fears of a new economic downturn and widespread dissatisfaction with national conditions, favorable ratings for business and labor hit all-time lows. Since then, favorable opinions of business corporations have increased 17 points and positive views of labor unions have risen 10 points.",good
mturk_charts/no_data_remaining/multi_col/2397.png,"A Pew Research Center survey in May found that for the first time, more than half (51%) of Americans favored allowing gay men and lesbians to marry. The same survey found that 72% percent of Americans believe that legal recognition of same-sex marriage is inevitable, regardless of whether they themselves favor or oppose it: While 85% of same-sex marriage supporters say legal recognition is inevitable, so do 59% of opponents.",good
mturk_charts/no_data_remaining/multi_col/2398.png,"The number of Americans who had a favorable view of gay men stands at 55%, an 18 percentage point increase compared to a decade earlier; 58% had a favorable opinion of lesbians, a 19 percentage point increase over the same time span.",complex
mturk_charts/no_data_remaining/multi_col/2399.png,"A new poll finds that the public is as interested in the Supreme Court’s upcoming ruling on the Voting Rights Act as in its long-awaited decisions on same-sex marriage. Roughly a third of Americans (35% each) say they are very interested in both how the court will rule on whether parts of the Voting Rights Act are still necessary and on federal and state laws on gay marriage. A third (33%) express little or no interest in how the court rules on the Voting Rights Act, while 40% say they are not too or not at all interested in the court’s rulings on gay marriage. The Pew Research Center survey was conducted June 20-23 among 1,005 adults, before the Supreme Court’s ruling Monday on affirmative action in college admissions. About three-in-ten (31%) had said they were very interested in that decision.",good
mturk_charts/no_data_remaining/multi_col/2400.png,"Pew Research surveys going back to 1987 show only a quarter to a third of Americans agreeing with the statement that “We should make every possible effort to improve the position of blacks and other minorities, even if it means giving them preferential treatment.” But support is sharply split by race: When we asked the question last year, 62% of blacks and 59% of Hispanics agreed with the statement but only 22% of whites did. And while 44% of 18- to 29-year-olds agreed, about a third of all other age groups did.",good
mturk_charts/no_data_remaining/multi_col/2401.png,"In many cases, the political divides over these issues are wider than the racial or ethnic differences. And as with many other issues, the debate over affirmative action is becoming more polarized along partisan lines, largely due to increased support for such programs by Democrats. When Pew Research first began asking the”preferential treatment” question back in 1987, only 33% of Democrats supported the principle; by 2012 that figure had risen to 52%. Meanwhile, Republicans have remained solid in their disapproval: Just 12% agree that we should make every possible effort, including preferential treatment, to improve the position of blacks and other minorities – virtually unchanged from 15% a quarter-century ago.",good
mturk_charts/no_data_remaining/multi_col/2402.png,"Most Americans believe undocumented immigrants should meet certain requirements before they are allowed to stay in the U.S. legally: 56% say undocumented immigrants should have to pay fines before gaining legal status. A similar percentage (55%) backs a 10-year waiting period for most immigrants before permanent residency. There is much broader support for another requirement – fully 76% of the public, including majorities of nearly every demographic group, say that undocumented immigrants should have to show they can speak and understand English before being allowed to stay in the U.S. legally.",good
mturk_charts/no_data_remaining/multi_col/2403.png,10 — Median age at which gay men in America said they first thought they might be gay. 15 — Median age at which they knew for sure. 13 — Median age at which American lesbians said they first thought they might be lesbian.,good
mturk_charts/no_data_remaining/multi_col/2404.png,56% — Percentage of unmarried gay men in America who say they’d like to get married someday. 58% — Percentage of unmarried U.S. lesbians who say they would. 45% — Percentage of unmarried bisexuals who say they would.,good
mturk_charts/no_data_remaining/multi_col/2405.png,"A new Kaiser Family Foundation Health Tracking Poll, from which this chart of the week is taken, suggests that, despite the “invincible” tag, young adults are worried about their ability to foot medical bills. More than three-quarters of those ages 18 to 25 regard health insurance as something important for them to have, something they need and something that is worth the cost. About two-thirds of young adults — roughly the same number as the general population — worry about medical bills that might result from a serious illness or accident. The survey, conducted June 4-9, did find a higher percentage of young adults than the overall population who believed they were healthy enough and didn’t really need insurance, but this still only constituted 24% of their age group compared to 11% of all adults.",complex
mturk_charts/no_data_remaining/multi_col/2406.png,"Lesbian, gay, bisexual and transgender adults are generally less religious than U.S. society as a whole, a recent Pew Research Center survey found. About half (51%) declare any religious affiliation at all, versus close to eight-in-ten U.S. adults; about a fifth (17%) are both religiously affiliated and say religion is very important in their lives, compared with just over half (54%) of the general public.",complex
mturk_charts/no_data_remaining/multi_col/2407.png,"Though ratings have improved in recent months, CNN’s morning programming ranked third in viewership in 2012, averaging just 239,000 viewers per day, compared with 452,000 for MSNBC’s Morning Joe and 1.13 million for Fox’s Fox and Friends, according to Nielsen Media Research. Other parts of the day look no better. Continued declines in prime-time viewership, considered the most critical time for cable news, placed the channel third behind Fox and MSNBC for three years straight. In 2012, it fell to third place in daytime viewership for the first time. There’s more to the story, of course. CNN remains a highly profitable organization, with a wide digital reach and a sizable international presence; it operates more bureaus around the world than Fox and MSNBC combined. And in May, the channel’s previous morning show, Starting Point, averaged 380,000 viewers, according to Nielsen—not enough to come close to Fox and Friends’ 1.26 million, but enough to approach MSNBC’s Morning Joe, which drew an average of 387,000.",good
mturk_charts/no_data_remaining/multi_col/2408.png,"In 2011, nearly two-thirds (64.6%) of U.S. Hispanics, or 33.5 million, traced their family origins to Mexico, according to Pew Research Center tabulations of the 2011 American Community Survey (ACS). By comparison, Puerto Ricans, the nation’s second largest Hispanic-origin group, number about 5 million and make up 9.5% of the total Hispanic population in the 50 states and the District of Columbia. Mexican-origin Hispanics have always been the largest Hispanic-origin group in the U.S. In 1860, for example, among the 155,000 Hispanics living in the U.S., 81% were of Mexican origin—a historic high. Since then the origins of the nation’s Hispanic population have diversified as growing numbers of immigrants from other Latin American nations and Puerto Rico settled in the U.S. For example, between 1930 and 1980, Hispanics from places other than Mexico nearly doubled their representation among U.S. Hispanics, from 22% to 41%. But with the arrival of large numbers of Mexican immigrants in the 1980s and 1990s, the Mexican share among Hispanics grew, rising to a recent peak of 66% in 2008. Since then it has declined slightly—to 65%—as Mexican migration to the U.S. has slowed (Passel, Cohn and Gonzalez-Barrera, 2012).",good
mturk_charts/no_data_remaining/multi_col/2409.png,"Latinos’ views of same-sex marriage have changed dramatically in recent years. In 2012 for the first time, more Latinos said they favored same-sex marriage than opposed it (52% versus 34%) according to a Pew Hispanic Center survey. This is a reversal from six years earlier, when one-third (31%) of Latinos favored same-sex marriage and more than half (56%) opposed it. This shift in views tracks with that of the general public, whose opinions on same-sex marriage have also changed in recent years. But even though more Hispanics now favor same-sex marriage than oppose it, not all Hispanic groups hold the same view. According to the National Survey of Latinos, support for allowing gays and lesbians to marry legally is highest among Latino adults with no religious affiliation (71%), Latinos ages 18 to 29 (68%), Latinos who identify with or lean toward the Democratic Party (60%) and Latinos with some college education or more (63%). By contrast, the strongest opposition to same-sex marriage comes from Evangelical Hispanics, 66% of whom oppose allowing gays and lesbians to marry legally. Additionally, 60% of Hispanics ages 65 and older and 51% of Hispanics who identify with or lean toward the Republican Party oppose legalizing same-sex marriage.",complex
mturk_charts/no_data_remaining/multi_col/2410.png,"According to Pew Research Center’s most recent estimate based on the 2011 American Community Survey, there were 1.89 million Cubans and 1.95 million Salvadorans living in the U.S. Statistically speaking, those two estimates are indistinguishable from each other, and it’s been that way since 2008.",good
mturk_charts/no_data_remaining/multi_col/2411.png,"In a second term marked by a series of controversies and little legislative success, President Obama’s job approval rating has nonetheless remained fairly steady. Currently, 49% approve of the way Obama is handling his job as president while 43% disapprove.",good
mturk_charts/no_data_remaining/multi_col/2412.png,"The latest national survey by the Pew Research Center, conducted June 12-16 among 1,512 adults, finds that Obama is likely benefitting from more positive perceptions of the national economy. Yet the public’s economic views look good only when compared with the dismal attitudes of the past five years. Take evaluations of local job availability: 29% now say that there are plenty of jobs available in their community, the most positive measure since July 2008. Roughly twice as many (64%) say that jobs are difficult to find.",good
mturk_charts/no_data_remaining/multi_col/2413.png,"Obama’s current job rating of 49% is higher than George W. Bush’s rating in June 2005 (42%), but lower than Bill Clinton’s job measure in June 1997 (54%).",good
mturk_charts/no_data_remaining/multi_col/2414.png,"Only about a quarter of Americans (23%) rate current economic conditions as excellent or good, while 76% say they are only fair or poor. Yet this is the most positive assessment of the nation’s economy since January 2008.",good
mturk_charts/no_data_remaining/multi_col/2415.png,"Today, according to new Pew Research Center data not yet released in a report, 88% of Germans say they have confidence in Obama to do the right thing in world affairs. In stark contrast, just 14% had confidence in Bush during his last year in office. Across Europe, Obama has received more favorable reviews than Bush, but the gap between the two American leaders has been especially wide among Germans. And while Obama’s ratings have slipped a bit over time in countries such as Britain, Spain and Poland, they’ve remained relatively steady in Germany, with roughly nine-in-ten consistently expressing a positive view of Obama since he took office in 2009.",good
mturk_charts/no_data_remaining/multi_col/2416.png,"Even amidst developments on the ground in Syria and the announcement of U.S. plans to aid anti-government groups there, the public continues to pay very little attention to news about Syria. In a separate survey conducted Thursday through Sunday, just 15% say they are following news about charges that Syria has used chemical weapons against anti-government groups very closely, far fewer than are following other stories such as the government’s collection of communication information (35%) and news about the national economy (30%). In fact, 33% say they are following news about Syria not at all closely.",good
mturk_charts/no_data_remaining/multi_col/2417.png,"A majority of Americans disapprove of the Supreme Court’s stance on prayer in public schools, according to 2012 data from the General Social Survey, conducted by the National Opinion Research Center at the University of Chicago. Asked whether they approve or disapprove of the court’s ruling that no state or local government may require the reading of the Lord’s Prayer or Bible verses in public schools, roughly 39% say they approve and about 57% say they disapprove. Those percentages have stayed relatively steady since the early 1980s.",good
mturk_charts/no_data_remaining/multi_col/2418.png,"Those numbers began to deteriorate sharply starting in late 2007 as the nation’s economic crisis took hold. In February 2008, only 17% of people rated the economy excellent or good and, a year later, only 4% gave the “good” response, ( no one used excellent). In that month’s survey, 71% called the economy poor. Although the recession was declared over in June 2009 by the National Bureau of Economic Research, Americans have remained deeply skeptical of the recovery. Only since last fall has the percentage calling it excellent or good consistently remained above 10%. Most people still rate the economy “only fair” (43% in the most recent survey) or poor (40%). In addition, a plurality (40%) in the March survey said it would be a long time before the economy recovers and 31% said it was not recovering but would soon. Read more",good
mturk_charts/no_data_remaining/multi_col/2419.png,"Overall, 48% of Hispanic eligible voters turned out to vote in 2012, down from 49.9% in 2008. By comparison, the 2012 voter turnout rate among blacks was 66.6% and among whites was 64.1%, both significantly higher than the turnout rate among Hispanics.",good
mturk_charts/no_data_remaining/multi_col/2420.png,"According to our data, the Martin case emerged as the No. 1 story in the mainstream press the week of March19-25, 2012—following the release of Zimmerman’s 911 calls. That week, it accounted for 19% of the newshole, making it the first story in 2012 to generate more coverage in a single week than the presidential campaign. (The term newshole refers to the space devoted to each subject in print and online and time on radio and TV.) At that point, about one-third of Americans (35%) said they were following news about the case very closely, making it one of the top stories in 2012 in terms of the level of public attention.",good
mturk_charts/no_data_remaining/multi_col/2421.png,"But Fewer See Need to Sacrifice Civil Liberties. Yet fewer Americans think it will be necessary to sacrifice civil liberties to combat terrorism than did so shortly after the 9/11 attacks. In a poll conducted in 2011, shortly before the 10th anniversary of 9/11, 40% said that “in order to curb terrorism in this country it will be necessary for the average person to give up some civil liberties,” while 54% said it would not. A decade earlier, in the aftermath of 9/11 and before the passage of the Patriot Act, opinion was nearly the reverse (55% necessary, 35% not necessary).",good
mturk_charts/no_data_remaining/multi_col/2422.png,"About seven-in-ten Americans (69%) say there’s solid evidence that the average temperature on earth has been getting warmer over the past few decades, according to a Pew Research Center survey conducted in March. That’s about as many as said so in 2008, although acceptance of the reality of global warming has risen and fallen considerably over that time span: from a high of 79% in July 2006 to a low of 57% in October 2009. But opinions vary on what’s causing the planet’s mean temperature to rise. Four in ten (42%) said it was primarily due to human activity, such as burning fossil fuels, while 23% attributed the warming to natural variations in climate patterns. Another 27% said there was no solid evidence of any warming.",good
mturk_charts/no_data_remaining/multi_col/2423.png,"In the Pew Research sample, two of the three major cable news channels had a fairly even distribution of airtime devoted to opinion and to newsgathering. CNN was the only one to feature more reporting (54%) than opinion (46%) overall. At the Fox News Channel, the split leaned toward moderately more opinion (55%) than reporting (45%).",good
mturk_charts/no_data_remaining/multi_col/2424.png,"American attitudes toward China have turned sharply negative over the last two years. According to new Pew Research Center poll findings not yet released in a report, 52% of Americans have an unfavorable opinion of China, while just 37% express a favorable view. In 2011, the balance of opinion was just the opposite – 51% held a favorable opinion, while just 36% gave China an unfavorable rating.",good
mturk_charts/no_data_remaining/multi_col/2425.png,"For their part, the Chinese increasingly see the U.S. in a negative light as well. In spring 2010, a few months after a visit to China by President Obama, 58% of Chinese expressed a favorable opinion of the U.S. Today, more than half of Chinese hold an unfavorable view (53% have an unfavorable view v. 40% favorable view).",good
mturk_charts/no_data_remaining/multi_col/2426.png,"Though growth in smartphone ownership has occurred up and down the economic spectrum, adoption still varies significantly by household income. However, that variation is unevenly distributed across different age groups. Younger adults—regardless of income level—are very likely to be smartphone owners. Conversely, for older adults smartphone ownership is more of an “elite” phenomenon: smartphones tend to be quite prevalent at the upper end of the income distribution but much less common among those with lower income levels.",unquestionable
mturk_charts/no_data_remaining/multi_col/2427.png,"There is a strong relationship between a country’s religiosity and opinions about homosexuality.2 There is far less acceptance of homosexuality in countries where religion is central to people’s lives – measured by whether they consider religion to be very important, whether they believe it is necessary to believe in God in order to be moral, and whether they pray at least once a day. There are some notable exceptions, however. For example, Russia receives low scores on the religiosity scale, which would suggest higher levels of tolerance for homosexuality. Yet, just 16% of Russians say homosexuality should be accepted by society. Conversely, Brazilians and Filipinos are considerably more tolerant of homosexuality than their countries’ relatively high levels of religiosity would suggest.",complex
mturk_charts/no_data_remaining/multi_col/2428.png,"At the start of his presidency, Obama received significantly more positive ratings than his predecessor. In 2009, Egyptians were almost evenly divided between those who expressed confidence that Obama would “do the right thing” in world affairs (42%) and those who lacked confidence in the new American president (47%). But Obama’s ratings have steadily declined, and today, only 26% of Egyptians express confidence in him, while 72% have little or no confidence.",good
mturk_charts/no_data_remaining/multi_col/2429.png,"The Pew Research Center’s results generally track with the General Social Survey: When the GSS asked last year if people had a gun in their home or garage, 34% said they did.",complex
mturk_charts/no_data_remaining/multi_col/2430.png,"The U.S. electorate reached several milestones last year. According to the Census Bureau, 2012 was the first time that the black voter turnout rate1, exceeded that of whites (File, 2013), though there is some skepticism about when or if the black voter turnout rate surpassed the white voter turnout rate (Taylor and Lopez, 2013). In addition, the number of white voters declined for the second presidential election in a row, leading to a decline in the white voter turnout rate. One other finding from 2012 is the decline in the youth voter turnout rate. According to an analysis by the Center for Information &amp; Research on Civic Learning &amp; Engagement, the voter turnout rate among those ages 18 to 29 declined from 51% in 2008 to 45% in 2012 (CIRCLE, 2013).",good
mturk_charts/no_data_remaining/multi_col/2431.png,"A survey conducted in early May after the Senate rejected a measure to expand background checks on private gun sales found that gun rights advocates continue to show a higher level of political activism on the issue than those who favor stricter gun control measures. Among those who prioritize gun rights, 41% say they would not vote for a candidate with whom they disagreed on gun policy, even if they agreed with the candidate on most other issues. That figure is 10 percentage points higher than the number of gun control supporters (31%) who say gun policy is a make-or-break voting issue for them. And while nearly as many gun control supporters as gun rights supporters report contacting a public official about gun policy in the past six months, more gun rights advocates have contributed money to organizations that take positions on gun policy (12% vs. 3% of gun control supporters).",good
mturk_charts/no_data_remaining/multi_col/2432.png,"The Centers for Disease Control and Prevention reported last week that the birth rate among 15- to 19-year-olds had fallen to a record low 31.3 births per 1,000 in 2011. Teen birth rates dropped for all racial and ethnic groups, but fell the most among Hispanic teens: from 75.3 per 1,000 in 2007 to 49.4 per 1,000 in 2011. Teen births have been trending lower for the past three decades. In 1991, the birth rate for all teens was 61.8 per 1,000, according to the CDC. But the decline has accelerated since the start of the Great Recession: from 41.5 per 1,000 in 2007 to 31.3 in 2011, a 25% drop. (While fertility rates fell during that period for all age groups except 40 and above, the declines were sharpest for women in their teens and 20s.)",good
mturk_charts/no_data_remaining/multi_col/2433.png,"In terms of both raw numbers and population rates, gun suicides have been on the rise in recent years, even as gun homicides have fallen. In 2010, the gun suicide rate was 6.3 per 100,000 people, compared with 3.6 per 100,000 for gun homicides.",good
