img_path,summary,category
mturk_charts/no_data_remaining/multi_col/1159.png,"Just 11% of Japanese express a favorable view of China today. And over the past decade, the average favorability of China among Japanese has been just 18%.",good
mturk_charts/no_data_remaining/multi_col/1160.png,"The Chinese also subscribe to negative stereotypes of the Japanese. Seven-in-ten or more Chinese associate violence (74%) and arrogance (70%) with the Japanese. The former view is up 9 percentage points since 2006. Only half the Chinese see the Japanese as modern, down from roughly two-thirds a decade ago. And the proportion of Chinese (34%) who see the Japanese as hardworking has nearly halved since 2006 (61%). As a point of comparison, in a 2015 Pew Research Center survey, 94% of Americans believed the Japanese to be hardworking.",good
mturk_charts/no_data_remaining/multi_col/1161.png,"Japanese atonement for its activities in China before and during World War II is an ongoing source of friction in Sino-Japanese relations. The Japanese believe they have expressed regret for their behavior, while the Chinese disagree. Among the Japanese people, 53% say they have apologized enough for their country’s military actions during the 1930s and 1940s. Such sentiment is up from 40% in 2006. Over that time period, the proportion of the public that believes Japan has not apologized sufficiently has fallen by 21 percentage points, from 44% to 23%. Notably, one-in-six Japanese (17%) say no apology is necessary.",good
mturk_charts/no_data_remaining/multi_col/1162.png,"Japanese atonement for its activities in China before and during World War II is an ongoing source of friction in Sino-Japanese relations. The Japanese believe they have expressed regret for their behavior, while the Chinese disagree. The Chinese see Tokyo’s war-related penitence quite differently. Roughly three-quarters (77%) say Japan has not adequately expressed regret, and such Chinese sentiment is largely unchanged since 2006. Only 10% believe Tokyo has apologized enough.",good
mturk_charts/no_data_remaining/multi_col/1163.png,"Voter satisfaction with the choice of presidential candidates, already at a two-decade low, has declined even further. A new survey finds that just a third of registered voters say they are very or fairly satisfied with the choices, while 63% say they are not too or not at all satisfied. That represents a 7-percentage-point drop since June in the share of voters expressing satisfaction with their candidate choices. This marks the first time in six presidential contests since 1992 that positive views of the choice of candidates have shown a significant decline over the course of the campaign (no comparative data are available for the 2000 campaign). The latest national survey by Pew Research Center, conducted Aug. 23-Sept. 2 among 1,201 adults, including 947 registered voters, finds that unhappiness with this year’s choices crosses partisan lines: Just 36% of Republican and Republican-leaning registered voters, and 35% of Democrats and Democratic leaners, say they are satisfied with their choices. In prior campaigns, voter satisfaction with the selection of candidates either increased or held steady as Election Day drew closer. At this point in the campaign four years ago, 54% of registered voters said they were very or fairly satisfied with the choice of candidates, which was little changed from June of that year (56%).",complex
mturk_charts/no_data_remaining/multi_col/1164.png,"Voters also are more likely to say the campaign so far is too negative than to say it is not (71% vs. 23%). Across party lines, majorities of Democrats (75%) and Republicans (65%) describe the campaign this way. More see this year’s campaign as too negative than in recent election cycles. The share saying this now (71%) is 20 points higher than it was in September 2012, when just about half thought the campaign was too negative, and is up 28 points from September 2008, when more thought that the campaign was not too negative (51%) than said it was (43%). In 2004, a somewhat smaller majority of voters described the campaign as too negative (62%) than say so now.",good
mturk_charts/no_data_remaining/multi_col/1165.png,"As in past Pew Research Center surveys of library use, the April 2016 survey also measured Americans’ usage of and engagement with libraries. Overall, 53% of Americans age 16 or older have had some interaction with a public library in the past year – either through an in-person visit, using a library website, or via a mobile app. Some 48% of adults specifically visited a library or bookmobile in the past 12 months, a modest uptick from the 44% who said that in late 2015. There was a four-point drop, though, in the number who visited library websites in the previous 12 months – falling from 31% who said they’d done so in 2015 to 27% in 2016.",good
mturk_charts/no_data_remaining/multi_col/1166.png,"When panelists received invitations via text message and email, they completed the survey earlier in the field period than those who received only email. In fact, in the first 30 minutes after the survey invitations were sent, 15% of the text message and email group had responded to the survey vs. only 6% of the email-only group. This has important implications for survey researchers who need to collect data in a short amount of time.",good
mturk_charts/no_data_remaining/multi_col/1167.png,"In the second experiment, all consenting respondents received text message and email invitations to their surveys. Those who had not responded by the third day were randomized into either the treatment group, which received text and email reminders, or the control group, which received only email reminders. Reminders were sent on days 4, 9, and 15 of the field period. The respondents who received only email reminders but still answered the survey were younger than the respondents who received both text and email reminders. Of the email-only group, one quarter (25%) were ages 18 to 29 versus only 15% of the text and email group. This was unexpected because of the popularity of texting among this age group. One possible explanation is that younger people use text messaging more than older adults, so the text message reminders may have been less novel. There were no other differences in demographics between the two groups of respondents.",good
mturk_charts/no_data_remaining/multi_col/1168.png,"Currently, 40% of the public says that the ability of terrorists to launch another major attack on the United States is greater than it was at the time of the 9/11 attacks, which is the highest share expressing this view over the past 14 years. About a third (31%) say terrorists’ abilities to attack are the same as at the time of 9/11, while just 25% say their ability to initiate a major attack is less than at that time.",complex
mturk_charts/no_data_remaining/multi_col/1169.png,"Currently, 49% of Americans say their bigger concern about the government’s anti-terrorism policies is that they have not gone far enough to protect the country, while 33% say their bigger concern is that those policies have gone too far in restricting civil liberties.",complex
mturk_charts/no_data_remaining/multi_col/1170.png,"Americans today have an enormous variety of content available to them at any time of day, and this material is available in a number of formats and through a range of digitally connected devices. Yet even as the number of ways people spend their time has expanded, a Pew Research Center survey finds that the share of Americans who have read a book in the last 12 months (73%) has remained largely unchanged since 2012. And when people reach for a book, it is much more likely to be a traditional print book than a digital product. Fully 65% of Americans have read a print book in the last year, more than double the share that has read an e-book (28%) and more than four times the share that has consumed book content via audio book (14%).",good
mturk_charts/no_data_remaining/multi_col/1171.png,"A similar share of Americans report that they read for pleasure, for work or school, or to keep up with current events compared to the most recent time these questions were asked in 2011. However, the share of Americans who read in order to research specific topics of interest has increased by 10-percentage points over that time frame, from 74% to 84%.",good
mturk_charts/no_data_remaining/multi_col/1172.png,"A similar share of Americans report that they read for pleasure, for work or school, or to keep up with current events compared to the most recent time these questions were asked in 2011. However, the share of Americans who read in order to research specific topics of interest has increased by 10-percentage points over that time frame, from 74% to 84%. In some cases, the factors associated with high rates of book readership are the same ones associated with reading for specific purposes. For instance, college graduates are more likely than those who have only attended high school to read books in general – and they are also more likely to read for all four of the specific motivations examined in this survey. At the same time, there is not always such a direct relationship between book reading and overall reading for specific purposes. As noted earlier in this report, young adults are more likely to read books than older adults. And when asked about specific reasons why they might read a range of content, these young adults are much more likely than older adults to say that they read for work or school, or to research a specific topic of interest. However, Americans of all ages are equally likely to indicate that they read (whether in book form or otherwise) for pleasure or to keep up with current events.",good
mturk_charts/no_data_remaining/multi_col/1173.png,"Baby Boomers and prior generations have cast the vast majority of votes in every presidential election since 1980, data from the Census Bureau’s November Current Population Survey voting supplement show. In 2012, Boomers and previous generations accounted for 56% of those who said they voted. And these generations dominated earlier elections to an even greater degree.",complex
mturk_charts/no_data_remaining/multi_col/1174.png,"But the ranks of Millennial and Generation X eligible voters have been growing, thanks to the aging-in of Millennials and naturalizations among foreign-born adults. These generations matched Boomers and previous generations as a share of eligible voters in 2012 and are now estimated to outnumber them. As of July, an estimated 126 million Millennial and Gen X adults were eligible to vote (56% of eligible voters), compared with only 98 million Boomers and other adults from prior generations, or 44% of the voting-eligible population.",good
mturk_charts/no_data_remaining/multi_col/1175.png,"Baby Boomers and prior generations have cast the vast majority of votes in every presidential election since 1980, data from the Census Bureau’s November Current Population Survey voting supplement show. In 2012, Boomers and previous generations accounted for 56% of those who said they voted. And these generations dominated earlier elections to an even greater degree. In the 2012 election an estimated 70% of eligible voters in the Baby Boom, Silent and Greatest generations voted. Turnout among these generations was similar in 2004 (70%) and 2008 (69%). If (and it’s a big if) 70% of Boomer-and-older eligible voters turn out in November, Millennials and Xers could match them even by turning out at much lower rates. A turnout rate of 70% among older voters would translate to 68.6 million votes. Millennials and Gen X could match that number of votes with a turnout rate of 54.5%. This level of turnout among the two younger generations seems plausible based on past elections.",good
mturk_charts/no_data_remaining/multi_col/1176.png,"There is broad public support for background checks for private gun sales and sales at gun shows (81%), laws to prevent the mentally ill from buying guns (76%), barring gun purchases by those on government screening lists (71%), and creating a federal database to track gun sales (68%). About half support bans on assault-style weapons (52%) and high-capacity ammunition clips (50%).",good
mturk_charts/no_data_remaining/multi_col/1177.png,"For the most part, opinions on these issues have changed little in recent years, but support for an assault weapons ban has slipped from 57% to 52% since July 2015, with the decline driven by Republicans and Republican-leaning independents. Currently, 35% of Republicans and Republican leaners favor an assault weapons ban, while 62% are opposed. In July 2015, Republicans were more divided between support (44%) and opposition (51%). Republican opposition to an assault weapons ban is at its highest point since 2013, the first time Pew Research Center asked this question. Democrats’ views are unchanged over the past year: Currently, 67% favor an assault weapons ban, while 32% are opposed.",good
mturk_charts/no_data_remaining/multi_col/1178.png,"The survey also gauged the intensity of concern or enthusiasm for gene editing, finding that two-thirds of all adults (68%) say this new development makes them “very” or “somewhat” worried. By contrast, only half (49%) say they are “very” or “somewhat” enthusiastic about gene editing. Three-in-ten say they are both worried and enthusiastic about the technology.",good
mturk_charts/no_data_remaining/multi_col/1179.png,"Political parties’ ideological stances are in the eye of the beholder: Republicans and Democrats see the opposite party as more ideologically extreme than their own, which they tend to consider more moderate. In a recent Pew Research Center study of political animosity, respondents were asked to rate themselves and both political parties on an 11-point ideological scale, ranging from very liberal to very conservative. Members of both parties most commonly place the other party on the extreme end of the scale. Among Democrats, 34% placed the GOP at the most conservative point. Even more Republicans – 45% – put the Democratic Party at the liberal extreme.",good
mturk_charts/no_data_remaining/multi_col/1180.png,"Majorities in both parties view the other party as closer to the ideological extreme than the center. Nearly six-in-ten Democrats (58%) place the Republican Party at one of the three most conservative points on the scale (0-2), while 69% of Republicans place the Democratic Party on the most liberal points (8-10). Among Republicans, 71% place themselves at least one point away from where they place the GOP on an ideological scale of zero to 10. They are more likely to consider themselves to the right of the party than its left. More than four-in-ten Republicans (44%) identify as more conservative than their party, with 19% putting themselves at least three points to the right. Fewer Republicans (28%) rate themselves as more liberal than the GOP.",good
mturk_charts/no_data_remaining/multi_col/1181.png,"After a year of escalating terror attacks against Western targets, people across Europe are widely supportive of U.S.-led military action against the Islamic militant group in Iraq and Syria known as ISIS. But when it comes to a broader strategy to defeat terrorism around the world, many Europeans fear relying too much on military force will create hatred that leads to more terrorism. A Pew Research Center survey conducted this spring, before the most recent terror attacks in France and Germany, found that a median of 76% across 10 European countries saw ISIS as a major threat to their nation and 69% supported U.S.-led military actions against the group. When asked about defeating terrorism more widely, only 41% were convinced that using overwhelming military force was the best strategy. A larger 53% thought relying too much on force would be counterproductive.",good
mturk_charts/no_data_remaining/multi_col/1182.png,"A new national survey finds that Trump supporters overwhelmingly believe that life in America is worse than it was 50 years ago “for people like them.” Fully 81% of registered voters who support Trump say life has gotten worse, compared with just 11% who say it has gotten better (6% say it is about the same). Most Clinton supporters take the opposite view: 59% say life for people like them has gotten better over the past half-century, while 19% think it has gotten worse and 18% see little change. The candidates’ supporters have contrasting expectations for the nation’s future. Trump backers are broadly pessimistic – 68% say life for the next generation will be worse than today. Clinton supporters have mixed assessments. Nearly four-in-ten (38%) say life will be better, 28% say it will be about the same and just 30% say it will be worse. The latest national survey by Pew Research Center, conducted August 9-16 among 2,010 adults, including 1,567 registered voters, finds little change overall in voters’ views of how the nation has changed and its future prospects since March, during the presidential primaries. But the divisions evident in that survey are striking in the context of the general election.",good
mturk_charts/no_data_remaining/multi_col/1183.png,"As was the case earlier this year, most voters have doubts that either Clinton or Trump would make a good president. Just 27% of registered voters say that Trump would make a good or great president, while about twice as many (55%) say he would be either poor or terrible (with 43% saying he would make a “terrible” president). Just 15% say Trump would make an “average” president. Opinions about how Clinton might do as president are not as negative. Still, only about a third of voters (31%) say she would be a good or great president, while 22% say would be average and 45% think she would be a poor (12%) or terrible (33%) president.",good
mturk_charts/no_data_remaining/multi_col/1184.png,"In recent years, these platforms have provided new arenas for national conversations about race and racial inequality. Some researchers and activists credit social media – in particular, Black Twitter – with propelling racially focused issues to greater national attention. In fact, two of the most used hashtags around social causes in Twitter history focus on race and criminal justice: hashtag_Ferguson and hashtag_BlackLivesMatter. In addition to social and political issues, social media also serve as places where conversations about race intersect with a number of issues, including pop culture, sports and everyday personal experiences. A new Pew Research Center survey finds significant differences in the way black and white adults use social media to share and interact with race-related content1 And a Pew Research Center analysis of tweets reveals that key news events – from Baltimore, to Charleston, South Carolina, to Dallas – often serve as a catalyst for social media conversations about race. Black social media users (68%) are roughly twice as likely as whites (35%) to say that at least some of the posts they see on social networking sites are about race or race relations. When it comes to their own postings, a similar racial gap exists. Among black social media users, 28% say most or some of what they post is about race or race relations; 8% of whites say the same. On the other hand, roughly two-thirds (67%) of whites who use social media say that none of things they post or share pertain to race.",good
mturk_charts/no_data_remaining/multi_col/1185.png,"In only six of the 16 countries surveyed do a majority of people feel their national economy is in good shape. Even before the Brexit vote caused economic turmoil, Europeans generally took a depressed view of the economy. In seven of the 10 European countries surveyed, roughly half or less see their country’s economic situation as good. Greeks stand out as the least happy, with only 2% saying the Greek economy is doing well. Similarly, just 12% in France and 13% in Spain give their economy a positive rating. Swedes and Germans, on the other hand, are the most confident in their respective economies among the European Union countries surveyed, with 76% in Sweden and 75% in Germany saying the economic situation is good. Roughly six-in-ten (61%) in the Netherlands also express this view. While there is still considerable economic gloom in Europe, sentiments have improved in several nations over the past few years. Ratings for the German economy are significantly better today than they were in the midst of the global financial crisis in 2009 (28% good). British and Polish views are much more positive than three years ago, and even though only a third of Italians rate their economy positively, this is much higher than the 3% who agreed in 2013. In contrast, the public mood has remained glum in Spain, France and Greece in recent years.",good
mturk_charts/no_data_remaining/multi_col/1186.png,"Across the Atlantic, Americans are slowly but consistently regaining confidence in their economy. A modest 44% of Americans currently think the U.S. economic situation is good, a full 27 percentage points higher than in 2009. Still, economic confidence remains lower than the pre-crisis 50% registered in 2007.",good
mturk_charts/no_data_remaining/multi_col/1187.png,"As political and economic unrest roils Venezuela, U.S. asylum applications filed by Venezuelans so far in fiscal 2016 have jumped 168% compared with the same time period a year earlier, according to a Pew Research Center analysis of U.S. Citizenship and Immigration Services data. Venezuela is now among the top nations of origin for asylum applicants to the U.S., accounting for 10,221 applications filed between October 2015 and June 2016 – up from 3,810 filed during the same time period the year before. (The data exclude applicants in the process of deportation.)",good
mturk_charts/no_data_remaining/multi_col/1188.png,"In an increasingly contentious presidential campaign, just a quarter of voters who support Donald Trump in the general election say they have a lot or some close friends who are supporters of Hillary Clinton. Even fewer Clinton backers (18%) say they have at least some friends who support Trump. Nearly half of Clinton supporters (47%), and 31% of Trump supporters, say they have no close friends who support the opposing candidate. The survey conducted June 7-July 5 among 4,602 adults, including 3,834 registered voters, on Pew Research Center’s nationally representative American Trends Panel finds that large majorities of both Trump and Clinton supporters have friends who back their preferred candidates. More than four-in-ten Trump supporters (44%) say they have a lot of close friends who back Trump, while another 38% say they have some friends who support him. Similarly, most Clinton supporters say they have a lot (41%) or some close friends (40%) who also express support for Clinton.",good
mturk_charts/no_data_remaining/multi_col/1189.png,"Among Clinton and Trump supporters, only about a quarter (24%) who have at least some friends who back the other candidate are “pretty outspoken” about their voting preferences. That compares with 38% who say they have no close friends who support the other candidate. Voters who have a lot of friends who back their preferred candidate are far more likely than others to be outspoken about who they are supporting: 45% say they are pretty outspoken, compared with just 24% of those with some friends who back their candidate and only 9% of those with few or no friends who back their candidate.",good
mturk_charts/no_data_remaining/multi_col/1190.png,"In other countries with large numbers of displaced persons, many are refugees from elsewhere. For example, Turkey has more than 2.5 million Syrian refugees as of the end of 2015, accounting for most of Turkey’s nearly 2.8 million displaced people. And Pakistan has more than 1.5 million refugees from Afghanistan, making up more than half of the 2.7 million displaced people living within Pakistan’s borders.",complex
mturk_charts/no_data_remaining/multi_col/1191.png,"In 2014, nearly 600,000 asylum applications were filed in the EU, Norway and Switzerland, a 47% increase over the more than 400,000 applications filed in 2013. In 2015, the number of asylum applications grew again, this time more than doubling 2014’s record to reach about 1.3 million (a 122% increase). The overall increase from 2013 to 2014 and again between 2014 and 2015 was reflected in the trajectory of new asylum seekers arriving from each of the three leading origin countries: Syria, Afghanistan and Iraq.",good
mturk_charts/no_data_remaining/multi_col/1192.png,"The research: Declining response rates have been a fixation for pollsters, who track their ebb like hawks. While few would claim the single-digit rates are something to boast about, research thus far – including the 15-year track compiled by SSRS’s David Dutwin, below – has not suggested that decreasing response rates are leading to increasing error rates. On the other hand, one of the few types of nonresponse bias that has been consistently noted by researchers is the fact that those who participate in surveys are also more likely to participate in civic activities – they are more likely to be “joiners,” in other words. Our own Scott Keeter and Drew DeSilver have a wrap-up on the challenges of polling when fewer people are available to be polled, that covers this issue and others.",good
