img_path,summary,category
mturk_charts/no_data_remaining/multi_col/2967.png,"In evaluating news coverage of different groups, pluralities of Americans say that coverage of poor people and Muslims is too negative, while somewhat smaller percentages say the same about coverage of blacks and Hispanics. Among eight groups tested, whites and middle-class people are the only groups that majorities say are treated fairly by the press; 57% say that news coverage of whites is generally fair while 56% say the same about coverage of middle-class people. Notably, about a third (32%) say that coverage of wealthy people is too positive — the highest percentage for any group included in the survey. About as many see coverage of the wealthy as too positive as say it is generally fair (31%).",good
mturk_charts/no_data_remaining/multi_col/2968.png,"Public attention to the major oil leak in the Gulf of Mexico has yet to drop off as significantly as media coverage. Currently, 39% say they followed news about the leak very closely last week, not much different from the 42% that said this one week earlier. Still, that is down sharply from 59% in the July 22-25 survey. More than four-in-ten (44%) say this was the story they followed most closely last week. The oil leak accounted for 3% of the coverage measured by PEJ, down from 11% one week earlier. With the underground well largely sealed, coverage has declined greatly since a peak of 44% of the newshole in mid-June.",good
mturk_charts/no_data_remaining/multi_col/2969.png,"More than four-in-ten Americans (43%) say they heard a lot last week about the dramatic exit by JetBlue flight attendant Steven Slater from his plane at New York’s Kennedy Airport after an argument with a passenger. A quarter (25%) say they heard a little about how Slater had quit his job, opened the plane door and hopped on the emergency exit chute. About three-in-ten (31%) say they heard nothing at all about this story. Fewer say they heard a lot (30%) about controversies over plans for mosques in several U.S. cities. Debate over building a mosque near the World Trade Center site in New York City continued to generate controversy this week, especially after a series of comments by President Obama about the issue over the weekend. About three-in-ten (29%) say they heard a little about this issue, while 41% say they had heard nothing at all. Close to four-in-ten Republicans (38%) say they heard a lot about this, compared with 28% of Democrats; 30% of independents say they heard a lot as well. Just more than two-in-ten (22%) say they heard a lot about the debate about changing the Constitution so that children of non-citizens born in the United States would no longer automatically be U.S. citizens. Another 37% heard a little about this debate, while 40% say they heard nothing at all. On this, there are no significant differences among partisans. Awareness of that story was similar to awareness of news about the arrest of a man suspected of stabbing as many as 20 people. About two-in-ten (21%) say they heard a lot about this story, 36% say they heard a little and 43% say they had heard nothing at all.",good
mturk_charts/no_data_remaining/multi_col/2970.png,"The Gulf coast oil leak continues to be the public’s most closely followed story, but interest has declined from last week. About four-in-ten (42%) say they followed the story very closely, down from 57% a week ago. Nevertheless, the Gulf oil leak was once again the public’s top news story: 42% say it is the story they followed most closely this week; news about the economy was a distant second, cited by just 16%.",good
mturk_charts/no_data_remaining/multi_col/2971.png,"In contrast to views of news about the oil spill, the public’s perceptions of economic news have not changed and remain far more negative than positive. Currently, 55%say they are hearing a mix of good and bad news about t he economy, while 38% say the economic news they are hearing is mostly bad and just 4% say they are hearing mostly good news about the economy. That is little changed from early July, when 54% said they were hearing mixed news, and 42% said they were hearing mostly bad news. In June, however, just 30% said they were hearing mostly bad news and 65% said the news was a mix of good and bad.",good
mturk_charts/no_data_remaining/multi_col/2972.png,"Over the course of George W. Bush’s two terms in office, Democratic ratings of the court remained lower than Republican ratings, and lower than they had been following Bill Clinton’s nominations of Ruth Bader Ginsburg and Stephen Breyer to the court (in December of 1997, 81% of Democrats had a favorable impression of the Supreme Court). Republican favorability is down from 70% in April 2009 — a month prior to Sotomayor’s nomination — and 80% in April 2008 in the last year of Bush’s presidency. As a result, for the first time since the Clinton administration, more Democrats (65%) than Republicans (52%) have a favorable impression of the court.",good
mturk_charts/no_data_remaining/multi_col/2973.png,"The controversy surrounding the firing of U.S. Department of Agriculture official Shirley Sherrod attracted widespread attention from the news media last week and was the dominant story on cable news networks. The public, however, showed modest interest in the Sherrod affair and, as has been the case since early May, the oil leak in the Gulf of Mexico was by far the public’s most closely followed news story. The latest News Interest Index survey, conducted July 22-25 among 1,004 adults by the Pew Research Center for the People &amp; the Press, finds that 51% say the oil leak was the story they followed most closely last week, compared with just 8% who cited news reports about the Sherrod controversy. News about the economy – at 13% most closely – also drew more interest than the Sherrod story. A separate analysis by Pew Research’s Project for Excellence in Journalism (PEJ) finds that reports on Sherrod’s firing accounted for 14% of all coverage last week, but as much as 28% of coverage on July 21, after it became clear that the video posted by conservative blogger Andrew Breitbart took Sherrod’s comments about race out of context. The White House subsequently apologized to Sherrod, as did many news commentators.",good
mturk_charts/no_data_remaining/multi_col/2974.png,"Latinos continue to lag behind non-Latinos in cell phone use. Just over three-fourths (76%) of Latinos ages 18 and older use cell phones; this number is 86% among non-Latinos.9 The same is true with regard to internet use, despite marked gains by Latinos in recent years (Livingston, Parker and Fox 2009). Some 64% of Latinos use the internet, compared with 78% of non-Latinos—a 14 percentage point difference.",good
mturk_charts/no_data_remaining/multi_col/2975.png,"Congressional leaders on both sides of the aisle continue to receive negative assessments from the public. Today, just a third (33%) approves of the Republican congressional leadership; about the same number (35%) approves of the Democratic leadership. While these evaluations have changed little in recent months, approval ratings for Democratic leaders are now far lower than they were in early 2009. Ratings for Republican leaders have shown less change over this period.",good
mturk_charts/no_data_remaining/multi_col/2976.png,"More than half of the public (55%) say this was the news they followed most closely last week. The Gulf coast spill now has been the most closely followed story for each of the past 12 weeks. News about the spill again received more coverage than any other major story, accounting for 20% of the newshole. That is up from 15% one week earlier, but still below peak levels reached in May and June, when it accounted for one-third or more of coverage, according to the Pew Research Center’s Project for Excellence in Journalism (PEJ).",good
mturk_charts/no_data_remaining/multi_col/2977.png,"The oil leak and the economy’s continued struggles remain the top long-running stories of this summer. Close to four-in-ten (37%) say they followed news about the economy very closely, while 13% say this was the story they followed more closely than any other. News about the economy – not including final congressional action on a financial regulatory overhaul – accounted for 10% of the newshole, according to PEJ. About a quarter (23%) say they followed news about the regulatory overhaul very closely; 4% say this was the story they followed most closely. News about the legislation accounted for 5% of coverage. Just more than two-in-ten (22%) say they followed news about the situation in Afghanistan very closely last week; 5% say they followed Afghanistan news more closely than any other story. News about the war accounted for 4% of coverage. Fewer than two-in-ten (17%) say they followed news about the 2010 elections very closely. This was the top story for 2%. This news made up 6% of coverage. Meanwhile, 14% say they very closely followed news about a resolution passed by the NAACP calling on Tea Party leaders to condemn racist talk among supporters; 2% say this was the story they followed most closely. News about the Tea Party, primarily news about the NAACP resolution, accounted for 3% of coverage.",good
mturk_charts/no_data_remaining/multi_col/2978.png,"You posit that there may be more of this going on among Millennials than among older respondents. It’s an interesting observation, but we have no way of knowing from our data whether it’s true. On the general topic of racial tolerance and diversity, however, there are a few things we do know. First, all age groups in this country have grown more tolerant over time, and Millennials are the most tolerant of all, as illustrated by the accompanying chart on attitudes about interracial dating. Might there be some social desirability embedded in these responses? Sure. But even if that’s all we’re measuring, it may be its own marker of social progress. Lip service, after all, is one of the tributes we pay to virtue.",unquestionable
mturk_charts/no_data_remaining/multi_col/2979.png,"You posit that there may be more of this going on among Millennials than among older respondents. It’s an interesting observation, but we have no way of knowing from our data whether it’s true. On the general topic of racial tolerance and diversity, however, there are a few things we do know. First, all age groups in this country have grown more tolerant over time, and Millennials are the most tolerant of all, as illustrated by the accompanying chart on attitudes about interracial dating. Might there be some social desirability embedded in these responses? Sure. But even if that’s all we’re measuring, it may be its own marker of social progress. Lip service, after all, is one of the tributes we pay to virtue.",unquestionable
mturk_charts/no_data_remaining/multi_col/2980.png,"An overwhelming proportion of Americans are familiar with Twitter, the online information-sharing network. Perhaps more surprisingly, a large majority also knows that children who are born to illegal immigrants in the United States are automatically U.S. citizens. Yet the public continues to struggle in identifying political figures, foreign leaders and even knowing facts about key government policies. Only about a third of Americans (34%) know that the government’s bailout of banks and financial institutions was enacted under the Bush administration. Nearly half (47%) incorrectly say that the Troubled Asset Relief Program – widely known as TARP – was signed into law by President Obama. Even fewer (28%) are able to identify John Roberts as chief justice of the U.S. Supreme Court. And just 19% know that David Cameron is the new prime minister of Great Britain. The Pew Research Center’s latest News IQ Quiz, conducted July 1-5 among 1,007 adults reached on cell phones and landlines, finds that both young people and older people have a basic awareness of Twitter: 85% know that it is an online information-sharing service. And while young people fare particularly poorly on political knowledge, people younger than 30 are as likely as older Americans to know the host country of this year’s World Cup and that children born to illegal immigrants in the United States are automatically citizens.",complex
mturk_charts/no_data_remaining/multi_col/2981.png,"The Gulf oil leak once again topped both public interest and media coverage last week, though the percent following the story very closely dropped to 43% from 57% the week of July 1-5. Still, 45% say they followed this news more closely than any other major story. Just 13% say they followed the next ranking story – the U.S. government’s legal challenge to Arizona’s new immigration law – most closely, according to the latest weekly News Interest Index conducted July 8-11 among 1,001 adults by the Pew Research Center for the People &amp; the Press. News about the oil spill accounted for 15% of coverage, more than double the next top story but far below the 44% devoted to the leak the week of June 14, according to a separate analysis by the Pew Research Center’s Project for Excellence in Journalism (PEJ). The percentage of coverage devoted to the spill declined in subsequent weeks as the media also focused on other major stories – such as the economy and the war in Afghanistan.",good
mturk_charts/no_data_remaining/multi_col/2982.png,"Overall opinions of the Supreme Court are unchanged since February, at 58% favorable, but are somewhat less positive than in April 2009 (64% favorable). Over this period, favorable impressions of the court among Republicans have fallen by 18 points – from 70% to 52%. Democrats’ views of the Supreme Court have shown less change: 65% now have a favorable view of the Supreme Court, up slightly from February (57%), and about the same as in April 2009 (63%). Independents’ opinions also have changed little over this period. Currently, 58% of independents have a positive impression of the court.",good
mturk_charts/no_data_remaining/multi_col/2983.png,"Public perceptions of economic news have turned much more negative. Currently, 42% say they are hearing mostly bad news about the economy, the highest percentage in a year. Last month, 30% of the public said they were hearing mostly bad news about the economy. The proportion saying they are hearing a mix of good and bad economic news has declined from 65% in June to 54% currently. This marks the first time this year that the percentage hearing mixed economic news has fallen below 60%, according to the latest News Interest Index survey conducted July 1-5 among 1,007 adults by the Pew Research Center for the People &amp; the Press. Just 3% say they are hearing mostly good news, about the same as the 4% that said this last month. More Americans also say they are hearing mostly bad news about two major aspects of the economy – the job situation and real estate values – than did so in May. Nearly two-thirds (64%) say they are hearing mostly bad news about jobs, up from 52% in May.",good
mturk_charts/no_data_remaining/multi_col/2984.png,"Americans continue to say they are tracking news about the environmental disaster unfolding in the Gulf of Mexico more closely than any other story. More than half (52%) say this is the news they are following most closely. Looking at a separate measure, 57% say they are following the oil leak very closely, about the same level of interest as the past five weeks. According to PEJ, media coverage last week was divided among several major stories. The oil leak accounted for 15% of the newshole, not much more than the 13% of coverage devoted to the economic developments. The Senate Judiciary Committee’s confirmation hearings on Kagan’s Supreme Court nomination accounted for 11% of coverage, though the public showed relatively little interest. Just 16% say they followed this news very closely. That’s not much different from the 20% in July 2009 who said they were very closely following the hearings for President Obama’s first Supreme Court nominee, Sonia Sotomayor. Kagan’s hearings produced no surprises and little drama; 3% say this was the news they followed most closely. Interest in the arrest by American law enforcement of 11 people suspected of being spies for Russia was similar to interest in Kagan’s confirmation hearings; 15% say they followed this story very closely. It was the story followed most closely by 2%. Coverage of the alleged spy ring accounted for 8% of the newshole.",good
mturk_charts/no_data_remaining/multi_col/2985.png,"About a third (34%) say they followed news about the immigration debate very closely; 11% say this was the news they followed most closely. In early May, 38% said they very closely followed news about Arizona’s new law giving police greater authority to question people they stop who they suspect might be illegal immigrants. Last week, immigration stories accounted for 3% of the coverage analyzed by PEJ. Interest in the arrest by American law enforcement of 11 people suspected of being spies for Russia was similar to interest in Kagan’s confirmation hearings; 15% say they followed this story very closely. It was the story followed most closely by 2%. Coverage of the alleged spy ring accounted for 8% of the newshole.",good
mturk_charts/no_data_remaining/multi_col/2986.png,"When respondents who favor gender equality are asked whether their country has made most of the changes needed to give women equal rights with men or if more changes are needed to achieve that goal, majorities in 18 of 22 countries say the latter. At least eight-in-ten equal rights supporters in Japan (89%), Brazil (84%), France (82%) and Spain (80%) say their countries need to continue making changes to ensure that women have the same rights as men. This view is shared nearly equally among both genders in Japan, Brazil and France; in Spain, women are considerably more likely than men to say that more changes need to be made (86% vs. 74%).",complex
mturk_charts/no_data_remaining/multi_col/2987.png,"Asked about the accuracy of economic coverage, 36% say news reports present the U.S. economy “about the way it really is.” Close to three-in-ten (28%) say news reports make the national economy seem worse than it really is and 23% say they make it seem better than it really is. People have greater confidence in the press’s portrayal of their state economies: 55% say news reports portray the economy in their state about as it really is, 20% say worse than it really is and 18% say better.",good
mturk_charts/no_data_remaining/multi_col/2988.png,"Looking at other news, 6% say they followed the World Cup more closely than any other story last week; 14% say they followed the international soccer tournament very closely. News about the World Cup made up 2% of the news coverage last week. Faisal Shazhad’s guilty plea in connection with the May attempt to explode a car bomb in Times Square was the top story for just 1% of Americans; 18% say they followed this story very closely. Interest in the story is far lower than in early May, shortly after the incident, when 37% said they followed news about the investigation and arrests very closely and 13% named this the story they followed most closely. The Times Square guilty please took up 2% of last week’s newshole.",good
mturk_charts/no_data_remaining/multi_col/2989.png,"Public interest in the disaster remains strong. More than six-in-ten (63%) say they followed news about the oil leak more closely than any other story last week. A majority (56%) says the press has done an excellent or good job in covering the leak, though that is down from 66% in early May. With so much public attention focused on the oil leak, only small percentages say they followed any of the other top stories most closely last week. Just 10% say this about the second ranked story, news about the economy. Fewer name the World Cup soccer tournament in South Africa (6%), the situation and events in Afghanistan (3%), drug-related violence in Mexico (2%) or ethnic violence in Kyrgyzstan (1%). More than half of Americans (55%) say they followed news about the oil leak very closely last week, while 38% say the same about the economy. About one-in-five (21%) say they followed news about Afghanistan very closely. Almost as many say the same about drug violence in Mexico (17%); 11% followed news about the World Cup very closely and 6% followed news out of Kyrgyzstan very closely.",good
mturk_charts/no_data_remaining/multi_col/2990.png,"News about the economy has been overshadowed by the Gulf oil leak in recent weeks. And in the public’s view, the economic news has not improved. Currently, 65% say they are hearing a mix of good and bad news about the economy, while 30% say they are hearing mostly bad news and just 4% say they are hearing mostly good news.",good
mturk_charts/no_data_remaining/multi_col/2991.png,"More than half of the public (56%) says they have a favorable opinion of Barack Obama, down from 65% in November 2009. About seven-in-ten (69%) say they have a favorable opinion of Michelle Obama, about the same as the 71% that said this in November. Still, the latest Pew Research/National Journal Congressional Connection Poll, sponsored by SHRM, shows both Barack and Michelle Obama with somewhat higher negative ratings. Barack Obama’s unfavorable rating increased nine points from 30% in November to 39%; Michelle Obama’s increased six points from 16% to 22%.",good
mturk_charts/no_data_remaining/multi_col/2992.png,"The public increasingly sees Barack Obama’s policies as having an impact on economic conditions and, for the first time, slightly more say the impact has been negative rather than positive. About three-in-ten (29%) say Obama’s economic policies since taking office have made economic conditions worse; 23% say his policies have made conditions better. Nearly four-in-ten (38%) say they have had no effect so far or volunteer that it is too soon to tell, according to the latest Pew Research/National Journal Congressional Connection Poll, sponsored by SHRM. The survey was conducted June 3-6 among 1,002 adults. Opinions about the impact of Obama’s economic policies have changed little since February. But the proportion saying that Obama’s economic policies have made economic conditions worse has nearly doubled – from 16% to 29% – since June 2009. Over this period, the percentage saying his policies have improved conditions has changed little, while the number saying Obama’s policies have had no effect or that it is too soon to tell has fallen from 53% to 38%.",good
mturk_charts/no_data_remaining/multi_col/2993.png,"The public’s views of current economic conditions also remain negative. Just 9% say conditions are excellent or good, which is little changed from measures over the past two years. However, among those viewing the economy negatively – as only fair or poor – the proportion rating it poor has declined over the past few months while the percentage saying it is only fair has risen.",good
mturk_charts/no_data_remaining/multi_col/2994.png,"As efforts to stop a major underwater oil leak faltered and President Obama traveled to Louisiana to assess the early damage, the crisis in the Gulf of Mexico grabbed public attention and dominated media coverage last week. More than half of Americans (55%) say they followed news about the oil leak very closely. Close to six-in-ten (58%) say they followed this news more closely than any other major story, according to the latest News Interest Index survey, conducted May 27-30 among 1,001 adults by the Pew Research Center for the People &amp; the Press. One week earlier, 47% said they were following news about the leak very closely.",good
mturk_charts/no_data_remaining/multi_col/2995.png,"Though most Americans focused on the oil spill last week, other stories also grabbed the public’s attention. More than four-in-ten (43%) say they followed reports about the condition of the economy very closely. This was the most closely followed story for 11%. The media devoted 6% of coverage to news about the economy, according to a separate analysis by the Pew Research Center’s Project for Excellence in Journalism (PEJ). About three-in-ten (29%) say they very closely followed President Obama’s announcement that he would send 1,200 National Guard troops to the Mexican border, a component in the long-running debate over immigration legislation; 7% say they followed this news more closely than any other major story. Reporting on this accounted for 5% of the newshole examined by PEJ. About two-in-ten (19%) say they very closely followed news about tensions between North Korea and South Korea; 3% say this was the story they followed most closely. News about the tensions made up 3% of coverage.",good
