img_path,summary,category
mturk_charts/no_data_remaining/multi_col/790.png,"The overall percentage of lawful immigrants to the United States choosing to apply for and gaining citizenship is at its highest level in more than two decades. Yet in terms of naturalization rate, Mexicans – the single largest group of lawful immigrants by country of origin – lag well behind green-card holders eligible to apply from other parts of the globe. Based on Pew Research Center estimates using the most recent U.S. Census Bureau data available, two-thirds (67%) of lawful immigrants eligible to apply for U.S. citizenship had applied for and obtained citizenship by 2015. This is the highest share since at least the mid-1990s. But among Mexican lawful immigrants eligible to apply, only 42% had applied for and obtained U.S. citizenship by 2015, a rate little changed since 2005 and one of the lowest among all immigrant groups when it comes to country of origin. As part of a larger survey of Hispanic immigrants fielded in late 2015, Pew Research Center asked Mexican green-card holders why they had not yet become naturalized U.S. citizens. The most frequent reasons centered on inadequate English skills, lack of time or initiative, and the cost of the U.S. citizenship application. These appear to be significant barriers, as nearly all lawful immigrants from Mexico said they would like to become U.S. citizens someday. In the United States, the citizenship, or naturalization, rate among all lawful immigrants steadily increased from 1995 to 2005, rising from 47% to 62%. Until about 2005, the naturalization rate among lawful immigrants from Mexico also increased steadily, but did so more rapidly (from 20% in 1995 to 38% in 2005), narrowing the gap between Mexicans and other immigrants. However, between 2005 and 2010, the naturalization rate of Mexican green-card holders leveled off, even as the rate for lawful permanent residents from other parts of the globe continued to rise. Only in the period from 2011 to 2015 did the rate of naturalization among eligible Mexican immigrants significantly increase again at a pace higher than that of other lawful U.S. immigrants – going from 38% to 42% among Mexicans, compared with a 2-percentage-point increase, from 72% to 74% among non-Mexican immigrants.",good
mturk_charts/no_data_remaining/multi_col/797.png,"In Western European countries, confidence in the U.S. president has declined sharply. Clear majorities in the United Kingdom, France and Germany had at least some confidence in Obama, with shares reaching 93% in Germany at the start of his presidency. (German confidence declined somewhat in 2014 after allegations the U.S. National Security Agency eavesdropped on Chancellor Angela Merkel, though it rebounded when the German investigation was later dropped.) Current Trump confidence ratings in these countries are similar to their respective lows during the George W. Bush years. For example, only 13% of French respondents had at least some confidence in Bush in 2008, and now 14% in France say the same for Trump. Likewise, 14% of Germans had at least some confidence in Bush in 2008, while 11% are confident in Trump now. In Europe, Poland is a bit of an outlier, since its confidence in the U.S. president changed less dramatically across the three administrations. Polish respondents had a Bush-era high of 47% confidence and an Obama-era high of 64%, yet just 23% of Poles have confidence in Trump in 2017.",good
mturk_charts/no_data_remaining/multi_col/798.png,"Russia and Israel have gained confidence in the U.S. president. Since Obama’s final term, confidence has gone up among Russians and Israelis. This year, 53% of Russians have at least some confidence in the U.S. president, up from an Obama-era low of 11% in 2015. Russian confidence in Obama rose and fell over the president’s eight years in office, which saw tensions with Russia over Ukraine and other issues. In Israel, 56% are confident in President Trump, up from 49% confidence for Obama in 2015. Over the past 15 years, Israeli confidence in the U.S. president was highest in 2003, when 83% said they had at least some confidence in George W. Bush.",good
mturk_charts/no_data_remaining/multi_col/799.png,"Lebanon, Turkey and Jordan consistently have had low confidence in the U.S. president, regardless of who that was, over the past 15 years. Today, just 15% in Lebanon, 11% in Turkey and 9% in Jordan have confidence in Trump.",good
mturk_charts/no_data_remaining/multi_col/800.png,"Japan and South Korea have sharply lower confidence in the U.S. president, but majorities remain favorable toward U.S. overall. Only around a quarter of Japanese respondents (24%) and 17% of South Koreans say they are confident in the U.S. president now that Trump is in office. That represents a 71-percentage-point drop in South Korea from 2015. And confidence among Japanese dropped 54 points between 2016 and 2017.",good
mturk_charts/no_data_remaining/multi_col/801.png,"Although he has only been in office a few months, Donald Trump’s presidency has had a major impact on how the world sees the United States. Trump and many of his key policies are broadly unpopular around the globe, and ratings for the U.S. have declined steeply in many nations. According to a new Pew Research Center survey spanning 37 nations, a median of just 22% has confidence in Trump to do the right thing when it comes to international affairs. This stands in contrast to the final years of Barack Obama’s presidency, when a median of 64% expressed confidence in Trump’s predecessor to direct America’s role in the world. The sharp decline in how much global publics trust the U.S. president on the world stage is especially pronounced among some of America’s closest allies in Europe and Asia, as well as neighboring Mexico and Canada. Across the 37 nations polled, Trump gets higher marks than Obama in only two countries: Russia and Israel. In countries where confidence in the U.S. president fell most, America’s overall image has also tended to suffer more. In the closing years of the Obama presidency, a median of 64% had a positive view of the U.S. Today, just 49% are favorably inclined toward America. Again, some of the steepest declines in U.S. image are found among long-standing allies.",good
mturk_charts/no_data_remaining/multi_col/802.png,"Today, in many countries, ratings for President Trump look very similar to those for Bush at the end of his term. This pattern is especially clear in Western Europe. In the UK, France, Germany and Spain, the low levels of confidence in Trump are very similar to the poor ratings for Bush in 2008. In addition to exploring global views of President Trump, this survey also examines attitudes toward three other major leaders on the international stage. The results demonstrate that Trump is not the only world leader in whom global publics lack confidence. Chinese President Xi Jinping and Russian President Vladimir Putin also get poor marks, though neither is rated as negatively as the U.S. president. Across the 37 nations surveyed, a median of 28% voice confidence in Xi, while 27% feel this way about Putin.",good
mturk_charts/no_data_remaining/multi_col/803.png,"Along with its citizens, America’s popular culture is often well-regarded abroad. Roughly two-thirds across the countries surveyed like American music, movies and television. Europeans and Asians are particularly likely to find U.S. pop culture appealing, while these types of cultural exports are less popular in several Muslim-majority nations. Despite the doubts sown several years ago by revelations of American spying on foreign leaders and citizens, across the 37 countries polled this spring a median of 54% believe the U.S. government respects the personal freedom of its people. In Europe, America’s reputation for individual liberty was damaged by the U.S. National Security Agency’s spying revelations and has not recovered – today, a median of 52% across the 10 European nations polled say Washington respects personal freedoms, while nearly as many (a median of 44%) say it does not. The U.S. gets higher marks on this issue in Asia and Africa. But America’s influence around the world is not always welcome. For example, even though many people say they personally like American popular culture, a global median of 54% worry that the influx of U.S. customs and ideas into their country is a bad thing. A U.S. export that not all publics embrace is American-style democracy. While publics around the world generally endorse broad democratic principles, they offer mixed views regarding American ideas about democracy: Globally, a median of 43% say they like these ideas, while 46% say they dislike them. As with several other aspects of U.S. soft power, U.S.-style democracy is particularly popular in the African and Asian nations surveyed.",good
mturk_charts/no_data_remaining/multi_col/804.png,"In many countries, a majority or plurality believes relations will remain about the same. However, in most regions of the world, the share of the public that believes things will worsen outweighs the share that thinks relations will improve by a ratio of two-to-one. While relatively few say they expect relations to improve, more than half hold this view in Russia and Israel.",good
mturk_charts/no_data_remaining/multi_col/805.png,"Amid ongoing controversies and investigations into allegations of links between the Trump presidential campaign and Russia, attitudes toward the U.S. have turned more positive in Russia. Following the outbreak of the Ukraine crisis in 2014, ratings for both the U.S. as a country and for President Obama plummeted. However, since 2015 – the last time the Center polled in Russia – favorable opinions of the U.S. have become much more common there. And President Trump gets more-positive reviews in Russia than either of his predecessors ever did.",good
mturk_charts/no_data_remaining/multi_col/806.png,"In survey after survey, Israelis give the U.S. some of its highest favorability ratings, and that’s true again this year, with 81% saying they have a positive view of the U.S. Assessments of American presidents, however, have fluctuated. In 2003, President George W. Bush received very high ratings, but those declined a bit over the course of his presidency. Obama’s confidence ratings varied from 49% to 71% in the Center’s polling in Israel during his administration. Between 2014 and 2015, his ratings dipped substantially, reflecting tensions between Obama and Prime Minister Benjamin Netanyahu over the Iran nuclear deal. Israel is one of only two countries (Russia being the other) in which Trump’s ratings are higher than Obama’s during the final two years of his administration.",good
mturk_charts/no_data_remaining/multi_col/807.png,"In Germany – and in several of its Western European neighbors – attitudes toward the U.S. have followed a clear pattern over the past decade and a half. President George W. Bush was not very popular at the outset of his presidency, and he grew less so over the next few years, amid widespread German opposition to key elements of his foreign policy. This in turn had a negative impact on America’s overall image in the country. President Obama, in contrast, was extremely well-regarded (although his ratings did decline somewhat following the NSA eavesdropping scandal), and this coincided with an improvement in attitudes toward the U.S. Today, German confidence in Trump is low, and U.S. favorability is near where it was at the end of the Bush years.",good
mturk_charts/no_data_remaining/multi_col/808.png,"In Germany – and in several of its Western European neighbors – attitudes toward the U.S. have followed a clear pattern over the past decade and a half. President George W. Bush was not very popular at the outset of his presidency, and he grew less so over the next few years, amid widespread German opposition to key elements of his foreign policy. This in turn had a negative impact on America’s overall image in the country. President Obama, in contrast, was extremely well-regarded (although his ratings did decline somewhat following the NSA eavesdropping scandal), and this coincided with an improvement in attitudes toward the U.S. Today, German confidence in Trump is low, and U.S. favorability is near where it was at the end of the Bush years. Over the past decade, U.S. presidents have gotten mixed or negative reviews in Mexico, but at 5% Donald Trump registers the lowest confidence rating of any U.S. leader in Mexico since Pew Research Center began surveying there. This 5% rating is also the lowest among the 37 nations polled in 2017. The proposed wall between the U.S. and Mexico has been a high-profile position for Trump since he declared his candidacy for president, and more than nine-in-ten Mexicans oppose it. U.S. favorability has typically been higher than confidence in the American president in Mexico. That remains the case this year, although the share of the public with a positive view of the U.S. has dropped steeply since 2015. Trump receives dramatically lower ratings than his predecessor in Canada. And for the first time since the Center began polling in Canada, the share of Canadians expressing a favorable opinion of their neighbor to the south has slipped to below 50%. Just 43% of Canadians now have a positive view of the U.S.",good
mturk_charts/no_data_remaining/multi_col/809.png,"Trump receives dramatically lower ratings than his predecessor in Canada. And for the first time since the Center began polling in Canada, the share of Canadians expressing a favorable opinion of their neighbor to the south has slipped to below 50%. Just 43% of Canadians now have a positive view of the U.S.",good
mturk_charts/no_data_remaining/multi_col/810.png,"Two years after the Supreme Court decision that required states to recognize same-sex marriages nationwide, support for allowing gays and lesbians to marry legally is at its highest point in over 20 years of Pew Research Center polling on the issue. By a margin of nearly two-to-one (62% to 32%), more Americans now say they favor allowing gays and lesbians to marry than say they are opposed. The latest national survey by Pew Research Center, conducted June 8-18 among 2,504 adults finds striking increases in support for same-sex marriage among some demographic and partisan groups that, until recently, had broadly opposed it, including:",good
mturk_charts/no_data_remaining/multi_col/811.png,"Younger Americans continue to be more likely than older Americans to say they favor allowing gays and lesbians to marry legally: Fully 74% of Millennials (ages 18 to 36) say they favor same-sex marriage, while just 23% say they are opposed. And by more than two-to-one, more Generation Xers (those ages 37 to 52) favor allowing gays and lesbians to marry than oppose same-sex marriage (65% vs. 29%). Support for same-sex marriage among older adults also has increased over the past ten years. Today, a 56%-majority of Boomers (those ages 53 to 71) say they favor allowing legal same-sex marriage, while a smaller share (39%) say they are opposed. Support among Boomers has increased since March 2016, when just less than half (46%) said they favored same-sex marriage. Among the Silent generation (those ages 72 to 89), 49% oppose allowing gays and lesbians to marry, while 41% favor this. However, support for same-sex marriage has nearly doubled among members of the Silent generation since 2007, when just 24% said they were in favor.",good
mturk_charts/no_data_remaining/multi_col/812.png,"Support for allowing gays and lesbians to marry legally also has steadily risen across racial and ethnic groups. Six-in-ten or more whites (64%) and Hispanics (60%) say they favor allowing same-sex couples to be married legally. In 2007, just 38% of whites and 37% of Hispanics supported same-sex marriage.",good
mturk_charts/no_data_remaining/multi_col/813.png,"Republicans and Republican leaners are divided on the question for the first time: 47% favor allowing gays and lesbians to marry, while a nearly identical share is opposed (48%). Fully three-quarters of Democrats and Democratic-leaning independents (76%) say they favor allowing same-sex marriage, compared to just 19% who are opposed.",good
mturk_charts/no_data_remaining/multi_col/814.png,"Support for same-sex marriage has risen across all religious groups in recent years, including among white evangelicals and black Protestants. Support for same sex-marriage among white Evangelicals has more than doubled compared with a decade ago (14% then, 35% now), while the share of black Protestants who favor same-sex marriage has increased from 24% in 2007 to 44% today.",good
mturk_charts/no_data_remaining/multi_col/815.png,"Throughout most of the last decade, the generational gap within white evangelicals was more modest. In 2007, for instance, 12% of Boomer and Silent white evangelicals supported same-sex marriage, compared with 19% of Millennial and Gen Xer white evangelicals.",good
mturk_charts/no_data_remaining/multi_col/816.png,"When it comes to views about some potential contributing factors to gun violence, Democrats and Republicans deeply disagree over the degree to which legally obtained guns contribute to gun violence. About three-quarters (76%) of Democrats say the ease with which people can legally obtain guns contributes a great deal or fair amount to gun violence, compared with just 39% of Republicans. By contrast, more than eight-in-ten Republicans (84%) and Democrats (88%) say the ease with which people can illegally obtain guns contributes a great deal or a fair amount to gun violence.",good
mturk_charts/no_data_remaining/multi_col/817.png,"Most Russians still believe their country doesn’t get the respect it deserves, but fewer feel this way now than in the past. Today, 56% of the Russian public thinks Moscow should be held in higher esteem around the world. About a third believes Russia gets the proper amount of respect, which is up from just 16% in 2012, the last time the question was asked.",good
mturk_charts/no_data_remaining/multi_col/818.png,"Russian President Vladimir Putin gets high marks on foreign affairs. Overall, nearly nine-in-ten Russians say they are confident in their president’s ability to do the right thing in world affairs, with 58% expressing a lot of confidence. When it comes to bilateral relationships, Russians give Putin high ratings on his handling of relations with the U.S. (73% approve), the EU (67%) and Ukraine (63%). But these ratings are down substantially from 2015, when 85% approved of Putin’s handling of the U.S., 82% approved of EU relations and 83% approved of Ukrainian relations. Putin gets his highest marks on managing relations with China (78% approval), a country with which Russian relations have become markedly friendlier in recent years. However, even that figure is down 12 percentage points compared with 2015.",good
mturk_charts/no_data_remaining/multi_col/819.png,"The public continues to be critical of both political parties. Both parties’ favorability ratings are more negative than positive and fewer than half say either party has high ethical standards. Majorities also fault both for their approach to government spending. But as in the past, more say the Democratic Party “cares about the middle class” (57%) than say that about the Republican Party (42%). And while 54% say the Republican Party is “too extreme,” fewer (45%) say this phrase applies to the Democratic Party. The share saying the Democratic Party is too extreme has risen over the past year (from 37%) while perceptions of the GOP have shown less change.",good
mturk_charts/no_data_remaining/multi_col/820.png,"As Congress continues to debate the budget and government spending, majorities are critical of the way that both parties handle these issues. Nearly two-thirds (64%) say the Republican Party is “too willing to cut government programs even when they work.” About as many (61%) say the Democratic Party “too often sees government as the only way to solve problems.”",good
mturk_charts/no_data_remaining/multi_col/821.png,"Perceptions of both parties remain little changed from April. Currently, four-in-ten have a favorable view of the Republican Party, while 54% express an unfavorable one. A comparable share of the public rates the Democratic Party favorably (44%), while half have an unfavorable opinion.",good
mturk_charts/no_data_remaining/multi_col/822.png,"Nearly eight-in-ten Republicans and leaners (77%) have a favorable view of the GOP, little changed since the beginning of the year. Democrats view the GOP less favorably now (12%) than in January (23%). Fully three-quarters of Democrats (75%) rate their party positively today, up slightly from April (70%). Republicans view the Democratic Party less favorably today (11%) than they did in January (23%).",good
mturk_charts/no_data_remaining/multi_col/823.png,"Mode also generally had a more pronounced effect on the responses from Democrats than on the responses from Republicans. Democrats, including independents who lean Democratic, were 17 points more likely to say that they followed news when asked on the phone (66%) than on the web (49%). Among Republicans and Republican leaners, by comparison, there was just a 7-point gap between those who were asked about their news habits on the phone (59%) and the web (52%).",good
mturk_charts/no_data_remaining/multi_col/824.png,"But while few citizens on the European continent are eager to see their own country depart the EU, many want the chance to have their voice heard through their own referendum on EU membership. Moreover, frustrations with Brussels remain when it comes to economic management and dealing with the refugee issue. Asked whether they would like their national government to make decisions about the movement of people into their country and trade with other nations, roughly half or more across the countries surveyed answer, “Yes.” A median of just 18% in the nine continental EU nations surveyed want their own country to leave the EU. Greece and Italy are home to the largest support for exit, but even in these countries more than half want to remain a part of the European project.",good
mturk_charts/no_data_remaining/multi_col/825.png,"Heightened adoption of mobile devices for news among older adults is due in part to the fact that they had considerably more room to grow than younger adults. Mobile news use, like internet use and mobile ownership in general, was already very high among younger adults, leaving little room for growth compared with older adults. For example, 94% of both those ages 18 to 29 and 30 to 49 get news on mobile – unchanged since 2016 for 18- to 29-year-olds and only a 9-point rise for the 30-49 group. By contrast, among those ages 50 to 64 and those 65 and older, increases of 16 and 24 points respectively in the past year have resulted in majorities in every age group now getting news on mobile. A recent Pew Research Center report similarly found a sharp rise in overall technology adoption among older Americans. Even though a large number of older adults are getting news on mobile devices, that doesn’t mean they prefer it. Across all adults, a clear majority of those who get news on both mobile devices and desktop/laptop computers prefer to get their news on mobile (65%). But those 65 and older are the only age group in which less than half prefer to do so: Only 44% prefer mobile, compared with about three-quarters of those 18 to 29 (77%), figures that have remained steady for both groups over the past year. In the next-highest age group, those 50 to 64, about half now prefer to get their news on mobile (54%), up from about four-in-ten (41%) a year ago.",good
mturk_charts/no_data_remaining/multi_col/826.png,"Large increases in mobile news use have also occurred among those with lower household incomes. About eight-in-ten adults with household incomes below $30,000 (79%) get news on mobile, double the portion of those who did so four years ago (37%). Even so, this is still lower than those with higher household incomes: About nine-in-ten of those with household incomes of $30,000 or more now get news on a mobile device.",good
mturk_charts/no_data_remaining/multi_col/827.png,"In 1967, the U.S. Supreme Court ruled in the Loving v. Virginia case that marriage across racial lines was legal throughout the country. Intermarriage has increased steadily since then: One-in-six U.S. newlyweds (17%) were married to a person of a different race or ethnicity in 2015, a more than fivefold increase from 3% in 1967. Among all married people in 2015 (not just those who recently wed), 10% are now intermarried – 11 million in total.",good
mturk_charts/no_data_remaining/multi_col/828.png,"Americans today also are less likely to oppose a close relative marrying someone of a different race or ethnicity. Now, 10% say they would oppose such a marriage in their family, down from 31% in 2000. The biggest decline has occurred among nonblacks: Today, 14% of nonblacks say they would oppose a close relative marrying a black person, down from 63% in 1990.",good
mturk_charts/no_data_remaining/multi_col/829.png,"The most common racial or ethnic pairing among newlywed intermarried couples is one Hispanic and one white spouse (42%). The next most common intermarriage pairings are one white and one Asian spouse (15%). Some 12% of newlywed intermarried couples include one white and one multiracial spouse, and 11% include one white and one black spouse.",good
