img_path,summary,category
mturk_charts/no_data_remaining/multi_col/2162.png,"Pressure on workers: As populations age, working-age people in the developed world may have to support more dependents, while workers in India and several major African nations will likely have to support fewer dependents.",unquestionable
mturk_charts/no_data_remaining/multi_col/2163.png,"Population 2050: The global population is expected to increase by 38%, from 6.9 billion in 2010 to 9.6 billion in 2050. The population of children younger than 15 is projected to increase by only 10%, a consequence of falling birth rates.",complex
mturk_charts/no_data_remaining/multi_col/2164.png,"How big will the U.S. be? The U.S. population is projected to grow by 89 million residents from 2010 to 2050. The U.S. is likely to grow faster than European and East Asian countries, but slower than Nigeria, which is expected to replace the U.S. as the world’s third most populous country.",unquestionable
mturk_charts/no_data_remaining/multi_col/2165.png,"Since the 1992 Winter Olympics in Albertville, France, the Pew Research Center has covered five summer and three winter games as part of its regular news interest surveys, in which we ask whether people are following various news events and, if so, how closely. Overall, the level of Olympics interest varies within a clear range: More than half but less than two-thirds say they’ve followed that year’s Games “very” or “fairly” closely, with the average interest level slightly higher for Summer Games. (For this exercise, we considered only surveys conducted during or shortly after the Games; when more than one survey was conducted we took the highest interest level.) The two exceptions were the 1996 (Atlanta) and 2004 (Athens) Summer Olympics. In 1996, the bombing at Atlanta’s Centennial Olympic Park occurred during our initial survey period; perhaps not surprisingly, 75% of people said they were following the Games closely — including 45% who said they were following them “very” closely, the highest interest level for any Olympics. In a follow-up survey in early September, a month after the Games concluded, interest had fallen back to 66%. During the Athens Games, the public was evenly split between those who said they were following the Olympics very or fairly closely (50%) and those who said they were following them not too or not at all closely (50%).",good
mturk_charts/no_data_remaining/multi_col/2166.png,"The eyes of the world will be turned toward Russia in the coming weeks as the XXII Winter Olympics begin in Sochi. While the attention has not always been flattering, and there are continued worries about potential terrorist attacks, many in Russia hope that the Olympics will showcase their country’s prosperity. But when it comes to global public opinion toward Russia, much of the world has unfavorable or mixed views, according to our spring 2013 Global Attitudes survey. People in only nine of 38 countries surveyed say they have a positive view of Russia — and among those, in only two of them do half or more of the population have a favorable opinion. Coincidentally, the most positive views of Russia hail from the birthplace of both the ancient and modern Olympic games, Greece (63% favorable). Russia also gets moderately positive views from close neighbors South Korea (53%) and China (49%). In 12 of the 38 countries, views of Russia are mixed. In Canada, one of the strongest perennial contenders for Winter Olympic gold and the most recent host of the games, 42% have a favorable view of Russia and 39% have an unfavorable opinion. In the U.S., another strong medal competitor, only 37% see Russia in a favorable light while 43% express a negative opinion. In the remaining 17 countries, opinions toward Russia are decidedly negative, especially in Europe and the Middle East. In Europe, negative views are shared by 64% of the French, 60% of Germans, 56% of Italians, 54% of Poles, and 51% among Czechs and the Spanish. Among Middle Eastern publics, opinions are even worse, with seven-in-ten or more in Israel (77%) and Jordan (70%) holding a negative opinion of Russia.",complex
mturk_charts/no_data_remaining/multi_col/2167.png,"In November 2011, a majority (56%) said that the U.S. had mostly achieved its goals in Iraq, but last March opinion was evenly split (46% mostly succeeded, 43% mostly failed). Today, just 37% believe the U.S. has mostly succeeded in achieving its goals in Iraq, a 19-point decline since 2011.",complex
mturk_charts/no_data_remaining/multi_col/2168.png,"While skeptical about U.S. achievements in Afghanistan, the public narrowly supports the original decision to use military force in Afghanistan. By contrast, more people view the decision to use force in Iraq as wrong than right. Currently, 51% say it was the right decision to use military force in Afghanistan, while slightly fewer (41%) say it was the wrong decision. That is among the lowest levels of support for the original decision to use force in Afghanistan since the Pew Research Center began asking the question eight years ago. In January 2006, fully 69% endorsed the decision to take military action in Afghanistan. In recent years, opinion about the original decision to go to war had been evenly divided, but in the current survey it has once again turned negative: 50% say it was wrong to use force in Iraq, while 38% support the decision to go to war.",complex
mturk_charts/no_data_remaining/multi_col/2169.png,"Among the uninsured, 47% express an unfavorable view of the law compared with 24% who regard it positively. That represents a negative shift since December when views were more divided, with 43% seeing the law unfavorably and 36% seeing it favorably.",good
mturk_charts/no_data_remaining/multi_col/2170.png,"But a new Pew Research Center/USA TODAY survey suggests that, at least for the moment, the issue of how best to deal with poverty and income inequality – and whether the government should address these issues at all – divides Republicans and those who lean toward the Republican Party more than it does Democrats and leaners. (See full table with detailed party breakdowns.) To be sure, majorities of 60% or more among Republicans and Democrats across the ideological spectrum agree that inequality is on the rise, and about 90% of liberal and centrist Democrats say the government should do something about it. But while a 61%-majority of moderate and liberal Republicans say the government should do something to reduce the gap between the rich and everyone else, 55% of conservative Republicans don’t want the government to do much or anything at all about inequality. Conservative Republicans are also far more likely than more moderate Republicans to say the government would do more to reduce poverty by lowering taxes on the wealthy and corporations to encourage investment and economic growth (70% vs. 42%); half of moderate and liberal Republicans say raising taxes on the wealthy and corporations to expand programs for the poor is a more effective way to reduce poverty. And while 78% of conservative Republicans believe government aid to the poor does more harm than good by making people too dependent on the government, more among moderate and liberal Republicans say it does more good than harm (52%) than say it has a negative impact (40%).",good
mturk_charts/no_data_remaining/multi_col/2171.png,There were also partisan disagreements over what kind of impact would come from granting legal status to millions of unauthorized immigrants who entered the country illegally. About three-in-four Republicans thought that doing so would encourage more people to come to the U.S. illegally and that it would be a drain on government services; about half of Democrats agreed. A greater share of Republicans also believed that legal status for those who live here illegally would reward such behavior and take jobs from U.S. citizens. But a substantial majority of both parties said that deporting all unauthorized immigrants would be unrealistic and that it would be better for the economy if they became legal workers.,unquestionable
mturk_charts/no_data_remaining/multi_col/2172.png,"When Obama takes the rostrum Tuesday night for his fifth State of the Union, he will be speaking at a time when his current approval rating stands at 43%. Last year was the only time just before a State of the Union that more than half the public gave Obama positive marks for the job he was doing, when 52% approved. Obama was riding the wave of his successful re-election campaign, which put him in a stronger position with the public than he was during much of his first term. He was also helped by the relative poor standing of the Republicans, whose favorable ratings had dropped significantly over the previous months.",good
mturk_charts/no_data_remaining/multi_col/2173.png,"Bucking a long-range trend of declining viewership, the audience for local TV news grew in all three major time slots in 2013. Viewership climbed 6% in the morning (5 to 7 a.m.) and 3% in the early evening (5 to 7 p.m.) newscasts, according to a new Pew Research Center analysis. The audience barely edged up—by .1%—in the late night slot (11 p.m.), a newscast that had suffered the biggest decreases in recent years. The good news comes after a difficult 2012 when late night and early evening audiences each dropped by 7% and the morning audience decreased by 5%. Indeed, viewership for all three slots had declined every year from 2008-2012—with the exception of a small uptick in 2011. Pew Research analyzes Nielsen Media Research audience data for all four major sweeps periods — February, May, July and November — and computes national averages for each time slot. The jump in viewership in the key timeslots was due largely to significant increases in the November sweeps period when morning news was up 12%, early evening grew by 8% and late night increased by 6%. While it is impossible to know whether the 2013 numbers are a harbinger of a new spurt of audience growth, they coincide with a wave of consolidation that has seen bullish media companies—from Gannett to Tribune—buy up large groups of stations. While the 2013 numbers are encouraging, the overall trend in local television news audience has not been positive. Even including 2013, the morning newscasts—the most consistent viewership performer in local news—has lost 3% of its audience since 2007. The decrease from 2007-2013 in early evening news viewership has been more dramatic—12%. And overall, the late night newscasts have lost about one-sixth of their viewers (17%) in that time period.",unquestionable
mturk_charts/no_data_remaining/multi_col/2174.png,"Despite a slowly recovering economy, the proportion of Americans who identify themselves as middle class has dropped sharply in recent years. Today, about as many Americans identify themselves as lower or lower-middle class (40%) as say they are in the middle class (44%), according to a recent Pew Research Center/USA TODAY survey. The nationally representative survey of 1,504 adults conducted Jan. 15-19 found that the share of Americans who identify with the middle class has never been lower, dropping to 44% in the latest survey from 53% in 2008 during the first months of the Great Recession. At the same time, the share of the public who says they are in the lower or lower-middle classes rose by 15 percentage points, from 25% in 2008 to 40% today. As a consequence of these shifts, the difference in the proportion of Americans who say they are middle class and those who say they are in the lower classes has fallen from 28 percentage points in 2008 (53% vs. 25%) to a statistically insignificant 4 points today (44% vs. 40%).",good
mturk_charts/no_data_remaining/multi_col/2175.png,"Yet Obama’s personal favorability is positive on balance, with 51% viewing him favorably and 45% expressing an unfavorable opinion. Michelle Obama’s favorability rating continues to be much higher than the president’s: Fully 68% view Michelle Obama favorably, compared with just 24% who view her unfavorably.",complex
mturk_charts/no_data_remaining/multi_col/2176.png,"E-book reading is growing, but printed books still dominate the reading world. 28% of American adults ages 18 and older read an e-book in the past year, up from 17% in 2011. Still, 69% read a printed book, about the same as last year. Only 4% of readers are “e-book only” readers. The vast majority of e-book readers also read a printed book.",good
mturk_charts/no_data_remaining/multi_col/2177.png,The rise of e-book reading is tied to the steady increase in ownership of tablet computers and e-readers. 50% of adults now own either a tablet computer or an e- reader.,good
mturk_charts/no_data_remaining/multi_col/2178.png,"The U.S. general public is also supportive of allowing unauthorized immigrants to remain in the country legally. A Pew Research Center/USA TODAY survey from last June found that 71% of U.S. adults said there should be a way for undocumented immigrants to stay in the country legally, if they meet certain requirements (a different survey question than that asked of Hispanics and Asian Americans). Support for legalization crosses party lines—majorities of Democrats (80%) and Republicans (61%) said they support this measure. The same survey found that most Americans believe legalization should be tied to improved border security—fully 77% said this. But the public was divided when it came to the timing of this link. Some 43% of U.S. adults said legalization should occur only after the effective control of U.S. borders is achieved, but half (49%) said unauthorized immigrants should be allowed to apply for legal status while border improvements are being made.",good
mturk_charts/no_data_remaining/multi_col/2179.png,"Yet amidst these skeptical views, most Americans continue to believe that opportunity exists for those who make the effort. Six-in-ten (60%) say most people who want to get ahead can make it if they are willing to work hard. Some 38% take the more pessimistic view that hard work and determination are no guarantee of success for most people. While opinions about the nexus between success and hard work have changed little since 2011, a decade ago just 28% were of the view that hard work and determination were no guarantee of success.",good
mturk_charts/no_data_remaining/multi_col/2180.png,"There is a broad consensus that the government should do “a lot” or “some” to reduce poverty – 82% of Americans express this view, with 53% saying the government should to a lot in this area. Most also believe the government should be addressing the gap between the rich and everyone else, but there is substantially less agreement in this area. While 69% say the government should do something, fewer than half (43%) say it should be doing a lot and roughly a quarter (26%) say the government should take some action. Majorities of Americans believe the government can do at least something to reduce poverty and the gap between the rich and everyone else. But fewer believe the government can do a lot to lessen poverty (40%) than say it should take a lot of action to achieve this goal (53%).",good
mturk_charts/no_data_remaining/multi_col/2181.png,"Young adults are significantly more supportive than their elders of Edward Snowden and his leaks of classified details of the National Security Agency’s telephone and internet surveillance programs, a new Pew Research Center/USA TODAY survey finds. 57% of 18- to 29-year olds said the leaks have served rather than harmed the public interest — almost exact mirrors of the 65-and-over age group. These youngest adults were the only age group without majority support for prosecuting Snowden — they split 42%-42% on whether the former NSA contractor should be tried. (Snowden was charged in June 2013 with three criminal counts related to the leaks, though he’s apparently not yet been formally indicted.)",good
mturk_charts/no_data_remaining/multi_col/2182.png,"More generally, strong majorities of all age groups agree that “Americans shouldn’t have to give up privacy and freedom in order to be safe from terrorism.” But people younger than 50 were significantly more supportive of that position than 50-and-overs were.",unquestionable
mturk_charts/no_data_remaining/multi_col/2183.png,"Today, 40% approve of the government’s collection of telephone and internet data as part of anti-terrorism efforts, while 53% disapprove. In July, more Americans approved (50%) than disapproved (44%) of the program.",good
mturk_charts/no_data_remaining/multi_col/2184.png,"Barack Obama’s job approval rating has shown little change from last month. In the current survey, 49% disapprove of how he is handling his job and 43% approve. Obama’s ratings had steadily declined from May to November of last year, before he regained some ground in December.",good
mturk_charts/no_data_remaining/multi_col/2185.png,"The proportion of Americans who read e-books is growing, but few have completely replaced print books for electronic versions. The percentage of adults who read an e-book in the past year has risen to 28%, up from 23% at the end of 2012. At the same time, about seven in ten Americans reported reading a book in print, up four percentage points after a slight dip in 2012, and 14% of adults listened to an audiobook. Overall, 76% of adults read a book in some format over the previous 12 months. The typical American adult read or listened to 5 books in the past year, and the average for all adults was 12 books.1 Neither the mean nor median number of books read has changed significantly over the past few years.",good
mturk_charts/no_data_remaining/multi_col/2186.png,"The January 2014 survey, conducted just after the 2013 holiday gift-giving season, produced evidence that e-book reading devices are spreading through the population. Some 42% of adults now own tablet computers, up from 34% in September. And the number of adults who own an e-book reading device like a Kindle or Nook reader jumped from 24% in September to 32% after the holidays. Overall, 50% of Americans now have a dedicated handheld device–either a tablet computer like an iPad, or an e-reader such as a Kindle or Nook–for reading e-content. That figure has grown from 43% of adults who had either of those devices in September.",good
mturk_charts/no_data_remaining/multi_col/2187.png,"E-book readers who own tablets or e-readers are very likely to read e-books on those devices—but those who own computers or cellphones sometimes turn to those platforms, too. And as tablet and e-reader ownership levels have risen over the past few years, these devices have become more prominent in the e-reading landscape:",unquestionable
mturk_charts/no_data_remaining/multi_col/2188.png,"College enrollment among low-income students has generally increased over the past several decades, according to data from the 2013 Digest of Educational Statistics (an arm of the federal Education Department). But the Great Recession and weak recovery have eroded the gains of recent years, and middle- and upper-income students remain far more likely to go to college. In 2012, the most recent year for which NCES figures are available, 50.9% of recent low-income high school completers (a category that includes both graduates and people who completed an equivalency degree and who are ages 16 to 24) were enrolled in a 2- or 4-year college. That’s down from the record-high 58.4% in 2007, and just half a percentage point higher than the rate in 1993. But enrollment rates among middle- and high-income students also have risen, to 64.7% and 80.7%, respectively, in 2012. (NCES defines “low income” as the bottom 20% of all family incomes, “high income” as the top 20%, and “middle income” as the 60% in between.) Looking at it another way, low-income students now are enrolled at about the same rate as middle-income students were in the mid-1980s.",good
mturk_charts/no_data_remaining/multi_col/2189.png,"The 2012 data on college entry by race and ethnicity show a striking convergence: After decades of marked disparities in enrollment, about two-thirds of white, black and Hispanic high school completers all were enrolled in college. (Enrollment among Asians continued to far outpace other groups.) But significant differences remain in completing high school: As of the 2009-10 academic year, the average freshman graduation rate in U.S. public high schools was 93.5% for Asian/Pacific Islanders, 83% for whites, 71.4% for Hispanics and 66.1% for blacks.",complex
mturk_charts/no_data_remaining/multi_col/2190.png,"According to the most recent report from the CDC’s National Center for Health Statistics, four-in-ten U.S. adults owned only a cellphone in 2013. Hispanics, African Americans, younger adults and the poor are more likely to use only a cell phone. By increasing the number of cellphone-only respondents, we can also ensure that we’re more accurately representing these groups.",complex
mturk_charts/no_data_remaining/multi_col/2191.png,"Participation at a high school level has soared in recent years, as well. More than 370,000 girls and 410,000 boys play on sports teams governed by the National Federation of State High School Associations. It is now the fourth-most popular sport for high school girls and fifth-most popular one for boys.",good
mturk_charts/no_data_remaining/multi_col/2192.png,"Fox still leads in audience, but that audience is smaller than it used to be. In 2013, Fox’s prime-time viewership declined 6% from the previous year, according to median monthly viewership data provided by Nielsen Media Research. But with 1.7 million viewers each evening, the channel still drew a bigger audience than CNN, MSNBC and HLN combined. Fox surpassed then-leader CNN in prime-time viewership in 2002, and has never looked back. However, there is some evidence of a ceiling for audience growth. Fox has not increased its median evening viewership since 2009.",good
mturk_charts/no_data_remaining/multi_col/2193.png,"A Pew Research analysis of more than a quarter million tweets found that 43% of the Twitter conversation about the potential 2016 presidential hopeful was critical of him or his administration while 14% defended Christie or criticized his opponents. The analysis covered the period between 9 a.m. Jan. 8 and 7 p.m. on Jan. 9, the day of Christie’s press conference.",good
mturk_charts/no_data_remaining/multi_col/2194.png,"Young people are among the least likely to regularly watch network news: 11% of those 18-29 in 2012, compared with 46% of this age group in 1993. About half (49%) of 18-29 year olds say they never watch. Older Americans, those 65 and up, are still far more likely to regularly watch network news than younger people, yet their regular viewership has dropped by almost half since 1993, from 75% down to 40% in 2012. According to Nielsen Media Research, the share of the public from the media’s highly coveted 25-54 year old demographic that watched NBC, ABC or CBS network news accounted for only 26% of all viewers in the 2012-13 ratings season. The vast majority of viewers were older Americans; a trend that is expected to continue.",good
mturk_charts/no_data_remaining/multi_col/2195.png,"Every two years, the Bureau of Labor Statistics makes a projection of what the nation’s workforce will look like 10 years into the future. Its latest projection, released last month, foresees an America in which more people work longer into their older years. By 2022, the agency projects that 31.9% of those ages 65 to 74 will still be working. That compares with 20.4% of the same age bracket in the workforce in 2002 and 26.8% who were in the workforce in 2012. The agency’s data finds the dividing line is age 55: labor force participation is expected to fall for those under that age who are considered the prime workforce group, and to rise for those above that age. There is less of an increase projected for 55-to-64 year olds. In 2002, 61.9% of Americans in this age group were in the workforce, a number that increased to 64.5% in 2012. The 2022 projection is that 67.5% will remain in the workforce.",good
mturk_charts/no_data_remaining/multi_col/2196.png,"By one measure, U.S. income inequality is the highest it’s been since 1928. In 1982, the highest-earning 1% of families received 10.8% of all pretax income, while the bottom 90% received 64.7%, according to research by UC-Berkeley professor Emmanuel Saez. Three decades later, according to Saez’ preliminary estimates for 2012, the top 1% received 22.5% of pretax income, while the bottom 90%’s share had fallen to 49.6%.",complex
mturk_charts/no_data_remaining/multi_col/2197.png,"The black-white income gap in the U.S. has persisted. The difference in median household incomes between whites and blacks has grown from about $19,000 in 1967 to roughly $27,000 in 2011 (as measured in 2012 dollars). Median black household income was 59% of median white household income in 2011, up modestly from 55% in 1967; as recently as 2007, black income was 63% of white income.",complex
mturk_charts/no_data_remaining/multi_col/2198.png,"As 2014 begins and the midterm election campaigns heat up, about half of the public (51%) is especially looking forward to November’s congressional elections while 49% are not looking forward to them. The new national survey by the Pew Research Center, conducted Jan. 2-5 among 1,005 adults, finds that 58% are looking forward to next month’s Winter Olympics in Sochi, Russia, while 42% are not. A majority (55%) also is looking forward to next month’s Super Bowl. Among other upcoming events, just 24% say they are looking forward to the Academy Awards while a comparable percentage (22%) is anticipating this summer’s World Cup soccer tournament.",good
