img_path,"summary",question_resolution,"question",answer_resolution,"abstractive_answer","extractive_answer","decontextualizated_text_added","decontextualizated_text_removed","extra_added_text"
mturk_charts/no_data/multi_col/5053.png,"Between Feb. 24 , 2016 – when Facebook first gave its users the option of clicking on the “ angry ” reaction , as well as the emotional reactions “ love , ” “ sad , ” “ haha ” and “ wow ” – and Election Day , the congressional Facebook audience used the “ angry ” button in response to lawmakers ’ posts a total of 3.6 million times . But during the same amount of time following the election , that number increased more than threefold , to nearly 14 million . The trend toward using the “ angry ” reaction continued during the last three months of 2017 . Use of the “ love ” reaction also increased after Election Day , but at a slower rate . Users reacted to congressional posts with the “ love ” button 7 million times in the period before the election , a figure that rose to about 12 million in the period afterward . While “ love ” was the most popular new reaction before the election , “ angry ” became the most popular afterward .",same,"When did the use of ''love'' reaction escalated on Facebook?",same,"Use of the “ love ” reaction also increased after Election Day , but at a slower rate . Users reacted to congressional posts with the “ love ” button 7 million times in the period before the election , a figure that rose to about 12 million in the period afterward","Use of the “ love ” reaction also increased after Election Day , but at a slower rate . Users reacted to congressional posts with the “ love ” button 7 million times in the period before the election , a figure that rose to about 12 million in the period afterward","","",""
mturk_charts/no_data/multi_col/5055.png,"When it comes to the content of congressional Facebook posts , those that were more confrontational were more likely to inspire “ angry ” reactions . Confrontational posts are defined as those that expressed opposition toward a number of politicians and political groups , including Trump , Barack Obama , Hillary Clinton , Democrats and Republicans . Overall , 69,318 posts – 15 % of all posts created between Feb. 24 , 2016 , and Dec. 31 , 2017 – expressed opposition . Among posts that expressed this kind of confrontational rhetoric , 13 % of the reactions to the average post received “ angry ” feedback . By comparison , just 3 % of reactions for posts that did not express political opposition were angry . However , when it comes to the “ love ” reaction , there was no meaningful difference in the rates at which the congressional Facebook audience responded to confrontational posts ( about 4 % both for posts expressing opposition and for those not expressing opposition ) .",same,"What inspired the angry reactions on Facebook regarding congressional Facebook posts?",new_answer,"When it comes to the content of congressional Facebook posts , those posts that expressed opposition toward a number of politicians and political groups were more likely to inspire “ angry ” reactions .","When it comes to the content of congressional Facebook posts , those that were more confrontational were more likely to inspire “ angry ” reactions . Confrontational posts are defined as those that expressed opposition toward a number of politicians and political groups","","","When it comes to the content of congressional Facebook posts , those posts that expressed opposition toward a number of politicians and political groups were more likely to inspire “ angry ” reactions ."
mturk_charts/no_data/multi_col/5059.png,"A week after Donald Trump nominated Brett Kavanaugh to fill Justice Anthony Kennedy ’s seat on the U.S. Supreme Court , the public is split in its early views of the nomination . Overall , 41 % think the Senate should confirm Kavanaugh to the Supreme Court , while about as many ( 36 % ) say they should not ; 23 % do not offer a view on the question .",same,"What are the opinions on Brett Kavanaugh being confirmed to the Supreme court?",same,"Overall , 41 % think the Senate should confirm Kavanaugh to the Supreme Court , while about as many ( 36 % ) say they should not ; 23 % do not offer a view on the question","Overall , 41 % think the Senate should confirm Kavanaugh to the Supreme Court , while about as many ( 36 % ) say they should not ; 23 % do not offer a view on the question","","",""
mturk_charts/no_data/multi_col/5060.png,"But among Democrats and Democratic leaners , 53 % say they worry Kavanaugh would make the Supreme Court too conservative , while far fewer say they do n’t worry about this ( 28 % ) . Among Republicans , a 63 % majority say they do n’t worry about Kavanaugh shifting the court ’s ideology ; small shares worry that he would make the court too conservative ( 12 % ) or not conservative enough ( 17 % ) .",same,"Describe partisans point of view about Kavanaugh.",answer1,"But among Democrats and Democratic leaners , 53 % say they worry Kavanaugh would make the Supreme Court too conservative , while far fewer say they do n’t worry about this ( 28 % ) . Among Republicans , a 63 % majority say they do n’t worry about Kavanaugh shifting the court ’s ideology ; small shares worry that he would make the court too conservative ( 12 % ) or not conservative enough ( 17 % ) .","But among Democrats and Democratic leaners , 53 % say they worry Kavanaugh would make the Supreme Court too conservative , while far fewer say they do n’t worry about this ( 28 % ) . Among Republicans , a 63 % majority say they do n’t worry about Kavanaugh shifting the court ’s ideology ; small shares worry that he would make the court too conservative ( 12 % ) or not conservative enough ( 17 % ) .","","",""
mturk_charts/no_data/multi_col/5062.png,"Nearly four - in - ten Americans ( 39 % ) say that if Kavanaugh is confirmed by the Senate to sit on the Supreme Court he would overturn the court ’s Roe v. Wade decision guaranteeing the right to abortion . Fewer ( 29 % ) say Kavanaugh would not vote to overturn Roe , while 32 % do not express an opinion or say it would not matter . In contrast , Republicans are divided : 39 % say Kavanaugh would not vote to overturn Roe , while 27 % say he would do this ; 34 % offer no response . There are no significant ideological differences among Republicans in these views .",same,"What Americans think about Kavanaugh and the decision about right to abortion?",answer2,"Nearly four - in - ten Americans ( 39 % ) say that if Kavanaugh is confirmed by the Senate to sit on the Supreme Court he would overturn the court ’s Roe v. Wade decision guaranteeing the right to abortion . Fewer ( 29 % ) say Kavanaugh would not vote to overturn Roe , while 32 % do not express an opinion or say it would not matter .","Nearly four - in - ten Americans ( 39 % ) say that if Kavanaugh is confirmed by the Senate to sit on the Supreme Court he would overturn the court ’s Roe v. Wade decision guaranteeing the right to abortion . Fewer ( 29 % ) say Kavanaugh would not vote to overturn Roe , while 32 % do not express an opinion or say it would not matter .","","",""
mturk_charts/no_data/multi_col/5065.png,"The overall partisan gap between Republicans and Democrats in views of Kavanaugh ’s nomination is as large as it has been for any nominee in recent years . Republicans and Republican leaners ( 73 % ) are 57 - percentage points more likely than Democrats and Democratic leaners ( 16 % ) to say they think the Senate should confirm Kavanaugh to the Supreme Court . This is about the same as the partisan gap in views of Neil Gorsuch in February 2017 ( 55 points ) , but larger than for previous appointments made by George W. Bush and Obama . For example , in June 2009 there was a 36 - point gap between the shares of Republicans ( 30 % ) and Democrats ( 66 % ) who supported the confirmation of Obama ’s nominee Sonya Sotomayor to the Supreme Court . And in September 2005 , the partisan gap in views of Bush ’s nominee John Roberts was about half of what it is today for Kavanaugh ( 30 points vs. 57 points ) .",same,"Describe the opinions in 2009 about the nominee of Sonya Sotomayor.",answer1,"in June 2009 there was a 36 - point gap between the shares of Republicans ( 30 % ) and Democrats ( 66 % ) who supported the confirmation of Obama ’s nominee Sonya Sotomayor to the Supreme Court","in June 2009 there was a 36 - point gap between the shares of Republicans ( 30 % ) and Democrats ( 66 % ) who supported the confirmation of Obama ’s nominee Sonya Sotomayor to the Supreme Court","","For example ,",""
mturk_charts/no_data/multi_col/5067.png,"Four decades after the birth of Louise Brown , the first “ test - tube baby ” conceived via in vitro fertilization ( IVF ) , 33 % of American adults report that they or someone they know has used some type of fertility treatment in order to try to have a baby , according to a new Pew Research Center survey . The share of people who say they have undergone a fertility treatment or know someone who has varies markedly by education and income . About four - in - ten ( 43 % ) of those with a bachelor ’s degree have had some exposure to fertility treatment – either through their own experience or that of someone they know – and the share rises to 56 % among those with a postgraduate degree . About half ( 48 % ) of people with family incomes of $ 75,000 or more also have been exposed to fertility treatment . ( The survey did not specify what type of treatment . ) Whites are more likely than blacks or Hispanics to report that they have undergone a fertility treatment or know someone who has ( 37 % vs. 22 % and 26 % , respectively ) , and women are more likely than men to say the same ( 36 % vs. 30 % ) .",same,"Describe the trend population of college educated adults have had some exposure to fertility treatment or someone they know?",answer1,"About four - in - ten ( 43 % ) of those with a bachelor ’s degree have had some exposure to fertility treatment – either through their own experience or that of someone they know – and the share rises to 56 % among those with a postgraduate degree .","About four - in - ten ( 43 % ) of those with a bachelor ’s degree have had some exposure to fertility treatment – either through their own experience or that of someone they know – and the share rises to 56 % among those with a postgraduate degree .",".","",""
mturk_charts/no_data/multi_col/5071.png,"As of July 12 , Trump has successfully appointed 43 judges , including one Supreme Court justice ( Neil Gorsuch ) , 22 appeals court judges and 20 district judges . Dozens of other court nominees are awaiting votes in the Senate , including two more appeals court judges who could be confirmed this week . While a few of Trump ’s predecessors going back to Jimmy Carter had also appointed a Supreme Court justice by July 12 of their second year in office , none had appointed close to as many appeals court members – the powerful judges who sit just below the Supreme Court level . ( Kavanaugh is currently a federal appeals court judge , just as eight of the nine current Supreme Court members were before they became justices . ) Obama and Bush had each appointed nine appeals court judges at this point in their presidencies , while Bill Clinton had appointed 11 . George H.W. Bush and Ronald Reagan came closest to matching Trump ’s total with 15 and 14 confirmed appeals court judges , respectively . Carter had appointed 10 .",same,"Describe the number of appeal court judges each president appointed by July 12 during their terms?",answer1,"Obama and Bush had each appointed nine appeals court judges at this point in their presidencies , while Bill Clinton had appointed 11 . George H.W. Bush and Ronald Reagan came closest to matching Trump ’s total with 15 and 14 confirmed appeals court judges , respectively . Carter had appointed 10 .","Obama and Bush had each appointed nine appeals court judges at this point in their presidencies , while Bill Clinton had appointed 11 . George H.W. Bush and Ronald Reagan came closest to matching Trump ’s total with 15 and 14 confirmed appeals court judges , respectively . Carter had appointed 10 .",", while Bill Clinton 11 . George H.W. Ronald Reagan came closest to matching Trump ’s total with 15 14 confirmed , respectively . Carter 10 .","",""
mturk_charts/no_data/multi_col/5072.png,"As of July 12 , the current federal judiciary overall consists of 725 active judges across 94 district courts , 13 appeals courts , the Supreme Court and one additional court , the Court of International Trade . ( This analysis counts only Article III judges who are included in the Federal Judicial Center ’s biographical database , which excludes three district - level courts in U.S. territories . ) Of these judges , 58 % were appointed by Democratic presidents and 42 % were appointed by Republicans , according to the Center ’s analysis . But these shares differ considerably by the level of court in question . Five of the nine current Supreme Court justices ( counting Justice Anthony Kennedy , whose retirement takes effect on July 31 ) were appointed by Republican presidents . The appeals courts are roughly evenly populated with appellate judges appointed by Democratic ( 51 % ) and Republican presidents ( 49 % ) . In district courts , 61 % of active judges were appointed by Democratic presidents and just 39 % were appointed by Republicans .",same,"What is the proportion of judges appointed by Democratic and Republican presidents?",answer1,"Of these judges , 58 % were appointed by Democratic presidents and 42 % were appointed by Republicans , according to the Center ’s analysis","Of these judges , 58 % were appointed by Democratic presidents and 42 % were appointed by Republicans , according to the Center ’s analysis","","",""
mturk_charts/no_data/multi_col/5073.png,"Across all levels of federal courts , 44 % of currently active federal judges were appointed by Obama , 30 % by George W. Bush and 14 % by Bill Clinton . Just 6 % of active judges were appointed by Trump . But that figure is certain to rise as the Senate confirms more of his nominees – and as more judges appointed by earlier presidents retire .",same,"What percentage of federal judges were appointed by Obama, Bush, and Clinton respectively?",same,"Across all levels of federal courts , 44 % of currently active federal judges were appointed by Obama , 30 % by George W. Bush and 14 % by Bill Clinton","Across all levels of federal courts , 44 % of currently active federal judges were appointed by Obama , 30 % by George W. Bush and 14 % by Bill Clinton","","",""
mturk_charts/no_data/multi_col/5088.png,"While populist attitudes span the ideological spectrum , populist political parties are relatively unpopular in Western Europe . Across the surveyed countries , around four - in - ten adults or fewer have a favorable view of the populist party ( or parties ) in their nation . For example , only 34 % of people in Denmark have a favorable view of the Danish People ’s Party ; 23 % of people in the UK view the UK Independence Party favorably ; and 16 % of French adults see the National Front favorably . Traditional parties do much better than populist parties in Denmark , Germany , the Netherlands and Sweden . But they face difficulties elsewhere : For most of the traditional parties the survey asked about , three - in - ten or fewer of respondents in France , Italy and Spain have a favorable view . In all eight surveyed countries , attitudes about both types of parties – traditional and populist – are heavily colored by respondents ’ ideological views .",same,"What is the performance of traditional parties in relation to populist parties in Denmark, German, Sweden, and the Netherlands?",same,"Traditional parties do much better than populist parties in Denmark , Germany , the Netherlands and Sweden","Traditional parties do much better than populist parties in Denmark , Germany , the Netherlands and Sweden","","",""
mturk_charts/no_data/multi_col/5089.png,"Western Europeans are divided over the impact of immigration on their nation ’s culture , security and economy , particularly along ideological lines . For example , a third or more in each country surveyed say immigrants increase the risk of terrorism in their nation , with Germans and Italians the most likely to express this view . Within each country , left - right ideology tends to influence these opinions more than populist views do . People on the right are at least 20 percentage points more likely than those on the left to say immigrants increase the risk of terrorism in their country . Still , in most countries , populist views also matter – the populist groups studied tend to be more negative toward immigrants on the security issue than their mainstream counterparts are .",same,"Describe Germans and Italians views on immigrants increasing terror risk?",same,"For example , a third or more in each country surveyed say immigrants increase the risk of terrorism in their nation , with Germans and Italians the most likely to express this view","For example , a third or more in each country surveyed say immigrants increase the risk of terrorism in their nation , with Germans and Italians the most likely to express this view","","",""
mturk_charts/no_data/multi_col/5097.png,"When asked which president has done the best job in their lifetimes , more Americans name Barack Obama than any other president . More than four - in - ten ( 44 % ) say Obama is the best or second best president of their lifetimes , compared with about a third who mention Bill Clinton ( 33 % ) or Ronald Reagan ( 32 % ) .",same,"What portion of Americans think that Obama did the best job in their lifetime compared to Clinton and Ronal?",answer2,"More than four - in - ten ( 44 % ) say Obama is the best or second best president of their lifetimes , compared with about a third who mention Clinton ( 33 % ) or Reagan ( 32 % ) .","More than four - in - ten ( 44 % ) say Obama is the best or second best president of their lifetimes , compared with about a third who mention Bill Clinton ( 33 % ) or Ronald Reagan ( 32 % ) .","","","More than four - in - ten ( 44 % ) say Obama is the best or second best president of their lifetimes , compared with about a third who mention Clinton ( 33 % ) or Reagan ( 32 % ) ."
mturk_charts/no_data/multi_col/5090.png,"Traditional left - right divisions play a bigger role than populist attitudes when it comes to views of the government ’s role in ensuring a decent standard of living . In general , Western Europeans tend to say it is the government ’s responsibility to ensure a decent standard of living for all : A median of 55 % across the eight countries surveyed hold this view ( though Germany is a notable exception ) . Left - right ideology is central to how people feel about this issue . Most of those on the political left place the responsibility on the government to guarantee that everyone has a decent standard of living , while many on the right say it is up to the individual . There tend to be smaller differences on this question between those with populist views and those with mainstream attitudes .",same,"What does Western Europeans say about the government and decent standard of living?",answer2,"In general , Western Europeans tend to say it is the government ’s responsibility to ensure a decent standard of living for all : A median of 55 % across the eight countries surveyed hold this view ( though Germany is a notable exception ) .","In general , Western Europeans tend to say it is the government ’s responsibility to ensure a decent standard of living for all : A median of 55 % across the eight countries surveyed hold this view ( though Germany is a notable exception ) .","","Left - right ideology central how people feel about issue",""
mturk_charts/no_data/multi_col/5098.png,"Reagan is the top choice among Boomers ( ages 54 to 72 ) and Silents ( ages 73 to 90 ) ; about four - in - ten in the two older generations name Reagan ( 42 % of Boomers , 38 % of Silents ) . But within both generations , there are a range of opinions , with Obama , Kennedy , Clinton and Trump all receiving mentions from 15 % or more Boomers and Silents .",same,"Who is the top choice president among the Boomers and silents?",same,"Reagan is the top choice among Boomers ( ages 54 to 72 ) and Silents ( ages 73 to 90 ) ; about four - in - ten in the two older generations name Reagan ( 42 % of Boomers , 38 % of Silents )","Reagan is the top choice among Boomers ( ages 54 to 72 ) and Silents ( ages 73 to 90 ) ; about four - in - ten in the two older generations name Reagan ( 42 % of Boomers , 38 % of Silents )","","",""
mturk_charts/no_data/multi_col/5099.png,"Currently , 44 % name Obama as their first or second choice for having done the best job of any president of their lifetimes , while 33 % name Clinton , 32 % Reagan and 19 % Trump . In 2011 , 49 % said Clinton had been one of the top two presidents , compared with 34 % who cited Reagan and 20 % who mentioned Obama .",same,"What percentage of Americans think that Obama has done the best job as the president?",answer2,"Currently , 44 % name Obama as their first or second choice for having done the best job of any president of their lifetimes , while 33 % name Clinton , 32 % Reagan and 19 % Trump .","Currently , 44 % name Obama as their first or second choice for having done the best job of any president of their lifetimes , while 33 % name Clinton , 32 % Reagan and 19 % Trump .",".","",""
mturk_charts/no_data/multi_col/5100.png,"A sizable majority of Democrats and Democratic - leaning independents say Barack Obama ( 71 % ) is the best ( 51 % ) or second best ( 20 % ) president in their lifetimes . About half of Democrats name Clinton ( 49 % ) . Another 14 % of Democrats name Kennedy as one of their top two , 12 % name Reagan and 10 % mention George W. Bush . A majority of Republicans and Republican - leaning independents say Reagan ( 57 % ) ranks in the top two presidents in their lifetimes . Another 40 % of Republicans name Trump , while 20 % name George W. Bush , 16 % name George H.W. Bush and 15 % mention Clinton .",same,"Which size of democrats say Obama is the best or second best president in their lifetimes?",new_answer,"A sizable majority of Democrats and Democratic - leaning independents say Barack Obama ( 71 % ) is the best ( 51 % ) or second best ( 20 % ) president in their lifetimes . About half of Democrats name Clinton ( 49 % ) . Another 14 % of Democrats name Kennedy as one of their top two , 12 % name Reagan and 10 % mention George W. Bush .","A sizable majority of Democrats and Democratic - leaning independents say Barack Obama ( 71 % ) is the best ( 51 % ) or second best ( 20 % ) president in their lifetimes . About half of Democrats name Clinton ( 49 % ) . Another 14 % of Democrats name Kennedy as one of their top two , 12 % name Reagan and 10 % mention George W. Bush .","","",""
mturk_charts/no_data/multi_col/5106.png,"In the Senate , lawmakers spend an average 317 calendar days in session during a two - year congressional term , according to the Center ’s analysis .",same,"what is the average calendar days spent in the senate by lawmakers during a two year congressional term?",answer2,"In the Senate , lawmakers spend an average 317 calendar days in session during a two - year congressional term , according to the Center ’s analysis .","In the Senate , lawmakers spend an average 317 calendar days in session during a two - year congressional term , according to the Center ’s analysis .","","",""
mturk_charts/no_data/multi_col/5109.png,"1 NATO is viewed favorably by people in the U.S. and many member countries . About six - in - ten Americans ( 62 % ) had a favorable opinion of NATO in a 2017 Pew Research Center survey of the U.S. and 11 other member countries . U.S. goodwill toward the alliance was significantly higher than in 2016 , when 53 % had a favorable view . Across all 12 NATO member countries included in the 2017 survey , a median of 61 % approved of the alliance , including a majority of respondents in every country except Spain , Greece and Turkey . In the Netherlands and Poland , roughly eight - in - ten ( 79 % ) said they have a positive view of NATO . Favorable views of NATO increased in many of these European countries between 2016 and 2017 .",same,"Describe the alliance approvals among NATO countries ?",answer1,"1 NATO is viewed favorably by people in the U.S. and many member countries Americans ( 62 % ) had a favorable opinion of NATO in a 2017 Pew Research Center survey of the U.S. and 11 other member countries . when 53 % had a favorable view . Across all 12 NATO member countries included in the 2017 survey , a median of 61 % approved of the alliance , including a majority of respondents in every country except Spain . In the Netherlands and Poland , roughly eight - in - ten ( 79 % ) said they have a positive view of NATO .","1 NATO is viewed favorably by people in the U.S. and many member countries Americans ( 62 % ) had a favorable opinion of NATO in a 2017 Pew Research Center survey of the U.S. and 11 other member countries . when 53 % had a favorable view . Across all 12 NATO member countries included in the 2017 survey , a median of 61 % approved of the alliance , including a majority of respondents in every country except Spain . In the Netherlands and Poland , roughly eight - in - ten ( 79 % ) said they have a positive view of NATO .","","",""
