img_path,"summary",question_resolution,"question",answer_resolution,"abstractive_answer","extractive_answer","decontextualizated_text_added","decontextualizated_text_removed","extra_added_text"
mturk_charts/no_data/multi_col/5165.png,"In the midst of an ongoing debate over the power of digital technology companies and the way they do business , sizable shares of Americans believe these companies privilege the views of certain groups over others . Some 43 % of Americans think major technology firms support the views of liberals over conservatives , while 33 % believe these companies support the views of men over women , a new Pew Research Center survey finds . In addition , 72 % of the public thinks it likely that social media platforms actively censor political views that those companies find objectionable . The belief that technology companies are politically biased and/or engaged in suppression of political speech is especially widespread among Republicans . Fully 85 % of Republicans and Republican - leaning independents think it likely that social media sites intentionally censor political viewpoints , with 54 % saying this is very likely . And a majority of Republicans ( 64 % ) think major technology companies as a whole support the views of liberals over conservatives .",same,"What is the opinion of Republicans about social media censor?",answer1,"Fully 85 % of Republicans and Republican - leaning independents think it likely that social media sites intentionally censor political viewpoints , with 54 % saying this is very likely . And a majority of Republicans ( 64 % ) think major technology companies as a whole support the views of liberals over conservatives .","Fully 85 % of Republicans and Republican - leaning independents think it likely that social media sites intentionally censor political viewpoints , with 54 % saying this is very likely . And a majority of Republicans ( 64 % ) think major technology companies as a whole support the views of liberals over conservatives .","","",""
mturk_charts/no_data/multi_col/5166.png,"When asked about the political views that major technology companies support , fewer than half of Americans ( 43 % ) say these companies support the views of liberals and conservatives equally . Instead , a slight majority feels these companies support the views of one side of the partisan spectrum over the other : 43 % of Americans say the companies support the views of liberals over conservatives , while 11 % say they support the views of conservatives over liberals . The view that major technology companies are more supportive of certain political views is particularly widespread among Republicans . Some 64 % of Republicans ( including Republican - leaning independents ) say major technology companies support the views of liberals over conservatives , and just 28 % say these companies support the views of liberals and conservatives equally . By contrast , 28 % of Democrats and Democratic leaners say these companies support liberal views over conservative ones , and 53 % say both groups ’ views are supported equally . Just 16 % of Democrats say the companies support the views of conservatives over liberals .",same,"How do partisans see technology companies towards partisanship?",answer2,"Some 64 % of Republicans ( including Republican - leaning independents ) say major technology companies support the views of liberals over conservatives , and just 28 % say these companies support the views of liberals and conservatives equally . By contrast , 28 % of Democrats and Democratic leaners say these companies support liberal views over conservative ones , and 53 % say both groups ’ views are supported equally . Just 16 % of Democrats say the companies support the views of conservatives over liberals","Some 64 % of Republicans ( including Republican - leaning independents ) say major technology companies support the views of liberals over conservatives , and just 28 % say these companies support the views of liberals and conservatives equally . By contrast , 28 % of Democrats and Democratic leaners say these companies support liberal views over conservative ones , and 53 % say both groups ’ views are supported equally . Just 16 % of Democrats say the companies support the views of conservatives over liberals","","",""
mturk_charts/no_data/multi_col/5167.png,"Roughly three - quarters of Americans ( 74 % ) think the impact of major technology companies on their own lives has been more good than bad , while 24 % say the opposite . When asked about the broader societal impact , a majority of Americans continue to feel positively , but the share saying the good outweighs the bad falls to 63 % . And 36 % of Americans say the impact of these companies on society as a whole has on balance been more bad than good .",same,"What are the feelings among American' college graduates?",answer2,"Roughly three - quarters of Americans ( 74 % ) think the impact of major technology companies on their own lives has been more good than bad , while 24 % say the opposite . When asked about the broader societal impact , a majority of Americans continue to feel positively , but the share saying the good outweighs the bad falls to 63 % .","Roughly three - quarters of Americans ( 74 % ) think the impact of major technology companies on their own lives has been more good than bad , while 24 % say the opposite . When asked about the broader societal impact , a majority of Americans continue to feel positively , but the share saying the good outweighs the bad falls to 63 % .","","",""
mturk_charts/no_data/multi_col/5168.png,"Overall , the public expresses modest levels of trust in major technology companies to do what is right . Only 3 % of Americans think these companies can be trusted to do what is right just about all of the time , notably smaller than the share ( 14 % ) that thinks they can hardly ever be trusted . In total , some 28 % of Americans think these companies can be trusted to do the right thing most of the time or always , while a total of 72 % think they can be trusted to do the right thing some of the time or hardly ever .",same,"How trustworthy are technology companies considered by the public?",answer2,"Only 3 % of Americans think these companies can be trusted to do what is right just about all of the time , notably smaller than the share ( 14 % ) that thinks they can hardly ever be trusted . In total , some 28 % of Americans think these companies can be trusted to do the right thing most of the time or always , while a total of 72 % think they can be trusted to do the right thing some of the time or hardly ever","Only 3 % of Americans think these companies can be trusted to do what is right just about all of the time , notably smaller than the share ( 14 % ) that thinks they can hardly ever be trusted . In total , some 28 % of Americans think these companies can be trusted to do the right thing most of the time or always , while a total of 72 % think they can be trusted to do the right thing some of the time or hardly ever","","",""
mturk_charts/no_data/multi_col/5169.png,"When asked about the appropriate role of government in regulating major technology companies , around half of U.S. adults ( 51 % ) believe these companies should be regulated more than they are now . Around one - in - ten ( 9 % ) feel they should be regulated less than they are now , while 38 % say their current level of regulation is appropriate . Although Republicans are more likely than Democrats to see an anti - conservative bias among major technology companies , this attitude does not translate into a broader desire by Republicans for increased regulation of these companies . Just over half ( 57 % ) of Democrats and Democratic leaners think major technology companies should be regulated more heavily than they are now , but that share falls to 44 % among Republicans and Republican leaners . Indeed , 12 % of Republicans say these companies should be regulated less than they are currently . That view is shared by 7 % of Democrats .",same,"What Americans think about the role of government in regulsting major technology companies?",answer1,"When asked about the appropriate role of government in regulating major technology companies , around half of U.S. adults ( 51 % ) believe these companies should be regulated more than they are now . Around one - in - ten ( 9 % ) feel they should be regulated less than they are now , while 38 % say their current level of regulation is appropriate","When asked about the appropriate role of government in regulating major technology companies , around half of U.S. adults ( 51 % ) believe these companies should be regulated more than they are now . Around one - in - ten ( 9 % ) feel they should be regulated less than they are now , while 38 % say their current level of regulation is appropriate","","",""
mturk_charts/no_data/multi_col/5170.png,"More broadly , the public places technology companies somewhere in the middle of the pack in terms of their overall power in the economy relative to other industries and commercial entities . Asked about the relative clout of eight different groups or entities , just over half the public ( 55 % ) says technology companies have too much power and influence , similar to the share ( 57 % ) that thinks the energy industry has an outsize influence on the economy today . Larger shares of the public feel that pharmaceutical companies , advertisers , or banks and other financial institutions have too much power and influence today , while smaller shares think this is true of labor unions , small businesses or the farming and agriculture industry .",same,"Describe the public opinion about the power of technology companies.",answer1,"Asked about the relative clout of eight different groups or entities , just over half the public ( 55 % ) says technology companies have too much power and influence , similar to the share ( 57 % ) that thinks the energy industry has an outsize influence on the economy today","Asked about the relative clout of eight different groups or entities , just over half the public ( 55 % ) says technology companies have too much power and influence , similar to the share ( 57 % ) that thinks the energy industry has an outsize influence on the economy today","","",""
mturk_charts/no_data/multi_col/5175.png,"Suspected bots are no more likely to link to digital - native news sites than to legacy news organizations . One might expect sites that were “ born on the web ” to be more integrated with social media and online environments relative to legacy news sites , and thus more frequently trafficked by suspected bot accounts . Yet suspected automated accounts are prolific in sharing links not only to sites born on the web but also to legacy news organizations . Suspected bots shared 60 % of tweeted links to legacy sites , about on par with the 59 % of tweeted links to digital native sites .",same,"Describe how suspected bots are acting in legacy sites and digital native sites.",answer1,"Suspected bots shared 60 % of tweeted links to legacy sites , about on par with the 59 % of tweeted links to digital native sites","Suspected bots shared 60 % of tweeted links to legacy sites , about on par with the 59 % of tweeted links to digital native sites","","",""
mturk_charts/no_data/multi_col/5180.png,"Restrictions on religion increased around the world in 2016 , according to Pew Research Center ’s ninth annual study on global restrictions on religion . This is the second year in a row that overall restrictions on religion – whether the result of government actions or by individuals or societal groups – increased in the 198 countries included in the study . More than a quarter ( 28 % ) of countries had “ high ” or “ very high ” levels of government restrictions on religion in 2016 , an increase from 25 % the year before . This is the largest share of countries in these categories since 2013 . Countries in the “ high ” or “ very high ” categories scored at least a 4.5 on the Government Restrictions Index . The index is a 10 - point scale based on 20 indicators of government restrictions on religion , including limits on proselytizing and public preaching , or detentions and assaults of religious group members . Laos , for example , joined the “ very high ” restrictions category in 2016 , due in part to a new government decree that allows the Ministry of Home Affairs to stop any religious activity that it sees as counter to policies , traditional customs or laws within its jurisdiction .",same,"Describe the increase in government restrictions on religion.",answer2,"This is the second year in a row that overall restrictions on religion – whether the result of government actions or by individuals or societal groups – increased in the 198 countries included in the study . More than a quarter ( 28 % ) of countries had “ high ” or “ very high ” levels of government restrictions on religion in 2016 , an increase from 25 % the year before . This is the largest share of countries in these categories since 2013 .","This is the second year in a row that overall restrictions on religion – whether the result of government actions or by individuals or societal groups – increased in the 198 countries included in the study . More than a quarter ( 28 % ) of countries had “ high ” or “ very high ” levels of government restrictions on religion in 2016 , an increase from 25 % the year before . This is the largest share of countries in these categories since 2013 .","","",""
mturk_charts/no_data/multi_col/5181.png,"The share of countries with “ high ” or “ very high ” levels of social hostilities involving religion remained stable at 27 % . Countries in these two categories scored at least a 3.6 on the Social Hostilities Index , a 10 - point scale based on 13 measures of social hostilities involving religion , including tensions between religious groups and religion - related terrorism . Although the share of countries in these categories did not change since last year , it was higher than in 2007 , when this study began tracking social hostilities . In addition , several countries joined these top two categories of social hostilities in 2016 . Bangladesh experienced an increase in assaults and killings of members of religious groups by social groups or individuals – including multiple instances where people who had expressed atheist views or were accused of offending Islam on the internet were killed or threatened .",same,"Describe the problems about religious violence that Bangladesh is experiencing.",same,"Bangladesh experienced an increase in assaults and killings of members of religious groups by social groups or individuals – including multiple instances where people who had expressed atheist views or were accused of offending Islam on the internet were killed or threatened","Bangladesh experienced an increase in assaults and killings of members of religious groups by social groups or individuals – including multiple instances where people who had expressed atheist views or were accused of offending Islam on the internet were killed or threatened","","",""
mturk_charts/no_data/multi_col/5185.png,"By contrast , seven - in - ten Democrats and Democratic leaners are very ( 43 % ) or somewhat ( 27 % ) confident that Mueller ’s investigation will be fair . The share of Democrats who express confidence in Mueller has held mostly stable over four surveys conducted since last December .",same,"Describe Democrats confidence in Mueller's investigation.",answer1,"By contrast , seven - in - ten Democrats and Democratic leaners are very ( 43 % ) or somewhat ( 27 % ) confident that Mueller ’s investigation will be fair .","By contrast , seven - in - ten Democrats and Democratic leaners are very ( 43 % ) or somewhat ( 27 % ) confident that Mueller ’s investigation will be fair .","","",""