img_path,summary,question_resolution,question,answer_resolution,abstractive_answer,extractive_answer,decontextualizated_text_added,decontextualizated_text_removed,extra_added_text
mturk_charts/no_data/multi_col/3428.png,"Independents who lean to one of the two parties are often much closer to partisans in their views than they are to independents who lean to the other party . For example , while 34 % of independents as a whole said they approved of the way Donald Trump was handling his job as president in a March Pew Research Center survey , the gap between independents who lean to the GOP and those who lean to the Democratic Party ( 73 % vs. 9 % ) was nearly as wide as the gap between Republicans and Democrats ( 85 % vs. 8 % ) .",same,Exemplify the similarities of view between independents who lean to on party and affiliates with a party.,answer1,"For example , while 34 % of independents as a whole said they approved of the way Donald Trump was handling his job as president in a March Pew Research Center survey , the gap between independents who lean to the GOP and those who lean to the Democratic Party ( 73 % vs. 9 % ) was nearly as wide as the gap between Republicans and Democrats ( 85 % vs. 8 % )","For example , while 34 % of independents as a whole said they approved of the way Donald Trump was handling his job as president in a March Pew Research Center survey , the gap between independents who lean to the GOP and those who lean to the Democratic Party ( 73 % vs. 9 % ) was nearly as wide as the gap between Republicans and Democrats ( 85 % vs. 8 % )",,,
mturk_charts/no_data/multi_col/3430.png,"Independents – particularly the 7 % of Americans who do n’t lean toward a party – are less politically engaged than partisans . In a survey conducted shortly after the November 2018 midterm election , just a third of those who do n’t lean toward either party ( 33 % ) reported voting . Democratic leaners ( 48 % ) and Republican leaners ( 54 % ) were considerably more likely to say they voted , though both groups reported lower rates of voting than partisans .",same,Describe the willingness to vote of independent Americans who do not lean to a party.,answer1,just a third of those who do n’t lean toward either party ( 33 % ) reported voting,just a third of those who do n’t lean toward either party ( 33 % ) reported voting,,,
mturk_charts/no_data/multi_col/3431.png,"Independents feel more negatively about political candidates and parties than partisans . In early 2018 , similar shares of Republicans ( 77 % ) and Democrats ( 74 % ) said the quality of candidates running for Congress in their district in the last several elections had been good . But those who leaned toward the parties were much less likely to say this .",same,How do independents see the partisans?,answer1,Independents feel more negatively about political candidates and parties than partisans,Independents feel more negatively about political candidates and parties than partisans,,,
mturk_charts/no_data/multi_col/3436.png,"Exposure to false or incorrect information is a key concern for people in 11 emerging economies , according to a recent Pew Research Center survey . Many social media users report being regularly exposed to misinformation when using the platforms . In most countries surveyed , more than a quarter of social media and messaging app users say they frequently encounter this sort of content , and majorities in 10 of the 11 countries say they see it at least occasionally .",same,How likely is fake news spreading to affect the world?,answer1,"Exposure to false or incorrect information is a key concern for people in 11 emerging economies , according to a recent Pew Research Center survey . Many social media users report being regularly exposed to misinformation when using the platforms . In most countries surveyed , more than a quarter of social media and messaging app users say they frequently encounter this sort of content , and majorities in 10 of the 11 countries say they see it at least occasionally","Exposure to false or incorrect information is a key concern for people in 11 emerging economies , according to a recent Pew Research Center survey . Many social media users report being regularly exposed to misinformation when using the platforms . In most countries surveyed , more than a quarter of social media and messaging app users say they frequently encounter this sort of content , and majorities in 10 of the 11 countries say they see it at least occasionally",,,
mturk_charts/no_data/multi_col/3440.png,"When it comes to the benefits , adults in these countries see digital connectivity enhancing people ’s access to political information and facilitating engagement with their domestic politics . Majorities in each country say access to the internet , mobile phones and social media has made people more informed about current events , and majorities in most countries believe social media have increased ordinary people ’s ability to have a meaningful voice in the political process . Additionally , half or more in seven of these 11 countries say technology has made people more accepting of those who have different views than they do . Similarly , the widespread view that technology has made people more informed about current events is often paired with worries that these tools might make people vulnerable : Majorities in 10 of these countries feel technology has made it easier to manipulate people with rumors and false information . Further , a recent report by the Center found that a median of 64 % across these 11 countries say people should be very concerned about exposure to false or incorrect information when using their phones .",same,How skeptical are people towards technology access?,answer2,"Majorities in each country say access to the internet , mobile phones and social media has made people more informed about current events , and majorities in most countries believe social media have increased ordinary people ’s ability to have a meaningful voice in the political process . Additionally , half or more in seven of these 11 countries say technology has made people more accepting of those who have different views than they do","Majorities in each country say access to the internet , mobile phones and social media has made people more informed about current events , and majorities in most countries believe social media have increased ordinary people ’s ability to have a meaningful voice in the political process . Additionally , half or more in seven of these 11 countries say technology has made people more accepting of those who have different views than they do",,,
mturk_charts/no_data/multi_col/3448.png,"Older Americans are also more likely to have had personal contact with a local journalist : A quarter of U.S. adults ages 65 and over have done so , compared with 17 % of those ages 18 to 29 . ( This may not come as a surprise : Since the question asked whether Americans have “ ever ” spoken to a local journalist , older adults have had more time – and a greater chance – to interact with a local reporter . )",same,How's the relationship between U.S adults and local journalists?,answer2,"Older Americans are also more likely to have had personal contact with a local journalist : A quarter of U.S. adults ages 65 and over have done so , compared with 17 % of those ages 18 to 29 . ( This may not come as a surprise : Since the question asked whether Americans have “ ever ” spoken to a local journalist , older adults have had more time – and a greater chance – to interact with a local reporter . )","Older Americans are also more likely to have had personal contact with a local journalist : A quarter of U.S. adults ages 65 and over have done so , compared with 17 % of those ages 18 to 29 . ( This may not come as a surprise : Since the question asked whether Americans have “ ever ” spoken to a local journalist , older adults have had more time – and a greater chance – to interact with a local reporter . )",,,
mturk_charts/no_data/multi_col/3456.png,"Roughly half of Americans ( 51 % ) say it ’s better for a woman who wants to reach high political office to have children before entering politics , according to a 2018 Pew Research Center survey on gender and leadership . About a quarter ( 26 % ) say it would be better to wait until she is well - established in her political career , while 19 % say it would be better for a woman not to have children at all if she plans to seek higher office . Views are different when it comes to leadership positions in the business world . About a quarter of Americans ( 23 % ) say it ’s better for women who want to reach top executive jobs in business to have children early in their careers , 41 % say they should wait and 34 % say it ’s better for them not to have children at all .",same,How are women's roles seen by Americans?,answer1,"Roughly half of Americans ( 51 % ) say it ’s better for a woman who wants to reach high political office to have children before entering politics , according to a 2018 Pew Research Center survey on gender and leadership . About a quarter ( 26 % ) say it would be better to wait until she is well - established in her political career , while 19 % say it would be better for a woman not to have children at all if she plans to seek higher office . Views are different when it comes to leadership positions in the business world . About a quarter of Americans ( 23 % ) say it ’s better for women who want to reach top executive jobs in business to have children early in their careers , 41 % say they should wait and 34 % say it ’s better for them not to have children at all","Roughly half of Americans ( 51 % ) say it ’s better for a woman who wants to reach high political office to have children before entering politics , according to a 2018 Pew Research Center survey on gender and leadership . About a quarter ( 26 % ) say it would be better to wait until she is well - established in her political career , while 19 % say it would be better for a woman not to have children at all if she plans to seek higher office . Views are different when it comes to leadership positions in the business world . About a quarter of Americans ( 23 % ) say it ’s better for women who want to reach top executive jobs in business to have children early in their careers , 41 % say they should wait and 34 % say it ’s better for them not to have children at all",,,
mturk_charts/no_data/multi_col/3457.png,"When thinking specifically about women seeking high political office , men are somewhat more likely than women to say having children early gives women a better chance of succeeding – 56 % vs. 47 % . Still , 24 % of men and 29 % of women say a woman should wait until she ’s well established , politically , before having children . Smaller shares of both groups say women are most successful in politics if they do n’t have children .",same,How do Americans see motherhood toward gender equality?,new_answer,"When thinking specifically about women seeking high political office , men are somewhat more likely than women to say having children early gives women a better chance of succeeding - 56 % vs. 47 % . Still , 24 % of men and 29 % of women say a woman should wait until she 's well established , politically , before having children . Smaller shares of both groups say women are most successful in politics if they do n't have children .","When thinking specifically about women seeking high political office , men are somewhat more likely than women to say having children early gives women a better chance of succeeding - 56 % vs. 47 % . Still , 24 % of men and 29 % of women say a woman should wait until she 's well established , politically , before having children . Smaller shares of both groups say women are most successful in politics if they do n't have children .",,,
mturk_charts/no_data/multi_col/3472.png,"Higher - income Americans are also more likely to have multiple devices that enable them to go online . Roughly two - thirds of adults living in high - earning households ( 64 % ) have home broadband services , a smartphone , a desktop or laptop computer and a tablet , compared with 18 % of those living in lower - income households .",same,"What proportion of adults from high-income families own broadband home services, a smartphone, a desktop or laptop, and a tablet?",answer2,"Roughly two - thirds of adults living in high - earning households ( 64 % ) have home broadband services , a smartphone , a desktop or laptop computer and a tablet , compared with 18 % of those living in lower - income households","Roughly two - thirds of adults living in high - earning households ( 64 % ) have home broadband services , a smartphone , a desktop or laptop computer and a tablet , compared with 18 % of those living in lower - income households",,,
mturk_charts/no_data/multi_col/3473.png,"With fewer options for online access at their disposal , many lower - income Americans are relying more on smartphones . As of early 2019 , 26 % of adults living in households earning less than $ 30,000 a year are “ smartphone - dependent ” internet users – meaning they own a smartphone but do not have broadband internet at home . This represents a substantial increase from 12 % in 2013 . In contrast , only 5 % of those living in households earning $ 100,000 or more fall into this category in 2019 .",same,"In 2019, what proportion of households with incomes less than $30,000 per year were “smartphone dependent” Internet users?",answer1,"26 % of adults living in households earning less than $ 30,000 a year are “ smartphone - dependent ” internet users","26 % of adults living in households earning less than $ 30,000 a year are “ smartphone - dependent ” internet users",,,
mturk_charts/no_data/multi_col/3475.png,"While U.S. Jews have a strong attachment to Israel , they are divided in their assessment of Trump ’s handling of the Israeli - Palestinian issue , according to a new Pew Research Center survey . Roughly four - in - ten ( 42 % ) say they think Trump is favoring the Israelis too much , while a similar share ( 47 % ) say he is striking the right balance between the Israelis and Palestinians . The rest either say he is favoring the Palestinians too much ( 6 % ) or they do n’t know ( 4 % ) . By comparison , Christians in the United States are more likely to say Trump is striking the right balance between the Israelis and Palestinians ( 59 % ) than to say Trump favors the Israelis too much ( 26 % ) . Among evangelical Protestants , 72 % say they think Trump strikes the right balance between the Israelis and Palestinians , and just 15 % say Trump favors the Israelis too much .",same,Describe the proportion of American Jews who say they think Trump is favoring Israelis too much?,new_answer,"U.S. Jews have a strong attachment to Israel , Roughly four - in - ten ( 42 % ) say they think Trump is favoring the Israelis too much","U.S. Jews have a strong attachment to Israel , Roughly four - in - ten ( 42 % ) say they think Trump is favoring the Israelis too much",,,
mturk_charts/no_data/multi_col/3480.png,"Black South Africans hold significantly more favorable views of the ANC compared with other racial groups . Nearly three - quarters of blacks in South Africa say they hold very favorable or somewhat favorable opinions of the country ’s leading party , the ANC – which was once led by the country ’s first democratically elected president , Nelson Mandela , and has historically carried strong support from blacks . By contrast , only 27 % of white and 30 % of coloured South Africans say they view the ANC favorably . ( Note : The term “ coloured ” is commonly used in South Africa to describe people of multiple races . It is used throughout this post to reflect survey question wording . ) The Democratic Alliance ( DA ) , which has established itself as the main opposition party in this year ’s election , garners significantly higher favorability measures among white ( 80 % favorable ) and coloured ( 69 % ) South Africans as of 2018 . Conversely , only about three - in - ten blacks say they have positive opinions of the DA .",same,What is the opinion of ANC among Black South Africans?,answer2,"Nearly three - quarters of blacks in South Africa say they hold very favorable or somewhat favorable opinions of the country ’s leading party , the ANC – which was once led by the country ’s first democratically elected president","Nearly three - quarters of blacks in South Africa say they hold very favorable or somewhat favorable opinions of the country ’s leading party , the ANC – which was once led by the country ’s first democratically elected president",,,
mturk_charts/no_data/multi_col/3482.png,"White and coloured South Africans are more pessimistic about the country ’s economic situation today than in the past . However , answers to this question vary widely by race . Similar shares of coloured and white South Africans say the financial situation has worsened ( 45 % and 46 % , respectively ) , while only 29 % of black South Africans express this sentiment .",same,What is the economic situation of South Africa?,answer1,"Similar shares of coloured and white South Africans say the financial situation has worsened ( 45 % and 46 % , respectively ) , while only 29 % of black South Africans express this sentiment .","Similar shares of coloured and white South Africans say the financial situation has worsened ( 45 % and 46 % , respectively ) , while only 29 % of black South Africans express this sentiment .",,,
mturk_charts/no_data/multi_col/3490.png,"First , many people who use smartphones are unaware that the apps and browsers on their devices involve using the internet . In the Center ’s survey of emerging economies , as many as 38 % of those who say they do not use the internet also indicate that they have a phone that connects to the internet . Due to differences in internet use across these countries , this group represents as much as 14 % of the total adult population in South Africa , or as little as 3 % in Venezuela .",same,Describe the proportion of smartphone owning population who don't use the internet in various countries?,answer2,"as many as 38 % of those who say they do not use the internet also indicate that they have a phone that connects to the internet . Due to differences in internet use across these countries , this group represents as much as 14 % of the total adult population in South Africa , or as little as 3 % in Venezuela","as many as 38 % of those who say they do not use the internet also indicate that they have a phone that connects to the internet . Due to differences in internet use across these countries , this group represents as much as 14 % of the total adult population in South Africa , or as little as 3 % in Venezuela",,In Center ’s survey emerging economies,
mturk_charts/no_data/multi_col/3493.png,"A majority of black adults say they have been discriminated against because of their race , but this varies by education . Roughly eight - in - ten blacks with at least some college experience ( 81 % ) say they ’ve experienced racial discrimination , at least from time to time , including 17 % who say this happens regularly . Among blacks with a high school education or less , these shares are lower – 69 % and 9 % , respectively .",same,Describe views of American Jews on Trump favoring Israelis?,new_answer,"Roughly eight - in - ten blacks with at least some college experience ( 81 % ) say they 've experienced racial discrimination , at least from time to time , including 17 % who say this happens regularly","Roughly eight - in - ten blacks with at least some college experience ( 81 % ) say they 've experienced racial discrimination , at least from time to time , including 17 % who say this happens regularly",,,
mturk_charts/no_data/multi_col/3501.png,"Among Latinos and Asians , the voter turnout rate in 2018 for naturalized citizens was higher than among the U.S. born . The naturalized - citizen turnout rate among Latinos was 44.2 % , higher than the 39.0 % turnout for U.S.-born Latinos . ( Naturalized citizens are immigrants who have become U.S. citizens . Latinos and Asians are the nation ’s two largest immigrant groups . ) This gap between the Latino groups narrowed from 2014 , when turnout was 35.2 % and 24.2 % , respectively . For Asians , naturalized citizens had a turnout rate of 42.7 % compared with 36.7 % for those born in the U.S. Those figures are up from 29.6 % and 22.4 % in 2014 . Among all U.S. eligible voters , by contrast , the 2018 turnout rate of naturalized citizens trailed that of the U.S. born , 45.7 % to 54.2 % , a similar pattern as in recent elections .",same,Compare the voter turnout rates of naturalized Asians with those born in the US?,new_answer,"For Asians , naturalized citizens had a turnout rate of 42.7 % compared with 36.7 % for those born in the U.S.","For Asians , naturalized citizens had a turnout rate of 42.7 % compared with 36.7 % for those born in the U.S.",,,
mturk_charts/no_data/multi_col/3505.png,"Even though most Western Europeans are not very religious , and those who live in countries with a church tax can opt out of paying it , support for the tradition remains strong in the region , according to a new Pew Research Center report , based on a 2017 survey of 15 countries . The study examines public attitudes toward church taxes by comparing the views of Western Europeans who say they pay such taxes with those who have opted out . Six of 15 surveyed Western European countries have a mandatory church tax for members of religious groups . They are Austria , Denmark , Finland , Germany , Sweden and Switzerland . While the rules for administering the tax or fee vary from country to country , each nation generally assesses a portion of the income ( or taxes paid ) of taxpayers who are members of the country ’s larger churches . While most registered Christians – and , in some countries , members of other religious groups – must pay the tax , people have the option of avoiding the tax by deregistering from their church . The money collected usually pays for church expenses , including clergy salaries , maintaining buildings and funding church charities . Sizable majorities of adults in all six countries with a mandatory tax say they pay it . Eight - in - ten Danes and roughly three - quarters of Austrians ( 76 % ) and Swiss ( 74 % ) say they pay the tax . In each country , a small share of adults – ranging from 8 % in Switzerland to 20 % in Finland – say they used to pay the tax but no longer do so .",same,Describe the rate of European citizens who pay mandatory church taxes.,answer1,"Sizable majorities of adults in all six countries with a mandatory tax say they pay it . Eight - in - ten Danes and roughly three - quarters of Austrians ( 76 % ) and Swiss ( 74 % ) say they pay the tax In each country , a small share of adults – ranging from 8 % in Switzerland to 20 % in Finland – say they used to pay the tax but no longer do so .","Sizable majorities of adults in all six countries with a mandatory tax say they pay it . Eight - in - ten Danes and roughly three - quarters of Austrians ( 76 % ) and Swiss ( 74 % ) say they pay the tax In each country , a small share of adults – ranging from 8 % in Switzerland to 20 % in Finland – say they used to pay the tax but no longer do so .",,,
mturk_charts/no_data/multi_col/3524.png,"In some ways , the findings from the new survey mirror results from the head - to - head question about sympathies . Among the public overall , larger shares have favorable opinions of both the Israeli people ( 64 % very or somewhat favorable ) and the Israeli government ( 41 % ) than of the Palestinian people ( 46 % ) and the Palestinian government ( 19 % ) .",same,Describe the Americans opinions about Israeli people and government.,answer1,"Among the public overall , larger shares have favorable opinions of both the Israeli people ( 64 % very or somewhat favorable ) and the Israeli government ( 41 %","Among the public overall , larger shares have favorable opinions of both the Israeli people ( 64 % very or somewhat favorable ) and the Israeli government ( 41 %",,,
mturk_charts/no_data/multi_col/3526.png,"The public also expresses more positive views of the Palestinian people than the government . While nearly half ( 46 % ) view the Palestinian people favorably , just 19 % have a favorable opinion of the Palestinian government .",same,How Americans perceive Palestinian people and government?,new_answer,"While nearly half ( 46 % ) view the Palestinian people favorably , just 19 % have a favorable opinion of the Palestinian government","While nearly half ( 46 % ) view the Palestinian people favorably , just 19 % have a favorable opinion of the Palestinian government",,,
