img_path,summary,question_resolution,question,answer_resolution,abstractive_answer,extractive_answer,decontextualizated_text_added,decontextualizated_text_removed,extra_added_text
mturk_charts/no_data/multi_col/3151.png,"Americans broadly agree that elected officials should avoid using heated language because it could encourage violence . Nearly three - quarters of Americans ( 73 % ) say this , while just a quarter believe that elected officials “ should be able to use heated language to express themselves without worrying about whether some people may act on what they say . ”",same,Describe the proportion of Americans who say elected politicians should avoid language because of its consequences?,answer2,"Nearly three - quarters of Americans ( 73 % ) say this , while just a quarter believe that elected officials “ should be able to use heated language to express themselves without worrying about whether some people may act on what they say","Nearly three - quarters of Americans ( 73 % ) say this , while just a quarter believe that elected officials “ should be able to use heated language to express themselves without worrying about whether some people may act on what they say",,,
mturk_charts/no_data/multi_col/3152.png,"Today , roughly two - thirds of Democratic and Democratic - leaning registered voters ( 65 % ) say they have an excellent ( 23 % ) or good ( 42 % ) impression of the Democratic presidential candidates as a group . By comparison , in September 2015 , only about half of Democratic voters ( 51 % ) said the same .",same,Describe the trend among immigrants who identify with the Democratic Party over the party's presidential candidates?,answer1,"Today , roughly two - thirds of Democratic and Democratic - leaning registered voters ( 65 % ) say they have an excellent ( 23 % ) or good ( 42 % ) impression of the Democratic presidential candidates as a group","Today , roughly two - thirds of Democratic and Democratic - leaning registered voters ( 65 % ) say they have an excellent ( 23 % ) or good ( 42 % ) impression of the Democratic presidential candidates as a group",,,
mturk_charts/no_data/multi_col/3154.png,"Today , about half of voters ( 52 % ) say they have given a lot of thought about the presidential candidates – the highest share at this early point in an election cycle since the question was first asked in the run - up to the 2008 election . Similar majorities of both Republican and Democratic voters say they have given a lot of thought to the 2020 candidates running for president ( 55 % and 52 % , respectively ) . Among registered Democratic and Democratic - leaning voters , the shares who say they have given a lot of thought to the candidates is higher than the shares who said this at similar points in the previous three election cycles . Today , about half of Democratic voters say this ( 52 % ) , compared with smaller shares in 2015 ( 43 % ) , 2011 ( 22 % ) and 2007 ( 37 % ) . Republican voters are about as likely to say they ’ve thought about the 2020 candidates as they were in September 2015 – when there were over 15 candidates running for the GOP presidential nomination .",same,Describe the proportion of American voters who thought hard about the presidential candidates?,answer1,about half of voters ( 52 % ) say they have given a lot of thought about the presidential candidates,about half of voters ( 52 % ) say they have given a lot of thought about the presidential candidates,,,
mturk_charts/no_data/multi_col/3156.png,"Attention to the presidential election at this point in the cycle is also at a historic high in Pew Research Center surveys dating back more than three decades . Today , 63 % of all U.S. adults say they have been following news about candidates for the 2020 presidential election very or fairly closely . This is 9 points higher than in August of 2015 , and 10 or more points higher than similar points for all elections dating back to when this question was first asked in 1987 . In the past , attention to presidential candidates was generally higher in election years when both political parties held primary contests . For example , early interest in news about candidates was higher in 2015 and 2007 than it was in 2011 – when only one party held primaries for the presidential nomination .",same,What proportion of American adults said they followed the news about the candidates for the 2020 presidential election very or very closely?,answer1,63 % of all U.S. adults say they have been following news about candidates for the 2020 presidential election very or fairly closely,63 % of all U.S. adults say they have been following news about candidates for the 2020 presidential election very or fairly closely,,,
mturk_charts/no_data/multi_col/3162.png,Americans see priorities other than a moon or Mars landing as more pressing for NASA . About six - in - ten ( 63 % ) say one of the organization ’s top priorities should be using space to monitor key parts of Earth ’s climate system . About four - in - ten or more said other top priorities should include conducting basic scientific research to increase knowledge of space ( 47 % ) and developing technologies that could be adapted for other uses ( 41 % ) .,same,Describe the majority opinion on what NASA's top priority is?,answer1,About six - in - ten ( 63 % ) say one of the organization ’s top priorities should be using space to monitor key parts of Earth ’s climate system,About six - in - ten ( 63 % ) say one of the organization ’s top priorities should be using space to monitor key parts of Earth ’s climate system,,,
mturk_charts/no_data/multi_col/3163.png,"However , even if space travel does become commonplace , more than half of Americans ( 58 % ) say they would not be interested in going . People who are n’t interested in orbiting the Earth in a spacecraft cite a number of concerns , including thinking it would be too expensive or scary or that their health or age would not allow for safe travel . Among the 42 % who would be interested , the most common reason is that they want to experience something unique .",same,Describe the proportion of Americans who are not interested in going on space travel if it becomes common?,answer1,"even if space travel does become commonplace , more than half of Americans ( 58 % ) say they would not be interested in going","even if space travel does become commonplace , more than half of Americans ( 58 % ) say they would not be interested in going",,,
mturk_charts/no_data/multi_col/3166.png,"Americans have little confidence that private space companies will minimize space debris . Just 13 % of Americans say they have a great deal of confidence that private space companies will minimize the amount of human - made space debris that they put into Earth ’s orbit – including fragments of rockets , satellites and other human - made objects . About half ( 51 % ) of Americans say they have not too much or no confidence at all that private companies will minimize the debris they create .",same,What Americans think about debris on space?,answer1,Just 13 % of Americans say they have a great deal of confidence that private space companies will minimize the amount of human - made space debris that they put into Earth ’s orbit About half ( 51 % ) of Americans say they have not too much or no confidence at all that private companies will minimize the debris they create .,Just 13 % of Americans say they have a great deal of confidence that private space companies will minimize the amount of human - made space debris that they put into Earth ’s orbit About half ( 51 % ) of Americans say they have not too much or no confidence at all that private companies will minimize the debris they create .,,,
mturk_charts/no_data/multi_col/3173.png,"A new Pew Research Center analysis estimates that around one - in - five adult Twitter users in the U.S. ( 19 % ) follow Trump ’s personal account on the platform , @realDonaldTrump . Trump ’s immediate predecessor , Barack Obama ( @BarackObama ) , is followed by 26 % of U.S. adult Twitter users . Bill Clinton is the only other former president with a public Twitter account , followed by 6 % of adult users . ( George W. Bush has a private account and former president Jimmy Carter does not have a personal Twitter account . )",same,Describe the amount of twitter followers of political leaders in US,answer1,around one - in - five adult Twitter users in the U.S. ( 19 % ) follow Trump ’s personal account on the platform Barack Obama is followed by 26 % of U.S. adult Twitter users Bill Clinton is followed by 6 % of adult users,around one - in - five adult Twitter users in the U.S. ( 19 % ) follow Trump ’s personal account on the platform Barack Obama is followed by 26 % of U.S. adult Twitter users Bill Clinton is followed by 6 % of adult users,,,
mturk_charts/no_data/multi_col/3180.png,"Depression has become increasingly common among American teenagers – especially teen girls , who are now almost three times as likely as teen boys to have had recent experiences with depression . In 2017 , 13 % of U.S. teens ages 12 to 17 ( or 3.2 million ) said they had experienced at least one major depressive episode in the past year , up from 8 % ( or 2 million ) in 2007 , according to a Pew Research Center analysis of data from the 2017 National Survey on Drug Use and Health . One - in - five teenage girls – or nearly 2.4 million – had experienced at least one major depressive episode ( the proxy measure of depression used in this analysis ) over the past year in 2017 . By comparison , 7 % of teenage boys ( or 845,000 ) had at least one major depressive episode in the past 12 months .",same,Describe the increase of teen girls experiencing depression in the US.,answer2,One - in - five teenage girls – or nearly 2.4 million – had experienced at least one major depressive episode ( the proxy measure of depression used in this analysis ) over the past year in 2017,One - in - five teenage girls – or nearly 2.4 million – had experienced at least one major depressive episode ( the proxy measure of depression used in this analysis ) over the past year in 2017,,,
mturk_charts/no_data/multi_col/3182.png,"Americans have complicated views about the role social media companies should play in removing offensive content from their platforms . A sizable majority of U.S. adults ( 66 % ) say social media companies have a responsibility to remove offensive content from their platforms , but just 31 % have a great deal or fair amount of confidence in these companies to determine what offensive content should be removed . Overall , about half of Republicans and Republican - leaning independents ( 52 % ) say social media companies have a responsibility to remove offensive content from their platforms . A much larger share of Democrats and Democratic leaners ( 77 % ) say social media companies have this responsibility .",same,Describe the trend in opinions among American adults towards removing offensive content from social media platforms?,new_answer,"A sizable majority of U.S. adults ( 66 % ) say social media companies have a responsibility to remove offensive content from their platforms , but just 31 % have a great deal or fair amount of confidence in these companies to determine what offensive content should be removed .","A sizable majority of U.S. adults ( 66 % ) say social media companies have a responsibility to remove offensive content from their platforms , but just 31 % have a great deal or fair amount of confidence in these companies to determine what offensive content should be removed .",.,,
mturk_charts/no_data/multi_col/3190.png,"Eight of the 10 countries that are expected to gain the most people by 2100 are in Africa : Nigeria ( with the largest gain , 527 million ) , the Democratic Republic of the Congo , Tanzania , Ethiopia , Angola , Niger , Egypt and Sudan . ( This recent animation of the UN data shows African nations ’ long - term rise up the population ranks . ) The two non - African nations on this list are Pakistan and the United States , which are projected to see population gains of 182 million and 103 million people , respectively .",same,In which continent are the most countries that will gain the most people?,answer1,"Eight of the 10 countries that are expected to gain the most people by 2100 are in Africa : Nigeria ( with the largest gain , 527 million ) , the Democratic Republic of the Congo , Tanzania , Ethiopia , Angola , Niger , Egypt and Sudan","Eight of the 10 countries that are expected to gain the most people by 2100 are in Africa : Nigeria ( with the largest gain , 527 million ) , the Democratic Republic of the Congo , Tanzania , Ethiopia , Angola , Niger , Egypt and Sudan",,,
mturk_charts/no_data/multi_col/3191.png,"On a percentage basis , all 10 countries that are projected to experience the biggest growth in population by 2100 are in Africa , led by Niger ( 581 % increase ) , Angola ( 473 % ) and Tanzania ( 378 % ) . The biggest percentage decreases in population are expected in Eastern European nations , led by Albania ( -62 % ) , Serbia ( -52 % ) , and Moldova and Bosnia - Herzegovina ( both -50 % ) .",same,Which countries will experience the biggest population reductions by 2100?,answer1,"The biggest percentage decreases in population are expected in Eastern European nations , led by Albania ( -62 % ) , Serbia ( -52 % ) , and Moldova and Bosnia - Herzegovina ( both -50 % ) .","The biggest percentage decreases in population are expected in Eastern European nations , led by Albania ( -62 % ) , Serbia ( -52 % ) , and Moldova and Bosnia - Herzegovina ( both -50 % ) .",,,
mturk_charts/no_data/multi_col/3193.png,"Among veterans , 64 % say the war in Iraq was not worth fighting considering the costs versus the benefits to the United States , while 33 % say it was . The general public ’s views are nearly identical : 62 % of Americans overall say the Iraq War was n’t worth it and 32 % say it was . Similarly , majorities of both veterans ( 58 % ) and the public ( 59 % ) say the war in Afghanistan was not worth fighting . About four - in - ten or fewer say it was worth fighting .",same,What was the opinion of most veterans on the Iraq war?,answer1,"Among veterans , 64 % say the war in Iraq was not worth fighting considering the costs versus the benefits to the United States","Among veterans , 64 % say the war in Iraq was not worth fighting considering the costs versus the benefits to the United States",,,
mturk_charts/no_data/multi_col/3199.png,"The most common types of fireworks - related injuries this time last year were heat burns ( 38 % ) , followed by bruises and abrasions ( 19 % ) and cuts ( 15 % ) . And despite common stereotypes and decades of parental warnings , fewer than 4 % of fireworks - related injuries involved amputation of a body part .",same,What are the main types of injuries related to fireworks?,answer1,The most common types of fireworks - related injuries this time last year were heat burns followed by bruises and abrasions and cuts,The most common types of fireworks - related injuries this time last year were heat burns followed by bruises and abrasions and cuts,,,
mturk_charts/no_data/multi_col/3205.png,"In a Pew Research Center survey in early 2018 , around three - quarters of Americans ( 74 % ) said voting in elections was very important to what it means to be a good citizen , and around seven - in - ten said the same about paying taxes ( 71 % ) and always following the law ( 69 % ) . But Democrats and Republicans – as well as younger and older adults – did n’t see eye to eye on all the traits and behaviors associated with good citizenship .",same,What proportion of Americans said that voting in elections was very important to what it means to be a good citizen?,answer1,around three - quarters of Americans ( 74 % ) said voting in elections was very important to what it means to be a good citizen,around three - quarters of Americans ( 74 % ) said voting in elections was very important to what it means to be a good citizen,,,
mturk_charts/no_data/multi_col/3208.png,"About two - thirds of Hispanics with darker skin colors ( 64 % ) report they have experienced discrimination or been treated unfairly regularly or from time to time , compared with half of those with a lighter skin tone . These differences in experiences with discrimination hold even after controlling for characteristics such as gender , age , education and whether they were born in the U.S. or abroad .",same,Describe the difference of discrimination experiences between Hispanics with dark and lighter skin.,answer1,"About two - thirds of Hispanics with darker skin colors ( 64 % ) report they have experienced discrimination or been treated unfairly regularly or from time to time , compared with half of those with a lighter skin tone","About two - thirds of Hispanics with darker skin colors ( 64 % ) report they have experienced discrimination or been treated unfairly regularly or from time to time , compared with half of those with a lighter skin tone",,,
mturk_charts/no_data/multi_col/3212.png,"Certain groups of teachers are more likely than others to work a summer job outside the school system , including those with less teaching experience and who are younger – groups that tend to have lower salaries . Male teachers and teachers at the secondary level also are more likely than their female and primary level counterparts to take additional work outside of the classroom , according to a Pew Research Center analysis of NCES data for the 2015 - 16 school year , the most recent year with available data . Roughly one - third ( 32 % ) of teachers with one year or less of teaching experience had a non - school job over the summer break before the school year – a far larger share than that of public school teachers overall . By comparison , 20 % of teachers with two to four years of experience took on summer employment that year , as did 17 % of teachers with five to nine years of experience . Teachers younger than 30 are more likely to hold summer jobs than their older colleagues . About a quarter ( 26 % ) of teachers under 30 worked during the summer of 2015 , compared with 16 % of those ages 30 to 39 , 14 % of those 40 to 49 , and 12 % of those 50 and older .",same,"Compare the rate of teachers who get a summer job, between newer and more experienced workers.",answer1,"Roughly one - third ( 32 % ) of teachers with one year or less of teaching experience had a non - school job over the summer break before the school year – a far larger share than that of public school teachers overall . By comparison , 20 % of teachers with two to four years of experience took on summer employment that year , as did 17 % of teachers with five to nine years of experience .","Roughly one - third ( 32 % ) of teachers with one year or less of teaching experience had a non - school job over the summer break before the school year – a far larger share than that of public school teachers overall . By comparison , 20 % of teachers with two to four years of experience took on summer employment that year , as did 17 % of teachers with five to nine years of experience .",,,
mturk_charts/no_data/multi_col/3215.png,"For those in their first year of teaching who worked a summer job in the months before the 2015 - 16 school year , the money earned during that time of year amounted to a larger portion of their annual income on average ( 12 % ) compared with their peers with more teaching experience . Those who had been teaching for one year or less and worked a second job during the school year brought in a similar proportion of their income from the additional work ( 11 % ) .",same,Describe the summer earnings of less experienced teachers.,answer2,"For those in their first year of teaching who worked a summer job in the months before the 2015 - 16 school year , the money earned during that time of year amounted to a larger portion of their annual income on average ( 12 % ) compared with their peers with more teaching experience . Those who had been teaching for one year or less and worked a second job during the school year brought in a similar proportion of their income from the additional work ( 11 % )","For those in their first year of teaching who worked a summer job in the months before the 2015 - 16 school year , the money earned during that time of year amounted to a larger portion of their annual income on average ( 12 % ) compared with their peers with more teaching experience . Those who had been teaching for one year or less and worked a second job during the school year brought in a similar proportion of their income from the additional work ( 11 % )",,,
mturk_charts/no_data/multi_col/3230.png,"As fact - checking organizations are increasingly being tapped to fight against misinformation , Republicans appear to have serious concerns about the fairness of these groups . Democrats , on the other hand , mostly think they are fair to all sides . Overall , Americans are split in their views of fact - checkers : Half say fact - checking efforts by news outlets and other organizations tend to deal fairly with all sides , while about the same portion ( 48 % ) say they tend to favor one side , according to a Pew Research Center survey conducted Feb. 19 to March 4 , 2019 . But members of the two parties do not see eye - to - eye on this question . Seven - in - ten Republicans say fact - checkers tend to favor one side , compared with roughly three - in - ten Democrats ( 29 % ) – a 41 percentage point difference . Conversely , most Democrats ( 69 % ) say fact - checkers deal fairly with all sides , a view shared by just 28 % of Republicans . Independents are more split , with 47 % saying fact - checkers tend to favor one side and 51 % saying they deal fairly with all sides – though independents who lean toward the Democratic Party and those who lean toward the Republican Party diverge sharply ( 65 % vs. 37 % say fact - checkers deal fairly with all sides , respectively ) .",same,Describe the trend among Americans towards data-checking organizations?,answer1,"Overall , Americans are split in their views of fact - checkers : Half say fact - checking efforts by news outlets and other organizations tend to deal fairly with all sides , while about the same portion ( 48 % ) say they tend to favor one side","Overall , Americans are split in their views of fact - checkers : Half say fact - checking efforts by news outlets and other organizations tend to deal fairly with all sides , while about the same portion ( 48 % ) say they tend to favor one side",,,
mturk_charts/no_data/multi_col/3231.png,"Overall , more Americans perceive fact - checkers as fair than say the same of news organizations more generally – but news organizations , too , elicit sharply divergent views from members of the two parties . Roughly seven - in - ten Americans ( 72 % ) say news organizations tend to favor one side when covering political and social issues – notably higher than the half who say the same about fact - checkers . Republicans are 32 points more likely than Democrats to have this view , though majorities of both parties say this ( 89 % of Republicans vs. 57 % of Democrats ) , and again , independents fall in between ( 72 % ) . The partisan difference on this question is on par with the prior two years it has been asked , and is larger than at any time in the previous three decades except in 2007 , at the end of President George W. Bush ’s second term in office .",same,Describe the proportion of Americans who say that news organizations tend to favor one side when covering political and social issues?,answer1,Roughly seven - in - ten Americans ( 72 % ) say news organizations tend to favor one side when covering political and social issues,Roughly seven - in - ten Americans ( 72 % ) say news organizations tend to favor one side when covering political and social issues,,,
mturk_charts/no_data/multi_col/3232.png,"About three - in - ten Americans ( 29 % ) say they are very confident in their own abilities to check the accuracy of a news story , while about a quarter ( 24 % ) express little to no confidence in their ability . The greatest portion ( 46 % ) are somewhat confident in their own ability .",same,Describe the proportion of Americans who say they are too confident in their own ability to verify the accuracy of a news story?,answer1,About three - in - ten Americans ( 29 % ) say they are very confident in their own abilities to check the accuracy of a news story,About three - in - ten Americans ( 29 % ) say they are very confident in their own abilities to check the accuracy of a news story,,,
