img_path,"summary",category
mturk_charts/no_data/multi_col/6893.png,"Partisan divisions over gun policy proposals may reflect contrasting views among Republicans and Democrats on gun violence in the country today and on the impact of access to guns on crime and mass shootings. Though clear majorities of both Republicans (74%) and Democrats (92%) consider gun violence to be at least a moderately big problem in the U.S., a much greater share of Democrats (65%) than Republicans (32%) say gun violence is a “very big” problem in the country.",good
mturk_charts/no_data/multi_col/6895.png,"Nearly two-thirds of Democrats (64%) say there would be fewer mass shootings in the U.S. if it were harder for people to legally obtain guns; only about a quarter of Republicans (27%) say the same. And Republicans are skeptical that making it harder to legally obtain guns would have an effect on mass shootings: 54% say it would not make a difference, while 18% think restricting access to guns would lead to more mass shootings.",good
mturk_charts/no_data/multi_col/6897.png,"Protection tops the list of reasons for owning a gun. While many gun owners say they have more than one reason for owning a firearm, 67% cite protection as a major reason. About four-in-ten gun owners (38%) say hunting is a major reason, and 30% cite sport shooting. Smaller shares cite a gun collection or their job as major reasons.",good
mturk_charts/no_data/multi_col/6902.png,"A new analysis of Pew Research Center survey data from fall 2016 finds that 53% of Millennials (those ages 18 to 35 at the time) say they used a library or bookmobile in the previous 12 months. That compares with 45% of Gen Xers, 43% of Baby Boomers and 36% of those in the Silent Generation. (It is worth noting that the question wording specifically focused on use of public libraries, not on-campus academic libraries.)",good
mturk_charts/no_data/multi_col/6906.png,"Many Russians see inherent conflict in their relationship with the West, but few rule out cooperation. According to a recently released Pew Research Center report based on 2015 survey data, overwhelming majorities in Russia believe that their country serves as an important counterbalance to the West (85%) and that Russian values clash with Western values (73%).",good
mturk_charts/no_data/multi_col/6909.png,"President Vladimir Putin’s handling of foreign affairs gets high ratings from most Russians, in contrast to more tempered views of his economic policies and anti-corruption efforts at home. Confidence in Putin’s global leadership has been consistently strong over the decade-and-a-half that Pew Research Center has polled in Russia. Trust in the Russian leader has remained high since an increase in 2014, shortly after the conflict with Ukraine and subsequent annexation of Crimea. Despite slippage in how well the public thinks their president is handling key foreign policies, a majority of Russians say their country plays a more important role on the world stage than it did 10 years ago.",good
mturk_charts/no_data/multi_col/6911.png,"Putin’s 2015 decision to intervene in the Syrian conflict was a momentous change in Russia’s foreign policy. Today, the prevailing view among Russians is that their country should stay the course in Syria, keeping Russia’s military involvement at its current level (46%). Among those who would like to see a change in Russia’s stance, roughly three times as many support decreasing the level of Russia’s involvement (34%), as opposed to increasing it (11%). When asked about the purpose of their country’s military actions in Syria, majorities say limiting casualties (72%) and defeating extremist groups (64%) should be priorities, compared with just a quarter who say the same about the Kremlin’s apparent goal of keeping Syrian President Bashar al-Assad in power.",good
mturk_charts/no_data/multi_col/6912.png,"Despite Russians’ lukewarm view of the economy, a majority (55%) still approves of Putin’s handling of the issue. Putin also has the support of more than half the country when it comes to energy policy and civil society. The only area included in the survey in which he fails to earn majority approval is the issue of corruption.",good
mturk_charts/no_data/multi_col/6915.png,"In general, Republicans and Democrats ascribe positive traits to their own party, while holding negative views of the opposing party. For example, about two-thirds of Democrats and Democratic-leaning independents (66%) say their party has high ethical standards, while about the same share of Republicans and Republican leaners (64%) say the same about the GOP. Comparable shares in each party (24% of Democrats, 21% of Republicans) say the opposing party has high ethical standards.",good
mturk_charts/no_data/multi_col/6919.png,"Donald Trump’s job approval continues to remain more negative than positive. Currently, 39% of the public approves of the way Trump is handling his job as president, while 55% disapprove. Ratings of Trump are virtually unchanged from April (39% approved) and February (also 39%).",good
mturk_charts/no_data/multi_col/6923.png,"A similar pattern emerges when it comes to a variety of religious concepts, such as miracles, the existence of the soul, or fate. For most religious beliefs mentioned in the survey, the Czech Republic has among the lowest levels of belief in the region, and typically falls far below the regional median. For example, 19% of Czechs believe in hell, compared with a regional median of 54% – which includes roughly six-in-ten adults in Poland (62%) and Croatia (60%). But that does not mean that the country is entirely devoid of religious or supernatural beliefs. Despite relatively low levels of belief in each concept, a majority of the Czech public (65%) believes in at least one of the nine concepts included in the survey (belief in God plus the eight items in the accompanying chart). Even among religiously unaffiliated Czechs, 52% believe in at least one of the concepts, including about a third (32%) who believe in fate (i.e., that the course of one’s life is largely or wholly preordained). And Czechs overall are much more likely to believe in the existence of the soul and fate than they are to believe in God.",good
mturk_charts/no_data/multi_col/6932.png,"With Brexit looming, Germany’s influence in the EU is likely to grow. While Europeans have an overwhelmingly favorable view of Germany, a plurality (a median of 48%) believes Berlin has too much influence when it comes to decision-making in the EU.",good
mturk_charts/no_data/multi_col/6935.png,"There are demographic differences in who identifies as LGBT. The most notable is by age. Young adults, ages 18 to 36, are by far the most likely to identify as LGBT (7.3%). By contrast, much smaller shares of those ages 37 to 51 (3.2%), 52 to 70 (2.4%) and 71 and older (1.4%) say they are LGBT, according to Gallup. Some 4.4% of women and 3.7% of men identify as LGBT. Whites are somewhat less likely (3.6%) than blacks (4.6%), Hispanics (5.4%) and Asians (4.9%) to say they are LGBT.",good
mturk_charts/no_data/multi_col/6941.png,"Asian and Hispanic newlyweds are the most likely to be intermarried. Nearly three-in-ten Asian newlyweds (29%) were married to someone of a different race or ethnicity in 2015, as were 27% of Hispanic newlyweds. Intermarriage for these groups was especially prevalent among the U.S. born: 39% of U.S.-born Hispanics and almost half (46%) of U.S.-born Asian newlyweds were intermarried in 2015. Although Asian and Hispanic newlyweds are most likely to be intermarried, overall increases in intermarriage have been driven in part by rising intermarriage rates among black and white newlyweds. The most dramatic increase has occurred among black newlyweds, whose intermarriage rate more than tripled from 5% in 1980 to 18% in 2015. Among whites, the rate rose from 4% in 1980 to 11% in 2015.",good
mturk_charts/no_data/multi_col/6943.png,"One-in-seven U.S. infants (14%) are multiracial or multiethnic. This share is nearly triple the share (5%) in 1980. Multiracial or multiethnic infants include children younger than 1 year old who live with two parents and whose parents are each of a different race, those with one Hispanic and one non-Hispanic parent, and those with at least one parent who identifies as multiracial.",good
mturk_charts/no_data/multi_col/6946.png,"By contrast, smaller religious groups may not have been harassed in as many countries simply because they are not present in as many countries. For instance, because of their dense concentration in a small number of countries, 99% of Jews and Hindus lived in nations where members of their groups were harassed. And despite being one of the most geographically dispersed religious groups, 97% of Muslims lived in countries where harassment of Muslims occurred in 2015. (By comparison, 78% of Christians lived in places where Christians were harassed.)",good
mturk_charts/no_data/multi_col/6947.png,"The generation of Central and Eastern Europeans who came of age after the fall of the Berlin Wall and collapse of the Soviet Union differs little in its political outlook from earlier generations weaned on communist ideology and anti-Western propaganda. Today, support for democracy is relatively tepid among both age groups. Majorities in most countries across the region are upbeat about free markets, with similar levels of support among young and old, according to a new Pew Research Center survey of adults in 18 Central and Eastern European countries.",good
mturk_charts/no_data/multi_col/6958.png,"The JOLTS program doesn’t produce state-level data, but it does indicate that the South had the most job openings in April of any region – nearly 2.2 million – though the openings rate there (3.9%) was slightly below that of the nation as a whole. The Midwest had the nation’s highest regional openings rate (4.4%), followed by the Northeast (4.1%); the rate in the West lagged behind at 3.6%. Nationally, workers appear to be in shortest supply in two service sectors: professional/business services and healthcare/social assistance. Both had well over 1 million job openings in April – roughly one-third more than the sector with the third-highest number, accommodation and food services. All three of those sectors had openings rates of 5% or higher, as did the catchall “other services” sector.",good
mturk_charts/no_data/multi_col/6959.png,"One-in-seven U.S. infants (14%) were multiracial or multiethnic in 2015, nearly triple the share in 1980, according to a Pew Research Center analysis of Census Bureau data. This increase comes nearly a half century after the landmark Supreme Court case Loving v. Virginia legalized interracial marriage.",good
mturk_charts/no_data/multi_col/6989.png,"Political observers have suggested that Prime Minister May called early elections in order to increase the number of Conservative Party seats in Parliament, thus strengthening her ability to negotiate with the EU over Brexit terms. Currently the British government receives mixed reviews from average citizens: 49% of Brits say they can trust the national government somewhat or a lot, and 48% say they have little or no confidence in the government to do the right thing for the UK.",good
mturk_charts/no_data/multi_col/6990.png,"Men are somewhat more convinced than women that Brexit will be a good thing. But an even larger generational divide exists, with only one-quarter of Brits ages 18 to 29 convinced Brexit will be good for their country, compared with 54% who say this among people 50 and older.",good
mturk_charts/no_data/multi_col/6991.png,"When it comes to trusting the UK government, people in Britain are evenly divided. Roughly half say that they trust the national government a lot or somewhat, and virtually the same number say they trust the government not much or not at all. Only 14% of the British public trusts the government a lot, while two-in-ten say they do not trust the government at all.",good
mturk_charts/no_data/multi_col/6994.png,"While a dislike of the candidates or issues was the most frequently cited reason for not voting, other top reasons included a lack of interest or a feeling that their vote wouldn’t make a difference (15%), being too busy or having a conflicting schedule (14%), having an illness or disability (12%) and being out of town or away from home (8%). Another 11% gave other reasons.",good
mturk_charts/no_data/multi_col/6998.png,"Even though the Senate first allowed cloture to be sought on nominations in 1949, it wasn’t until the 1968 nomination of Abe Fortas to be chief justice of the Supreme Court that it was actually attempted. The cloture vote failed, and Fortas was not confirmed. Over the next two decades, cloture was sought only 10 times on nominations and was actually invoked eight times, primarily for judicial positions, according to a Congressional Research Service report. But since 1992, according to Pew Research Center tabulations of Senate data, 232 individual nominees have been subject to at least one cloture vote.",good
mturk_charts/no_data/multi_col/7002.png,"Both younger and older veterans gave higher approval ratings for Trump than did younger and older adults overall. Nearly half of veterans ages 18 to 49 (46%) approved of Trump’s job performance, compared with only 31% of all adults younger than 50. Among those 50 and older, nearly six-in-ten veterans (58%) supported Trump, while about half of all older adults (49%) said the same.",good
mturk_charts/no_data/multi_col/7001.png,"Russia and other countries in Central and Eastern Europe have experienced a resurgence of Orthodox Christian identity since the fall of the Soviet Union, according to a new Pew Research Center survey of 18 countries in the region. This increase in religious identity is accompanied in large part by high levels of religious belief, such as belief in God.",unquestionable
mturk_charts/no_data/multi_col/7007.png,"Some 84% of American households contain at least one smartphone, according to a Pew Research Center survey conducted in fall 2016. Desktop and laptop computers are nearly as common – 80% of households contain at least one of these devices. Tablet computer ownership is somewhat less widespread, with 68% of households containing at least one tablet. And 39% of households contain at least one streaming media device, such as an Apple TV, Roku or Google Chromecast.",good
mturk_charts/no_data/multi_col/7012.png,"Even before this week’s terrorist bombing at a pop concert in Manchester, England, people across Europe and in the U.S. and Canada had pervasive concerns about the threat of extremism in their countries. Across 12 countries surveyed from February through April by Pew Research Center, majorities said they were at least somewhat concerned about extremism in the name of Islam in their countries, including 79% who said this in the UK itself. And across the 10 EU countries surveyed, a median of 79% were concerned about Islamic extremism, while only 21% were not concerned. In many of the countries polled this year, much of the public is very concerned about extremism in the name of Islam. This includes 50% in Italy and Spain, 47% in Germany, 46% in France and 43% in the UK. Meanwhile, less than 15% of the population in all these countries is not at all concerned about the threat of extremism in the name of Islam.",good
mturk_charts/no_data/multi_col/7017.png,"For their part, a solid majority of Americans say the U.S. should militarily defend a NATO ally if embroiled in an armed conflict with Russia. Asked about their own country’s obligation under the same scenario, more than half in the Netherlands (72%), Poland (62%), Canada (58%) and France (53%) support living up to their mutual defense commitment as a member of NATO. Just 40% of Germans back such assistance. In most countries surveyed, the more people perceive Russia as a major threat, the greater their willingness to come to a security partner’s defense.",good
mturk_charts/no_data/multi_col/7019.png,"Support for the transatlantic security partnership is similar in Canada, the other North American member of NATO. Nearly two-thirds of Canadians (66%) hold NATO in high esteem. Such support has improved by 10 percentage points since 2015. This rise in support can be seen across demographic groups. Roughly three-quarters of Liberal Party (75%) and Conservative Party (74%) adherents have a positive view of the security alliance, as do about two-thirds of New Democratic Party (65%) loyalists. In Europe, the Poles (79%) and Dutch (79%) express the strongest support for NATO among the alliance members surveyed. In 2015 such sentiment stood at 74% in Poland and 72% in the Netherlands.",good
mturk_charts/no_data/multi_col/7026.png,"Honolulu has by far the highest share of intermarried newlyweds of any metro area analyzed – 42% of newlyweds living in and around that city were married to someone of a different race or ethnicity. The same is true of about three-in-ten newlyweds living near Las Vegas or Santa Barbara, California. (All U.S. metro areas with at least 200 newlyweds in the Census Bureau data – 126 in all – are included in this analysis. Click here to see full tables that can be sorted by metro area and race and ethnicity.)",good
mturk_charts/no_data/multi_col/7031.png,"Yet despite these gains, many seniors remain largely disconnected from the digital revolution. One-third of adults ages 65 and older say they never use the internet, and roughly half (49%) say they do not have home broadband services. Meanwhile, even with their recent gains, the proportion of seniors who say they own smartphones is 42 percentage points lower than those ages 18 to 64. Seniors ages 65 to 69 are about twice as likely as those ages 80 and older to say they ever go online (82% vs. 44%) or have broadband at home (66% vs. 28%), and they are roughly four times as likely to say they own smartphones (59% vs. 17%).",good
mturk_charts/no_data/multi_col/7029.png,"Graduates in STEM fields accounted for at least 70% of OPT approvals from India, Iran, Bangladesh and Sri Lanka from 2012 to 2015. Of the 72,151 from India employed under OPT, 84% had STEM degrees, the highest percentage of any origin country. Iran (79%), Bangladesh (74%) and Sri Lanka (70%) also had high shares of STEM graduates. Among those from China, 54% went to STEM graduates.",good
mturk_charts/no_data/multi_col/7035.png,"Those who consistently stayed with their parties expressed strong views of Trump, both positive and negative. In April 2017, 84% of those who consistently identified with or leaned toward the Republican Party approved of Trump’s job performance – with 66% approving strongly.",good
mturk_charts/no_data/multi_col/7037.png,"There is somewhat more change among political independents than among partisans. However, 78% of those who did not identify as Republicans or Democrats in December 2015 also did not affiliate with either party in March 2017. Among the remaining 22%, nearly equal shares ended up identifying as Democrats (12%) and Republicans (10%). Among nonpartisans who leaned toward a party in December 2015, roughly six-in-ten leaned toward the same party in March of this year. There was more movement during this period among leaners than partisans. For instance, 16% of those who initially leaned Republican eventually called themselves Democrats (either identified or leaned Democratic); a comparable share of those who initially leaned Democratic became Republicans or Republican leaners (14%).",good
mturk_charts/no_data/multi_col/7045.png,"There are also sizable differences in views about this issue by age, with younger adults ages 18 to 29 especially likely (66%) to see government regulations as necessary. Seniors 65 and older, however, think the private marketplace is the most effective way to increase reliance on renewable energy sources by a 50%-41% margin. Differences by age hold even when accounting for the tendency of older adults to identify with the GOP.",good
mturk_charts/no_data/multi_col/7046.png,"Perceptions of both natural gas and nuclear power fall in between. Three-in-ten Americans see natural gas (30%) as very effective at minimizing air pollution, 42% say natural gas is somewhat effective in minimizing air pollution, and 23% say natural gas is not at all or not too effective. Views of nuclear power are mixed, with 28% saying the use of nuclear energy is very effective, 27% saying it is somewhat effective and 35% saying it is not too or not at all effective in minimizing air pollution.",good
mturk_charts/no_data/multi_col/7049.png,"When considering the broader question of whether it is possible to reduce environmental regulations while protecting the environment, there is a strong divide in public opinion. About half (49%) of the public says it is possible to cut back on environmental regulations and still effectively protect air and water quality, while a similar share (47%) says this is not possible. There are large partisan divides on this issue. By a 63%-35% margin, most Republicans and Republican leaners hold that it is possible to cut back on environmental regulations and still effectively protect air and water quality in the U.S.",good
mturk_charts/no_data/multi_col/7059.png,"A substantial share of adults in Central and Eastern Europe hold traditional views of the role of women and the family, according to a recent Pew Research Center survey of 18 nations in the region. This is especially true in the 10 countries surveyed with Orthodox Christian majorities. For instance, majorities of respondents in all 10 of these Orthodox countries agree with the statement, “Women have a responsibility to society to bear children,” including at least three-quarters in Armenia (82%), Romania (81%) and Bulgaria (77%) and about six-in-ten in Russia and Belarus (59% each). Generally, smaller shares in the eight Catholic-majority, religiously mixed or majority-unaffiliated countries surveyed (Bosnia and Hungary are exceptions) take this position.",good
mturk_charts/no_data/multi_col/7064.png,"Asian workers in the U.S. are the most likely to have completed at least a bachelor’s degree. In 2016, about two-thirds (65%) of Asian workers ages 25 to 29 had at least a bachelor’s degree, compared with 47% of white workers in this age group. And although the share of young black and Hispanic workers who are college educated has grown, just 27% of black Millennial workers and 21% of Hispanic Millennial workers held a bachelor’s degree in 2016.",good
mturk_charts/no_data/multi_col/7074.png,"Researchers are, of course, interested in the extent to which nonresponse bias is getting worse over time. Comparing current levels to those measured roughly four years ago, we find that, on average, the accuracy of telephone survey data is at least as high as it was in 2012. On 13 demographic, lifestyle and health questions11that have high response rate benchmark survey data, the average (absolute) difference between the Center telephone estimates and the benchmark survey estimates was 2.7 percentage points in 2016, compared with 2.8 points in 2012. In general, accuracy as measured by these benchmarks was lower among certain demographic groups such as young adults and minorities. But there is no indication that the biases within groups got worse over time. Most major subgroups – defined by age, gender, race or education – saw the accuracy of their estimates from phone surveys either stay level or slightly improve. For example, across the 13 lifestyle, health and demographic questions with high response rate comparisons, the average difference between the Hispanic adult estimate from Pew Research Center phone surveys and the same Hispanic estimate from the benchmark survey was 5.5 percentage points in 2016 as compared with 6.7 in 2012. The average change in accuracy from 2012 to 2016 was similar for non-Hispanic white. For blacks, however, their phone survey estimates differed from benchmark survey estimates by an average of 5.1 percentage points in 2016 versus 4.2 points in 2012.",good
mturk_charts/no_data/multi_col/7094.png,"Americans are closely divided on the issue of whether the marches will increase public support for science: 44% think they will help and 44% think they will make no difference. Another 7% believe they will hurt public support. Most Democrats and Democratic leaners (61%) believe the marches and demonstrations held in April will benefit public support for science. By contrast, just 22% of Republicans and independents who lean to the GOP say the marches will help drive public support for science, while six-in-ten (60%) of this group believes the marches will have no impact on public support and 13% say the marches will hurt public support.",good
mturk_charts/no_data/multi_col/7093.png,"Support for the goals of the science marches is divided by political party. Republicans and Republican leaners oppose the goals of the science marches by a 47%-25% margin; some 29% are undecided about their views. Democrats and Democratic leaners support the goals of the marches by a 68%-14% margin, with 18% undecided.",good
mturk_charts/no_data/multi_col/7098.png,"Here, too, there are differences in views by party and age. Fully 68% of Republicans and Republican-leaning independents think there has been too much media coverage of demonstrations, while 18% think the amount of coverage has been about right and 11% say there has been too little coverage. By contrast, 43% of Democrats and Democratic leaners think there has been the right amount of coverage, 29% think there has been too little and 26% say there has been too much media coverage of demonstrations these days.",good
