img_path,"summary",category
mturk_charts/no_data/multi_col/6763.png,"Overall, global publics tend to express positive views about China. A median of 47% across the 38 nations polled have a favorable opinion of China, while 37% have an unfavorable one. Global ratings for the U.S., which have declined sharply in the first year of the Trump administration, look very similar: A median of 49% see the U.S. in a positive light, while 39% offer an unfavorable view. (For more on global views of the U.S., see “U.S. Image Suffers as Publics Around World Question Trump’s Leadership.”)",good
mturk_charts/no_data/multi_col/6764.png,"A median of 47% across the 38 countries surveyed have a favorable opinion of China, while 37% express an unfavorable view. Majorities or pluralities in 24 countries give China a positive rating.",good
mturk_charts/no_data/multi_col/6768.png,"While China’s global image is largely positive, the same is not true of its leader, President Xi Jinping. A global median of 53% say they have little or no confidence in him to do the right thing in world affairs, compared with 28% who do have confidence in Xi.",good
mturk_charts/no_data/multi_col/6771.png,"Among the 38 countries surveyed, South Korea is the most likely to say that the U.S. is the leading economic power (66%), followed closely by Japan (62%). Roughly half say the U.S. is the world’s economic leader in Israel (52%), Vietnam (51%), Hungary (51%) and the U.S. itself (51%).",good
mturk_charts/no_data/multi_col/6775.png,"Many people in Asia-Pacific countries have negative views of North Korea. Among the countries surveyed, the Japanese are most negative on North Korea: 94% say they have an unfavorable view, including 78% who say they have a very unfavorable opinion. In Australia, the U.S. and South Korea, roughly three-quarters or more say they have unfavorable views. Across the region, only Filipinos have a generally positive view of North Korea, with more than half (53%) holding a favorable view.",good
mturk_charts/no_data/multi_col/6776.png,"Americans and most people in the Asia-Pacific countries surveyed are concerned about North Korea’s nuclear program. Half or more in each country say they are somewhat or very concerned about the nuclear program. In the Asia-Pacific region, anxiety is highest among Pyongyang’s closest neighbors – Japan, the Philippines and South Korea, where around 60% or more say they are very concerned.",good
mturk_charts/no_data/multi_col/6783.png,"In the first months of the Trump administration, the top countries of origin for refugees have been the Democratic Republic of the Congo (3,235), followed by Burma (Myanmar) (2,470), Iraq (1,923), Somalia (1,879), Syria (1,779) and Ukraine (1,603). These six countries have made up two-thirds (67%) of all refugees entering the U.S. since Jan. 21, 2017. Of these, three are majority-Muslim origin countries (Iraq, Somalia and Syria).",good
mturk_charts/no_data/multi_col/6785.png,"Around four-in-ten U.S. adults (41%) have experienced some form of online harassment, and an even larger share – 66% – have seen this happen to others. Pew Research Center measured online harassment by asking respondents if they had personally experienced at least one of six types of behavior online: Offensive name-calling, purposeful embarrassment, physical threats, harassment over a sustained period of time, sexual harassment or stalking. Overall, 41% of U.S. adults say they have been the target of at least one of these harassing behaviors online, representing a modest increase from 2014, when 35% of Americans said they had been harassed online. And while 22% of Americans say they have experienced only less severe forms of online harassment, such as name-calling or embarrassment, 18% have been the target of more severe forms of online harassment, including physical threats, sustained harassment, stalking and sexual harassment.",good
mturk_charts/no_data/multi_col/6786.png,"Political views, physical appearance, gender and race are among the top reasons people say they are harassed online. Some 14% of Americans – representing 35% of those who have encountered any type of harassment online – say they have been the target of online harassment because of their political views. Democrats and Republicans are equally likely to say this. Among other reasons people have been harassed online, around one-in-ten U.S. adults cite their physical appearance (9%), while 8% each say they were targeted because of their gender or their race or ethnicity. Smaller shares cited religion, sexual orientation, occupation or disability status as reasons. Social media is by far the most common venue for online harassment. When asked where their most recent incident with online harassment occurred, 58% of those who have been harassed online cited social media, the most common response. By comparison, 23% of online harassment targets say their most recent experience occurred in the comments sections of a website, while 15% cited a text or messaging app.",good
mturk_charts/no_data/multi_col/6787.png,"Americans’ views about the balance between online safe spaces and free speech tend to vary by gender. Men are more likely than women to say that it is more important for people to be able to speak their minds freely online (56% vs. 36%), while women are more inclined than men to say it is more important for people to feel welcome and safe in online spaces (63% vs. 43%).",good
mturk_charts/no_data/multi_col/6788.png,"Overall, 43% of U.S. adults say that law enforcement does not take incidents of online harassment seriously enough. Another 19% feel that police do take harassment complaints seriously, and 32% are unsure of how law enforcement handles this issue.",good
mturk_charts/no_data/multi_col/6789.png,"Witnessing online harassment has led some bystanders to change their online behavior. Roughly one-quarter of Americans (27%) say they have chosen not to post something after witnessing online harassment, while a similar share (28%) say they adjusted their privacy settings after seeing this type of online behavior. Some users report going a step further: 13% of U.S. adults have stopped using an online service altogether after seeing others being harassed.",good
mturk_charts/no_data/multi_col/6802.png,"Yet even as partisan divides in views of some of these institutions have widened in recent years, the public’s overall evaluations are little changed. Majorities of Americans say churches and religious organizations (59%) and colleges and universities (55%) have a positive effect. Nearly half (47%) say labor unions have a positive impact; 32% see their impact negatively. Views of the impact of banks and other financial institutions are more negative (46%) than positive (39%). And by roughly two-to-one (63% to 28%), more Americans say that the national news media has a negative than positive effect on the way things are going in the country.",good
mturk_charts/no_data/multi_col/6808.png,"Among Republicans and Republican leaners, younger adults have much more positive views of colleges and universities than older adults. About half (52%) of Republicans ages 18 to 29 say colleges and universities have a positive impact on the country, compared with just 27% of those 65 and older. By contrast, there are no significant differences in views among Democrats by age, with comparable majorities of all age groups saying colleges and universities have a positive impact.",good
mturk_charts/no_data/multi_col/6811.png,"Public views of the impact of churches and religious organizations on the country have changed little in recent years. Currently, 59% say churches have a positive effect on the country, while 26% say they have a negative effect.",good
mturk_charts/no_data/multi_col/6812.png,"Gun ownership spans all types of American communities, but it is particularly common in rural parts of the country. Among adults who live in rural areas, 46% say they own a gun, compared with 28% of adults who live in the suburbs and even fewer – 19% – in urban areas, according to a new Pew Research Center survey.",good
mturk_charts/no_data/multi_col/6813.png,"The relatively young age at which rural gun owners first acquired a gun is perhaps not surprising: Americans who grew up in rural areas are more likely to have grown up with guns in their homes. About seven-in-ten Americans who grew up in a rural area (72%) say there were guns in their household growing up, compared with half (52%) of those who grew up in a small town and 39% of those who grew up in a city.",good
mturk_charts/no_data/multi_col/6816.png,"New arrivals who receive green cards, on the other hand, are far more likely to be sponsored by family members – fully 85% are, compared with 46% of those who adjusted their status in 2015. Only 4% of new arrivals came in an employment category. Green card holders who adjusted their status are more likely than new arrivals to be in the prime working years of 25 to 64, and are less likely to be younger or older. Among those who adjusted their status, 72% were ages 25 to 64, compared with 55% of new arrivals.",good
mturk_charts/no_data/multi_col/6823.png,"The Brazilian public expects a recovery soon. While recent economic forecasts point to a slow recovery, the majority of the Brazilian public remains confident that the economy will bounce back in the near future. Nearly seven-in-ten Brazilians (69%) say the country’s economic situation will improve over the next 12 months, with roughly a third (34%) believing it will improve a lot. Individuals with higher levels of education are less optimistic about the future, however. About half (51%) of Brazilians who completed college believe the economy will improve, compared to 71% of those without university degrees.",good
mturk_charts/no_data/multi_col/6825.png,"Only about a quarter of Brazilians believe that political instability will get better. While the impact of the recent charge against the president and other ongoing investigations remains to be seen, 86% of Brazilians say political instability is a big problem for their country. Moreover, the public is skeptical that the current state of affairs in Brasília, the capital, will change for the better anytime soon. About four-in-ten Brazilians (42%) believe the political instability will get worse in the next five years, 29% say the problem will stay the same and roughly a quarter (24%) believe the instability will get better.",good
mturk_charts/no_data/multi_col/6824.png,"Even before being charged with corruption, Brazilian President Michel Temer was less popular than his predecessors. Temer, Brazil’s current leader, has been charged with corruption amid allegations he participated in bribery. But even before the scandal, when Brazilians were asked about their views of the country’s current and previous presidents, Temer’s favorability trailed that of his immediate predecessors, according to a Pew Research Center survey conducted in March and April. In the spring survey, about one-in-five (21%) Brazilians had a positive view of Temer, including only 2% who had a very favorable view of him. About a third (34%) of the public had a favorable view of Temer’s former boss, impeached President Dilma Rousseff. And more than four-in-ten (45%) had a positive opinion of former President Luiz Inácio Lula da Silva, who is also under investigation.",good
mturk_charts/no_data/multi_col/6826.png,"NRA members are also significantly more likely than other gun owners to say they have a gun that is loaded and easily accessible to them at all times (53% vs. 34%). And, among handgun owners, NRA members are twice as likely to say they carry a gun with them outside of their home all or most of the time (44% vs. 22%). They are also more likely to say they have taken a gun safety course at some point – 84% of NRA members have done this, compared with 67% of gun owners who don’t belong to the NRA.",good
mturk_charts/no_data/multi_col/6828.png,"To be sure, the NRA has been an active voice in debates over many of these policy proposals. And the public is divided when it comes to the amount of influence the NRA has over guns laws in the U.S.: While 44% of all adults say the NRA has too much influence over gun legislation, 40% say it has the right amount of influence. Relatively few (15%) say the NRA has too little influence. For their part, NRA members are largely satisfied with the amount of influence the organization has over U.S. gun laws. About six-in-ten (63%) say the NRA has the right amount of influence and 28% say it has too little influence. Only 9% of NRA members say the organization has too much influence over gun laws. Among non-gun owners, 50% view the NRA as too influential.",good
mturk_charts/no_data/multi_col/6835.png,"Among both Republicans and Democrats, however, majorities place the U.S. among the greatest nations, rather than saying it stands above others or that other nations are superior. In the new survey, 60% of Democrats and 52% of Republicans say the U.S. is one of the greatest countries in the world, again little changed from 2015.",good
mturk_charts/no_data/multi_col/6836.png,"Among Democrats, just 13% of liberals say the U.S. stands above other nations, compared with 23% of moderate and conservative Democrats. And nearly three-in-ten liberal Democrats (29%) say there are other countries better than the U.S.; only 13% of conservative and moderate Democrats say the same. Adults 65 and older are the most likely to say the U.S. stands above all other nations (44%). By contrast, just 12% of those younger than 30 say the same, the lowest share in any age category. There is little difference in views of the nation’s global standing by race and ethnicity: About three-in-ten whites (30%) and blacks (31%) and about a quarter of Hispanics (26%) view the U.S. as above all other nations. The majority view across each of these groups is that the U.S. is a great country, on par with some other countries.",good
mturk_charts/no_data/multi_col/6837.png,"Women are more likely than men to cite protection – rather than recreation – as the only reason they own a gun. Male and female gun owners are about equally likely to cite protection as a reason why they own guns: About nine-in-ten in each group say this is a reason, and 65% and 71%, respectively, say it is a major reason. But far larger shares of women than men who own guns say protection is the only reason they own a gun: About a quarter of women who own guns (27%) are in this category, compared with just 8% of men.",good
mturk_charts/no_data/multi_col/6838.png,"Women who own guns are less likely than their male counterparts to say they go sport shooting or hunting, though substantial shares of women do so. About four-in-ten female gun owners (43%) say they go shooting or to a gun range often or sometimes; 58% of men who own guns say the same. And while 37% of male gun owners say they go hunting at least sometimes, 28% of women who own guns do so.",good
mturk_charts/no_data/multi_col/6839.png,"Male gun owners are more likely than female gun owners to say there is a gun that is both loaded and easily accessible to them all of the time when they’re at home. Some 43% of men who own guns say this is the case, compared with 29% of women gun owners. However, among those who own handguns, equal shares of men and women (26% each) say they carry their gun outside their home all or most of the time.",good
mturk_charts/no_data/multi_col/6843.png,"As part of a larger survey of Hispanic immigrants fielded in late 2015, Pew Research Center asked Mexican green-card holders why they had not yet become naturalized U.S. citizens. The most frequent reasons centered on inadequate English skills, lack of time or initiative, and the cost of the U.S. citizenship application. These appear to be significant barriers, as nearly all lawful immigrants from Mexico said they would like to become U.S. citizens someday. In the United States, the citizenship, or naturalization, rate among all lawful immigrants steadily increased from 1995 to 2005, rising from 47% to 62%. Until about 2005, the naturalization rate among lawful immigrants from Mexico also increased steadily, but did so more rapidly (from 20% in 1995 to 38% in 2005), narrowing the gap between Mexicans and other immigrants. However, between 2005 and 2010, the naturalization rate of Mexican green-card holders leveled off, even as the rate for lawful permanent residents from other parts of the globe continued to rise. Only in the period from 2011 to 2015 did the rate of naturalization among eligible Mexican immigrants significantly increase again at a pace higher than that of other lawful U.S. immigrants – going from 38% to 42% among Mexicans, compared with a 2-percentage-point increase, from 72% to 74% among non-Mexican immigrants.",good
mturk_charts/no_data/multi_col/6846.png,"Asked why they hadn’t yet naturalized, the Center’s 2015 survey found that 35% of Mexican and 23% of other Latino immigrants with green cards identified personal barriers, such as a lack of English proficiency. Another common reason given was a lack of interest or just having not applied yet. About a third (31%) of Mexican lawful immigrants said this, while only 16% of non-Mexican Latino immigrants said the same. An additional 13% of Mexican and 19% of non-Mexican lawful immigrants identified financial and administrative barriers, mainly the cost of naturalization.",good
mturk_charts/no_data/multi_col/6853.png,"More than half of smartphone owners say they get news alerts on their phones, but few get these alerts frequently. Some 55% of smartphone owners say they ever get news alerts on their phones’ screens, according to a 2016 Pew Research Center survey. However, few users say they receive these types of alerts often, with just 13% of smartphone owners reporting doing this. While smartphones are becoming more integrated into our lives, many users aren’t taking the necessary steps to secure their devices. A 2016 Pew Research Center survey found that 28% of U.S. smartphone owners say they do not use a screen lock or other features to secure their phone. Although a majority of smartphone users say they have updated their phone’s apps or operating system, around four-in-ten say they only update when it’s convenient for them. But some smartphone users forgo updating their phones altogether: 14% say they never update their phone’s operating system, while 10% say they don’t update the apps on their phone.",good
mturk_charts/no_data/multi_col/6855.png,"Americans have different views about where it is and isn’t appropriate to use a cellphone. In a 2014 Pew Research Center survey, roughly three-quarters of adults said it was OK for people to use their phones while walking down the street, riding public transit or waiting in line, but far fewer found it acceptable to use cellphones during a meeting, at the movies or in church.",good
mturk_charts/no_data/multi_col/6856.png,"The smartphone is essential for many owners, but a slight majority says it’s not always needed. Some 46% of smartphone owners said their smartphone is something “they couldn’t live without,” compared with 54% who said in a 2014 Pew Research Center survey that their phone is “not always needed.” Perhaps surprisingly, smartphone owners who depend on their mobile device for internet access are not significantly more inclined than those who have multiple options for going online to say they couldn’t live without their phone (49% vs. 46%). In addition to being essential for many, smartphone owners are much more likely to have positive views of these devices. For instance, they are much more likely to say smartphones are more helpful than annoying, represent freedom rather than represent a leash, enable connecting rather than being distracting and are worth the cost rather than being a financial burden.",good
mturk_charts/no_data/multi_col/6858.png,"Blacks are more likely than either whites or Hispanics to say voting should be made as easy as possible for citizens: 79% of blacks say this, while just 19% say citizens should have to prove they really want to vote by registering ahead of time. Among whites, a much narrower majority (54%) support making voting as easy as possible for all citizens (44% say citizens should prove they want to vote by registering ahead of time). By 64%-35%, most Hispanics support taking steps to make voting easy for all citizens.",good
mturk_charts/no_data/multi_col/6859.png,"While there is support for making it easy for citizens to vote, the public is largely opposed to making voting required in national elections. Only two-in-ten (20%) would favor mandatory voting, while nearly eight-in-ten (78%) says citizens should be able to decide for themselves whether or not to vote in national elections.",good
mturk_charts/no_data/multi_col/6860.png,"The public places a great deal of personal importance on the right to vote. When asked about the importance of five rights and freedoms, the right to vote ranks about as high as any item on the list. Overall, 91% of Americans say that the right to vote is essential to their sense of freedom. Only 7% say it is important but not essential, and just 1% says it is not important. A comparable share (92%) considers freedom of speech to be essential to their own sense of freedom. Large majorities also say the right to privacy (87%) and freedom of religion (85%) are essential to them. Views are more mixed when it comes to the right to own guns: 48% say this is essential, while 33% say it is important but not essential and 19% say it is not important.",good
mturk_charts/no_data/multi_col/6872.png,"In addition to exploring global views of President Trump, this survey also examines attitudes toward three other major leaders on the international stage. The results demonstrate that Trump is not the only world leader in whom global publics lack confidence. Chinese President Xi Jinping and Russian President Vladimir Putin also get poor marks, though neither is rated as negatively as the U.S. president. Across the 37 nations surveyed, a median of 28% voice confidence in Xi, while 27% feel this way about Putin.",good
mturk_charts/no_data/multi_col/6874.png,"Survey respondents were read a list of positive and negative characteristics, and for each one, were asked whether it describes Donald Trump. Around the globe, people associate a number of negative characteristics with the U.S. leader. Most say he is arrogant, intolerant and dangerous, while few think of him as well-qualified or as someone who cares about ordinary people. Describing Trump as charismatic is more common, although global publics on balance do not think of him as charismatic either. They do, however, see Trump as a strong leader – a median of 55% across the nations polled describe him this way.",good
mturk_charts/no_data/multi_col/6883.png,"Among non-gun owners, mothers are much more likely than fathers to say they have talked with their children about gun safety (58% vs. 37%). And while 59% of white parents who don’t own guns say they have talked with their children about gun safety, 40% of nonwhite parents who don’t own guns say they have done this.",good
mturk_charts/no_data/multi_col/6882.png,"Gun owners with children younger than 18 in the household are more likely than those who aren’t parents to say they keep all their guns locked and unloaded while they’re at home, according to a new Pew Research Center survey. Even so, 44% of gun-owning parents say there is a gun that is both loaded and easily accessible to them all or most of the time when they’re at home. Among gun-owning parents with children in their household, 54% say all of the guns in their home are kept in a locked place and 53% say they are all kept unloaded. By comparison, 30% of gun owners who are not parents say all their guns are locked and 40% say they are unloaded, according to the survey conducted in March and April among 3,930 U.S. adults, including 1,269 gun owners.",good
mturk_charts/no_data/multi_col/6888.png,"Republicans and Republican leaners are divided on the question for the first time: 47% favor allowing gays and lesbians to marry, while a nearly identical share is opposed (48%). Fully three-quarters of Democrats and Democratic-leaning independents (76%) say they favor allowing same-sex marriage, compared to just 19% who are opposed. Among Republicans and Republican leaners, a majority of Millennials (60%) support same-sex marriage, while 38% are opposed. About half of Gen X Republicans (51%) favor allowing gays and lesbians to marry legally. Majorities of Republican Baby Boomers (53%) and Republican Silents (62%) continue to oppose same-sex marriage.",good
mturk_charts/no_data/multi_col/6891.png,"In the new survey, majorities across all educational groups now say they favor same-sex marriage, but levels of support are highest among those who have graduated from college: 79% among those with postgraduate degrees and 72% among those with bachelor’s degrees. Smaller majorities of those with some college experience but no college degree (62%) or those with no more than a high school degree (53%) say they favor allowing gays and lesbians to marry. While Republicans overall are divided in views of same-sex marriage, moderate and liberal Republicans are much more supportive than are conservative Republicans (63% vs. 39%). There also are wide ideological differences among Democrats, though majorities of conservative and moderate Democrats (66%) and liberal Democrats (90%) favor allowing gays and lesbians to marry legally.",good
