img_path,"summary",category
mturk_charts/no_data/multi_col/7108.png,"Roughly a quarter century after the end of the Soviet era, Russia retains substantial influence throughout many parts of Central and Eastern Europe. Indeed, Russia is widely viewed by the region’s Orthodox Christians as an important counterweight to Western influences and as a global protector of Orthodox and ethnic Russian populations, according to a new Pew Research Center survey of 18 countries in Central and Eastern Europe. Majorities or pluralities in nearly all Orthodox-majority countries surveyed agree that a strong Russia is necessary to balance the influence of the West, and that Russia has an obligation to protect Orthodox Christians and ethnic Russians outside its borders.",good
mturk_charts/no_data/multi_col/7116.png,"The Trump administration and governments in Ottawa and Mexico City have indicated they will renegotiate the trilateral, quarter-century-old North American Free Trade Agreement (NAFTA). While the existing accord enjoys the support of roughly three-quarters of the Canadian public and six-in-ten Mexicans, it is viewed less favorably in the United States, with Republicans far less supportive than Democrats, according to a new Pew Research Center survey of all three countries. About half of Americans (51%) say NAFTA has been a good thing for the U.S., including 11% who say it has been very good. That compares with 74% of Canadians who say the agreement has been good for Canada, including 20% who say it has been very good. Among Mexicans, 60% see NAFTA as being good for their country, including 10% who hold that view strongly. These differences in views may, in part, reflect the fact that both Canada and Mexico run merchandise trade surpluses with the U.S. In 2016, the U.S. ran a collective $74 billion trade goods deficit with its two NAFTA partners.",good
mturk_charts/no_data/multi_col/7119.png,"As of 2016, 15% of 25- to 35-year-old Millennials were living in their parents’ home. This is 5 percentage points higher than the share of Generation Xers who lived in their parents’ home in 2000 when they were the same age (10%), and nearly double the share of the Silent Generation who lived at home in 1964 (8%). It doesn’t appear that a lack of jobs is keeping Millennials at home. As of the first quarter of 2016 (when the living arrangements data were collected), only 5.1% of older young adults were unemployed, down from 10.1% in the first quarter of 2010. Yet the share of 25- to 35-year-olds living at home rose during that span, increasing from 12% in 2010 to 15% in 2016.",good
mturk_charts/no_data/multi_col/7121.png,"The increased prevalence of living with mom and/or dad is more prominent among less-educated young adults. In 2016, only 10% of Millennials who had completed at least a bachelor’s degree lived at home, compared with 7% of college-educated Gen Xers who lived at home in 2000. By contrast, 20% of young adults with no more than a high school diploma lived in their parents’ home in 2016, up from 12% of Gen Xers in 2000.",good
mturk_charts/no_data/multi_col/7120.png,"Millennials – whether living with their parents or not – are moving significantly less often than earlier generations of young adults. Among 25- to 35-year-old Millennials who were living at home in 2016, 91% reported that they resided at the same address one year earlier. This does not preclude the possibility that the young adult moved out and “boomeranged” back in the intervening year (perhaps multiple times); the data simply indicate that they lived with their parent or parents one year earlier as well.",good
mturk_charts/no_data/multi_col/7131.png,"The public continues to express frustration with the federal government, rather than anger or contentment. A majority of Americans say frustration (55%) best describes their feeling toward the federal government, while about two-in-ten say they are angry (22%); a similar share (19%) say they are basically content. Overall, attitudes toward the federal government today are virtually identical to a year ago. In March 2016, 57% said they felt frustrated with the federal government, while 21% said they were angry and 20% said they were basically content.",good
mturk_charts/no_data/multi_col/7133.png,"Overall, 41% say they have quite a lot of confidence in the future of the U.S., while another 30% say they have some confidence. About three-in-ten (28%) say they have very little or no confidence at all in the future of the U.S.",good
mturk_charts/no_data/multi_col/7134.png,"Currently, there are modest differences in outlook by levels of educational attainment. Those with some college experience are somewhat less likely to say they have a lot of confidence in the future of the U.S. than are both those with more and less education. The shares who say they have a lot of confidence are down significantly since 2015 among postgraduates (13 points), college graduates (8 points) and those with some college experience (7 points). There has been no significant shift in outlook among those with no more than a high school diploma.",good
mturk_charts/no_data/multi_col/7198.png,"Views of why some people are rich and poor vary by gender, education and income level as well. For example, men (49%) are slightly more likely than women (41%) to say that hard work is more often the reason why someone is rich. Men (42%) also are more likely than women (26%) to say that a lack of effort is more to blame if someone is poor. Those with postgraduate degrees are more likely to say that having more advantages in life has more to do with why a person is rich (52%) than they are to say hard work has more to do with it (34%). Those with less education are more divided on what has more to do with why a person is rich. When it comes to the reasons why a person is poor, majorities of postgraduates (62%) and college graduates (59%) say circumstances are generally to blame. Most of those with some college experience (54%) also take this view. Among those with no more than a high school diploma, about half (49%) point to circumstances as the reason why a person is poor, while 38% cite a lack of effort.",good
mturk_charts/no_data/multi_col/7203.png,"These states have metro areas that are home to large technology and finance hubs such as San Jose, Dallas, Houston and New York City. New Jersey had 9.4 visa approvals per 1,000 workers, the highest ratio in the nation. Maryland had the second-highest ratio, with 4.9 H-1B approvals per 1,000 workers.",good
mturk_charts/no_data/multi_col/7204.png,"About two-thirds (64%) of H-1B visa requests in fiscal 2011 were for occupations in the fields of science, technology, engineering and math (STEM), according to the most recently available government data. Nine-in-ten H-1B visa requests (90%) are for jobs that require some high-level STEM knowledge. Most H-1B applications (75%) require high-level computer knowledge, and roughly half require significant engineering and math skills. High-level scientific knowledge is less commonly requested.",good
mturk_charts/no_data/multi_col/7210.png,"The share of births outside of marriage declined for immigrant women from 2008 to 2014, but held steady for U.S.-born women. Immigrant women play an important role in overall U.S. fertility trends. Between 1970 and 2014, the increase in the annual number of U.S. births was driven entirely by immigrant women, while births to U.S.-born women fell. The important role of immigrant women in driving U.S. births stems from both the growth in the foreign-born population and the fact that immigrant women have, on average, more children than U.S.-born women.",good
mturk_charts/no_data/multi_col/7213.png,"The U.S. admitted 84,995 refugees in fiscal year 2016, the most since 1999. More than half resettled in one of just 10 states, with the largest numbers going to California and Texas. Nebraska, North Dakota and Idaho ranked near the top for the most refugees resettled per capita, with rates over two-and-a-half times the national average. And almost half (46%) of the fiscal 2016 refugees were Muslim, the highest number for any year since refugees’ self-reported religious affiliation became publicly available in 2002.",good
mturk_charts/no_data/multi_col/7224.png,"By roughly two-to-one, both blacks (62% to 29%) and Hispanics (63% to 33%) are more likely to say free trade agreements have been good for the country than to say they have been bad for the country. By contrast, whites are divided in their views of the impact of free trade agreements (47% say they have been a good thing, 44% say they have been a bad thing).",good