img_path,"summary",category
mturk_charts/no_data/multi_col/5620.png,"Among those who disapprove of Trump, 65% of self-identified Democrats say they don’t think those with a different view of Trump share their other values and goals. Among those who disapprove of Trump and lean toward the Democratic Party (but don’t identify with it), views are more mixed: 47% think those with a different view of Trump probably share many of their other values and goals, while 52% think they probably do not.",good
mturk_charts/no_data/multi_col/5621.png,"Currently, whites remain divided in their views of Trump: Half (50%) approve of the job Trump is doing as president, while 45% disapprove. Blacks (85%) and Hispanics (74%) overwhelmingly disapprove of Trump’s job performance.",good
mturk_charts/no_data/multi_col/5624.png,"The public is split on whether Russian efforts to influence the 2016 election benefited Donald Trump’s campaign or neither campaign very much. Roughly equal shares say that Russian efforts likely benefited Trump’s campaign (43%) or neither of the campaigns (48%) – with sharp divisions by party. Just 4% say Russian efforts benefited Hillary Clinton’s campaign.",good
mturk_charts/no_data/multi_col/5626.png,"Democrats – especially liberals – are deeply skeptical that the White House will make serious efforts to block Russia from intervening in future elections. A large majority of liberal Democrats (70%), along with about half (51%) of the party’s conservatives and moderates, say they are “not at all confident” the administration will make serious efforts.",good
mturk_charts/no_data/multi_col/5633.png,"As one might expect, working in science, technology, engineering and math (STEM) – or earning a postgraduate degree in a STEM field – is closely related to liking science and math classes in grades K-12. But many of those who work in other occupations or have a degree in a different field liked one or both of these subjects as well.",good
mturk_charts/no_data/multi_col/5647.png,"President Donald Trump has appointed 29 judges to the federal bench since his inauguration, including 14 appeals court judges and a Supreme Court justice, Neil Gorsuch. While Trump has moved quickly to put his stamp on the federal judiciary, his judges have also faced a record amount of opposition, at least based on the average number of Senate votes cast against them. The 23 men and six women Trump has successfully appointed so far have faced a total of 654 “no” votes on the floor of the Senate, according to a Pew Research Center analysis of data from the Federal Judicial Center and the U.S. Senate. That works out to an average of nearly 23 votes against each confirmed judge – by far the highest average for any president’s judges since the Senate expanded to its current 100 members in 1959. The 330 judges Barack Obama appointed during his eight years in office faced an average of six votes against them. George W. Bush’s 328 confirmed judges faced an average of two, and Bill Clinton’s 382 judges faced an average of just over one. (This analysis counts judges for each Senate confirmation vote they faced. Some judges held multiple judicial positions and are counted more than once. Clarence Thomas, for instance, is counted twice under George H.W. Bush’s total because Thomas was confirmed to two separate positions that each required a confirmation vote: first to a seat on the U.S. Court of Appeals for the District of Columbia Circuit in 1990, then to the Supreme Court in 1991.)",unquestionable
mturk_charts/no_data/multi_col/5650.png,"A plurality of women (48%) say they work in places where there are more women than men, while 18% say there are more men than women, according to a Pew Research Center survey. Similarly, 44% of men say their workplace is majority-male, and 19% say women outnumber men. About a third of women (33%) and men (36%) say both genders are about equally represented in their workplace.",good
mturk_charts/no_data/multi_col/5651.png,"There are big gaps as well in perceptions about how women are treated in the workplace and how much attention is paid to increasing gender diversity. Most women who work in majority-female workplaces say women are usually treated fairly where they work when it comes to recruitment and hiring (79%) and in opportunities for promotion and advancement (70%). Smaller shares, but still majorities, of women who say their workplace is balanced in terms of gender say women are treated fairly in these areas. Women who work in majority-male workplaces feel much differently: 48% say women are treated fairly where they work when it comes to recruitment and hiring, and even fewer (38%) say women are treated fairly in promotions and advancement. Women who work mainly with men are also less likely than other female workers to say their workplace pays the right amount of attention to increasing gender diversity. Only 49% say this, compared with 78% of women who say there is an even gender mix where they work and 71% who work in female-dominated workplaces.",good
mturk_charts/no_data/multi_col/5659.png,"Pessimism and disaffection are widespread among Italians ahead of the country’s general election on Sunday. In a Pew Research Center survey conducted last fall, 82% of Italians said they distrust parliament and an equal share said the national economic situation is bad. About three-quarters (77%) said politicians don’t care what people like them think, including 59% who felt that way strongly.",good
mturk_charts/no_data/multi_col/5668.png,"As noted in October, there has been an increase in the share of Americans expressing consistently liberal or mostly liberal views, while the share holding a mix of liberal and conservative views has declined.",unquestionable
mturk_charts/no_data/multi_col/5669.png,"More than four-in-ten Millennials (currently ages 22 to 37) are Hispanic (21%), African American (13%), Asian (7%) or another race (3%). Among Gen Xers, 39% are nonwhites.",good
mturk_charts/no_data/multi_col/5673.png,"Along with being the most popular social media site, Facebook users also visit the site with high levels of frequency. Fully 74% of Facebook users say they visit the site daily, with around half (51%) saying they do several times a day. The share of Facebook users who visit the site on a daily basis is statistically unchanged compared with 2016, when 76% of Facebook users reported they visited the site daily. While the overall share of Americans who use Snapchat is smaller than that of Facebook, a similar share of Snapchat users (49%) say they use the platform multiple times per day. All told, a majority of Snapchat (63%) and Instagram (60%) users indicate that they visit these platforms on a daily basis. The share of Instagram users who visit the platform daily has increased slightly since 2016 when 51% of Instagram users were daily visitors. (Note: this is the first year the Center has specifically asked about the frequency of Snapchat use in a telephone poll.)",good
mturk_charts/no_data/multi_col/5675.png,"These findings vary by age. Roughly half of social media users ages 18 to 24 (51%) say it would be hard to give up social media, but just one-third of users ages 50 and older feel similarly. The data also fit broadly with other findings the Center has collected about Americans’ attitudes toward social media. Despite using them for a wide range of reasons, just 3% of social media users indicate that they have a lot of trust in the information they find on these sites. And relatively few have confidence in these platforms to keep their personal information safe from bad actors.",good
mturk_charts/no_data/multi_col/5676.png,"Sub-Saharan African nations account for eight of the 10 fastest growing international migrant populations since 2010, according to a Pew Research Center analysis of the latest United Nations data on the number of emigrants, or people living outside their country of birth. The number of emigrants from each of these sub-Saharan countries grew by 50% or more between 2010 and 2017, significantly more than the 17% worldwide average increase for the same period. At the country level, only Syria had a higher rate of growth in its number of people living in other countries.",good
mturk_charts/no_data/multi_col/5678.png,"And as international migration has increased, the breakdown of where sub-Saharan emigrants live has changed. In 1990, 75% of emigrants from the region lived in other sub-Saharan countries, a share that dropped to 68% by 2017. Over the same period, the share of sub-Saharan emigrants who live in the United States climbed from 2% to 6%. This has helped make African immigrants a small but fast-growing slice of the overall U.S. immigrant population. As of 2017, nearly 1.5 million sub-Saharan immigrants lived in the U.S., according to UN data.",good
mturk_charts/no_data/multi_col/5681.png,"The two publics also have different perspectives on the core elements of the U.S.-German relationship. A 45% plurality of Germans believe economic and trade ties are the most important component of the relationship, while just around one-third point toward shared democratic values. Only 16% say security and defense ties are most important.",good
mturk_charts/no_data/multi_col/5683.png,"In both nations, there are partisan differences over what binds the two countries together.1 Among Americans, Republicans clearly see defense ties as most important (47%), with 28% naming economic and trade ties and just 12% naming shared values. Democrats are almost evenly divided across the three options.",good
mturk_charts/no_data/multi_col/5684.png,"In addition, Democrats are more likely to name Germany as a top foreign policy partner for the U.S. Among Democrats, 21% believe Germany is one of the two most important partners for the U.S., putting it in the third spot overall behind Great Britain (32%) and China (26%). Among Republicans, Germany is tied for the seventh spot, alongside Russia, with just 5% of Republicans citing it as a top partner.",good
mturk_charts/no_data/multi_col/5687.png,"Americans are much less likely to see Germany in this way – only 12% name Germany as one of America’s top two partners. Still, Germany does make the top four, trailing Great Britain (33%) and China (24%) and tying with Israel (12%).",good
mturk_charts/no_data/multi_col/5688.png,"Both the American and German publics support cooperating more with a number of global powers in the future. Majorities across both nations want to work more with each other, as well as with France, Great Britain and China. However, fewer Germans want their country to cooperate more with the U.S. than with any other country tested. And roughly one-third in Germany (34%) say they want to cooperate less with the U.S. in the future. Almost eight-in-ten in Germany want to see their country working more with Russia. Americans are split – just 43% want increased cooperation with Moscow while 44% hold the opposite view. Democrats are much more likely than Republicans to say the U.S. should cooperate less with Russia in the future (55% versus 35% respectively). But when it comes to working with Germany, France, Great Britain and China, Democrats are more likely than Republicans to want increased cooperation.",good
mturk_charts/no_data/multi_col/5691.png,"Parents with children younger than 18 in the household were no more or less likely than non-parents to express support for allowing teachers to carry guns in schools: 46% of parents and 44% of non-parents said they would favor it. Instead, opinions divided primarily along party lines and by gun ownership status, with Republicans and those who own guns particularly likely to say they would support allowing teachers to carry guns in schools.",good
mturk_charts/no_data/multi_col/5695.png,"Black households have only 10 cents in wealth for every dollar held by white households. In 2016, the median wealth of non-Hispanic white households was $171,000. That’s 10 times the wealth of black households ($17,100) – a larger gap than in 2007. The Great Recession of 2007-2009 triggered a stark decline in wealth for U.S. families and further widened the already large wealth gap between white and black households. Yet the black-to-white wealth gap has evolved differently for families at different income levels, according to a Pew Research Center analysis of Federal Reserve data. The wealth gap increased between middle-income black and white families, but shrank between lower-income black and white families from 2007 to 2016. Much of the reduction in the wealth gap among lower-income families was driven by a sharp decrease in wealth for whites.",unquestionable
mturk_charts/no_data/multi_col/5716.png,"Roughly eight-in-ten (79%) African Americans self-identify as Christian, as do seven-in-ten whites and 77% of Latinos, according to Pew Research Center’s 2014 Religious Landscape Study. Most black Christians and about half of all African Americans (53%) are associated with historically black Protestant churches, according to the study. Smaller shares of African Americans identify with evangelical Protestantism (14%), Catholicism (5%), mainline Protestantism (4%) and Islam (2%).",good
mturk_charts/no_data/multi_col/5717.png,"African Americans are more religious than whites and Latinos by many measures of religious commitment. For instance, three-quarters of black Americans say religion is very important in their lives, compared with smaller shares of whites (49%) and Hispanics (59%); African Americans also are more likely to attend services at least once a week and to pray regularly. Black Americans (83%) are more likely to say they believe in God with absolute certainty than whites (61%) and Latinos (59%).",good
mturk_charts/no_data/multi_col/5721.png,"There were wide gaps across the two major parties: 55% of Democratic members and 34% of Republican members made posts about the topic. In both parties, the shares of women who discussed sexual misconduct on Facebook were 30 percentage points larger than the shares of men who did so.",good
mturk_charts/no_data/multi_col/5726.png,"Adults who live in someone else’s household typically live with a relative. Today, 14% of adults living in someone else’s household are a parent of the household head, up from 7% in 1995. Some 47% of extra adults today are adult children living in their mom and/or dad’s home, down from 52% in 1995. Other examples of extra adults are a sibling living in the home of a brother or sister, or a roommate.",good
mturk_charts/no_data/multi_col/5727.png,"Majorities of Americans say the federal government does not provide enough help for older people (65%), poor people (62%) and the middle class (61%). By contrast, nearly two-thirds (64%) say the government provides too much help for wealthy people.",good
mturk_charts/no_data/multi_col/5728.png,"There are partisan differences in views of government support for all groups included in the survey. However, the gap is somewhat narrower in views of government help for older people than for other groups. While 73% of Democrats and Democratic-leaning independents say the federal government does not do enough for older people, a smaller majority of Republicans (58%) say the same. The partisan gap is much wider in views of government help for younger people. Nearly seven-in-ten Democrats (69%) say the federal government does not provide enough help for younger people. Republicans are divided: Nearly equal shares say the government does too little (29%) and too much (27%) for younger people, while 36% say it provides about the right amount of help. In addition, there are sizable age differences in views of government help for younger people – but not in how much the government does for older people. A majority of those younger than 50 (58%) say the government does not do enough for younger people, compared with 44% of those 50 and older. Nearly identical shares of those under 50 (65%) and those 50 and older (66%) say the federal government does not do enough for older people.",good
mturk_charts/no_data/multi_col/5729.png,"The partisan divide in views of government aid for the poor is wider than for other groups. Fully 82% of Democrats say the federal government does not provide enough help for poor people, compared with just 36% of Republicans. About as many Republicans say the government does too much for the poor (33%) as say it does too little; 27% say the help the government provides is about right. Democrats and Republicans also differ in their attitudes about the help the government provides to wealthy people. A large majority of Democrats (77%) say the federal government provides too much help to the wealthy. As with views about government help to the poor, Republicans are divided. Nearly half of Republicans (46%) say the federal government provides too much help for wealthy people, 42% say it provides about the right amount, while 6% say it does not provide enough help.",good
mturk_charts/no_data/multi_col/5730.png,"Nearly half of Republicans with incomes under $40,000 (47%) say that the government does not provide enough assistance for poor people. This is considerably higher than those who make between $40,000 and $75,000 or $75,000 or more; only about three-in-ten in these income brackets say that poor people do not receive enough assistance (32% and 28%, respectively).",good
mturk_charts/no_data/multi_col/5735.png,"Terrorism and global threats: Defending against terrorism continues to rank among the public’s leading priorities for the president and Congress, with nearly three-quarters (73%) saying it is a top priority.",good
mturk_charts/no_data/multi_col/5738.png,"Race relations: Nearly a year into Trump’s presidency, a majority of Americans (60%) say his election has worsened race relations in the United States. Three-in-ten say Trump’s election has not made a difference when it comes to race relations, and just 8% say his election has made them better. Just after Trump’s election in 2016, nearly half of Republican voters (48%) said they expected his election to lead to improved race relations. Roughly a year later, just 17% of Republicans say it has. Meanwhile, about eight-in-ten Democratic voters (83%) say Trump’s election has made race relations worse, little different than the share who expected his election to lead to worse race relations in November 2016 (81%).",good
mturk_charts/no_data/multi_col/5750.png,"A new national survey by Pew Research Center of 1,503 adults, conducted Jan. 10-15, 2018, finds that strengthening the economy continues to rank among the public’s leading priorities (71% top priority), along with defending against terrorism (73%) and improving the educational system (72%). However, fewer view the economy as a top priority than did so four (80%) or eight (83%) years ago. Over the same period, the share rating improving the job situation as a top priority also has declined; 62% say this today, its lowest point in a decade. In 2014, 74% viewed the job situation as a top priority and 81% did so in 2010. Reducing the budget deficit also has declined among the public’s policy priorities. Currently, just 48% say cutting the deficit should be a top policy priority for the president and Congress, down from 63% in 2014. A year earlier, in 2013, the share citing the deficit as a top priority was high as at any point in the past two decades (72%).",good
mturk_charts/no_data/multi_col/5754.png,"The goal of addressing drug addiction has increased in importance among members of both parties. Nearly half of Republicans (47%) say that dealing with addiction should be a top priority; this is up 15 points since early last year, when only about third (32%) of Republicans prioritized this issue.",good
mturk_charts/no_data/multi_col/5759.png,"The new survey, conducted Jan. 10-15 among 1,503 adults, finds that 29% say the tax law will have a mostly positive effect on them and their families, while nearly as many (27%) say its effect will be mostly negative. A third say the law will not have much of a personal impact. Opinions also are divided about the tax law’s impact on the country as a whole: 35% say the law will have a mostly positive effect on the country, 40% a mostly negative effect and 15% say it will have little effect.",good
mturk_charts/no_data/multi_col/5760.png,"Assessments of the law over the coming years vary widely by income as well. People with family incomes of $75,000 or more say the tax law’s personal impact will be more positive than negative. Those with lower incomes have less favorable expectations for the law. Nearly four-in-ten (38%) of those with incomes of at least $100,000 say the law will have a mostly positive personal impact, while just 20% expect negative effects (35% say it will not have much effect). Among those with incomes of $75,000-$99,999, 44% say the law’s personal impact will be mostly positive compared with 19% who say it will be mostly negative; 30% expect not much of an effect.",good
mturk_charts/no_data/multi_col/5761.png,"Among Republicans, in particular, there are sizable income differences in expectations for the law’s personal impact. A majority (62%) of Republicans and Republican leaners with incomes of $75,000 or more say the tax law will have a mostly positive impact on them and their families. That compares with 50% of Republicans with incomes between $40,000 and $74,999 and 43% of those with incomes below $40,000. Majorities of Republicans across income categories say the law will have a mostly positive impact on the country in coming years.",good
mturk_charts/no_data/multi_col/5762.png,"Overall, personal understanding of the tax law’s impact varies only modestly across demographic groups. However, those with more education feel they understand how the law might affect them better than those with less education. Partisan differences in understanding are modest: Republicans and Republican leaners (71%) are only somewhat more likely than Democrats and Democratic leaners (65%) to say they understand very or somewhat well how the law might affect them.",good
mturk_charts/no_data/multi_col/5765.png,"Much of the recent growth in the foreign-born black population has been fueled by African migration. Between 2000 and 2016, the black African immigrant population more than doubled, from 574,000 to 1.6 million. Africans now make up 39% of the overall foreign-born black population, up from 24% in 2000. Still, roughly half of all foreign-born blacks living in the U.S. in 2016 (49%) were from the Caribbean, with Jamaica and Haiti being the largest source countries.",good
mturk_charts/no_data/multi_col/5766.png,"Overall, black immigrants (28%) are somewhat less likely than the overall U.S. population (31%) to have a college degree or more, but black immigrants from Africa are more likely than Americans overall to have a college degree or higher. But educational attainment varies widely by country of origin. For example, 59% of foreign-born blacks from Nigeria have a bachelor’s or advanced degree – a share that is roughly double that of the overall population. By comparison, just 10% of black immigrants from Somalia have earned at least a bachelor’s degree.",good
mturk_charts/no_data/multi_col/5768.png,"Remittance flows decreased worldwide for a second consecutive year in 2016, the first back-to-back decline in over three decades, according to recently released data from the World Bank. Remittances to Latin America and the Caribbean, however, rose to a record high. Globally, migrants sent an estimated $574 billion to their home countries in 2016, a 1.4% drop from 2015. But in Latin America and the Caribbean – together making up a region where many people say economic conditions are bad – remittances rose to $74.3 billion, a 7.4% increase from the previous year ($69.2 billion). Europe was the only other region in the world to see an increase, and it was a much smaller one (up 0.9%).",good
mturk_charts/no_data/multi_col/5774.png,"As in the past, there are wide religious differences in Middle East sympathies. White evangelical Protestants continue to overwhelmingly sympathize with Israel: 78% say this, while just 5% sympathize more with the Palestinians. Other religious groups sympathize more with Israel than the Palestinians, though by much smaller margins. Religiously unaffiliated people are divided: 29% sympathize more with the Palestinians, 26% more with Israel and 24% say they side with both or neither.",good
mturk_charts/no_data/multi_col/5776.png,"Opinions of Israel’s prime minister, Benjamin Netanyahu, are basically unchanged from last year. About as many say they have a favorable view (31%) as an unfavorable opinion (28%) of Netanyahu; 41% express no opinion of Israel’s prime minister.",good
mturk_charts/no_data/multi_col/5775.png,"At this early point in his term, a plurality (42%) of Americans say that Trump is “striking the right balance” when it comes to Middle East policy. Three-in-ten (30%) say Trump favors Israel too much, while just 3% say Trump favors the Palestinians too much; 25% do not offer an opinion. Today, nearly half of Democrats (46%) say Trump favors Israel too much, while just 21% say he is striking the right balance. In 2010, more Republicans said Obama supported the Palestinians too much (38%) than said he struck the right balance.",good
