img_path,summary,question_resolution,question,answer_resolution,abstractive_answer,extractive_answer,decontextualizated_text_added,decontextualizated_text_removed,abstractive_text_added,abstractive_text_removed,extra_added_text,title,original_answer
mturk_charts/no_data_remaining/multi_col/1733.png,"The Supreme Court ’s decision in the case could impact how the public views the institution . Americans ’ views of the high court are near their lowest point in at least the past few decades . As the court has handed down decisions on highly politicized cases in recent years , it has seen ebbs and flows in support from Democrats and Republicans . For example , after the Supreme Court ruled to keep intact much of the health care law in summer 2012 , 64 % of Democrats said they viewed the court favorably , compared with just 38 % of Republicans . But after the court ’s session last June , which included a conservative victory on contraception in the Hobby Lobby case , the court ’s favorability rose to 53 % among Republicans and fell to 52 % among Democrats . Overall , we found in that survey last July , about half of the public ( 52 % ) had a favorable opinion of the Supreme Court and 38 % viewed it unfavorably .",same,How's the Supreme Court seen among the general public?,new_answer,About half of the public ( 52 % ) had a favorable opinion of the Supreme Court and 38 % viewed it unfavorably .,about half of the public ( 52 % ) had a favorable opinion of the Supreme Court and 38 % viewed it unfavorably .,,"The ’s decision in case could impact how views institution Americans ’ views high court are near their lowest point in at least past few decades As court has handed down decisions on highly politicized cases in recent years , has seen ebbs flows in support from Democrats Republicans For example , after ruled to keep intact much health care law in summer 2012 , 64 Democrats said they court favorably , compared with just Republicans But after court ’s session last June , which included conservative victory on contraception in Hobby Lobby case , court ’s favorability rose to 53 among Republicans fell to among Democrats Overall , we found in that survey last July ,",About,about, ,Supreme Court Favorability Ticked Back Supreme Down After Summer 2014 Rulings,"The Supreme Court ’s decision in the case could impact how the public views the institution . Americans ’ views of the high court are near their lowest point in at least the past few decades . As the court has handed down decisions on highly politicized cases in recent years , it has seen ebbs and flows in support from Democrats and Republicans . For example , after the Supreme Court ruled to keep intact much of the health care law in summer 2012 , 64 % of Democrats said they viewed the court favorably , compared with just 38 % of Republicans . But after the court ’s session last June , which included a conservative victory on contraception in the Hobby Lobby case , the court ’s favorability rose to 53 % among Republicans and fell to 52 % among Democrats . Overall , we found in that survey last July , about half of the public ( 52 % ) had a favorable opinion of the Supreme Court and 38 % viewed it unfavorably"
mturk_charts/no_data_remaining/multi_col/1734.png,"Though they tend not to get much attention from Beltway insiders , state legislatures are key players in redrawing congressional - district boundaries . In most states , it ’s the state legislature that takes the lead role in drawing new district maps , according to the National Conference of State Legislatures . ( Commissions do this job in 13 states and have advisory or backup roles in seven others , although the Supreme Court is currently weighing the legality of the commissions ’ task . ) Given the inherently political nature of redistricting , which party controls the legislature can be crucial to a state ’s final maps and thus , control of Congress . Democrats have “ suffered devastating losses at all levels of government ” over the past several election cycles , the DNC report noted . According to our analysis of NCSL data , the Democratic Party today has 919 fewer legislative seats than it did in 2009 . Democrats control both legislative chambers in just 11 states , down from 34 states in 1982 and 27 as recently as 2010 , though that number had fluctuated in the years in between . Meanwhile , Republicans have gained a total of 888 legislative seats since 2009 , and control both chambers in a record - high 30 states . In eight other states , each party controls one chamber .",same,Describe the divide in control over legislative chambers between Democrats and Republicans.,answer2,"Democrats control both legislative chambers in just 11 states , down from 34 states in 1982 and 27 as recently as 2010 , though that number had fluctuated in the years in between . Meanwhile , Republicans have gained a total of 888 legislative seats since 2009 , and control both chambers in a record - high 30 states . .","Democrats control both legislative chambers in just 11 states , down from 34 states in 1982 and 27 as recently as 2010 , though that number had fluctuated in the years in between . Meanwhile , Republicans have gained a total of 888 legislative seats since 2009 , and control both chambers in a record - high 30 states . .",,,,, ,Partisan Composition of State Legislatures Number of state legislatures REPUBLICANS CONTROL BOTH CHA MBERS DEMOCRATS CONTROL BOTH CHA MBERS 15 10 10,". Democrats control both legislative chambers in just 11 states , down from 34 states in 1982 and 27 as recently as 2010 , though that number had fluctuated in the years in between . Meanwhile , Republicans have gained a total of 888 legislative seats since 2009 , and control both chambers in a record - high 30 states ."
mturk_charts/no_data_remaining/multi_col/1736.png,"Another interesting historical trend is how opinions have evolved across generational groups . Namely , Baby Boomers ’ support for marijuana legalization peaked in the late 1970s , before plummeting in the 1980s during the nation ’s “ War on Drugs ” era . But today , Boomers ’ support for legalizing marijuana is greater than it was four decades ago . Even within the last decade , Millennials have shifted . In 2006 , just 34 % of Millennials favored the legal use of marijuana ; by 2014 , that share had risen to 69 % .",same,What is the opinion of Millennials in legalising the use of marijuana ?,answer1,"In 2006 , just 34 % of Millennials favored the legal use of marijuana ; by 2014 , that share had risen to 69 % .","In 2006 , just 34 % of Millennials favored the legal use of marijuana ; by 2014 , that share had risen to 69 % .",.,,,, ,Growing Support for Marijuana Legalization % saying use of marijuana should be made legal 69% Millennial born 1981-98,"In 2006 , just 34 % of Millennials favored the legal use of marijuana ; by 2014 , that share had risen to 69 %"
mturk_charts/no_data_remaining/multi_col/1737.png,"Hispanics are significantly more likely than whites to say the Earth is warming because of human activities and that the U.S. should do whatever it takes to protect the environment , a new Pew Research Center analysis finds . In a recent survey , we ask if there is solid evidence that the Earth has been warming over the past few decades . Seven - in - ten Hispanics say the Earth is warming because of human activity , a higher share than among whites ( 44 % ) . More than half ( 56 % ) of blacks say the same . About two - in - ten Hispanics and whites and a quarter of blacks say the Earth is warming because of natural patterns . Overall , a quarter of Americans say there is no solid evidence of global warming . Just 11 % of Hispanics and 17 % of blacks say there is no solid evidence the Earth is getting warmer , while 31 % of whites say the same .",same,What is the opinion of ethnic groups about global warming?,answer1,"Seven - in - ten Hispanics say the Earth is warming because of human activity , a higher share than among whites ( 44 % ) . More than half ( 56 % ) of blacks say the same . About two - in - ten Hispanics and whites and a quarter of blacks say the Earth is warming because of natural patterns . Just 11 % of Hispanics and 17 % of blacks say there is no solid evidence the Earth is getting warmer , while 31 % of whites say the same .","Seven - in - ten Hispanics say the Earth is warming because of human activity , a higher share than among whites ( 44 % ) . More than half ( 56 % ) of blacks say the same . About two - in - ten Hispanics and whites and a quarter of blacks say the Earth is warming because of natural patterns . Just 11 % of Hispanics and 17 % of blacks say there is no solid evidence the Earth is getting warmer , while 31 % of whites say the same .",About two and and quarter natural patterns Just 11 and 17 there no solid evidence getting warmer while 31,,,, ,Hispanics More Likely than Whites to Say Humans Have Warmed the Planet % of USS adults saying,"Seven - in - ten Hispanics say the Earth is warming because of human activity , a higher share than among whites ( 44 % ) . More than half ( 56 % ) of blacks say the same"
mturk_charts/no_data_remaining/multi_col/1738.png,"The survey finds that opinions of the 2010 health care law – which will soon face a major challenge in the Supreme Court – remain little changed : Public opinion continues to be closely divided , with views somewhat more negative than positive ( 53 % disapprove , 45 % approve ) . Americans remain split over the law ’s future : 50 % say the law ’s major provisions are “ probably here to stay ” while 45 % think they “ will probably be eliminated . ” The divided views of the law ’s fate also are largely unchanged over the past year . In April 2014 , 49 % said the law was probably here to stay while 43 % said it would probably be eliminated .",same,What is the trend in the public opinion about the health care law?,answer1,"The survey finds that opinions of the health care law remain little changed : Public opinion continues to be closely divided , with views somewhat more negative than positive ( 53 % disapprove , 45 % approve ) .","The survey finds that opinions of the health care law remain little changed : Public opinion continues to be closely divided , with views somewhat more negative than positive ( 53 % disapprove , 45 % approve ) .",) .,2010 – which will soon face a major challenge in Supreme Court –,,, ,No Change in Views of Health Care Law,"The survey finds that opinions of the 2010 health care law – which will soon face a major challenge in the Supreme Court – remain little changed : Public opinion continues to be closely divided , with views somewhat more negative than positive ( 53 % disapprove , 45 % approve"
mturk_charts/no_data_remaining/multi_col/1739.png,"Barack Obama ’s job approval is little changed over the last month , with Americans about equally likely to say they approve of his job performance ( 48 % ) as disapprove ( 46 % ) . But his current ratings reflect a shift in a positive direction from last year . Obama ’s rating among independents , in particular , has ticked higher in recent months ; 45 % of independents now approve of his job performance , similar to his rating last month ( 42 % ) , but significantly higher than in December ( 39 % ) and throughout much of 2014 .",same,How does the public currently view Obama?,same,Americans about equally likely to say they approve of his job performance ( 48 % ) as disapprove ( 46 % ) .,Americans about equally likely to say they approve of his job performance ( 48 % ) as disapprove ( 46 % ) .,,"Barack Obama ’s approval is little changed over the last month , with But current ratings reflect a shift in a positive direction from last year Obama ’s rating among independents , in particular , has ticked higher in recent months ; 45 independents now , similar rating last month 42 , but significantly higher than in December 39 and throughout much 2014",,, ,Obama's Job Approval of way Obama is handling his job,"Barack Obama ’s job approval is little changed over the last month , with Americans about equally likely to say they approve of his job performance ( 48 % ) as disapprove ( 46 % ) . But his current ratings reflect a shift in a positive direction from last year . Obama ’s rating among independents , in particular , has ticked higher in recent months ; 45 % of independents now approve of his job performance , similar to his rating last month ( 42 % ) , but significantly higher than in December ( 39 % ) and throughout much of 2014 ."
mturk_charts/no_data_remaining/multi_col/1740.png,"Currently 36 % approve of the job performance of Democratic leaders , while just 26 % approve of Republican leaders . Both ratings are slightly higher than they were last spring .",same,Describe the views of congressional leaders.,same,"Currently 36 % approve of the job performance of Democratic leaders , while just 26 % approve of Republican leaders .","Currently 36 % approve of the job performance of Democratic leaders , while just 26 % approve of Republican leaders .",,Both ratings are slightly higher than they were last spring,,, ,Views of Congressional Leaders % who approve of the way are handling theirjob,"Currently 36 % approve of the job performance of Democratic leaders , while just 26 % approve of Republican leaders . Both ratings are slightly higher than they were last spring ."
mturk_charts/no_data_remaining/multi_col/1741.png,"The new national survey by the Pew Research Center , conducted Feb. 18 - 22 among 1,504 adults , also finds a shift over the past year in public attitudes about the best approach for dealing with global terrorism . In the new survey , 47 % say “ using overwhelming military force is the best way to defeat terrorism around the world . ” About as many ( 46 % ) say that “ relying too much on military force to defeat terrorism creates hatred that leads to more terrorism . ” In the Pew Research Center ’s political typology survey , conducted Jan. 23 - Mar. 16 , 2014 , 57 % said an over - reliance on military force creates more hatred leading to increased terrorism , while fewer ( 37 % ) said that overwhelming military force is the best way to defeat global terrorism . There is a wide and growing partisan divide in these attitudes : Today , 74 % of Republicans say the best way to defeat global terrorism is with “ overwhelming force , ” up from 57 % a year ago . Meanwhile , Democrats ’ attitudes are virtually unchanged . Just 30 % of Democrats favor the use of overwhelming force to defeat terrorism ; 29 % said this last March .",same,What are the public views about the best approach for defeating global terrorism in 2015?,answer1,47 % say “ using overwhelming military force is the best way to defeat terrorism around the world . ” About as many ( 46 % ) say that “ relying too much on military force to defeat terrorism creates hatred that leads to more terrorism . ”,47 % say “ using overwhelming military force is the best way to defeat terrorism around the world . ” About as many ( 46 % ) say that “ relying too much on military force to defeat terrorism creates hatred that leads to more terrorism . ”,,"The new national survey by Pew Research Center , conducted Feb. 18 - 22 among 1,504 adults , also finds a shift over past year in public attitudes about approach for dealing with global In new survey , In Pew Research Center ’s political typology survey , conducted Jan. 23 - Mar. 16 , 2014 , 57 said an over - reliance leading increased , while fewer 37 said global There a wide and growing partisan divide in these attitudes : Today , 74 of Republicans global with , up from 57 a year ago",,, ,Shifting Views on Best Approach for Defeating Global Terrorism % who say,"The new national survey by the Pew Research Center , conducted Feb. 18 - 22 among 1,504 adults , also finds a shift over the past year in public attitudes about the best approach for dealing with global terrorism . In the new survey , 47 % say “ using overwhelming military force is the best way to defeat terrorism around the world . ” About as many ( 46 % ) say that “ relying too much on military force to defeat terrorism creates hatred that leads to more terrorism . ” In the Pew Research Center ’s political typology survey , conducted Jan. 23 - Mar. 16 , 2014 , 57 % said an over - reliance on military force creates more hatred leading to increased terrorism , while fewer ( 37 % ) said that overwhelming military force is the best way to defeat global terrorism . There is a wide and growing partisan divide in these attitudes : Today , 74 % of Republicans say the best way to defeat global terrorism is with “ overwhelming force , ” up from 57 % a year ago ."
mturk_charts/no_data_remaining/multi_col/1742.png,"However , most Americans ( 60 % ) think the U.S. effort against ISIS will definitely or probably succeed . A 45 % plurality say the U.S. and its allies will probably succeed against the Islamic militants in Iraq and Syria , while 15 % think they will definitely succeed . About one - third ( 34 % ) thinks the campaign will probably fail ( 28 % ) or definitely fail ( 5 % ) . Similar shares of Democrats ( 62 % ) and Republicans ( 61 % ) expect the to be a success .",same,How optimistic is the public about the U.S. campaign against ISIS?,answer1,"Most Americans ( 60 % ) think the U.S. effort against ISIS will definitely or probably succeed . A 45 % plurality say the U.S. and its allies will probably succeed against the Islamic militants in Iraq and Syria , while 15 % think they will definitely succeed . About one - third ( 34 % ) thinks the campaign will probably fail ( 28 % ) or definitely fail ( 5 % ) .","most Americans ( 60 % ) think the U.S. effort against ISIS will definitely or probably succeed . A 45 % plurality say the U.S. and its allies will probably succeed against the Islamic militants in Iraq and Syria , while 15 % think they will definitely succeed . About one - third ( 34 % ) thinks the campaign will probably fail ( 28 % ) or definitely fail ( 5 % ) .",,However Similar shares of Democrats 62 Republicans 61 expect to be a success,Most,most, ,"Public Cautiously Optimistic U.S. Campaign Against ISIS Will Succeed Overall, military do you think the US and its allies will in their military campaign vs Islamic militants in Iraq &Syria?","However , most Americans ( 60 % ) think the U.S. effort against ISIS will definitely or probably succeed . A 45 % plurality say the U.S. and its allies will probably succeed against the Islamic militants in Iraq and Syria , while 15 % think they will definitely succeed . About one - third ( 34 % ) thinks the campaign will probably fail ( 28 % ) or definitely fail ( 5 % ) . Similar shares of Democrats ( 62 % ) and Republicans ( 61 % ) expect the to be a success ."
mturk_charts/no_data_remaining/multi_col/1743.png,"As fighting continues in eastern Ukraine between government forces and Russian - backed rebels , the public has become more supportive of sending arms to the Ukrainian government and increasing sanctions on Russia . More still oppose ( 53 % ) than favor ( 41 % ) the U.S. sending arms and military supplies to the Ukrainian government , but support for arming Ukraine is up 11 points since April 2014 , when opposition outweighed support by about two - to - one ( 30 % favored , 62 % opposed ) . The latest national survey by the Pew Research Center , conducted Feb. 18 - 22 among 1,504 adults , finds the public is split over whether the U.S. should provide training to Ukrainian troops : 49 % say they would favor this , while 46 % are opposed .",same,Describe the support for the U.S. sending arms to Ukraine since 2014.,answer2,"More still oppose ( 53 % ) than favor ( 41 % ) the U.S. sending arms and military supplies to the Ukrainian government , but support for arming Ukraine is up 11 points since April 2014 , when opposition outweighed support by about two - to - one ( 30 % favored , 62 % opposed ) .","More still oppose ( 53 % ) than favor ( 41 % ) the U.S. sending arms and military supplies to the Ukrainian government , but support for arming Ukraine is up 11 points since April 2014 , when opposition outweighed support by about two - to - one ( 30 % favored , 62 % opposed ) .",.,,,, ,"More Support Providing Arms to the % favor/oppose US sending arms, military supplies","More still oppose ( 53 % ) than favor ( 41 % ) the U.S. sending arms and military supplies to the Ukrainian government , but support for arming Ukraine is up 11 points since April 2014 , when opposition outweighed support by about two - to - one ( 30 % favored , 62 % opposed )"
mturk_charts/no_data_remaining/multi_col/1744.png,"Compared with gay men and lesbians , bisexuals have a different perspective on their sexual orientation and a distinct set of experiences , according to a 2013 Pew Research Center survey of nearly 1,200 lesbian , gay , bisexual and transgender adults . Bisexuals are much less likely than gay men and lesbians to say that their sexual orientation is an important part of who they are . Only 20 % of bisexuals say being bisexual is extremely or very important to their overall identity . The shares of gay men ( 48 % ) and lesbians ( 50 % ) who say the same about their sexual orientations are much higher . ( Due to the small number of transgender adults in the survey , it ’s not possible to break out their responses . However , they are included in the total LGBT shares reported here . )",same,"How important do bisexuals feel being LGBT is to their identify, compared to other LGBT adults?",answer2,Bisexuals are much less likely than gay men and lesbians to say that their sexual orientation is an important part of who they are . Only 20 % of bisexuals say being bisexual is extremely or very important to their overall identity .,Bisexuals are much less likely than gay men and lesbians to say that their sexual orientation is an important part of who they are . Only 20 % of bisexuals say being bisexual is extremely or very important to their overall identity .,,The shares ( 48 ) ( 50 ) the same about orientations higher,,, ,"Bisexuals Less Likely to Say Sexual Orientation is Important Say to Their Identity Percent who say being LGBT is important to their overall identity Notes: Based on all LGBT (N=1,197). Resi ponses for",Bisexuals are much less likely than gay men and lesbians to say that their sexual orientation is an important part of who they are . Only 20 % of bisexuals say being bisexual is extremely or very important to their overall identity . The shares of gay men ( 48 % ) and lesbians ( 50 % ) who say the same about their sexual orientations are much higher .
mturk_charts/no_data_remaining/multi_col/1748.png,"There has been considerable interest in specific demographic breakdowns of the general public ’s answers to science - related questions that Pew Research covered in its recent report on science issues and the gaps between citizens and scientists ’ opinions on a range of issues . Here are additional demographic breakdowns of views among the general public based on a nationally representative survey of 2,002 U.S. adults conducted August 15 - 25 , 2014 . By a 57%-37 % margin , the public believes that genetically - modified foods ( GM foods ) are generally unsafe to eat . This is a major contrast with scientists Pew Research surveyed . Some 3,748 U.S.-based members of the AAAS were surveyed from September 11 to October 13 , 2014 and they said such foods were generally safe to eat by an 88%-11 % margin . The nearby chart of the data from the survey of the general public shows several patterns . Those more likely to think genetically modified food is unsafe include : women , African - Americans and Hispanics , and those without college degrees .",same,What is the opinion of public about genetically modified food?,answer1,"By a 57%-37 % margin , the public believes that genetically - modified foods ( GM foods ) are generally unsafe to eat .","By a 57%-37 % margin , the public believes that genetically - modified foods ( GM foods ) are generally unsafe to eat .",.,,,, ,"Views on Safety of Genetically Modified Foods, by Key Demographics % of U.S. adults who say itisgenerally safe or unsafe to eat genetically modifedfoods Generally unsafe Generally safe","By a 57%-37 % margin , the public believes that genetically - modified foods ( GM foods ) are generally unsafe to eat"
mturk_charts/no_data_remaining/multi_col/1749.png,"Two - thirds ( 67 % ) of adults say scientists do not have a clear understanding , while 28 % say scientists have a clear understanding of the health effects . Those more likely to think scientists do not have a clear understanding of the health effects of GM crops include : women and older Americans . Non - Hispanic whites and blacks are more likely than Hispanics to say scientists do not have a clear understanding of this .",same,What is the opinion of the U.S adults about the scientist understanding of health effects of genetically modified crops?,same,"Two - thirds ( 67 % ) of adults say scientists do not have a clear understanding , while 28 % say scientists have a clear understanding of the health effects .","Two - thirds ( 67 % ) of adults say scientists do not have a clear understanding , while 28 % say scientists have a clear understanding of the health effects .",.,,,, ,Views on Scientific Understanding of GM crops understanding % of U.S. adults who say scientists have a clear/not clear understanding of the health effects of GM crops,"Two - thirds ( 67 % ) of adults say scientists do not have a clear understanding , while 28 % say scientists have a clear understanding of the health effects"
