img_path,summary,question_resolution,question,answer_resolution,abstractive_answer,extractive_answer,decontextualizated_text_added,decontextualizated_text_removed,abstractive_text_added,abstractive_text_removed,extra_added_text,title,original_answer
mturk_charts/no_data_remaining/multi_col/1929.png,"Hispanics are the only major racial or ethnic group to see a statistically significant decline in its poverty rate , according to 2013 Census Bureau figures released this week . The drop in the poverty rate among Hispanics – from 25.6 % in 2012 to 23.5 % in 2013 – contributed to the first decline in the nation ’s overall poverty rate since 2006 . Hispanics also were the only group to see a decline in the number of people living in poverty ( the year - to - year changes in the overall U.S. number was not statistically different . ) From 2012 to 2013 , the number of Hispanics in poverty dropped from 13.6 million to 12.7 million , even as the Hispanic population grew by 1 million over the same time period .",same,Describe the poverty rates of Hispanics over the past years.,new_answer,Hispanics are the only major racial or ethnic group to see a statistically significant decline in its poverty rate . The drop in the poverty rate among Hispanics – from 25.6 % in 2012 to 23.5 % in 2013 – contributed to the first decline in the nation ’s overall poverty rate since 2006 . Hispanics also were the only group to see a decline in the number of people living in poverty .,Hispanics are the only major racial or ethnic group to see a statistically significant decline in its poverty rate . The drop in the poverty rate among Hispanics – from 25.6 % in 2012 to 23.5 % in 2013 – contributed to the first decline in the nation ’s overall poverty rate since 2006 . Hispanics also were the only group to see a decline in the number of people living in poverty .,,", according Census Bureau figures released this week ( year - - year changes U.S. was not different ) From , dropped 13.6 million 12.7 million , even as Hispanic population grew by 1 million over same time period",,, ,Hispanic Poverty Rate Declines Black 27.2% Hispanic 23,"Hispanics are the only major racial or ethnic group to see a statistically significant decline in its poverty rate , according to 2013 Census Bureau figures released this week . The drop in the poverty rate among Hispanics – from 25.6 % in 2012 to 23.5 % in 2013 – contributed to the first decline in the nation ’s overall poverty rate since 2006 . Hispanics also were the only group to see a decline in the number of people living in poverty ( the year - to - year changes in the overall U.S. number was not statistically different . ) From 2012 to 2013 , the number of Hispanics in poverty dropped from 13.6 million to 12.7 million , even as the Hispanic population grew by 1 million over the same time period ."
mturk_charts/no_data_remaining/multi_col/1930.png,"A new report released today by the Pew Research Center shows how the values Americans bring to parenting are strongly linked to their own ideological leanings . But aside from ideology , the survey finds widespread agreement among parents over the traits that children should be taught . Fully 94 % of parents say it is important to teach children responsibility , while nearly as many ( 92 % ) say the same about hard work . Helpfulness , good manners and independence also are widely viewed as important for children to learn , according to the survey . When parents were asked which traits they considered to be “ most important ” to teach children , the same ones topped the list , with one exception — while only 56 % of parents say passing on religious faith is important , fully 31 % say this is one of the most important things to teach children . That makes teaching religious faith the third most important trait , behind responsibility and hard work .",same,Describe the values parents find the most important to teach their children.,answer2,"Fully 94 % of parents say it is important to teach children responsibility , while nearly as many ( 92 % ) say the same about hard work . Helpfulness , good manners and independence also are widely viewed as important for children to learn .","Fully 94 % of parents say it is important to teach children responsibility , while nearly as many ( 92 % ) say the same about hard work . Helpfulness , good manners and independence also are widely viewed as important for children to learn .",Helpfulness good manners and independence also are widely viewed for learn,,,, ,"Parents See Responsibility, Hard Work as Most Important to Teach Children % of parents saying each is 'especially importantto teach children' Most important NET Importa nt","Fully 94 % of parents say it is important to teach children responsibility , while nearly as many ( 92 % ) say the same about hard work ."
mturk_charts/no_data_remaining/multi_col/1934.png,"Developing countries provide the strongest support across the board for foreign investment , trade and the benefits to be derived from globalization . A median of 87 % of those surveyed in the developing world say trade is good for the economy , including 47 % who say it is very good . Fully 85 % see foreign companies building plants in their country as beneficial . In addition , 66 % say growing international business ties create jobs and 57 % say foreign companies buying domestic companies is good . And 55 % voice the view that trade increases wages . A median of 78 % in emerging markets see trade as beneficial , including 25 % who say it is very good . And 52 % say trade creates jobs , while a plurality believes it leads to higher wages ( 45 % ) . Such emerging market sentiment may reflect the experience in China and elsewhere , where growing international business ties have been associated with more employment opportunities and higher incomes . While 84 % in advanced economies say trade is good for their country , there is less enthusiasm . Only 44 % voice the view that trade boosts employment and just 25 % say it leads to higher wages . Such opinions are likely the casualty of the convergence of globalization with slow economic growth , high unemployment and stagnating incomes in these nations .",same,How do developing countries feel about globalisation?,answer1,"Developing countries provide the strongest support across the board for foreign investment , trade and the benefits to be derived from globalization . A median of 87 % of those surveyed in the developing world say trade is good for the economy . Fully 85 % see foreign companies building plants in their country as beneficial . In addition , 66 % say growing international business ties create jobs and 57 % say foreign companies buying domestic companies is good . And 55 % voice the view that trade increases wages .","Developing countries provide the strongest support across the board for foreign investment , trade and the benefits to be derived from globalization . A median of 87 % of those surveyed in the developing world say trade is good for the economy . Fully 85 % see foreign companies building plants in their country as beneficial . In addition , 66 % say growing international business ties create jobs and 57 % say foreign companies buying domestic companies is good . And 55 % voice the view that trade increases wages .",,including 47 who it very 78 emerging markets including 25 who it very 52 creates while a plurality believes it leads higher ( 45 ) Such emerging market sentiment may reflect experience China elsewhere where have been associated with more employment opportunities higher incomes While 84 advanced economies there less enthusiasm Only 44 boosts employment just 25 it leads higher,,, ,Developing Nations Are Generally More Positive about Certain Trade Benefits,"Developing countries provide the strongest support across the board for foreign investment , trade and the benefits to be derived from globalization . A median of 87 % of those surveyed in the developing world say trade is good for the economy , including 47 % who say it is very good . Fully 85 % see foreign companies building plants in their country as beneficial . In addition , 66 % say growing international business ties create jobs and 57 % say foreign companies buying domestic companies is good . And 55 % voice the view that trade increases wages . A median of 78 % in emerging markets see trade as beneficial , including 25 % who say it is very good . And 52 % say trade creates jobs , while a plurality believes it leads to higher wages ( 45 % ) . Such emerging market sentiment may reflect the experience in China and elsewhere , where growing international business ties have been associated with more employment opportunities and higher incomes . While 84 % in advanced economies say trade is good for their country , there is less enthusiasm . Only 44 % voice the view that trade boosts employment and just 25 % say it leads to higher wages"
mturk_charts/no_data_remaining/multi_col/1935.png,"Some of the greatest public skepticism about trade and foreign investment is found in the United States . In 2002 , 78 % of Americans held the view that growing trade and business ties with other countries was a good thing . This sentiment was roughly comparable to that voiced at the time in the other 14 nations surveyed every year between 2002 and 2014 .",same,What are the opinions of Americans about growing trade and business with other countries?,answer1,"In 2002 , 78 % of Americans held the view that growing trade and business ties with other countries was a good thing .","In 2002 , 78 % of Americans held the view that growing trade and business ties with other countries was a good thing .",,Some greatest public skepticism about foreign investment is found in United States This sentiment roughly comparable to voiced at time in 14 nations surveyed every year between 2014,,, ,Americans Less Convinced Trade Is Growing trade and business ties with other countries are a good thing,"Some of the greatest public skepticism about trade and foreign investment is found in the United States . In 2002 , 78 % of Americans held the view that growing trade and business ties with other countries was a good thing . This sentiment was roughly comparable to that voiced at the time in the other 14 nations surveyed every year between 2002 and 2014 ."
mturk_charts/no_data_remaining/multi_col/1944.png,"At the same time , there has been a substantial drop in the public ’s ratings of the government ’s efforts to reduce terrorism . Though a 56 % majority says the government is doing very well or fairly well , this is a 16 - point decline from last November . About four - in - ten ( 42 % ) say the government is doing not too well or not at all well , which nears the post-9/11 high of 44 % in early 2007 .",same,How does the public rate the government's performance in reducing the threat of terrorism?,answer2,A 56 % majority says the government is doing very well or fairly well . About four - in - ten ( 42 % ) say the government is doing not too well or not at all well .,a 56 % majority says the government is doing very well or fairly well . About four - in - ten ( 42 % ) say the government is doing not too well or not at all well .,,"Though , this 16 point decline from last November , which nears post-9/11 high of 44 early 2007",A,a, ,Less Positive Rating for Gov't Efforts to Reduce Threat of Terrorism % rating gov'tjob in reducing threatof terrorism,"Though a 56 % majority says the government is doing very well or fairly well , this is a 16 - point decline from last November . About four - in - ten ( 42 % ) say the government is doing not too well or not at all well , which nears the post-9/11 high of 44 % in early 2007 ."
mturk_charts/no_data_remaining/multi_col/1945.png,"Republican dissatisfaction has nearly doubled since last fall , from 30 % then to 58 % today saying the government is not doing a good job . Since last year , the share of Democrats saying this has increased only modestly , from 20 % to 26 % . During the Obama era , Republicans consistently have given lower marks than Democrats to the government ’s anti - terrorism efforts . However , the partisan gap was even greater ( and in the opposite direction ) late in George W. Bush ’s tenure ; in 2007 , 62 % of Democrats rated the government ’s job in the reducing terrorism as not good , compared with just 16 % of Republicans .",same,Compare the partisan views of the government's anti-terrorism efforts in recent years.,answer1,"Republican dissatisfaction has nearly doubled since last fall , from 30 % then to 58 % today saying the government is not doing a good job . Since last year , the share of Democrats saying this has increased only modestly , from 20 % to 26 % .","Republican dissatisfaction has nearly doubled since last fall , from 30 % then to 58 % today saying the government is not doing a good job . Since last year , the share of Democrats saying this has increased only modestly , from 20 % to 26 % .",,During Obama era Republicans consistently have given lower marks than ’s anti - terrorism efforts However partisan gap was even greater ( and in opposite direction ) late in George W. Bush ’s tenure ; in 2007 62 rated ’s in reducing terrorism as compared with just 16 Republicans,,, ,Republican Much More Negative about Gov't Anti-Terrorism Efforts % saying gov't is doing not too/not at all well in reducing the threatof terrorism,"Republican dissatisfaction has nearly doubled since last fall , from 30 % then to 58 % today saying the government is not doing a good job . Since last year , the share of Democrats saying this has increased only modestly , from 20 % to 26 % . During the Obama era , Republicans consistently have given lower marks than Democrats to the government ’s anti - terrorism efforts . However , the partisan gap was even greater ( and in the opposite direction ) late in George W. Bush ’s tenure ; in 2007 , 62 % of Democrats rated the government ’s job in the reducing terrorism as not good , compared with just 16 % of Republicans ."
mturk_charts/no_data_remaining/multi_col/1946.png,"In addition , a growing share of the public expresses concerns that the government ’s anti - terrorism policies have not gone far enough to adequately protect the country ( 50 % ) rather than going too far in restricting the average person ’s civil liberties ( 35 % ) . This is a shift from when this question was asked last year after revelations about the NSA ’s domestic surveillance program . Pluralities then said they were more concerned that the government had gone too far ( 47 % in July and 44 % in November ) . Today , the balance of opinion is similar to the public ’s views in late 2010 .",same,Describe the concerns of the public about the government's anti-terrorism policies.,answer1,A growing share of the public expresses concerns that the government ’s anti - terrorism policies have not gone far enough to adequately protect the country ( 50 % ) rather than going too far in restricting the average person ’s civil liberties ( 35 % ) .,a growing share of the public expresses concerns that the government ’s anti - terrorism policies have not gone far enough to adequately protect the country ( 50 % ) rather than going too far in restricting the average person ’s civil liberties ( 35 % ) .,,"In addition , This is shift from when this question was asked last year after revelations about NSA domestic surveillance program Pluralities then said they were more concerned had 47 July and 44 November Today , balance opinion is similar views late 2010",A,a, ,Shifting Public Views on Balance Between Security and Civil Liberties Bigger concern about gov't fanti- -terrorism policies?,"In addition , a growing share of the public expresses concerns that the government ’s anti - terrorism policies have not gone far enough to adequately protect the country ( 50 % ) rather than going too far in restricting the average person ’s civil liberties ( 35 % ) . This is a shift from when this question was asked last year after revelations about the NSA ’s domestic surveillance program . Pluralities then said they were more concerned that the government had gone too far ( 47 % in July and 44 % in November ) . Today , the balance of opinion is similar to the public ’s views in late 2010 ."
mturk_charts/no_data_remaining/multi_col/1947.png,"An increasing share of the public believes that Islam is more likely than other religions to encourage violence among its believers , reaching a high since 2002 . Currently , 50 % say Islam encourages violence more than other religions , up from 43 % in July and 38 % in February . Republicans continue to be more likely than Democrats to say Islam encourages violence more than other religions . But increasing shares of both parties express this view . Among Republicans , two - thirds ( 67 % ) say Islam is more likely to encourage violence — up 13 points since February ; just 23 % say Islam does not encourage violence more than others . About four - in - ten Democrats ( 42 % ) say Islam is more likely to encourage violence — up 14 points — while 48 % say it is not more likely .",same,Describe the trend in public views on the relationship between Islamic religion and violence.,new_answer,"An increasing share of the public believes that Islam is more likely than other religions to encourage violence among its believers , reaching a high since 2002 . Currently , 50 % say Islam encourages violence more than other religions , up from 43 % in July and 38 % in February .","An increasing share of the public believes that Islam is more likely than other religions to encourage violence among its believers , reaching a high since 2002 . Currently , 50 % say Islam encourages violence more than other religions , up from 43 % in July and 38 % in February .",,Republicans continue be Democrats But shares both parties express this view Among Republicans two - thirds ( 67 ) — 13 points ; just 23 does not others About four - - ten Democrats ( 42 ) — 14 points — while 48 it not,,, ,Is the Islamic Religion More Likely than Others to Encourage Violence? % saying Islam is Not More likely to encourage violence violence,"An increasing share of the public believes that Islam is more likely than other religions to encourage violence among its believers , reaching a high since 2002 . Currently , 50 % say Islam encourages violence more than other religions , up from 43 % in July and 38 % in February . Republicans continue to be more likely than Democrats to say Islam encourages violence more than other religions . But increasing shares of both parties express this view . Among Republicans , two - thirds ( 67 % ) say Islam is more likely to encourage violence — up 13 points since February ; just 23 % say Islam does not encourage violence more than others . About four - in - ten Democrats ( 42 % ) say Islam is more likely to encourage violence — up 14 points — while 48 % say it is not more likely"
mturk_charts/no_data_remaining/multi_col/1948.png,"The Optimists Club : The countries with the rosiest views of the next year are those with emerging or developing economies . Eight - in - ten Chinese ( 80 % ) expect their economy to get better over the next 12 months , as do roughly three - quarters of Peruvians ( 77 % ) and Vietnamese ( 74 % ) . Seven - in - ten or more Senegalese ( 73 % ) , Nigerians ( 72 % ) , Indians ( 71 % ) and Colombians ( 70 % ) are similarly upbeat . Notably , economic forecasters at the International Monetary Fund ( IMF ) expect little improvement in most of these economies over the next year . The striking exceptions are India , where the IMF foresees the economy accelerating from 5.4 % in 2014 to 6.4 % in 2015 , confirming public expectations , and China , where public optimism is at odds with an IMF prediction that the economy will actually slow slightly , from 7.4 % in 2014 to 7.1 % in 2015 . The Pessimists Club : More than half of Greeks ( 53 % ) anticipate economic conditions worsening over the next 12 months , ( another 26 % expect the Greek economy to remain the same , which , in a nation where the economy shrank by -3.9 % in 2013 is hardly a vote of confidence ) . In addition , 48 % of the French expect their economy to deteriorate , as do 46 % of Lebanese and 44 % of Palestinians . Greek pessimists , however , may be pleasantly surprised : the IMF foresees the Greek economy improving from 0.6 % growth in 2014 to 2.9 % in 2015 . Similarly , while less than half the Lebanese expect more hard times , the IMF forecasts Lebanon ’s economy to accelerate from 1 % growth in 2014 to 2.5 % in 2015 .",same,Describe the countries that the most optimistic about their country's future economic situation.,answer1,"The countries with the rosiest views of the next year are those with emerging or developing economies . Eight - in - ten Chinese ( 80 % ) expect their economy to get better over the next 12 months , as do roughly three - quarters of Peruvians ( 77 % ) and Vietnamese ( 74 % ) . Seven - in - ten or more Senegalese ( 73 % ) , Nigerians ( 72 % ) , Indians ( 71 % ) and Colombians ( 70 % ) are similarly upbeat .","The countries with the rosiest views of the next year are those with emerging or developing economies . Eight - in - ten Chinese ( 80 % ) expect their economy to get better over the next 12 months , as do roughly three - quarters of Peruvians ( 77 % ) and Vietnamese ( 74 % ) . Seven - in - ten or more Senegalese ( 73 % ) , Nigerians ( 72 % ) , Indians ( 71 % ) and Colombians ( 70 % ) are similarly upbeat .",,Optimists Club : Notably economic forecasters at International Monetary Fund IMF little improvement most these striking exceptions India where IMF foresees accelerating from 5.4 2014 6.4 2015 confirming public expectations China where public optimism is at odds an IMF prediction that will actually slow slightly from 7.4 2014 7.1 2015 Pessimists Club : More than half Greeks 53 anticipate economic conditions worsening another 26 Greek remain same which a nation where shrank by -3.9 2013 is hardly a vote confidence In addition 48 French deteriorate 46 Lebanese 44 Palestinians Greek pessimists however may be pleasantly surprised : IMF foresees Greek improving from 0.6 growth 2014 2.9 2015 Similarly while less than half Lebanese hard times IMF forecasts Lebanon ’s accelerate from 1 growth 2014 2.5 2015,,, ,Differing Economic Outlooks Future among Nations on Economic Future Percent saying they expect the economic situation over the next 12 months in their country to improve Most optimistic countries Most pessimistic countries 53% Greece,"The Optimists Club : The countries with the rosiest views of the next year are those with emerging or developing economies . Eight - in - ten Chinese ( 80 % ) expect their economy to get better over the next 12 months , as do roughly three - quarters of Peruvians ( 77 % ) and Vietnamese ( 74 % ) . Seven - in - ten or more Senegalese ( 73 % ) , Nigerians ( 72 % ) , Indians ( 71 % ) and Colombians ( 70 % ) are similarly upbeat . Notably , economic forecasters at the International Monetary Fund ( IMF ) expect little improvement in most of these economies over the next year . The striking exceptions are India , where the IMF foresees the economy accelerating from 5.4 % in 2014 to 6.4 % in 2015 , confirming public expectations , and China , where public optimism is at odds with an IMF prediction that the economy will actually slow slightly , from 7.4 % in 2014 to 7.1 % in 2015 . The Pessimists Club : More than half of Greeks ( 53 % ) anticipate economic conditions worsening over the next 12 months , ( another 26 % expect the Greek economy to remain the same , which , in a nation where the economy shrank by -3.9 % in 2013 is hardly a vote of confidence ) . In addition , 48 % of the French expect their economy to deteriorate , as do 46 % of Lebanese and 44 % of Palestinians . Greek pessimists , however , may be pleasantly surprised : the IMF foresees the Greek economy improving from 0.6 % growth in 2014 to 2.9 % in 2015 . Similarly , while less than half the Lebanese expect more hard times , the IMF forecasts Lebanon ’s economy to accelerate from 1 % growth in 2014 to 2.5 % in 2015"
mturk_charts/no_data_remaining/multi_col/1949.png,This includes 64 % of those surveyed in advanced economies and 59 % in emerging markets . Only in developing economies is there some semblance of satisfaction with economic performance : 51 % voice the view that their economy is doing well .,same,How do developing economies perceive their economic situation?,answer1,In developing economies is there some semblance of satisfaction with economic performance : 51 % voice the view that their economy is doing well .,in developing economies is there some semblance of satisfaction with economic performance : 51 % voice the view that their economy is doing well .,,This includes 64 those surveyed advanced and 59 emerging markets Only,In,in, ,Economic Mood Glum in Advanced and Emerging Economies The currenteconomic situation in our country is,This includes 64 % of those surveyed in advanced economies and 59 % in emerging markets . Only in developing economies is there some semblance of satisfaction with economic performance : 51 % voice the view that their economy is doing well
