img_path,"summary",question_resolution,"question",answer_resolution,"abstractive_answer","extractive_answer","decontextualizated_text_added","decontextualizated_text_removed","extra_added_text"
mturk_charts/no_data/multi_col/7120.png,"Millennials – whether living with their parents or not – are moving significantly less often than earlier generations of young adults . Among 25- to 35 - year - old Millennials who were living at home in 2016 , 91 % reported that they resided at the same address one year earlier . This does not preclude the possibility that the young adult moved out and “ boomeranged ” back in the intervening year ( perhaps multiple times ) ; the data simply indicate that they lived with their parent or parents one year earlier as well .",same,"How do the Millennials live?",answer1,"Millennials – whether living with their parents or not – are moving significantly less often than earlier generations of young adults . Among 25- to 35 - year - old Millennials who were living at home in 2016 , 91 % reported that they resided at the same address one year earlier . This does not preclude the possibility that the young adult moved out and “ boomeranged ” back in the intervening year ( perhaps multiple times ) ; the data simply indicate that they lived with their parent or parents one year earlier as well .","Millennials – whether living with their parents or not – are moving significantly less often than earlier generations of young adults . Among 25- to 35 - year - old Millennials who were living at home in 2016 , 91 % reported that they resided at the same address one year earlier . This does not preclude the possibility that the young adult moved out and “ boomeranged ” back in the intervening year ( perhaps multiple times ) ; the data simply indicate that they lived with their parent or parents one year earlier as well .","","",""
mturk_charts/no_data/multi_col/7131.png,"The public continues to express frustration with the federal government , rather than anger or contentment . A majority of Americans say frustration ( 55 % ) best describes their feeling toward the federal government , while about two - in - ten say they are angry ( 22 % ) ; a similar share ( 19 % ) say they are basically content . Overall , attitudes toward the federal government today are virtually identical to a year ago . In March 2016 , 57 % said they felt frustrated with the federal government , while 21 % said they were angry and 20 % said they were basically content .",same,"What is the distribution of people who are frustrated against the government?",answer2,"A majority of Americans say frustration ( 55 % ) best describes their feeling toward the federal government , while about two - in - ten say they are angry ( 22 % ) ; a similar share ( 19 % ) say they are basically content","A majority of Americans say frustration ( 55 % ) best describes their feeling toward the federal government , while about two - in - ten say they are angry ( 22 % ) ; a similar share ( 19 % ) say they are basically content","","",""
mturk_charts/no_data/multi_col/7133.png,"Overall , 41 % say they have quite a lot of confidence in the future of the U.S. , while another 30 % say they have some confidence . About three - in - ten ( 28 % ) say they have very little or no confidence at all in the future of the U.S.",same,"What is the distribution of the Republicans' confidence about the U.S future?",same,"Overall , 41 % say they have quite a lot of confidence in the future of the U.S. , while another 30 % say they have some confidence . About three - in - ten ( 28 % ) say they have very little or no confidence at all in the future of the U.S.","Overall , 41 % say they have quite a lot of confidence in the future of the U.S. , while another 30 % say they have some confidence . About three - in - ten ( 28 % ) say they have very little or no confidence at all in the future of the U.S.","","",""
mturk_charts/no_data/multi_col/6006.png,"Guatemalan immigrants around the world sent home $ 7.5 billion in remittances in 2016 , while Salvadorans sent $ 4.6 billion and Hondurans $ 3.9 billion , according to World Bank data . The vast majority of the money came from immigrants in the U.S.",same,"How is financial support do the Guatemalan immigrants send home?",answer2,"Guatemalan immigrants around the world sent home $ 7.5 billion in remittances in 2016","Guatemalan immigrants around the world sent home $ 7.5 billion in remittances in 2016","","",""
mturk_charts/no_data/multi_col/6013.png,"In Turkey , 79 % of Muslims who observe the five daily prayers ( salah ) that are required under Islam say life is better for people like them compared with 50 years ago . In contrast , only about half ( 49 % ) of Turkish Muslims who pray seldom or never at all see the same progress . These divergent views may in part reflect differences in opinion about President Recep Erdogan and his religiously conservative AKP party . In Nigeria – home to both Muslims and Christians , but now governed by an elected Muslim leader – Muslims are much more enthusiastic about their country ’s progress . Nearly three times as many Nigerian Muslims as Christians ( 62 % vs. 22 % ) say life is better today compared with 50 years ago . In Israel , 50 years after the Jewish State was victorious in the Six - Day War against a coalition of Arab nations , Israeli Jews are far more convinced than Israeli Arabs that life today is better for people like them . Nearly six - in - ten Jews in Israel say life has improved , compared with only a third of Israeli Arabs who see similar progress .",same,"What are the views about life in some countries after 50 years?",answer2,"In Turkey , 79 % of Muslims who observe the five daily prayers ( salah ) that are required under Islam say life is better for people like them compared with 50 years ago . only about half ( 49 % ) of Turkish Muslims who pray seldom or never at all see the same progress . In Nigeria , nearly three times as many Nigerian Muslims as Christians ( 62 % vs. 22 % ) say life is better today compared with 50 years ago . Nearly six - in - ten Jews in Israel say life has improved , compared with only a third of Israeli Arabs who see similar progress","In Turkey , 79 % of Muslims who observe the five daily prayers ( salah ) that are required under Islam say life is better for people like them compared with 50 years ago . only about half ( 49 % ) of Turkish Muslims who pray seldom or never at all see the same progress . In Nigeria Nearly three times as many Nigerian Muslims as Christians ( 62 % vs. 22 % ) say life is better today compared with 50 years ago . Nearly six - in - ten Jews in Israel say life has improved , compared with only a third of Israeli Arabs who see similar progress","half 49 Turkish pray seldom or never at all same","– home to both and but now governed by an elected Muslim leader – much more enthusiastic their country ’s","In Turkey , 79 % of Muslims who observe the five daily prayers ( salah ) that are required under Islam say life is better for people like them compared with 50 years ago . only about half ( 49 % ) of Turkish Muslims who pray seldom or never at all see the same progress . In Nigeria , nearly three times as many Nigerian Muslims as Christians ( 62 % vs. 22 % ) say life is better today compared with 50 years ago . Nearly six - in - ten Jews in Israel say life has improved , compared with only a third of Israeli Arabs who see similar progress"
mturk_charts/no_data/multi_col/6008.png,"At a country level , some of the most positive assessments of progress over the past 50 years are found in Vietnam ( 88 % say life is better today ) , India ( 69 % ) and South Korea ( 68 % ) – all societies that have seen dramatic economic transformations since the late 1960s , not to mention the end of armed conflict in the case of Vietnam . A majority in Turkey ( 65 % better ) also share a sense of progress over the past five decades . In some of the more developed countries , publics also report that life is better today , including 65 % in Japan and Germany , and 64 % in the Netherlands and Sweden .",same,"How does a country's assessment of progress change over the past 50 years?",answer1,"At a country level , some of the most positive assessments of progress over the past 50 years are found in Vietnam ( 88 % say life is better today ) , India ( 69 % ) and South Korea ( 68 % ) . A majority in Turkey ( 65 % better ) also share a sense of progress over the past five decades In some developed countries , publics also report that life is better today , including 65 % in Japan and Germany , and 64 % in the Netherlands and Sweden .","At a country level , some of the most positive assessments of progress over the past 50 years are found in Vietnam ( 88 % say life is better today ) , India ( 69 % ) and South Korea ( 68 % ) . A majority in Turkey ( 65 % better ) also share a sense of progress over the past five decades In some developed countries , publics also report that life is better today , including 65 % in Japan and Germany , and 64 % in the Netherlands and Sweden .","In","– all societies economic transformations since late 1960s",""
mturk_charts/no_data/multi_col/6816.png,"New arrivals who receive green cards , on the other hand , are far more likely to be sponsored by family members – fully 85 % are , compared with 46 % of those who adjusted their status in 2015 . Only 4 % of new arrivals came in an employment category . Green card holders who adjusted their status are more likely than new arrivals to be in the prime working years of 25 to 64 , and are less likely to be younger or older . Among those who adjusted their status , 72 % were ages 25 to 64 , compared with 55 % of new arrivals .",same,"What is the distribution of new arrivals with green cards are likely to be sponsored by family members?",same,"New arrivals who receive green cards , on the other hand , are far more likely to be sponsored by family members – fully 85 % are , compared with 46 % of those who adjusted their status in 2015","New arrivals who receive green cards , on the other hand , are far more likely to be sponsored by family members – fully 85 % are , compared with 46 % of those who adjusted their status in 2015","","",""
mturk_charts/no_data/multi_col/6823.png,"The Brazilian public expects a recovery soon . While recent economic forecasts point to a slow recovery , the majority of the Brazilian public remains confident that the economy will bounce back in the near future . Nearly seven - in - ten Brazilians ( 69 % ) say the country ’s economic situation will improve over the next 12 months , with roughly a third ( 34 % ) believing it will improve a lot . Individuals with higher levels of education are less optimistic about the future , however . About half ( 51 % ) of Brazilians who completed college believe the economy will improve , compared to 71 % of those without university degrees .",same,"What is the distribution of Brazilians who are confident that the country's economy will improve over the next 12 months?",answer2,"Nearly seven - in - ten Brazilians ( 69 % ) say the country ’s economic situation will improve over the next 12 months , with roughly a third ( 34 % ) believing it will improve a lot .","Nearly seven - in - ten Brazilians ( 69 % ) say the country ’s economic situation will improve over the next 12 months , with roughly a third ( 34 % ) believing it will improve a lot .",".","",""
mturk_charts/no_data/multi_col/6825.png,"Only about a quarter of Brazilians believe that political instability will get better . While the impact of the recent charge against the president and other ongoing investigations remains to be seen , 86 % of Brazilians say political instability is a big problem for their country . Moreover , the public is skeptical that the current state of affairs in Brasília , the capital , will change for the better anytime soon . About four - in - ten Brazilians ( 42 % ) believe the political instability will get worse in the next five years , 29 % say the problem will stay the same and roughly a quarter ( 24 % ) believe the instability will get better .",same,"What opinion do Brazilians have about political instability in the next five years?",answer1,"About four - in - ten Brazilians ( 42 % ) believe the political instability will get worse in the next five years , 29 % say the problem will stay the same and roughly a quarter ( 24 % ) believe the instability will get better .","About four - in - ten Brazilians ( 42 % ) believe the political instability will get worse in the next five years , 29 % say the problem will stay the same and roughly a quarter ( 24 % ) believe the instability will get better .","","",""
mturk_charts/no_data/multi_col/5987.png,"The public overwhelmingly sees the issue of sexual assault and harassment as very important for the country . About three - quarters of the public ( 74 % ) say it is “ very important ” for the country . Among five current issues tested , only proposed changes to the federal tax system rank as important as sexual assault and harassment in the public ’s view . Democrats and Democratic leaners are 20 percentage points more likely than Republicans and Republican leaners to view the issue of sexual assault and harassment as very important . Nevertheless , nearly nine - in - ten Republicans ( 87 % ) say it is at least somewhat important . Very few Republicans or Democrats regard this issue as not important . More women than men say the issue of sexual assault and harassment is very important . And adults younger than 30 are more likely to view this issue as very important than are people 50 and older .",same,"What opinion do the partisans have about the importance of sex harassment issue.",same,"Democrats and Democratic leaners are 20 percentage points more likely than Republicans and Republican leaners to view the issue of sexual assault and harassment as very important . Nevertheless , nearly nine - in - ten Republicans ( 87 % ) say it is at least somewhat important . Very few Republicans or Democrats regard this issue as not important .","Democrats and Democratic leaners are 20 percentage points more likely than Republicans and Republican leaners to view the issue of sexual assault and harassment as very important . Nevertheless , nearly nine - in - ten Republicans ( 87 % ) say it is at least somewhat important . Very few Republicans or Democrats regard this issue as not important .","","",""
mturk_charts/no_data/multi_col/5997.png,"Among those who say that it is at least probable that senior members of the Trump administration had improper contact with Russia , 36 % are very confident that Mueller ’s investigation will be fair and another 31 % are somewhat confident . Among those who think that there was probably or definitely no improper contact , only 12 % are very confident in a fair investigation , while 30 % are somewhat confident .",same,"How is the confidence rate in Mueller's investigation?",same,"Among those who say that it is at least probable that senior members of the Trump administration had improper contact with Russia , 36 % are very confident that Mueller ’s investigation will be fair and another 31 % are somewhat confident . Among those who think that there was probably or definitely no improper contact , only 12 % are very confident in a fair investigation , while 30 % are somewhat confident .","Among those who say that it is at least probable that senior members of the Trump administration had improper contact with Russia , 36 % are very confident that Mueller ’s investigation will be fair and another 31 % are somewhat confident . Among those who think that there was probably or definitely no improper contact , only 12 % are very confident in a fair investigation , while 30 % are somewhat confident .","","",""
mturk_charts/no_data/multi_col/6005.png,"Immigrants account for most of the 4.6 million U.S. residents with origins in El Salvador , Guatemala and Honduras and are the main driver of the group ’s growth . By contrast , two - thirds of Mexican Americans were born in the U.S. , and births to U.S. residents are the main contributor to the group ’s population growth .",same,"What are the origins of most of the U.S. residents immigrants?",same,"Immigrants account for most of the 4.6 million U.S. residents with origins in El Salvador , Guatemala and Honduras and are the main driver of the group ’s growth .","Immigrants account for most of the 4.6 million U.S. residents with origins in El Salvador , Guatemala and Honduras and are the main driver of the group ’s growth .",".","",""
mturk_charts/no_data/multi_col/6163.png,"More than 37 million Latinos in the U.S. speak Spanish at home , making it the country ’s most common non - English language . But while the number of Latinos who speak Spanish at home continues to increase due to the overall growth of the Latino population , the share of Latinos who speak the language has declined over the past decade or so : 73 % of Latinos spoke Spanish at home in 2015 , down from 78 % in 2006 , according to a Pew Research Center analysis of Census Bureau data . The national decline in Spanish use among Latinos extended to all of the top 25 U.S. metro areas with the largest population of Latinos ages 5 and older . The San Antonio - New Braunfels and Phoenix - Mesa - Scottsdale metro areas had some of the largest declines , with the shares who spoke Spanish in each declining by 9 percentage points . Some of the smallest declines came in the Washington - Arlington - Alexandria , McAllen - Edinburg - Mission , Sacramento - Roseville - Arden - Arcade and Miami - Fort Lauderdale - West Palm Beach metro areas , where the share who spoke Spanish at home declined by about 2 percentage points each from 2006 to 2015 . ( Click here for a sortable table of Spanish use by metro area . )",same,"What opinion do the Latinos in the U.S have about speaking Spanish at home?",answer2,"More than 37 million Latinos in the U.S. speak Spanish at home , making it the country ’s most common non - English language .","More than 37 million Latinos in the U.S. speak Spanish at home , making it the country ’s most common non - English language .","","",""
mturk_charts/no_data/multi_col/6164.png,"Overall , 36 % of U.S. adults say their family has achieved the American dream , while another 46 % say they are “ on their way ” to achieving it , according to an August survey by Pew Research Center . ( The survey asked people about the “ American dream , ” as they define it . ) People who say they have already achieved the American dream are generally older , more affluent and better - educated than those who say they are on their way to achieving the American dream and those who say it ’s out of reach .",same,"What is the distribution of U.S. adults who say their families have achieved the American dream?",answer2,"Overall , 36 % of U.S. adults say their family has achieved the American dream , while another 46 % say they are “ on their way ” to achieving it , according to an August survey by Pew Research Center .","Overall , 36 % of U.S. adults say their family has achieved the American dream , while another 46 % say they are “ on their way ” to achieving it , according to an August survey by Pew Research Center .","","",""
mturk_charts/no_data/multi_col/6168.png,"In Latin America , where nearly 40 % of the world ’s Catholics live , Protestant populations have risen sharply . In a survey conducted in the region in 2014 , 9 % of respondents across 19 Latin American countries said they were raised as Protestants , while 19 % identified Protestant ( or evangelical ) Christianity as their current religion . Net gains for Protestants in Latin America have meant net losses for Catholics . While 84 % of respondents were raised as Catholic , only 69 % identified their current religion as Catholic . Protestants across Latin America also are significantly more religious than Catholics . And they are more likely to take conservative positions on issues such as divorce , abortion , gay marriage and gender norms . One relatively recent and distinctive Protestant movement that has gained ground globally is Pentecostalism . While practices vary , Pentecostal churches often emphasize the “ gifts of the Holy Spirit , ” such as divine healing , speaking in tongues and receiving direct revelations from God . These practices are common among Protestants in sub - Saharan Africa , Latin America and even in Asia . For example , in a survey conducted in 2014 , the majority of churchgoing Protestants across 19 Latin American countries said they have at least occasionally witnessed speaking in tongues , prophesying and praying for a miraculous healing in church .",same,"What is the different of Latinos raised as Catholics with those who are currently Catholics?",answer1,"While 84 % of respondents were raised as Catholic , only 69 % identified their current religion as Catholic","While 84 % of respondents were raised as Catholic , only 69 % identified their current religion as Catholic","","",""
mturk_charts/no_data/multi_col/6111.png,"Pew Research Center surveys of transatlantic experts and general publics in North America and Europe reveal a division between these two groups over the role of the people ’s voice in governing . While a median of 68 % of the 12 publics surveyed say allowing citizens to vote directly on major national issues would be a good way to govern their country , just 37 % of foreign policy experts surveyed agree .",same,"What is the distribution of the public say about allowing citizens to vote directly on major national issues would help govern their country?",answer1,"While a median of 68 % of the 12 publics surveyed say allowing citizens to vote directly on major national issues would be a good way to govern their country , just 37 % of foreign policy experts surveyed agree .","While a median of 68 % of the 12 publics surveyed say allowing citizens to vote directly on major national issues would be a good way to govern their country , just 37 % of foreign policy experts surveyed agree .","","",""
mturk_charts/no_data/multi_col/6112.png,"Populist movements have ushered in new political actors on both sides of the Atlantic . Perhaps none is better known than the 45th president of the United States , Donald Trump . Among the foreign policy experts polled by Pew Research Center , nearly nine - in - ten ( 88 % ) say they lack confidence in Trump to do the right thing regarding world affairs . A median of 76 % among the European and North American publics agree . Nearly as many foreign policy experts describe Trump as “ dangerous . ” A median of roughly seven - in - ten across the publics surveyed share this view .",same,"What is the distribution of foreign policy experts who lack confidence in Trump's ability to do the right thing regarding world affairs?",answer2,"Among the foreign policy experts polled by Pew Research Center , nearly nine - in - ten ( 88 % ) say they lack confidence in Trump to do the right thing regarding world affairs . A median of 76 % among the European and North American publics agree . ” A median of roughly seven - in - ten across the publics describe Trump as "dangerous".","Among the foreign policy experts polled by Pew Research Center , nearly nine - in - ten ( 88 % ) say they lack confidence in Trump to do the right thing regarding world affairs . A median of 76 % among the European and North American publics agree . ” A median of roughly seven - in - ten across the publics surveyed share this view .","","Nearly as many describe as “ dangerous","Among the foreign policy experts polled by Pew Research Center , nearly nine - in - ten ( 88 % ) say they lack confidence in Trump to do the right thing regarding world affairs . A median of 76 % among the European and North American publics agree . ” A median of roughly seven - in - ten across the publics describe Trump as "dangerous"."
mturk_charts/no_data/multi_col/6109.png,"Looking ahead , the public has mixed views of how they think the national economy will perform over the next year . About as many say conditions will be better in a year ( 32 % ) as say they will be worse ( 29 % ) ; 37 % think they will be about the same as they are now .",same,"What are the public views on the economic conditions over the next year?",same,"About as many say conditions will be better in a year ( 32 % ) as say they will be worse ( 29 % ) ; 37 % think they will be about the same as they are now","About as many say conditions will be better in a year ( 32 % ) as say they will be worse ( 29 % ) ; 37 % think they will be about the same as they are now","","Looking ahead , public has mixed views of how national economy perform over next .",""
mturk_charts/no_data/multi_col/6671.png,"Nearly nine - in - ten Americans ( 87 % ) who have seen a health care provider in the past year say their concerns or descriptions of symptoms were carefully listened to , and 84 % say they felt their provider “ really cared about ( their ) health and well - being , ” according to a Pew Research Center survey conducted in spring 2016 . Just 23 % of patients said they “ felt rushed by their health care provider , ” and even fewer ( 15 % ) felt confused about instructions they got for treatment or at - home care .",same,"What is the distribution of Americans who feel rushed by their healthcare providers?",answer1,"Just 23 % of patients said they “ felt rushed by their health care provider .","Just 23 % of patients said they “ felt rushed by their health care provider .","","",""
