img_path,"summary",question_resolution,"question",answer_resolution,"abstractive_answer","extractive_answer","decontextualizated_text_added","decontextualizated_text_removed","extra_added_text"
mturk_charts/no_data/multi_col/6946.png,"By contrast , smaller religious groups may not have been harassed in as many countries simply because they are not present in as many countries . For instance , because of their dense concentration in a small number of countries , 99 % of Jews and Hindus lived in nations where members of their groups were harassed . And despite being one of the most geographically dispersed religious groups , 97 % of Muslims lived in countries where harassment of Muslims occurred in 2015 . ( By comparison , 78 % of Christians lived in places where Christians were harassed . )",same,"What is the distribution of harassment victims among religious groups?",answer2,"For instance , because of their dense concentration in a small number of countries , 99 % of Jews and Hindus lived in nations where members of their groups were harassed . And despite being one of the most geographically dispersed religious groups , 97 % of Muslims lived in countries where harassment of Muslims occurred in 2015 . ( By comparison , 78 % of Christians lived in places where Christians were harassed . )","For instance , because of their dense concentration in a small number of countries , 99 % of Jews and Hindus lived in nations where members of their groups were harassed . And despite being one of the most geographically dispersed religious groups , 97 % of Muslims lived in countries where harassment of Muslims occurred in 2015 . ( By comparison , 78 % of Christians lived in places where Christians were harassed . )","","",""
mturk_charts/no_data/multi_col/6947.png,"The generation of Central and Eastern Europeans who came of age after the fall of the Berlin Wall and collapse of the Soviet Union differs little in its political outlook from earlier generations weaned on communist ideology and anti - Western propaganda . Today , support for democracy is relatively tepid among both age groups . Majorities in most countries across the region are upbeat about free markets , with similar levels of support among young and old , according to a new Pew Research Center survey of adults in 18 Central and Eastern European countries .",same,"How has the German reunification been affected?",answer2,"The generation of Central and Eastern Europeans who came of age after the fall of the Berlin Wall and collapse of the Soviet Union differs little in its political outlook from earlier generations weaned on communist ideology and anti - Western propaganda .","The generation of Central and Eastern Europeans who came of age after the fall of the Berlin Wall and collapse of the Soviet Union differs little in its political outlook from earlier generations weaned on communist ideology and anti - Western propaganda .",".","",""
mturk_charts/no_data/multi_col/6019.png,"2 Americans and Germans differ when people in each country are asked which nations are their first and second most important partners . Combining both first and second mentions , Americans name Great Britain more than any other country ( 33 % ) , followed by China ( 24 % ) , Germany ( 12 % ) , Israel ( 12 % ) and Canada ( 10 % ) . In Germany , France gathers the most votes as either first or second most important partner ( 63 % ) , followed by the U.S. ( 43 % ) . Lagging far behind in the eyes of Germans are Russia ( 11 % ) , China ( 7 % ) and Great Britain ( 6 % ) .",same,"Which are the most important partner in Germany?",answer1,"In Germany , France gathers the most votes as either first or second most important partner ( 63 % ) , followed by the U.S. ( 43 % ) .","In Germany , France gathers the most votes as either first or second most important partner ( 63 % ) , followed by the U.S. ( 43 % ) .",".","",""
mturk_charts/no_data/multi_col/6021.png,"Americans and Germans have different views about what the most important aspect of the U.S.-German relationship is . Roughly a third of Americans say the most important aspects of the relationship – from a list of three options – are security and defense ties ( 34 % ) and economic and trade ties ( 33 % ) . About one - in - five ( 21 % ) name shared democratic values as the pre - eminent aspect of the relationship . Most Germans , by contrast , say economic connections are the most critical ( 45 % ) , with about a third saying democratic values are the keystone of the transatlantic relationship ( 35 % ) . Only 16 % of Germans cite defense ties .",same,"What opinion do the Americans have about the U.S. German relationship?",same,"Roughly a third of Americans say the most important aspects of the relationship – from a list of three options – are security and defense ties ( 34 % ) and economic and trade ties ( 33 % ) .","Roughly a third of Americans say the most important aspects of the relationship – from a list of three options – are security and defense ties ( 34 % ) and economic and trade ties ( 33 % ) .",".","",""
mturk_charts/no_data/multi_col/6022.png,"Americans are more likely than their German counterparts to say other countries do too little in global affairs . Roughly two - thirds of Americans say China ( 66 % ) and Russia ( 65 % ) do too little to help solve global problems . About half say the same about the United Nations , and 45 % of Americans hold this view about the European Union . However , Americans are split on whether Germany is doing too little ( 39 % ) or the right amount ( 40 % ) . Germans , on the other hand , have more mixed views . While pluralities in Germany say the UN , Russia and China are doing too little , 46 % say the EU is doing enough . And nearly half say that NATO is doing the right amount to help solve the world ’s problems , roughly the same share of Americans ( 48 % ) who say the Atlantic defense organization is not doing enough . Germans are divided on whether the U.S. is doing too little ( 39 % ) or too much ( 39 % ) to help solve global problems .",same,"Which countries do Americans say do little to help solve global problems?",same,"Roughly two - thirds of Americans say China ( 66 % ) and Russia ( 65 % ) do too little to help solve global problems .","Roughly two - thirds of Americans say China ( 66 % ) and Russia ( 65 % ) do too little to help solve global problems .",".","",""
mturk_charts/no_data/multi_col/6190.png,"The 2018 midterm elections are still more than a year away , but the two groups at either end of the political typology are already highly motivated by the battle for congressional control . More than eight - in - ten Solid Liberals ( 84 % ) say it matters a great deal to them which party wins control of Congress next year , the highest share of any typology group . Core Conservatives are next highest , at 77 % . At this point , other groups are less engaged by the struggle for partisan control of Congress . And the drop - off is particularly notable among three groups close to the middle of the typology . On the right , fewer than half of Market Skeptic Republicans ( 44 % ) and New Era Enterprisers ( 41 % ) say it matters a great deal which party wins control of Congress ; on the left , just 44 % of Devout and Diverse say the same .",same,"What is the distribution of Liberals who say it matters which party controls the congress?",answer1,"More than eight - in - ten Solid Liberals ( 84 % ) say it matters a great deal to them which party wins control of Congress next year , the highest share of any typology group","More than eight - in - ten Solid Liberals ( 84 % ) say it matters a great deal to them which party wins control of Congress next year , the highest share of any typology group","","",""
mturk_charts/no_data/multi_col/6195.png,"Republicans also were somewhat less likely than Democrats to post about the attack in general : 66 % of GOP members with Facebook pages did so between the day of the attack and Oct. 9 , compared with 84 % of Democrats . ( Oct. 9 was chosen as the cutoff date to gauge lawmakers ’ early reactions to the shooting . )",same,"How likely do the partisans mention guns in Facebook posts?",same,"Republicans also were somewhat less likely than Democrats to post about the attack in general : 66 % of GOP members with Facebook pages did so between the day of the attack , compared with 84 % of Democrats","Republicans also were somewhat less likely than Democrats to post about the attack in general : 66 % of GOP members with Facebook pages did so between the day of the attack , compared with 84 % of Democrats","","and Oct. 9",""
mturk_charts/no_data/multi_col/6216.png,"Despite these somewhat lukewarm assessments of their current political system , Japanese remain solidly supportive of democracy . Roughly three - quarters ( 77 % ) endorse representative democracy , while almost two - thirds ( 65 % ) say referenda on major policy issues would be good for Japan – something that has never happened in post - World War II Japan .",same,"What is the distribution of Japanese who endorse representative democracy?",same,"Roughly three - quarters ( 77 % ) endorse representative democracy .","Roughly three - quarters ( 77 % ) endorse representative democracy .",".","",""
mturk_charts/no_data/multi_col/6786.png,"Political views , physical appearance , gender and race are among the top reasons people say they are harassed online . Some 14 % of Americans – representing 35 % of those who have encountered any type of harassment online – say they have been the target of online harassment because of their political views . Democrats and Republicans are equally likely to say this . Among other reasons people have been harassed online , around one - in - ten U.S. adults cite their physical appearance ( 9 % ) , while 8 % each say they were targeted because of their gender or their race or ethnicity . Smaller shares cited religion , sexual orientation , occupation or disability status as reasons . Social media is by far the most common venue for online harassment . When asked where their most recent incident with online harassment occurred , 58 % of those who have been harassed online cited social media , the most common response . By comparison , 23 % of online harassment targets say their most recent experience occurred in the comments sections of a website , while 15 % cited a text or messaging app .",same,"What is the distribution of Americans who have experienced online harassment related to their gender or race/ethnicity?",answer2,"Among other reasons people have been harassed online , around one - in - ten U.S. adults cite their physical appearance ( 9 % ) , while 8 % each say they were targeted because of their gender or their race or ethnicity","Among other reasons people have been harassed online , around one - in - ten U.S. adults cite their physical appearance ( 9 % ) , while 8 % each say they were targeted because of their gender or their race or ethnicity","","",""
mturk_charts/no_data/multi_col/6787.png,"Americans ’ views about the balance between online safe spaces and free speech tend to vary by gender . Men are more likely than women to say that it is more important for people to be able to speak their minds freely online ( 56 % vs. 36 % ) , while women are more inclined than men to say it is more important for people to feel welcome and safe in online spaces ( 63 % vs. 43 % ) .",same,"What is the distribution of men who are likely to be of the view that people should speak their minds freely online?",same,"Men are more likely than women to say that it is more important for people to be able to speak their minds freely online ( 56 % vs. 36 % )","Men are more likely than women to say that it is more important for people to be able to speak their minds freely online ( 56 % vs. 36 % )","","",""
mturk_charts/no_data/multi_col/6788.png,"Overall , 43 % of U.S. adults say that law enforcement does not take incidents of online harassment seriously enough . Another 19 % feel that police do take harassment complaints seriously , and 32 % are unsure of how law enforcement handles this issue .",same,"What is the distribution of U.S. adults who say that online harassment is not taken serious enough?",same,"Overall , 43 % of U.S. adults say that law enforcement does not take incidents of online harassment seriously enough","Overall , 43 % of U.S. adults say that law enforcement does not take incidents of online harassment seriously enough","","",""
mturk_charts/no_data/multi_col/6347.png,"The general news media and specialty publications are major ways most Americans get their information about science . But many also are exposed to scientific subjects through movies and television shows – and they come away from these fictional portraits with a positive impression of working in science , technology and medicine . Roughly eight - in - ten Americans ( 81 % ) say they at least sometimes watch one or more of three types of science - related entertainment shows and movies : those focusing on criminal investigations , ones about hospitals and medical settings , or science fiction , according to a Pew Research Center survey conducted in May and June .",same,"What are the general ways that most Americans get their information about science?",answer2,"The general news media and specialty publications are major ways most Americans get their information about science .","The general news media and specialty publications are major ways most Americans get their information about science .","","",""
mturk_charts/no_data/multi_col/6346.png,"Two - thirds of DACA recipients are ages 25 or younger , and a majority are women . Women make up a slight majority ( 53 % ) of active DACA recipients , while 47 % are men , according to the tabulations from U.S. Citizenship and Immigration Services .",same,"How is the demographics of DACA recipients like?",answer2,"Two - thirds of DACA recipients are ages 25 or younger , and a majority are women . Women make up a slight majority ( 53 % ) of active DACA recipients , while 47 % are men , according to the tabulations from U.S. Citizenship and Immigration Services .","Two - thirds of DACA recipients are ages 25 or younger , and a majority are women . Women make up a slight majority ( 53 % ) of active DACA recipients , while 47 % are men , according to the tabulations from U.S. Citizenship and Immigration Services .","","",""
mturk_charts/no_data/multi_col/6349.png,"A majority of Americans get their science news from general outlets , though many question how often these outlets get the science facts right . More than half ( 54 % ) say they regularly get their science news from general news outlets , outpacing every other source type asked about , including a range of specialty science sources .",same,"What is the distribution of Americans who get science news from general outlets?",same,"More than half ( 54 % ) say they regularly get their science news from general news outlets , outpacing every other source type asked about , including a range of specialty science sources .","More than half ( 54 % ) say they regularly get their science news from general news outlets , outpacing every other source type asked about , including a range of specialty science sources .",".","",""
mturk_charts/no_data/multi_col/7116.png,"The Trump administration and governments in Ottawa and Mexico City have indicated they will renegotiate the trilateral , quarter - century - old North American Free Trade Agreement ( NAFTA ) . While the existing accord enjoys the support of roughly three - quarters of the Canadian public and six - in - ten Mexicans , it is viewed less favorably in the United States , with Republicans far less supportive than Democrats , according to a new Pew Research Center survey of all three countries . About half of Americans ( 51 % ) say NAFTA has been a good thing for the U.S. , including 11 % who say it has been very good . That compares with 74 % of Canadians who say the agreement has been good for Canada , including 20 % who say it has been very good . Among Mexicans , 60 % see NAFTA as being good for their country , including 10 % who hold that view strongly . These differences in views may , in part , reflect the fact that both Canada and Mexico run merchandise trade surpluses with the U.S. In 2016 , the U.S. ran a collective $ 74 billion trade goods deficit with its two NAFTA partners .",same,"What do Americans and Canadians think about the NAFTA?",same,"About half of Americans ( 51 % ) say NAFTA has been a good thing for the U.S. , including 11 % who say it has been very good . That compares with 74 % of Canadians who say the agreement has been good for Canada , including 20 % who say it has been very good","About half of Americans ( 51 % ) say NAFTA has been a good thing for the U.S. , including 11 % who say it has been very good . That compares with 74 % of Canadians who say the agreement has been good for Canada , including 20 % who say it has been very good","","",""
mturk_charts/no_data/multi_col/7119.png,"As of 2016 , 15 % of 25- to 35 - year - old Millennials were living in their parents ’ home . This is 5 percentage points higher than the share of Generation Xers who lived in their parents ’ home in 2000 when they were the same age ( 10 % ) , and nearly double the share of the Silent Generation who lived at home in 1964 ( 8 % ) . It does n’t appear that a lack of jobs is keeping Millennials at home . As of the first quarter of 2016 ( when the living arrangements data were collected ) , only 5.1 % of older young adults were unemployed , down from 10.1 % in the first quarter of 2010 . Yet the share of 25- to 35 - year - olds living at home rose during that span , increasing from 12 % in 2010 to 15 % in 2016 .",same,"What are the rates of people from different generations from 25 to 35 years living with their parents?",answer1,"As of 2016 , 15 % of 25- to 35 - year - old Millennials were living in their parents ’ home . This is 5 percentage points higher than the share of Generation Xers who lived in their parents ’ home in 2000 when they were the same age ( 10 % ) , and nearly double the share of the Silent Generation who lived at home in 1964 ( 8 % ) .","As of 2016 , 15 % of 25- to 35 - year - old Millennials were living in their parents ’ home . This is 5 percentage points higher than the share of Generation Xers who lived in their parents ’ home in 2000 when they were the same age ( 10 % ) , and nearly double the share of the Silent Generation who lived at home in 1964 ( 8 % ) .","","",""
mturk_charts/no_data/multi_col/7121.png,"The increased prevalence of living with mom and/or dad is more prominent among less - educated young adults . In 2016 , only 10 % of Millennials who had completed at least a bachelor ’s degree lived at home , compared with 7 % of college - educated Gen Xers who lived at home in 2000 . By contrast , 20 % of young adults with no more than a high school diploma lived in their parents ’ home in 2016 , up from 12 % of Gen Xers in 2000 .",same,"How is the influence of education in young adults living with their parents.",answer2,"In 2016 , only 10 % of Millennials who had completed at least a bachelor ’s degree lived at home , compared with 7 % of college - educated Gen Xers who lived at home in 2000 . By contrast , 20 % of young adults with no more than a high school diploma lived in their parents ’ home in 2016 , up from 12 % of Gen Xers in 2000 .","In 2016 , only 10 % of Millennials who had completed at least a bachelor ’s degree lived at home , compared with 7 % of college - educated Gen Xers who lived at home in 2000 . By contrast , 20 % of young adults with no more than a high school diploma lived in their parents ’ home in 2016 , up from 12 % of Gen Xers in 2000 .","","",""
mturk_charts/no_data/multi_col/7134.png,"Currently , there are modest differences in outlook by levels of educational attainment . Those with some college experience are somewhat less likely to say they have a lot of confidence in the future of the U.S. than are both those with more and less education . The shares who say they have a lot of confidence are down significantly since 2015 among postgraduates ( 13 points ) , college graduates ( 8 points ) and those with some college experience ( 7 points ) . There has been no significant shift in outlook among those with no more than a high school diploma .",same,"What are the differences in outlook among those with no more than a high school diploma?",answer2,"The shares who say they have a lot of confidence are down significantly since 2015 among postgraduates ( 13 points ) , college graduates ( 8 points ) and those with some college experience ( 7 points ) .","The shares who say they have a lot of confidence are down significantly since 2015 among postgraduates ( 13 points ) , college graduates ( 8 points ) and those with some college experience ( 7 points ) .",".","",""
mturk_charts/no_data/multi_col/7198.png,"Views of why some people are rich and poor vary by gender , education and income level as well . For example , men ( 49 % ) are slightly more likely than women ( 41 % ) to say that hard work is more often the reason why someone is rich . Men ( 42 % ) also are more likely than women ( 26 % ) to say that a lack of effort is more to blame if someone is poor . Those with postgraduate degrees are more likely to say that having more advantages in life has more to do with why a person is rich ( 52 % ) than they are to say hard work has more to do with it ( 34 % ) . Those with less education are more divided on what has more to do with why a person is rich . When it comes to the reasons why a person is poor , majorities of postgraduates ( 62 % ) and college graduates ( 59 % ) say circumstances are generally to blame . Most of those with some college experience ( 54 % ) also take this view . Among those with no more than a high school diploma , about half ( 49 % ) point to circumstances as the reason why a person is poor , while 38 % cite a lack of effort .",same,"What are the views of postgraduates and college graduates on why a person is rich or poor?",answer2,"Those with postgraduate degrees are more likely to say that having more advantages in life has more to do with why a person is rich ( 52 % ) than they are to say hard work has more to do with it ( 34 % ) . When it comes to the reasons why a person is poor , majorities of postgraduates ( 62 % ) and college graduates ( 59 % ) say circumstances are generally to blame . Most of those with some college experience ( 54 % ) also take this view .","Those with postgraduate degrees are more likely to say that having more advantages in life has more to do with why a person is rich ( 52 % ) than they are to say hard work has more to do with it ( 34 % ) . When it comes to the reasons why a person is poor , majorities of postgraduates ( 62 % ) and college graduates ( 59 % ) say circumstances are generally to blame . Most of those with some college experience ( 54 % ) also take this view .","","",""
mturk_charts/no_data/multi_col/7203.png,"These states have metro areas that are home to large technology and finance hubs such as San Jose , Dallas , Houston and New York City . New Jersey had 9.4 visa approvals per 1,000 workers , the highest ratio in the nation . Maryland had the second - highest ratio , with 4.9 H-1B approvals per 1,000 workers .",same,"What is the Visa approval ratio did New Jersey have per 1,000 workers?",same,"New Jersey had 9.4 visa approvals per 1,000 workers , the highest ratio in the nation","New Jersey had 9.4 visa approvals per 1,000 workers , the highest ratio in the nation","","",""
