img_path,"summary",question_resolution,"question",answer_resolution,"abstractive_answer","extractive_answer","decontextualizated_text_added","decontextualizated_text_removed","extra_added_text"
mturk_charts/no_data/multi_col/6891.png,"In the new survey , majorities across all educational groups now say they favor same - sex marriage , but levels of support are highest among those who have graduated from college : 79 % among those with postgraduate degrees and 72 % among those with bachelor ’s degrees . Smaller majorities of those with some college experience but no college degree ( 62 % ) or those with no more than a high school degree ( 53 % ) say they favor allowing gays and lesbians to marry . While Republicans overall are divided in views of same - sex marriage , moderate and liberal Republicans are much more supportive than are conservative Republicans ( 63 % vs. 39 % ) . There also are wide ideological differences among Democrats , though majorities of conservative and moderate Democrats ( 66 % ) and liberal Democrats ( 90 % ) favor allowing gays and lesbians to marry legally .",same,"How is the LGBT phobia among Americans?",answer1,"In the new survey , majorities across all educational groups now say they favor same - sex marriage , but levels of support are highest among those who have graduated from college : 79 % among those with postgraduate degrees and 72 % among those with bachelor ’s degrees . Smaller majorities of those with some college experience but no college degree ( 62 % ) or those with no more than a high school degree ( 53 % ) say they favor allowing gays and lesbians to marry . While Republicans overall are divided in views of same - sex marriage , moderate and liberal Republicans are much more supportive than are conservative Republicans ( 63 % vs. 39 % ) . There also are wide ideological differences among Democrats , though majorities of conservative and moderate Democrats ( 66 % ) and liberal Democrats ( 90 % ) favor allowing gays and lesbians to marry legally .","In the new survey , majorities across all educational groups now say they favor same - sex marriage , but levels of support are highest among those who have graduated from college : 79 % among those with postgraduate degrees and 72 % among those with bachelor ’s degrees . Smaller majorities of those with some college experience but no college degree ( 62 % ) or those with no more than a high school degree ( 53 % ) say they favor allowing gays and lesbians to marry . While Republicans overall are divided in views of same - sex marriage , moderate and liberal Republicans are much more supportive than are conservative Republicans ( 63 % vs. 39 % ) . There also are wide ideological differences among Democrats , though majorities of conservative and moderate Democrats ( 66 % ) and liberal Democrats ( 90 % ) favor allowing gays and lesbians to marry legally .","","",""
mturk_charts/no_data/multi_col/6893.png,"Partisan divisions over gun policy proposals may reflect contrasting views among Republicans and Democrats on gun violence in the country today and on the impact of access to guns on crime and mass shootings . Though clear majorities of both Republicans ( 74 % ) and Democrats ( 92 % ) consider gun violence to be at least a moderately big problem in the U.S. , a much greater share of Democrats ( 65 % ) than Republicans ( 32 % ) say gun violence is a “ very big ” problem in the country .",same,"What opinion do the partisans have about gun violence as a social issue?",same,"Partisan divisions over gun policy proposals may reflect contrasting views among Republicans and Democrats on gun violence in the country today and on the impact of access to guns on crime and mass shootings . Though clear majorities of both Republicans ( 74 % ) and Democrats ( 92 % ) consider gun violence to be at least a moderately big problem in the U.S. , a much greater share of Democrats ( 65 % ) than Republicans ( 32 % ) say gun violence is a “ very big ” problem in the country .","Partisan divisions over gun policy proposals may reflect contrasting views among Republicans and Democrats on gun violence in the country today and on the impact of access to guns on crime and mass shootings . Though clear majorities of both Republicans ( 74 % ) and Democrats ( 92 % ) consider gun violence to be at least a moderately big problem in the U.S. , a much greater share of Democrats ( 65 % ) than Republicans ( 32 % ) say gun violence is a “ very big ” problem in the country .","","",""
mturk_charts/no_data/multi_col/6895.png,"Nearly two - thirds of Democrats ( 64 % ) say there would be fewer mass shootings in the U.S. if it were harder for people to legally obtain guns ; only about a quarter of Republicans ( 27 % ) say the same . And Republicans are skeptical that making it harder to legally obtain guns would have an effect on mass shootings : 54 % say it would not make a difference , while 18 % think restricting access to guns would lead to more mass shootings .",same,"What do the partisans think about gun ownership policies?",answer1,"Nearly two - thirds of Democrats ( 64 % ) say there would be fewer mass shootings in the U.S. if it were harder for people to legally obtain guns ; only about a quarter of Republicans ( 27 % ) say the same . And Republicans are skeptical that making it harder to legally obtain guns would have an effect on mass shootings : 54 % say it would not make a difference , while 18 % think restricting access to guns would lead to more mass shootings .","Nearly two - thirds of Democrats ( 64 % ) say there would be fewer mass shootings in the U.S. if it were harder for people to legally obtain guns ; only about a quarter of Republicans ( 27 % ) say the same . And Republicans are skeptical that making it harder to legally obtain guns would have an effect on mass shootings : 54 % say it would not make a difference , while 18 % think restricting access to guns would lead to more mass shootings .","","",""
mturk_charts/no_data/multi_col/7026.png,"Honolulu has by far the highest share of intermarried newlyweds of any metro area analyzed – 42 % of newlyweds living in and around that city were married to someone of a different race or ethnicity . The same is true of about three - in - ten newlyweds living near Las Vegas or Santa Barbara , California . ( All U.S. metro areas with at least 200 newlyweds in the Census Bureau data – 126 in all – are included in this analysis . Click here to see full tables that can be sorted by metro area and race and ethnicity . )",same,"How do the newlyweds live in and around that city in any metro area?",answer1,"42 % of newlyweds living in and around that city were married to someone of a different race or ethnicity about three - in - ten newlyweds living near Las Vegas or Santa Barbara , California . U.S. metro areas with at least 200 newlyweds in the Census Bureau data – 126 in all – are included in this analysis .","42 % of newlyweds living in and around that city were married to someone of a different race or ethnicity about three - in - ten newlyweds living near Las Vegas or Santa Barbara , California . U.S. metro areas with at least 200 newlyweds in the Census Bureau data – 126 in all – are included in this analysis .","","true",""
mturk_charts/no_data/multi_col/7031.png,"Yet despite these gains , many seniors remain largely disconnected from the digital revolution . One - third of adults ages 65 and older say they never use the internet , and roughly half ( 49 % ) say they do not have home broadband services . Meanwhile , even with their recent gains , the proportion of seniors who say they own smartphones is 42 percentage points lower than those ages 18 to 64 . Seniors ages 65 to 69 are about twice as likely as those ages 80 and older to say they ever go online ( 82 % vs. 44 % ) or have broadband at home ( 66 % vs. 28 % ) , and they are roughly four times as likely to say they own smartphones ( 59 % vs. 17 % ) .",same,"What opinion do seniors of age 65 and older have about disconnecting from the digital revolution?",answer1,"One - third of adults ages 65 and older say they never use the internet , and roughly half ( 49 % ) say they do not have home broadband services . seniors who say they own smartphones is 42 percentage points lower than those ages 18 to 64 . Seniors ages 65 to 69 are about twice as likely as those ages 80 and older to say they ever go online ( 82 % vs. 44 % ) or have broadband at home ( 66 % vs. 28 % ) , and they are roughly four times as likely to say they own smartphones ( 59 % vs. 17 % ) .","One - third of adults ages 65 and older say they never use the internet , and roughly half ( 49 % ) say they do not have home broadband services . seniors who say they own smartphones is 42 percentage points lower than those ages 18 to 64 . Seniors ages 65 to 69 are about twice as likely as those ages 80 and older to say they ever go online ( 82 % vs. 44 % ) or have broadband at home ( 66 % vs. 28 % ) , and they are roughly four times as likely to say they own smartphones ( 59 % vs. 17 % ) .","","",""
mturk_charts/no_data/multi_col/7029.png,"Graduates in STEM fields accounted for at least 70 % of OPT approvals from India , Iran , Bangladesh and Sri Lanka from 2012 to 2015 . Of the 72,151 from India employed under OPT , 84 % had STEM degrees , the highest percentage of any origin country . Iran ( 79 % ) , Bangladesh ( 74 % ) and Sri Lanka ( 70 % ) also had high shares of STEM graduates . Among those from China , 54 % went to STEM graduates .",same,"How is the degree holders Working under OPT?",answer2,"Of the 72,151 from India employed under OPT , 84 % had STEM degrees , the highest percentage of any origin country . Iran ( 79 % ) , Bangladesh ( 74 % ) and Sri Lanka ( 70 % ) also had high shares of STEM graduates . Among those from China , 54 % went to STEM graduates .","Of the 72,151 from India employed under OPT , 84 % had STEM degrees , the highest percentage of any origin country . Iran ( 79 % ) , Bangladesh ( 74 % ) and Sri Lanka ( 70 % ) also had high shares of STEM graduates . Among those from China , 54 % went to STEM graduates .","","",""
mturk_charts/no_data/multi_col/6533.png,"Views among Republicans are much chillier : 43 % give cold ratings to college professors , including about a quarter ( 27 % ) who give a very cold rating . A significantly smaller share of Republicans ( 30 % ) give professors a warm rating , while 25 % take a neutral view . Conservative Republicans are especially likely to give very ( 31 % ) or somewhat ( 20 % ) cold ratings to professors . By contrast , moderate and liberal Republicans hold quite different views : More offer warm ( 49 % ) than cold ( 20 % ) assessments of professors .",same,"What are the ratings the professors are likely to get from conservative Republicans?",answer1,"Conservative Republicans are especially likely to give very ( 31 % ) or somewhat ( 20 % ) cold ratings to professors","Conservative Republicans are especially likely to give very ( 31 % ) or somewhat ( 20 % ) cold ratings to professors","","",""
mturk_charts/no_data/multi_col/6536.png,"Today , 76 % of Republicans have a cold view of Democrats ( rating them 0 - 49 on the 0 - 100 scale ) , with about half ( 53 % ) rating Democrats very coldly ( 0 - 24 ) . Very cold ratings for Democrats among Republicans are higher today than in December 2016 ( 33 % ) , after the election , or in March of last year ( 46 % ) during the primary campaign .",same,"How are the cold ratings distributed among opposing parties?",answer1,"Today , 76 % of Republicans have a cold view of Democrats ( rating them 0 - 49 on the 0 - 100 scale ) , with about half ( 53 % ) rating Democrats very coldly ( 0 - 24 ) . Very cold ratings for Democrats among Republicans are higher today than in December 2016 ( 33 % .","Today , 76 % of Republicans have a cold view of Democrats ( rating them 0 - 49 on the 0 - 100 scale ) , with about half ( 53 % ) rating Democrats very coldly ( 0 - 24 ) . Very cold ratings for Democrats among Republicans are higher today than in December 2016 ( 33 % .","","",""
mturk_charts/no_data/multi_col/6538.png,"Still , Democrats in particular are somewhat more likely today than they were last year to say the term “ Democrat ” describes them very well : 39 % say this today , compared with 33 % in March 2016 . Another 51 % of Democrats say the term describes them fairly well . Even fewer Republicans ( 31 % ) say the term “ Republican ” applies very well to them ; most Republicans ( 58 % ) say it describes them fairly well . The share of Republicans who say they are described well by the term is largely unchanged from last year .",same,"How has Democrat's felt the term 'Democrats' describes them over the recent years?",same,"Democrats in particular are somewhat more likely today than they were last year to say the term “ Democrat ” describes them very well : 39 % say this today , compared with 33 % in March 2016 . Another 51 % of Democrats say the term describes them fairly well","Democrats in particular are somewhat more likely today than they were last year to say the term “ Democrat ” describes them very well : 39 % say this today , compared with 33 % in March 2016 . Another 51 % of Democrats say the term describes them fairly well","","Still",""
mturk_charts/no_data/multi_col/5967.png,"While the conflict continues , many in Turkey , Jordan and Lebanon want their country to accept fewer refugees . As of mid-2016 , these countries and other neighboring nations have taken in about 4.8 million Syrian refugees . Only 8 % in Jordan and 4 % in Lebanon and Turkey support accepting more refugees from Syria . A majority in Jordan wants its country to accept fewer Syrian refugees and around one - quarter ( 23 % ) say their country should not accept any refugees ( a volunteered category ) . However , Syrians already living in Jordan have very different views . A large majority of them say the country should accept more refugees from Syria and 0 % say that Jordan should stop accepting refugees all together . In Lebanon , similar numbers say their country should either accept fewer refugees ( 40 % ) or none at all ( 42 % ) . Christians are more likely than Shia or Sunni Muslims to say that Lebanon should not accept any refugees from Syria .",same,"What opinion does the majority of Jordanians have about accepting Syrian refugees?",same,"A majority in Jordan wants its country to accept fewer Syrian refugees and around one - quarter ( 23 % ) say their country should not accept any refugees ( a volunteered category ) .","A majority in Jordan wants its country to accept fewer Syrian refugees and around one - quarter ( 23 % ) say their country should not accept any refugees ( a volunteered category ) .",".","",""
mturk_charts/no_data/multi_col/5973.png,"In addition , there continue to be demographic differences in opinions about the law . By about two - to - one , women are more likely to say they approve ( 61 % ) than disapprove ( 31 % ) of the law . Men are more divided : Half approve , while 45 % disapprove .",same,"What is the opinion about demographic approval/disapproval of the law?",same,"By about two - to - one , women are more likely to say they approve ( 61 % ) than disapprove ( 31 % ) of the law . Men are more divided : Half approve , while 45 % disapprove","By about two - to - one , women are more likely to say they approve ( 61 % ) than disapprove ( 31 % ) of the law . Men are more divided : Half approve , while 45 % disapprove","","",""
mturk_charts/no_data/multi_col/5976.png,"Recipients of these special immigrant visas can receive refugee resettlement benefits from the U.S. government , which include 30 to 120 days of financial assistance . About 85 % of those who have entered the U.S. under the special immigrant visa programs ( from Oct. 1 , 2007 , to Sept 30 , 2017 ) have received refugee assistance and resettled in states across the country . Top resettlement states during this time include California ( 17,416 ) , Texas ( 10,598 ) , and Virginia ( 7,249 ) .",same,"Which states are the top settlement among special immigrant visa holders?",answer1,"Top resettlement states during this time include California ( 17,416 ) , Texas ( 10,598 ) , and Virginia ( 7,249 ) .","Top resettlement states during this time include California ( 17,416 ) , Texas ( 10,598 ) , and Virginia ( 7,249 ) .","","",""
mturk_charts/no_data/multi_col/6295.png,"Online news that comes via emails and texts from friends or family is the type of news encounter most likely to result in a follow - up action . Among the five pathways studied , news instances spurred by emails and texts from friends or family elicited the most activity ; nearly three - quarters ( 73 % ) of these instances were acted upon in some way . That outpaced social media and direct visits to a news organization ’s website , where a follow - up action occurred in about half of news instances ( 53 % and 47 % , respectively ) . Overall , talking with someone offline , whether in person or over the phone , was the most common action taken with digital news .",same,"Which pathway elicited the most activity resulting in follow-up action?",same,"Among the five pathways studied , news instances spurred by emails and texts from friends or family elicited the most activity ; nearly three - quarters ( 73 % ) of these instances were acted upon in some way .","Among the five pathways studied , news instances spurred by emails and texts from friends or family elicited the most activity ; nearly three - quarters ( 73 % ) of these instances were acted upon in some way .",".","",""
mturk_charts/no_data/multi_col/6297.png,"The public generally expresses more worry than enthusiasm about emerging automation technologies – especially when it comes to jobs . U.S. adults are roughly twice as likely to express worry ( 72 % ) as enthusiasm ( 33 % ) about a future in which robots and computers are capable of doing many jobs that are currently done by humans . They are also around three times as likely to express worry ( 67 % ) as enthusiasm ( 22 % ) about algorithms that make hiring decisions without any human involvement . By comparison , Americans tend to hold more balanced views toward driverless vehicles and robot caregivers .",same,"What is the distribution of U.S. adults expresses worry about potential developments in automation?",same,"U.S. adults are roughly twice as likely to express worry ( 72 % ) as enthusiasm ( 33 % ) about a future in which robots and computers are capable of doing many jobs that are currently done by humans .","U.S. adults are roughly twice as likely to express worry ( 72 % ) as enthusiasm ( 33 % ) about a future in which robots and computers are capable of doing many jobs that are currently done by humans .",".","",""
mturk_charts/no_data/multi_col/6298.png,"Americans are reluctant to incorporate these types of technologies into their own lives . When asked whether they would or would not personally use specific automation technologies , around six - in - ten U.S. adults say they would not want to ride in a driverless car ( 56 % ) or have a robot caregiver for themselves or a family member ( 59 % ) . Views on applying for a job that uses a computer program to evaluate and select applicants are even more negative : 76 % of Americans say they would not want to apply .",same,"What opinion do American have about the use of automation technologies in their way of life?",answer1,"around six - in - ten U.S. adults say they would not want to ride in a driverless car ( 56 % ) or have a class='chrome-extension-mutihighlight chrome-extension-mutihighlight-style-2'>robot caregiver for themselves or a family member ( 59 % )","around six - in - ten U.S. adults say they would not want to ride in a driverless car ( 56 % ) or have a caregiver for themselves or a family member ( 59 % )","","class='chrome-extension-mutihighlight chrome-extension-mutihighlight-style-2'>robot","around six - in - ten U.S. adults say they would not want to ride in a driverless car ( 56 % ) or have a class='chrome-extension-mutihighlight chrome-extension-mutihighlight-style-2'>robot caregiver for themselves or a family member ( 59 % )"
mturk_charts/no_data/multi_col/6749.png,"Even so , college graduates are the least likely group to be renters . In 2016 , 29 % of college - educated household heads were renters , compared with 38 % of household heads with a high school degree only or some college experience and 52 % of household heads who did not finish high school .",same,"How does education level affect householders?",same,"college graduates are the least likely group to be renters . In 2016 , 29 % of college - educated household heads were renters , compared with 38 % of household heads with a high school degree only or some college experience and 52 % of household heads who did not finish high school .","college graduates are the least likely group to be renters . In 2016 , 29 % of college - educated household heads were renters , compared with 38 % of household heads with a high school degree only or some college experience and 52 % of household heads who did not finish high school .","","Even so",""
mturk_charts/no_data/multi_col/6754.png,"Still , even among those who like right - wing parties , confidence in Trump is limited , and there is no Western European country in which a majority of right - wing party supporters offer a positive assessment of the American president ’s leadership in world affairs . Trump gets more negative ratings globally than Merkel , Xi or Putin . German Chancellor Angela Merkel is the only world leader included in the survey who receives more positive than negative reviews . Across the 37 nations polled , a median of 42 % express confidence in her , while 31 % say they lack confidence . Ratings for Chinese President Xi Jinping and Russian President Vladimir Putin are mostly negative , and Trump receives even more unfavorable assessments than both of them .",same,"What opinion do the publics have about worldwide national leaders during the Trump government?",answer2,"Angela Merkel is the only world leader included in the survey who receives more positive than negative reviews . Across the 37 nations polled , a median of 42 % express confidence in her , while 31 % say they lack confidence . Ratings for Chinese President Xi Jinping and Russian President Vladimir Putin are mostly negative , and class='chrome-extension-mutihighlight chrome-extension-mutihighlight-style-6'>Trump receives even more unfavorable assessments than both of them . class='chrome-extension-mutihighlight chrome-extension-mutihighlight-style-6'>Trump receives even more unfavorable assessments than both of","Angela Merkel is the only world leader included in the survey who receives more positive than negative reviews . Across the 37 nations polled , a median of 42 % express confidence in her , while 31 % say they lack confidence . Ratings for Chinese President Xi Jinping and Russian President Vladimir Putin are mostly negative , and Trump receives even more unfavorable assessments than both of them .","Trump","class='chrome-extension-mutihighlight chrome-extension-mutihighlight-style-6'>Trump class='chrome-extension-mutihighlight chrome-extension-mutihighlight-style-6'>Trump","Angela Merkel is the only world leader included in the survey who receives more positive than negative reviews . Across the 37 nations polled , a median of 42 % express confidence in her , while 31 % say they lack confidence . Ratings for Chinese President Xi Jinping and Russian President Vladimir Putin are mostly negative , and class='chrome-extension-mutihighlight chrome-extension-mutihighlight-style-6'>Trump receives even more unfavorable assessments than both of them . class='chrome-extension-mutihighlight chrome-extension-mutihighlight-style-6'>Trump receives even more unfavorable assessments than both of"
mturk_charts/no_data/multi_col/6756.png,"Most say Trump is arrogant , intolerant and dangerous , but a majority also sees him as a strong leader . Survey respondents were read a list of positive and negative characteristics and asked whether each one describes Trump . Around the globe , people tend to associate the American leader with all of the negative characteristics tested : Most say he is arrogant , intolerant and dangerous , while relatively few think of him as well - qualified or as someone who cares about ordinary people . Describing Trump as charismatic is more common , though global publics on balance do not think of him as charismatic , either . They do , however , see Trump as a strong leader – a median of 55 % across the nations polled describe him this way .",same,"What are the global thoughts about Trump's personality traits?",answer2,"Around the globe , people tend to associate the American leader with all of the negative characteristics tested : Most say he is arrogant , intolerant and dangerous , while relatively few think of him as well - qualified or as someone who cares about ordinary people .","Around the globe , people tend to associate the American leader with all of the negative characteristics tested : Most say he is arrogant , intolerant and dangerous , while relatively few think of him as well - qualified or as someone who cares about ordinary people .",".","",""
