img_path,"summary",question_resolution,"question",answer_resolution,"abstractive_answer","extractive_answer","decontextualizated_text_added","decontextualizated_text_removed","extra_added_text"
mturk_charts/no_data/multi_col/6683.png,"Across seven Asia - Pacific nations surveyed , a median of 62 % see ISIS as a major threat and 61 % see global climate change in the same light . About half across the region see cyberattacks and Chinese power as a major challenge . Fewer are very concerned about the global economy , refugees or American and Russian power .",same,"What is the distribution across the seven Asia-Pacific nations that see global climate change as a threat?",answer2,"Across seven Asia - Pacific nations surveyed , a median of 62 % see ISIS as a major threat and 61 % see global climate change in the same light","Across seven Asia - Pacific nations surveyed , a median of 62 % see ISIS as a major threat and 61 % see global climate change in the same light","","",""
mturk_charts/no_data/multi_col/6687.png,"Venezuela is the only Latin American country surveyed in which economic worries match the level of concern over climate change . A majority of Venezuelans ( 56 % ) name the condition of the global economy as a major threat , virtually tied with the 55 % who say the same about climate change . In five of the six remaining Latin American nations surveyed , the condition of the world economy ranks as the second - greatest threat .",same,"What the Venezuelan majority think of climate change and global economy as a threat?",same,"A majority of Venezuelans ( 56 % ) name the condition of the global economy as a major threat , virtually tied with the 55 % who say the same about climate change .","A majority of Venezuelans ( 56 % ) name the condition of the global economy as a major threat , virtually tied with the 55 % who say the same about climate change .",".","",""
mturk_charts/no_data/multi_col/7046.png,"Perceptions of both natural gas and nuclear power fall in between . Three - in - ten Americans see natural gas ( 30 % ) as very effective at minimizing air pollution , 42 % say natural gas is somewhat effective in minimizing air pollution , and 23 % say natural gas is not at all or not too effective . Views of nuclear power are mixed , with 28 % saying the use of nuclear energy is very effective , 27 % saying it is somewhat effective and 35 % saying it is not too or not at all effective in minimizing air pollution .",same,"What are the views on both natural gas and nuclear power effectiveness in minimising air pollution?",answer1,"Perceptions of both natural gas and nuclear power fall in between . Three - in - ten Americans see natural gas ( 30 % ) as very effective at minimizing air pollution , 42 % say natural gas is somewhat effective in minimizing air pollution , and 23 % say natural gas is not at all or not too effective . Views of nuclear power are mixed , with 28 % saying the use of nuclear energy is very effective , 27 % saying it is somewhat effective and 35 % saying it is not too or not at all effective in minimizing air pollution","Perceptions of both natural gas and nuclear power fall in between . Three - in - ten Americans see natural gas ( 30 % ) as very effective at minimizing air pollution , 42 % say natural gas is somewhat effective in minimizing air pollution , and 23 % say natural gas is not at all or not too effective . Views of nuclear power are mixed , with 28 % saying the use of nuclear energy is very effective , 27 % saying it is somewhat effective and 35 % saying it is not too or not at all effective in minimizing air pollution","","",""
mturk_charts/no_data/multi_col/7049.png,"When considering the broader question of whether it is possible to reduce environmental regulations while protecting the environment , there is a strong divide in public opinion . About half ( 49 % ) of the public says it is possible to cut back on environmental regulations and still effectively protect air and water quality , while a similar share ( 47 % ) says this is not possible . There are large partisan divides on this issue . By a 63%-35 % margin , most Republicans and Republican leaners hold that it is possible to cut back on environmental regulations and still effectively protect air and water quality in the U.S.",same,"what percentage margin of Republican and Republican leaners hold that it is possible to cut back on environmental regulations and still effectively protect air and water quality?",new_answer,"By a 63%-35 % margin , most Republicans and Republican leaners hold that it is possible to cut back on environmental regulations and still effectively protect air and water quality in the U.S.","By a 63%-35 % margin , most Republicans and Republican leaners hold that it is possible to cut back on environmental regulations and still effectively protect air and water quality in the U.S.","","",""
mturk_charts/no_data/multi_col/7059.png,"A substantial share of adults in Central and Eastern Europe hold traditional views of the role of women and the family , according to a recent Pew Research Center survey of 18 nations in the region . This is especially true in the 10 countries surveyed with Orthodox Christian majorities . For instance , majorities of respondents in all 10 of these Orthodox countries agree with the statement , “ Women have a responsibility to society to bear children , ” including at least three - quarters in Armenia ( 82 % ) , Romania ( 81 % ) and Bulgaria ( 77 % ) and about six - in - ten in Russia and Belarus ( 59 % each ) . Generally , smaller shares in the eight Catholic - majority , religiously mixed or majority - unaffiliated countries surveyed ( Bosnia and Hungary are exceptions ) take this position .",same,"What is the role of women according to adults in Orthodox majority countries?",answer1,"majorities of respondents in all 10 of these Orthodox countries agree with the statement , “ Women have a responsibility to society to bear children , ” including at least three - quarters in Armenia ( 82 % ) , Romania ( 81 % ) and Bulgaria ( 77 % ) and about six - in - ten in Russia and Belarus ( 59 % each ) . Generally , smaller shares in the eight Catholic - majority , religiously mixed or majority - unaffiliated countries surveyed ( Bosnia and Hungary are exceptions ) take this position .","majorities of respondents in all 10 of these Orthodox countries agree with the statement , “ Women have a responsibility to society to bear children , ” including at least three - quarters in Armenia ( 82 % ) , Romania ( 81 % ) and Bulgaria ( 77 % ) and about six - in - ten in Russia and Belarus ( 59 % each ) . Generally , smaller shares in the eight Catholic - majority , religiously mixed or majority - unaffiliated countries surveyed ( Bosnia and Hungary are exceptions ) take this position .","","",""
mturk_charts/no_data/multi_col/6856.png,"The smartphone is essential for many owners , but a slight majority says it ’s not always needed . Some 46 % of smartphone owners said their smartphone is something “ they could n’t live without , ” compared with 54 % who said in a 2014 Pew Research Center survey that their phone is “ not always needed . ” Perhaps surprisingly , smartphone owners who depend on their mobile device for internet access are not significantly more inclined than those who have multiple options for going online to say they could n’t live without their phone ( 49 % vs. 46 % ) . In addition to being essential for many , smartphone owners are much more likely to have positive views of these devices . For instance , they are much more likely to say smartphones are more helpful than annoying , represent freedom rather than represent a leash , enable connecting rather than being distracting and are worth the cost rather than being a financial burden .",same,"What is the distribution of people who think that they cannot do without their smartphones and those who think it is not always needed?",answer2,"Some 46 % of smartphone owners said their smartphone is something “ they could n’t live without , ” compared with 54 % who said that their phone is “ not always needed . ”","Some 46 % of smartphone owners said their smartphone is something “ they could n’t live without , ” compared with 54 % who said that their phone is “ not always needed . ”",".","in a 2014 Pew Research Center survey",""
mturk_charts/no_data/multi_col/6858.png,"Blacks are more likely than either whites or Hispanics to say voting should be made as easy as possible for citizens : 79 % of blacks say this , while just 19 % say citizens should have to prove they really want to vote by registering ahead of time . Among whites , a much narrower majority ( 54 % ) support making voting as easy as possible for all citizens ( 44 % say citizens should prove they want to vote by registering ahead of time ) . By 64%-35 % , most Hispanics support taking steps to make voting easy for all citizens .",same,"What are the Black's views on making voting as easy as possible?",answer2,"Blacks are more likely than either whites or Hispanics to say voting should be made as easy as possible for citizens : 79 % of blacks say this , while just 19 % say citizens should have to prove they really want to vote by registering ahead of time .","Blacks are more likely than either whites or Hispanics to say voting should be made as easy as possible for citizens : 79 % of blacks say this , while just 19 % say citizens should have to prove they really want to vote by registering ahead of time .",".","",""
mturk_charts/no_data/multi_col/6859.png,"While there is support for making it easy for citizens to vote , the public is largely opposed to making voting required in national elections . Only two - in - ten ( 20 % ) would favor mandatory voting , while nearly eight - in - ten ( 78 % ) says citizens should be able to decide for themselves whether or not to vote in national elections .",same,"What is the distribution of favour voting in national elections?",same,"Only two - in - ten ( 20 % ) would favor mandatory voting , while nearly eight - in - ten ( 78 % ) says citizens should be able to decide for themselves whether or not to vote in national elections .","Only two - in - ten ( 20 % ) would favor mandatory voting , while nearly eight - in - ten ( 78 % ) says citizens should be able to decide for themselves whether or not to vote in national elections .",".","",""
mturk_charts/no_data/multi_col/6150.png,"Overall , 36 % say lowering taxes for large businesses and corporations would help the economy , while an identical share ( 36 % ) say it would hurt the economy ; 25 % do n’t think it would make much difference . Views on how these cuts would impact the fairness of the tax system tilt more negative : 44 % say lowering taxes for large businesses and corporations would make the tax system less fair , compared with 25 % who say it would make the system more fair and 27 % who do n’t think it would make much difference .",same,"What are the negative thought about large businesses?",answer1,"44 % say lowering taxes for large businesses and corporations would make the tax system less fair , compared with 25 % who say it would make the system more fair and 27 % who do n’t think it would make much difference .","44 % say lowering taxes for large businesses and corporations would make the tax system less fair , compared with 25 % who say it would make the system more fair and 27 % who do n’t think it would make much difference .","","",""
mturk_charts/no_data/multi_col/6151.png,"Among Republicans and Republican leaners , a wide majority of those with household incomes of $ 75,000 a year or more ( 73 % ) think lowering taxes on corporations and large businesses would help the economy . By comparison , 42 % of Republicans in households making $ 30,000 a year or less think lower taxes for large businesses and corporations would help the economy . Among Democrats and Democratic leaners , the income pattern in views is the reverse : Those with higher incomes are more likely than those with lower incomes to say tax cuts for large businesses and corporations would hurt the economy . About six - in - ten Democrats with incomes of $ 75,000 a year or more ( 61 % ) think lowering taxes on corporations would hurt the economy , compared with 44 % of those earning $ 30,000 a year or less . While Democrats overall think lower taxes on large businesses and corporations would make the tax system less fair , this view is more widely held among those earning $ 75,000 a year or more ( 76 % ) and those earning between $ 30,000 and $ 74,999 ( 61 % ) than among those with household incomes of less than $ 30,000 ( 45 % ) . Among Republicans , those with incomes of $ 75,000 a year or above are more likely to say lowering taxes on large businesses and corporations would make the tax system more fair ( 43 % ) than less fair ( 17 % ) .",same,"What opinion do Democrats and Democratic leaners have about the income pattern?",answer1,"Among Democrats and Democratic leaners , the income pattern in views is the reverse : Those with higher incomes are more likely than those with lower incomes to say tax cuts for large businesses and corporations would hurt the economy . About six - in - ten Democrats with incomes of $ 75,000 a year or more ( 61 % ) think lowering taxes on corporations would hurt the economy , compared with 44 % of those earning $ 30,000 a year or less . While Democrats overall think lower taxes on large businesses and corporations would make the tax system less fair , this view is more widely held among those earning $ 75,000 a year or more ( 76 % ) and those earning between $ 30,000 and $ 74,999 ( 61 % ) than among those with household incomes of less than $ 30,000 ( 45 % ) .","Among Democrats and Democratic leaners , the income pattern in views is the reverse : Those with higher incomes are more likely than those with lower incomes to say tax cuts for large businesses and corporations would hurt the economy . About six - in - ten Democrats with incomes of $ 75,000 a year or more ( 61 % ) think lowering taxes on corporations would hurt the economy , compared with 44 % of those earning $ 30,000 a year or less . While Democrats overall think lower taxes on large businesses and corporations would make the tax system less fair , this view is more widely held among those earning $ 75,000 a year or more ( 76 % ) and those earning between $ 30,000 and $ 74,999 ( 61 % ) than among those with household incomes of less than $ 30,000 ( 45 % ) .","","",""
mturk_charts/no_data/multi_col/6152.png,"Yet the share who says they are very confident in Donald Trump ( 22 % ) is substantially higher than the shares saying this for either Republican leaders ( 9 % ) or Democratic leaders ( 11 % ) in Congress . But the public is also more likely to say they are “ not at all confident ” in Trump ’s decision making on tax policy ( 42 % ) than to say this about either party ’s leaders in Congress ( 31 % say this about GOP leaders , 24 % about Democratic leaders ) .",same,"Why people are not confident on donald trump?",answer2,"the public is also more likely to say they are “ not at all confident ” in Trump ’s decision making on tax policy ( 42 % ) than to say this about either party ’s leaders in Congress ( 31 % say this about GOP leaders , 24 % about Democratic leaders ) .","the public is also more likely to say they are “ not at all confident ” in Trump ’s decision making on tax policy ( 42 % ) than to say this about either party ’s leaders in Congress ( 31 % say this about GOP leaders , 24 % about Democratic leaders ) .","","But",""
mturk_charts/no_data/multi_col/6116.png,"Few transatlantic experts surveyed ( 4 % ) think their country would benefit from having a strong leader who makes decisions without interference from parliament or courts . Publics across Western Europe and North America are largely similar to the experts in their view that such an approach to government would be inappropriate ; a median of 14 % say rule by a strong leader would be good for their country . However , public support varies markedly across countries , ranging from a high of 29 % of Italians who think an unchecked executive is very or somewhat good to a low of 6 % in Germany . Across most of the countries surveyed , those with more education are more opposed to rule by strong leaders . Only 2 % of foreign policy experts think military rule would be appropriate for governing their countries . Publics across Western Europe and North America roughly mirror experts , with a median of 11 % saying they think a military government would be a good thing . Again , though , support varies across countries . Germany and Sweden are the least positive ( 4 % each ) , while Americans , the French and Italians are the most ( 17 % each ) . As with opposition to a strong leader , those with more education tend to be more opposed to rule by the military across most of the countries surveyed .",same,"What the experts views of their approach of government?",answer2,"Few transatlantic experts surveyed ( 4 % ) think their country would benefit from having a strong leader who makes decisions without interference from parliament or courts .","Few transatlantic experts surveyed ( 4 % ) think their country would benefit from having a strong leader who makes decisions without interference from parliament or courts .",".","",""
mturk_charts/no_data/multi_col/6118.png,"Views of events in Russia ’s history differ by the level of confidence in President Vladimir Putin . Russians who trust Putin to do the right thing on the world stage are more likely than those who express no confidence to name World War II as the most important event of the past century ( 35 % vs 24 % ) . This may reflect Putin ’s efforts to promote the war as a defining moment for the Russian nation . Among the small share who express no confidence in Putin , the top historical event is the dissolution of the Soviet Union ( 30 % ) , not World War II .",same,"What opinion do the Russians have about the belief that Putin will do the right thing?",answer1,"Russians who trust Putin to do the right thing on the world stage are more likely than those who express no confidence to name World War II as the most important event of the past century ( 35 % vs 24 % ) . Among the small share who express no confidence in Putin , the top historical event is the dissolution of the Soviet Union ( 30 % ) , not World War II .","Russians who trust Putin to do the right thing on the world stage are more likely than those who express no confidence to name World War II as the most important event of the past century ( 35 % vs 24 % ) . Among the small share who express no confidence in Putin , the top historical event is the dissolution of the Soviet Union ( 30 % ) , not World War II .","Russians trust do right thing on world stage are more likely than those","Russia ’s history differ by level President Vladimir This may reflect ’s efforts promote war a defining moment for Russian nation",""
mturk_charts/no_data/multi_col/6126.png,"Several Asian countries have greater confidence in Trump than in Chinese President Xi Jinping . While Trump faces low global confidence overall , greater shares of people in the Philippines , Vietnam and Japan are confident in Trump than in China ’s leader . ( Within the region , Filipinos had the highest confidence in Xi , at 53 % , while the Japanese had the lowest at 11 % . ) In contrast , people in South Korea were more than twice as likely to have confidence in Xi than Trump regarding world affairs ( 38 % versus 17 % ) .",same,"What opinion do the people have about supporting Trump and Chinese President Xi Jinping .",answer2,"Within the region , Filipinos had the highest confidence in Xi , at 53 % , while the Japanese had the lowest at 11 % . In contrast , people in South Korea were more than twice as likely to have confidence in Xi than Trump regarding world affairs ( 38 % versus 17 % ) .","Within the region , Filipinos had the highest confidence in Xi , at 53 % , while the Japanese had the lowest at 11 % . In contrast , people in South Korea were more than twice as likely to have confidence in Xi than Trump regarding world affairs ( 38 % versus 17 % ) .","Within the region Filipinos had the highest at 53 while the Japanese had the lowest at 11","",""
mturk_charts/no_data/multi_col/7035.png,"Those who consistently stayed with their parties expressed strong views of Trump , both positive and negative . In April 2017 , 84 % of those who consistently identified with or leaned toward the Republican Party approved of Trump ’s job performance – with 66 % approving strongly .",same,"What is the distribution of Republicans who approve Trump's job performance?",answer2,"84 % of those who consistently identified with or leaned toward the Republican Party approved of Trump ’s job performance – with 66 % approving strongly .","84 % of those who consistently identified with or leaned toward the Republican Party approved of Trump ’s job performance – with 66 % approving strongly .",".","In April 2017 ,",""
mturk_charts/no_data/multi_col/7037.png,"There is somewhat more change among political independents than among partisans . However , 78 % of those who did not identify as Republicans or Democrats in December 2015 also did not affiliate with either party in March 2017 . Among the remaining 22 % , nearly equal shares ended up identifying as Democrats ( 12 % ) and Republicans ( 10 % ) . Among nonpartisans who leaned toward a party in December 2015 , roughly six - in - ten leaned toward the same party in March of this year . There was more movement during this period among leaners than partisans . For instance , 16 % of those who initially leaned Republican eventually called themselves Democrats ( either identified or leaned Democratic ) ; a comparable share of those who initially leaned Democratic became Republicans or Republican leaners ( 14 % ) .",same,"What was the trend among nonpartisans who leaned towards a party in December 2015?",answer1,"Among nonpartisans who leaned toward a party in December 2015 , roughly six - in - ten leaned toward the same party in March of this year .","Among nonpartisans who leaned toward a party in December 2015 , roughly six - in - ten leaned toward the same party in March of this year .",".","",""
mturk_charts/no_data/multi_col/7045.png,"There are also sizable differences in views about this issue by age , with younger adults ages 18 to 29 especially likely ( 66 % ) to see government regulations as necessary . Seniors 65 and older , however , think the private marketplace is the most effective way to increase reliance on renewable energy sources by a 50%-41 % margin . Differences by age hold even when accounting for the tendency of older adults to identify with the GOP .",same,"What do people who are 65 years old or more think about the private marketplace?",answer1,"Seniors 65 and older , however , think the private marketplace is the most effective way to increase reliance on renewable energy sources by a 50%-41 % margin .","Seniors 65 and older , however , think the private marketplace is the most effective way to increase reliance on renewable energy sources by a 50%-41 % margin .",".","",""
mturk_charts/no_data/multi_col/6943.png,"One - in - seven U.S. infants ( 14 % ) are multiracial or multiethnic . This share is nearly triple the share ( 5 % ) in 1980 . Multiracial or multiethnic infants include children younger than 1 year old who live with two parents and whose parents are each of a different race , those with one Hispanic and one non - Hispanic parent , and those with at least one parent who identifies as multiracial .",same,"What is the distribution of the Multiracial population?",same,"One - in - seven U.S. infants ( 14 % ) are multiracial or multiethnic . This share is nearly triple the share ( 5 % ) in 1980 . Multiracial or multiethnic infants include children younger than 1 year old who live with two parents and whose parents are each of a different race , those with one Hispanic and one non - Hispanic parent , and those with at least one parent who identifies as multiracial","One - in - seven U.S. infants ( 14 % ) are multiracial or multiethnic . This share is nearly triple the share ( 5 % ) in 1980 . Multiracial or multiethnic infants include children younger than 1 year old who live with two parents and whose parents are each of a different race , those with one Hispanic and one non - Hispanic parent , and those with at least one parent who identifies as multiracial","","",""
