img_path,summary,question_resolution,question,answer_resolution,abstractive_answer,extractive_answer,decontextualizated_text_added,decontextualizated_text_removed,extra_added_text
mturk_charts/no_data/multi_col/8895.png,"Much like ride - hailing apps , the legal and regulatory status of home - sharing services has been the subject of much debate in cities around the country . But in contrast to ride - hailing , relatively few Americans have been following the debate over home - sharing services : 22 % of Americans have heard something about this issue , with just 6 % indicating that they have heard “ a lot ” about it . Even users of home - sharing services themselves are not following this issue particularly closely : Just 19 % of home - sharing users have heard “ a lot ” about it , while 37 % have heard “ a little . ” But although home - sharing users have not been following the legal debate over these services with nearly the same intensity as their ride - hailing counterparts , those home - sharing users who have been following this issue tend to feel that these services should be both legal and tax - free for owners . Among home - sharing users who are aware of the legal debate over these services , 56 % believe that these services should be legal , and that owners should not have to pay any local hotel or lodging taxes ; just 31 % believe that owners should be able to legally rent out these services but should have to pay taxes for the privilege of doing so .",same,Discuss what home-sharing users have heard about its legality?,answer2,"Home - sharing services has been the subject of much debate in cities around the country . Just 19 % of home - sharing users have heard “ a lot ” about it , while 37 % have heard “ a little . ”","home - sharing services has been the subject of much debate in cities around the country . Just 19 % of home - sharing users have heard “ a lot ” about it , while 37 % have heard “ a little . ”",,Much like ride hailing apps legal and regulatory status But contrast to ride hailing relatively few Americans following over : 22 Americans something this issue with just 6 indicating that they Even themselves are not following this issue particularly closely : But although not following legal over these with nearly same intensity as their ride hailing counterparts those who following this issue tend to feel that these should be both legal and tax free for owners Among who are aware legal over these 56 believe that these should be legal and that owners should not to pay any local hotel or lodging taxes ; just 31 believe that owners should be able to legally rent out these but should to pay taxes for privilege doing so, 
mturk_charts/no_data/multi_col/8896.png,"Users frequently contribute to crowdfunding projects as a way to help individuals in need . Fully 68 % of crowdfunding donors have contributed to a project to help someone facing some sort of hardship or financial challenge , making it the most common type of project of the five evaluated in this survey . In addition to these types of projects : Contributions to help someone in need are more often directed toward a person who is already known by the donor , as opposed to a stranger or a public figure . Among those who have contributed to a crowdsourced project to help someone in need , 63 % say they have given to help a friend of a friend or an acquaintance , while 62 % have contributed to help a close friend or member of their family . By contrast , just 7 % of these donors have given to a campaign to assist a public figure , while 28 % have given to help someone who was not a public figure but whom they did not know personally .",same,Comment on crowdfunding trends for people facing hardship or financial challenges?,answer2,Fully 68 % of crowdfunding donors have contributed to a project to help someone facing some sort of hardship or financial challenge .,Fully 68 % of crowdfunding donors have contributed to a project to help someone facing some sort of hardship or financial challenge .,,"Users frequently contribute projects as way individuals in need , making it the most common type the five evaluated in this survey In addition these types projects : Contributions in need are more often directed toward person who is already known by the donor , as opposed stranger public figure Among those who crowdsourced in need , 63 say they given friend friend an acquaintance , while 62 close friend member their family By contrast , just 7 these given campaign assist public figure , while 28 given who was not public figure but whom they did not know personally", 
mturk_charts/no_data/multi_col/8897.png,"Users frequently contribute to crowdfunding projects as a way to help individuals in need . Fully 68 % of crowdfunding donors have contributed to a project to help someone facing some sort of hardship or financial challenge , making it the most common type of project of the five evaluated in this survey . In addition to these types of projects : Men and women differ in a number of ways when it comes to their use of crowdfunding platforms . Male donors are roughly twice as likely as female donors to have contributed to six or more projects , and are also nearly twice as likely to have contributed more than $ 100 to an individual project . And while women are more likely to contribute to a project to help someone in need , men are more likely to help fund new products or inventions , as well as projects for musicians or other creative artists . Younger men are especially interested in funding new products and inventions : 48 % of men ages 18 - 49 who have made a crowdfunding donation have contributed to this type of project .",same,Compare male and female crowdfunding differences?,answer2,"Male donors are roughly twice as likely as female donors to have contributed to six or more projects , and are also nearly twice as likely to have contributed more than $ 100 to an individual project .","Male donors are roughly twice as likely as female donors to have contributed to six or more projects , and are also nearly twice as likely to have contributed more than $ 100 to an individual project .",", .",, 
mturk_charts/no_data/multi_col/8898.png,"For instance , while a majority of Israeli Muslims ( 68 % ) say religion is very important in their lives , this share is substantially lower than the 89 % who say the same in Morocco or the 85 % in the nearby Palestinian territories and Jordan . Lebanon is the only country polled in the region where a slim majority of Muslims say religion is very important in their personal lives ( 59 % ) .",same,What is distribution of Muslims saying religion is very important to their lives?,answer2,"While a majority of Israeli Muslims ( 68 % ) say religion is very important in their lives , this share is substantially lower than the 89 % who say the same in Morocco or the 85 % in the nearby Palestinian territories and Jordan . Lebanon is the only country polled in the region where a slim majority of Muslims say religion is very important in their personal lives ( 59 % ) .","while a majority of Israeli Muslims ( 68 % ) say religion is very important in their lives , this share is substantially lower than the 89 % who say the same in Morocco or the 85 % in the nearby Palestinian territories and Jordan . Lebanon is the only country polled in the region where a slim majority of Muslims say religion is very important in their personal lives ( 59 % ) .",,, 
mturk_charts/no_data/multi_col/8909.png,"A study from 2014 also revealed that conservatives and liberals have different experiences seeing posts about politics on Facebook . About half of Facebook users who express consistently conservative views across a range of political values questions ( 47 % ) see posts on the site that align with their views all or most of the time , compared with only about a third ( 32 % ) of those who express consistently liberal views . However , a larger share of these consistently liberal Facebook users than of consistent conservatives have de - friended , hidden or blocked someone because of something that friend posted about politics ( 44 % , vs. 31 % ) . Both groups , however , are more likely than those with more mixed political views to report seeing like - minded views and blocking others at much higher rates . Overall , most Facebook users see a mix of views on the platform : Only about a quarter of Facebook users ( 23 % ) see views that align with their own all or most of the time .",same,Compare conservatives and liberals posting trends on Facebook?,answer2,"About half of Facebook users who express consistently conservative views across a range of political values questions ( 47 % ) see posts on the site that align with their views all or most of the time , compared with only about a third ( 32 % ) of those who express consistently liberal views .","About half of Facebook users who express consistently conservative views across a range of political values questions ( 47 % ) see posts on the site that align with their views all or most of the time , compared with only about a third ( 32 % ) of those who express consistently liberal views .",.,, 
mturk_charts/no_data/multi_col/8911.png,"Yet there are key differences within the two parties as well . Among Republicans , 71 % of conservative Republicans oppose allowing gays and lesbians to marry legally , more than twice the share of GOP moderates and liberals ( 34 % ) . A 55 % majority of moderate and liberal Republicans favor allowing same - sex marriage . Within the GOP , these ideological differences also are notable across voters ’ primary preferences for the party ’s 2016 presidential nominee . About half ( 52 % ) of GOP voters who back Donald Trump ( now the party ’s presumptive nominee ) say they oppose same - sex marriage , compared with 70 % who preferred Ted Cruz and just 37 % who backed John Kasich .",same,Compare ideological differences in views about same sex marriage?,answer2,"Among Republicans , 71 % of conservative Republicans oppose allowing gays and lesbians to marry legally , more than twice the share of GOP moderates and liberals ( 34 % ) . A 55 % majority of moderate and liberal Republicans favor allowing same - sex marriage .","Among Republicans , 71 % of conservative Republicans oppose allowing gays and lesbians to marry legally , more than twice the share of GOP moderates and liberals ( 34 % ) . A 55 % majority of moderate and liberal Republicans favor allowing same - sex marriage .",,Yet there are key differences within two parties as well Within these ideological differences also are notable across voters ’ primary preferences for party ’s 2016 presidential nominee About half 52 voters who back Donald Trump now party ’s presumptive nominee say they compared with 70 who preferred Ted Cruz just 37 who backed John Kasich, 
mturk_charts/no_data/multi_col/8922.png,"The challenges of polling Asian Americans are likely to persist in the foreseeable future , though some trends may make this task easier . Among U.S. adults , Asians are projected to be the third - fastest - growing racial / ethnic group behind Hispanics and multiracial adults . By 2030 , Asians will make up 6.9 % of U.S. adults , and by 2060 , they will make up 9.4 % of the adult population .",same,Describe trends in Asian population among Americans from 2030 to 2060?,answer2,"Among U.S. adults , Asians are projected to be the third - fastest - growing racial / ethnic group behind Hispanics and multiracial adults . By 2030 , Asians will make up 6.9 % of U.S. adults , and by 2060 , they will make up 9.4 % of the adult population .","Among U.S. adults , Asians are projected to be the third - fastest - growing racial / ethnic group behind Hispanics and multiracial adults . By 2030 , Asians will make up 6.9 % of U.S. adults , and by 2060 , they will make up 9.4 % of the adult population .",,The challenges polling Asian Americans likely persist in foreseeable future though some trends may this task easier, 
mturk_charts/no_data/multi_col/8941.png,"The public ’s wariness toward global engagement extends to U.S. participation in the global economy . Nearly half of Americans ( 49 % ) say U.S. involvement in the global economy is a bad thing because it lowers wages and costs jobs ; fewer ( 44 % ) see this as a good thing because it provides the U.S. with new markets and opportunities for growth . Trump ’s primary campaign supporters stand out for their negative assessments of U.S. involvement in the global economy . Fully 65 % of Republican registered voters who prefer Trump for the Republican presidential nomination say U.S. involvement in the global economy is a bad thing , compared with only about half of those who prefer Cruz ( 49 % ) or Kasich ( 46 % ) .",same,What are American views of US involvement in global economy?,answer2,The public ’s wariness toward global engagement extends to U.S. participation in the global economy . Nearly half of Americans ( 49 % ) say U.S. involvement in the global economy is a bad thing because it lowers wages and costs jobs ; fewer ( 44 % ) see this as a good thing because it provides the U.S. with new markets and opportunities for growth .,The public ’s wariness toward global engagement extends to U.S. participation in the global economy . Nearly half of Americans ( 49 % ) say U.S. involvement in the global economy is a bad thing because it lowers wages and costs jobs ; fewer ( 44 % ) see this as a good thing because it provides the U.S. with new markets and opportunities for growth .,,"Trump primary campaign supporters stand out their negative assessments Fully 65 Republican registered voters who prefer Trump Republican presidential nomination , compared only about those who prefer Cruz or Kasich 46", 
mturk_charts/no_data/multi_col/8946.png,"Sanders supporters stand out for civil liberties concerns . Half of Americans say their bigger concern about government anti - terrorism policies is that they have not gone far enough to adequately protect the country ; 35 % are more concerned that they have gone too far in restricting civil liberties . Large majorities of Republican voters , regardless of their primary preference , say their bigger concern is that anti - terror policies have not gone far enough to protect the country . On the Democratic side , supporters of the two candidates differ in their views . Among Sanders supporters , 51 % say their bigger concern is that U.S. policies have gone too far in restricting civil liberties , while 33 % say they have not gone far enough in protecting the U.S. Opinion among Clinton supporters is reversed ( 51 % not gone far enough , 35 % too far ) .",same,What are views of anti-terrorism policies among Sanders supporters?,answer2,"Among Sanders supporters , 51 % say their bigger concern is that U.S. policies have gone too far in restricting civil liberties , while 33 % say they have not gone far enough in protecting the U.S.","Among Sanders supporters , 51 % say their bigger concern is that U.S. policies have gone too far in restricting civil liberties , while 33 % say they have not gone far enough in protecting the U.S.",,Opinion among Clinton reversed ( 35 ) ., 
mturk_charts/no_data/multi_col/8959.png,"More adults ( 31 % ) say the health care law has had a mostly negative effect on themselves and their families than say it has had a mostly positive one ( 23 % ) , while 45 % say it not has had much of an effect . The share saying the law has not has much an effect has declined over the past three years , but the balance of opinion about the law ’s personal impact has remained more negative than positive .",same,What are views of families on the impact of the health care laws?,answer2,"More adults ( 31 % ) say the health care law has had a mostly negative effect on themselves and their families than say it has had a mostly positive one ( 23 % ) , while 45 % say it not has had much of an effect .","More adults ( 31 % ) say the health care law has had a mostly negative effect on themselves and their families than say it has had a mostly positive one ( 23 % ) , while 45 % say it not has had much of an effect .",,The share saying declined over past three years but balance opinion about ’s personal impact remained more, 
mturk_charts/no_data/multi_col/8960.png,"By roughly the same margin ( 37 % to 30 % ) , more say that , looking ahead , the health care law will have a mostly negative than a mostly positive personal impact , while 30 % say it will not have much of an effect . This is little changed over the last few years .",same,What are trends in views of the health care law?,answer2,"By roughly the same margin ( 37 % to 30 % ) , more say that , looking ahead , the health care law will have a mostly negative than a mostly positive personal impact , while 30 % say it will not have much of an effect . This is little changed over the last few years .","By roughly the same margin ( 37 % to 30 % ) , more say that , looking ahead , the health care law will have a mostly negative than a mostly positive personal impact , while 30 % say it will not have much of an effect . This is little changed over the last few years .",,, 
mturk_charts/no_data/multi_col/8962.png,"As in the past , young people view the ACA more positively than do older adults . Among those younger than 30 , about as many approve ( 50 % ) as disapprove ( 47 % ) of the health care law . Among older age groups , more disapprove than approve .",same,Describe age differences in views of health care law?,answer2,"Among those younger than 30 , about as many approve ( 50 % ) as disapprove ( 47 % ) of the health care law . Among older age groups , more disapprove than approve .","Among those younger than 30 , about as many approve ( 50 % ) as disapprove ( 47 % ) of the health care law . Among older age groups , more disapprove than approve .",,As in past young people view ACA positively do adults, 
mturk_charts/no_data/multi_col/8965.png,"In Pakistan , the Palestinian territories , Jordan , Malaysia and Senegal , roughly half or more of the full population says that laws in their country should strictly follow the teachings of the Quran . By contrast , in Burkina Faso , Turkey , Lebanon and Indonesia , less than a quarter agree . And in many of these countries where non - Muslims make up a significant portion of the population , there are strong disagreements between major religious groups on this issue . For example , a 42 % plurality of Nigerians think laws should not be influenced by the Quran , while 27 % think laws should strictly follow the teachings of the Quran . 		 However , among Nigerian Muslims , 52 % say national laws should conform to Islamic law , compared with only 2 % among Nigerian Christians .",same,Describe the distribution of countries saying their laws should strictly follow Quran?,answer2,"In Pakistan , the Palestinian territories , Jordan , Malaysia and Senegal , roughly half or more of the full population says that laws in their country should strictly follow the teachings of the Quran . By contrast , in Burkina Faso , Turkey , Lebanon and Indonesia , less than a quarter agree .","In Pakistan , the Palestinian territories , Jordan , Malaysia and Senegal , roughly half or more of the full population says that laws in their country should strictly follow the teachings of the Quran . By contrast , in Burkina Faso , Turkey , Lebanon and Indonesia , less than a quarter agree .",,And many these countries where non - Muslims make up significant portion there are strong disagreements between major religious groups on this issue For example 42 % plurality Nigerians think not be influenced by while 27 % think However among Nigerian Muslims 52 % say national conform to Islamic law compared with only 2 % among Nigerian Christians, 
mturk_charts/no_data/multi_col/8969.png,"The idea that an independent Palestinian state can peacefully coexist with Israel has been the cornerstone of many Arab - Israeli peace initiatives in recent years . But while significant shares of Israeli Arabs and Jews are optimistic about the prospect of a two - state solution , the Arabs currently in the Palestinian territories are less so . Half of Israeli Arabs ( citizens and residents living within the boundaries of Israel , as defined in the 2008 census conducted by Israel ’s Central Bureau of Statistics ) say it is possible for Israel and an independent Palestinian state to coexist peacefully together , according to 2015 Pew Research Center surveys . By contrast , less than one - third of Arabs living in the Palestinian territories say a two - state solution is possible ( 28 % ) . Jewish public opinion in Israel is divided on this question – 43 % say a two - state solution is possible , while 45 % disagree .",same,"What are views of Israeli Arabs, Jews and Palestinians on peaceful coexistence of independent Palestinian state? ",answer2,"Half of Israeli Arabs say it is possible for Israel and an independent Palestinian state to coexist peacefully together , according to 2015 Pew Research Center surveys . By contrast , less than one - third of Arabs living in the Palestinian territories say a two - state solution is possible ( 28 % ) . Jewish public opinion in Israel is divided on this question – 43 % say a two - state solution is possible , while 45 % disagree .","Half of Israeli Arabs say it is possible for Israel and an independent Palestinian state to coexist peacefully together , according to 2015 Pew Research Center surveys . By contrast , less than one - third of Arabs living in the Palestinian territories say a two - state solution is possible ( 28 % ) . Jewish public opinion in Israel is divided on this question – 43 % say a two - state solution is possible , while 45 % disagree .",,The idea that can with has been cornerstone many Arab peace initiatives recent years But significant shares Jews are optimistic about prospect currently are so citizens residents within boundaries as defined 2008 census conducted by ’s Central Bureau Statistics, 
mturk_charts/no_data/multi_col/8970.png,"However , both Israeli Arabs and Arabs living in the Palestinian territories share a common skepticism about current efforts to achieve a peace settlement . Most Israeli Arabs ( 72 % ) and Arabs living in the Palestinian territories ( 84 % ) say the Israeli government is not making a sincere effort to bring peace to the region .",same,What do Israeli Arabs and Palestinians say about the Israeli government?,answer2,Both Israeli Arabs and Arabs living in the Palestinian territories share a common skepticism about current efforts to achieve a peace settlement . Most Israeli Arabs ( 72 % ) and Arabs living in the Palestinian territories ( 84 % ) say the Israeli government is not making a sincere effort to bring peace to the region .,both Israeli Arabs and Arabs living in the Palestinian territories share a common skepticism about current efforts to achieve a peace settlement . Most Israeli Arabs ( 72 % ) and Arabs living in the Palestinian territories ( 84 % ) say the Israeli government is not making a sincere effort to bring peace to the region .,,"However ,", 
mturk_charts/no_data/multi_col/8972.png,"Jehovah ’s Witnesses , who make up just less than 1 % of U.S. adults , are known for their door - to - door proselytism . But members of this denomination , which has its origins in 19th - century America , are also unique in many other ways . Here are a few facts about Jehovah ’s Witnesses in the United States today , based on Pew Research Center ’s Religious Landscape Study : Jehovah ’s Witnesses are among the most racially and ethnically diverse religious groups in America . No more than four - in - ten members of the group belong to any one racial and ethnic background : 36 % are white , 32 % are Hispanic , 27 % are black and 6 % are another race or mixed race .",same,Describe demographic makeup of Jehovah's Witnesses?,answer2,"Jehovah ’s Witnesses are among the most racially and ethnically diverse religious groups in America . No more than four - in - ten members of the group belong to any one racial and ethnic background : 36 % are white , 32 % are Hispanic , 27 % are black and 6 % are another race or mixed race .","Jehovah ’s Witnesses are among the most racially and ethnically diverse religious groups in America . No more than four - in - ten members of the group belong to any one racial and ethnic background : 36 % are white , 32 % are Hispanic , 27 % are black and 6 % are another race or mixed race .",,who make up just less 1 U.S. adults known for their door door proselytism But this denomination which has its origins 19th century also unique many other ways Here a few facts about United States today based on Pew Research Center Religious Landscape Study, 
mturk_charts/no_data/multi_col/8974.png,"In the new study , nearly a quarter of Americans ( 23 % ) have either consistently liberal ( 13 % ) or consistently conservative views ( 10 % ) . In 2004 , just 11 % were either consistently liberal ( 8 % ) or consistently conservative ( 3 % ) .",same,write about Hispanic people population and age ?,answer2,"In the study , Americans with some college experience in 2004 have either consistently liberal ( 13 % ) or consistently conservative views ( 10 % ) .","In the study , Americans have either consistently liberal ( 13 % ) or consistently conservative views ( 10 % ) .",,new nearly a quarter of 23 2004 just 11 were 8 3, 
