img_path,summary,question_resolution,question,answer_resolution,abstractive_answer,extractive_answer,decontextualizated_text_added,decontextualizated_text_removed,extra_added_text
mturk_charts/no_data/multi_col/8986.png,"While New York is no longer the home to the largest number of immigrants , its immigrant population is more diverse than those of California or Texas . Large shares of California ’s and Texas ’ immigrant populations are from Mexico and South and East Asia . By contrast , about a quarter of immigrants in New York are from the Caribbean ( 24 % ) and another 24 % are from South and East Asia . Another 19 % are from Europe or Canada and Central and South America , each . Only 6 % of immigrants in New York are from Mexico .",same,Tell about immigrant makeup of New York?,answer2,"About a quarter of immigrants in New York are from the Caribbean ( 24 % ) and another 24 % are from South and East Asia . Another 19 % are from Europe or Canada and Central and South America , each . Only 6 % of immigrants in New York are from Mexico .","about a quarter of immigrants in New York are from the Caribbean ( 24 % ) and another 24 % are from South and East Asia . Another 19 % are from Europe or Canada and Central and South America , each . Only 6 % of immigrants in New York are from Mexico .",,While is no longer home to largest number its immigrant population is more diverse than those California Texas Large shares California ’s Texas ’ immigrant populations By contrast, 
mturk_charts/no_data/multi_col/8989.png,"China and India make the list mainly because of their large populations . Currently centenarians make up a very small share , proportionally , of these relatively young countries . But they make up a larger share of the total populations of rapidly aging Japan and Italy . Today , there are 4.8 centenarians for every 10,000 people in Japan and 4.1 in Italy .",same,Describe distribution of people older than 100 in Japan and Italy?,answer2,"Today , there are 4.8 centenarians for every 10,000 people in Japan and 4.1 in Italy .","Today , there are 4.8 centenarians for every 10,000 people in Japan and 4.1 in Italy .",,China India make the list mainly because of their large populations Currently make up a very small share proportionally of these relatively young countries But they make up a larger share of the total populations of rapidly aging, 
mturk_charts/no_data/multi_col/8992.png,"Hispanics are the youngest major racial or ethnic group in the United States . About one - third , or 17.9 million , of the nation ’s Hispanic population is younger than 18 , and about a quarter , or 14.6 million , of all Hispanics are Millennials ( ages 18 to 33 in 2014 ) , according to a Pew Research Center analysis of U.S. Census Bureau data . Altogether , 		  nearly six - in - ten Hispanics are Millennials or younger .",same,Comment on Hispanic population that are Millennial or younger?,answer2,"Altogether ,   nearly six - in - ten Hispanics are Millennials","Altogether ,   nearly six - in - ten Hispanics are Millennials or younger .", ,the youngest major racial ethnic group the United States About one third 17.9 million of the nation ’s Hispanic population is than 18 and about a quarter 14.6 million of all ( ages 18 to 33 2014 ) according to a Pew Research Center analysis of U.S. Census Bureau data, 
mturk_charts/no_data/multi_col/8997.png,"Because so few children come to the U.S. as immigrants , young Hispanics are overwhelmingly U.S. born . Among children younger than 18 , 94 % are U.S. born , and about two - thirds of Hispanic Millennials ( 65 % ) were born in the U.S. This compares with about four - in - ten Gen Xers , Boomers and older adults who are U.S. born .",same,What is generational distribution of US born Hispanics?,answer2,"Young Hispanics are overwhelmingly U.S. born . Among children younger than 18 , 94 % are U.S. born , and about two - thirds of Hispanic Millennials ( 65 % ) were born in the U.S. This compares with about four - in - ten Gen Xers , Boomers and older adults who are U.S. born .","young Hispanics are overwhelmingly U.S. born . Among children younger than 18 , 94 % are U.S. born , and about two - thirds of Hispanic Millennials ( 65 % ) were born in the U.S. This compares with about four - in - ten Gen Xers , Boomers and older adults who are U.S. born .",,Because so few come to as immigrants, 
mturk_charts/no_data/multi_col/8998.png,"For Gen Xers , who came of age during a period of high immigration , the pattern holds , but is not quite as stark . In 1998 , when they were ages 18 to 33 , half of Hispanic Gen Xers were U.S. born , compared with a 41 % U.S.-born share when they were ages 34 to 49 in 2014 .",same,Compare Gen Xers ages in 1998 and 2014?,answer2,"For Gen Xers in 1998 , when they were ages 18 to 33 , half of Hispanic Gen Xers were U.S. born , compared with a 41 % U.S.-born share when they were ages 34 to 49 in 2014 .","For Gen Xers In 1998 , when they were ages 18 to 33 , half of Hispanic Gen Xers were U.S. born , compared with a 41 % U.S.-born share when they were ages 34 to 49 in 2014 .",,who came age during period high immigration the pattern holds but is not quite as stark, 
mturk_charts/no_data/multi_col/8999.png,"With a higher U.S.-born share comes a larger share who are proficient in English . 		 About three - quarters of Hispanic Millennials are proficient English speakers – that is , they either speak only English at home ( 28 % ) or speak a language other than English at home , but speak English “ very well ” ( 48 % ) .  		  Some 19 % of Hispanic Millennials speak English less than very well and just 5 % do not speak English at all .",same,Discuss English speaking trends among Hispanic Millennials?,answer2," About three - quarters of Hispanic Millennials are proficient English speakers – that is , they either speak only English at home ( 28 % ) or speak a language other than English at home , but speak English “ very well ” ( 48 % ) . Some 19 % of Hispanic Millennials speak English less than very well and just 5 % do not speak English at all ."," About three - quarters of Hispanic Millennials are proficient English speakers – that is , they either speak only English at home ( 28 % ) or speak a language other than English at home , but speak English “ very well ” ( 48 % ) .    Some 19 % of Hispanic Millennials speak English less than very well and just 5 % do not speak English at all .",   ,With higher U.S.-born share comes larger share who in, 
mturk_charts/no_data/multi_col/9051.png,"Americans tend to prioritize individual liberty , while Europeans tend to value the role of the state to ensure no one in society is in need . Nearly six - in - ten in the U.S. ( 58 % ) believe allowing everyone to pursue their life ’s goals without interference from the state is more important . Majorities in all European nations polled in 2011 said guaranteeing that nobody is in need is more important .",same,What are priorities of US compared to European nations?,answer2,"Americans tend to prioritize individual liberty , while Europeans tend to value the role of the state to ensure no one in society is in need . Nearly six - in - ten in the U.S. ( 58 % ) believe allowing everyone to pursue their life ’s goals without interference from the state is more important . Majorities in all European nations polled in 2011 said guaranteeing that nobody is in need is more important .","Americans tend to prioritize individual liberty , while Europeans tend to value the role of the state to ensure no one in society is in need . Nearly six - in - ten in the U.S. ( 58 % ) believe allowing everyone to pursue their life ’s goals without interference from the state is more important . Majorities in all European nations polled in 2011 said guaranteeing that nobody is in need is more important .",,, 
mturk_charts/no_data/multi_col/9052.png,"There is greater tolerance in the U.S. than in Europe for offensive speech . A solid majority ( 77 % ) of Americans believe citizens should be allowed to make statements that are offensive to people ’s religious beliefs , a significantly higher share of the public than in any of the European Union nations included in our 2015 survey . In Poland , Germany and Italy , fewer than half think this kind of speech should be legal . Similarly , Americans are more likely to say offensive statements about minority groups should be permitted .",same,Compare views of US to other European nations on offensive language to religious beliefs?,answer2,"There is greater tolerance in the U.S. than in Europe for offensive speech . A solid majority ( 77 % ) of Americans believe citizens should be allowed to make statements that are offensive to people ’s religious beliefs , a significantly higher share of the public than in any of the European Union nations included in our 2015 survey . In Poland , Germany and Italy , fewer than half think this kind of speech should be legal .","There is greater tolerance in the U.S. than in Europe for offensive speech . A solid majority ( 77 % ) of Americans believe citizens should be allowed to make statements that are offensive to people ’s religious beliefs , a significantly higher share of the public than in any of the European Union nations included in our 2015 survey . In Poland , Germany and Italy , fewer than half think this kind of speech should be legal .",,Similarly more likely say about minority groups permitted, 
mturk_charts/no_data/multi_col/9054.png,"Americans and Europeans do n’t always agree on questions about morality , especially on issues related to sexuality . For instance , while just 30 % in the U.S. think sex between unmarried adults is morally unacceptable , this is nonetheless significantly higher than what our 2013 poll found in Europe . And while adultery is widely frowned upon in the EU – except , notably , in France – Americans are even more likely to say having an affair is morally unacceptable .",same,Compare views of US to European nations on morality?,answer2,Americans and Europeans do n’t always agree on questions about morality . Americans are even more likely to say having an affair is morally unacceptable .,Americans and Europeans do n’t always agree on questions about morality . Americans are even more likely to say having an affair is morally unacceptable .,,", especially issues related sexuality For instance , while just 30 % in the U.S. think sex between unmarried adults , this nonetheless significantly higher than what our 2013 poll found in Europe And while adultery widely frowned upon in the EU – except , notably , in France –", 
mturk_charts/no_data/multi_col/9104.png,"Drought tops the list of climate change concerns . We read respondents a list of four potential effects of global warming , and asked which one concerns them the most : droughts or water shortages ; severe weather , such as floods or intense storms ; long periods of unusually hot weather ; or rising sea levels . In 31 nations , drought is a top worry . Fully half of Americans name drought as their chief climate change concern , and this is especially true in drought - plagued Western states compared with other regions of the country .",same,Discuss US worries on drought?,answer2,Fully half of Americans name drought as their chief climate change concern .,Fully half of Americans name drought as their chief climate change concern .,,"Drought tops the list concerns We read respondents a list four potential effects global warming , and asked which one concerns them the most : droughts or water shortages ; severe weather , such floods or intense storms ; long periods unusually hot weather ; or rising sea levels In 31 nations , is a top worry , and this is especially true in - plagued Western states compared with other regions the country", 
mturk_charts/no_data/multi_col/9105.png,"Most people in the countries we surveyed say rich nations should do more than developing nations to address climate change . A median of 54 % agree with the statement “ Rich countries , such as the U.S. , Japan and Germany , should do more than developing countries because they have produced most of the world ’s greenhouse gas emissions so far . ” A median of just 38 % think “ developing countries should do just as much as rich countries because they will produce most of the world ’s greenhouse gas emissions in the future . ” Notably , the U.S. is among a small group of countries in which half or more believe developing countries should do just as much – half of Americans hold this view , while only four - in - ten want rich countries to shoulder more of the costs .",same,Describe global views on responsibility towards climate change?,answer2,"Most people in the countries surveyed say rich nations should do more than developing nations to address climate change . A median of 54 % agree with the statement “ Rich countries , such as the U.S. , Japan and Germany , should do more than developing countries because they have produced most of the world ’s greenhouse gas emissions so far . ” A median of just 38 % think “ developing countries should do just as much as rich countries because they will produce most of the world ’s greenhouse gas emissions in the future . ” Notably , the U.S. is among a small group of countries in which half or more believe developing countries should do just as much – half of Americans hold this view , while only four - in - ten want rich countries to shoulder more of the costs .","Most people in the countries surveyed say rich nations should do more than developing nations to address climate change . A median of 54 % agree with the statement “ Rich countries , such as the U.S. , Japan and Germany , should do more than developing countries because they have produced most of the world ’s greenhouse gas emissions so far . ” A median of just 38 % think “ developing countries should do just as much as rich countries because they will produce most of the world ’s greenhouse gas emissions in the future . ” Notably , the U.S. is among a small group of countries in which half or more believe developing countries should do just as much – half of Americans hold this view , while only four - in - ten want rich countries to shoulder more of the costs .",,we, 
mturk_charts/no_data/multi_col/9103.png,"People in countries with high per - capita levels of carbon emissions are less intensely concerned about climate change . Among the nations we surveyed , the U.S. has the highest carbon emissions per capita , but it is among the least concerned about climate change and its potential impact . Others in this category are Australia , Canada and Russia . Publics in Africa , Latin America and Asia , many of which have very low emissions per capita , are frequently the most concerned about the negative effects of climate change . Climate change is not seen as a distant threat . A global median of 51 % say climate change is already harming people around the world , while another 28 % believe it will do so in the next few years . This view is especially common in Latin America . For instance , fully 90 % of Brazilians say climate change is harming people now . Europeans are also particularly likely to hold this opinion . However , only 41 % of Americans believe people are being harmed by climate change today .",same,Describe global concerns on climate change?,answer2,"Climate change is not seen as a distant threat . A global median of 51 % say climate change is already harming people around the world , while another 28 % believe it will do so in the next few years .","Climate change is not seen as a distant threat . A global median of 51 % say climate change is already harming people around the world , while another 28 % believe it will do so in the next few years .",,People countries with high per - capita levels carbon emissions are less intensely concerned about Among nations we surveyed U.S. has highest carbon emissions per capita but among least concerned about and its potential impact Others this category are Australia Canada and Russia Publics Africa Latin America and Asia many which have very low emissions per capita are frequently most concerned about negative effects This view especially common Latin America For instance fully 90 Brazilians now Europeans are also particularly likely to hold this opinion However only 41 Americans are being harmed by today, 
mturk_charts/no_data/multi_col/9106.png,"Most people in the countries we surveyed say rich nations should do more than developing nations to address climate change . A median of 54 % agree with the statement “ Rich countries , such as the U.S. , Japan and Germany , should do more than developing countries because they have produced most of the world ’s greenhouse gas emissions so far . ” A median of just 38 % think “ developing countries should do just as much as rich countries because they will produce most of the world ’s greenhouse gas emissions in the future . ” Notably , the U.S. is among a small group of countries in which half or more believe developing countries should do just as much – half of Americans hold this view , while only four - in - ten want rich countries to shoulder more of the costs .",same,Compare responsibility of developed to developing countries on global warming?,answer2,"A median of 54 % agree with the statement “ Rich countries , should do more than developing countries . ” A median of just 38 % think “ developing countries should do just as much as rich countries . ”","A median of 54 % agree with the statement “ Rich countries , should do more than developing countries . ” A median of just 38 % think “ developing countries should do just as much as rich countries . ”",,such U.S. Japan and Germany because they have produced most world ’s greenhouse gas emissions so far because they will produce most world ’s greenhouse gas emissions in future, 
mturk_charts/no_data/multi_col/9109.png,"But , judging by the results of our recently released survey on religion in everyday life , religion does indeed seem to be a subject many people avoid . About half of U.S. adults tell us they seldom ( 33 % ) or never ( 16 % ) talk about religion with people outside their family . And roughly four - in - ten say they seldom ( 26 % ) or never ( 13 % ) discuss religion even with members of their immediate family . So who does talk about religion ? Well , not surprisingly , religious people do . According to the new report , fully two - thirds of highly religious Americans – defined as those who say they pray daily and attend religious services weekly – report that they talk about religion with their immediate families at least once a week , and 43 % say they talk about religion with people outside their families each week . Among less religious Americans , by contrast , just one - in - five ( 19 % ) say they talk about religion with members of their immediate family and only about one - in - ten ( 9 % ) discuss religion with people outside their family each week .",same,What are trends among Americans on discussing religion?,answer2,About half of U.S. adults tell us they seldom ( 33 % ) or never ( 16 % ) talk about religion with people outside their family . And roughly four - in - ten say they seldom ( 26 % ) or never ( 13 % ) discuss religion even with members of their immediate family .,About half of U.S. adults tell us they seldom ( 33 % ) or never ( 16 % ) talk about religion with people outside their family . And roughly four - in - ten say they seldom ( 26 % ) or never ( 13 % ) discuss religion even with members of their immediate family .,,, 
mturk_charts/no_data/multi_col/9110.png,"Millennials may be less attached to institutional religion than older Americans , but generally they are no more argumentative about religion than other generations . For example , roughly two - thirds of Baby Boomers ( 67 % ) , Generation Xers ( 69 % ) and Millennials ( 68 % ) and 62 % of the Silent Generation say the best thing to do when they encounter someone who disagrees with them about religion is to try to understand the other person ’s views and agree to disagree . And just 7 % of Boomers and Silents as well as 5 % of Millennials and 4 % of those in Generation X would try to change the person ’s mind .",same,What is distribution of generations saying agree to  disagree on religion?,answer2,"Roughly two - thirds of Baby Boomers ( 67 % ) , Generation Xers ( 69 % ) and Millennials ( 68 % ) and 62 % of the Silent Generation say the best thing to do when they encounter someone who disagrees with them about religion is to try to understand the other person ’s views and agree to disagree .","roughly two - thirds of Baby Boomers ( 67 % ) , Generation Xers ( 69 % ) and Millennials ( 68 % ) and 62 % of the Silent Generation say the best thing to do when they encounter someone who disagrees with them about religion is to try to understand the other person ’s views and agree to disagree .",.,And just 7 Silents as well as 5 4 those in X would change mind, 
mturk_charts/no_data/multi_col/9114.png,"The proposed border wall is deeply divisive along partisan lines . By nearly two - to - one ( 63 % to 33 % ) , Republicans and GOP leaners favor building a wall along the entire U.S.-Mexico border . By contrast , just 13 % of Democrats favor building a border wall , while 84 % are opposed . There also are substantial generational and ethnic differences in views of a border wall . Just 20 % of Millennials favor building a wall along the entire U.S.-Mexico border , which is far lower than the shares of Gen Xers ( 36 % ) , Boomers ( 43 % ) and Silents ( 47 % ) who favor this proposal . Whites ( 43 % favor ) are more than twice as likely as blacks ( 13 % ) and Hispanics ( 16 % ) to favor building a border wall .",same,What are partisans views on building a border wall along US Mexico border?,answer2,"The proposed border wall is deeply divisive along partisan lines . By nearly two - to - one ( 63 % to 33 % ) , Republicans and GOP leaners favor building a wall along the entire U.S.-Mexico border . By contrast , just 13 % of Democrats favor building a border wall , while 84 % are opposed .","The proposed border wall is deeply divisive along partisan lines . By nearly two - to - one ( 63 % to 33 % ) , Republicans and GOP leaners favor building a wall along the entire U.S.-Mexico border . By contrast , just 13 % of Democrats favor building a border wall , while 84 % are opposed .",,There also substantial generational ethnic differences in views Just 20 Millennials which far lower than shares Gen Xers 36 Boomers 43 Silents 47 who this proposal Whites 43 more than twice as likely as blacks Hispanics 16, 
mturk_charts/no_data/multi_col/9120.png,"Good neighbors can be a blessing , whether they ’re people you can trust to water the plants or watch the kids . But building that trust can be hard : Just half of Americans ( 52 % ) say they trust all or most of their neighbors , while a similar share ( 48 % ) say they trust some or none of their neighbors , according to a 2015 Pew Research Center survey .",same,Comment on the trust that Americans have on their neighbors?,answer2,"Just half of Americans ( 52 % ) say they trust all or most of their neighbors , while a similar share ( 48 % ) say they trust some or none of their neighbors , according to a 2015 Pew Research Center survey .","Just half of Americans ( 52 % ) say they trust all or most of their neighbors , while a similar share ( 48 % ) say they trust some or none of their neighbors , according to a 2015 Pew Research Center survey .",none,Good can be blessing whether ’re people you can water the plants watch the kids But building that can be hard : class='chrome-extension-mutihighlight chrome-extension-mutihighlight-style-5'>none class='chrome-extension-mutihighlight chrome-extension-mutihighlight-style-5'>none, 
mturk_charts/no_data/multi_col/9125.png,"Catholics ’ views on these and similar questions may reflect the fact that American Catholics themselves are experiencing family life in all its modern complexity . One - quarter of Catholics say they have been divorced , including one - in - ten who are now remarried . And fully 44 % of U.S. Catholics say they have lived together with a romantic partner outside of marriage at some point in their lives , including 9 % who are currently cohabiting .",same,Discuss marriage patterns among Catholics?,answer2,"One - quarter of Catholics say they have been divorced , including one - in - ten who are now remarried . And fully 44 % of U.S. Catholics say they have lived together with a romantic partner outside of marriage at some point in their lives , including 9 % who are currently cohabiting .","One - quarter of Catholics say they have been divorced , including one - in - ten who are now remarried . And fully 44 % of U.S. Catholics say they have lived together with a romantic partner outside of marriage at some point in their lives , including 9 % who are currently cohabiting .",,’ views on these and similar questions may reflect the fact that American themselves experiencing family life all its modern complexity, 
