img_path,summary,question_resolution,question,answer_resolution,abstractive_answer,extractive_answer,decontextualizated_text_added,decontextualizated_text_removed,extra_added_text
mturk_charts/no_data/multi_col/8824.png,"Americans and Europeans are looking inward . Nearly six - in - ten Americans ( 57 % ) believe the U.S. should deal with its own problems and let other countries deal with their problems as best they can ; just 37 % think the U.S. should help other countries solve problems . On balance , Europeans are also focused on their own challenges , although half or more in Spain , Germany and Sweden want to help other nations . While this nation - first sentiment has seen little change in recent years in Europe , it has grown by 11 percentage points since 2010 in the U.S.",same,What are views of Americans on dealing with country issues?,answer2,Americans and Europeans are looking inward . Nearly six - in - ten Americans ( 57 % ) believe the U.S. should deal with its own problems and let other countries deal with their problems as best they can ; just 37 % think the U.S. should help other countries solve problems .,Americans and Europeans are looking inward . Nearly six - in - ten Americans ( 57 % ) believe the U.S. should deal with its own problems and let other countries deal with their problems as best they can ; just 37 % think the U.S. should help other countries solve problems .,,"On balance , also focused on challenges , although half or more Spain , Germany Sweden want to nations While this nation first sentiment has seen little change recent years Europe , it has grown by 11 percentage points since 2010", 
mturk_charts/no_data/multi_col/8825.png,"ISIS is seen as the top threat on both sides of the Atlantic . Eight - in - ten Americans say the Islamic militant group in Iraq and Syria is a major threat to the U.S. , similar to the median of 76 % across the 10 EU nations polled . Concern about ISIS is particularly high in Spain ( 93 % say it is a major threat ) and France ( 91 % ) . Americans and Europeans may agree ISIS is a top threat , but they differ in how they rank other concerns . For example , while climate change is the second biggest concern in Europe , it is lower on the list in the U.S. Instead , Americans name cyberattacks as the second greatest threat . China ’s emergence as a world power rates relatively low in both the U.S. and Europe , although Americans are more concerned than Europeans about Beijing ’s growing power .",same,What are the concerns of US and EU on ISIS?,answer2,"ISIS is seen as the top threat . Eight - in - ten Americans say the group is a major threat to the U.S. , similar to the median of 76 % across the 10 EU nations polled .","ISIS is seen as the top threat . Eight - in - ten Americans say the group is a major threat to the U.S. , similar to the median of 76 % across the 10 EU nations polled .",,on both sides Atlantic Islamic militant Iraq and Syria Concern about particularly high Spain ( 93 it ) and France ( 91 ) and Europeans may agree but they differ how they rank other concerns For example while climate change second biggest concern Europe it lower on list Instead name cyberattacks second greatest China ’s emergence world power rates relatively low both and Europe although are more concerned than Europeans about Beijing ’s growing power, 
mturk_charts/no_data/multi_col/8827.png,"Americans are more wary of economic globalization . About half of Americans ( 49 % ) say U.S. involvement in the global economy is a bad thing because it lowers wages and costs jobs ; only 44 % think it is a good thing because it creates new markets and opportunities for growth . Europeans tend to embrace economic globalization , although Greece is a clear exception .",same,What are views of American adults on global economic engagement?,answer2,Americans are more wary of economic globalization . About half of Americans ( 49 % ) say U.S. involvement in the global economy is a bad thing because it lowers wages and costs jobs ; only 44 % think it is a good thing because it creates new markets and opportunities for growth .,Americans are more wary of economic globalization . About half of Americans ( 49 % ) say U.S. involvement in the global economy is a bad thing because it lowers wages and costs jobs ; only 44 % think it is a good thing because it creates new markets and opportunities for growth .,,"Europeans tend to embrace , although Greece clear exception", 
mturk_charts/no_data/multi_col/8837.png,"The United Kingdom may soon become the first country to leave the European Union , pending the results of a June 23 referendum . As the vote nears , a new Pew Research Center survey highlights a key British complaint about the EU : Nearly two - thirds of Britons say they want the EU to return certain powers to national governments . Only 6 % want to transfer more powers to the Brussels - based institution .",same,What are thoughts of Brits about the future of EU?,answer2,Nearly two - thirds of Britons say they want the EU to return certain powers to national governments . Only 6 % want to transfer more powers .,Nearly two - thirds of Britons say they want the EU to return certain powers to national governments . Only 6 % want to transfer more powers .,,"The United Kingdom may soon become first country leave European Union , pending results a June 23 referendum As vote nears , a new Pew Research Center survey highlights a key British complaint about : Brussels based institution", 
mturk_charts/no_data/multi_col/8838.png,"Older people in the UK are more likely to support reclaiming some powers from the EU . Almost three - quarters of British over the age of 50 take this position , compared with only 51 % of those ages 18 - 35 . Britons with less education are more likely than those with more education to favor Brussels returning some powers to national capitals ( 68 % vs. 56 % ) . And men are more likely than women to prefer this option .",same,Describe age gap in British supporting reclaiming powers from EU?,answer2,"Older people in the UK are more likely to support reclaiming some powers from the EU . Almost three - quarters of British over the age of 50 take this position , compared with only 51 % of those ages 18 - 35 .","Older people in the UK are more likely to support reclaiming some powers from the EU . Almost three - quarters of British over the age of 50 take this position , compared with only 51 % of those ages 18 - 35 .",,Britons less education than education favor Brussels returning national capitals ( 68 vs. 56 ) And men than women prefer option, 
mturk_charts/no_data/multi_col/8840.png,"While Brits remain divided on whether leaving the EU is right for their country , key EU members outside of the UK are resolute : A majority in every member state surveyed says Brexit would be a bad thing .",same,What are views of EU member countries on UK leaving EU?,answer2,A majority in every member state surveyed says Brexit would be a bad thing .,A majority in every member state surveyed says Brexit would be a bad thing .,,"While Brits remain divided on whether leaving the EU is right for their country , key EU members outside of the UK are resolute :", 
mturk_charts/no_data/multi_col/8843.png,"The institution ’s strongest backers are the Poles ( 72 % ) and the Hungarians ( 61 % ) . In many other nations , support is tepid . Just 27 % of the Greeks , 38 % of the French and 47 % of the Spanish have a favorable opinion of the EU . Notably , 44 % of the British view the EU favorably , including 53 % of the Scottish .",same,What is the distribution of EU favorability across Europe?,answer2,"The EU ’s strongest backers are the Poles ( 72 % ) and the Hungarians ( 61 % ) . In many other nations , support is tepid . Just 27 % of the Greeks , 38 % of the French and 47 % of the Spanish have a favorable opinion of the EU . Notably , 44 % of the British view the EU favorably .","The institution ’s strongest backers are the Poles ( 72 % ) and the Hungarians ( 61 % ) . In many other nations , support is tepid . Just 27 % of the Greeks , 38 % of the French and 47 % of the Spanish have a favorable opinion of the EU . Notably , 44 % of the British view the EU favorably .",,including 53 Scottish, 
mturk_charts/no_data/multi_col/8846.png,"A party ’s criticism of the European Union does not , however , necessarily translate into disfavor toward Brussels by the party ’s adherents . In Italy , 58 % of those who identify with the Euroskeptic Five Star Movement have a positive view of the EU . In Poland , where the ruling Law and Justice ( PiS ) party is in a feud with the EU on a range of issues , two - thirds ( 67 % ) of PiS partisans still have a favorable opinion of the Brussels institution . Much of the disaffection with the EU among Europeans can be attributed to Brussels ’ handling of the refugee issue . In every country surveyed , overwhelming majorities disapprove of how Brussels has dealt with the problem . This includes 94 % of Greeks , 88 % of Swedes and 77 % of Italians . The strongest approval of EU management of the refugee crisis is in the Netherlands , but that backing is a tepid 31 % .",same,What is distribution of opinions on how EU deals with the refugee issue?,answer2,"In In every country surveyed , overwhelming majorities disapprove of how Brussels has dealt with the refugee problem . This includes 94 % of Greeks , 88 % of Swedes and 77 % of Italians . The strongest approval of EU management of the refugee crisis is in the Netherlands , but that backing is a tepid 31 % .","In In every country surveyed , overwhelming majorities disapprove of how Brussels has dealt with the problem . This includes 94 % of Greeks , 88 % of Swedes and 77 % of Italians . The strongest approval of EU management of the refugee crisis is in the Netherlands , but that backing is a tepid 31 % .",,, 
mturk_charts/no_data/multi_col/8847.png,"Much of the disaffection with the EU among Europeans can be attributed to Brussels ’ handling of the refugee issue . In every country surveyed , overwhelming majorities disapprove of how Brussels has dealt with the problem . This includes 94 % of Greeks , 88 % of Swedes and 77 % of Italians . The strongest approval of EU management of the refugee crisis is in the Netherlands , but that backing is a tepid 31 % . The EU ’s handling of economic issues is another huge source of disaffection with the institution . About nine - in - ten Greeks ( 92 % ) disapprove of how the EU has dealt with the ongoing economic crisis . Roughly two - thirds of the Italians ( 68 % ) , French ( 66 % ) and Spanish ( 65 % ) similarly disapprove . ( France and Spain are the two nations where the favorability of the EU has recently experienced the largest decline . ) Majorities in Sweden ( 59 % ) and the UK ( 55 % ) , including 84 % of UKIP supporters , also disapprove of the EU ’s job in dealing with economic challenges . The strongest approval of Brussels ’ economic efforts is in Poland and Germany ( both 47 % ) .",same,Express the disapproval of EU's handling of the economic issues  across different countries?,answer2,"About nine - in - ten Greeks ( 92 % ) disapprove of how the EU has dealt with the ongoing economic crisis . Roughly two - thirds of the Italians ( 68 % ) , French ( 66 % ) and Spanish ( 65 % ) similarly disapprove . ( France and Spain are the two nations where the favorability of the EU has recently experienced the largest decline . ) Majorities in Sweden ( 59 % ) and the UK ( 55 % ) , also disapprove of the EU ’s job in dealing with economic challenges .","About nine - in - ten Greeks ( 92 % ) disapprove of how the EU has dealt with the ongoing economic crisis . Roughly two - thirds of the Italians ( 68 % ) , French ( 66 % ) and Spanish ( 65 % ) similarly disapprove . ( France and Spain are the two nations where the favorability of the EU has recently experienced the largest decline . ) Majorities in Sweden ( 59 % ) and the UK ( 55 % ) , also disapprove of the EU ’s job in dealing with economic challenges .",About nine - - ten Greeks 92 how dealt ongoing crisis Roughly - thirds Italians 68 French 66 Spanish 65 similarly,including 84 UKIP supporters The strongest approval Brussels ’ efforts is Poland Germany both 47, 
mturk_charts/no_data/multi_col/8859.png,"There are demographic differences among Republicans on many of these issues – and in views of Trump . For instance , Republicans younger than 30 are much less likely to say that immigrants to the United States threaten our values than those 65 or over ( 57 % vs. 83 % ) . Younger Republicans are also less positive in their assessments of Trump ( 37 % warm vs. 56 % among those 65 and older ) . In addition to age , both education and ideology are associated with views of Trump within the GOP . Republican voters with less than a college degree – particularly those with some college experience – feel more warmly toward Trump than those with more education . And conservative GOP voters rate Trump higher than moderate and liberal GOP voters .",same,Describe the views of Republican voters on Trump based on age and education?,answer2,"Younger Republicans are less positive in their assessments of Trump ( 37 % warm vs. 56 % among those 65 and older ) . In addition to age , both education and ideology are associated with views of Trump within the GOP . Republican voters with less than a college degree – particularly those with some college experience – feel more warmly toward Trump than those with more education . And conservative GOP voters rate Trump higher than moderate and liberal GOP voters .","Younger Republicans are less positive in their assessments of Trump ( 37 % warm vs. 56 % among those 65 and older ) . In addition to age , both education and ideology are associated with views of Trump within the GOP . Republican voters with less than a college degree – particularly those with some college experience – feel more warmly toward Trump than those with more education . And conservative GOP voters rate Trump higher than moderate and liberal GOP voters .",,There demographic differences on many these issues For instance younger 30 much likely say that immigrants United States threaten our values or over 57 83 also, 
mturk_charts/no_data/multi_col/8873.png,"Overall , Vermont Sen. Bernie Sanders was mentioned more frequently than any other candidate in May , June and September of 2015 . Sanders was mentioned in about 165,000 comments , more than the number of mentions for the next two highest candidates combined : former Secretary of State Hillary Clinton , with about 85,000 , and Donald Trump , with about 73,000 . The main Sanders discussion forum , or subreddit , /r / SandersForPresident , offered not only discussion but opportunities to volunteer and raise funds for the candidate .",same,"What is distribution of reddit comments between Sanders, Trump and Clinton ?",answer2,"Overall , Vermont Sen. Bernie Sanders was mentioned more frequently than any other candidate in May , June and September of 2015 . Sanders was mentioned in about 165,000 comments , more than the number of mentions for the next two highest candidates combined : former Secretary of State Hillary Clinton , with about 85,000 , and Donald Trump , with about 73,000 .","Overall , Vermont Sen. Bernie Sanders was mentioned more frequently than any other candidate in May , June and September of 2015 . Sanders was mentioned in about 165,000 comments , more than the number of mentions for the next two highest candidates combined : former Secretary of State Hillary Clinton , with about 85,000 , and Donald Trump , with about 73,000 .",,The main discussion forum or subreddit /r / SandersForPresident offered not only discussion but opportunities to volunteer raise funds, 
mturk_charts/no_data/multi_col/8875.png,"At the same time , there are some positive interactions , too . About a quarter of Israeli Muslims ( 26 % ) say a Jewish person has expressed sympathy toward them because of their religious identity within the past year .",same,Comment on Israeli Muslims receiving sympathy from Jewish?,answer2,About a quarter of Israeli Muslims ( 26 % ) say a Jewish person has expressed sympathy toward them because of their religious identity within the past year .,About a quarter of Israeli Muslims ( 26 % ) say a Jewish person has expressed sympathy toward them because of their religious identity within the past year .,,"At same time , there are some positive interactions , too", 
mturk_charts/no_data/multi_col/8886.png,"There was a wide and consistent gender gap in opinions about the relative strengths of male and female political leaders on five attributes tested in our survey , though most men and women said there is no gender difference on these traits . One of the largest gender gaps was on the ability to work out compromises : 41 % of women compared with 27 % of men said women are better at this . Women also were more likely than men to say female leaders surpass men in being honest and ethical , working to improve quality of life for Americans , standing up for their beliefs despite political pressure , and being persuasive . The survey also asked about gender differences among leaders on various policy issues , and found less - pronounced differences among male and female respondents .",same,What is the gender gap in political leadership?,answer2,"There was a wide and consistent gender gap in opinions about the relative strengths of male and female political leaders on five attributes tested . One of the largest gender gaps was on the ability to work out compromises : 41 % of women compared with 27 % of men said women are better at this . Women also were more likely than men to say female leaders surpass men in being honest and ethical , working to improve quality of life for Americans , standing up for their beliefs despite political pressure , and being persuasive .","There was a wide and consistent gender gap in opinions about the relative strengths of male and female political leaders on five attributes tested . One of the largest gender gaps was on the ability to work out compromises : 41 % of women compared with 27 % of men said women are better at this . Women also were more likely than men to say female leaders surpass men in being honest and ethical , working to improve quality of life for Americans , standing up for their beliefs despite political pressure , and being persuasive .",: 41 % compared with 27 % are better at this Women also were more likely than say surpass being honest ethical working improve quality life for Americans standing up for their beliefs despite pressure being persuasive,our survey though most there is no difference these traits, 
mturk_charts/no_data/multi_col/8887.png,"In November 2014 , before Clinton had declared her candidacy , Democrats were more enthused than Republicans about a potential female president . This partisan difference was bigger than the gender difference among survey respondents . Our survey question asked people whether they hoped a female president will be elected in their lifetime , or whether that did not matter to them . For many , the prospect of a Clinton presidency may have influenced their responses to this “ hypothetical ” question . Democratic women ( 69 % ) were the most likely to say they hoped a female U.S. president would be elected in their lifetimes , followed by Democratic men ( 46 % ) and independent women ( 45 % ) . Among Republicans , fewer women ( 20 % ) and men ( 16 % ) said they hoped for this , as did about a third ( 32 % ) of independent men .",same,What is distribution of partisan hopes on seeing a female president among men and women?,answer2,"Democratic women ( 69 % ) were the most likely to say they hoped a female U.S. president would be elected in their lifetimes , followed by Democratic men ( 46 % ) and independent women ( 45 % ) . Among Republicans , fewer women ( 20 % ) and men ( 16 % ) said they hoped for this , as did about a third ( 32 % ) of independent men .","Democratic women ( 69 % ) were the most likely to say they hoped a female U.S. president would be elected in their lifetimes , followed by Democratic men ( 46 % ) and independent women ( 45 % ) . Among Republicans , fewer women ( 20 % ) and men ( 16 % ) said they hoped for this , as did about a third ( 32 % ) of independent men .",Democratic women ( 69 % ) most likely to say they hoped U.S. would be elected in their lifetimes followed by Democratic men ( 46 % ) and independent women ( 45 % ) Among fewer women ( 20 % ) and men ( 16 % ) said they hoped for this as did third ( 32 % ) of independent men,In November 2014 before Clinton had declared her candidacy Democrats more enthused than potential This partisan difference was bigger than gender difference among survey respondents, 
mturk_charts/no_data/multi_col/8888.png,"Nearly three - quarters of Americans have used a shared , collaborative or on - demand online service . Pew Research Center asked American adults whether or not they have used 11 different services tied to the new digital economy , and fully 72 % say they have used at least one of them .",same,Describe on-demand online service usage trends among Americans?,answer2,"Nearly three - quarters of Americans have used a shared , collaborative or on - demand online service . Pew Research Center asked American adults whether or not they have used 11 different services tied to the new digital economy , and fully 72 % say they have used at least one of them .","Nearly three - quarters of Americans have used a shared , collaborative or on - demand online service . Pew Research Center asked American adults whether or not they have used 11 different services tied to the new digital economy , and fully 72 % say they have used at least one of them .",,, 
mturk_charts/no_data/multi_col/8890.png,"About one - in - five Americans ( 22 % ) have contributed to a “ crowdfunded ” online fundraising project , while 3 % have created their own fundraising project on one of these sites . Although large - scale fundraising projects get most of the attention in news stories , there are far more instances of people using crowdfunding platforms to help someone in need , often a person close to them . Roughly two - thirds ( 68 % ) of crowdfunding donors have contributed to a project to help a person facing a hardship or financial challenge ,   and around six - in - ten say they did so on behalf of an acquaintance , close friend or family member .",same,Discuss US crowdfunding trends?,answer2,"Roughly two - thirds ( 68 % ) of crowdfunding donors have contributed to a project to help a person facing a hardship or financial challenge , and around six - in - ten say they did so on behalf of an acquaintance , close friend or family member . ","Roughly two - thirds ( 68 % ) of crowdfunding donors have contributed to a project to help a person facing a hardship or financial challenge ,   and around six - in - ten say they did so on behalf of an acquaintance , close friend or family member .", ,About one five Americans 22 “ crowdfunded ” online fundraising while 3 created their own fundraising one these sites Although large scale fundraising projects get most the class='chrome-extension-mutihighlight chrome-extension-mutihighlight-style-4'>attention news stories there are far more instances people using platforms someone need often them class='chrome-extension-mutihighlight chrome-extension-mutihighlight-style-4'>attention news stories there are far more instances people using platforms someone need often them, 
