img_path,summary,question_resolution,question,answer_resolution,abstractive_answer,extractive_answer,decontextualizated_text_added,decontextualizated_text_removed,extra_added_text
mturk_charts/no_data/multi_col/9212.png,"A majority of Americans support the renewal of diplomatic relations with Cuba . A Pew Research Center survey from July 2015 found that 73 % of Americans approved of the thaw in relations between the two countries . A similar share also said they would favor ending the trade embargo the U.S. imposed against Cuba in 1960 . Support for renewed diplomatic and economic relations had increased across nearly all partisan groups since January 2015 , the month after Obama announced his initiative .",same,What are US opinions on ties with Cuba?,answer2,A majority of Americans support the renewal of diplomatic relations with Cuba . A Pew Research Center survey from July 2015 found that 73 % of Americans approved of the thaw in relations between the two countries . A similar share also said they would favor ending the trade embargo the U.S. imposed against Cuba in 1960 .,A majority of Americans support the renewal of diplomatic relations with Cuba . A Pew Research Center survey from July 2015 found that 73 % of Americans approved of the thaw in relations between the two countries . A similar share also said they would favor ending the trade embargo the U.S. imposed against Cuba in 1960 .,,"Support for renewed and economic had increased across nearly all partisan groups since January , month after Obama announced his initiative", 
mturk_charts/no_data/multi_col/9215.png,"The U.S. decision to restore relations with Cuba had strong support in Latin America . A majority across five Latin American countries surveyed in the spring of 2015 said they approved of the thawing of relations between the U.S. and Cuba . Nearly eight - in - ten in Chile ( 79 % ) , Argentina ( 78 % ) and Venezuela ( 77 % ) said they approved of the renewal of relations between the U.S. and Cuba , as did 67 % of those in Brazil and 54 % of those in Mexico . There was similarly broad support for ending the U.S. trade embargo against Cuba . Support for ending the embargo was stronger among Latin Americans with higher incomes , compared with lower - income respondents .",same,Describe the distribution of approval across the surveyed countries on renewal of ties between US and Cuba?,answer2,"Nearly eight - in - ten in Chile ( 79 % ) , Argentina ( 78 % ) and Venezuela ( 77 % ) said they approved of the renewal of relations between the U.S. and Cuba , as did 67 % of those in Brazil and 54 % of those in Mexico .","Nearly eight - in - ten in Chile ( 79 % ) , Argentina ( 78 % ) and Venezuela ( 77 % ) said they approved of the renewal of relations between the U.S. and Cuba , as did 67 % of those in Brazil and 54 % of those in Mexico .",,The decision to restore with had strong support Latin America A majority across five Latin American countries surveyed spring 2015 thawing There was similarly broad support for ending trade embargo against Support for ending embargo was stronger among Latin Americans with higher incomes compared with lower income respondents, 
mturk_charts/no_data/multi_col/9222.png,"The notion that a person can be Jewish even without observing the Sabbath or believing in God may be tied to the idea held by many Jews that being Jewish is more about ancestry or culture than about religion . Indeed , a plurality of Jews in Israel ( 55 % ) and a majority in the U.S. ( 62 % ) say this is the case for them personally , although 23 % in each country say their Jewish identity is about religion and ancestry / culture equally . About one - in - five Israeli Jews ( 22 % ) and a slightly smaller share of American Jews ( 15 % ) say being Jewish , to them , is primarily about religion . Orthodox Jews in both countries are particularly likely to take this position .",same,Describe views of Jews in Israel and US on what it means to them personally to be Jewish?,answer2,"The idea held by many Jews that being Jewish is more about ancestry or culture than about religion . Indeed , a plurality of Jews in Israel ( 55 % ) and a majority in the U.S. ( 62 % ) say this is the case for them personally , although 23 % in each country say their Jewish identity is about religion and ancestry / culture equally . About one - in - five Israeli Jews ( 22 % ) and a slightly smaller share of American Jews ( 15 % ) say being Jewish , to them , is primarily about religion .","the idea held by many Jews that being Jewish is more about ancestry or culture than about religion . Indeed , a plurality of Jews in Israel ( 55 % ) and a majority in the U.S. ( 62 % ) say this is the case for them personally , although 23 % in each country say their Jewish identity is about religion and ancestry / culture equally . About one - in - five Israeli Jews ( 22 % ) and a slightly smaller share of American Jews ( 15 % ) say being Jewish , to them , is primarily about religion .",,The notion person can be even without observing Sabbath believing God may be tied Orthodox both countries are particularly likely take position, 
mturk_charts/no_data/multi_col/9224.png,"The survey asked Jews in Israel whether they identify with any of these international streams of Judaism , acknowledging that some of them may not be familiar to respondents . In Israel , very few Jews identify with Conservative ( 2 % ) or Reform ( 3 % ) Judaism , while half ( 50 % ) identify with Orthodoxy – including many Jews who are not highly religiously observant but may still be most familiar with Orthodox Judaism . About four - in - ten Israeli Jews ( 41 % ) do not identify with any of these three streams or denominations of Judaism .",same,Discuss trends in how Israeli Jews identify?,answer2,"The survey asked Jews in Israel whether they identify with any of these international streams of Judaism , acknowledging that some of them may not be familiar to respondents . In Israel , very few Jews identify with Conservative ( 2 % ) or Reform ( 3 % ) Judaism , while half ( 50 % ) identify with Orthodoxy . About four - in - ten Israeli Jews ( 41 % ) do not identify with any of these three streams or denominations of Judaism .","The survey asked Jews in Israel whether they identify with any of these international streams of Judaism , acknowledging that some of them may not be familiar to respondents . In Israel , very few Jews identify with Conservative ( 2 % ) or Reform ( 3 % ) Judaism , while half ( 50 % ) identify with Orthodoxy . About four - in - ten Israeli Jews ( 41 % ) do not identify with any of these three streams or denominations of Judaism .",,– including many who are highly religiously observant but still most Orthodox, 
mturk_charts/no_data/multi_col/9225.png,"Those who identify themselves as “ born - again or evangelical ” Christians constitute a sizable share of the electorate – 36 % of registered voters , compared with 37 % who are non - evangelical Christians and 27 % who identify with non - Christian faiths or with no religion at all . In addition , evangelicals are much more numerous within the Republican Party than among Democrats . Still , nearly three - in - ten Democrats consider themselves born - again or evangelical Christians .",same,What is the distribution of Christians among registered voters describing themselves as born-again or evangelical?,answer2,"Those who identify themselves as “ born - again or evangelical ” Christians constitute a sizable share of the electorate – 36 % of registered voters , compared with 37 % who are non - evangelical Christians and 27 % who identify with non - Christian faiths or with no religion at all .","Those who identify themselves as “ born - again or evangelical ” Christians constitute a sizable share of the electorate – 36 % of registered voters , compared with 37 % who are non - evangelical Christians and 27 % who identify with non - Christian faiths or with no religion at all .",,In addition evangelicals much more numerous within Republican Party than among Democrats Still nearly three in ten Democrats consider, 
mturk_charts/no_data/multi_col/9233.png,"When it comes to their general predictions for the future of human employment and workforce automation , roughly two - thirds of Americans expect that within the next 50 years robots and computers will do much of the work currently done by humans . 		 Some 15 % of Americans expect that this level of automation will “ definitely ” happen ,  		  while 50 % think it will “ probably ” happen . On the other hand , one - quarter of Americans expect that this outcome will probably not happen , and 7 % believe it will definitely not happen .",same,What are American views about robot takeover of human work in next 50 years?,answer2,"When it comes to their general predictions for the future of human employment and workforce automation , roughly two - thirds of Americans expect that within the next 50 years robots and computers will do much of the work currently done by humans . Some 15 % of Americans expect that this level of automation will “ definitely ” happen , while 50 % think it will “ probably ” happen . On the other hand , one - quarter of Americans expect that this outcome will probably not happen , and 7 % believe it will definitely not happen .","When it comes to their general predictions for the future of human employment and workforce automation , roughly two - thirds of Americans expect that within the next 50 years robots and computers will do much of the work currently done by humans .  Some 15 % of Americans expect that this level of automation will “ definitely ” happen ,    while 50 % think it will “ probably ” happen . On the other hand , one - quarter of Americans expect that this outcome will probably not happen , and 7 % believe it will definitely not happen .",human    ,class='chrome-extension-mutihighlight chrome-extension-mutihighlight-style-1'>human class='chrome-extension-mutihighlight chrome-extension-mutihighlight-style-1'>human, 
mturk_charts/no_data/multi_col/9234.png,"Similarly , Americans who work in the government , nonprofit or education sectors are a bit more skeptical about the future of workforce automation than are Americans who work for a large corporation , medium - sized company or small business . Just 7 % of Americans who work in the government , education or nonprofit sectors expect that robots and computers will definitely take over most human employment in the next 50 years , while 13 % of those who work for a large corporation or small business or medium - sized company are certain that this will occur .",same,Compare views of people working in different businesses on robots definitely taking over most human employment in next 50 years?,answer2,"Americans who work in the government , nonprofit or education sectors are a bit more skeptical about the future of workforce automation than are Americans who work for a large corporation , medium - sized company or small business . Just 7 % of Americans who work in the government , education or nonprofit sectors expect that robots and computers will definitely take over most human employment in the next 50 years , while 13 % of those who work for a large corporation or small business or medium - sized company are certain that this will occur .","Americans who work in the government , nonprofit or education sectors are a bit more skeptical about the future of workforce automation than are Americans who work for a large corporation , medium - sized company or small business . Just 7 % of Americans who work in the government , education or nonprofit sectors expect that robots and computers will definitely take over most human employment in the next 50 years , while 13 % of those who work for a large corporation or small business or medium - sized company are certain that this will occur .",human,Similarly class='chrome-extension-mutihighlight chrome-extension-mutihighlight-style-1'>human class='chrome-extension-mutihighlight chrome-extension-mutihighlight-style-1'>human, 
mturk_charts/no_data/multi_col/9236.png,"When asked about a number of issues that might cause them to lose their current jobs , just 11 % of workers are at least somewhat concerned that they might lose their jobs because their employer replaces human workers with machines or computer programs . On the other hand , roughly one - in - five express concern that they might lose their jobs because their employer finds other ( human ) workers to perform their jobs for less money or because their overall industry workforce is shrinking . The most prominent concern is poor management by their own employer , albeit by a narrow margin , among the five evaluated in this survey : Workers whose jobs involve primarily manual or physical labor2 express heightened concern about all of these potential employment threats , especially when it comes to replacement by robots or other machines . Fully 17 % of these workers are at least somewhat concerned about the threat from workforce automation , with 11 % indicating that they are “ very concerned . ” By contrast , just 5 % of workers whose jobs do not involve manual labor express some level of concern about the threat of workforce automation .",same,What are concerns of workers on workforce automation?,answer2,"Fully 17 % of workers are at least somewhat concerned about the threat from workforce automation . By contrast , just 5 % of workers whose jobs do not involve manual labor express some level of concern about the threat of workforce automation . ","Fully 17 % of workers are at least somewhat concerned about the threat from workforce automation . By contrast , just 5 % of workers whose jobs do not involve manual labor express some level of concern about the threat of workforce automation .",,When asked a number issues that might cause them to lose their current 11 that they might lose their because their employer replaces class='chrome-extension-mutihighlight chrome-extension-mutihighlight-style-1'>human with machines or class='chrome-extension-mutihighlight chrome-extension-mutihighlight-style-6'>computer programs On other hand roughly one - in - five that they might lose their because their employer finds other ( class='chrome-extension-mutihighlight chrome-extension-mutihighlight-style-1'>human ) to perform their for less money or because their overall industry is shrinking The most prominent is poor management by their own employer albeit by a narrow margin among five evaluated in this survey : Workers primarily or physical labor2 heightened all these potential employment threats especially when it comes to replacement by robots or other machines these with 11 indicating that they “ very ” class='chrome-extension-mutihighlight chrome-extension-mutihighlight-style-1'>human with machines or class='chrome-extension-mutihighlight chrome-extension-mutihighlight-style-6'>computer programs On other hand roughly one - in - five that they might lose their because their employer finds other ( class='chrome-extension-mutihighlight chrome-extension-mutihighlight-style-1'>human ) to perform their for less money or because their overall industry is shrinking The most prominent is poor management by their own employer albeit by a narrow margin among five evaluated in this survey : Workers primarily or physical labor2 heightened all these potential employment threats especially when it comes to replacement by robots or other machines these with 11 indicating that they “ very ” class='chrome-extension-mutihighlight chrome-extension-mutihighlight-style-6'>computer programs On other hand roughly one - in - five that they might lose their because their employer finds other ( class='chrome-extension-mutihighlight chrome-extension-mutihighlight-style-1'>human ) to perform their for less money or because their overall industry is shrinking The most prominent is poor management by their own employer albeit by a narrow margin among five evaluated in this survey : Workers primarily or physical labor2 heightened all these potential employment threats especially when it comes to replacement by robots or other machines these with 11 indicating that they “ very ” class='chrome-extension-mutihighlight chrome-extension-mutihighlight-style-1'>human ) to perform their for less money or because their overall industry is shrinking The most prominent is poor management by their own employer albeit by a narrow margin among five evaluated in this survey : Workers primarily or physical labor2 heightened all these potential employment threats especially when it comes to replacement by robots or other machines these with 11 indicating that they “ very ”, 
mturk_charts/no_data/multi_col/9237.png,"Among the top five nations with which the U.S. runs a trade deficit , Germany has a $ 912 per capita trade advantage with the U.S. ( total deficit divided by Germany ’s total population ) , compared with China ’s $ 266 per capita imbalance . This is largely because China ’s large workforce churns out a high volume of low - value products for export to the U.S. , while Germany ’s smaller workforce largely produces high - value products , such as automobiles , to sell to Americans .",same,Compare the trade deficit per capita of US with Germany and China?,answer2,"Among the top five nations with which the U.S. runs a trade deficit , Germany has a $ 912 per capita trade advantage with the U.S. ( total deficit divided by Germany ’s total population ) , compared with China ’s $ 266 per capita imbalance .","Among the top five nations with which the U.S. runs a trade deficit , Germany has a $ 912 per capita trade advantage with the U.S. ( total deficit divided by Germany ’s total population ) , compared with China ’s $ 266 per capita imbalance .",,This is largely because large workforce churns out high volume of low - value products for export to while smaller workforce largely produces high - value products such as automobiles to sell to Americans, 
mturk_charts/no_data/multi_col/9239.png,"It ’s a straightforward question , but the answers yielded some interesting results . One - in - six ( 16 % ) of those who say they “ definitely voted ” in the 2014 midterm election have no record of voting in commercially available national voter files , according to a Pew Research Center analysis .",same,Discuss what people remember of voting in the 2014 election?,answer2,"One - in - six ( 16 % ) of those who say they “ definitely voted ” in the 2014 midterm election have no record of voting in commercially available national voter files , according to a Pew Research Center analysis .","One - in - six ( 16 % ) of those who say they “ definitely voted ” in the 2014 midterm election have no record of voting in commercially available national voter files , according to a Pew Research Center analysis .",,It ’s straightforward question but answers yielded some interesting results, 
mturk_charts/no_data/multi_col/9240.png,"The mismatch group is also significantly more likely to have changed residences in the past few years , making it more challenging for voter databases to maintain up - to - date records of their voting history . For example , those who have lived at least five years at their current residence are significantly more likely to have their self - reported vote match the voter record than those who have a shorter residential tenure ( 12 % vs. 26 % ) . Renters ( 27 % ) are twice as likely as homeowners ( 13 % ) to say they voted but to not have a record of voting .",same,Compare what those who lived at their current residence for more than 5 years and less remember about voting in the 2014 elections?,answer2,Those who have lived at least five years at their current residence are significantly more likely to have their self - reported vote match the voter record than those who have a shorter residential tenure ( 12 % vs. 26 % ) .,those who have lived at least five years at their current residence are significantly more likely to have their self - reported vote match the voter record than those who have a shorter residential tenure ( 12 % vs. 26 % ) .,,"The mismatch group is also changed residences in past few , making it challenging for databases maintain up date records of voting history For example , Renters 27 twice as as homeowners 13 say they voted but not of voting", 
mturk_charts/no_data/multi_col/9244.png,"Canadians are more concerned than their American counterparts on a number of key issues related to climate change . For example , in Pew Research Center ’s spring 2015 survey of 40 nations , 84 % of Canadians supported an international agreement to limit their country ’s greenhouse gas emissions , compared with 69 % of Americans . This agreement was subsequently adopted at the Paris COP21 conference , but whether the United States will enact such an accord remains in question . A majority ( 56 % ) of Canadians say climate change is harming people now , while only 41 % of Americans agree . On most of the questions presented to both Canadians and Americans on climate change , Canadians were more concerned and closer to the global 40 - country median than Americans , who were generally less concerned than others around the world .",same,Compare Americans to Canadians on concerns to global climate?,answer2,"Canadians are more concerned than their American counterparts on a number of key issues related to climate change . For example , in Pew Research Center ’s spring 2015 survey of 40 nations , 84 % of Canadians supported an international agreement to limit their country ’s greenhouse gas emissions , compared with 69 % of Americans . A majority ( 56 % ) of Canadians say climate change is harming people now , while only 41 % of Americans agree . On most of the questions presented to both Canadians and Americans on climate change , Canadians were more concerned and closer to the global 40 - country median than Americans , who were generally less concerned than others around the world .","Canadians are more concerned than their American counterparts on a number of key issues related to climate change . For example , in Pew Research Center ’s spring 2015 survey of 40 nations , 84 % of Canadians supported an international agreement to limit their country ’s greenhouse gas emissions , compared with 69 % of Americans . A majority ( 56 % ) of Canadians say climate change is harming people now , while only 41 % of Americans agree . On most of the questions presented to both Canadians and Americans on climate change , Canadians were more concerned and closer to the global 40 - country median than Americans , who were generally less concerned than others around the world .",,This was subsequently adopted at Paris COP21 conference but whether United States will enact such accord remains question, 
mturk_charts/no_data/multi_col/9255.png,"Half of this group thinks that their vote does n’t really affect how the government runs things , notably higher than the 36 % of those who learned about the election from at least one type of source .",same,Discuss of views of public who say their votes dont affect how government runs things?,answer2,"Half of those who did not learn about the election think that their vote does n’t really affect how the government runs things , notably higher than the 36 % of those who learned about the election from at least one type of source .","Half of this group thinks that their vote does n’t really affect how the government runs things , notably higher than the 36 % of those who learned about the election from at least one type of source .","Half this group thinks that their vote does n’t really affect how government runs things , .",, 
mturk_charts/no_data/multi_col/9270.png,"The U.S. electorate this year will be the country ’s most diverse ever , and that is evident in several Super Tuesday states holding primaries or caucuses on March 1 in which blacks could have a significant impact . In five of 12 Super Tuesday states , blacks account for at least 15 % of the electorate , according to a Pew Research Center analysis of 2014 census data . Black eligible voters have the largest footprint in Georgia ( 31 % ) and Alabama ( 26 % ) , while Virginia , Tennessee and Arkansas also have sizable black electorates .",same,Describe distribution of black eligible voters across US states?,answer2,"Black eligible voters have the largest footprint in Georgia ( 31 % ) and Alabama ( 26 % ) , while Virginia , Tennessee and Arkansas also have sizable black electorates .","Black eligible voters have the largest footprint in Georgia ( 31 % ) and Alabama ( 26 % ) , while Virginia , Tennessee and Arkansas also have sizable black electorates .",.,, 
mturk_charts/no_data/multi_col/9280.png,"Not only that , but 57 % said the choice of a new Supreme Court justice was “ very important ” to them personally , and 24 % said it was “ somewhat important . ” In April 2010 , after Justice John Paul Stevens announced his retirement from the court , and before Obama named Elena Kagan as his replacement , just 40 % viewed the choice of a new Supreme Court justice as very important .",same,What were views of public on next Supreme Court justice in April 2010?,answer2,"In April 2010 , just 40 % viewed the choice of a new Supreme Court justice as very important .","In April 2010 , just 40 % viewed the choice of a new Supreme Court justice as very important .",.,after Justice John Paul Stevens announced his retirement from court and before Obama named Elena Kagan his replacement, 
