img_path,summary,question_resolution,question,answer_resolution,abstractive_answer,extractive_answer,decontextualizated_text_added,decontextualizated_text_removed,extra_added_text,title,original_answer
mturk_charts/no_data/multi_col/4088.png,"The survey also found that many men say men face at least some pressure to engage in activities that are sometimes associated with “ traditional masculinity . ” More than eight - in - ten say men face pressure to be emotionally strong , with 41 % saying men face a lot of pressure in this area . About six - in - ten ( 57 % ) say men face pressure to be willing to throw a punch if provoked , 45 % say men face pressure to join in when other men talk about women in a sexual way , and 40 % say men face pressure to have many sexual partners .",same,What's going on when it comes to fragile masculinity?,answer1,"The survey also found that many men say men face at least some pressure to engage in activities that are sometimes associated with “ traditional masculinity . ” More than eight - in - ten say men face pressure to be emotionally strong , with 41 % saying men face a lot of pressure in this area . About six - in - ten ( 57 % ) say men face pressure to be willing to throw a punch if provoked , 45 % say men face pressure to join in when other men talk about women in a sexual way , and 40 % say men face pressure to have many sexual partners .","The survey also found that many men say men face at least some pressure to engage in activities that are sometimes associated with “ traditional masculinity . ” More than eight - in - ten say men face pressure to be emotionally strong , with 41 % saying men face a lot of pressure in this area . About six - in - ten ( 57 % ) say men face pressure to be willing to throw a punch if provoked , 45 % say men face pressure to join in when other men talk about women in a sexual way , and 40 % say men face pressure to have many sexual partners .",,,,More than eight-in-ten men say men face pressure to be emotionally strong,"The survey also found that many men say men face at least some pressure to engage in activities that are sometimes associated with “ traditional masculinity . ” More than eight - in - ten say men face pressure to be emotionally strong , with 41 % saying men face a lot of pressure in this area . About six - in - ten ( 57 % ) say men face pressure to be willing to throw a punch if provoked , 45 % say men face pressure to join in when other men talk about women in a sexual way , and 40 % say men face pressure to have many sexual partners"
mturk_charts/no_data/multi_col/4087.png,"When it comes to how men view themselves , about three - in - ten ( 31 % ) say they are very manly or masculine , 54 % describe themselves as somewhat masculine and 15 % say they are not too or not at all masculine . Again , race is linked to views about this : 49 % of black men consider themselves to be very masculine , compared with 34 % of Hispanic men and 28 % of white men . Views also vary by party , with Republican men more likely than Democratic men to describe themselves as very masculine ( 39 % vs. 23 % ) .",same,How do men see their gender role?,answer2,"When it comes to how men view themselves , about three - in - ten ( 31 % ) say they are very manly or masculine , 54 % describe themselves as somewhat masculine and 15 % say they are not too or not at all masculine . Views also vary by party , with Republican men more likely than Democratic men to describe themselves as very masculine ( 39 % vs. 23 % ) .","When it comes to how men view themselves , about three - in - ten ( 31 % ) say they are very manly or masculine , 54 % describe themselves as somewhat masculine and 15 % say they are not too or not at all masculine . Views also vary by party , with Republican men more likely than Democratic men to describe themselves as very masculine ( 39 % vs. 23 % ) .",,,,"Race, education, party linked to how men see their masculinity","When it comes to how men view themselves , about three - in - ten ( 31 % ) say they are very manly or masculine , 54 % describe themselves as somewhat masculine and 15 % say they are not too or not at all masculine . Views also vary by party , with Republican men more likely than Democratic men to describe themselves as very masculine ( 39 % vs. 23 % ) ."
mturk_charts/no_data/multi_col/4076.png,"Among Democratic and Democratic - leaning registered voters , somewhat more say they want the Democratic Party to move in a more moderate ( 53 % ) than more liberal ( 40 % ) direction . These views are about the same as they were following the 2014 midterm elections . In November 2016 , after Trump ’s presidential election victory , a somewhat greater share of Democrats ( 49 % ) wanted the party to head in a more liberal direction .",same,How liberal are Democratic partisans?,answer1,"Among Democratic and Democratic - leaning registered voters , somewhat more say they want the Democratic Party to move in a more moderate ( 53 % ) than more liberal ( 40 % ) direction . These views are about the same as they were following the 2014 midterm elections . In November 2016 , after Trump ’s presidential election victory , a somewhat greater share of Democrats ( 49 % ) wanted the party to head in a more liberal direction .","Among Democratic and Democratic - leaning registered voters , somewhat more say they want the Democratic Party to move in a more moderate ( 53 % ) than more liberal ( 40 % ) direction . These views are about the same as they were following the 2014 midterm elections . In November 2016 , after Trump ’s presidential election victory , a somewhat greater share of Democrats ( 49 % ) wanted the party to head in a more liberal direction .",,,,Democratic views on their preferred ideological direction for the party,"Among Democratic and Democratic - leaning registered voters , somewhat more say they want the Democratic Party to move in a more moderate ( 53 % ) than more liberal ( 40 % ) direction . These views are about the same as they were following the 2014 midterm elections . In November 2016 , after Trump ’s presidential election victory , a somewhat greater share of Democrats ( 49 % ) wanted the party to head in a more liberal direction"
mturk_charts/no_data/multi_col/4053.png,"Another kind of survey experiment involves randomly assigning different answer choices to survey questions . A recent survey by the Center asked Americans whether Trump or Democratic congressional leaders should take the lead in solving the nation ’s problems . One group of respondents saw only two possible answers : Trump or Democratic leaders . But another group saw an additional answer : both . The experiment showed one consistent pattern : Regardless of the answer options , a greater share of the public said that Democrats should take the lead than said Trump should take the lead . But in the version of the question in which “ both ” was an explicit option , a 54 % majority of Americans chose that response .",same,How natural is bipartisan for U.S adults?,answer1,"One group of respondents saw only two possible answers : Trump or Democratic leaders . But another group saw an additional answer : both But in the version of the question in which “ both ” was an explicit option , a 54 % majority of Americans chose that response .","One group of respondents saw only two possible answers : Trump or Democratic leaders . But another group saw an additional answer : both But in the version of the question in which “ both ” was an explicit option , a 54 % majority of Americans chose that response .","in the version the question in which “ ” was explicit option , a 54 % majority Americans chose that response",,,"Partisan divide over who should 'take the lead,' but when given the option, a majority says it should be both Trump and Democratic leaders",. One group of respondents saw only two possible answers : Trump or Democratic leaders . But another group saw an additional answer : both
mturk_charts/no_data/multi_col/4067.png,"As economic and security concerns have become less prominent , the domestic issues of reducing health care costs ( 69 % top priority ) and improving the educational system ( 68 % ) now rank among the top tier of public priorities . About two - thirds also say that taking steps to make the Social Security ( 67 % ) and Medicare ( 67 % ) systems financially sound are top priorities for the country .",same,What is socially expected when it comes to public policies?,answer1,"As economic and security concerns have become less prominent , the domestic issues of reducing health care costs ( 69 % top priority ) and improving the educational system ( 68 % ) now rank among the top tier of public priorities . About two - thirds also say that taking steps to make the Social Security ( 67 % ) and Medicare ( 67 % ) systems financially sound are top priorities for the country .","As economic and security concerns have become less prominent , the domestic issues of reducing health care costs ( 69 % top priority ) and improving the educational system ( 68 % ) now rank among the top tier of public priorities . About two - thirds also say that taking steps to make the Social Security ( 67 % ) and Medicare ( 67 % ) systems financially sound are top priorities for the country .",,,,Public's policy priorities for 2019,"As economic and security concerns have become less prominent , the domestic issues of reducing health care costs ( 69 % top priority ) and improving the educational system ( 68 % ) now rank among the top tier of public priorities . About two - thirds also say that taking steps to make the Social Security ( 67 % ) and Medicare ( 67 % ) systems financially sound are top priorities for the country"
mturk_charts/no_data/multi_col/4065.png,"The destinations of emigrants from Latin American and Caribbean countries have changed somewhat since 1990 , though the United States remains the overwhelming destination of choice . The U.S. was home to 67 % of the region ’s emigrants in 2017 , almost unchanged from 62 % in 1990 . In 2017 , 16 % of emigrants lived in other Latin American - Caribbean countries , down from 26 % in 1990 . Argentina was the top destination country for this group of emigrants , with 1.8 million people from other Latin American countries living there in 2017 , up from 830,000 in 1990 . Meanwhile , the share of Latin American and Caribbean emigrants living in Europe reached 12 % in 2017 , up from 7 % in 1990 .",same,What are the destination countries usually considered by emigrants?,answer1,"The destinations of emigrants from Latin American and Caribbean countries have changed somewhat since 1990 , though the United States remains the overwhelming destination of choice . The U.S. was home to 67 % of the region ’s emigrants in 2017 , almost unchanged from 62 % in 1990 . In 2017 , 16 % of emigrants lived in other Latin American - Caribbean countries , down from 26 % in 1990 . Meanwhile , the share of Latin American and Caribbean emigrants living in Europe reached 12 % in 2017 , up from 7 % in 1990 .","The destinations of emigrants from Latin American and Caribbean countries have changed somewhat since 1990 , though the United States remains the overwhelming destination of choice . The U.S. was home to 67 % of the region ’s emigrants in 2017 , almost unchanged from 62 % in 1990 . In 2017 , 16 % of emigrants lived in other Latin American - Caribbean countries , down from 26 % in 1990 . Meanwhile , the share of Latin American and Caribbean emigrants living in Europe reached 12 % in 2017 , up from 7 % in 1990 .",,"Argentina top country for this group with 1.8 million people there 830,000",,Majority of Latin American and Caribbean emigrants live in the U.S.,"The destinations of emigrants from Latin American and Caribbean countries have changed somewhat since 1990 , though the United States remains the overwhelming destination of choice . The U.S. was home to 67 % of the region ’s emigrants in 2017 , almost unchanged from 62 % in 1990 . In 2017 , 16 % of emigrants lived in other Latin American - Caribbean countries , down from 26 % in 1990 . Argentina was the top destination country for this group of emigrants , with 1.8 million people from other Latin American countries living there in 2017 , up from 830,000 in 1990 . Meanwhile , the share of Latin American and Caribbean emigrants living in Europe reached 12 % in 2017 , up from 7 % in 1990 ."
mturk_charts/no_data/multi_col/4062.png,"The Latin America and Caribbean region was the world ’s fastest - growing source of international migrants from 1990 through 2010 . However , growth in the number of emigrants from this region has slowed dramatically in recent years – due in large part to a slowdown of people leaving Mexico , according to a Pew Research Center analysis of government data . The global population of emigrants ( people living outside their country of birth ) from Latin American - Caribbean nations grew by 7 % between 2010 and 2017 , according to the analysis , which uses data from the United Nations and the U.S. Census Bureau . This is slower than the overall worldwide growth rate of 17 % during the same period . Other regions , meanwhile , saw faster growth than Latin America during the period , including the Middle East and North Africa ( 38 % increase ) and sub - Saharan Africa ( 32 % ) .",same,Compare the growth of emigrant population from different regions of the world?,same,"The global population of emigrants ( people living outside their country of birth ) from Latin American - Caribbean nations grew by 7 % between 2010 and 2017 , according to the analysis , which uses data from the United Nations and the U.S. Census Bureau . This is slower than the overall worldwide growth rate of 17 % during the same period . Other regions , meanwhile , saw faster growth than Latin America during the period , including the Middle East and North Africa ( 38 % increase ) and sub - Saharan Africa ( 32 % ) .","The global population of emigrants ( people living outside their country of birth ) from Latin American - Caribbean nations grew by 7 % between 2010 and 2017 , according to the analysis , which uses data from the United Nations and the U.S. Census Bureau . This is slower than the overall worldwide growth rate of 17 % during the same period . Other regions , meanwhile , saw faster growth than Latin America during the period , including the Middle East and North Africa ( 38 % increase ) and sub - Saharan Africa ( 32 % ) .",,,,Growth of emigrant population from Latin American and Caribbean countries slowed substantially,"The global population of emigrants ( people living outside their country of birth ) from Latin American - Caribbean nations grew by 7 % between 2010 and 2017 , according to the analysis , which uses data from the United Nations and the U.S. Census Bureau . This is slower than the overall worldwide growth rate of 17 % during the same period . Other regions , meanwhile , saw faster growth than Latin America during the period , including the Middle East and North Africa ( 38 % increase ) and sub - Saharan Africa ( 32 % )"
mturk_charts/no_data/multi_col/4061.png,"In practical terms , this type of hyperinflation means that the price of goods can shoot up precipitously over the course of only a week . The turbulent economy has left many Venezuelans saying they can not afford key necessities . In the new Center survey , about three - quarters say there were times over the past year when they did not have enough money to buy food their family needed , 80 % said they sometimes could not pay for their family ’s medical or health care , and 87 % said they could not always afford to buy clothing for their family . These differences cut across cleavages in society : Men and women , older and younger Venezuelans , and those with higher and lower levels of education are similarly likely to say they ca n’t afford these basics .",same,Describe how much are the Venezuelans struggling to get the basic needs?,answer1,"In the new Center survey , about three - quarters say there were times over the past year when they did not have enough money to buy food their family needed , 80 % said they sometimes could not pay for their family ’s medical or health care , and 87 % said they could not always afford to buy clothing for their family .","In the new Center survey , about three - quarters say there were times over the past year when they did not have enough money to buy food their family needed , 80 % said they sometimes could not pay for their family ’s medical or health care , and 87 % said they could not always afford to buy clothing for their family .",.,,,Most Venezuelans struggling financially,"In the new Center survey , about three - quarters say there were times over the past year when they did not have enough money to buy food their family needed , 80 % said they sometimes could not pay for their family ’s medical or health care , and 87 % said they could not always afford to buy clothing for their family"
mturk_charts/no_data/multi_col/4059.png,"Younger Venezuelans and those with higher levels of education are slightly less likely to trust the government . Partisan differences are particularly stark . Those who identified as supporters of Maduro ’s United Socialist Party of Venezuela ( PSUV ) when the poll was conducted are much more likely to trust the government than those who support other parties or have no partisan affiliation ; 71 % of PSUV backers trust the national government , compared with just 20 % of other people .",same,Compare the partisan differences on the Venezuelans support of the government?,same,"Those who identified as supporters of ( PSUV ) when the poll was conducted are much more likely to trust the government than those who support other parties or have no partisan affiliation ; 71 % of PSUV backers trust the national government , compared with just 20 % of other people .","Those who identified as supporters of ( PSUV ) when the poll was conducted are much more likely to trust the government than those who support other parties or have no partisan affiliation ; 71 % of PSUV backers trust the national government , compared with just 20 % of other people .",.,Maduro ’s United Socialist Party Venezuela,,Few Venezuelans say they trust their government,"Those who identified as supporters of Maduro ’s United Socialist Party of Venezuela ( PSUV ) when the poll was conducted are much more likely to trust the government than those who support other parties or have no partisan affiliation ; 71 % of PSUV backers trust the national government , compared with just 20 % of other people"
mturk_charts/no_data/multi_col/4054.png,"Survey experiments also may involve randomizing specific details within a question to better understand nuances in views . For example , a report about Americans ’ views about elections included a question that described a hypothetical election with 1 million voters in which one person voted even though they were not eligible to do so . Around four - in - ten Americans ( 41 % ) said this would be a “ major problem . ” But the question also included a set of variations that were randomly assigned . In those versions , the number of people who were described as voting despite being ineligible to vote changed . While some people received the scenario in which one person voted despite being ineligible , others were asked about 10 , 100 , 1,000 , or 10,000 people voting despite being ineligible . The experiment found that 69 % of U.S. adults said that 10,000 people voting despite being ineligible was a major problem , compared with 41 % who said the same about one ineligible person voting . Since respondents were randomly assigned into each version of the question , these differences can be attributed to the changing information itself , not the attributes of the people who responded .",same,"Describe U.S. adults concern about people voting despite being ineligible, comparing it to the number of people on this condition?",answer1,"The experiment found that 69 % of U.S. adults said that 10,000 people voting despite being ineligible was a major problem , compared with 41 % who said the same about one ineligible person voting .","The experiment found that 69 % of U.S. adults said that 10,000 people voting despite being ineligible was a major problem , compared with 41 % who said the same about one ineligible person voting .",.,,,Concern about ineligible voters casting ballots rises as their numbers increase,"The experiment found that 69 % of U.S. adults said that 10,000 people voting despite being ineligible was a major problem , compared with 41 % who said the same about one ineligible person voting"
mturk_charts/no_data/multi_col/4045.png,"In a separate Pew Research Center survey conducted in January , 94 % of Democrats say they trust what Trump says less than what prior presidents said , while 58 % of Republicans say they trust what Trump says more than what prior presidents said . Similarly , nine - in - ten Democrats say the ethical standards of top Trump administration officials are poor or not good , while around three - quarters of Republicans ( 76 % ) say the administration ’s ethical standards are excellent or good .",same,How much do Democrats and Republicans trust in what Trump says?,same,"94 % of Democrats say they trust what Trump says less than what prior presidents said , while 58 % of Republicans say they trust what Trump says more than what prior presidents said .","94 % of Democrats say they trust what Trump says less than what prior presidents said , while 58 % of Republicans say they trust what Trump says more than what prior presidents said .",.,,,Trust in what Trump says varies sharply by party,"94 % of Democrats say they trust what Trump says less than what prior presidents said , while 58 % of Republicans say they trust what Trump says more than what prior presidents said"
mturk_charts/no_data/multi_col/4051.png,"The experiment found that respondents were more likely to say plenty of “ jobs ” were available in their community than they were to say plenty of “ good jobs ” were available ( 60 % vs. 48 % ) . While there are partisan differences in these views ( Republicans had more positive views of job availability ) , both Republicans and Democrats are significantly more likely to say “ jobs ” are available than to say “ good jobs ” are .",same,Describe the difference of opinions between jobs and good jobs in the community?,same,The experiment found that respondents were more likely to say plenty of “ jobs ” were available in their community than they were to say plenty of “ good jobs ” were available ( 60 % vs. 48 % ) .,The experiment found that respondents were more likely to say plenty of “ jobs ” were available in their community than they were to say plenty of “ good jobs ” were available ( 60 % vs. 48 % ) .,.,,,A gap in views of the availability of jobs and 'good jobs',The experiment found that respondents were more likely to say plenty of “ jobs ” were available in their community than they were to say plenty of “ good jobs ” were available ( 60 % vs. 48 % )
mturk_charts/no_data/multi_col/3988.png,"Across the five Asia - Pacific countries surveyed , cyberattacks , climate change and ISIS are all mentioned as top concerns by at least one country . In Japan , it is cyberattacks , while in South Korea and Australia , it is climate change . ISIS is named as the top threat in the Philippines and Indonesia , nations where Islamic extremist violence has occurred frequently over the past 15 years . Asia - Pacific publics also express concern about North Korea ’s nuclear program and China ’s power and influence . In South Korea , more rate China ’s power as a major threat ( 82 % ) than the DPRK ’s nuclear program ( 67 % ) . Since 2013 , concern about North Korea has fallen substantially in South Korea , from 82 % in 2013 to 67 % in 2018 . Over that time , perceptions of China as a threat have grown in four of the nations surveyed in the region , particularly in Australia ( up 20 points ) and Indonesia ( up 16 ) .",same,What are top threats in Asia-Pacific?,new_answer,"Across the five Asia - Pacific countries surveyed , cyberattacks , climate change and ISIS are all mentioned as top concerns by at least one country . In Japan , it is cyberattacks , while in South Korea and Australia , it is climate change . ISIS is named as the top threat in the Philippines and Indonesia . In South Korea , more rate China ’s power as a major threat ( 82 % ) than the DPRK ’s nuclear program ( 67 % ) .","Across the five Asia - Pacific countries surveyed , cyberattacks , climate change and ISIS are all mentioned as top concerns by at least one country . In Japan , it is cyberattacks , while in South Korea and Australia , it is climate change . ISIS is named as the top threat in the Philippines and Indonesia . In South Korea , more rate China ’s power as a major threat ( 82 % ) than the DPRK ’s nuclear program ( 67 % ) .",,,,"Cyberattacks, climate change and ISIS are top concerns in Asia-Pacific.","Across the five Asia - Pacific countries surveyed , cyberattacks , climate change and ISIS are all mentioned as top concerns by at least one country . In Japan , it is cyberattacks , while in South Korea and Australia , it is climate change . ISIS is named as the top threat in the Philippines and Indonesia . In South Korea , more rate China ’s power as a major threat ( 82 % ) than the DPRK ’s nuclear program ( 67 % ) ."
