img_path,summary,question_resolution,question,answer_resolution,abstractive_answer,extractive_answer,decontextualizated_text_added,decontextualizated_text_removed,extra_added_text,title,original_answer
mturk_charts/no_data/multi_col/4372.png,"Hispanics had a gender gap in voting preference , with 73 % of Hispanic women and 63 % of Hispanic men backing the Democratic congressional candidates – a reflection of the election ’s broad gender differences . In a pre - election Pew Research Center survey of Hispanics , differences by gender extended to views of the country . For example , Hispanic women were significantly more dissatisfied with the way things are going in the country today than Hispanic men . A gender gap also existed among white voters , with 49 % of white women backing the Democratic congressional candidate compared with 39 % of white men . By contrast , few gender differences existed among black voters , with about nine - in - ten black voters of both genders backing Democratic candidates .",same,What is the gender gap between voters of the  democratic candidate?,answer1,"Hispanics had a gender gap in voting preference , with 73 % of Hispanic women and 63 % of Hispanic men backing the Democratic congressional candidates . A gender gap also existed among white voters , with 49 % of white women backing the Democratic congressional candidate compared with 39 % of white men . By contrast , few gender differences existed among black voters , with about nine - in - ten black voters of both genders backing Democratic candidates .","Hispanics had a gender gap in voting preference , with 73 % of Hispanic women and 63 % of Hispanic men backing the Democratic congressional candidates . A gender gap also existed among white voters , with 49 % of white women backing the Democratic congressional candidate compared with 39 % of white men . By contrast , few gender differences existed among black voters , with about nine - in - ten black voters of both genders backing Democratic candidates .",A also existed among white voters 49 white candidate compared 39 white By contrast few existed among black voters about nine ten black voters both genders,– reflection election ’s broad In pre election Pew Research Center survey by extended to views country For example were significantly more dissatisfied way things are going country today than,,Hispanic women more often voted for Democrats than Hispanic men in 2018,"Hispanics had a gender gap in voting preference , with 73 % of Hispanic women and 63 % of Hispanic men backing the Democratic congressional candidates – a reflection of the election ’s broad gender differences . In a pre - election Pew Research Center survey of Hispanics , differences by gender extended to views of the country . For example , Hispanic women were significantly more dissatisfied with the way things are going in the country today than Hispanic men"
mturk_charts/no_data/multi_col/4357.png,"Japanese feel better about their economy than at any time in nearly two decades . But the overall mood in Japan remains wary , if not pessimistic . The prevailing view is that average people are worse off than before the Great Recession , while few think the next generation will fare any better . Automation is one reason the future may not be so bright for ordinary people : Majorities of Japanese say growing reliance on robots and computers will lead to joblessness and income inequality . And less than half the public is satisfied with the way democracy is working in Japan , while more than half hold the view that politicians do not care about ordinary people , that they are corrupt and that elections ultimately do not change much . Positive views of the economy are up 34 percentage points since the early days of the global financial crisis in 2009 . Nonetheless , in 2018 just 44 % say the current economic situation in Japan is good , while 55 % believe conditions are bad . Four - in - ten Japanese ( 41 % ) think average people today are worse off financially than they were 20 years ago . Just 26 % say they are better off . At the same time , only 15 % of the public believes that children today in Japan will grow up to be better off financially than their parents , while 76 % expect they will be worse off . That is among the lowest level of optimism about the next generation ’s prospects among the 27 nations Pew Research Center surveyed in 2018 .",same,What are the expectations Japanese people have about their childrens' future?,answer1,"The overall mood in Japan remains wary , if not pessimistic . Only 15 % of the public believes that children today in Japan will grow up to be better off financially than their parents , while 76 % expect they will be worse off .","the overall mood in Japan remains wary , if not pessimistic . only 15 % of the public believes that children today in Japan will grow up to be better off financially than their parents , while 76 % expect they will be worse off .",overall mood remains wary if not pessimistic . .,,"The overall mood in Japan remains wary , if not pessimistic . Only 15 % of the public believes that children today in Japan will grow up to be better off financially than their parents , while 76 % expect they will be worse off .","Majorities in Japan are still dissatisfied with Japanese economy, are pessimistic about children’s future and are critical of their democracy.","only 15 % of the public believes that children today in Japan will grow up to be better off financially than their parents , while 76 % expect they will be worse off"
mturk_charts/no_data/multi_col/4348.png,"As previous Pew Research Center surveys have shown , the partisan differences in views of women and leadership are wider than gender differences in these opinions . More than twice as many Democrats ( 82 % ) as Republicans ( 36 % ) say the record number of women who will serve in the 116th Congress – most of whom are Democrats – is a good thing . The gender gap is much more modest ; 65 % of women and 55 % of men say the highest - ever number of women in Congress is a good thing .",same,Describe Democrats and Republicans views about the number of women in the Congress?,answer1,The partisan differences in views of women and leadership are wider than gender differences in these opinions . More than twice as many Democrats ( 82 % ) as Republicans ( 36 % ) say the record number of women who will serve in Congress is a good thing .,the partisan differences in views of women and leadership are wider than gender differences in these opinions . More than twice as many Democrats ( 82 % ) as Republicans ( 36 % ) say the record number of women who will serve in Congress is a good thing .,partisan differences views and leadership wider gender differences these opinions . .,116th – most whom –,The partisan differences in views of women and leadership are wider than gender differences in these opinions . More than twice as many Democrats ( 82 % ) as Republicans ( 36 % ) say the record number of women who will serve in Congress is a good thing .,Wide partisan gap in views of the record number of women in the new Congress,More than twice as many Democrats ( 82 % ) as Republicans ( 36 % ) say the record number of women who will serve in the 116th Congress – most of whom are Democrats – is a good thing
mturk_charts/no_data/multi_col/4349.png,"Democrats divided on how far to go in investigating Trump administration . With the Democratic Party now in control of House committees , Democrats are divided on whether they are more concerned congressional Democrats will focus too much – or not enough – in investigating the Trump administration . About half of Democrats and Democratic - leaning independents ( 51 % ) say their bigger concern is that Democrats in Congress will not focus enough on investigating the administration ; nearly as many ( 46 % ) say their bigger concern is they will focus too much on investigations .",same,What Democrats think about investigation of Trump administration?,answer1,Democrats divided on how far to go in investigating Trump administration . About half of Democrats and Democratic - leaning independents ( 51 % ) say their bigger concern is that Democrats in Congress will not focus enough on investigating the administration ; nearly as many ( 46 % ) say their bigger concern is they will focus too much on investigations .,Democrats divided on how far to go in investigating Trump administration . About half of Democrats and Democratic - leaning independents ( 51 % ) say their bigger concern is that Democrats in Congress will not focus enough on investigating the administration ; nearly as many ( 46 % ) say their bigger concern is they will focus too much on investigations .,divided how far to go Trump . .,,,Democrats are split in concerns over investigations of Trump administration,About half of Democrats and Democratic - leaning independents ( 51 % ) say their bigger concern is that Democrats in Congress will not focus enough on investigating the administration ; nearly as many ( 46 % ) say their bigger concern is they will focus too much on investigations
mturk_charts/no_data/multi_col/4371.png,"About a quarter of Hispanics who cast a ballot in 2018 ( 27 % ) said they were voting in a midterm for the first time , compared with 18 % of black voters and 12 % of white voters , according to the exit polls . Meanwhile , many new voters this year were young . A majority of voters younger than 30 said they were voting in a midterm for the first time . ( Note : This item has been corrected . See details at end of post . )",same,Compare proportions of first-time voters?,answer1,"About a quarter of Hispanics who cast a ballot in 2018 ( 27 % ) said they were voting in a midterm for the first time , compared with 18 % of black voters and 12 % of white voters , according to the exit polls . Meanwhile , many new voters this year were young . A majority of voters younger than 30 said they were voting in a midterm for the first time .","About a quarter of Hispanics who cast a ballot in 2018 ( 27 % ) said they were voting in a midterm for the first time , compared with 18 % of black voters and 12 % of white voters , according to the exit polls . Meanwhile , many new voters this year were young . A majority of voters younger than 30 said they were voting in a midterm for the first time .",,,,About a quarter of Hispanic voters cast a ballot in a midterm for the first time in 2018,"About a quarter of Hispanics who cast a ballot in 2018 ( 27 % ) said they were voting in a midterm for the first time , compared with 18 % of black voters and 12 % of white voters , according to the exit polls . Meanwhile , many new voters this year were young . A majority of voters younger than 30 said they were voting in a midterm for the first time"
mturk_charts/no_data/multi_col/4370.png,"In U.S. congressional races nationwide , an estimated 69 % of Latinos voted for the Democratic candidate and 29 % backed the Republican candidate , a more than two - to - one advantage for Democrats , according to National Election Pool exit poll data . These results largely reflect the party affiliation of Latinos . In a Pew Research Center pre - election survey , 62 % of Latinos said they identify with or lean toward the Democratic Party compared with 27 % who affiliated with the Republican Party . Among other racial and ethnic groups , a lower share of whites ( 44 % ) voted for Democrats in congressional races compared with blacks ( 90 % ) and Asians ( 77 % ) . ( Exit polls offer the first look at who voted in an election , a portrait that will be refined over time as more data , such as state voter files , become available . )",same,What are trends in Latino voting?,answer1,"In U.S. congressional races nationwide , an estimated 69 % of Latinos voted for the Democratic candidate and 29 % backed the Republican candidate , a more than two - to - one advantage for Democrats , according to National Election Pool exit poll data .","In U.S. congressional races nationwide , an estimated 69 % of Latinos voted for the Democratic candidate and 29 % backed the Republican candidate , a more than two - to - one advantage for Democrats , according to National Election Pool exit poll data .",.,,,Many more Latinos voted for Democrats than Republicans in 2018 U.S. congressional races,"In U.S. congressional races nationwide , an estimated 69 % of Latinos voted for the Democratic candidate and 29 % backed the Republican candidate , a more than two - to - one advantage for Democrats , according to National Election Pool exit poll data"
mturk_charts/no_data/multi_col/4295.png,"Seven - in - ten Americans say the U.S. should cooperate more with Germany , but only 41 % of Germans say Germany should cooperate more with the U.S. German views on this question have become more negative in the past year : In 2017 , a 56 % majority of Germans said they should collaborate more with the U.S. When asked about cooperation with other major powers , Americans and Germans generally agree that their countries should cooperate more with France , the United Kingdom and China . But when it comes to Russia , people in the U.S. and Germany sharply diverge . A majority of Americans ( 58 % ) want to cooperate less with their Cold War adversary , while nearly seven - in - ten Germans ( 69 % ) want to cooperate more with Russia , the source of about a third of Germany ’s natural gas imports as of 2015 .",same,How do Americans and Germans see each other cooperating over the foreign policies?,answer1,"Seven - in - ten Americans say the U.S. should cooperate more with Germany , but only 41 % of Germans say Germany should cooperate more with the U.S. ","Seven - in - ten Americans say the U.S. should cooperate more with Germany , but only 41 % of Germans say Germany should cooperate more with the U.S.",,German views on this question have become negative past year : In 2017 a 56 majority said they collaborate When asked about cooperation other major powers and generally agree that their countries France United Kingdom and China, ,Americans want more cooperation with European allies - including Germany - but Germans are less likely to want cooperation with the U.S.,"Seven - in - ten Americans say the U.S. should cooperate more with Germany , but only 41 % of Germans say Germany should cooperate more with the U.S. German views on this question have become more negative in the past year : In 2017 , a 56 % majority of Germans said they should collaborate more with the U.S. When asked about cooperation with other major powers , Americans and Germans generally agree that their countries should cooperate more with France , the United Kingdom and China"
mturk_charts/no_data/multi_col/4340.png,"By and large , the public views these examples of algorithmic decision - making as unfair to the people the computer - based systems are evaluating . Most notably , only around one - third of Americans think that the video job interview and personal finance score algorithms would be fair to job applicants and consumers . When asked directly whether they think the use of these algorithms is acceptable , a majority of the public says that they are not acceptable . Two - thirds of Americans ( 68 % ) find the personal finance score algorithm unacceptable , and 67 % say the computer - aided video job analysis algorithm is unacceptable .",same,How are the algorithms seen by Americans?,answer1,"By and large , the public views these examples of algorithmic decision - making as unfair to the people the computer - based systems are evaluating . Most notably , only around one - third of Americans think that the video job interview and personal finance score algorithms would be fair to job applicants and consumers . When asked directly whether they think the use of these algorithms is acceptable , a majority of the public says that they are not acceptable . Two - thirds of Americans ( 68 % ) find the personal finance score algorithm unacceptable , and 67 % say the computer - aided video job analysis algorithm is unacceptable .","By and large , the public views these examples of algorithmic decision - making as unfair to the people the computer - based systems are evaluating . Most notably , only around one - third of Americans think that the video job interview and personal finance score algorithms would be fair to job applicants and consumers . When asked directly whether they think the use of these algorithms is acceptable , a majority of the public says that they are not acceptable . Two - thirds of Americans ( 68 % ) find the personal finance score algorithm unacceptable , and 67 % say the computer - aided video job analysis algorithm is unacceptable .",,,,Majorities of Americans find it unacceptable to use algorithms to make decisions with real-world consequences for humans,"By and large , the public views these examples of algorithmic decision - making as unfair to the people the computer - based systems are evaluating . Most notably , only around one - third of Americans think that the video job interview and personal finance score algorithms would be fair to job applicants and consumers . When asked directly whether they think the use of these algorithms is acceptable , a majority of the public says that they are not acceptable . Two - thirds of Americans ( 68 % ) find the personal finance score algorithm unacceptable , and 67 % say the computer - aided video job analysis algorithm is unacceptable ."
mturk_charts/no_data/multi_col/4346.png,"Congressional Democrats hold especially wide leads over Trump – of at least 20 percentage points – on their approaches to the environment , ethics in government , Medicare , health care and Social Security . The Democrats are preferred by smaller margins on foreign policy , immigration policy and gun policy .",same,What are the public views about Congressional Democrats and Trump?,answer1,"Congressional Democrats hold especially wide leads over Trump – of at least 20 percentage points – on their approaches to the environment , ethics in government , Medicare , health care and Social Security . The Democrats are preferred by smaller margins on foreign policy , immigration policy and gun policy .","Congressional Democrats hold especially wide leads over Trump – of at least 20 percentage points – on their approaches to the environment , ethics in government , Medicare , health care and Social Security . The Democrats are preferred by smaller margins on foreign policy , immigration policy and gun policy .",,,,Public prefers Democrats in Congress to Trump on range of issues,"Congressional Democrats hold especially wide leads over Trump – of at least 20 percentage points – on their approaches to the environment , ethics in government , Medicare , health care and Social Security . The Democrats are preferred by smaller margins on foreign policy , immigration policy and gun policy"
mturk_charts/no_data/multi_col/4344.png,"More than four - in - ten ( 44 % ) expect relations between Republicans and Democrats in Washington will get worse in the coming year . In 2014 , after the GOP won full control of Congress , 34 % said partisan relations would worsen and in 2006 , after Democrats won majorities in the House and Senate , just 20 % expressed this view .",same,What are Americans expecting from partisanship?,same,"More than four - in - ten ( 44 % ) expect relations between Republicans and Democrats in Washington will get worse in the coming year . In 2014 , 34 % said partisan relations would worsen and in 2006 just 20 % expressed this view .","More than four - in - ten ( 44 % ) expect relations between Republicans and Democrats in Washington will get worse in the coming year . In 2014 , 34 % said partisan relations would worsen and in 2006 just 20 % expressed this view .",,after GOP won full control of Congress after won majorities House Senate,,More Americans expect partisan relations to get worse than did so stafter three parror midterms % who say relations coming between Republicans aland Democrats in Washington,"More than four - in - ten ( 44 % ) expect relations between Republicans and Democrats in Washington will get worse in the coming year . In 2014 , after the GOP won full control of Congress , 34 % said partisan relations would worsen and in 2006 , after Democrats won majorities in the House and Senate , just 20 % expressed this view"
mturk_charts/no_data/multi_col/4331.png,But artificial additives are far from the only ingredient that people restrict in their diet . About four - in - ten Americans ( 38 % ) report limiting sugar intake and about three - in - ten limit salt ( 29 % ) or fat ( 28 % ) .,same,"Describe Americans opinions about limiting sugar, salt and fat in their food?",same,About four - in - ten Americans ( 38 % ) report limiting sugar intake and about three - in - ten limit salt ( 29 % ) or fat ( 28 % ) .,About four - in - ten Americans ( 38 % ) report limiting sugar intake and about three - in - ten limit salt ( 29 % ) or fat ( 28 % ) .,.,,,44% of Americans say they limit their consumption of artificial sweeteners,About four - in - ten Americans ( 38 % ) report limiting sugar intake and about three - in - ten limit salt ( 29 % ) or fat ( 28 % )
mturk_charts/no_data/multi_col/4298.png,"American and German views on defense spending are generally similar , but there have been notable shifts in opinion in both countries over the last year . Americans have become less likely to say European allies should increase spending on national defense ( 39 % hold this view this year , down from 45 % in 2017 ) . Meanwhile , Germans have become more likely to say their country should increase defense spending ( 43 % have this opinion this year , up from 32 % in 2017 ) .",same,How Germans opinions about investing in defense changed over the last year?,same,"German views on defense spending have notable shifts in opinion over the last year . Germans have become more likely to say their country should increase defense spending ( 43 % have this opinion this year , up from 32 % in 2017 ) .","German views on defense spending have notable shifts in opinion over the last year . Germans have become more likely to say their country should increase defense spending ( 43 % have this opinion this year , up from 32 % in 2017 ) .",German views on notable shifts over the last . .,,,"Germans increasingly want to spend more on defense, even as fewer Americans see a need for European allies to enlarge defense budgets","Germans have become more likely to say their country should increase defense spending ( 43 % have this opinion this year , up from 32 % in 2017 )"
mturk_charts/no_data/multi_col/4297.png,"Most Germans want to be more independent from the U.S. on foreign policy , but most Americans want to remain close with Europe . A wide majority of Germans ( 72 % ) say they want their country to be more independent from the U.S. on foreign policy , while about a quarter ( 24 % ) want it to remain as close to the U.S. as it has been . In the U.S. , roughly two - thirds of Americans ( 65 % ) want to remain close with Europe , rather than be more independent on foreign policy ( 30 % ) .",same,What are Germans opinions about foreign policy with the U.S.?,same,"Most Germans want to be more independent from the U.S. on foreign policy , but most Americans want to remain close with Europe . A wide majority of Germans ( 72 % ) say they want their country to be more independent from the U.S. on foreign policy , while about a quarter ( 24 % ) want it to remain as close to the U.S. as it has been .","Most Germans want to be more independent from the U.S. on foreign policy , but most Americans want to remain close with Europe . A wide majority of Germans ( 72 % ) say they want their country to be more independent from the U.S. on foreign policy , while about a quarter ( 24 % ) want it to remain as close to the U.S. as it has been .",Most but most Americans with Europe . .,,,Do you think the relationship between the U.S. and Europe/U.S. and Germany should remain as close as it has been or do you think that the U.S./Germany should take a more independent approach to foreign policy than it has in the past,"A wide majority of Germans ( 72 % ) say they want their country to be more independent from the U.S. on foreign policy , while about a quarter ( 24 % ) want it to remain as close to the U.S. as it has been"
