img_path,summary,question_resolution,question,answer_resolution,abstractive_answer,extractive_answer,decontextualizated_text_added,decontextualizated_text_removed,extra_added_text,title,original_answer
mturk_charts/no_data/multi_col/4672.png,"Across the countries studied – Denmark , France , Germany , Italy , the Netherlands , Spain , Sweden and the United Kingdom – a median of 70 % say they get news at least daily from TV . The platform ’s reach is highest in Italy and Spain , where 81 % in each country say they get news daily from TV . Online news consumption is slightly less common : A regional median of 60 % get news this way at least daily . But in some countries , the share of people who get news online competes with – or even exceeds – the share who get it through TV .",same,Describe Europeans main way to get news?,answer1,"Across the countries studied – Denmark , France , Germany , Italy , the Netherlands , Spain , Sweden and the United Kingdom – a median of 70 % say they get news at least daily from TV The platform ’s reach is highest in Italy and Spain , where 81 % in each country say they get news daily from TV . Online news consumption is slightly less common : A regional median of 60 % get news this way at least daily . But in some countries , the share of people who get news online competes with – or even exceeds – the share who get it through TV .","Across the countries studied – Denmark , France , Germany , Italy , the Netherlands , Spain , Sweden and the United Kingdom – a median of 70 % say they get news at least daily from TV The platform ’s reach is highest in Italy and Spain , where 81 % in each country say they get news daily from TV . Online news consumption is slightly less common : A regional median of 60 % get news this way at least daily . But in some countries , the share of people who get news online competes with – or even exceeds – the share who get it through TV .",The platform ’s reach is highest in where 81 in each country . Online consumption is slightly less common : A regional 60 this way . But in some share people who online competes with or even exceeds share who it through .,,,"TV is the most popular source for news across Western Europe, but online and radio outlets are just as popular in some countries","Across the countries studied – Denmark , France , Germany , Italy , the Netherlands , Spain , Sweden and the United Kingdom – a median of 70 % say they get news at least daily from TV"
mturk_charts/no_data/multi_col/4670.png,"The shares of U.S. adults who say they use the internet , use social media , own a smartphone or own a tablet computer are all nearly identical to the shares who said so in 2016 . The share who say they have broadband internet service at home currently stands at 65 % – nearly identical to the 67 % who said this in a survey conducted in summer 2015 . And when it comes to desktop or laptop ownership , there has actually been a small dip in the overall numbers over the last two years – from 78 % in 2016 to 73 % today . A contributing factor behind this slowing growth is that parts of the population have reached near - saturation levels of adoption of some technologies . Put simply , in some instances there just are n’t many non - users left . For example , nine - in - ten or more adults younger than 50 say they go online or own a smartphone . And a similar share of those in higher - income households have laptops or desktops .",same,Describe the adoption of internet service at home?,same,nine - in - ten or more adults younger than 50 say they go online or own a smartphone . And a similar share of those in higher - income households have laptops or desktops .,nine - in - ten or more adults younger than 50 say they go online or own a smartphone . And a similar share of those in higher - income households have laptops or desktops .,nine - - ten or more adults younger than 50 go online or own smartphone . And similar of those higher - income households laptops or desktops .,The who broadband internet service at home currently stands at 65 % – nearly identical to the 67 % who said this survey conducted summer 2015,,Some groups have reached near-saturation levels for adoption of basic technologies,The share who say they have broadband internet service at home currently stands at 65 % – nearly identical to the 67 % who said this in a survey conducted in summer 2015
mturk_charts/no_data/multi_col/4665.png,"Younger Republicans are especially likely to say that Republicans in Congress are not obligated to support Trump ’s policies if they disagree with them ; those ages 50 to 64 are about evenly divided in their views . By contrast , a majority of Republicans 65 and older say that Republican lawmakers in Washington do have an obligation to support the president ’s policies even if they disagree . Conservative Republicans and Republican leaners are split in their views : About as many say GOP lawmakers have an obligation to support Trump ’s policies ( 47 % ) as say they do not ( 50 % ) . Most moderate and liberal Republicans ( 72 % ) say Republicans in Congress are not obligated to support Trump ’s policies if they disagree with them .",same,What moderate and liberal Republicans think about their obligation to support Trump?,answer1,Most moderate and liberal Republicans ( 72 % ) say Republicans in Congress are not obligated to support Trump ’s policies if they disagree with them .,Most moderate and liberal Republicans ( 72 % ) say Republicans in Congress are not obligated to support Trump ’s policies if they disagree with them .,.,,,Do Republicans in Congress have an obligation to back Trump’s policies?,Most moderate and liberal Republicans ( 72 % ) say Republicans in Congress are not obligated to support Trump ’s policies if they disagree with them
mturk_charts/no_data/multi_col/4659.png,"Donald Trump receives generally negative ratings from the public across a range of personal traits and characteristics . Just 24 % of Americans say Trump is even - tempered , while nearly three times as many ( 70 % ) say that description does not apply to him . Fewer than half say that Trump is a strong leader ( 43 % ) , well - informed ( 38 % ) , empathetic ( 36 % ) or trustworthy ( 34 % ) .",same,Describe Americans opinions about some of Trump's traits?,answer1,"Donald Trump receives generally negative ratings from the public across a range of personal traits and characteristics . Just 24 % of Americans say Trump is even - tempered , while nearly three times as many ( 70 % ) say that description does not apply to him . Fewer than half say that Trump is a strong leader ( 43 % ) , well - informed ( 38 % ) , empathetic ( 36 % ) or trustworthy ( 34 % ) .","Donald Trump receives generally negative ratings from the public across a range of personal traits and characteristics . Just 24 % of Americans say Trump is even - tempered , while nearly three times as many ( 70 % ) say that description does not apply to him . Fewer than half say that Trump is a strong leader ( 43 % ) , well - informed ( 38 % ) , empathetic ( 36 % ) or trustworthy ( 34 % ) .",Donald receives generally negative ratings from the public across range personal traits and characteristics,,,"Trump gets low marks for temperament, trust; most say he stands up for beliefs","Just 24 % of Americans say Trump is even - tempered , while nearly three times as many ( 70 % ) say that description does not apply to him . Fewer than half say that Trump is a strong leader ( 43 % ) , well - informed ( 38 % ) , empathetic ( 36 % ) or trustworthy ( 34 % )"
mturk_charts/no_data/multi_col/4656.png,"Overall , roughly six - in - ten American adults accept at least one of these New Age beliefs . Specifically , four - in - ten believe in psychics and that spiritual energy can be found in physical objects , while somewhat smaller shares express belief in reincarnation ( 33 % ) and astrology ( 29 % ) . But New Age beliefs are not necessarily replacing belief in traditional forms of religious beliefs or practices . While eight - in - ten Christians say they believe in God as described in the Bible , six - in - ten believe in one or more of the four New Age beliefs analyzed here , ranging from 47 % of evangelical Protestants to roughly seven - in - ten Catholics and Protestants in the historically black tradition .",same,Describe some of the New Age beliefs?,same,"Overall , roughly six - in - ten American adults accept at least one of these New Age beliefs . Specifically , four - in - ten believe in psychics and that spiritual energy can be found in physical objects , while somewhat smaller shares express belief in reincarnation ( 33 % ) and astrology ( 29 % ) .","Overall , roughly six - in - ten American adults accept at least one of these New Age beliefs . Specifically , four - in - ten believe in psychics and that spiritual energy can be found in physical objects , while somewhat smaller shares express belief in reincarnation ( 33 % ) and astrology ( 29 % ) .",Overall roughly six American adults accept at least one of these New Age beliefs . .,,,"Six-in-ten Christians, 'nones' hold at least one New Age belief","Specifically , four - in - ten believe in psychics and that spiritual energy can be found in physical objects , while somewhat smaller shares express belief in reincarnation ( 33 % ) and astrology ( 29 % )"
mturk_charts/no_data/multi_col/4633.png,"Respondents to the survey were read a list of seven major nations , and for each one , were asked whether they think it is playing a more important , less important , or as important of a role in the world compared with 10 years ago . Among the seven countries tested , China stands apart : A median of 70 % across the nations polled say Beijing plays a more important role today than a decade ago . Half or more in 23 of 25 countries express this view . Many also say this about Russia . A median of 42 % believe Moscow ’s role on the world stage has grown over the past decade , and majorities hold this view in Greece , Israel , Tunisia and Russia itself . Overall , people are split on whether Germany ’s role is greater than it was 10 years ago or about the same , but many in Europe see Germany ’s role as more influential . On the other hand , Europeans are particularly likely to think the UK is less important now . There is no real consensus in views of America ’s prominence in world affairs . A median of 35 % believe it is as important as it was 10 years ago , while 31 % say it is more important and 25 % say less . Japan is the only country with a majority saying that Washington plays a less important role . Meanwhile , Israelis , Nigerians and Kenyans are particularly likely to think the U.S. is more important than it used to be .",same,What is the opinion about America's rise in world power?,answer1,"There is no real consensus in views of America ’s prominence in world affairs . A median of 35 % believe it is as important as it was 10 years ago , while 31 % say it is more important and 25 % say less .","There is no real consensus in views of America ’s prominence in world affairs . A median of 35 % believe it is as important as it was 10 years ago , while 31 % say it is more important and 25 % say less .",,,,China is seen as having more influence in the world over the past decade.,"There is no real consensus in views of America ’s prominence in world affairs . A median of 35 % believe it is as important as it was 10 years ago , while 31 % say it is more important and 25 % say less"
mturk_charts/no_data/multi_col/4628.png,"The survey examined attitudes toward five world leaders , and overall Donald Trump receives the most negative ratings among the five . A median of 70 % across the 25 nations polled lack confidence in the American leader . Russian President Vladimir Putin and Chinese President Xi Jinping also receive mostly negative reviews . In contrast , opinions about German Chancellor Angela Merkel and French President Emmanuel Macron are generally positive . Both leaders are mostly popular in the EU , although there are regional divides within Europe , with Merkel and Macron receiving favorable ratings in the Northern European nations surveyed and less stellar reviews in Eastern and Southern Europe .",same,What the survey shows about population confidence in Trump?,answer1,"The survey examined attitudes toward five world leaders , and overall Donald Trump receives the most negative ratings among the five . A median of 70 % across the 25 nations polled lack confidence in the American leader .","The survey examined attitudes toward five world leaders , and overall Donald Trump receives the most negative ratings among the five . A median of 70 % across the 25 nations polled lack confidence in the American leader .",,,,"Merkel and Macron are viewed with more confidence internationally than Xi, Putin or Trump.","The survey examined attitudes toward five world leaders , and overall Donald Trump receives the most negative ratings among the five . A median of 70 % across the 25 nations polled lack confidence in the American leader"
mturk_charts/no_data/multi_col/4626.png,"Around the world , publics are divided about the direction of American power : Across the 25 nations surveyed , a median of 31 % say the U.S. plays a more important role in the world today than it did ten years ago ; 25 % say it plays a less important role ; and 35 % believe the U.S. is as important as it was a decade ago . In contrast , views about Chinese power are clear : A median of 70 % say China ’s role on the world stage has grown over the past 10 years . Still , by a slim margin , more people name the U.S. as the world ’s leading economic power ( a median of 39 % say the U.S. , 34 % say China ) . And despite the unease many feel about the U.S. at the moment , the idea of a U.S.-led world order is still attractive to most . When asked which would be better for the world , having China or the U.S. as the top global power , people in nearly every country tend to select the U.S. , and this is particularly common among some of China ’s Asia - Pacific neighbors , such as Japan , the Philippines , South Korea and Australia .",same,What is the public opinion about Chinese power?,answer1,A median of 70 % say China ’s role on the world stage has grown over the past 10 years . ,A median of 70 % say China ’s role on the world stage has grown over the past 10 years .,.,, ,People see the balance of power between the U.S. and China.,A median of 70 % say China ’s role on the world stage has grown over the past 10 years
mturk_charts/no_data/multi_col/4625.png,"Even though America ’s image has declined since Trump ’s election , on balance the U.S. still receives positive marks – across the 25 nations polled , a median of 50 % have a favorable opinion of the U.S. , while 43 % offer an unfavorable rating . However , a median of only 27 % say they have confidence in President Trump to do the right thing in world affairs ; 70 % lack confidence in him .",same,What was America's international image in 2018?,answer1,"Even though America ’s image has declined since Trump ’s election , on balance the U.S. still receives positive marks – across the 25 nations polled , a median of 50 % have a favorable opinion of the U.S. , while 43 % offer an unfavorable rating . However , a median of only 27 % say they have confidence in President Trump to do the right thing in world affairs ; 70 % lack confidence in him .","Even though America ’s image has declined since Trump ’s election , on balance the U.S. still receives positive marks – across the 25 nations polled , a median of 50 % have a favorable opinion of the U.S. , while 43 % offer an unfavorable rating . However , a median of only 27 % say they have confidence in President Trump to do the right thing in world affairs ; 70 % lack confidence in him .",,,,America’s international image in 2018,"Even though America ’s image has declined since Trump ’s election , on balance the U.S. still receives positive marks – across the 25 nations polled , a median of 50 % have a favorable opinion of the U.S. , while 43 % offer an unfavorable rating . However , a median of only 27 % say they have confidence in President Trump to do the right thing in world affairs ; 70 % lack confidence in him ."
mturk_charts/no_data/multi_col/4624.png,"While all community types gained at least some population from international migration , suburban counties stand out in terms of domestic migration . A net of 6.4 million people have moved from urban and rural areas into the suburbs since 2000 ( meaning that 6.4 million more people moved into suburban areas from an urban or rural area than moved out of suburban areas to different types of communities ) , while cities lost a net of 5.4 million people and rural counties lost 1.0 million people to other community types . Combined with international migration , urban counties gained a net total of only 1.6 million people due to migration and rural counties lost about 400,000 , compared with suburban counties ’ gain of 11.7 million people .",same,What's trending in American Human migration?,answer1,"While all community types gained at least some population from international migration , suburban counties stand out in terms of domestic migration . A net of 6.4 million people have moved from urban and rural areas into the suburbs since 2000 ( meaning that 6.4 million more people moved into suburban areas from an urban or rural area than moved out of suburban areas to different types of communities ) , while cities lost a net of 5.4 million people and rural counties lost 1.0 million people to other community types . Combined with international migration , urban counties gained a net total of only 1.6 million people due to migration and rural counties lost about 400,000 , compared with suburban counties ’ gain of 11.7 million people .","While all community types gained at least some population from international migration , suburban counties stand out in terms of domestic migration . A net of 6.4 million people have moved from urban and rural areas into the suburbs since 2000 ( meaning that 6.4 million more people moved into suburban areas from an urban or rural area than moved out of suburban areas to different types of communities ) , while cities lost a net of 5.4 million people and rural counties lost 1.0 million people to other community types . Combined with international migration , urban counties gained a net total of only 1.6 million people due to migration and rural counties lost about 400,000 , compared with suburban counties ’ gain of 11.7 million people .",,,,"Suburbs have gained population from international and domestic migration, while rural areas fell behind Total international migration by ","While all community types gained at least some population from international migration , suburban counties stand out in terms of domestic migration . A net of 6.4 million people have moved from urban and rural areas into the suburbs since 2000 ( meaning that 6.4 million more people moved into suburban areas from an urban or rural area than moved out of suburban areas to different types of communities ) , while cities lost a net of 5.4 million people and rural counties lost 1.0 million people to other community types . Combined with international migration , urban counties gained a net total of only 1.6 million people due to migration and rural counties lost about 400,000 , compared with suburban counties ’ gain of 11.7 million people"
mturk_charts/no_data/multi_col/4618.png,"Women account for more than a quarter ( 28 % ) of the 67 judges President Donald Trump has successfully appointed to the federal courts since taking office . That ’s well below the share appointed by Barack Obama – whose 324 judicial appointees were a record 42 % female – but higher than the share appointed by any other Republican president , according to a Pew Research Center analysis of data from the Federal Judicial Center . In both parties , presidents have appointed a growing share of female judges in recent decades . Women represented 22 % of the 324 judges appointed by Republican George W. Bush during his eight years in office , 19 % of the 188 judges appointed by George H.W. Bush and 8 % of the 364 judges appointed by Ronald Reagan . Among recent Democratic presidents , Obama ’s total exceeded the share appointed by Bill Clinton ( 28 % of 372 judges ) and Jimmy Carter ( 16 % of 261 judges ) . Trump ’s numbers are as of Sept. 30 and will change as the Senate moves to confirm more of his pending judicial nominees and as he identifies new nominees for vacant positions .",same,What are the women's thoughts on the government?,answer1,"Women account for more than a quarter ( 28 % ) of the judges President Donald Trump has successfully appointed to the federal courts since taking office . That ’s well below the share appointed by Barack Obama – whose judicial appointees were a record 42 % female – but higher than the share appointed by any other Republican president , according to a Pew Research Center analysis of data from the Federal Judicial Center . In both parties , presidents have appointed a growing share of female judges in recent decades . Women represented 22 % of the judges appointed by Republican George W. Bush during his eight years in office , 19 % of the judges appointed by George H.W. Bush and 8 % of the judges appointed by Ronald Reagan .","Women account for more than a quarter ( 28 % ) of the judges President Donald Trump has successfully appointed to the federal courts since taking office . That ’s well below the share appointed by Barack Obama – whose judicial appointees were a record 42 % female – but higher than the share appointed by any other Republican president , according to a Pew Research Center analysis of data from the Federal Judicial Center . In both parties , presidents have appointed a growing share of female judges in recent decades . Women represented 22 % of the judges appointed by Republican George W. Bush during his eight years in office , 19 % of the judges appointed by George H.W. Bush and 8 % of the judges appointed by Ronald Reagan .",,67 324 324 188 364 Among Democratic total exceeded Bill Clinton 372 Jimmy Carter 16 261 numbers are as Sept. 30 will change as Senate moves confirm pending nominees as he identifies new nominees vacant positions,,Trump has appointed a greater share of women judges than any other Republican presidents,"Women account for more than a quarter ( 28 % ) of the 67 judges President Donald Trump has successfully appointed to the federal courts since taking office . That ’s well below the share appointed by Barack Obama – whose 324 judicial appointees were a record 42 % female – but higher than the share appointed by any other Republican president , according to a Pew Research Center analysis of data from the Federal Judicial Center . In both parties , presidents have appointed a growing share of female judges in recent decades . Women represented 22 % of the 324 judges appointed by Republican George W. Bush during his eight years in office , 19 % of the 188 judges appointed by George H.W. Bush and 8 % of the 364 judges appointed by Ronald Reagan . Among recent Democratic presidents , Obama ’s total exceeded the share appointed by Bill Clinton ( 28 % of 372 judges ) and Jimmy Carter ( 16 % of 261 judges ) . Trump ’s numbers are as of Sept. 30 and will change as the Senate moves to confirm more of his pending judicial nominees and as he identifies new nominees for vacant positions"
mturk_charts/no_data/multi_col/4616.png,"Unlike in 2014 , when 2.1 million more votes were cast in Republican than in Democratic House primaries , this year Democratic races drew more votes : 20.4 million versus 16.3 million . That was nearly twice as many votes as the 10.7 million cast in 2014 ’s Democratic House primaries . One reason : There have been a lot more contested primaries on the Democratic side this year , and contested races tend to attract more voters .",same,Describe Democrats rise in votes?,answer1,"Unlike in 2014 , when 2.1 million more votes were cast in Republican than in Democratic House primaries , this year Democratic races drew more votes : 20.4 million versus 16.3 million . That was nearly twice as many votes as the 10.7 million cast in 2014 ’s Democratic House primaries .","Unlike in 2014 , when 2.1 million more votes were cast in Republican than in Democratic House primaries , this year Democratic races drew more votes : 20.4 million versus 16.3 million . That was nearly twice as many votes as the 10.7 million cast in 2014 ’s Democratic House primaries .",,,,"More contested House races are driving higher turnout, particularly among Democrats","Unlike in 2014 , when 2.1 million more votes were cast in Republican than in Democratic House primaries , this year Democratic races drew more votes : 20.4 million versus 16.3 million . That was nearly twice as many votes as the 10.7 million cast in 2014 ’s Democratic House primaries"
