img_path,"summary",question_resolution,"question",answer_resolution,"abstractive_answer","extractive_answer","decontextualizated_text_added","decontextualizated_text_removed","extra_added_text"
mturk_charts/no_data/multi_col/4919.png,"A separate survey by Pew Research Center finds that about four - in - ten Americans ( 43 % ) think it would a good thing for the country if a Democratic woman was elected president ; 32 % say this would be neither a good thing nor a bad thing , and 24 % say it would be a bad thing for the country if a Democratic woman became president . When asked about the prospect of electing a Republican woman president , 32 % say this would be a good thing , while 44 % see it as neither good nor bad and 23 % say it would be a bad thing for the country . About seven - in - ten Democrats ( 69 % ) say a woman from their own party being elected president would be a good thing for the country . But when asked about the prospect of a Republican woman president , only 21 % of Democrats say this would be a good thing ; 44 % say it would be neither good nor bad and 35 % say it would be a bad thing . Among Republicans , 47 % say it would be a good thing to have a Republican woman as president , but a similar share ( 42 % ) see this as neither good nor bad . About one - in - ten ( 11 % ) say this would be a bad thing for the country . Republicans have far less positive views about the prospect of a Democratic woman being elected president : Just 10 % say this would be a good thing while half ( 52 % ) say it would be a bad thing for the country .",same,"How do partisans see the possibility of a female leader?",answer1,"A separate survey by Pew Research Center finds that about four - in - ten Americans ( 43 % ) think it would a good thing for the country if a Democratic woman was elected president ; 32 % say this would be neither a good thing nor a bad thing , and 24 % say it would be a bad thing for the country if a Democratic woman became president . When asked about the prospect of electing a Republican woman president , 32 % say this would be a good thing , while 44 % see it as neither good nor bad and 23 % say it would be a bad thing for the country . About seven - in - ten Democrats ( 69 % ) say a woman from their own party being elected president would be a good thing for the country . But when asked about the prospect of a Republican woman president , only 21 % of Democrats say this would be a good thing ; 44 % say it would be neither good nor bad and 35 % say it would be a bad thing . Among Republicans , 47 % say it would be a good thing to have a Republican woman as president , but a similar share ( 42 % ) see this as neither good nor bad . About one - in - ten ( 11 % ) say this would be a bad thing for the country . Republicans have far less positive views about the prospect of a Democratic woman being elected president : Just 10 % say this would be a good thing while half ( 52 % ) say it would be a bad thing for the country .","A separate survey by Pew Research Center finds that about four - in - ten Americans ( 43 % ) think it would a good thing for the country if a Democratic woman was elected president ; 32 % say this would be neither a good thing nor a bad thing , and 24 % say it would be a bad thing for the country if a Democratic woman became president . When asked about the prospect of electing a Republican woman president , 32 % say this would be a good thing , while 44 % see it as neither good nor bad and 23 % say it would be a bad thing for the country . About seven - in - ten Democrats ( 69 % ) say a woman from their own party being elected president would be a good thing for the country . But when asked about the prospect of a Republican woman president , only 21 % of Democrats say this would be a good thing ; 44 % say it would be neither good nor bad and 35 % say it would be a bad thing . Among Republicans , 47 % say it would be a good thing to have a Republican woman as president , but a similar share ( 42 % ) see this as neither good nor bad . About one - in - ten ( 11 % ) say this would be a bad thing for the country . Republicans have far less positive views about the prospect of a Democratic woman being elected president : Just 10 % say this would be a good thing while half ( 52 % ) say it would be a bad thing for the country .","","",""
mturk_charts/no_data/multi_col/4925.png,"When asked about the possibility of influencing the internal affairs of other countries , Russians are divided on their own government ’s actions . Nearly equal numbers say the Russian government mostly stays out of the internal affairs of other countries ( 46 % ) as say it does try to influence other nations ( 45 % ) . Young Russians ( ages 18 to 29 ) are more likely to say Russia tries to interfere abroad ( 56 % ) than those 50 and older ( 41 % ) . Those Russians who lack confidence in Putin are also more willing to say Russia tries to influence other countries ( 63 % ) . However , Russians clearly see the U.S. as an interfering power , with 85 % saying the U.S. tries to shape the internal affairs of other countries versus only 9 % who say the U.S. stays out . In looking at other countries , roughly six - in - ten in Russia say that Canada ( 62 % ) and China ( 61 % ) avoid meddling , but 48 % say that Germany does try to influence the affairs of other countries .",same,"How do Russians see their government's influence over the world?",answer1,"Nearly equal numbers say the Russian government mostly stays out of the internal affairs of other countries ( 46 % ) as say it does try to influence other nations ( 45 % ) .","Nearly equal numbers say the Russian government mostly stays out of the internal affairs of other countries ( 46 % ) as say it does try to influence other nations ( 45 % ) .","","Young Russians ages 18 29 are more likely Russia tries interfere abroad 56 than those 50 and older 41 Those Russians who lack confidence in Putin are also more willing Russia tries 63 However , Russians clearly see U.S. an interfering power , with 85 saying U.S. tries shape versus only 9 who U.S.",""
mturk_charts/no_data/multi_col/4926.png,"Most Russians say that Western sanctions are having an effect on their economy , and nearly half ( 47 % ) say it is a major effect . This concern is little changed from surveys in 2015 and 2017 . Relatedly , 80 % of Russians see NATO as a military threat , with 45 % stating it is a major threat . Similar sentiments toward the organization were shared in 2015 and 2017 .",same,"What is the Russian's perception of Western sanctions effect?",answer1,"Most Russians say that Western sanctions are having an effect on their economy , and nearly half ( 47 % ) say it is a major effect .","Most Russians say that Western sanctions are having an effect on their economy , and nearly half ( 47 % ) say it is a major effect .","","This concern little changed from surveys in 2015 2017 Relatedly 80 of see NATO as military threat with 45 stating threat Similar sentiments toward the organization were shared in 2015 2017",""
mturk_charts/no_data/multi_col/4928.png,"When it comes to international perceptions of Russia , a majority of Russians say their country should be more respected around the world . Roughly six - in - ten ( 61 % ) say Russia does not get enough respect , with only about half that ( 32 % ) saying Russia is as respected around the world as it should be . These sentiments are largely unchanged since 2017 , but since 2012 , feelings that Russia is as respected as it should be have doubled .",same,"How do Russians see their national sovereignty towards the world?",answer1,"When it comes to international perceptions of Russia , a majority of Russians say their country should be more respected around the world . Roughly six - in - ten ( 61 % ) say Russia does not get enough respect , with only about half that ( 32 % ) saying Russia is as respected around the world as it should be .","When it comes to international perceptions of Russia , a majority of Russians say their country should be more respected around the world . Roughly six - in - ten ( 61 % ) say Russia does not get enough respect , with only about half that ( 32 % ) saying Russia is as respected around the world as it should be .","","These sentiments are largely unchanged since 2017 but since 2012 feelings have doubled",""
mturk_charts/no_data/multi_col/4932.png,"Despite satisfaction with the country ’s overall direction , the Russian public still sees a bevy of problems . Among these , economic issues are the most pressing , especially inflation : 69 % say rising prices are a very big problem for Russia . An additional 25 % say inflation is a moderately big problem , meaning that 94 % of the public is concerned about the issue . Other economic issues near the top in the survey are income inequality and a lack of jobs , with 57 % of Russians saying these are very big problems . Inequality , in particular , is considered a bigger problem among Russians ages 50 and older ( 66 % say it is a very big problem ) and those whose income is below the country median ( 62 % ) . Corruption among the political elite is also a pressing concern among Russians , with 59 % saying it is a very big problem . Concern about corruption is especially common among people who lack confidence in Putin ( of whom 69 % see it as very big problem ) or do not support United Russia ( 67 % ) . Fewer Russians are concerned about corrupt business leaders ( 44 % ) .",same,"What are major problems in Russia?",answer2,"Economic issues are the most pressing , especially inflation : 69 % say rising prices are a very big problem for Russia . Other economic issues near the top in the survey are income inequality and a lack of jobs , with 57 % of Russians saying these are very big problems . Corruption among the political elite is also a pressing concern among Russians , with 59 % saying it is a very big problem .","economic issues are the most pressing , especially inflation : 69 % say rising prices are a very big problem for Russia . Other economic issues near the top in the survey are income inequality and a lack of jobs , with 57 % of Russians saying these are very big problems . Corruption among the political elite is also a pressing concern among Russians , with 59 % saying it is a very big problem .","Other near top in survey income inequality and lack jobs with 57 Russians saying problems Corruption among political elite also concern among Russians with 59 saying it","Among An additional 25 moderately meaning that 94 public concerned about issue","Economic issues are the most pressing , especially inflation : 69 % say rising prices are a very big problem for Russia . Other economic issues near the top in the survey are income inequality and a lack of jobs , with 57 % of Russians saying these are very big problems . Corruption among the political elite is also a pressing concern among Russians , with 59 % saying it is a very big problem ."
mturk_charts/no_data/multi_col/4936.png,"Digital advertising revenue continues to grow , but little of it benefits news organizations . Total digital advertising revenue has jumped 25 % in 2017 across all types of digital outlets , not just news , according to eMarketer . This has been especially true of mobile advertising revenue , which totaled $ 61 billion in 2017 , roughly equal to the total amount of digital advertising revenue just two years prior , in 2015 ( $ 60 billion ) – and which goes hand in hand with Americans ’ increased use of mobile for news . However , news organizations seem to share little in this bonanza – 52 % of all digital display advertising revenue goes to just two companies : Facebook and Google .",same,"What are trends in digital advertising revenue?",same,"Digital advertising revenue continues to grow , but little of it benefits news organizations . Total digital advertising revenue has jumped 25 % in 2017 across all types of digital outlets , not just news , according to eMarketer .","Digital advertising revenue continues to grow , but little of it benefits news organizations . Total digital advertising revenue has jumped 25 % in 2017 across all types of digital outlets , not just news , according to eMarketer .","Digital continues grow , but little it benefits news organizations . Total has jumped 25 in 2017 across types outlets , not news , according eMarketer .","52 display goes two companies : Facebook and Google",""
mturk_charts/no_data/multi_col/4951.png,"The survey ’s most widely accepted use of genetic intervention of animals involves mosquitoes . Seven - in - ten Americans ( 70 % ) believe that genetically engineering mosquitoes to prevent their reproduction and therefore the spread of some mosquito - borne diseases would be an appropriate use of technology , while about three - in - ten ( 29 % ) see the use of genetic engineering for this purpose as taking technology too far .",same,"What are views on genetic engineering of mosquitos?",answer2,"Seven - in - ten Americans ( 70 % ) believe that genetically engineering mosquitoes to prevent their reproduction and therefore the spread of some mosquito - borne diseases would be an appropriate use of technology , while about three - in - ten ( 29 % ) see the use of genetic engineering for this purpose as taking technology too far .","Seven - in - ten Americans ( 70 % ) believe that genetically engineering mosquitoes to prevent their reproduction and therefore the spread of some mosquito - borne diseases would be an appropriate use of technology , while about three - in - ten ( 29 % ) see the use of genetic engineering for this purpose as taking technology too far .",".","",""
mturk_charts/no_data/multi_col/4960.png,"For most Americans , exposure to different content and ideas on social media has not caused them to change their opinions . But a small share of the public – 14 % – say they have changed their views about a political or social issue in the past year because of something they saw on social media , according to a Pew Research Center survey of U.S. adults conducted May 29 - June 11 . Certain groups , particularly young men , are more likely than others to say they ’ve modified their views because of social media . Around three - in - ten men ages 18 to 29 ( 29 % ) say their views on a political or social issue changed in the past year due to social media . This is roughly twice the share saying this among all Americans and more than double the shares among men and women ages 30 and older ( 12 % and 11 % , respectively ) . There are also differences by race and ethnicity , according to the new survey . Around one - in - five black ( 19 % ) and Hispanic ( 22 % ) Americans say their views changed due to social media , compared with 11 % of whites .",same,"How U.S. adults perceive the impact of social media on their opinions?",same,"For most Americans , exposure to different content and ideas on social media has not caused them to change their opinions . But a small share of the public – 14 % – say they have changed their views about a political or social issue in the past year because of something they saw on social media according to a Pew Research Center survey of U.S. adults conducted May 29 - June 11 . Around three - in - ten men ages 18 to 29 ( 29 % ) say their views on a political or social issue changed in the past year due to social media . This is roughly twice the share saying this among all Americans and more than double the shares among men and women ages 30 and older ( 12 % and 11 % , respectively ) .","For most Americans , exposure to different content and ideas on social media has not caused them to change their opinions . But a small share of the public – 14 % – say they have changed their views about a political or social issue in the past year because of something they saw on social media according to a Pew Research Center survey of U.S. adults conducted May 29 - June 11 . Around three - in - ten men ages 18 to 29 ( 29 % ) say their views on a political or social issue changed in the past year due to social media . This is roughly twice the share saying this among all Americans and more than double the shares among men and women ages 30 and older ( 12 % and 11 % , respectively ) .","according Pew Research Center survey U.S. adults conducted May 29 - June 11 Around three - - ten men ages 18 29 ( 29 ) due This is roughly twice saying this among all more than double shares among men women ages 30 older ( 12 11 respectively )","",""
mturk_charts/no_data/multi_col/4961.png,"Although most people have not changed their views on a political or social issue in the past year because of social media , those who have also tend to place a high level of personal importance on social media as a tool for personal political engagement and activism . Among all social media users , people who changed their views on an issue are much more likely than those who did n’t to say such sites are important when it comes to getting involved with political or social issues important to them ( 63 % vs. 35 % ) or finding others who share their views about important issues ( 67 % vs. 38 % ) . Just over half whose views changed ( 56 % ) say social media is personally important in providing a venue to express their political opinions , compared with a third of social media users who have not changed a view in the past year ( 33 % ) .",same,"Describe the level of importance on social media for personal political engagement on people?",same,"Among all social media users , people who changed their views on an issue are much more likely than those who did n’t to say such sites are important when it comes to getting involved with political or social issues important to them ( 63 % vs. 35 % ) or finding others who share their views about important issues ( 67 % vs. 38 % ) . Just over half whose views changed ( 56 % ) say social media is personally important in providing a venue to express their political opinions , compared with a third of social media users who have not changed a view in the past year ( 33 % ) .","Among all social media users , people who changed their views on an issue are much more likely than those who did n’t to say such sites are important when it comes to getting involved with political or social issues important to them ( 63 % vs. 35 % ) or finding others who share their views about important issues ( 67 % vs. 38 % ) . Just over half whose views changed ( 56 % ) say social media is personally important in providing a venue to express their political opinions , compared with a third of social media users who have not changed a view in the past year ( 33 % ) .","","",""
mturk_charts/no_data/multi_col/4964.png,"A sharp decrease in the share of mothers with four or more children has played a role in the long - term decline in larger families , according to the Census Bureau data . In 1976 , four - in - ten moms in their early 40s had given birth to four or more children . But by 2016 , the share had shrunk to just 15 % . The three - child family , by contrast , has held relatively constant : In both 1976 and 2016 , roughly a quarter of mothers ages 40 to 44 had given birth to three children .",same,"Describe the trend in mothers with four or more children?",answer2,"A sharp decrease in the share of mothers with four or more children has played a role in the long - term decline in larger families , according to the Census Bureau data . In 1976 , four - in - ten moms in their early 40s had given birth to four or more children . But by 2016 , the share had shrunk to just 15 % .","A sharp decrease in the share of mothers with four or more children has played a role in the long - term decline in larger families , according to the Census Bureau data . In 1976 , four - in - ten moms in their early 40s had given birth to four or more children . But by 2016 , the share had shrunk to just 15 % .","A sharp decrease with played role long term decline larger families according Census Bureau data","The three child family contrast held relatively constant : both and roughly quarter ages 40 44 three",""
mturk_charts/no_data/multi_col/4966.png,"In the wake of Donald Trump ’s 2016 election victory , an overwhelming majority of those who said they had voted for him had “ warm ” feelings for him . By this spring , more than a year into Trump ’s presidency , the feelings of these same Trump voters had changed very little . In March , 82 % of those who reported voting for Trump – and whom researchers were able to verify through voting records as having voted in 2016 – said they felt “ warmly ” toward Trump , with 62 % saying they had “ very warm ” feelings toward him . Their feelings were expressed on a 0 - 100 “ feeling thermometer . ” A rating of 51 or higher is “ warm , ” with 76 or higher indicating “ very warm ” feelings .",same,"How have Trump's supporter's views changed along the time?",answer1,"By this spring , the feelings of these same Trump voters had changed very little . In March , 82 % of those who reported voting for Trump said they felt “ warmly ” toward Trump , with 62 % saying they had “ very warm ” feelings toward him . Their feelings were expressed on a 0 - 100 “ feeling thermometer . ” A rating of 51 or higher is “ warm , ” with 76 or higher indicating “ very warm ” feelings .","By this spring , the feelings of these same Trump voters had changed very little . In March , 82 % of those who reported voting for Trump said they felt “ warmly ” toward Trump , with 62 % saying they had “ very warm ” feelings toward him . Their feelings were expressed on a 0 - 100 “ feeling thermometer . ” A rating of 51 or higher is “ warm , ” with 76 or higher indicating “ very warm ” feelings .","","more than year into ’s presidency – and whom researchers able to verify through records as having voted in 2016 –",""
mturk_charts/no_data/multi_col/4968.png,"About a third of Trump ’s November 2016 voters ( 35 % ) had cold or neutral feelings toward him earlier that year . By September 2016 , a 57 % majority of these voters had warmed to him , including 24 % who felt very warmly . And shortly after the election , three - quarters of these once cold or neutral voters ( 74 % ) felt warmly toward him , including 43 % who rated him very warmly . Among the 65 % majority of Trump voters who felt warmly toward him in April 2016 , there was much less change in opinions about him . Of this group , 90 % or more maintained warm feelings toward him in September and November 2016 .",same,"How was Trump seen by his supporters?",same,"By September 2016 , a 57 % majority of voters had warmed to Trump , including 24 % who felt very warmly . Among the 65 % majority of Trump voters who felt warmly toward him in April 2016 , there was much less change in opinions about him .","By September 2016 , a 57 % majority of voters had warmed to him , including 24 % who felt very warmly . Among the 65 % majority of Trump voters who felt warmly toward him in April 2016 , there was much less change in opinions about him .","","About third ’s November ( 35 ) cold or neutral feelings earlier that year these And shortly after election three - quarters these once cold or neutral ( 74 ) 43 rated Of this group 90 or more maintained warm feelings and November","By September 2016 , a 57 % majority of voters had warmed to Trump , including 24 % who felt very warmly . Among the 65 % majority of Trump voters who felt warmly toward him in April 2016 , there was much less change in opinions about him ."
