img_path,"summary",question_resolution,"question",answer_resolution,"abstractive_answer","extractive_answer","decontextualizated_text_added","decontextualizated_text_removed","extra_added_text"
mturk_charts/no_data/multi_col/4882.png,"Views of Mexico are mixed : While 39 % say they feel “ warmly ” toward Mexico , 34 % feel “ coldly , ” and 26 % are neutral , according to a new Pew Research Center survey conducted July 30 to Aug. 12 among 4,581 adults . The public has much warmer feelings toward Canada . Two - thirds ( 67 % ) say they feel warmly toward Canada , with 52 % giving it a very warm rating ( 76 or higher on the scale ) . Just 12 % feel coldly toward Canada .",same,"How Americans feel about Canada?",answer1,"The public has much warmer feelings toward Canada . Two - thirds ( 67 % ) say they feel warmly toward Canada , with 52 % giving it a very warm rating . Just 12 % feel coldly toward Canada .","The public has much warmer feelings toward Canada . Two - thirds ( 67 % ) say they feel warmly toward Canada , with 52 % giving it a very warm rating . Just 12 % feel coldly toward Canada .","The public has much warmer feelings","76 or higher on the scale",""
mturk_charts/no_data/multi_col/4887.png,"About eight - in - ten Republicans and Republican - leaning independents ( 81 % ) say Republican and Democratic voters disagree on basic facts of issues . A similar – albeit slightly smaller – share of Democrats and Democratic - leaning independents ( 76 % ) say the same . Just 18 % of Republicans and 23 % of Democrats say that voters of the two parties can agree on basic facts even if they disagree over policies and plans .",same,"Describe agreement or disagreement on basic facts between partisans?",same,"About eight - in - ten Republicans and Republican - leaning independents ( 81 % ) say Republican and Democratic voters disagree on basic facts of issues . A similar – albeit slightly smaller – share of Democrats and Democratic - leaning independents ( 76 % ) say the same . Just 18 % of Republicans and 23 % of Democrats say that voters of the two parties can agree on basic facts even if they disagree over policies and plans .","About eight - in - ten Republicans and Republican - leaning independents ( 81 % ) say Republican and Democratic voters disagree on basic facts of issues . A similar – albeit slightly smaller – share of Democrats and Democratic - leaning independents ( 76 % ) say the same . Just 18 % of Republicans and 23 % of Democrats say that voters of the two parties can agree on basic facts even if they disagree over policies and plans .","About eight - in - ten Republican - leaning independents ( 81 ) Republican Democratic issues . A similar – albeit slightly smaller – share Democratic - leaning independents ( 76 ) same . .","",""
mturk_charts/no_data/multi_col/4888.png,"Opinion on whether or not Republican and Democratic voters can agree on basic facts differs by race and ethnicity . Whites ( 82 % ) are far more likely than blacks ( 70 % ) or Hispanics ( 64 % ) to say that voters can not agree on basic facts . And while about a third ( 34 % ) of Hispanics and 26 % of blacks say that voters of both major parties can agree on basic facts , fewer whites ( 17 % ) say the same . Younger Americans are less likely than older Americans to say that the two parties can not agree on basic facts . About seven - in - ten ( 69 % ) of those ages 18 to 29 say Republican and Democratic voters can not agree on basic facts . In contrast , those ages 30 to 49 ( 78 % ) , 50 to 64 ( 80 % ) and 65 and older ( 83 % ) are much more likely to say the same thing . And while nearly one - third of 18- to 29 - year - olds ( 29 % ) say that partisans do agree on basic facts , just 16 % of those 65 and older say the same .",same,"Describe agreement or disagreement on basic facts between partisans of different age groups?",answer2,"Younger Americans are less likely than older Americans to say that the two parties can not agree on basic facts . About seven - in - ten ( 69 % ) of those ages 18 to 29 say Republican and Democratic voters can not agree on basic facts . those ages 30 to 49 ( 78 % ) , 50 to 64 ( 80 % ) and 65 and older ( 83 % ) are much more likely to say the same thing . And while nearly one - third of 18- to 29 - year - olds ( 29 % ) say that partisans do agree on basic facts , just 16 % of those 65 and older say the same .","Younger Americans are less likely than older Americans to say that the two parties can not agree on basic facts . About seven - in - ten ( 69 % ) of those ages 18 to 29 say Republican and Democratic voters can not agree on basic facts . those ages 30 to 49 ( 78 % ) , 50 to 64 ( 80 % ) and 65 and older ( 83 % ) are much more likely to say the same thing . And while nearly one - third of 18- to 29 - year - olds ( 29 % ) say that partisans do agree on basic facts , just 16 % of those 65 and older say the same .","Younger Americans less than Americans two parties can not About seven in ten 69 18 Republican Democratic voters can not","In contrast",""
mturk_charts/no_data/multi_col/4889.png,"Just prior to the 2016 election , the public had fairly low expectations for Donald Trump ’s presidency . Majorities of Americans said that if Trump was elected , he would not be likely to improve the way government works , set a high moral standard for the presidency or achieve other goals .",same,"What were the expectations of Trump if he was elected?",answer1,"Majorities of Americans said that if Trump was elected , he would not be likely to improve the way government works , set a high moral standard for the presidency .","Majorities of Americans said that if Trump was elected , he would not be likely to improve the way government works , set a high moral standard for the presidency .",", , set a high moral standard for presidency .","",""
mturk_charts/no_data/multi_col/4893.png,"Across five evaluations in the survey , Trump gets his most negative ratings for setting a high moral standard for the presidency . The public ’s pre - election expectations were already quite low : In November 2016 , just 33 % of Americans said that if Trump was elected he definitely or probably would set high moral standard for the presidency ; twice as many ( 66 % ) said he definitely or probably would not do this . The current ratings are somewhat more negative : Just 27 % say Trump has set a high moral standard for the presidency , while 71 % say he has not done this . Republicans are divided in their assessment of Trump in this area : 51 % say he definitely or probably set a high moral standard for the presidency , while 47 % say he definitely or probably has not . Just prior to the election , 60 % of Republicans said they expected Trump would set a high moral standard . Before the election , 89 % of Democrats anticipated that Trump would not set a high moral standard for the presidency ; today , about the same share ( 92 % ) say he has not done this . Still , more Democrats say he has definitely not set a high moral standard for the presidency than said he definitely would do this in the pre - election survey ( 81 % now , 69 % then ) . Similarly , before the election an overwhelming share of Democrats ( 91 % ) said Trump would definitely or probably not improve the country ’s global standing ; today , 90 % say he has not achieved this objective . Republicans ’ views also have changed little since before the election : Currently , 72 % say he has improved the U.S. global standing ; 70 % expected he would do this before his election victory . And while 84 % of Democrats say Trump has improperly used his office to enrich himself , his family or friends , 79 % expected he would do this before the election . Prior to the election , just 29 % of Republicans said Trump definitely or probably would use the office of the presidency for personal gain ; today , even fewer Republicans ( 21 % ) say has definitely or probably done this .",same,"What were expectations of Democrats that Trump would not set a high moral standard for the presidency?",answer2,"Before the election , 89 % of Democrats anticipated that Trump would not set a high moral standard for the presidency ; today , about the same share ( 92 % ) say he has not done this . Still , more Democrats say he has definitely not set a high moral standard for the presidency than said he definitely would do this in the pre - election survey ( 81 % now , 69 % then ) .","Before the election , 89 % of Democrats anticipated that Trump would not set a high moral standard for the presidency ; today , about the same share ( 92 % ) say he has not done this . Still , more Democrats say he has definitely not set a high moral standard for the presidency than said he definitely would do this in the pre - election survey ( 81 % now , 69 % then ) .","Trump","class='chrome-extension-mutihighlight chrome-extension-mutihighlight-style-6'>Trump",""
mturk_charts/no_data/multi_col/4901.png,"More than 22.4 million people applied in 2017 to a U.S. visa program that provides 50,000 green cards , or lawful permanent residence , each year through a lottery system , according to a Pew Research Center analysis of U.S. State Department data . The number of applicants nearly matched the record 23 million applicants received in 2016 and came as the Trump administration and some members of Congress have sought to eliminate the program – the only one of its kind globally . Since 2005 , more than 200 million people from countries around the world have applied for the program , known as the U.S. diversity lottery , which seeks to diversify the nation ’s immigrant population by granting visas to immigrants from nations that are underrepresented among recently arrived immigrants .",same,"Describe the U.S visa program applications since 2005?",answer1,"More than 22.4 million people applied in 2017 to a U.S. visa program according to a Pew Research Center analysis of U.S. State Department data . The number of applicants nearly matched the record 23 million applicants received in 2016 Since 2005 , more than 200 million people from countries around the world have applied for the program .","More than 22.4 million people applied in 2017 to a U.S. visa program according to a Pew Research Center analysis of U.S. State Department data . The number of applicants nearly matched the record 23 million applicants received in 2016 Since 2005 , more than 200 million people from countries around the world have applied for the program .","","that provides 50,000 green cards or lawful permanent residence each year through lottery system and came as Trump administration and some members Congress sought eliminate – only one its kind globally known as diversity lottery which seeks diversify nation ’s immigrant population by granting visas immigrants nations that are underrepresented among recently arrived immigrants",""
mturk_charts/no_data/multi_col/4908.png,"When it comes to evaluating their own online habits , teens express mixed views about whether or not they themselves spend too much time on various screens . Roughly half ( 54 % ) believe they spend too much time on their cellphone , while 41 % say they spend too much time on social media . By contrast , only around one - quarter ( 26 % ) believe they spend too much time playing video games – comparable to the share ( 22 % ) who say they spend too little time gaming . Meanwhile , roughly four - in - ten teens say they spend about the right amount of time on social media or gaming . Despite these varying views about screen time , roughly half or more teens say they have tried to limit the amount of time they spend on each technology . Some 52 % have ever cut back on the time they spend on their cellphone , while 57 % have limited their time spent on social media and 58 % have cut back on their time playing video games .",same,"How's the screen time spent among teenagers?",answer1,"Roughly half ( 54 % ) believe they spend too much time on their cellphone , while 41 % say they spend too much time on social media . By contrast , only around one - quarter ( 26 % ) believe they spend too much time playing video games – comparable to the share ( 22 % ) who say they spend too little time gaming . Meanwhile , roughly four - in - ten teens say they spend about the right amount of time on social media or gaming . Despite these varying views about screen time , roughly half or more teens say they have tried to limit the amount of time they spend on each technology . Some 52 % have ever cut back on the time they spend on their cellphone , while 57 % have limited their time spent on social media and 58 % have cut back on their time playing video games .","Roughly half ( 54 % ) believe they spend too much time on their cellphone , while 41 % say they spend too much time on social media . By contrast , only around one - quarter ( 26 % ) believe they spend too much time playing video games – comparable to the share ( 22 % ) who say they spend too little time gaming . Meanwhile , roughly four - in - ten teens say they spend about the right amount of time on social media or gaming . Despite these varying views about screen time , roughly half or more teens say they have tried to limit the amount of time they spend on each technology . Some 52 % have ever cut back on the time they spend on their cellphone , while 57 % have limited their time spent on social media and 58 % have cut back on their time playing video games .","","",""
mturk_charts/no_data/multi_col/4909.png,"Cellphones are deeply embedded in the everyday experiences of most U.S. teens . Most notably , 72 % of teens say they at least sometimes check for messages or notifications as soon as they wake up ( with 44 % saying they often do this ) . And 57 % feel they often or sometimes have to respond to messages from other people immediately . Meanwhile , 31 % of teens say they lose focus in class because they are checking their cellphone – though just 8 % say this often happens to them , and 38 % say it never does . Teens across a range of demographic groups respond in similar ways to these questions about their cellphone use . However , teens ages 15 to 17 are particularly likely to say they check for messages as soon as they wake up – 49 % say they often do this , compared with 37 % of teens ages 13 to 14 .",same,"How's the relationship between U.S teens and their cell phones?",answer1,"Cellphones are deeply embedded in the everyday experiences of most U.S. teens . Most notably , 72 % of teens say they at least sometimes check for messages or notifications as soon as they wake up ( with 44 % saying they often do this ) . And 57 % feel they often or sometimes have to respond to messages from other people immediately . Meanwhile , 31 % of teens say they lose focus in class because they are checking their cellphone – though just 8 % say this often happens to them , and 38 % say it never does . Teens across a range of demographic groups respond in similar ways to these questions about their cellphone use .","Cellphones are deeply embedded in the everyday experiences of most U.S. teens . Most notably , 72 % of teens say they at least sometimes check for messages or notifications as soon as they wake up ( with 44 % saying they often do this ) . And 57 % feel they often or sometimes have to respond to messages from other people immediately . Meanwhile , 31 % of teens say they lose focus in class because they are checking their cellphone – though just 8 % say this often happens to them , and 38 % say it never does . Teens across a range of demographic groups respond in similar ways to these questions about their cellphone use .","Cellphones deeply embedded the everyday experiences most U.S.","However ages 15 17 particularly likely 49 compared 37 ages 13 14",""
mturk_charts/no_data/multi_col/4912.png,"When asked to reflect on their teen ’s cellphone use , a majority of parents ( 72 % ) feel their teen is at least sometimes distracted by their cellphone when they are trying to have a conversation with them . Indeed , 30 % of parents say their teen often does this . At the same time , this sense of distraction caused by cellphones is not an entirely teen - specific phenomenon . When asked this question about their parent ’s behavior , half of teens say their parent is distracted by their own phone at least sometimes during conversations between them ( 51 % ) , with 14 % of teens reporting that their parent is often distracted in this way .",same,"How in-person relationships have been affected by cell phones?",answer1,"When asked to reflect on their teen ’s cellphone use , a majority of parents ( 72 % ) feel their teen is at least sometimes distracted by their cellphone when they are trying to have a conversation with them . Indeed , 30 % of parents say their teen often does this . At the same time , this sense of distraction caused by cellphones is not an entirely teen - specific phenomenon . When asked this question about their parent ’s behavior , half of teens say their parent is distracted by their own phone at least sometimes during conversations between them ( 51 % ) , with 14 % of teens reporting that their parent is often distracted in this way .","When asked to reflect on their teen ’s cellphone use , a majority of parents ( 72 % ) feel their teen is at least sometimes distracted by their cellphone when they are trying to have a conversation with them . Indeed , 30 % of parents say their teen often does this . At the same time , this sense of distraction caused by cellphones is not an entirely teen - specific phenomenon . When asked this question about their parent ’s behavior , half of teens say their parent is distracted by their own phone at least sometimes during conversations between them ( 51 % ) , with 14 % of teens reporting that their parent is often distracted in this way .","","",""
mturk_charts/no_data/multi_col/4915.png,"About six - in - ten Americans ( 61 % ) say it ’s a good thing that more women are running for U.S. Congress this year than in the past , while a third say this is neither good nor bad . Just 5 % see this as a bad thing .",same,"What are the American views on gender equality when it comes to politics?",same,"About six - in - ten Americans ( 61 % ) say it ’s a good thing that more women are running for U.S. Congress this year than in the past , while a third say this is neither good nor bad . Just 5 % see this as a bad thing .","About six - in - ten Americans ( 61 % ) say it ’s a good thing that more women are running for U.S. Congress this year than in the past , while a third say this is neither good nor bad . Just 5 % see this as a bad thing .","","",""
mturk_charts/no_data/multi_col/4916.png,"While most Americans say it ’s good that more women are running for Congress this year , fewer than half say that , if there were more women there , Congress would do a better job of dealing with the country ’s problems ( 39 % ) ; the tone of the political debate in Washington would be more respectful ( 36 % ) ; or that there would be more openness and transparency in government ( 34 % ) . About half or more say that the number of women in Congress does n’t have much to do with each of these areas .",same,"What's the consensus on having more women in Congress?",same,"While most Americans say it ’s good that more women are running for Congress this year , fewer than half say that , if there were more women there , Congress would do a better job of dealing with the country ’s problems ( 39 % ) ; the tone of the political debate in Washington would be more respectful ( 36 % ) ; or that there would be more openness and transparency in government ( 34 % ) . About half or more say that the number of women in Congress does n’t have much to do with each of these areas .","While most Americans say it ’s good that more women are running for Congress this year , fewer than half say that , if there were more women there , Congress would do a better job of dealing with the country ’s problems ( 39 % ) ; the tone of the political debate in Washington would be more respectful ( 36 % ) ; or that there would be more openness and transparency in government ( 34 % ) . About half or more say that the number of women in Congress does n’t have much to do with each of these areas .","","",""
mturk_charts/no_data/multi_col/4917.png,"Americans today are more likely to say they personally hope the United States will elect a female president in their lifetime – 45 % say this , up from 38 % in November 2014 . Half of the public says it does not matter to them if the U.S. elects a female president .",same,"What are views of Americans on having a female president?",answer1,"Americans today are more likely to say they personally hope the United States will elect a female president in their lifetime – 45 % say this , up from 38 % in November 2014 . Half of the public says it does not matter to them if the U.S. elects a female president .","Americans today are more likely to say they personally hope the United States will elect a female president in their lifetime – 45 % say this , up from 38 % in November 2014 . Half of the public says it does not matter to them if the U.S. elects a female president .","","",""
mturk_charts/no_data/multi_col/4918.png,"Regardless of whether they hope to see a female president , a majority of Americans ( 68 % ) say they expect there to be one in their lifetime . That number is down slightly since 2014 , when 73 % of the public said they thought the U.S. would elect a female president in their lifetime . Still , the share who say they think this is likely to happen is higher than in 1996 , when the question was first asked . At that time , only about half of Americans ( 54 % ) said they thought they would see a woman as president in their lifetime .",same,"Describe the expectations of Americans on having a female leader?",answer1,"Regardless of whether they hope to see a female president , a majority of Americans ( 68 % ) say they expect there to be one in their lifetime . That number is down slightly since 2014 , when 73 % of the public said they thought the U.S. would elect a female president in their lifetime . Still , the share who say they think this is likely to happen is higher than in 1996 , when the question was first asked . At that time , only about half of Americans ( 54 % ) said they thought they would see a woman as president in their lifetime .","Regardless of whether they hope to see a female president , a majority of Americans ( 68 % ) say they expect there to be one in their lifetime . That number is down slightly since 2014 , when 73 % of the public said they thought the U.S. would elect a female president in their lifetime . Still , the share who say they think this is likely to happen is higher than in 1996 , when the question was first asked . At that time , only about half of Americans ( 54 % ) said they thought they would see a woman as president in their lifetime .","","",""
