img_path,"summary",question_resolution,"question",answer_resolution,"abstractive_answer","extractive_answer","decontextualizated_text_added","decontextualizated_text_removed","extra_added_text"
mturk_charts/no_data/multi_col/4816.png,"Even so , Latinos say achieving the American dream is n’t easy . Only about half ( 51 % ) said they had achieved it so far , and about three - quarters ( 74 % ) said achieving the dream today is hard for people like them .",same,"What are Hispanics thoughts about achieving the American dream?",answer2,"Latinos say achieving the American dream is n’t easy . Only about half ( 51 % ) said they had achieved it so far , and about three - quarters ( 74 % ) said achieving the dream today is hard for people like them .","Latinos say achieving the American dream is n’t easy . Only about half ( 51 % ) said they had achieved it so far , and about three - quarters ( 74 % ) said achieving the dream today is hard for people like them .","","Even",""
mturk_charts/no_data/multi_col/4817.png,"The life goals of Latinos overlap with some of these ingredients of the American dream . The two goals rated most highly by Latinos were being a good parent ( 51 % ) and having the resources to provide for their family ( 49 % ) . Owning a home – often seen as a key part of the American dream – was cited by 33 % of Hispanics as an extremely important life goal for them . Other top goals for Hispanics included having a successful marriage ( 30 % ) and being successful in a high - paying career or profession ( 22 % ) .",same,"Describe the life goals of Hispanics?",answer1,"The two goals rated most highly by Latinos were being a good parent ( 51 % ) and having the resources to provide for their family ( 49 % ) . Owning a home was cited by 33 % of Hispanics as an extremely important life goal for them . Other top goals for Hispanics included having a successful marriage ( 30 % ) and being successful in a high - paying career or profession ( 22 % ) .","The two goals rated most highly by Latinos were being a good parent ( 51 % ) and having the resources to provide for their family ( 49 % ) . Owning a home was cited by 33 % of Hispanics as an extremely important life goal for them . Other top goals for Hispanics included having a successful marriage ( 30 % ) and being successful in a high - paying career or profession ( 22 % ) .","","– often seen key part American dream –",""
mturk_charts/no_data/multi_col/4818.png,"Eight - in - ten immigrant Latinos said in 2016 that their own standard of living is better than that of their parents , and just as many expected their children will be better off . Among second - generation Hispanics ( the U.S.-born children of immigrant parents ) , these shares were 75 % and 71 % , respectively – slightly below the shares of immigrant Latinos . But for third or higher generation Latinos ( U.S.-born Latinos with U.S.-born parents ) , just two - thirds ( 66 % ) said they will be better off than their parents and 60 % said they expect their kids to be better off .",same,"Describe life expectations for third generation Latinos?",answer2,"Eight - in - ten immigrant Latinos said in 2016 that their own standard of living is better than that of their parents , and just as many expected their children will be better off . Among second - generation Hispanics , these shares were 75 % and 71 % , respectively – slightly below the shares of immigrant Latinos . But for third or higher generation Latinos , just two - thirds ( 66 % ) said they will be better off than their parents and 60 % said they expect their kids to be better off .","Eight - in - ten immigrant Latinos said in 2016 that their own standard of living is better than that of their parents , and just as many expected their children will be better off . Among second - generation Hispanics , these shares were 75 % and 71 % , respectively – slightly below the shares of immigrant Latinos . But for third or higher generation Latinos , just two - thirds ( 66 % ) said they will be better off than their parents and 60 % said they expect their kids to be better off .","","U.S.-born U.S.-born with U.S.-born",""
mturk_charts/no_data/multi_col/4828.png,"By contrast , smaller shares of Americans who live in urban areas ( 13 % ) or the suburbs ( 9 % ) view access to high - speed internet service as a major problem in their area . And a majority of both urban and suburban residents report that this is not an issue in their local community , according to the survey , conducted Feb. 26 - March 11 . ( The survey categorized Americans as urban , suburban or rural based on their own description of their community type . )",same,"What do urban and suburban Americans say about high-speed internet in their area?",answer2,"Smaller shares of Americans who live in urban areas ( 13 % ) or the suburbs ( 9 % ) view access to high - speed internet service as a major problem in their area . And a majority of both urban and suburban residents report that this is not an issue in their local community , according to the survey , conducted Feb. 26 - March 11 .","smaller shares of Americans who live in urban areas ( 13 % ) or the suburbs ( 9 % ) view access to high - speed internet service as a major problem in their area . And a majority of both urban and suburban residents report that this is not an issue in their local community , according to the survey , conducted Feb. 26 - March 11 .","","By contrast","Smaller shares of Americans who live in urban areas ( 13 % ) or the suburbs ( 9 % ) view access to high - speed internet service as a major problem in their area . And a majority of both urban and suburban residents report that this is not an issue in their local community , according to the survey , conducted Feb. 26 - March 11 ."
mturk_charts/no_data/multi_col/4829.png,"And while the broadband gap between rural and non - rural Americans has narrowed over time , rural adults remain less likely to have a high - speed internet connection at home . Seven - in - ten suburban residents and two - thirds of urban dwellers say they subscribe to broadband services at home , compared with 58 % of rural adults , according to a separate Pew Research Center survey conducted in January .",same,"Compare internet subscriptions between urban and suburban residents?",answer1,"Seven - in - ten suburban residents and two - thirds of urban dwellers say they subscribe to broadband services at home , compared with 58 % of rural adults , according to a separate Pew Research Center survey conducted in January .","Seven - in - ten suburban residents and two - thirds of urban dwellers say they subscribe to broadband services at home , compared with 58 % of rural adults , according to a separate Pew Research Center survey conducted in January .",".","",""
mturk_charts/no_data/multi_col/4835.png,"On Iran , by contrast , there are major differences . While majorities in both parties have cold feelings , these views are much more widespread – and more intensely negative – among Republicans . A 64 % majority of Republicans have very cold feelings toward Iran , compared with only 34 % of Democrats .",same,"What is the feeling towards Iran by both Republicans and Democrats?",answer2,"While majorities in both parties have cold feelings , these views are much more widespread – and more intensely negative – among Republicans . A 64 % majority of Republicans have very cold feelings toward Iran , compared with only 34 % of Democrats .","While majorities in both parties have cold feelings , these views are much more widespread – and more intensely negative – among Republicans . A 64 % majority of Republicans have very cold feelings toward Iran , compared with only 34 % of Democrats .","","",""
mturk_charts/no_data/multi_col/4815.png,"Hispanics are significantly more likely than the general U.S. public to believe in core parts of the American dream – that hard work will pay off and that each successive generation is better off than the one before it . Yet many Hispanics see the American dream as hard to reach , and belief in it declines as immigrant roots grow distant , according to newly released results from a Pew Research Center 2016 survey of Hispanic adults . More than three - quarters of Hispanics ( 77 % ) said at the time that most people can get ahead with hard work , a higher share than among the U.S. public ( 62 % ) in 2016 . For Hispanics , similar shares expected their standard of living to be better than that of their parents ( 75 % ) and expected their children to be better off than themselves ( 72 % ) . Among the U.S. public , by contrast , just 56 % expected to be better off than their parents , and 46 % expected their children to have a better standard of living than they did .",same,"Compare the belief of Hispanics to general US public in the American dream?",answer1,"Hispanics are significantly more likely than the general U.S. public to believe in core parts of the American dream . Three - quarters of Hispanics ( 77 % ) said at the time that most people can get ahead with hard work , a higher share than among the U.S. public ( 62 % ) in 2016 . For Hispanics , similar shares expected their standard of living to be better than that of their parents ( 75 % ) and expected their children to be better off than themselves ( 72 % ) . Among the U.S. public , by contrast , just 56 % expected to be better off than their parents , and 46 % expected their children to have a better standard of living than they did .","Hispanics are significantly more likely than the general U.S. public to believe in core parts of the American dream . three - quarters of Hispanics ( 77 % ) said at the time that most people can get ahead with hard work , a higher share than among the U.S. public ( 62 % ) in 2016 . For Hispanics , similar shares expected their standard of living to be better than that of their parents ( 75 % ) and expected their children to be better off than themselves ( 72 % ) . Among the U.S. public , by contrast , just 56 % expected to be better off than their parents , and 46 % expected their children to have a better standard of living than they did .","Among by contrast just 56 46 have they did","– will pay each successive generation is one before it","Hispanics are significantly more likely than the general U.S. public to believe in core parts of the American dream . Three - quarters of Hispanics ( 77 % ) said at the time that most people can get ahead with hard work , a higher share than among the U.S. public ( 62 % ) in 2016 . For Hispanics , similar shares expected their standard of living to be better than that of their parents ( 75 % ) and expected their children to be better off than themselves ( 72 % ) . Among the U.S. public , by contrast , just 56 % expected to be better off than their parents , and 46 % expected their children to have a better standard of living than they did ."
mturk_charts/no_data/multi_col/4825.png,"Over the course of more than 15 years and three presidential administrations , Americans have consistently said that defending the nation against terrorism should be a top policy priority for the White House and Congress , according to Pew Research Center surveys conducted since shortly after the attacks of Sept. 11 , 2001 . In January of this year , 73 % of U.S. adults said defending the country against future terrorist attacks should be a top priority for President Donald Trump and Congress – making this one of the most frequently cited priorities , along with improving the educational system ( 72 % ) and strengthening the nation ’s economy ( 71 % ) .",same,"What are public policy priorities for Trump in 2018?",answer1,"73 % of U.S. adults said defending the country against future terrorist attacks should be a top priority for President Donald Trump and Congress – making this one of the most frequently cited priorities , along with improving the educational system ( 72 % ) and strengthening the nation ’s economy ( 71 % ) .","73 % of U.S. adults said defending the country against future terrorist attacks should be a top priority for President Donald Trump and Congress – making this one of the most frequently cited priorities , along with improving the educational system ( 72 % ) and strengthening the nation ’s economy ( 71 % ) .","","Over course more than 15 years three presidential administrations Americans have consistently that terrorism policy White House according to Pew Research Center surveys conducted since shortly after Sept. 11 2001",""
mturk_charts/no_data/multi_col/4836.png,"Republicans and Democrats are in general agreement on their feelings about Britain . Majorities in both parties ( 63 % of Democrats and 59 % of Republicans ) feel warmly toward Britain , with about four - in - ten in both saying they feel very warmly . These feelings are little changed since 2016 , although Republicans are slightly less likely to feel very warmly toward Britain ( 46 % in 2016 , 37 % now ) ; Democrats are somewhat more likely to feel very warmly ( 37 % in 2016 , 43 % now ) . A 55 % majority of Democrats express warm feelings toward Germany , compared with 37 % of Republicans . Virtually all of the partisan difference in feelings toward Germany is in the share of those who feel very warmly : 36 % of Democrats , compared with 19 % of Republicans .",same,"What are partisan sentiments towards Britain?",answer1,"Republicans and Democrats are in general agreement on their feelings about Britain . Majorities in both parties ( 63 % of Democrats and 59 % of Republicans ) feel warmly toward Britain , with about four - in - ten in both saying they feel very warmly .","Republicans and Democrats are in general agreement on their feelings about Britain . Majorities in both parties ( 63 % of Democrats and 59 % of Republicans ) feel warmly toward Britain , with about four - in - ten in both saying they feel very warmly .","","These little changed since 2016 although slightly less likely to 46 2016 37 now ; somewhat more likely to 37 2016 43 now A 55 majority express warm Germany 37 36 19",""
mturk_charts/no_data/multi_col/4839.png,"Student involvement in extracurricular activities often differs by family income . Seven - in - ten parents of school - age children say their children return home after school , while 18 % say their school - age children participate in after - school activities and 8 % say they use an after - care program , according to a fall 2015 survey of parents with children younger than 18 . About one - third of parents ( 32 % ) with annual family incomes of $ 75,000 or higher report that their children participate in after - school activities or go to an after - care program , compared with 17 % of those with incomes below $ 30,000 . For some parents – including about half ( 52 % ) of those with family incomes of less than $ 30,000 – affordable , high - quality after - school programs can be hard to find .",same,"Describe the relation between family income level and extracurricular activities?",same,"About one - third of parents ( 32 % ) with annual family incomes of $ 75,000 or higher report that their children participate in after - school activities or go to an after - care program , compared with 17 % of those with incomes below $ 30,000 .","About one - third of parents ( 32 % ) with annual family incomes of $ 75,000 or higher report that their children participate in after - school activities or go to an after - care program , compared with 17 % of those with incomes below $ 30,000 .","","For some – including about half 52 less than – affordable high quality programs can be hard find",""
mturk_charts/no_data/multi_col/4841.png,"The high educational attainment among young Americans today is reflected in the workforce . Four - in - ten Millennial workers ages 25 to 29 had at least a bachelor ’s degree in 2016 . ( Overall , about one - third – 34 % – of Millennials ages 25 to 29 had at least a bachelor ’s in 2016 . ) That compares with 32 % of Generation X workers and smaller shares of the Baby Boom and Silent generations when they were the same age . Employed Millennial women ( 46 % ) are particularly likely to have a bachelor ’s degree or higher in comparison with Gen X women ( 36 % ) at the same age . Millennial men in the workforce are also more likely to hold at least a bachelor ’s degree than their Gen X counterparts did as young adults .",same,"Compare the distribution of college graduates between different age groups?",new_answer,"The high educational attainment among young Americans today is reflected in the workforce . Four - in - ten Millennial workers ages 25 to 29 had at least a bachelor ’s degree in 2016 . That compares with 32 % of Generation X workers and smaller shares of the Baby Boom and Silent generations when they were the same age .","The high educational attainment among young Americans today is reflected in the workforce . Four - in - ten Millennial workers ages 25 to 29 had at least a bachelor ’s degree in 2016 . That compares with 32 % of Generation X workers and smaller shares of the Baby Boom and Silent generations when they were the same age .","","",""
mturk_charts/no_data/multi_col/4842.png,"About half ( 52 % ) of American adults lived in middle - class households in 2016 . This is virtually unchanged from the 51 % who were middle class in 2011 . But while the size of the nation ’s middle class remained relatively stable , financial gains for middle - income Americans during this period were modest compared with those of higher - income households , causing the income disparity between the groups to grow . The recent stability in the share of adults living in middle - income households marks a shift from a decades - long downward trend . From 1971 to 2011 , the share of adults in the middle class fell by 10 percentage points . But that shift was not all down the economic ladder . Indeed , the increase in the share of adults who are upper income was greater than the increase in the share who are lower income over that period , a sign of economic progress overall .",same,"Describe the changes in American income level from 1971 to 2011?",same,"From 1971 to 2011 , the share of adults in the middle class fell by 10 percentage points . But that shift was not all down the economic ladder . The increase in the share of adults who are upper income was greater than the increase in the share who are lower income over that period , a sign of economic progress overall .","From 1971 to 2011 , the share of adults in the middle class fell by 10 percentage points . But that shift was not all down the economic ladder . the increase in the share of adults who are upper income was greater than the increase in the share who are lower income over that period , a sign of economic progress overall .","","Indeed","From 1971 to 2011 , the share of adults in the middle class fell by 10 percentage points . But that shift was not all down the economic ladder . The increase in the share of adults who are upper income was greater than the increase in the share who are lower income over that period , a sign of economic progress overall ."
mturk_charts/no_data/multi_col/4850.png,"A sizable majority of U.S. adults use Facebook and most of its users get news on the site . But a new Pew Research Center survey finds that notable shares of Facebook users ages 18 and older lack a clear understanding of how the site ’s news feed operates , feel ordinary users have little control over what appears there , and have not actively tried to influence the content the feed delivers to them . The findings from the survey – conducted May 29 - June 11 – come amid a debate over the power of major online platforms , the algorithms that underpin those platforms and the nature of the content those algorithms surface to users . Facebook ’s broad reach and impact mean that its news feed is one of the most prominent examples of a content algorithm in many Americans ’ lives . When asked whether they understand why certain posts but not others are included in their news feed , around half of U.S. adults who use Facebook ( 53 % ) say they do not – with 20 % saying they do not understand the feed at all well . Older users are especially likely to say they do not understand the workings of the news feed : Just 38 % of Facebook users ages 50 and older say they have a good understanding of why certain posts are included in it , compared with 59 % of users ages 18 to 29 .",same,"Describe Americans knowledge about Facebook news feed?",answer1,"When asked whether they understand why certain posts but not others are included in their news feed , around half of U.S. adults who use Facebook ( 53 % ) say they do not – with 20 % saying they do not understand the feed at all well . Older users are especially likely to say they do not understand the workings of the news feed : Just 38 % of Facebook users ages 50 and older say they have a good understanding of why certain posts are included in it , compared with 59 % of users ages 18 to 29 .","When asked whether they understand why certain posts but not others are included in their news feed , around half of U.S. adults who use Facebook ( 53 % ) say they do not – with 20 % saying they do not understand the feed at all well . Older users are especially likely to say they do not understand the workings of the news feed : Just 38 % of Facebook users ages 50 and older say they have a good understanding of why certain posts are included in it , compared with 59 % of users ages 18 to 29 .","","",""
mturk_charts/no_data/multi_col/4852.png,"Significant shares of Facebook users have taken steps in the past year to reframe their relationship with the social media platform . Just over half of Facebook users ages 18 and older ( 54 % ) say they have adjusted their privacy settings in the past 12 months , according to a new Pew Research Center survey . Around four - in - ten ( 42 % ) say they have taken a break from checking the platform for a period of several weeks or more , while around a quarter ( 26 % ) say they have deleted the Facebook app from their cellphone . All told , some 74 % of Facebook users say they have taken at least one of these three actions in the past year .",same,"Describe the change of habits among Facebook users in the past year?",answer1,"Just over half of Facebook users ( 54 % ) say they have adjusted their privacy settings in the past 12 months , according to a new Pew Research Center survey . Around four - in - ten ( 42 % ) say they have taken a break from checking the platform for a period of several weeks or more , while around a quarter ( 26 % ) say they have deleted the Facebook app from their cellphone . some 74 % of Facebook users say they have taken at least one of these three actions in the past year .","Just over half of Facebook users ( 54 % ) say they have adjusted their privacy settings in the past 12 months , according to a new Pew Research Center survey . Around four - in - ten ( 42 % ) say they have taken a break from checking the platform for a period of several weeks or more , while around a quarter ( 26 % ) say they have deleted the Facebook app from their cellphone . some 74 % of Facebook users say they have taken at least one of these three actions in the past year .","some 74 at least one these three actions year","ages 18 and older",""
mturk_charts/no_data/multi_col/4854.png,"For example , across the eight European nations polled , a median of only 53 % expressed confidence in banks and financial institutions . This trust varied by region : While about half or more in each of the five northern European countries surveyed said they trust banks , only 18 % in Spain , 29 % in Italy and 39 % in France said the same .",same,"What do Europeans of different countries think about their trust in banks?",answer2,"across the eight European nations polled , a median of only 53 % expressed confidence in banks and financial institutions . This trust varied by region : only 18 % in Spain , 29 % in Italy and 39 % in France .","across the eight European nations polled , a median of only 53 % expressed confidence in banks and financial institutions . This trust varied by region : only 18 % in Spain , 29 % in Italy and 39 % in France .","","While about half or more each five northern countries surveyed said they said same",""
mturk_charts/no_data/multi_col/4859.png,"Only 13 % of Americans , however , have a great deal of confidence that space companies will sufficiently address the debris problem , while 51 % have not too much or no confidence , according to a recent Pew Research Center survey . Yet , the same survey finds that , among the 7 % of the public that is highly attentive to space news – those who say they have heard “ a lot ” about NASA in the past year and “ a lot ” about private space companies – some 37 % have a great deal of confidence that private companies will minimize space debris .",same,"What do Americans think about space companies addressing the debris problem?",answer2,"Only 13 % of Americans , have a great deal of confidence that space companies will sufficiently address the debris problem , while 51 % have not too much or no confidence .","Only 13 % of Americans , have a great deal of confidence that space companies will sufficiently address the debris problem , while 51 % have not too much or no confidence .",".","however according to recent Pew Research Center survey",""
