img_path,"summary",question_resolution,"question",answer_resolution,"abstractive_answer","extractive_answer","decontextualizated_text_added","decontextualizated_text_removed","abstractive_text_added","abstractive_text_removed","extra_added_text","title","original_answer"
mturk_charts/no_data/multi_col/10896.png,"And half of voters ( 50 % ) say “ experience and a proven record ” is more important to them than “ new ideas and a different approach ” ( 43 % ) . Republicans ( 59 % ) are more likely than either Democrats ( 46 % ) or independents ( 48 % ) to prioritize a proven record .",same,"What is the preference of registered voter about experience and proven records of candidates ?",answer1,"And half of voters ( 50 % ) say “ experience and a proven record ” is more important to them than “ new ideas and a different approach ” ( 43 % )","And half of voters ( 50 % ) say “ experience and a proven record ” is more important to them than “ new ideas and a different approach ” ( 43 % )","","","",""," ","GOP Voters Prefer a Candidate With 'Proven Record' to One With 'New Ideas'","And half of voters ( 50 % ) say “ experience and a proven record ” is more important to them than “ new ideas and a different approach ” ( 43 % )"
mturk_charts/no_data/multi_col/10900.png,"For example , three - in - ten conservative Republican voters say there is a good chance they would vote for Ted Cruz ( 30 % ) or Scott Walker ( 30 % ) , while just 10 % of moderate and liberal Republicans say this about either man . About twice as many GOP conservatives ( 25 % ) as moderates and liberals ( 13 % ) say there is a good chance they would support Ben Carson . There is a narrower gap in support for Jeb Bush : 25 % of conservative Republican voters and 17 % of moderate and liberal Republican voters say there is a good chance they would vote for the former Florida governor . Chris Christie is relatively well known among both conservative and moderate and liberal Republican voters , but draws little support from either group . Just 11 % of conservative Republicans and 6 % of moderate and liberal Republicans say they see a good chance of supporting Christie ; 40 % and 37 % , respectively , say there is no chance they would vote for the New Jersey governor .",same,"Describe what conservative Republican voters say about voting each candidate ?",answer1,"three - in - ten conservative Republican voters say there is a good chance they would vote for Ted Cruz ( 30 % ) or Scott Walker ( 30 % ) , while just 10 % of moderate and liberal Republicans say this about either man About twice as many GOP conservatives ( 25 % ) as moderates and liberals ( 13 % ) say there is a good chance they would support Ben Carson","three - in - ten conservative Republican voters say there is a good chance they would vote for Ted Cruz ( 30 % ) or Scott Walker ( 30 % ) , while just 10 % of moderate and liberal Republicans say this about either man About twice as many GOP conservatives ( 25 % ) as moderates and liberals ( 13 % ) say there is a good chance they would support Ben Carson","","","",""," ","Conservative Republicans More Likely to Support all GOP Contenders, but Walker, Cruz, Carson Draw Disproportionate Support","three - in - ten conservative Republican voters say there is a good chance they would vote for Ted Cruz ( 30 % ) or Scott Walker ( 30 % ) , while just 10 % of moderate and liberal Republicans say this about either man About twice as many GOP conservatives ( 25 % ) as moderates and liberals ( 13 % ) say there is a good chance they would support Ben Carson"
mturk_charts/no_data/multi_col/10903.png,"Though support for Clinton is widespread among Democratic voters , there is a gender gap in the strength of her support among white Democratic voters . Overall , 62 % of women and 54 % of men say there is a good chance they would vote for Clinton . But these differences are particularly evident among whites : 61 % of white Democratic women say there is a good chance they would vote for Clinton compared with 43 % of white Democratic men . Conversely , more white Democratic men ( 45 % ) than women ( 26 % ) see some chance of voting for Clinton . Only about 10 % in each group sees no chance of voting for her .",same,"What is the opinion of men and women voters about voting ?",answer2,"Overall , 62 % of women and 54 % of men say there is a good chance they would vote for Clinton . But these differences are particularly evident among whites : 61 % of white Democratic women say there is a good chance they would vote for Clinton compared with 43 % of white Democratic men . Conversely , more white Democratic men ( 45 % ) than women ( 26 % ) see some chance of voting for Clinton","Overall , 62 % of women and 54 % of men say there is a good chance they would vote for Clinton . But these differences are particularly evident among whites : 61 % of white Democratic women say there is a good chance they would vote for Clinton compared with 43 % of white Democratic men . Conversely , more white Democratic men ( 45 % ) than women ( 26 % ) see some chance of voting for Clinton","","","",""," ","Gender Gap in Intensity of Potential Democratic Support for Clinton","Overall , 62 % of women and 54 % of men say there is a good chance they would vote for Clinton . But these differences are particularly evident among whites : 61 % of white Democratic women say there is a good chance they would vote for Clinton compared with 43 % of white Democratic men . Conversely , more white Democratic men ( 45 % ) than women ( 26 % ) see some chance of voting for Clinton"
mturk_charts/no_data/multi_col/10915.png,"2 ) App response rates were lower than Web rates overall and for each of the 14 surveys we conducted . When conducting a new poll , survey researchers often go to a lot of trouble to find out how many of the people they targeted to take the survey actually end up completing the questionnaire , a concept referred to as the response rate . In this case , we found that those who were asked to take the survey on a Web browser were more likely to complete at least one survey than those using apps to take the survey , resulting in overall response rates of 84 % and 58 % , respectively . Part of this may be due to the fact that many panelists assigned to use the app had trouble using it because they did n’t know what an app was , how to download it or how to use it even though they own a smartphone . In the future , we will take this into consideration because if fewer people use the survey app , this has implications for both the precision of the data collected and for cost . 3 ) App and Web respondents look similar demographically , and their answers basically did not differ . App respondents were somewhat younger , more likely to be from the Midwest and less likely to be registered to vote than Web respondents . Overall , app respondents looked slightly more like all smartphone users than did the Web respondents . In the final reckoning , though , both the app and Web respondents look similar enough in terms of demographics that either could be used to represent all smartphone users .",same,"Describe the difference between App and Web respondents?",answer2,"App response rates were lower than Web rates overall and for each of the 14 surveys we conducted . When conducting a new poll , survey researchers often go to a lot of trouble to find out how many of the people they targeted to take the survey actually end up completing the questionnaire , a concept referred to as the response rate . In this case , we found that those who were asked to take the survey on a Web browser were more likely to complete at least one survey than those using apps to take the survey , resulting in overall response rates of 84 % and 58 % , respectively","App response rates were lower than Web rates overall and for each of the 14 surveys we conducted . When conducting a new poll , survey researchers often go to a lot of trouble to find out how many of the people they targeted to take the survey actually end up completing the questionnaire , a concept referred to as the response rate . In this case , we found that those who were asked to take the survey on a Web browser were more likely to complete at least one survey than those using apps to take the survey , resulting in overall response rates of 84 % and 58 % , respectively","","","",""," ","App Response Rate Lower at Every Day and Time","App response rates were lower than Web rates overall and for each of the 14 surveys we conducted . When conducting a new poll , survey researchers often go to a lot of trouble to find out how many of the people they targeted to take the survey actually end up completing the questionnaire , a concept referred to as the response rate . In this case , we found that those who were asked to take the survey on a Web browser were more likely to complete at least one survey than those using apps to take the survey , resulting in overall response rates of 84 % and 58 % , respectively"
mturk_charts/no_data/multi_col/10917.png,"But when they ’re asked about the time they spend with their children , dads are much more likely than moms to say it ’s not enough . About half ( 48 % ) of working dads say they spend too little time with their kids , compared with just 26 % of working moms . Most working moms ( 66 % ) say they spend the right amount of time with their kids .",same,"What's the difference between both working moms and dads about enjoying their kids?",answer2,"About half ( 48 % ) of working dads say they spend too little time with their kids , compared with just 26 % of working moms . Most working moms ( 66 % ) say they spend the right amount of time with their kids","About half ( 48 % ) of working dads say they spend too little time with their kids , compared with just 26 % of working moms . Most working moms ( 66 % ) say they spend the right amount of time with their kids","","","",""," ","Among Working Parents, Fathers More Conflicted About Time Spent with Kids","About half ( 48 % ) of working dads say they spend too little time with their kids , compared with just 26 % of working moms . Most working moms ( 66 % ) say they spend the right amount of time with their kids"
mturk_charts/no_data/multi_col/10920.png,"While texting , talking , emailing and going online dominate , a majority of Americans also use their smartphones for social networking , taking photos or videos , and catching up with the news . A vast majority of smartphone owners say they used their phone for text messaging , voice and video calling , email and accessing the internet at least once over a weeklong “ experience sampling ” study . Besides these four activities , other smartphone apps were also popular . Three - quarters of smartphone owners reported using their phone for social media , while 60 % took pictures or a video , and more than half ( 55 % ) got news on their smartphone at least once over the course of the one - week survey period .",same,"What is the most likely usefulness of a smartphone?",answer1,"Three - quarters of smartphone owners reported using their phone for social media , while 60 % took pictures or a video , and more than half ( 55 % ) got news on their smartphone at least once over the course of the one - week survey period","Three - quarters of smartphone owners reported using their phone for social media , while 60 % took pictures or a video , and more than half ( 55 % ) got news on their smartphone at least once over the course of the one - week survey period","","","",""," ","Text Messaging, Voice/Video Calls, Internet, Email Rank Among Most Popular Smartphone Features","Three - quarters of smartphone owners reported using their phone for social media , while 60 % took pictures or a video , and more than half ( 55 % ) got news on their smartphone at least once over the course of the one - week survey period"
mturk_charts/no_data/multi_col/10936.png,"Republicans remain more skeptical than Democrats about the seriousness of Iranian leaders . Fully 80 % of Republicans who have heard at least a little about the negotiations say Iranian leaders are not serious about addressing international concerns over the country ’s nuclear program . A majority of independents ( 64 % ) and only about half of Democrats ( 48 % ) say Iranian leaders are not serious about addressing these concerns ( based on those who have heard at least a little about U.S.-Iran negotiations ) .",same,"How are the Iranian leaders seen among U.S partisans?",answer2,"Fully 80 % of Republicans who have heard at least a little about the negotiations say Iranian leaders are not serious about addressing international concerns over the country ’s nuclear program . A majority of independents ( 64 % ) and only about half of Democrats ( 48 % ) say Iranian leaders are not serious about addressing these concerns ( based on those who have heard at least a little about U.S.-Iran negotiations ) .","Fully 80 % of Republicans who have heard at least a little about the negotiations say Iranian leaders are not serious about addressing international concerns over the country ’s nuclear program . A majority of independents ( 64 % ) and only about half of Democrats ( 48 % ) say Iranian leaders are not serious about addressing these concerns ( based on those who have heard at least a little about U.S.-Iran negotiations ) .","","","",""," ","Republicans Remain Deeply Skeptical of Seriousness of Iran's Leaders","Fully 80 % of Republicans who have heard at least a little about the negotiations say Iranian leaders are not serious about addressing international concerns over the country ’s nuclear program . A majority of independents ( 64 % ) and only about half of Democrats ( 48 % ) say Iranian leaders are not serious about addressing these concerns ( based on those who have heard at least a little about U.S.-Iran negotiations ) ."
mturk_charts/no_data/multi_col/10959.png,"Bilingualism is measured in our National Surveys of Latinos by asking Hispanic adults to self - assess their language abilities . Respondents rated their ability to carry on a conversation in Spanish and how well they can read a book or newspaper written in Spanish . The same questions are posed about their English - speaking ability . Bilingualism is linked to age . Some 42 % of Hispanics ages 18 to 29 are bilingual . That share falls to about a third among Hispanics ages 30 to 49 and ages 50 to 64 , but rises again , to 40 % , among those ages 65 and older .",same,"Are the Hispanic used to speak English?",answer2,"The same questions are posed about their English - speaking ability . Bilingualism is linked to age . Some 42 % of Hispanics ages 18 to 29 are bilingual . That share falls to about a third among Hispanics ages 30 to 49 and ages 50 to 64 , but rises again , to 40 % , among those ages 65 and older","The same questions are posed about their English - speaking ability . Bilingualism is linked to age . Some 42 % of Hispanics ages 18 to 29 are bilingual . That share falls to about a third among Hispanics ages 30 to 49 and ages 50 to 64 , but rises again , to 40 % , among those ages 65 and older","","","",""," ","Majority of U.S. Latinos Use English or are Bilingual","The same questions are posed about their English - speaking ability . Bilingualism is linked to age . Some 42 % of Hispanics ages 18 to 29 are bilingual . That share falls to about a third among Hispanics ages 30 to 49 and ages 50 to 64 , but rises again , to 40 % , among those ages 65 and older"
mturk_charts/no_data/multi_col/10961.png,"About four - in - ten longtime residents in Sioux City ( 40 % ) and Macon ( 38 % ) and about three - in - ten in Denver ( 29 % ) say that the quality of local news has gotten better ; only a small minority in each city says that it has gotten worse . The same pattern holds for thinking that keeping up with local news is easier ; roughly four - in - ten longtime residents in each city say this .",same,"How do Denver public rate the local news quality?",answer1,"About four - in - ten longtime residents in Sioux City ( 40 % ) and Macon ( 38 % ) and about three - in - ten in Denver ( 29 % ) say that the quality of local news has gotten better ; only a small minority in each city says that it has gotten worse .","About four - in - ten longtime residents in Sioux City ( 40 % ) and Macon ( 38 % ) and about three - in - ten in Denver ( 29 % ) say that the quality of local news has gotten better ; only a small minority in each city says that it has gotten worse .","","","",""," ","Longtime Residents More Likely to See Their Local News as Better than Worse","About four - in - ten longtime residents in Sioux City ( 40 % ) and Macon ( 38 % ) and about three - in - ten in Denver ( 29 % ) say that the quality of local news has gotten better ; only a small minority in each city says that it has gotten worse ."
mturk_charts/no_data/multi_col/10963.png,"Almost no one in Nigeria , Ghana , Bangladesh and Uganda owns a landline telephone . Many people worldwide are skipping the fixed telephone line that many Americans grew up with , and this fact is most apparent in many emerging and developing nations . Only 1 % of the population in Nigeria , Ghana , Bangladesh and Uganda say they own a working landline telephone in their household , while 89 % in Nigeria , 83 % in Ghana , 76 % in Bangladesh and 65 % in Uganda own cell phones . This compares with 60 % landline penetration in the U.S.",same,"Describe the trend in skipping landline telephone by different nations ?",answer2,"Only 1 % of the population in Nigeria , Ghana , Bangladesh and Uganda say they own a working landline telephone in their household , while 89 % in Nigeria , 83 % in Ghana , 76 % in Bangladesh and 65 % in Uganda own cell phones . This compares with 60 % landline penetration in the U.S.","Only 1 % of the population in Nigeria , Ghana , Bangladesh and Uganda say they own a working landline telephone in their household , while 89 % in Nigeria , 83 % in Ghana , 76 % in Bangladesh and 65 % in Uganda own cell phones . This compares with 60 % landline penetration in the U.S.","","","",""," ","Nations Skipping the Landline Phone","Only 1 % of the population in Nigeria , Ghana , Bangladesh and Uganda say they own a working landline telephone in their household , while 89 % in Nigeria , 83 % in Ghana , 76 % in Bangladesh and 65 % in Uganda own cell phones . This compares with 60 % landline penetration in the U.S."
mturk_charts/no_data/multi_col/10966.png,"Just 27 % are bothered “ a lot ” by the amount they pay in taxes . By contrast , 64 % say they are bothered a lot by the feeling that some corporations do not pay their fair share of taxes , and 61 % say the same about some wealthy people failing to pay their fair share . In views of other aspects of the tax system , 44 % say they are bothered a lot by the complexity of the system , while just 20 % are bothered a great deal by the feeling that some poor people are not paying their fair share of taxes .",same,"Describe how people feeling about federal tax system ?",answer1,"Just 27 % are bothered “ a lot ” by the amount they pay in taxes . By contrast , 64 % say they are bothered a lot by the feeling that some corporations do not pay their fair share of taxes , and 61 % say the same about some wealthy people failing to pay their fair share . In views of other aspects of the tax system , 44 % say they are bothered a lot by the complexity of the system , while just 20 % are bothered a great deal by the feeling that some poor people are not paying their fair share of taxes .","Just 27 % are bothered “ a lot ” by the amount they pay in taxes . By contrast , 64 % say they are bothered a lot by the feeling that some corporations do not pay their fair share of taxes , and 61 % say the same about some wealthy people failing to pay their fair share . In views of other aspects of the tax system , 44 % say they are bothered a lot by the complexity of the system , while just 20 % are bothered a great deal by the feeling that some poor people are not paying their fair share of taxes .","","","",""," ","More Are Bothered by Corporations, Wealthy Not Paying Fair Share Than by What They Pay in Taxes","Just 27 % are bothered “ a lot ” by the amount they pay in taxes . By contrast , 64 % say they are bothered a lot by the feeling that some corporations do not pay their fair share of taxes , and 61 % say the same about some wealthy people failing to pay their fair share In views of other aspects of the tax system , 44 % say they are bothered a lot by the complexity of the system , while just 20 % are bothered a great deal by the feeling that some poor people are not paying their fair share of taxes ."
mturk_charts/no_data/multi_col/10968.png,"Frustration with the feeling that some corporations and wealthy people do not pay their fair share of taxes is shared widely across demographic and partisan groups . Fully 75 % of Democrats are bothered a lot by the feeling that corporations do not pay their fair share of taxes , and 72 % say the same about wealthy people not paying their fair share . Fewer Republicans are bothered a lot by some corporations ( 52 % ) and wealthy people ( 45 % ) not paying their fair share . Still , these rank among the Republicans ’ top concerns among five items tested .",same,"How Democrats and Republicans bothered about different aspects of tax system ?",answer2,"Fully 75 % of Democrats are bothered a lot by the feeling that corporations do not pay their fair share of taxes , and 72 % say the same about wealthy people not paying their fair share . Fewer Republicans are bothered a lot by some corporations ( 52 % ) and wealthy people ( 45 % ) not paying their fair share . Still , these rank among the Republicans ’ top concerns among five items tested .","Fully 75 % of Democrats are bothered a lot by the feeling that corporations do not pay their fair share of taxes , and 72 % say the same about wealthy people not paying their fair share . Fewer Republicans are bothered a lot by some corporations ( 52 % ) and wealthy people ( 45 % ) not paying their fair share . Still , these rank among the Republicans ’ top concerns among five items tested .","","","",""," ","Democrats, Republicans Bothered by Different Aspects of Federal Tax System","Fully 75 % of Democrats are bothered a lot by the feeling that corporations do not pay their fair share of taxes , and 72 % say the same about wealthy people not paying their fair share . Fewer Republicans are bothered a lot by some corporations ( 52 % ) and wealthy people ( 45 % ) not paying their fair share . Still , these rank among the Republicans ’ top concerns among five items tested ."
mturk_charts/no_data/multi_col/10974.png,"People see the internet as a good influence on education , but are skeptical of its effect on morality . Overall , people in the emerging and developing countries surveyed see the internet as having a positive effect on education , personal relationships and the economy . But they are wary about its impact on politics and especially on morality . A median of 42 % across 32 countries say that the internet is a bad influence on morality .",same,"What median across the 32 countries sees internet as a negative influence on morality?",same,"A median of 42 % across 32 countries say that the internet is a bad influence on morality","A median of 42 % across 32 countries say that the internet is a bad influence on morality","","","",""," ","Internet Influence Seen as Positive in Emerging and Developing Nations; Morality an Exception","A median of 42 % across 32 countries say that the internet is a bad influence on morality"
mturk_charts/no_data/multi_col/10976.png,"Overall , 		 a median of 64 % across 32 emerging and developing nations say the internet is a good influence on education ,  		  with at least half also seeing it as a good influence on personal relationships ( 53 % ) and the economy ( 52 % ) . People are more mixed on the internet ’s effect on politics , with similar proportions saying that the influence is good ( 36 % ) as say it is bad ( 30 % ) .",same,"Describe people's overall views on internet influence on education, personal relationships and politics.",answer1,"Overall ,  a median of 64 % across 32 emerging and developing nations say the internet is a good influence on education ,    with at least half also seeing it as a good influence on personal relationships ( 53 % ) and the economy ( 52 % ) . People are more mixed on the internet ’s effect on politics , with similar proportions saying that the influence is good ( 36 % ) as say it is bad ( 30 % ) .","Overall ,  a median of 64 % across 32 emerging and developing nations say the internet is a good influence on education ,    with at least half also seeing it as a good influence on personal relationships ( 53 % ) and the economy ( 52 % ) . People are more mixed on the internet ’s effect on politics , with similar proportions saying that the influence is good ( 36 % ) as say it is bad ( 30 % ) .","   ","","",""," ","Internet Has Most Positive Influence on Education, Least Positive on Morality","Overall , a median of 64 % across 32 emerging and developing nations say the internet is a good influence on education , with at least half also seeing it as a good influence on personal relationships ( 53 % ) and the economy ( 52 % ) . People are more mixed on the internet ’s effect on politics , with similar proportions saying that the influence is good ( 36 % ) as say it is bad ( 30 % ) ."
