img_path,"summary",question_resolution,"question",answer_resolution,"abstractive_answer","extractive_answer","decontextualizated_text_added","decontextualizated_text_removed","abstractive_text_added","abstractive_text_removed","extra_added_text","title","original_answer"
mturk_charts/no_data/multi_col/11243.png,"Support for the increased use of fracking has declined . Overall , 41 % favored the increased use of fracking to extract oil and natural gas from underground rock formations while 47 % are opposed , according to last November ’s poll . In March 2013 , there was more support ( 48 % ) than opposition ( 38 % ) to increased use of the drilling technique . Republicans support increased fracking far more than Democrats , by a 62 % to 29 % margin . There was a particularly dramatic change of views in the Midwest where increased use of fracking is now opposed by a 47 % to 39 % margin compared with the majority who favored its use in 2013 .",same,"Describe the overall opinions on Fracking among the public and partisan views.",answer2,"Overall , 41 % favored the increased use of fracking to extract oil and natural gas from underground rock formations while 47 % are opposed , according to last November ’s poll . In March 2013 , there was more support ( 48 % ) than opposition ( 38 % ) to increased use of the drilling technique . Republicans support increased fracking far more than Democrats , by a 62 % to 29 % margin . There was a particularly dramatic change of views in the Midwest where increased use of fracking is now opposed by a 47 % to 39 % margin compared with the majority who favored its use in 2013","Overall , 41 % favored the increased use of fracking to extract oil and natural gas from underground rock formations while 47 % are opposed , according to last November ’s poll . In March 2013 , there was more support ( 48 % ) than opposition ( 38 % ) to increased use of the drilling technique . Republicans support increased fracking far more than Democrats , by a 62 % to 29 % margin . There was a particularly dramatic change of views in the Midwest where increased use of fracking is now opposed by a 47 % to 39 % margin compared with the majority who favored its use in 2013","","","",""," ","Opinion More Fracking Turns Against More Fracking % saying they increased use","Overall , 41 % favored the increased use of fracking to extract oil and natural gas from underground rock formations while 47 % are opposed , according to last November ’s poll . In March 2013 , there was more support ( 48 % ) than opposition ( 38 % ) to increased use of the drilling technique . Republicans support increased fracking far more than Democrats , by a 62 % to 29 % margin . There was a particularly dramatic change of views in the Midwest where increased use of fracking is now opposed by a 47 % to 39 % margin compared with the majority who favored its use in 2013"
mturk_charts/no_data/multi_col/11246.png,"Environmental protection draws more support in principle than when the issue of potential costs is raised . Among the public , 71 % said the country “ should do whatever it takes to protect the environment , ” according to a January - March 2014 survey . But a smaller majority ( 56 % ) said “ stricter environmental laws and regulations are worth the cost . ” Nearly four - in - ten ( 39 % ) said tougher environmental laws and regulations cost too many jobs and hurt the economy . There are sharp partisan divides on these questions . Democrats overwhelmingly , by eight - to - one , said that the country should do whatever it takes to safeguard the environment while Republicans are almost evenly divided . About seven - in - ten ( 71 % ) Democrats believe stricter environmental laws are worth the cost compared with just 37 % of Republicans . Nearly six - in - ten Republicans ( 59 % ) said stricter environmental laws and regulations have a negative economic impact .",same,"What are the public percentages views on environmental laws and how strict they should be?",answer1,"Among the public , 71 % said the country “ should do whatever it takes to protect the environment , ” according to a January - March 2014 survey . But a smaller majority ( 56 % ) said “ stricter environmental laws and regulations are worth the cost . ” Nearly four - in - ten ( 39 % ) said tougher environmental laws and regulations cost too many jobs and hurt the economy","Among the public , 71 % said the country “ should do whatever it takes to protect the environment , ” according to a January - March 2014 survey . But a smaller majority ( 56 % ) said “ stricter environmental laws and regulations are worth the cost . ” Nearly four - in - ten ( 39 % ) said tougher environmental laws and regulations cost too many jobs and hurt the economy","","","",""," ","Broad Public Support for Environmental Protection, But is it Worth the Cost? % saying ","Among the public , 71 % said the country “ should do whatever it takes to protect the environment , ” according to a January - March 2014 survey . But a smaller majority ( 56 % ) said “ stricter environmental laws and regulations are worth the cost . ” Nearly four - in - ten ( 39 % ) said tougher environmental laws and regulations cost too many jobs and hurt the economy"
mturk_charts/no_data/multi_col/11248.png,"Americans are divided over the executive action President Obama announced last November expanding the number of undocumented immigrants permitted to work and stay in the U.S. About as many disapprove ( 50 % ) as approve ( 46 % ) of Obama ’s action , which could make up to 4 million people newly eligible for deportation relief , according to a survey last December . About eight - in - ten Republicans ( 82 % ) disapprove of the executive action and about seven - in - ten Democrats ( 71 % ) approve of it , with very strong attitudes on both sides . Hispanics overwhelmingly support the deportation - relief action : 81 % approve , including 59 % who very strongly approve . But non - Hispanic whites disapprove of it by nearly two - to - one ( 62 % vs. 34 % ) , with nearly half ( 49 % ) disapproving very strongly .",same,"What percentage differ in Obama's executive action in regards to undocumented immigrants?",answer1,"About as many disapprove ( 50 % ) as approve ( 46 % ) of Obama ’s action , which could make up to 4 million people newly eligible for deportation relief , according to a survey last December","About as many disapprove ( 50 % ) as approve ( 46 % ) of Obama ’s action , which could make up to 4 million people newly eligible for deportation relief , according to a survey last December","","","",""," ","The public is divided over President Obama’s recent executive action that expands the number of undocumented immigrants permitted to stay and work in the U.S","About as many disapprove ( 50 % ) as approve ( 46 % ) of Obama ’s action , which could make up to 4 million people newly eligible for deportation relief , according to a survey last December"
mturk_charts/no_data/multi_col/11255.png,"U.S. Hispanics say relief from the threat of deportation is more important than a pathway to citizenship . Among U.S. Hispanics , a larger share — by 56 % to 35 % — said in a Sept.-Oct . 2014 survey that it is more important that unauthorized immigrants be able to live and work in the U.S. without threat of deportation than have a pathway to citizenship . Among Hispanic adults , immigrants ( 59 % ) are more likely than U.S.-born Hispanics ( 54 % ) to say that being able to live and work legally is more important . Among Latino registered voters , 51 % say deportation relief is more important than a pathway to citizenship for undocumented immigrants . Meanwhile , four - in - ten Latino voters say the opposite .",same,"What are the views among Latinos on what is important between relief from deportation and a pathway to citizenship?",answer1,"U.S. Hispanics say relief from the threat of deportation is more important than a pathway to citizenship . Among U.S. Hispanics , a larger share — by 56 % to 35 % — said in a Sept.-Oct . 2014 survey that it is more important that unauthorized immigrants be able to live and work in the U.S. without threat of deportation than have a pathway to citizenship","U.S. Hispanics say relief from the threat of deportation is more important than a pathway to citizenship . Among U.S. Hispanics , a larger share — by 56 % to 35 % — said in a Sept.-Oct . 2014 survey that it is more important that unauthorized immigrants be able to live and work in the U.S. without threat of deportation than have a pathway to citizenship","","","",""," ","Among Latinos, relief from deportation still seen as more important than pathway to citizenship for undocumented immigrants.","U.S. Hispanics say relief from the threat of deportation is more important than a pathway to citizenship . Among U.S. Hispanics , a larger share — by 56 % to 35 % — said in a Sept.-Oct . 2014 survey that it is more important that unauthorized immigrants be able to live and work in the U.S. without threat of deportation than have a pathway to citizenship"
mturk_charts/no_data/multi_col/11271.png,"When should women who want to advance professionally have children ? The public is split — 36 % say that having kids early in her career is the way to go for a woman who wants to “ reach a top executive position , ” while 40 % say it ’s better for a woman to hold off until she ’s well established in her career . And another one - fifth say that women who want to advance up the career ladder should not have kids at all , according to a new Pew Research Center survey .",same,"What is the opinion of the public about women who want to advance professionally have children ?",answer2,"The public is split — 36 % say that having kids early in her career is the way to go for a woman who wants to “ reach a top executive position , ” while 40 % say it ’s better for a woman to hold off until she ’s well established in her career . And another one - fifth say that women who want to advance up the career ladder should not have kids at all","The public is split — 36 % say that having kids early in her career is the way to go for a woman who wants to “ reach a top executive position , ” while 40 % say it ’s better for a woman to hold off until she ’s well established in her career . And another one - fifth say that women who want to advance up the career ladder should not have kids at all","","","",""," ","best time for women to have children career family","The public is split — 36 % say that having kids early in her career is the way to go for a woman who wants to “ reach a top executive position , ” while 40 % say it ’s better for a woman to hold off until she ’s well established in her career . And another one - fifth say that women who want to advance up the career ladder should not have kids at all"
mturk_charts/no_data/multi_col/11273.png,"Of the 12 stressful events that we studied , on average , women were aware of a larger number of events that had occurred among people they knew . On average , men were aware of 7 % fewer stressful events among their closest social ties .",same,"Describe how women and men are aware of stressful events ?",answer2,"On average , men were aware of 7 % fewer stressful events among their closest social ties .","On average , men were aware of 7 % fewer stressful events among their closest social ties .","","","",""," ","Technology muse and awareness of stressful events in others' lives The possible) average number people ofstressful events (out of a total of theirfriends/ possible) acquaintances people in the past 12 months","On average , men were aware of 7 % fewer stressful events among their closest social ties ."
mturk_charts/no_data/multi_col/11278.png,"Obama Draws More Confidence Than GOP Leaders on Economy . Overall , about half of Americans ( 49 % ) say they have a great deal or fair amount of confidence in Obama to ‘ do the right thing ’ in dealing with the economy , while 50 % have not too much confidence or no confidence at all . That compares with 43 % who have at least a fair amount of confidence in Democratic congressional leaders , and 37 % who express confidence in GOP leaders on the economy .",same,"What is the opinion of Americans about Obama dealing with economy ?",same,"Overall , about half of Americans ( 49 % ) say they have a great deal or fair amount of confidence in Obama to ‘ do the right thing ’ in dealing with the economy , while 50 % have not too much confidence or no confidence at all","Overall , about half of Americans ( 49 % ) say they have a great deal or fair amount of confidence in Obama to ‘ do the right thing ’ in dealing with the economy , while 50 % have not too much confidence or no confidence at all","","","",""," ","More Have Confidence in Obama Than GOP Leaders on Economy","Overall , about half of Americans ( 49 % ) say they have a great deal or fair amount of confidence in Obama to ‘ do the right thing ’ in dealing with the economy , while 50 % have not too much confidence or no confidence at all"
mturk_charts/no_data/multi_col/11282.png,"One - in - four ( 25 % ) are very worried about a domestic terrorist attack happening “ soon , ” while about four - in - ten ( 39 % ) are somewhat worried ; 36 % are not too worried or not at all worried . That balance of opinion has not significantly changed since last July . The long - term trend on terrorism concerns has been fairly stable , except on a few occasions , since the fall of 2001 .",same,"What are the public's worry about a terrorist attack after the Paris incident?",same,"One - in - four ( 25 % ) are very worried about a domestic terrorist attack happening “ soon , ” while about four - in - ten ( 39 % ) are somewhat worried ; 36 % are not too worried or not at all worried","One - in - four ( 25 % ) are very worried about a domestic terrorist attack happening “ soon , ” while about four - in - ten ( 39 % ) are somewhat worried ; 36 % are not too worried or not at all worried","","","",""," ","Public’s Terrorism Worries Hold Steady After Paris Attacks","One - in - four ( 25 % ) are very worried about a domestic terrorist attack happening “ soon , ” while about four - in - ten ( 39 % ) are somewhat worried ; 36 % are not too worried or not at all worried"
mturk_charts/no_data/multi_col/11284.png,"Currently , 85 % of Democrats say the government is doing very or fairly well in reducing the terror threat , up 14 points since September . About six - in - ten ( 63 % ) Republicans give the government positive ratings ; at that time , just 40 % of Republicans said the government was doing well in addressing the of terrorism .",same,"Describe the partisan views on government's fight against terrorism.",answer1,"Currently , 85 % of Democrats say the government is doing very or fairly well in reducing the terror threat , up 14 points since September . About six - in - ten ( 63 % ) Republicans give the government positive ratings ; at that time , just 40 % of Republicans said the government was doing well in addressing the of terrorism","Currently , 85 % of Democrats say the government is doing very or fairly well in reducing the terror threat , up 14 points since September . About six - in - ten ( 63 % ) Republicans give the government positive ratings ; at that time , just 40 % of Republicans said the government was doing well in addressing the of terrorism","","","",""," ","Majorities of Partisans Rate Gov’t Positively in Reducing Terrorism Threat","Currently , 85 % of Democrats say the government is doing very or fairly well in reducing the terror threat , up 14 points since September . About six - in - ten ( 63 % ) Republicans give the government positive ratings ; at that time , just 40 % of Republicans said the government was doing well in addressing the of terrorism"
mturk_charts/no_data/multi_col/11287.png,"The public ’s views of torture against suspected terrorists have remained generally stable over the past decade . One - in - five ( 20 % ) say the use of torture against suspected terrorists can often be justified to gain important information . About three - in - ten ( 31 % ) say it can sometimes be justified , 20 % think it can rarely be justified , and 27 % say it can never be justified .",same,"Describe the public's views on the justification of torturing suspected terrorists.",answer2,"One - in - five ( 20 % ) say the use of torture against suspected terrorists can often be justified to gain important information . About three - in - ten ( 31 % ) say it can sometimes be justified","One - in - five ( 20 % ) say the use of torture against suspected terrorists can often be justified to gain important information . About three - in - ten ( 31 % ) say it can sometimes be justified","","","",""," ","Over Past Decade, Little Change in Views of Whether Torture of Suspected Terrorists Can Be Justified","One - in - five ( 20 % ) say the use of torture against suspected terrorists can often be justified to gain important information . About three - in - ten ( 31 % ) say it can sometimes be justified"
mturk_charts/no_data/multi_col/11291.png,"About three - in - ten ( 29 % ) say they were following news about the terrorist shootings in Paris very closely , according to a separate survey conducted Jan. 8 - 11 among 1,000 adults . That compares with 24 % who were very closely following news about the U.S. economy , 19 % who tracked the AirAsia flight that crashed Dec. 29 , and 17 % who paid close attention to news about the incoming Republican leaders in Congress . While younger Americans typically pay less attention to news events than older Americans , the gap on the terrorist shootings in Paris is particularly large : 43 % of those ages 65 and older followed this news very closely , while just 15 % of those ages 18 - 29 say they did the same .",same,"Compare the size of people who followed different news closely.",answer2,"About three - in - ten ( 29 % ) say they were following news about the terrorist shootings in Paris very closely That compares with 24 % who were very closely following news about the U.S. economy , 19 % who tracked the AirAsia flight that crashed Dec. 29 , and 17 % who paid close attention to news about the incoming Republican leaders in Congress","About three - in - ten ( 29 % ) say they were following news about the terrorist shootings in Paris very closely That compares with 24 % who were very closely following news about the U.S. economy , 19 % who tracked the AirAsia flight that crashed Dec. 29 , and 17 % who paid close attention to news about the incoming Republican leaders in Congress","","","",""," ","News Interest Index","About three - in - ten ( 29 % ) say they were following news about the terrorist shootings in Paris very closely That compares with 24 % who were very closely following news about the U.S. economy , 19 % who tracked the AirAsia flight that crashed Dec. 29 , and 17 % who paid close attention to news about the incoming Republican leaders in Congress"
mturk_charts/no_data/multi_col/11288.png,"The public ’s views of torture against suspected terrorists have remained generally stable over the past decade . One - in - five ( 20 % ) say the use of torture against suspected terrorists can often be justified to gain important information . About three - in - ten ( 31 % ) say it can sometimes be justified , 20 % think it can rarely be justified , and 27 % say it can never be justified . Among Republicans , three - in - ten ( 30 % ) think that the use of torture against suspected terrorists can often be justified , 38 % sometimes justified , 16 % rarely justified , and 11 % never justified . Just 11 % of Democrats say this practice can often be justified , 25 % sometimes , 21 % rarely , and a plurality ( 40 % ) say it can never be justified . In both parties , there is an ideological divide in terms of these attitudes . While 35 % of conservative Republicans say torture to gain information from suspected terrorists can often be justified , just 21 % of moderate and liberal Republicans agree . And about half ( 51 % ) of liberal Democrats say the use of torture can never be justified , compared with 32 % of moderates and conservatives in the party .",same,"What are the partisan ideologies on the question of Torture?",answer1,"Among Republicans , three - in - ten ( 30 % ) think that the use of torture against suspected terrorists can often be justified , 38 % sometimes justified , 16 % rarely justified , and 11 % never justified . Just 11 % of Democrats say this practice can often be justified , 25 % sometimes , 21 % rarely , and a plurality ( 40 % ) say it can never be justified . In both parties , there is an ideological divide in terms of these attitudes","Among Republicans , three - in - ten ( 30 % ) think that the use of torture against suspected terrorists can often be justified , 38 % sometimes justified , 16 % rarely justified , and 11 % never justified . Just 11 % of Democrats say this practice can often be justified , 25 % sometimes , 21 % rarely , and a plurality ( 40 % ) say it can never be justified . In both parties , there is an ideological divide in terms of these attitudes","","","",""," ","Partisan and Ideological Divisions Over Views of Torture","Among Republicans , three - in - ten ( 30 % ) think that the use of torture against suspected terrorists can often be justified , 38 % sometimes justified , 16 % rarely justified , and 11 % never justified . Just 11 % of Democrats say this practice can often be justified , 25 % sometimes , 21 % rarely , and a plurality ( 40 % ) say it can never be justified . In both parties , there is an ideological divide in terms of these attitudes"
mturk_charts/no_data/multi_col/11298.png,"Because no single question can possibly paint a full picture of opinion on an issue , the Pew Research Center covers public policy from multiple angles . On gun policy , we have conducted polls exploring attitudes about a number of proposals , including stricter background checks on gun purchases , preventing people with mental illness from purchasing guns and establishing a federal database to track gun sales . Our January 2013 survey found that many of these proposals drew extensive public support ( see “ In Gun Control Debate , Several Options Draw Majority Support , ” Jan. 14 , 2013 ) . Other recent polls have looked at the differing perspectives of gun owners and non - gun owners and the potential impact of stricter gun laws in a number of areas , including whether such laws would reduce the number of deaths in mass shootings . Even after the Senate defeated a background checks bill in 2013 , we found that 81 % favored making private gun sales and sales at gun shows subject to background checks ( see “ Broad Support for Renewed Background Checks Bill , Skepticism About Its Chances , ” May 23 , 2013 ) .",same,"Describe the views on tracking guns and background checks as far as gun policy is concerned.",new_answer,"81 % favored making private gun sales and sales at gun shows subject to background checks","81 % favored making private gun sales and sales at gun shows subject to background checks","","On policy , we have conducted polls exploring attitudes about a number of proposals , including stricter on purchases , preventing people with mental illness from purchasing guns establishing a federal database track . Our January 2013 survey found that many of these proposals drew extensive public support ( see “ In Gun Control Debate , Several Options Draw Majority Support , ” Jan. 14 , 2013 ) . Other recent polls have looked the differing perspectives of owners non - owners the potential impact of stricter laws in a number of areas , including whether such laws would reduce the number of deaths in mass shootings . Even after the Senate defeated a bill in 2013 , we found that ( see “ Broad Support for Renewed Background Checks Bill , Skepticism About Its Chances , ” May 23 , 2013 ) .","",""," ","Broad Public Backing for Many Gun Policy Proposals","On gun policy , we have conducted polls exploring attitudes about a number of proposals , including stricter background checks on gun purchases , preventing people with mental illness from purchasing guns and establishing a federal database to track gun sales . Our January 2013 survey found that many of these proposals drew extensive public support ( see “ In Gun Control Debate , Several Options Draw Majority Support , ” Jan. 14 , 2013 ) . Other recent polls have looked at the differing perspectives of gun owners and non - gun owners and the potential impact of stricter gun laws in a number of areas , including whether such laws would reduce the number of deaths in mass shootings . Even after the Senate defeated a background checks bill in 2013 , we found that 81 % favored making private gun sales and sales at gun shows subject to background checks ( see “ Broad Support for Renewed Background Checks Bill , Skepticism About Its Chances , ” May 23 , 2013 ) ."
