img_path,"summary",question_resolution,"question",answer_resolution,"abstractive_answer","extractive_answer","decontextualizated_text_added","decontextualizated_text_removed","abstractive_text_added","abstractive_text_removed","extra_added_text","title","original_answer"
mturk_charts/no_data/multi_col/10496.png,"Partisanship and ideology remain some of the strongest factors underlying attitudes about whether Earth is warming , our survey finds . Today , roughly nine - in - ten liberal Democrats ( 92 % ) say that there is solid evidence Earth ’s average temperature is rising , and 76 % attribute this rise mostly to human activity . Very few liberal Democrats ( 5 % ) say there is not solid evidence of warming . A clear 83 % majority of conservative and moderate Democrats also say Earth is warming , but just 55 % say this is the result of human activity . By contrast , just 38 % of conservative Republicans say that there is solid evidence of global warming . Reflecting a divide within the GOP , conservative Republicans stand out as the only ideological group in which a majority ( 56 % ) says that there is not solid evidence of a rise in the earth ’s temperature ( a 61 % majority of moderate and liberal Republicans say Earth is warming ) .",same,"What is the opinion of liberal Democrats about global warming ?",answer2,"Today , roughly nine - in - ten liberal Democrats ( 92 % ) say that there is solid evidence Earth ’s average temperature is rising , and 76 % attribute this rise mostly to human activity . Very few liberal Democrats ( 5 % ) say there is not solid evidence of warming","Today , roughly nine - in - ten liberal Democrats ( 92 % ) say that there is solid evidence Earth ’s average temperature is rising , and 76 % attribute this rise mostly to human activity . Very few liberal Democrats ( 5 % ) say there is not solid evidence of warming","","","",""," ","Liberal Democrats Overwhelmingly Say Solid Evidence Global Warming is Occurring; Most Conservative Republicans Say There is Not","Today , roughly nine - in - ten liberal Democrats ( 92 % ) say that there is solid evidence Earth ’s average temperature is rising , and 76 % attribute this rise mostly to human activity . Very few liberal Democrats ( 5 % ) say there is not solid evidence of warming"
mturk_charts/no_data/multi_col/10500.png,"About one - in - five multiracial Americans , including about a third of all black mixed - race adults , have dressed or behaved in a certain way in an attempt to influence how others see their race . According to our survey , fully 21 % of mixed - race adults have attempted to influence how others saw their race . About one - in - ten multiracial adults have talked ( 12 % ) , dressed ( 11 % ) or worn their hair ( 11 % ) in a certain way in order to affect how others saw their race . A similar share ( 11 % ) say they associated with certain people to alter how others saw their racial background . ( The survey did not ask respondents to identify which race or races they sought to resemble . )",same,"Describe how the mixed-race adults behaved in certain ways to influence how others see their race ?",answer2,"About one - in - ten multiracial adults have talked ( 12 % ) , dressed ( 11 % ) or worn their hair ( 11 % ) in a certain way in order to affect how others saw their race . A similar share ( 11 % ) say they associated with certain people to alter how others saw their racial background .","About one - in - ten multiracial adults have talked ( 12 % ) , dressed ( 11 % ) or worn their hair ( 11 % ) in a certain way in order to affect how others saw their race . A similar share ( 11 % ) say they associated with certain people to alter how others saw their racial background .","","","",""," ","Attempts to Change How Others See Their Race others saw their race","About one - in - ten multiracial adults have talked ( 12 % ) , dressed ( 11 % ) or worn their hair ( 11 % ) in a certain way in order to affect how others saw their race . A similar share ( 11 % ) say they associated with certain people to alter how others saw their racial background ."
mturk_charts/no_data/multi_col/10503.png,"Federal policy defines “ Hispanic ” not as a race , but as an ethnicity . And it prescribes that Hispanics can in fact be of any race . But these census findings suggest that standard U.S. racial categories might either be confusing or not provide relevant options for Hispanics to describe their racial identity . They also raise an important question long pondered by social scientists and policymakers : Do Hispanics consider their Hispanic background to be part of their racial background , their ethnic background or both ? A new Pew Research Center survey of multiracial Americans finds that , for two - thirds of Hispanics , their Hispanic background is a part of their racial background – not something separate . This suggests that Hispanics have a unique view of race that does n’t necessarily fit within the official U.S. definitions .",same,"What is the understanding of Hispanics and their belief that being Hispanics is part of their racial backgrounds? What does this suggest in relation to U.S. official definitions of race?",answer1,"A new Pew Research Center survey of multiracial Americans finds that , for two - thirds of Hispanics , their Hispanic background is a part of their racial background – not something separate . This suggests that Hispanics have a unique view of race that does n’t necessarily fit within the official U.S. definitions","A new Pew Research Center survey of multiracial Americans finds that , for two - thirds of Hispanics , their Hispanic background is a part of their racial background – not something separate . This suggests that Hispanics have a unique view of race that does n’t necessarily fit within the official U.S. definitions","","","",""," ","Two-Thirds of Hispanic Adults Say Being Hispanic is Part of Their Racial Background","A new Pew Research Center survey of multiracial Americans finds that , for two - thirds of Hispanics , their Hispanic background is a part of their racial background – not something separate . This suggests that Hispanics have a unique view of race that does n’t necessarily fit within the official U.S. definitions"
mturk_charts/no_data/multi_col/10505.png,"Despite the negative economic mood in Russia , President Putin still receives overwhelming support from the public . On foreign relations , eight - in - ten or more approve of his dealings with China , the U.S. , Ukraine and the European Union . In the domestic realm , overwhelming majorities support his energy policy ( 73 % ) and his handling of the economy ( 70 % ) . His lowest rating is for his handling of corruption , but even here , 62 % of the Russian public supports him .",same,"What percentage of Russians supports Putin's policies?",answer1,"In the domestic realm , overwhelming majorities support his energy policy ( 73 % ) and his handling of the economy ( 70 % ) . His lowest rating is for his handling of corruption , but even here , 62 % of the Russian public supports him .","In the domestic realm , overwhelming majorities support his energy policy ( 73 % ) and his handling of the economy ( 70 % ) . His lowest rating is for his handling of corruption , but even here , 62 % of the Russian public supports him .","","","",""," ","Russians Overwhelmingly Support Putin's Foreign and Domestic Policies","In the domestic realm , overwhelming majorities support his energy policy ( 73 % ) and his handling of the economy ( 70 % ) . His lowest rating is for his handling of corruption , but even here , 62 % of the Russian public supports him ."
mturk_charts/no_data/multi_col/10506.png,"Russians do not like the U.S. and other Western powers . Only 15 % of Russians have a favorable view of the U.S. , with 81 % holding an unfavorable opinion . Similarly , only 12 % of Russians have positive views of NATO . Even opinions of the EU ( 31 % favorable ) and Germany ( 35 % ) are at all - time lows . In fact , since 2011 , positive views of Germany have fallen 43 percentage points . Similar drops in favorability also occurred in views of the U.S. ( down 41 points ) , the EU ( down 33 ) and NATO ( down 25 ) since 2011 .",same,"What percentages are the views of Russians towards the U.S. and NATO?",answer2,"Russians do not like the U.S. and other Western powers . Only 15 % of Russians have a favorable view of the U.S. , with 81 % holding an unfavorable opinion . Similarly , only 12 % of Russians have positive views of NATO .","Russians do not like the U.S. and other Western powers . Only 15 % of Russians have a favorable view of the U.S. , with 81 % holding an unfavorable opinion . Similarly , only 12 % of Russians have positive views of NATO .","","","",""," ","Russians Hold Very Negative Views of U.S. and NATO","Russians do not like the U.S. and other Western powers . Only 15 % of Russians have a favorable view of the U.S. , with 81 % holding an unfavorable opinion . Similarly , only 12 % of Russians have positive views of NATO ."
mturk_charts/no_data/multi_col/10522.png,"NATO publics support economic aid , but do not favor arming Ukraine . Most people in the eight NATO countries surveyed ( a median of 70 % ) are happy to see Western countries send economic aid to Ukraine . Many also support Ukraine joining NATO and , in half the EU countries surveyed , favor Ukraine joining the European Union . But people in these NATO countries made it clear that they did not support sending arms to Ukraine – a median of just 41 % supported doing so . Skepticism about sending arms was highest in Germany , Spain and Italy , while support for arming Ukraine was more common in Poland , the U.S. and Canada . The West and Russia disagree over what has caused the conflict . A median of 39 % across the eight NATO countries surveyed say that Russia is to blame for the crisis in Ukraine , more than blame the pro - Russian separatists ( median of 18 % ) , the Ukrainian government ( 9 % ) or Western countries ( 7 % ) . Ukrainians agree , with 45 % blaming Russia for the violence in eastern Ukraine . However , half in Russia blame Western countries , such as those in Europe and the U.S. , for the Ukraine crisis . Around a quarter in Russia ( 26 % ) blame the current government in Kyiv , but only 2 % name Russia as the primary cause of the conflict .",same,"What Ukrainian percent blames Russia for the violence in eastern Ukraine?",same,"Ukrainians agree , with 45 % blaming Russia for the violence in eastern Ukraine","Ukrainians agree , with 45 % blaming Russia for the violence in eastern Ukraine","","","",""," ","NATO Countries Blame Russia and Ukraine; Russians Blame West","Ukrainians agree , with 45 % blaming Russia for the violence in eastern Ukraine"
mturk_charts/no_data/multi_col/10533.png,"Contrary to their attitudes about what their own country should do , widespread majorities of most NATO publics believe the U.S. would use military force to defend a fellow NATO country . Poles stand out as less certain that the U.S. would come to an ally ’s aid ( 49 % would , 31 % would not ) .",same,"How does the poles stand out in the belief that U.S. will come to an ally's defense?",answer1,"Poles stand out as less certain that the U.S. would come to an ally ’s aid ( 49 % would , 31 % would not ) .","Poles stand out as less certain that the U.S. would come to an ally ’s aid ( 49 % would , 31 % would not ) .","","","",""," ","NATO Countries Believe U.S. Will Come to Defense of Allies","Poles stand out as less certain that the U.S. would come to an ally ’s aid ( 49 % would , 31 % would not ) ."
mturk_charts/no_data/multi_col/10548.png,"The Pew Research Center survey , conducted May 12 - 18 among 2,002 adults , finds that partisans are as divided on this issue as ever : Today , 65 % of Democrats and an identical percentage of independents favor gay marriage ; only about one third ( 34 % ) of Republicans do so . Growing shares of all three groups support same - sex marriage , yet the differences between Democrats and Republicans are as wide today as they were a decade ago . However , with same - sex marriage legal in 36 states ( and the District of Columbia ) and the possibility of a Supreme Court decision on its nationwide status , Republicans ( 72 % ) are just as likely as Democrats ( 72 % ) and independents ( 74 % ) to say that it is “ inevitable ” that same - sex marriage will be legally recognized .",same,"What percentage of partisans favor gay marriage today?",answer1,"Today , 65 % of Democrats and an identical percentage of independents favor gay marriage ; only about one third ( 34 % ) of Republicans do so","Today , 65 % of Democrats and an identical percentage of independents favor gay marriage ; only about one third ( 34 % ) of Republicans do so","","","",""," ","Partisans Agree: Legal Recognition ‘Inevitable’","Today , 65 % of Democrats and an identical percentage of independents favor gay marriage ; only about one third ( 34 % ) of Republicans do so"
mturk_charts/no_data/multi_col/10556.png,"About half ( 51 % ) say immigrants today strengthen the country because of their hard work and talents , while 41 % say immigrants are a burden because they take jobs , housing and health care . The share saying that immigrants strengthen the country has declined six percentage points since last year .",same,"What are the partisans' views when it comes to immigration?",answer2,"About half ( 51 % ) say immigrants today strengthen the country because of their hard work and talents , while 41 % say immigrants are a burden because they take jobs , housing and health care .","About half ( 51 % ) say immigrants today strengthen the country because of their hard work and talents , while 41 % say immigrants are a burden because they take jobs , housing and health care .","","","",""," ","Wide Partisan Divide in Overall Views of Immigrants' Impact on the U.S. Which comes closer to your view? Immigrants today (%) Burden country Strengthen","About half ( 51 % ) say immigrants today strengthen the country because of their hard work and talents , while 41 % say immigrants are a burden because they take jobs , housing and health care ."
mturk_charts/no_data/multi_col/10552.png,"Partisans rate their parties . Most Republicans and Republican leaners ( 57 % ) say their party is not doing a good job of representing their views on same - sex marriage , and the party draws criticism from those on both sides of the issue .",same,"Are Republicans LGBTphobic?",answer2,"Most Republicans and Republican leaners ( 57 % ) say their party is not doing a good job of representing their views on same - sex marriage , and the party draws criticism from those on both sides of the issue .","Most Republicans and Republican leaners ( 57 % ) say their party is not doing a good job of representing their views on same - sex marriage , and the party draws criticism from those on both sides of the issue .","","","",""," ","Republicans Dissatisfied with Party’s Handling of Same-Sex Marriage","Most Republicans and Republican leaners ( 57 % ) say their party is not doing a good job of representing their views on same - sex marriage , and the party draws criticism from those on both sides of the issue ."
mturk_charts/no_data/multi_col/10564.png,"Democrats rate their party better than Republicans when it comes to representing their views on the issue of illegal immigration . About half ( 51 % ) of Democrats and Democratic leaners say their party is doing a good job representing their views . Just 34 % of Republicans and Republican leaners say this about the GOP . Overall , 83 % of Democrats and Democratic leaners support a path to legal status for undocumented immigrants . Among this group , 55 % say the party is doing a good job representing their views on this issue ; 38 % say it is not . Democrats who oppose a path to legal status ( 16 % of all Democrats and Democratic leaners ) are more critical of their party : Just 30 % say the party does a good job of reflecting their views , while 70 % say it does not . On the Republican side , both supporters and opponents of legal status for undocumented immigrants think the GOP is not doing a good job representing their views . Republicans and Republican leaners who oppose legal status are somewhat more negative about the party on this issue ( 65 % bad job vs. 30 % good job ) than those who support a pathway to legal status ( 55 % bad vs. 36 % good ) .",same,"How different are the partisans' views on immigration?",answer1,"About half ( 51 % ) of Democrats and Democratic leaners say their party is doing a good job representing their views . Just 34 % of Republicans and Republican leaners say this about the GOP . Overall , 83 % of Democrats and Democratic leaners support a path to legal status for undocumented immigrants Among this group , 55 % say the party is doing a good job representing their views on this issue ; 38 % say it is not . Democrats who oppose a path to legal status ( 16 % of all Democrats and Democratic leaners ) are more critical of their party : Just 30 % say the party does a good job of reflecting their views , while 70 % say it does not . On the Republican side , both supporters and opponents of legal status for undocumented immigrants think the GOP is not doing a good job representing their views .","About half ( 51 % ) of Democrats and Democratic leaners say their party is doing a good job representing their views . Just 34 % of Republicans and Republican leaners say this about the GOP . Overall , 83 % of Democrats and Democratic leaners support a path to legal status for undocumented immigrants Among this group , 55 % say the party is doing a good job representing their views on this issue ; 38 % say it is not . Democrats who oppose a path to legal status ( 16 % of all Democrats and Democratic leaners ) are more critical of their party : Just 30 % say the party does a good job of reflecting their views , while 70 % say it does not . On the Republican side , both supporters and opponents of legal status for undocumented immigrants think the GOP is not doing a good job representing their views .","","","",""," ","Democrats Rate Party Their Better on Illegal Immigration","About half ( 51 % ) of Democrats and Democratic leaners say their party is doing a good job representing their views . Just 34 % of Republicans and Republican leaners say this about the GOP . Overall , 83 % of Democrats and Democratic leaners support a path to legal status for undocumented immigrants Among this group , 55 % say the party is doing a good job representing their views on this issue ; 38 % say it is not . Democrats who oppose a path to legal status ( 16 % of all Democrats and Democratic leaners ) are more critical of their party : Just 30 % say the party does a good job of reflecting their views , while 70 % say it does not . On the Republican side , both supporters and opponents of legal status for undocumented immigrants think the GOP is not doing a good job representing their views ."
mturk_charts/no_data/multi_col/10565.png,"A new Pew Research Center survey finds that 76 % in France say they have a favorable view of Muslims living in their country , similar to the 72 % registered in 2014 . Meanwhile , the percentage with a very favorable opinion of Muslims has increased significantly , rising from 14 % last year to 25 % today . Attitudes toward Muslims tend to be more positive on the political left in France , but ratings improved across the ideological spectrum .",same,"What are the views on Muslims by the French?",answer2,"A new Pew Research Center survey finds that 76 % in France say they have a favorable view of Muslims living in their country , similar to the 72 % registered in 2014 . Meanwhile , the percentage with a very favorable opinion of Muslims has increased significantly , rising from 14 % last year to 25 % today .","A new Pew Research Center survey finds that 76 % in France say they have a favorable view of Muslims living in their country , similar to the 72 % registered in 2014 . Meanwhile , the percentage with a very favorable opinion of Muslims has increased significantly , rising from 14 % last year to 25 % today .","","","",""," ","French Views of Muslims, 2014-15","A new Pew Research Center survey finds that 76 % in France say they have a favorable view of Muslims living in their country , similar to the 72 % registered in 2014 . Meanwhile , the percentage with a very favorable opinion of Muslims has increased significantly , rising from 14 % last year to 25 % today ."
mturk_charts/no_data/multi_col/10569.png,"Of all U.S. advertising revenue , 28 % comes from digital ads . For most legacy news sectors , digital ad revenue represents a much smaller fraction of their total intake , despite years of experimentation . Just 4 % of local TV advertising revenue comes from digital , according to estimates from market research firm BIA / Kelsey , and this is not projected to grow much over the next five years . Newspapers see about 18 % of their total ad revenue from digital , according to BIA / Kelsey , and this does not at present make up for falling print revenue . Even for digital - native news organizations , high levels of digital revenue are no guarantee of profitability .",same,"Where does the most revenue come from of all U.S. advertising?",answer2,"Of all U.S. advertising revenue , 28 % comes from digital ads . For most legacy news sectors , digital ad revenue represents a much smaller fraction of their total intake , despite years of experimentation . Just 4 % of local TV advertising revenue comes from digital , according to estimates from market research firm BIA / Kelsey , and this is not projected to grow much over the next five years . Newspapers see about 18 % of their total ad revenue from digital , according to BIA / Kelsey , and this does not at present make up for falling print revenue . .","Of all U.S. advertising revenue , 28 % comes from digital ads . For most legacy news sectors , digital ad revenue represents a much smaller fraction of their total intake , despite years of experimentation . Just 4 % of local TV advertising revenue comes from digital , according to estimates from market research firm BIA / Kelsey , and this is not projected to grow much over the next five years . Newspapers see about 18 % of their total ad revenue from digital , according to BIA / Kelsey , and this does not at present make up for falling print revenue .","","","",""," ","Newspaper Ad Revenue from Digital and Print","Of all U.S. advertising revenue , 28 % comes from digital ads . For most legacy news sectors , digital ad revenue represents a much smaller fraction of their total intake , despite years of experimentation . Just 4 % of local TV advertising revenue comes from digital , according to estimates from market research firm BIA / Kelsey , and this is not projected to grow much over the next five years . Newspapers see about 18 % of their total ad revenue from digital , according to BIA / Kelsey , and this does not at present make up for falling print revenue . ."
mturk_charts/no_data/multi_col/10584.png,"A median of 78 % of Europeans have a favorable opinion of Jews . This includes majority approval in all six nations surveyed . The strongest support is in France ( 92 % ) , while the weakest is in Poland ( 59 % ) . A median of 61 % voice a favorable attitude toward Muslims . This includes at least half in four of the six countries . The most favorable view of Muslims is in France ( 76 % ) .",same,"What is the percentage size of Europeans positive opinion of Jews?",answer2,"A median of 78 % of Europeans have a favorable opinion of Jews . This includes majority approval in all six nations surveyed . The strongest support is in France ( 92 % ) , while the weakest is in Poland ( 59 % ) .","A median of 78 % of Europeans have a favorable opinion of Jews . This includes majority approval in all six nations surveyed . The strongest support is in France ( 92 % ) , while the weakest is in Poland ( 59 % ) .","","","",""," ","Europeans Have Favorable Opinion of Jews, Mixed on Roma","A median of 78 % of Europeans have a favorable opinion of Jews . This includes majority approval in all six nations surveyed . The strongest support is in France ( 92 % ) , while the weakest is in Poland ( 59 % ) ."
mturk_charts/no_data/multi_col/10593.png,"A majority of Americans ( 54 % ) disapprove of the U.S. government ’s collection of telephone and internet data as part of anti - terrorism efforts , while 42 % approve of the program . Democrats are divided on the program , while Republicans and independents are more likely to disapprove than approve , according to a survey we conducted in spring 2014 .",same,"What are the partisans' views on NSA Surveillance?",answer1,"Democrats are divided on the program , while Republicans and independents are more likely to disapprove than approve , according to a survey we conducted in spring 2014","Democrats are divided on the program , while Republicans and independents are more likely to disapprove than approve , according to a survey we conducted in spring 2014","","","",""," ","Americans' Views of NSA Surveillance","Democrats are divided on the program , while Republicans and independents are more likely to disapprove than approve , according to a survey we conducted in spring 2014"
